Comment ID,Link ID,Parent ID,Author,Score,Publish Date,Permalink,Text,Stickied,Is Submitter
fa2gzy5,t3_e7b7yb,t3_e7b7yb,2low-key,1,2019-12-07 23:13:00,/r/EDAnonymous/comments/e7b7yb/selfreflection_saturday_december_7_2019/fa2gzy5/,I ate with my boyfriend at a restaurant this week! I feel shitty and guilty about it right now but I know deep down it was a good step towards recovery.,False,False
fa24xcb,t3_e7b7yb,t3_e7b7yb,lazyobsessive,1,2019-12-07 22:04:41,/r/EDAnonymous/comments/e7b7yb/selfreflection_saturday_december_7_2019/fa24xcb/,I think my hunger is increasing because I just started a new antidepressant. I haven’t felt hungry in months and now I am afraid I will start gaining weight.,False,False
fa0bby4,t3_e7b7yb,t3_e7b7yb,absolute_boy,2,2019-12-07 14:54:54,/r/EDAnonymous/comments/e7b7yb/selfreflection_saturday_december_7_2019/fa0bby4/,Does anyone else hugely overestimate how much they can eat when buying binge food? I just ordered 2 pizzas and couldn't even finish one.,False,False
fa06rhw,t3_e7b7yb,t3_e7b7yb,fmdkdnxksk,3,2019-12-07 14:14:58,/r/EDAnonymous/comments/e7b7yb/selfreflection_saturday_december_7_2019/fa06rhw/,i weighed myself and it said 95.4 and i almost started crying but then i weighed myself again and it said 99.4 i am now crying again because i really don’t want to go to this christmas party i hate my life so much i feel like shit when i starve and i feel like shit when i eat,False,False
f9zxui6,t3_e7b7yb,t3_e7b7yb,cappuccinomore,1,2019-12-07 13:22:29,/r/EDAnonymous/comments/e7b7yb/selfreflection_saturday_december_7_2019/f9zxui6/,I had a dream that my mother found out about my disordered eating and didn’t care. That’s honestly one of my worst fears.,False,False
f9yy38n,t3_e7b7yb,t3_e7b7yb,elllxvi,1,2019-12-07 10:18:33,/r/EDAnonymous/comments/e7b7yb/selfreflection_saturday_december_7_2019/f9yy38n/,"i don’t want to binge anymore even if i eat enough i just end up binging and now that i stopped restricting im gaining weight and im fucking terrified,i want to make it stop i need to feel in control, i need to feel wanted",False,False
f9yv1hv,t3_e7b7yb,t3_e7b7yb,mustyday,1,2019-12-07 09:58:49,/r/EDAnonymous/comments/e7b7yb/selfreflection_saturday_december_7_2019/f9yv1hv/,"I’m struggling but I feel like I’m not struggling enough to be taken seriously. I don’t restrict heavily. on my “restriction” days I manage about 900 calories, usually 1300-1400 though. And then I binge. So it all averages out to maintenance.   I know I’m eating less than I should and I restrict and over exercise to compensate for binging which is literally a form of purging.   I feel like I’m losing my mind but I also don’t feel like I have an ed. My bmi is 22. I’m not even close to thin.   I just want to eat normally and not feel hungry 24/7 but I also want to be skinny and tiny and beautiful.   I’m nearly 26, I’m too old for this.",False,False
f9ykp0o,t3_e7b7yb,t3_e7b7yb,caalelle,1,2019-12-07 08:46:20,/r/EDAnonymous/comments/e7b7yb/selfreflection_saturday_december_7_2019/f9ykp0o/,"my best friend since childhood invited me to go to a christmas orchestra with her this evening. I haven't seen her in over a year so I'm really looking forward to it. I can't remember the last time I left my house so hopefully I can manage the social anxiety. people we went to school with are gonna be there so the possibility of a panic attack is really high. I just want to hide behind my huge grandpa sweater and make a fun memory with my best friend. I'm looking forward to enjoying live music and she said she's gonna bring me a fruit smoothie bc she's v supportive, honestly such a queen. I have to take tons of pictures. she makes me laugh and she's been by my side since the 4th grade. I hope today is a good day.",False,False
f9yipth,t3_e7b7yb,t1_f9x1ytz,oh-em-jizzles,1,2019-12-07 08:33:25,/r/EDAnonymous/comments/e7b7yb/selfreflection_saturday_december_7_2019/f9yipth/,"that sounds lovely, im glad you were able to be productive and that you're in a good mindset about it ! you and your body ARE ok !",False,False
f9yiipg,t3_e7b7yb,t1_f9yag6t,oh-em-jizzles,1,2019-12-07 08:32:10,/r/EDAnonymous/comments/e7b7yb/selfreflection_saturday_december_7_2019/f9yiipg/,"i know it's overwhelming but start small! make a goal to just take a shower, maybe grab a few clothes off the ground on the way there and back , move just a couple dishes to the kitchen. the small stuff adds up !",False,False
f9yag6t,t3_e7b7yb,t3_e7b7yb,Edith-Anne-Newton,1,2019-12-07 07:38:32,/r/EDAnonymous/comments/e7b7yb/selfreflection_saturday_december_7_2019/f9yag6t/,Feel like I'm never gonna be a self sufficent adult with independence. I can barely open my bathroom door with how much dirty clothes are everywhere.. Cant find anything I need. Dirty dishes everywhere. My closet is a mess. My dresser is a mess. All my devices are a mess. Havent even cut my nails bc it always hurts and that sounds exhausting to deal with for some reason. I need a haircut. I need a shower. I need clean clothes. cant get myself to do anything that takes more than clicking and thinking. Lay in bed all day and stink up the mattress...,False,False
f9y58d0,t3_e7b7yb,t3_e7b7yb,0463517228539110,1,2019-12-07 06:59:44,/r/EDAnonymous/comments/e7b7yb/selfreflection_saturday_december_7_2019/f9y58d0/,TW numbers  Binged last night &amp; am up 3lbs today. Kill me.,False,False
f9y3nra,t3_e7b7yb,t3_e7b7yb,serendipi7y_,1,2019-12-07 06:47:34,/r/EDAnonymous/comments/e7b7yb/selfreflection_saturday_december_7_2019/f9y3nra/,"I am tired of this. My brain goes into binge mode and i go out of self control and eat everything i see. I just want this to end asap and feel i am in control of what i eat. No more binge. No more obsession with junk food. Just a healthy and normal relationship with my body, what i eat, and self acceptance.",False,False
f9xtoc9,t3_e7b7yb,t1_f9xs4dt,hammerprice,1,2019-12-07 05:27:50,/r/EDAnonymous/comments/e7b7yb/selfreflection_saturday_december_7_2019/f9xtoc9/,"If you want it, you can do it. xx",False,False
f9xs4dt,t3_e7b7yb,t3_e7b7yb,littlesunbabe,1,2019-12-07 05:15:36,/r/EDAnonymous/comments/e7b7yb/selfreflection_saturday_december_7_2019/f9xs4dt/,"I came to the realization that this disorder is no way to live and that I can not go on this way forever. All though my attempts at recovery have failed thus far, I will continue to try. I want to recover. I want more.",False,False
f9xruz1,t3_e7b7yb,t3_e7b7yb,hammerprice,1,2019-12-07 05:13:40,/r/EDAnonymous/comments/e7b7yb/selfreflection_saturday_december_7_2019/f9xruz1/,"I had a really good week and was really successful in a lot of things. I've had more success at work recently even if it's hard and stressful in its own ways and I had an amazing time out with some friends.  I think this time last week I said I wanted to make it another week without binging...? I didn't quite manage that, BUT I *did* manage to stop a single binge from turning into a binge cycle/spiral, which I'm really proud of and a little stunned by.  I'm gonna set a few plans into motion this upcoming week and tend them so they come to fruition!!! I *will!!!*",False,False
f9xrgpr,t3_e7b7yb,t1_f9x7kom,hammerprice,1,2019-12-07 05:10:20,/r/EDAnonymous/comments/e7b7yb/selfreflection_saturday_december_7_2019/f9xrgpr/,GOOD LUCK!! I hope the sugar worked its dang magic,False,False
f9xresy,t3_e7b7yb,t1_f9x1ytz,hammerprice,1,2019-12-07 05:09:53,/r/EDAnonymous/comments/e7b7yb/selfreflection_saturday_december_7_2019/f9xresy/,That sounds so lovely! You're going to be more than okay because these memories will stay with you longer than any food ♥,False,False
f9x7kom,t3_e7b7yb,t3_e7b7yb,paraphrasis,1,2019-12-07 02:09:06,/r/EDAnonymous/comments/e7b7yb/selfreflection_saturday_december_7_2019/f9x7kom/,"I turned in my master thesis this week. I let myself relax for a couple of days. By next saturday I hope I will have passed my thesis defence, because I am so nervous I think I might die. I also let myself eat maintenance calories on monday, to get some sugar to my brain.",False,False
f9x1ytz,t3_e7b7yb,t3_e7b7yb,tea-addicted-taemint,1,2019-12-07 01:19:46,/r/EDAnonymous/comments/e7b7yb/selfreflection_saturday_december_7_2019/f9x1ytz/,"I went out to eat twice today, and probably went over my TDEE. But I had a good time with my family and my friend, used my creative energy productively, and enjoyed myself. I might feel guilty but I hope that feeling will pass. Me and my body will be ok.",False,False
