Comment ID,Link ID,Parent ID,Author,Score,Publish Date,Permalink,Text,Stickied,Is Submitter
fgi6253,t3_dhndum,t3_dhndum,happy_fart_man,1,2020-02-04 03:09:43,/r/EDAnonymous/comments/dhndum/my_boyfriend_just_made_me_a_fear_food_meal_in_a/fgi6253/,Baby sandwich! And It's the baby steps that really matter. I feel like victories almost should feel weird because you're not used to having them. Good for you!!,False,False
f3wqood,t3_dhndum,t3_dhndum,brandhoes,1,2019-10-16 03:49:53,/r/EDAnonymous/comments/dhndum/my_boyfriend_just_made_me_a_fear_food_meal_in_a/f3wqood/,i wish my potential s/o would do that with me ;;;;; you sound like such a sweet couple!,False,False
f3uj6uv,t3_dhndum,t1_f3s2ikg,attenuatingpixie333,1,2019-10-15 12:45:28,/r/EDAnonymous/comments/dhndum/my_boyfriend_just_made_me_a_fear_food_meal_in_a/f3uj6uv/,"Oh no :( I understand the feeling of being with a guy who is not supportive and whose family is even worse. It wasn't specifically ED related, but was mental illness related. It is bad enough when the SO's family isn't kind to you, but even worse when the things they pick at are your biggest struggles and insecurities. My heart breaks for your daughter that she had to experience that.   I hope she's doing better now and that the next person she is with treats her right, instead of cutting her down like that!",False,True
f3uikhm,t3_dhndum,t1_f3ru2rg,attenuatingpixie333,1,2019-10-15 12:39:26,/r/EDAnonymous/comments/dhndum/my_boyfriend_just_made_me_a_fear_food_meal_in_a/f3uikhm/,"If you aren't ready to share that with him, then you don't need to feel obligated to yet. But if you feel you want to work on recovery at least a little bit, and want to let someone in, it can be pretty great.   After fully explaining it to my boy, it sort of put a lot into light for him, I think. It gave him the chance to be able to see that I'm deeply struggling with this stuff, and that my heavy restriction and then binging isn't just because I'm trying some crash diet and then getting too hungry and overeating.   I explained the compulsions and the anxieties about all the aspects of my ED and how it was the same as depression and anxiety: you know what you need to do to be healthy, but you can't just make your brain see it that way and turn it all off.   I think driving home the idea that it isn't just some attempt at a crash diet or something really helped things click into place for him. I think before that, he thought I was just stuck in a ""try to diet hard, get too hungry, start binging"" loop, rather than the reality: ""eat less and less or you're a failure, have one inconvenience, eat everything in sight for days because you suck anyway so why not""   (Disclaimer: that's the internal ED gremlin voice, not me saying that.)",False,True
f3uhrc7,t3_dhndum,t1_f3pqoup,attenuatingpixie333,1,2019-10-15 12:30:56,/r/EDAnonymous/comments/dhndum/my_boyfriend_just_made_me_a_fear_food_meal_in_a/f3uhrc7/,Oh that is so sweet! Mine does that too but that's because he hates the texture of fat so he automatically just gets rid of it whenever he cooks it for me or him 😂,False,True
f3uhn9z,t3_dhndum,t1_f3pp2uc,attenuatingpixie333,1,2019-10-15 12:29:45,/r/EDAnonymous/comments/dhndum/my_boyfriend_just_made_me_a_fear_food_meal_in_a/f3uhn9z/,"He definitely tries, and sometimes his attempts aren't the best. But hey, neither are mine. He is trying to understand and help me, and sometimes he comes off a little less supportive; I am trying to be healthy, and sometimes I find myself exaggerating how much I ate in a day so that he doesn't push the issue.   It is trial and error for sure, but baby steps are so important and it's the little big things like this that are so great to hold onto.",False,True
f3taqdp,t3_dhndum,t3_dhndum,chicathescrounger,1,2019-10-15 02:42:41,/r/EDAnonymous/comments/dhndum/my_boyfriend_just_made_me_a_fear_food_meal_in_a/f3taqdp/,Aww!,False,False
f3t53h9,t3_dhndum,t1_f3szzaj,BroItsJesus,1,2019-10-15 00:51:58,/r/EDAnonymous/comments/dhndum/my_boyfriend_just_made_me_a_fear_food_meal_in_a/f3t53h9/,"Because when I found out a few years ago, I was in a public place, and I had a panic attack. It really wasn't made any better by the people all around me. If I could've found out on my phone, likely in the privacy of my own home, I'd have dealt a lot better with it, and been able to save myself for embarrassment.  I'd recommend you refrain from jumping to conclusions like that in the future.",False,False
f3szzaj,t3_dhndum,t1_f3rbwr2,alfred_schlieffen,1,2019-10-14 23:29:58,/r/EDAnonymous/comments/dhndum/my_boyfriend_just_made_me_a_fear_food_meal_in_a/f3szzaj/,"can I ask why? OP came here to share a sweet story about her SO helping her find a way to eat *something* after two days of fasting. why would you want to ruin that for her? especially when the calories in “0 cal” cooking spray are negligible, especially compared to butter. would it be better if she just ate nothing at all? I really feel like this comment is lacking in tact and just basic kindness tbh.",False,False
f3szf1u,t3_dhndum,t1_f3qup7i,JohnLongSilvers,1,2019-10-14 23:21:45,/r/EDAnonymous/comments/dhndum/my_boyfriend_just_made_me_a_fear_food_meal_in_a/f3szf1u/,"Yes but someone helping you eat something when you might have otherwise continued to fast is a win, no matter how small that something may be.",False,False
f3s3dq2,t3_dhndum,t3_dhndum,discohaylie,1,2019-10-14 18:38:37,/r/EDAnonymous/comments/dhndum/my_boyfriend_just_made_me_a_fear_food_meal_in_a/f3s3dq2/,This is so sweet. You are lucky to have a good person on your team.,False,False
f3s30y7,t3_dhndum,t3_dhndum,caj065,1,2019-10-14 18:35:56,/r/EDAnonymous/comments/dhndum/my_boyfriend_just_made_me_a_fear_food_meal_in_a/f3s30y7/,wow i could only dream of having someone that understanding. hes a keeper,False,False
f3s2ikg,t3_dhndum,t3_dhndum,JetPatriot,1,2019-10-14 18:31:51,/r/EDAnonymous/comments/dhndum/my_boyfriend_just_made_me_a_fear_food_meal_in_a/f3s2ikg/," This.  My daughter suffers from bulimia.  When she was dating a guy she really loved and was talking about a future with, she told him the truth.  That sometimes she binges and purges.  He said. ""That is disgusting.""  He told his family and every time she went near the bathroom, his sister said, ""So are you going to throw up now?""  Thankfully she is rid of that family now.  So glad to hear your boyfriend is supportive.",False,False
f3s1vi4,t3_dhndum,t3_dhndum,Tylly,2,2019-10-14 18:26:38,/r/EDAnonymous/comments/dhndum/my_boyfriend_just_made_me_a_fear_food_meal_in_a/f3s1vi4/,This is king behavior,False,False
f3s02vj,t3_dhndum,t3_dhndum,_fidgetspinner,2,2019-10-14 18:12:31,/r/EDAnonymous/comments/dhndum/my_boyfriend_just_made_me_a_fear_food_meal_in_a/f3s02vj/,wow that is so sweet &lt;3,False,False
f3rxf9d,t3_dhndum,t1_f3plz4l,attenuatingpixie333,2,2019-10-14 17:51:52,/r/EDAnonymous/comments/dhndum/my_boyfriend_just_made_me_a_fear_food_meal_in_a/f3rxf9d/,"It has been a tough road, figuring out how to best understand each other and our different issues, but things like this just show me how far we have both come. I am definitely absolutely thankful I have someone who cares enough to put in this kind of effort even when he isn't really sure he understands.   I absolutely ate the hell out of that soup and sandwich... and didn't even feel anxious afterwards!",False,True
f3rws87,t3_dhndum,t3_dhndum,ddmar,2,2019-10-14 17:46:49,/r/EDAnonymous/comments/dhndum/my_boyfriend_just_made_me_a_fear_food_meal_in_a/f3rws87/,This is the cutest shit I've read all day,False,False
f3ru2rg,t3_dhndum,t1_f3qh4o5,oywiththedoodles,1,2019-10-14 17:24:36,/r/EDAnonymous/comments/dhndum/my_boyfriend_just_made_me_a_fear_food_meal_in_a/f3ru2rg/,I’m not sure how to share this with my partner- they don’t know I’m on ED things really. I barely have a diagnosis. But your post gives me hope that things can change and grow and be better.,False,False
f3rrmmq,t3_dhndum,t3_dhndum,yamiryukia330,1,2019-10-14 17:09:13,/r/EDAnonymous/comments/dhndum/my_boyfriend_just_made_me_a_fear_food_meal_in_a/f3rrmmq/,that sounds so sweet. he's trying to help even if it may not be super obvious to others,False,False
f3rqkra,t3_dhndum,t3_dhndum,muathrowaway0,1,2019-10-14 17:03:59,/r/EDAnonymous/comments/dhndum/my_boyfriend_just_made_me_a_fear_food_meal_in_a/f3rqkra/,This is the cutest thing ever ;\_;  &amp;#x200B;  keep him,False,False
f3rqjoj,t3_dhndum,t3_dhndum,certifiedsnax,1,2019-10-14 17:03:46,/r/EDAnonymous/comments/dhndum/my_boyfriend_just_made_me_a_fear_food_meal_in_a/f3rqjoj/,that’s so wholesome your boyfriend cares about you so much im gonna cry,False,False
f3rgr9q,t3_dhndum,t3_dhndum,ri-ri,2,2019-10-14 16:19:30,/r/EDAnonymous/comments/dhndum/my_boyfriend_just_made_me_a_fear_food_meal_in_a/f3rgr9q/,GOD dam. What a nice boyfriend. Keeper!,False,False
f3rcrsj,t3_dhndum,t1_f3rbwr2,attenuatingpixie333,2,2019-10-14 15:59:26,/r/EDAnonymous/comments/dhndum/my_boyfriend_just_made_me_a_fear_food_meal_in_a/f3rcrsj/,"I think pretty much everyone on here knows that. Same with diet soda, powerade 0, and Bang energy drinks. None of those are truly 0 calories. Definitely way safer having 5 or so calories than the hundred in butter.",False,True
f3rbwr2,t3_dhndum,t3_dhndum,BroItsJesus,2,2019-10-14 15:55:40,/r/EDAnonymous/comments/dhndum/my_boyfriend_just_made_me_a_fear_food_meal_in_a/f3rbwr2/,I love that he was supportive but I'm gonna shit on you a bit (sorry). It's not 0 cal spray. It's just oil with a serving size so small they round down :(,False,False
f3qxxej,t3_dhndum,t1_f3qwzg1,suedpol_2015,1,2019-10-14 14:46:40,/r/EDAnonymous/comments/dhndum/my_boyfriend_just_made_me_a_fear_food_meal_in_a/f3qxxej/,"I don't know anything about you don't know anything about me, so no reason to be so upset. I wish you all the best in your recovery.",False,False
f3qwzg1,t3_dhndum,t1_f3quctw,attenuatingpixie333,1,2019-10-14 14:42:14,/r/EDAnonymous/comments/dhndum/my_boyfriend_just_made_me_a_fear_food_meal_in_a/f3qwzg1/,"&gt; a matter of concern and a clear sign of illness.   Yes. An illness called an eating disorder. You are on an eating disorder sub.   Idk what you are doing lurking around in an ED sub and making weird assumptions and accusations, but this isn't the place. Everyone here struggles with umhealthy eating behaviors. Many of us have friends, family, or significant others who know about it and help us through it. Such as someone who struggles with any mental illness. Depression, anxiety, PTSD, what have you. A loved one creating a safe space and helping us to work through our anxieties and issues is not codependency, it is bring supportive even when you don't understand something.",False,True
f3qup7i,t3_dhndum,t1_f3qcgm4,suedpol_2015,1,2019-10-14 14:24:51,/r/EDAnonymous/comments/dhndum/my_boyfriend_just_made_me_a_fear_food_meal_in_a/f3qup7i/,"I agree. This is why I didn't write ""this IS a sign of codependency"", but ""this could be a sign of codependency"". I don't know whether it is a sign of codependency in this case as we are lacking context. Importantly, however, 1 soup in 2 days is alarmingly low.",False,False
f3quctw,t3_dhndum,t1_f3qgsi9,suedpol_2015,1,2019-10-14 14:22:07,/r/EDAnonymous/comments/dhndum/my_boyfriend_just_made_me_a_fear_food_meal_in_a/f3quctw/,"If you have not eaten for 2 days and the only thing you eat then is "" a grilled cheese and some soup "" with "" 0 cal cooking spray instead of butter"" this is so much under any reasonable amount of calories that it is a matter of concern and a clear sign of illness. It is very hard to tell then whether it is more appropriate to play by the rules dictated by this illness or to (try to) oppose against it. Playing by these rules is then not only a sign of love but also of an overwhelming situation (for both parties) (same is true for not playing by the rules then, btw.",False,False
f3qne2m,t3_dhndum,t3_dhndum,MissMagus,1,2019-10-14 13:27:05,/r/EDAnonymous/comments/dhndum/my_boyfriend_just_made_me_a_fear_food_meal_in_a/f3qne2m/,my boyfriend does stuff like this too.  It makes recovering so much easier.,False,False
f3qle3e,t3_dhndum,t3_dhndum,FreakingJinkiesDude,1,2019-10-14 13:10:42,/r/EDAnonymous/comments/dhndum/my_boyfriend_just_made_me_a_fear_food_meal_in_a/f3qle3e/,"I love this! He really seems to care about you while keeping in mind what you are and aren’t comfortable with at this point. This is so sweet, I’m really happy for you ❤️",False,False
f3qjxup,t3_dhndum,t3_dhndum,randomjee,1,2019-10-14 12:59:16,/r/EDAnonymous/comments/dhndum/my_boyfriend_just_made_me_a_fear_food_meal_in_a/f3qjxup/,That made my heart melt like cheese.,False,False
f3qh4o5,t3_dhndum,t1_f3q0ek7,attenuatingpixie333,1,2019-10-14 12:36:54,/r/EDAnonymous/comments/dhndum/my_boyfriend_just_made_me_a_fear_food_meal_in_a/f3qh4o5/,"He's not always been like this, either. He has always tried to be supportive, but it took a few different tries with talking to him about my ED before he started to get a grasp on how the best ways to be supportive and helpful are.   It just gives me hope for the others on here who have people in their lives who can't figure out the best way to be supportive. They might still figure it out. :)",False,True
f3qgsi9,t3_dhndum,t1_f3q3men,attenuatingpixie333,1,2019-10-14 12:34:25,/r/EDAnonymous/comments/dhndum/my_boyfriend_just_made_me_a_fear_food_meal_in_a/f3qgsi9/,"Yes. Showing your SO support in a healthy and non intrusive way is absolutely codependency, you are so correct. Good job.   /s",False,True
f3qe7jj,t3_dhndum,t1_f3q3men,LowCalPal,1,2019-10-14 12:17:03,/r/EDAnonymous/comments/dhndum/my_boyfriend_just_made_me_a_fear_food_meal_in_a/f3qe7jj/,That seems like a pretty big leap.,False,False
f3qcgm4,t3_dhndum,t1_f3q3men,angilnibreathnach,1,2019-10-14 12:05:40,/r/EDAnonymous/comments/dhndum/my_boyfriend_just_made_me_a_fear_food_meal_in_a/f3qcgm4/,I disagree. I don’t think there is nearly enough information to make a suggestion like that.,False,False
f3q432r,t3_dhndum,t3_dhndum,High_as_red,1,2019-10-14 11:09:07,/r/EDAnonymous/comments/dhndum/my_boyfriend_just_made_me_a_fear_food_meal_in_a/f3q432r/,Adoreable fuck,False,False
f3q3men,t3_dhndum,t3_dhndum,suedpol_2015,1,2019-10-14 11:05:56,/r/EDAnonymous/comments/dhndum/my_boyfriend_just_made_me_a_fear_food_meal_in_a/f3q3men/,In my view this could be a sign of codependency ( [https://www.eatingdisorderhope.com/blog/codependent-spouses-treatment](https://www.eatingdisorderhope.com/blog/codependent-spouses-treatment) ).,False,False
f3q0ek7,t3_dhndum,t3_dhndum,oywiththedoodles,1,2019-10-14 10:42:25,/r/EDAnonymous/comments/dhndum/my_boyfriend_just_made_me_a_fear_food_meal_in_a/f3q0ek7/,"How sweet and caring and thoughtful. So often we have people pushing us and obviously not understanding what’s going on, that it’s beautiful to read that someone being so so considerate in a helpful way.",False,False
f3pxg1h,t3_dhndum,t3_dhndum,robotsintrees,1,2019-10-14 10:20:59,/r/EDAnonymous/comments/dhndum/my_boyfriend_just_made_me_a_fear_food_meal_in_a/f3pxg1h/,"This is beautiful. I recently had to be brutally honest with my husband about how bad things have gotten, and he's shown nothong but continued love and compassion; fuck, he lifted me off a toilet seat the other day. Keep this guy 👍",False,False
f3pqoup,t3_dhndum,t3_dhndum,j01ene,1,2019-10-14 09:31:35,/r/EDAnonymous/comments/dhndum/my_boyfriend_just_made_me_a_fear_food_meal_in_a/f3pqoup/,My boyfriend cuts off the fat from meat for me.. I know how it feels...,False,False
f3pp2uc,t3_dhndum,t3_dhndum,Panda_Melody,1,2019-10-14 09:19:03,/r/EDAnonymous/comments/dhndum/my_boyfriend_just_made_me_a_fear_food_meal_in_a/f3pp2uc/,It’s so nice to hear about supportive spouses on here! All too often people are being very mistreated.   You are so lucky and your bf sounds amazing!   You’re doing you’re best and that’s all anyone can ask! ❤️,False,False
f3plz4l,t3_dhndum,t3_dhndum,SidAndFinancy,1,2019-10-14 08:55:49,/r/EDAnonymous/comments/dhndum/my_boyfriend_just_made_me_a_fear_food_meal_in_a/f3plz4l/,"That man is kind, considerate, and he obviously cares for you deeply. Trust me, that is rare. You have yourself a good one. I hope you ate the hell out of your soup and sandwich!",False,False
f3pigsl,t3_dhndum,t3_dhndum,andiaaa,1,2019-10-14 08:28:22,/r/EDAnonymous/comments/dhndum/my_boyfriend_just_made_me_a_fear_food_meal_in_a/f3pigsl/,"damn, that's so cute(:",False,False
f3pi3vg,t3_dhndum,t3_dhndum,sstephenn,1,2019-10-14 08:25:28,/r/EDAnonymous/comments/dhndum/my_boyfriend_just_made_me_a_fear_food_meal_in_a/f3pi3vg/,so cute,False,False
f3phnt2,t3_dhndum,t3_dhndum,Little-Rexy,1,2019-10-14 08:21:54,/r/EDAnonymous/comments/dhndum/my_boyfriend_just_made_me_a_fear_food_meal_in_a/f3phnt2/,"He sounds fantastic! The best part is, you are both working together for your recovery- Hugs!",False,False
f3pbql9,t3_dhndum,t3_dhndum,lacroixbitch23,1,2019-10-14 06:51:11,/r/EDAnonymous/comments/dhndum/my_boyfriend_just_made_me_a_fear_food_meal_in_a/f3pbql9/,That’s so sweet of him. I love.,False,False
f3p6lf1,t3_dhndum,t3_dhndum,rachihc,1,2019-10-14 04:49:22,/r/EDAnonymous/comments/dhndum/my_boyfriend_just_made_me_a_fear_food_meal_in_a/f3p6lf1/,He sounds like a sweetheart. This is so lovely.,False,False
f3p3eyw,t3_dhndum,t3_dhndum,allychaan,1,2019-10-14 03:20:50,/r/EDAnonymous/comments/dhndum/my_boyfriend_just_made_me_a_fear_food_meal_in_a/f3p3eyw/,"Aaww this warms my heart so much, I feel like its the oerfect compromise for the both of you, but regardles he's showing you that he understands how you feel but still wants to help. That's suoer adorable",False,False
