Comment ID,Link ID,Parent ID,Author,Score,Publish Date,Permalink,Text,Stickied,Is Submitter
f3opacx,t3_dhg5ix,t3_dhg5ix,shortchair,1,2019-10-13 22:37:12,/r/EDAnonymous/comments/dhg5ix/i_cant_wait_until_im_dying_and_everyone_is/f3opacx/,"In my experience, people who act like they don't give a shit about you aren't gonna magically change even if you kill yourself trying to change them.  We are only hurting ourselves in the end.",False,False
f3ntdti,t3_dhg5ix,t3_dhg5ix,_fidgetspinner,1,2019-10-13 16:28:59,/r/EDAnonymous/comments/dhg5ix/i_cant_wait_until_im_dying_and_everyone_is/f3ntdti/,i understand. i have the same mindset. i want to show people how much pain i'm feeling on the inside by making myself look sick on the outside.,False,False
f3nqbi6,t3_dhg5ix,t1_f3noaxh,ProblematicText,1,2019-10-13 16:10:45,/r/EDAnonymous/comments/dhg5ix/i_cant_wait_until_im_dying_and_everyone_is/f3nqbi6/,I’m sorry :(  Do you see a therapist/talk to them about it? I’ve found that can be really helpful for giving me some strategies/skills for coping with having said person in my life (when they were) and not be able to be so affected by their toxicity,False,False
f3noaxh,t3_dhg5ix,t1_f3nnkk2,bonnginn,1,2019-10-13 15:58:43,/r/EDAnonymous/comments/dhg5ix/i_cant_wait_until_im_dying_and_everyone_is/f3noaxh/,I wish cutting them out of my life were an option. :/,False,True
f3nnkk2,t3_dhg5ix,t1_f3nmttd,ProblematicText,3,2019-10-13 15:54:20,/r/EDAnonymous/comments/dhg5ix/i_cant_wait_until_im_dying_and_everyone_is/f3nnkk2/,"Don’t get me wrong, it hasn’t been a clean easy process, and involved me cutting ties with the person/people who made me feel that way + therapy and a lot of self development.   I know it’s easier said than done tho. But it can be done.",False,False
f3nmttd,t3_dhg5ix,t1_f3nmgwg,bonnginn,2,2019-10-13 15:49:45,/r/EDAnonymous/comments/dhg5ix/i_cant_wait_until_im_dying_and_everyone_is/f3nmttd/,I’m glad youre speaking past tense and worked through these feelings successfully. I hope I can too.,False,True
f3nmgwg,t3_dhg5ix,t3_dhg5ix,ProblematicText,4,2019-10-13 15:47:42,/r/EDAnonymous/comments/dhg5ix/i_cant_wait_until_im_dying_and_everyone_is/f3nmgwg/,I have felt like this before.  Pls stay safe &lt;3,False,False
