Comment ID,Link ID,Parent ID,Author,Score,Publish Date,Permalink,Text,Stickied,Is Submitter
eva4yld,t3_bx62z1,t3_bx62z1,Cheezpuff1995,1,2019-07-28 13:36:01,/r/EDAnonymous/comments/bx62z1/sometimes_i_feel_like_recovery_social_media/eva4yld/,"If I remember correctly, in one of her videos, she states that she gets a lot shit for how she looks now compared to when she was skinnier.   She said that nobody would question her when she was thinner and assumed she was healthy and happy, but they started questioning her health as soon she gained the thick thighs.",False,False
eqccf2l,t3_bx62z1,t3_bx62z1,throwaway199502,1,2019-06-07 22:58:36,/r/EDAnonymous/comments/bx62z1/sometimes_i_feel_like_recovery_social_media/eqccf2l/,"Omg yes, this is spot on. I don’t have a curvy body so when I gain it’s not like I get the “Instagram ass” which is exactly what’s trendy right now, so there’s really no point for me lol",False,False
eq6hv42,t3_bx62z1,t3_bx62z1,strangebadgerbabe,1,2019-06-06 08:57:08,/r/EDAnonymous/comments/bx62z1/sometimes_i_feel_like_recovery_social_media/eq6hv42/,"Oh gosh, I thought I was the only one that saw this. They’re swapping the disorder for “fitness”, but it’s still just as obsessive and time consuming.",False,False
eq5xzn9,t3_bx62z1,t1_eq47051,ifuckpineapples,1,2019-06-06 05:34:14,/r/EDAnonymous/comments/bx62z1/sometimes_i_feel_like_recovery_social_media/eq5xzn9/,you're so right,False,False
eq5m3ug,t3_bx62z1,t1_eq44thd,IkarosFalling,1,2019-06-06 02:26:43,/r/EDAnonymous/comments/bx62z1/sometimes_i_feel_like_recovery_social_media/eq5m3ug/,"Idk if I can word this without sounding like a cunt... But I feel like there is some merit to their recovery and their way of expressing it. I have the current ""Instagram shape"" ie, flat stomach, C cup size but not like folded over?,small waist with wide hips, big thighs but somehow a thigh gal, big butt, skinny shoulders with collar bones... I fucking hate it. In fact I think the trend for liking it is disgusting. It grosses me out that all these girls are out these injecting gross shit into their thighs and asses to fake the thing that has haunted and tortured me since puberty. I just want small thighs and upper arms, but no, I lose all my weight from my waist but (and probably because it's easy) I don't give a shit! I only focus on my blubbery thighs and dream about how a waist can be sinched but not my legs.....    Blah blah... Long story short they could equally have hated their natural curves and I think it takes a lot of mental health repair and recovery to see the ass as an asset ;p, or in general to go from wanting and chasing sticc to loving the thicc they have. I'm not there and I can't even stand the trend, let alone the ""perfect"" features I naturally have. I only consider the ones I don't perfect. And there in lies the disease.",False,False
eq5j37h,t3_bx62z1,t3_bx62z1,fat-tangerine,1,2019-06-06 01:34:32,/r/EDAnonymous/comments/bx62z1/sometimes_i_feel_like_recovery_social_media/eq5j37h/,"I got to a point where I lost 45% of my body weight in two months with anorexia and an extreme exercise addiction. I was praised, then I got burned out and decided to try to eat better and work out normally. Ultimately I gained weight back into a healthier range with muscle (but a little chubby over it all because cortisol) and everyone was telling me how dissapointed they were that I gained weight. Straight up told me that they were dissapointed in me. Anyways, this was a personal lesson that just proved to me that there is no 'recovered' unless still thin and pretty. It's so disheartening.",False,False
eq4tt67,t3_bx62z1,t1_eq4sep5,jellyboness,1,2019-06-05 20:48:29,/r/EDAnonymous/comments/bx62z1/sometimes_i_feel_like_recovery_social_media/eq4tt67/,"Same, I wish I could recover mentally and not gain weight lol",False,False
eq4sep5,t3_bx62z1,t1_eq4rq0f,makeitfancee,1,2019-06-05 20:30:44,/r/EDAnonymous/comments/bx62z1/sometimes_i_feel_like_recovery_social_media/eq4sep5/,"&gt; Regardless I feel like such a loser when I see people “in recovery” who are still much thinner than I am, when I’m trying desperately to restrict.   This is how I felt when I tried to ""recover"" the second time around.",False,False
eq4rq0f,t3_bx62z1,t3_bx62z1,jellyboness,1,2019-06-05 20:21:45,/r/EDAnonymous/comments/bx62z1/sometimes_i_feel_like_recovery_social_media/eq4rq0f/,"When your BMI is 12 and you bring it up to 16, I think that’s “good enough” for people to get off your back, and you can act like you’re cured.   Regardless I feel like such a loser when I see people “in recovery” who are still much thinner than I am, when I’m trying desperately to restrict.",False,False
eq4ln0u,t3_bx62z1,t3_bx62z1,Shorse_rider,1,2019-06-05 19:06:56,/r/EDAnonymous/comments/bx62z1/sometimes_i_feel_like_recovery_social_media/eq4ln0u/,"Those people are still absolutely obsessed with food and control, and measuring, and 'cheat days' and it's just not recovery in my opinion. Recovery is when food has it's place. You eat, you move on. But you don't put it on this massive pedestal or document every single morsel. I see recovery as seeing food as neutral with peaks of pleasure (social events etc). And when the food is pleasurable it's punctuating another happy experience - it doesn't make up the entire experience. For example your birthday should not be ALL ABOUT the CAKE..or some day that we look forward to because it's an excuse to binge or 'cheat'.",False,False
eq4jll2,t3_bx62z1,t1_eq4iwaa,CannonEyes,1,2019-06-05 18:45:14,/r/EDAnonymous/comments/bx62z1/sometimes_i_feel_like_recovery_social_media/eq4jll2/,Just a different perspective :),False,False
eq4iwaa,t3_bx62z1,t1_eq4gllq,throwawayW861443,1,2019-06-05 18:37:52,/r/EDAnonymous/comments/bx62z1/sometimes_i_feel_like_recovery_social_media/eq4iwaa/,"This is also very, every fucking true",False,True
eq4gllq,t3_bx62z1,t3_bx62z1,CannonEyes,1,2019-06-05 18:13:43,/r/EDAnonymous/comments/bx62z1/sometimes_i_feel_like_recovery_social_media/eq4gllq/,"I see what you mean, but I think a lot of us have been in a place where we had a socially acceptable body but still saw ourselves as huge, disgusting, etc due to an eating disorder leading to unhealthy weight-loss to get to our ""goal weight."" Recovery obviously involves weight gain. Often we will get back to our previous body that we thought was horrible. And if recovery allows you to love that body you previously hated, I think that is a win. Because an eating disorder is not about what society views as desirable, it's physiological and distorts your own views.",False,False
eq4g778,t3_bx62z1,t1_eq4fwtz,ci-fre,1,2019-06-05 18:09:30,/r/EDAnonymous/comments/bx62z1/sometimes_i_feel_like_recovery_social_media/eq4g778/,"Me too. I feel like she shouldn't need to mention body positivity as much as she does. It kind of feels like... asking for positive comments, if that makes sense.",False,False
eq4fwtz,t3_bx62z1,t1_eq4em9s,throwawayW861443,1,2019-06-05 18:06:28,/r/EDAnonymous/comments/bx62z1/sometimes_i_feel_like_recovery_social_media/eq4fwtz/,Oh I have no doubt that she probably DOES feel insecure. She’s beautiful!!! I just wish it wasn’t some weird virtu signaling type thing? Idk,False,True
eq4em9s,t3_bx62z1,t1_eq4bz04,ci-fre,1,2019-06-05 17:53:23,/r/EDAnonymous/comments/bx62z1/sometimes_i_feel_like_recovery_social_media/eq4em9s/,"In the context of jenBretty I sort of see what you mean about ""looking hot."" I mean, a lot of her Instagram pics have angles with her butt in front of the camera. There's nothing inherently wrong with this, but since she had an ED I feel she might still be struggling with body image issues, and she wants commenters to say she's hot. Also, her photos aren't all super related to recovery, but she still mentions it in the tags. For example in a recent post, although she's not really in a pose that highlights her butt:  &gt;Kiss whoever the fuck you want 🏳️‍🌈 #myfavshirttoweartofamilydinners #happypridemonth #happybeingme  #thickthighssavelives #embracingit #pride #loveislove #selflove  Umm... okay? I feel like if the photo is about Pride Month, loving yourself in this context should only mean overcoming internalized homophobia/transphobia/queerphobia, not her thighs lol. I feel like she might still be very insecure about her thighs which is why she posted this.",False,False
eq4bz04,t3_bx62z1,t1_eq44e7n,throwawayW861443,1,2019-06-05 17:27:59,/r/EDAnonymous/comments/bx62z1/sometimes_i_feel_like_recovery_social_media/eq4bz04/,"Yeah :( idk I wouldn’t be as mad at all if they were just like “here’s a pic of me lookin fit!” And THATs It. Not this weird message of “recovery is possible, hey I did it and am still lean!”",False,True
eq4bt51,t3_bx62z1,t1_eq44thd,throwawayW861443,1,2019-06-05 17:26:24,/r/EDAnonymous/comments/bx62z1/sometimes_i_feel_like_recovery_social_media/eq4bt51/,I know:( and it’s like....this is why I’ll never recover??? How can I? I have such a fear of becoming fat and I dont have perfect body fat distribution so I am obsessed with lifting weights,False,True
eq4bp55,t3_bx62z1,t1_eq3spbg,throwawayW861443,1,2019-06-05 17:25:17,/r/EDAnonymous/comments/bx62z1/sometimes_i_feel_like_recovery_social_media/eq4bp55/,BROOOOOO   “If you gain weight and it’s not muscle you’re wrong” is so true!!!,False,True
eq47051,t3_bx62z1,t3_bx62z1,cinnamonbicycle,1,2019-06-05 16:36:28,/r/EDAnonymous/comments/bx62z1/sometimes_i_feel_like_recovery_social_media/eq47051/,"Imo, anyone who has a ""recovery"" account isn't actually Recovered. All the actually recovered people just have normal accounts not dedicated to ED stuff.",False,False
eq44thd,t3_bx62z1,t3_bx62z1,PieldeSapo,1,2019-06-05 16:13:57,/r/EDAnonymous/comments/bx62z1/sometimes_i_feel_like_recovery_social_media/eq44thd/,"I so totally agree with you I hate it, even the prorecovery girls that aren't fitness models but are so perfectly shaped like yeah ofc you don't hate your body anymore you are exactly what society wants!!!!",False,False
eq44lxd,t3_bx62z1,t1_eq41jbc,PieldeSapo,1,2019-06-05 16:11:49,/r/EDAnonymous/comments/bx62z1/sometimes_i_feel_like_recovery_social_media/eq44lxd/,You should watch stephanies latest video she's coming clean about this lol,False,False
eq44e7n,t3_bx62z1,t3_bx62z1,ci-fre,1,2019-06-05 16:09:39,/r/EDAnonymous/comments/bx62z1/sometimes_i_feel_like_recovery_social_media/eq44e7n/,"&gt;I see this allot with girls who are into powerlifting (my sport now) and it’s like????? Bro yes you aren’t afraid to eat anymore but I’m not getting ~inspired~ by your perfect fit body. I still hate myself. Glad you don’t.  You're not the only one to have thought this. I think I've seen the sentiment that a lot of recovery bloggers are sort of swapping one eating disorder for another. In that they *still* have body image problems and anxiety around food, only they're channeling it into obsessing about looking ""fit.""",False,False
eq41vtu,t3_bx62z1,t3_bx62z1,dntlookatmepls,1,2019-06-05 15:44:31,/r/EDAnonymous/comments/bx62z1/sometimes_i_feel_like_recovery_social_media/eq41vtu/,Omg 100% agree. Like wow revolutionary ! /s,False,False
eq41jbc,t3_bx62z1,t1_eq3spbg,Lethargicmandarin,1,2019-06-05 15:40:56,/r/EDAnonymous/comments/bx62z1/sometimes_i_feel_like_recovery_social_media/eq41jbc/,"True, a lot of recovered ED people still have disordered eating and so do a ton of fitness gurus (Stephanie Buttermore, cough cough). It’s just another way to feed the obsession with food and body imo.   When you recover, your body will naturally gain lean mass though. It’s impossible to gain purely fat. Even normal people, when overfed, gain muscle and fat despite not lifting",False,False
eq3spbg,t3_bx62z1,t3_bx62z1,fishonthesun,1,2019-06-05 14:18:11,/r/EDAnonymous/comments/bx62z1/sometimes_i_feel_like_recovery_social_media/eq3spbg/,"This is so true. And like if you watch episodes of supersize vs superskinny where they have the eating disorder segment, the recovered people look like normal people. So seeing ""recovery"" insta full of still skinny, lean girls is like... bullshit. They probably dont eat junk food except for ""cheat days"" ie binges. They probably limit how much they eat so they build more lean muscle than bulky muscle. And it makes you feel like if you gain weight without it being muscle your recovery is ""wrong""  Idk I have big anger about that",False,False
eq3qmra,t3_bx62z1,t3_bx62z1,HorrorRefrigerator1,1,2019-06-05 13:58:43,/r/EDAnonymous/comments/bx62z1/sometimes_i_feel_like_recovery_social_media/eq3qmra/,big mood,False,False
