Comment ID,Link ID,Parent ID,Author,Score,Publish Date,Permalink,Text,Stickied,Is Submitter
f15gk6i,t3_d7k0uo,t1_f10yt5g,Throwaway_For_Thot,2,2019-09-22 17:09:04,/r/EDAnonymous/comments/d7k0uo/vice_kindly_what_the_fuck/f15gk6i/,Oh bless you I hadn’t subbed to them yet &lt;3,False,True
f14iaip,t3_d7k0uo,t1_f14h2gn,rachihc,2,2019-09-22 13:04:48,/r/EDAnonymous/comments/d7k0uo/vice_kindly_what_the_fuck/f14iaip/,"Of venus mount region? Yeah, insulting.",False,False
f14h2gn,t3_d7k0uo,t1_f13eg88,glokash,2,2019-09-22 12:53:52,/r/EDAnonymous/comments/d7k0uo/vice_kindly_what_the_fuck/f14h2gn/,It’s gross. It’s an acronym for “fat upper pussy area”,False,False
f13eg88,t3_d7k0uo,t3_d7k0uo,rachihc,1,2019-09-22 08:31:19,/r/EDAnonymous/comments/d7k0uo/vice_kindly_what_the_fuck/f13eg88/,I have no idea what is going on. What is fupa?,False,False
f12xkp6,t3_d7k0uo,t1_f11k91h,arabella_05,1,2019-09-22 05:37:25,/r/EDAnonymous/comments/d7k0uo/vice_kindly_what_the_fuck/f12xkp6/,sometimes vice gets it so right ... but mostly ... mostly it's very very wrong,False,False
f127tdo,t3_d7k0uo,t3_d7k0uo,not_the_cicada,1,2019-09-22 02:09:04,/r/EDAnonymous/comments/d7k0uo/vice_kindly_what_the_fuck/f127tdo/,"Their earlier ED editorials are absolutely cringe as fuck, they are infuriatingly flippant.",False,False
f11ryn6,t3_d7k0uo,t3_d7k0uo,webtrauma,2,2019-09-22 00:22:13,/r/EDAnonymous/comments/d7k0uo/vice_kindly_what_the_fuck/f11ryn6/,Why did I look that up and read it,False,False
f11k91h,t3_d7k0uo,t3_d7k0uo,red_ossifrage,3,2019-09-21 23:31:45,/r/EDAnonymous/comments/d7k0uo/vice_kindly_what_the_fuck/f11k91h/,"ah, more winning content from the Top Minds of Journalism",False,False
f10yt5g,t3_d7k0uo,t3_d7k0uo,webtrauma,1,2019-09-21 21:22:44,/r/EDAnonymous/comments/d7k0uo/vice_kindly_what_the_fuck/f10yt5g/,r/tihi,False,False
f10tb0n,t3_d7k0uo,t3_d7k0uo,glokash,1,2019-09-21 20:50:28,/r/EDAnonymous/comments/d7k0uo/vice_kindly_what_the_fuck/f10tb0n/,Why is that even an article ☹️,False,False
