Comment ID,Link ID,Parent ID,Author,Score,Publish Date,Permalink,Text,Stickied,Is Submitter
eppsbc4,t3_avp7oy,t3_avp7oy,Colgate_Grizi7,1,2019-06-01 06:58:49,/r/EDAnonymous/comments/avp7oy/would_anyone_be_interested_in_location_based/eppsbc4/,I’m in the uk and would be down for a snap group,False,False
ehktwnl,t3_avp7oy,t3_avp7oy,borbolete,1,2019-03-01 14:16:03,/r/EDAnonymous/comments/avp7oy/would_anyone_be_interested_in_location_based/ehktwnl/,I'm from UK and would be up for either Snapchat or insta:),False,False
ehie6me,t3_avp7oy,t3_avp7oy,stillweighting,1,2019-02-28 16:44:05,/r/EDAnonymous/comments/avp7oy/would_anyone_be_interested_in_location_based/ehie6me/,I’m also in the UK and would be totally down for a snap or insta group! ,False,False
ehhqje5,t3_avp7oy,t3_avp7oy,mostlyoff,1,2019-02-28 12:27:23,/r/EDAnonymous/comments/avp7oy/would_anyone_be_interested_in_location_based/ehhqje5/,yeah! i'm from the UK too so hmu if you make one,False,False
ehhp89k,t3_avp7oy,t3_avp7oy,Rickticia,1,2019-02-28 12:14:07,/r/EDAnonymous/comments/avp7oy/would_anyone_be_interested_in_location_based/ehhp89k/,I’m down! Boston Area here.,False,False
ehh0lmt,t3_avp7oy,t1_ehgtjqp,tzt-t,1,2019-02-28 07:29:32,/r/EDAnonymous/comments/avp7oy/would_anyone_be_interested_in_location_based/ehh0lmt/,"Canadian too, but sounds fun! ",False,False
ehgugbb,t3_avp7oy,t3_avp7oy,fizzy_bubblech420,1,2019-02-28 05:31:59,/r/EDAnonymous/comments/avp7oy/would_anyone_be_interested_in_location_based/ehgugbb/,Yeah I’m down for an insta/ snapchat group ,False,False
ehgtjqp,t3_avp7oy,t3_avp7oy,watermelements,1,2019-02-28 05:08:24,/r/EDAnonymous/comments/avp7oy/would_anyone_be_interested_in_location_based/ehgtjqp/,"I’m Canadian, but I love the idea!!",False,False
ehgqjfd,t3_avp7oy,t1_ehgqbtg,dalishmage,1,2019-02-28 03:42:57,/r/EDAnonymous/comments/avp7oy/would_anyone_be_interested_in_location_based/ehgqjfd/,i would be down for an insta group too!! ,False,True
ehgqbtg,t3_avp7oy,t3_avp7oy,luckycharmsinahoe,1,2019-02-28 03:37:16,/r/EDAnonymous/comments/avp7oy/would_anyone_be_interested_in_location_based/ehgqbtg/,"I’m from uk too, i don’t have snapchat but i’m down if there is any ig groups",False,False
