Comment ID,Link ID,Parent ID,Author,Score,Publish Date,Permalink,Text,Stickied,Is Submitter
ehvxnlo,t3_axo2y5,t3_axo2y5,tigerchik,1,2019-03-05 19:54:09,/r/EDAnonymous/comments/axo2y5/just_ed_things_airport_edition/ehvxnlo/,Rude... but you might find it funny at some point... ,False,False
ehvhxo3,t3_axo2y5,t1_ehv11nq,UnusualReport,1,2019-03-05 16:33:28,/r/EDAnonymous/comments/axo2y5/just_ed_things_airport_edition/ehvhxo3/,This. They thought you planned to party really hard.,False,False
ehvge4g,t3_axo2y5,t1_ehuykvq,Arceliaz,1,2019-03-05 16:15:50,/r/EDAnonymous/comments/axo2y5/just_ed_things_airport_edition/ehvge4g/,Omg that’s so funny I would never have thought of that! 😂,False,False
ehv8igb,t3_axo2y5,t1_ehv11nq,sintos-compa,1,2019-03-05 14:51:20,/r/EDAnonymous/comments/axo2y5/just_ed_things_airport_edition/ehv8igb/,"""it's powdered sugar... no, really.""",False,False
ehv8h2b,t3_axo2y5,t3_axo2y5,sintos-compa,1,2019-03-05 14:50:55,/r/EDAnonymous/comments/axo2y5/just_ed_things_airport_edition/ehv8h2b/,he thought you were a coke dealer,False,False
ehv51ty,t3_axo2y5,t3_axo2y5,amborgg,1,2019-03-05 14:13:56,/r/EDAnonymous/comments/axo2y5/just_ed_things_airport_edition/ehv51ty/,"The eye roll could have been that they were annoyed they had to open the suitcase knowing it likely wasn’t anything. They don’t know who you are- a dietician, a drug dealer, anyone who would need that kind of scale lol ignore them ",False,False
ehv11nq,t3_axo2y5,t3_axo2y5,aerienne,1,2019-03-05 13:29:11,/r/EDAnonymous/comments/axo2y5/just_ed_things_airport_edition/ehv11nq/,"If it makes you feel any better, they most likely thought is was for drugs and not food. I brought mine in my carry-on once when I was moving and they fucking swabbed the thing for residue. Jokes on them.",False,False
ehuykvq,t3_axo2y5,t3_axo2y5,paperklipp,1,2019-03-05 13:02:27,/r/EDAnonymous/comments/axo2y5/just_ed_things_airport_edition/ehuykvq/,"Ignore it. I travel with my food scale as well. And honestly if he *was* giving you shade, it’s a lot more likely he thought you were bringing it to weigh out drugs. ",False,False
ehuybcr,t3_axo2y5,t1_ehuw8uo,that-boy-aint-right-,1,2019-03-05 12:59:37,/r/EDAnonymous/comments/axo2y5/just_ed_things_airport_edition/ehuybcr/,"Yep, there was no need for judgement.",False,False
ehuw8uo,t3_axo2y5,t3_axo2y5,PM-ME-CORGIS,1,2019-03-05 12:36:48,/r/EDAnonymous/comments/axo2y5/just_ed_things_airport_edition/ehuw8uo/,That was rude of him. Pay no mind,False,False
