Comment ID,Link ID,Parent ID,Author,Score,Publish Date,Permalink,Text,Stickied,Is Submitter
f4hzcov,t3_dki7mg,t1_f4hxw4n,SHybrid,1,2019-10-20 14:01:30,/r/EDAnonymous/comments/dki7mg/my_mom_triggers_me/f4hzcov/,That's a good chance! Wish you best 😊,False,False
f4hxw4n,t3_dki7mg,t1_f4h14b9,howareudoying2day,1,2019-10-20 13:52:20,/r/EDAnonymous/comments/dki7mg/my_mom_triggers_me/f4hxw4n/,Still a teenager but will be going to college soon!,False,True
f4h14b9,t3_dki7mg,t3_dki7mg,SHybrid,2,2019-10-20 10:57:37,/r/EDAnonymous/comments/dki7mg/my_mom_triggers_me/f4h14b9/,That's real bad... maybe you should try to move out whenever you can afford it. This way surely you wouldn't see each other at meals and it would be easier to get control over your relationship with food. I believe it's the only way to deal with a toxic parent and still not burn all the bridges.,False,False
f4gzunm,t3_dki7mg,t3_dki7mg,notracisthasblackcat,4,2019-10-20 10:51:17,/r/EDAnonymous/comments/dki7mg/my_mom_triggers_me/f4gzunm/,That sounds like abuse to me. Not e\\ven joking. Verbal/emotional abuse. Check out r/raisedbynarcissists,False,False
f4gztvx,t3_dki7mg,t3_dki7mg,senslessshit,2,2019-10-20 10:51:08,/r/EDAnonymous/comments/dki7mg/my_mom_triggers_me/f4gztvx/,omg i'm so sorry. hope you'll feel better &lt;3,False,False
f4gyizb,t3_dki7mg,t3_dki7mg,Rivka90,3,2019-10-20 10:45:27,/r/EDAnonymous/comments/dki7mg/my_mom_triggers_me/f4gyizb/,"Man, you guys deserve so much better. I'm sorry you have to cope with such unhealthy behavior from the person that is supposed to give you love and support. I hope you both find your real moms one day. It's not necessarily the ones we are born with.",False,False
f4gq2ut,t3_dki7mg,t3_dki7mg,mimithelittledog,1,2019-10-20 09:58:34,/r/EDAnonymous/comments/dki7mg/my_mom_triggers_me/f4gq2ut/,"My mom is fat, has always been fat, and when I walked out the door yesterday she told her friend that “ I needed to lose 15 pounds.”",False,False
