Comment ID,Link ID,Parent ID,Author,Score,Publish Date,Permalink,Text,Stickied,Is Submitter
epio68m,t3_bsii5t,t1_eoo73ey,1354267,1,2019-05-30 13:37:00,/r/EDAnonymous/comments/bsii5t/tw_calories_and_numbers_mentioned_how_many/epio68m/,"Just so you know, that won’t always be the case. I promise that time actually does really help with this specific problem. Check back in a month, six months, a year, and you’ll see how much easier this is.",False,False
eoqut9h,t3_bsii5t,t1_eoo716e,fishonthesun,1,2019-05-25 10:12:10,/r/EDAnonymous/comments/bsii5t/tw_calories_and_numbers_mentioned_how_many/eoqut9h/,Unfortunately if I want lasting energy I have to eat protein bars. I've tried pressed fruit bars but I end up having to eat them every half hour or so to prevent passing out so it ends up just being higher cals than a protein bar.  Thank you for the advice tho &lt;3,False,False
eopag43,t3_bsii5t,t3_bsii5t,chillinthetrees,1,2019-05-24 23:33:12,/r/EDAnonymous/comments/bsii5t/tw_calories_and_numbers_mentioned_how_many/eopag43/,I generally bounce back and forth between 600 a day and less than 100 a day. Of course we all have our binge days but i tend to follow those days with long fasts.,False,False
eoor1zs,t3_bsii5t,t3_bsii5t,secretweightloss,1,2019-05-24 19:54:40,/r/EDAnonymous/comments/bsii5t/tw_calories_and_numbers_mentioned_how_many/eoor1zs/,I feel like having an ED has completely skewed my idea of what a normal number is. Like (for myself) i consider over 600 to be high restricting but for a normal person I know that would be like shocking low. But then I come on here and see people talking about eating 1-200 daily and feel like a fat slob for eating 3 times that,False,False
eooi4us,t3_bsii5t,t3_bsii5t,unnecessaryletters,1,2019-05-24 18:05:23,/r/EDAnonymous/comments/bsii5t/tw_calories_and_numbers_mentioned_how_many/eooi4us/,"i usually hit 800-1000, and on exercise days i don't eat more to compensate unless i feel really sick or weak. make sure you're paying attention to how you feel ❤️",False,False
eoo899p,t3_bsii5t,t3_bsii5t,N7girl,1,2019-05-24 16:06:20,/r/EDAnonymous/comments/bsii5t/tw_calories_and_numbers_mentioned_how_many/eoo899p/,That's little. I estimate I ate about 600 today so I guess I won't be eating dinner anymore. Fuck me.,False,False
eoo76oo,t3_bsii5t,t1_eoo6b1g,sadslap,1,2019-05-24 15:52:34,/r/EDAnonymous/comments/bsii5t/tw_calories_and_numbers_mentioned_how_many/eoo76oo/,good not to count!!!! :) :) :),False,True
eoo73ey,t3_bsii5t,t1_eonlwd4,sadslap,1,2019-05-24 15:51:25,/r/EDAnonymous/comments/bsii5t/tw_calories_and_numbers_mentioned_how_many/eoo73ey/,"thx :( definitely talked to my therapist already about the trigger, no longer keeping track of what i eat, but the habit is still there now so regardless of whether or not i keep a physical copy, i always know....",False,True
eoo716e,t3_bsii5t,t1_eoo37vs,sadslap,1,2019-05-24 15:50:39,/r/EDAnonymous/comments/bsii5t/tw_calories_and_numbers_mentioned_how_many/eoo716e/,"nooo I'm sorry this makes you feel shitty :( :( :( no matter how you restrict, you never feel like it's enough. please stay safe and try to eat something whenever you feel like you're going to pass out! i eat the pressed kind fruit bars which are only 100 calories and have 2 servings of fruit + chia seeds!",False,True
eoo6b1g,t3_bsii5t,t3_bsii5t,snefferu,1,2019-05-24 15:41:19,/r/EDAnonymous/comments/bsii5t/tw_calories_and_numbers_mentioned_how_many/eoo6b1g/,"To me under 1000 is heavy restriction, I would feel very hungry on 700. I naturally eat about 1300-1700 depending on appetite fluctuation but I’m in recovery and aim for 2000. I’m not counting atm though 😬 at the height of my ED I was on roughly 500.",False,False
eoo37vs,t3_bsii5t,t3_bsii5t,fishonthesun,1,2019-05-24 15:01:33,/r/EDAnonymous/comments/bsii5t/tw_calories_and_numbers_mentioned_how_many/eoo37vs/,Haha this thread makes me feel so fucking shitty. Due to my physical activity (usually burn ~2500-2800) and hypoglycemia I'd be constantly risking passing out if I tried to restrict lower than 1300 or so. Doesnt stop me from trying and almost always failing,False,False
eonw6va,t3_bsii5t,t3_bsii5t,juliejulie77,1,2019-05-24 13:37:56,/r/EDAnonymous/comments/bsii5t/tw_calories_and_numbers_mentioned_how_many/eonw6va/,"I eat 800 most days and ""binge"" on 2500 once a week or so. I have a BMI of 16 and am 5'7",False,False
eonswv6,t3_bsii5t,t3_bsii5t,face-grime,1,2019-05-24 12:59:04,/r/EDAnonymous/comments/bsii5t/tw_calories_and_numbers_mentioned_how_many/eonswv6/,usually 250-650  But after 500 I start to really despise myself more than usual so,False,False
eonra9s,t3_bsii5t,t3_bsii5t,lafisthename,1,2019-05-24 12:39:55,/r/EDAnonymous/comments/bsii5t/tw_calories_and_numbers_mentioned_how_many/eonra9s/,I eat 500 on weekdays and 900 on dnd days (Wednesday and Friday).,False,False
eonlwd4,t3_bsii5t,t3_bsii5t,1354267,1,2019-05-24 11:36:22,/r/EDAnonymous/comments/bsii5t/tw_calories_and_numbers_mentioned_how_many/eonlwd4/,"I think the concept of normal goes out the window when all of us are aware of the fact that we aren’t mentally healthy. There is no normal, anymore. What’s normal for you may be totally abnormal for someone else, and that’s okay. I think one of the most important parts of recovery is learning not to compare ANY aspects of yourself to others. You should talk to your therapist about what is or isn’t normal for YOU. They may find that you tracking your food like this might actually be too triggering for you, and cause stuff like this to happen.",False,False
eonlv69,t3_bsii5t,t3_bsii5t,plshealme,1,2019-05-24 11:35:58,/r/EDAnonymous/comments/bsii5t/tw_calories_and_numbers_mentioned_how_many/eonlv69/,"500-700 is not being a noob of anything you should feel judged for. it's still heavy restriction, though of course every person has a different opinion on this.  you are not alone though. i eat between 500-700 on my 'normal' days. i work full time and exercise daily so that's my 'safe amount' where i eat enough to not feel like absolute shit day in day out. i am sure many here restrict in a similar range, but even if they didn't, it wouldn't change the fact that it's still restrictive and a lot less than your body technically needs.",False,False
