Comment ID,Link ID,Parent ID,Author,Score,Publish Date,Permalink,Text,Stickied,Is Submitter
erkedkp,t3_c22xz7,t1_erjaw0w,baswild,1,2019-06-19 11:26:46,/r/EDAnonymous/comments/c22xz7/i_find_recovery_difficult_to_accept_because_its/erkedkp/,i don’t think you horribly explained it!! it definitely makes more sense to me now. i remember hearing people talking about it while i was at treatment and thinking it sounded like nonsense but i didn’t say anything. thank you for explaining!,False,False
erjihqd,t3_c22xz7,t3_c22xz7,ci-fre,1,2019-06-19 03:01:41,/r/EDAnonymous/comments/c22xz7/i_find_recovery_difficult_to_accept_because_its/erjihqd/,"Your recovery can be different.  Body positivity isn't exactly the same as eating disorder recovery—it's a movement, not a health thing the same way recovery is. In this particular movement, there are a *LOT* of misunderstandings and oversimplifications, which leads to psuedoscience.  You don't need to believe *everything* that *every single* body positivity supporter says. You just need to feel that you deserve to love yourself and take care of yourself.  I relate to you. It's why I was never really able to recover. Whenever I have any concern with stuff I get called out for stressing about it and I'm told to STFU :(",False,False
erjcir2,t3_c22xz7,t3_c22xz7,red_ossifrage,1,2019-06-19 00:51:18,/r/EDAnonymous/comments/c22xz7/i_find_recovery_difficult_to_accept_because_its/erjcir2/,"The pseudoscience thing kills me. I usually hate this language, but ""feels over reals"" comes to mind. Like I'm sorry, just because it would be nice for something to be true, or would encourage people to recover if it were true, that doesn't make your bullshit, a priori theories *actually* true.    One site that especially irked me was mirror-mirror. I found it in middle school, and while it's now improved some (it used to have a bunch of random pages that were basically just opinionated rambling), it immediately turned recovery into a joke to me. To be fair, I had no interest in recovery either then or now, but still, sites like that could have done better than making 13 yr old me actually laugh. When you tell me set point theory is the realest thing to ever real, and I'm just too stupid from not eating to know that, you've instantly lost my respect (and attention). People with EDs do not take kindly to condescension, and that site was/is the epitome of both condescension and pseudoscience - no better combo to repel the people it's supposed to help!   It still pisses me off that it's one of the first sites that comes up if you're googling along those lines.",False,False
erjaw0w,t3_c22xz7,t1_erj9e4j,rdnvl,1,2019-06-19 00:20:40,/r/EDAnonymous/comments/c22xz7/i_find_recovery_difficult_to_accept_because_its/erjaw0w/,"I’m really terrible at explaining things! I took this from a comment by u//edgeofdreams on a r/nostupidquestions thread where someone asked if set point theory is “bullshit” or not, since there are a few conflicting definitions online about it depending on the source. I think this quote helps explain and debunk the scary myth side (that it’s beyond our control) while validating the slightly annoying yet relieving, scientific and true angle (that it’s mainly our body being used to certain habits and not liking changed but none of this being fixed whatsoever) behind set point theory:  &gt; ""if your parents are fat you'll be fat because of your set point""  That's mostly bullshit. There are some genetic factors that affect weight gain/loss, but it isn't a guarantee you'll be fat or skinny. You might as well say, ""Your parents had long hair, so you'll have long hair.""  ""someone can go on a diet but it wont work because of their set point""  This is also bullshit.  The whole idea of a ""set point"" is that it's a particular weight your body is accustomed to being at. You'll tend to want to eat more if you drop below it and want to eat less if you're above it. However, it's not permanently fixed by genetics. (...) You can change your set point. It just takes time.",False,False
erj9e4j,t3_c22xz7,t1_erhbu0o,baswild,1,2019-06-18 23:54:09,/r/EDAnonymous/comments/c22xz7/i_find_recovery_difficult_to_accept_because_its/erj9e4j/, can you explain set point theory a little? i’ve def heard it before but i can’t seem to remember,False,False
erj0k7f,t3_c22xz7,t1_erhezyx,quietpandaa,1,2019-06-18 21:44:07,/r/EDAnonymous/comments/c22xz7/i_find_recovery_difficult_to_accept_because_its/erj0k7f/,You might like something like /r/exproed. I tried to revive it a few months ago but had trouble getting enough traffic. But in my dreams it's exactly like this sub but with a focus on actively trying to recover!,False,False
eril002,t3_c22xz7,t1_erij3f6,ifuckpineapples,1,2019-06-18 18:26:33,/r/EDAnonymous/comments/c22xz7/i_find_recovery_difficult_to_accept_because_its/eril002/,"milk is its own group, so it counts as one milk. behind the scenes most foods have fat, starch, and protein anyways, but this system helps you just categorize by main value more than anything",False,True
erij3f6,t3_c22xz7,t1_erifei5,lotsofsqs,1,2019-06-18 18:02:20,/r/EDAnonymous/comments/c22xz7/i_find_recovery_difficult_to_accept_because_its/erij3f6/,"You're amazing! Thank you! One question: say you have one cup of milk; does that count as one protein, one carb, and one fat exchange? Or just one milk group exchange?",False,False
erifei5,t3_c22xz7,t1_ericfnc,ifuckpineapples,1,2019-06-18 17:18:24,/r/EDAnonymous/comments/c22xz7/i_find_recovery_difficult_to_accept_because_its/erifei5/,"yes, she gave me a calorie count and exchange rate for each of the three phases (starting low and ending up around my tdee). [heres](https://imgur.com/a/bCi9uR7) the link to the imgur album, i put notes under each pic explaining the phases. hope it helps!",False,True
ericii4,t3_c22xz7,t1_eri92ui,DisturbedWeakness,1,2019-06-18 16:46:14,/r/EDAnonymous/comments/c22xz7/i_find_recovery_difficult_to_accept_because_its/ericii4/,"I was 15 when I was in that clinic. My parents denied every seen me fasting and ever wisnessing any eating disordered behavior. Even though my mother regularly put me in clothes that where way too small for me, kept pointing out to me I had fatblobs on my chest, since I was about 8. I only found out these were my breasts which develop even before you start menstruating which I started at 8 or 9 when I was in highschool and some of my friend forced me to buy bras.    My father got reallyad if I refused to eat and put me in a headlock and literally forced to food down my throat.   But they just told the doc at the clinic they had no idea why I would tell such nonsense. 'she probably wants some more attention, maybe she saw that news item about pro ana and decided it's cool? (pro ana was in the news a lot back then and a large recovery community had been started as an alternative to those sites.)    I believed I recovered on my own but looking back I certainly retained a lot of bad habits. And I never regained a health relationship with food. Maybe I just ate healthier but still kept my binges. And I stopped exercising because I have serious chronic pain. Gained a lot. So before my relapse I was obese. April 27th I was obese. Now I am almost at the borderline of overweight/healthy weight.    I keep thinking what if they are just going to tell me 'well done you really needed to lose those kgs.' but my rational mind tells me that losing weight is just a minor part of the problem. My fears are based in eating itself. Feeling. In my mood. In my life. In my emotions. In everything. Kcals is like a short word for everygoddamnthingthatisbotheringme. The clinic that treated me like an attention seeking idiot but kept me inpatient for a year and a half wasn't and ed clinic. I would hope and ed clinic at least knows to look further than the number on a scale or the plates you empty...    ♥️",False,False
ericfnc,t3_c22xz7,t1_eri92dy,lotsofsqs,1,2019-06-18 16:45:24,/r/EDAnonymous/comments/c22xz7/i_find_recovery_difficult_to_accept_because_its/ericfnc/,That would be awesome! Were you counting calories at the time? I've always wondered if they check out...,False,False
eri92ui,t3_c22xz7,t1_erhoiay,YouCanJustThrowMeAwy,1,2019-06-18 16:08:46,/r/EDAnonymous/comments/c22xz7/i_find_recovery_difficult_to_accept_because_its/eri92ui/,"This scares the crap out of me. I’m being referred to an ED clinic, because I asked for counselling and they said I needed a specialist, however they were also surprised I said I had an ED because I was still classed as overweight on my BMI. I’m a size 12 (UK) but I’ve dropped about 4 dress sizes through my ED and I wanted a healthier way to go about it, but my doctor was so sceptical of me because I’m not yet underweight.",False,False
eri92dy,t3_c22xz7,t1_erhkkj6,ifuckpineapples,1,2019-06-18 16:08:37,/r/EDAnonymous/comments/c22xz7/i_find_recovery_difficult_to_accept_because_its/eri92dy/,"this sounds like you want an exchange meal plan. when I was seeing my dietician she set me up with one and I did like it as a way to paln my own meals. there's categories like protein, fats, veg, milk, etc and there's examples of what counts as each and serving sizes. you can Google it or if oh want I can snap you a pick of mine as we changed the numbers through my recovery phases. fwiw it was very helpful, I just never got the mental stuff down",False,True
eri49m4,t3_c22xz7,t3_c22xz7,philoqueen,1,2019-06-18 15:19:55,/r/EDAnonymous/comments/c22xz7/i_find_recovery_difficult_to_accept_because_its/eri49m4/,"Ahhhh I felt this same way. I hated recovery as a concept. But I define it for myself. You should do the same--define it for what YOU want it to look like. Recovery is not eating whatever the fuck you want and binging constantly and being unhealthy and/or becoming obese. It's eating what your body needs when it needs it, balanced meals regularly, and no longer obsessing over your body or food. It's not thinking you're anorexic at a BMI of 21 ***BUT also*** not thinking you're fat at a BMI of 21.",False,False
erhzpi3,t3_c22xz7,t1_erhezyx,roastedpepper,1,2019-06-18 14:33:00,/r/EDAnonymous/comments/c22xz7/i_find_recovery_difficult_to_accept_because_its/erhzpi3/,I so feel this. My therapist just brought up set point and starvation mode. I didn’t say anything cause I didn’t want to be “resisting.”  It’s all just so annoying. Recovery doesn’t have to include fatlogic but it seems that it usually does? I dunno. Super frustrating.,False,False
erhtjqc,t3_c22xz7,t1_erho4jg,lotsofsqs,1,2019-06-18 13:29:36,/r/EDAnonymous/comments/c22xz7/i_find_recovery_difficult_to_accept_because_its/erhtjqc/,"&gt; it felt so arbitrary.   I like the flexibility of it. Like, it still gives me some control and choices.  &gt;they insisted on me having at least one dessert per day and weekly pizza despite that not being what I was struggling with   That's super strange... That's what I didn't like about ED treatment. It seemed geared toward people with AN and not people who binge.  That looks pretty cool! A shopping list would be really helpful too. The grocery store is daunting.",False,False
erhp6xz,t3_c22xz7,t3_c22xz7,Written23,1,2019-06-18 12:44:51,/r/EDAnonymous/comments/c22xz7/i_find_recovery_difficult_to_accept_because_its/erhp6xz/,"I totally agree.  My old friends used to tout all that stuff and although I was always heavier I KNOW it's because of my f-ed up eating and lack of exercise.  Then when I finally got close to a healthy weight they all started calling me sick.  Like no,  that's what my body should look like.  Always made me so angry.  I can't find solace in the body positivity movement. It ignores all logic.",False,False
erhp2nh,t3_c22xz7,t1_erhmlti,Renlywinsthethrone,1,2019-06-18 12:43:40,/r/EDAnonymous/comments/c22xz7/i_find_recovery_difficult_to_accept_because_its/erhp2nh/,"Took me a minute. ""What do sga men have to do with this?""",False,False
erhoiay,t3_c22xz7,t1_erhe98g,DisturbedWeakness,1,2019-06-18 12:38:00,/r/EDAnonymous/comments/c22xz7/i_find_recovery_difficult_to_accept_because_its/erhoiay/,"When I first got referred to a clinic and got admitted I was referred with an eating disorder and depression. The psychiatrist in the clinic told my I could not have an ED since I exercised multiple hours a day and I was normal weight. I however didn't get a period cause my body fat was too low for that. Also my hair fell out and I kept fainting. That was all stress and attention seeking according to the psych. I however did see a dietician and her first question to me was 'are you afraid to be in a snackbar?' so I said no. I don't have money and I won't eat anything anyway. An she looked at me weird, and told me. Sooo you ain't afraid to inhale that fatsmell? I laughed in her face and told her I am not going to get fat from a smell. She was pretty big so asked her if she thought she could lose weight by plugging her nose. She seemed offended and she gave me a standard list for eating. I followed that and doubled my exercise. I really recovered after I got out of there, although learning the structure of three meals helped a bit. (and being away from home helped a lot)   Have found that many psychs have no idea how to actually treat Ed's other than 'eat this' and 'I never eat that so that's probably weird behavior, Yes even if 80% of people do eat that.'",False,False
erhohcc,t3_c22xz7,t3_c22xz7,cinnamonbicycle,1,2019-06-18 12:37:44,/r/EDAnonymous/comments/c22xz7/i_find_recovery_difficult_to_accept_because_its/erhohcc/,"I completely agree. I go through phases of truly wanting to recover, but it always gets crushed by this bullshit. When I was forced through residential treatment, my team wouldn't listen to me or my *parents* when we told them the goal weight they set for me was too high for my body. They made me feel like I was being difficult and defiant when I tried to explain that some of the foods they forced us to eat were so unhealthy they were literally harming us more than helping. There is an unreal amount of bullshit circulated in the recovery community and I can't stand it.  Luckily, my outpatient team doesn't buy into too much of that. I recommend finding a dietitian who doesn't specialize in eating disorders. That way, they'll just deal with actual facts and none of that pseudoscience.",False,False
erho4jg,t3_c22xz7,t1_erhkkj6,watchmedisapr,1,2019-06-18 12:34:10,/r/EDAnonymous/comments/c22xz7/i_find_recovery_difficult_to_accept_because_its/erho4jg/,"They do! I hated the whole food group rhetoric of treatment because it felt so arbitrary. I'm overweight and they refused to tailor my eating plan to my personal needs. I don't process simple carbs (bread, rice, sweets). They insisted on me having at least one dessert per day and weekly pizza despite that not being what I was struggling with. I like that this plan instead figures out what best fuels your body and helps you create meals to fit that. Every week the app helps you pick the meals you'd like and it automatically adjusts portion size based on your goals and how you feel.    I grabbed a [screen shot](http://imgur.com/gallery/lIIdFo0) of a couple of the meals. I love that they give you a shopping list, cooking directions and an estimate on prep time. Honestly that's the all the parts of eating real food I find the scariest.",False,False
erhng7i,t3_c22xz7,t3_c22xz7,DisturbedWeakness,1,2019-06-18 12:27:12,/r/EDAnonymous/comments/c22xz7/i_find_recovery_difficult_to_accept_because_its/erhng7i/,O God this. I made the hard decision of telling my therapist about my relapse.. And she asked me what I was eating now. So I told her (was low restricting for a couple weeks by then) and she flat out told me I would probably soon stop losing weight altogether.   So me very confused asked why?   And she said again that my fear of not losing weight wasn't very realistic cause if I don't eat I cant burn calories............   I told her I regretted saying anything and also thanked her for her advise and promised to go back to eating to avoid not being able to burn anything. (lolwtfwoman).      I have no idea what to do know. If my therapist does even understand cico I can't explain why I am doing what I'm doing. And that in therapy is just fuel to the ed-fire.     *****Left out all the fat logic nonsense she said cause not understanding cico is bad enough.,False,False
erhmlti,t3_c22xz7,t3_c22xz7,Current_Selection,1,2019-06-18 12:18:25,/r/EDAnonymous/comments/c22xz7/i_find_recovery_difficult_to_accept_because_its/erhmlti/,&gt;YOU MLM LOVING SLUT  hahahahahaha I love you,False,False
erhl013,t3_c22xz7,t3_c22xz7,silversandpiper,1,2019-06-18 12:03:44,/r/EDAnonymous/comments/c22xz7/i_find_recovery_difficult_to_accept_because_its/erhl013/,"I am not specifically anorexic (my disorder is like a diet that never ended after I got fit, still put in the same amount of work everyday etc but don't avoid certain foods) and I've lost weight twice now because I regained after the first time. I get triggered when doctors and other people tell me to not focus on a specific weight range or BMI and my goal should be the weight I feel healthy at, eat when satiated etc, don't calorie count, don't look at scale. Guess how I regained weight the first time? GUESS WHAT I DID?? So now when people say something along those lines I always think to myself, ""Yeah right, tried that and got fat again along with bonus prehypertension. My way seems to work better.""",False,False
erhkkj6,t3_c22xz7,t1_erhj1ok,lotsofsqs,1,2019-06-18 11:59:52,/r/EDAnonymous/comments/c22xz7/i_find_recovery_difficult_to_accept_because_its/erhkkj6/,"Do they give you quantity as well? That sounds pretty cool.  I think something like this would be helpful, but I don't necessarily need the actual foods, just the food groups. Like:  B: fruit, fat. S: fruit. L: protein, vegetable. D: grain, vegetable. S: fruit.  Problem is, I have no idea what a normal amount of food looks like.",False,False
erhj1ok,t3_c22xz7,t1_erhi98m,watchmedisapr,1,2019-06-18 11:46:05,/r/EDAnonymous/comments/c22xz7/i_find_recovery_difficult_to_accept_because_its/erhj1ok/,"Exactly. Honestly I've found the best meal plan through an app called G-plans. If you don't buy into all the supplements they try to sell you, you end up with about $30/month or $150/year for meal plans. It's interactive and tailored to how your body works. I panicked when I saw how much food I had to get but my bf got me through it. Here were my last two days:  B: strawberry almond quinoa S: apple, PB L: beef and broccoli white rice S: almonds, plum D: avacado zucchini pasta S: pear  B: protein breakfast parfaits (chia, fruit, soy yogurt) S: cashews, pear L: seared turmeric chicken S: apple, pb D: veggie thai fried quinoa  S: strawberries",False,False
erhi98m,t3_c22xz7,t1_erhe98g,lotsofsqs,1,2019-06-18 11:38:39,/r/EDAnonymous/comments/c22xz7/i_find_recovery_difficult_to_accept_because_its/erhi98m/,"The treatment center in my city apparently considers a pop tart ""fruit"" and you can't count an avocado as a fat. That's why I've been so hesitant to see a dietitian even though I'd really like some help meal planning.",False,False
erhhmq0,t3_c22xz7,t3_c22xz7,jayrambling,1,2019-06-18 11:32:25,/r/EDAnonymous/comments/c22xz7/i_find_recovery_difficult_to_accept_because_its/erhhmq0/,"Omg yes!! I go to group therapy at my university and it's so full of that junk, but I can never say anything about it because I don't want to trigger the other girls in the group. It's endlessly frustrating. I see it a lot on recovery IG as well, and the times that I've said something about it I get attacked for hating fat people which is so so so untrue. I just think that it's irresponsible to promote pseudoscience to people with eating disorders because in the end it'll just bite them in the ass.",False,False
erhgl6a,t3_c22xz7,t1_erhezyx,lotsofsqs,1,2019-06-18 11:21:41,/r/EDAnonymous/comments/c22xz7/i_find_recovery_difficult_to_accept_because_its/erhgl6a/,"Ah, for sure. That's why I spend a lot of time on this sub. I go through my recovery with the mindset of ""take what's helpful and leave the rest.""  I think the biggest challenge is, how much information about nutrition and anatomy should you really be thinking about on a daily basis? Like, certainly having one cookie a day is better than starving yourself, no? I feel very educated on nutrition, but just because I know a lot, doesn't mean that during my eating disorder I was practicing it or healthy in any way. So I think about eating balanced meals and kind of leave it at that. I don't need to track macros right now.",False,False
erhgjwz,t3_c22xz7,t1_erhezyx,Carracado,1,2019-06-18 11:21:19,/r/EDAnonymous/comments/c22xz7/i_find_recovery_difficult_to_accept_because_its/erhgjwz/,"&gt;i seemingly have to deal with a high chance of all the fatlogicky nonsense, because it gets extremely difficult to find anywhere to seek support without being sold the extra lies on the side.  This is basically how it is with any kind of group, though. No one will find a group be it church, clubs, support groups, AA meetings, whatever that aligns with them completely. “Take what you need and leave what you don’t.”  It can be frustrating at times but your journey doesn’t have to match anyone else’s. You can absolutely talk to your treatment team about your thoughts and feelings, too. They want you to be *healthy*. If part of the recovery rhetoric you’re getting is getting in the way, they will want to know so they can support you with it.   This is about *you*. The thoughts and feelings that you can commiserate with in a group setting can be very beneficial but your recovery doesn’t have to be ice cream and sleeping all day. It should be whatever helps you align in mind, body, and spirit. I’ve been at this 12 years and I don’t believe I will ever be able to stop eating mechanically, and that’s okay. I’m okay with that. I think intuitive eating is dangerous and I won’t even entertain it. I don’t think it’s based on any sound evidence of superiority to mechanical eating. Does that mean I can’t get anything from recovery groups who believe intuitive eating is the One True Path? Of course not. There are still a lot of bright, funny, and caring people who believe that and I deserve to have bright, funny, and caring people in my recovery. And you do too.",False,False
erhf2ca,t3_c22xz7,t1_erheuas,ifuckpineapples,1,2019-06-18 11:05:27,/r/EDAnonymous/comments/c22xz7/i_find_recovery_difficult_to_accept_because_its/erhf2ca/,yup thats p much what i said.,False,True
erhf0pf,t3_c22xz7,t1_erhezyx,[deleted],1,2019-06-18 11:04:57,/r/EDAnonymous/comments/c22xz7/i_find_recovery_difficult_to_accept_because_its/erhf0pf/,[removed],False,False
erhezyx,t3_c22xz7,t1_erha0mt,ifuckpineapples,1,2019-06-18 11:04:43,/r/EDAnonymous/comments/c22xz7/i_find_recovery_difficult_to_accept_because_its/erhezyx/,"i appreciate the sentiment. I guess what im more frustrated with is if i want to seek any solace in recovery--be it online or in person somewhere-- i seemingly have to deal with a high chance of all the fatlogicky nonsense, because it gets extremely difficult to find anywhere to seek support without being sold the extra lies on the side. its just frustrating and i wish we had a sub like this one but recovery focused. even /r/fuckeatingdisorders can get like this at times and its disappointing, if you correct any misinfo on nutrition or anatomy you get downvoted completely.",False,True
erheuas,t3_c22xz7,t1_erheqyy,livipup,1,2019-06-18 11:03:00,/r/EDAnonymous/comments/c22xz7/i_find_recovery_difficult_to_accept_because_its/erheuas/,Being worse when underweight still means things will improve at a healthy weight,False,False
erheqyy,t3_c22xz7,t1_erhbxj6,ifuckpineapples,1,2019-06-18 11:02:01,/r/EDAnonymous/comments/c22xz7/i_find_recovery_difficult_to_accept_because_its/erheqyy/,"ive never really had any problems in terms of hair damage/excess shedding, and ive had heart palpitations before my eating disorder, during, and while recovered + at a higher weight. im also p much always tired, cold and a little anxious no matter where i am at the moment weight/recovery wise, the only difference is its all slightly worse when underweight (and what im anxious about changes). im glad those things cleared up for you though.",False,True
erhejjh,t3_c22xz7,t1_erhe98g,ifuckpineapples,1,2019-06-18 10:59:50,/r/EDAnonymous/comments/c22xz7/i_find_recovery_difficult_to_accept_because_its/erhejjh/,"jesus i would cancel with them so hard theyd get whiplash. that is absolutely ridiculous and i dont think it takes a degree in nutrition to tell that both of those simply arent true. sorry you have to deal with such bullshit in the recovery world, it truly does make it harder",False,True
erhe98g,t3_c22xz7,t3_c22xz7,watchmedisapr,1,2019-06-18 10:56:52,/r/EDAnonymous/comments/c22xz7/i_find_recovery_difficult_to_accept_because_its/erhe98g/,"Thank you. I've been basically dropped by every treatment program because I'm not quiet about my concerns and I ask questions and challenge rhetoric. Had a staring contest with a nutritionist because she claimed a pop tart was more healthy than a banana for breakfast. Another one told me that a sandwich and salad were not age appropriate for a lunch and that to tick off my veggie requirement I'd need potato chips.   No. Just, fucking, no.",False,False
