Comment ID,Link ID,Parent ID,Author,Score,Publish Date,Permalink,Text,Stickied,Is Submitter
euejcqv,t3_ce5njl,t3_ce5njl,[deleted],1,2019-07-21 16:50:22,/r/EDAnonymous/comments/ce5njl/my_office_had_a_weight_loss_contest/euejcqv/,[removed],False,False
euae6z1,t3_ce5njl,t1_eu07hjz,loversalibi,1,2019-07-20 04:10:11,/r/EDAnonymous/comments/ce5njl/my_office_had_a_weight_loss_contest/euae6z1/,somehow i never noticed spongebob at the end of schindlers list,False,False
eu3988m,t3_ce5njl,t1_etzv81y,steepedinqualitea,1,2019-07-17 19:10:10,/r/EDAnonymous/comments/ce5njl/my_office_had_a_weight_loss_contest/eu3988m/,I think it’s usually something the employers insurance pushes them to do because having obese people on their insurance plans means having to cover more doctors visits and procedures in the future.,False,False
eu35o1u,t3_ce5njl,t1_eu1y2s3,philoqueen,1,2019-07-17 18:26:50,/r/EDAnonymous/comments/ce5njl/my_office_had_a_weight_loss_contest/eu35o1u/,Unfortunately it wasn’t really an option for me. Everyone could kind of tell when I had to leave early every other day for outpatient and I gained 40 pounds in 1-2 months 😂 eventually I just blurted it out “I’m recovering” while eating a huge lunch and no one asked “from what” as it was pretty obvious and everyone was just supportive about it and kept it vague. I am super lucky though to have a supportive office.,False,False
eu2sj5s,t3_ce5njl,t1_eu2q9jn,champollion00000,1,2019-07-17 15:59:06,/r/EDAnonymous/comments/ce5njl/my_office_had_a_weight_loss_contest/eu2sj5s/,I don't think those people understand what an incel is.,False,False
eu2q9jn,t3_ce5njl,t1_eu25z5z,SalehRobbins,1,2019-07-17 15:35:25,/r/EDAnonymous/comments/ce5njl/my_office_had_a_weight_loss_contest/eu2q9jn/,"THIS.   I've only ever been treated with respect by family, friends, and teachers when I weighed 80lbs. I'm 100lbs now but I'm not just relapsing anymore because the voice is back. It has a real effect on what opportunities you're given. All the people who told me I was pudgy, average, and ""meh"" appearance wise are also the people who rushed to compliment me once I opened up about my eating disorder. I can't trust people to be honest.   I got called an incel for saying this on r/teenagers, lol!",False,False
eu25z5z,t3_ce5njl,t1_etzawl5,champollion00000,1,2019-07-17 12:04:23,/r/EDAnonymous/comments/ce5njl/my_office_had_a_weight_loss_contest/eu25z5z/,"YES. This. This is what is preventing me from recovering. Recovery is always about self love and acceptance and how the world SHOULD be. But the world actually IS full of people who are judging you on your appearance and that has real consequences in your professional and personal life. People legit treat me worse now that I'm heavier and I'm only talking about going from a 16.5 to an 18 BMI. Part of the problem is self loathing and body dysmorphia, of course, but part of it is the fact that we live in a horrible messed up world that rewards unrealistic standards and unhealthy behavior. You can't just ""opt out"" of it, just as you can't ""opt out"" of misogyny, racism, classism or other systemic societal problems. You're always going to be implicated and affected by them in some way.",False,False
eu24neg,t3_ce5njl,t1_eu1lnxb,smashing_hashing,1,2019-07-17 11:50:38,/r/EDAnonymous/comments/ce5njl/my_office_had_a_weight_loss_contest/eu24neg/,"I have embraced this, I don't run away from it anymore.",False,False
eu24nac,t3_ce5njl,t1_eu1exm9,GhostGangGiGi,1,2019-07-17 11:50:35,/r/EDAnonymous/comments/ce5njl/my_office_had_a_weight_loss_contest/eu24nac/,"That's quite possible! I know we just got new insurance plans shortly before the contest and it was framed as a ""health incentive contest"" lol the fucking irony.",False,True
eu1znwm,t3_ce5njl,t1_eu0pfwi,GhostGangGiGi,1,2019-07-17 10:58:21,/r/EDAnonymous/comments/ce5njl/my_office_had_a_weight_loss_contest/eu1znwm/,I live in a very uncool state and city and I pay $770 for a small ass one bedroom. Finding affordable housing is really really hard especially when you have a pet and not that much credit / income :(,False,True
eu1ysln,t3_ce5njl,t1_eu1cjr5,dogsandpeaceohmy,1,2019-07-17 10:49:11,/r/EDAnonymous/comments/ce5njl/my_office_had_a_weight_loss_contest/eu1ysln/,If in the states they legally have to.,False,False
eu1y2s3,t3_ce5njl,t1_eu1938y,coconutpikki,1,2019-07-17 10:41:40,/r/EDAnonymous/comments/ce5njl/my_office_had_a_weight_loss_contest/eu1y2s3/,I would never have the confidence or sense of self care to disclose that to my employer sadly,False,False
eu1ub0h,t3_ce5njl,t3_ce5njl,MoosieGoose,1,2019-07-17 10:00:09,/r/EDAnonymous/comments/ce5njl/my_office_had_a_weight_loss_contest/eu1ub0h/,"Co-workers did this years ago when I was very sick. Didn't participate, but certainly did check those numbers!",False,False
eu1sond,t3_ce5njl,t1_eu01fbv,RefurbishedDalek,1,2019-07-17 09:42:15,/r/EDAnonymous/comments/ce5njl/my_office_had_a_weight_loss_contest/eu1sond/,“Save money AND kill off your ED employees in one fell swoop!  Totally worth the $1K !”  /s FUCK that shit.,False,False
eu1rl2r,t3_ce5njl,t3_ce5njl,InsomniacCyclops,1,2019-07-17 09:29:47,/r/EDAnonymous/comments/ce5njl/my_office_had_a_weight_loss_contest/eu1rl2r/,You guys are getting paid?,False,False
eu1pikz,t3_ce5njl,t1_eu0vxte,Noroeste,1,2019-07-17 09:05:49,/r/EDAnonymous/comments/ce5njl/my_office_had_a_weight_loss_contest/eu1pikz/,Thank you for keeping yourself physically and mentally strong for the sake of helping others!,False,False
eu1ndhu,t3_ce5njl,t3_ce5njl,quietlyinteresting,1,2019-07-17 08:39:52,/r/EDAnonymous/comments/ce5njl/my_office_had_a_weight_loss_contest/eu1ndhu/,"Jaysus that sounds’ like some immature passive aggressive bullying within a work dynamic by people in authority who should know better.   Have one better though, my company had a drinking contest at the last Christmas party. Of course I had been fasting all week since I would be eating in public. Long story short I won the drinking contest but woke up the next morning with a cut forehead and a black eye. When I came in to work on Monday I was met with positive reinforcement by colleagues and managers.",False,False
eu1lnxb,t3_ce5njl,t1_eu06yh1,Auntie_Vodka,1,2019-07-17 08:18:22,/r/EDAnonymous/comments/ce5njl/my_office_had_a_weight_loss_contest/eu1lnxb/,"I have to leave the room when my mother eats fast food now, cause I have to calculate how many calories all of it was",False,False
eu1ho5n,t3_ce5njl,t3_ce5njl,pastelxbones,1,2019-07-17 07:37:02,/r/EDAnonymous/comments/ce5njl/my_office_had_a_weight_loss_contest/eu1ho5n/,"That's a pretty messed up idea for a contest, eating disorders aside.",False,False
eu1fo5v,t3_ce5njl,t1_eu1cjr5,RoughTurnip,1,2019-07-17 07:22:24,/r/EDAnonymous/comments/ce5njl/my_office_had_a_weight_loss_contest/eu1fo5v/,better taxes out now than finding you owe a bunch later...with penalties,False,False
eu1exm9,t3_ce5njl,t1_etzv81y,Bunny_Feet,1,2019-07-17 07:17:00,/r/EDAnonymous/comments/ce5njl/my_office_had_a_weight_loss_contest/eu1exm9/,"Insurance related, maybe?  Some places even have deals with fitbit for promoting a healthier lifestyle, except no one seems to know what ""healthy"" means.  lol",False,False
eu1er7x,t3_ce5njl,t1_eu1a4i0,CurlyJ2019,1,2019-07-17 07:15:40,/r/EDAnonymous/comments/ce5njl/my_office_had_a_weight_loss_contest/eu1er7x/,"Brb moving to Germany!  Depends on the job - tech jobs, lawyers, doctors, and experienced professionals receive reasonable salaries. The rest of the peasantry better get used to having roommates.",False,False
eu1cjr5,t3_ce5njl,t1_etz0gax,wrinkle-crease,1,2019-07-17 06:58:48,/r/EDAnonymous/comments/ce5njl/my_office_had_a_weight_loss_contest/eu1cjr5/,lame they took out taxes!!,False,False
eu1ap9q,t3_ce5njl,t1_eu18j85,_nocturnalvoid,1,2019-07-17 06:42:52,/r/EDAnonymous/comments/ce5njl/my_office_had_a_weight_loss_contest/eu1ap9q/,Thanks,False,False
eu1a4i0,t3_ce5njl,t1_eu18otj,rachihc,1,2019-07-17 06:37:35,/r/EDAnonymous/comments/ce5njl/my_office_had_a_weight_loss_contest/eu1a4i0/,well I be damn I pay 300 euros per month for a flat with a balcony and garden =/ and is an average city in Germany.   I just hope that salaries pay accordingly.,False,False
eu19bxf,t3_ce5njl,t3_ce5njl,Sal4Sale,1,2019-07-17 06:30:20,/r/EDAnonymous/comments/ce5njl/my_office_had_a_weight_loss_contest/eu19bxf/,[Wait...](https://imgur.com/a/MEsaNem),False,False
eu1938y,t3_ce5njl,t1_etzd5eh,philoqueen,1,2019-07-17 06:28:02,/r/EDAnonymous/comments/ce5njl/my_office_had_a_weight_loss_contest/eu1938y/,"Same, my office knows about my past ED and they’d force me to seek help if I relapsed",False,False
eu18otj,t3_ce5njl,t1_eu0pfwi,CurlyJ2019,1,2019-07-17 06:24:26,/r/EDAnonymous/comments/ce5njl/my_office_had_a_weight_loss_contest/eu18otj/,That’s not expensive depending on where you live. SF/Bay area that’s actually pretty cheap :(,False,False
eu18j85,t3_ce5njl,t1_eu01fbv,CurlyJ2019,1,2019-07-17 06:23:17,/r/EDAnonymous/comments/ce5njl/my_office_had_a_weight_loss_contest/eu18j85/,"They are somewhat common in office jobs. I think it’s because if they reduce the number or percent of overweight/obese people, the insurance company lowers the premium, so the company hopes to save money overall. Also explains why many offer gym memberships or give x number of hours for exercise a week.",False,False
eu0vxte,t3_ce5njl,t1_eu0m4e9,Sal4Sale,1,2019-07-17 04:31:13,/r/EDAnonymous/comments/ce5njl/my_office_had_a_weight_loss_contest/eu0vxte/,EMS and firefighting. Won’t see my ass on no calendars,False,False
eu0pfwi,t3_ce5njl,t3_ce5njl,rachihc,1,2019-07-17 03:32:36,/r/EDAnonymous/comments/ce5njl/my_office_had_a_weight_loss_contest/eu0pfwi/,"1. What a fucke up competition is that for an office. 2. Wow, is rend that expensive?",False,False
eu0m4e9,t3_ce5njl,t1_etzd5eh,melindseyme,1,2019-07-17 03:05:23,/r/EDAnonymous/comments/ce5njl/my_office_had_a_weight_loss_contest/eu0m4e9/,What sort of work do you do?,False,False
eu0l5ac,t3_ce5njl,t3_ce5njl,aweebirb,1,2019-07-17 02:53:44,/r/EDAnonymous/comments/ce5njl/my_office_had_a_weight_loss_contest/eu0l5ac/,My office is having something like that (more of a log-your-healthy-meals than a weight loss contest) this month... I'm practicing showing restraint and not participating when friends ask me to join their team. 😬,False,False
eu0ezjw,t3_ce5njl,t3_ce5njl,throwawaybunnyrabbit,1,2019-07-17 02:01:41,/r/EDAnonymous/comments/ce5njl/my_office_had_a_weight_loss_contest/eu0ezjw/,"I saw another post like this a while ago- apparently this isnt even uncommon I guess? that's so fucked up that your job would have a contest like that. I dont blame you one bit, and I hope you're able to get back on track with recovery ♡",False,False
eu0a1r9,t3_ce5njl,t3_ce5njl,TheAdjunctTavore,1,2019-07-17 01:19:13,/r/EDAnonymous/comments/ce5njl/my_office_had_a_weight_loss_contest/eu0a1r9/,Damn. My work rewards people who lose a lot of weight too. I can't enter or I would have won that shit long ago.,False,False
eu08g6c,t3_ce5njl,t1_etzv81y,GhostGangGiGi,1,2019-07-17 01:06:05,/r/EDAnonymous/comments/ce5njl/my_office_had_a_weight_loss_contest/eu08g6c/,There a quite a few pretty overweight people but I don’t feel like it’s a disproportionate amount.,False,True
eu08cfd,t3_ce5njl,t1_etzz24p,GhostGangGiGi,1,2019-07-17 01:05:19,/r/EDAnonymous/comments/ce5njl/my_office_had_a_weight_loss_contest/eu08cfd/,Yup that’s the way our contest worked as well.,False,True
eu083aa,t3_ce5njl,t3_ce5njl,GhostGangGiGi,1,2019-07-17 01:03:10,/r/EDAnonymous/comments/ce5njl/my_office_had_a_weight_loss_contest/eu083aa/,I’m not sure it’s that common but my job is an office job for a local company.,False,True
eu07hjz,t3_ce5njl,t1_etzvvml,smashing_hashing,1,2019-07-17 00:58:15,/r/EDAnonymous/comments/ce5njl/my_office_had_a_weight_loss_contest/eu07hjz/,I really wish my work did this because I am already thinking about the strategies I would employ to manipulate my starting and ending weight.  Start with super hydrated intentional keto constipation and finish like Spongebob at the end of Schindler's List,False,False
eu06yh1,t3_ce5njl,t1_etz0gax,smashing_hashing,1,2019-07-17 00:53:59,/r/EDAnonymous/comments/ce5njl/my_office_had_a_weight_loss_contest/eu06yh1/,I would go so hard at that for such an amount. I don't blame you even a little.,False,False
eu032n2,t3_ce5njl,t3_ce5njl,sepidumb,1,2019-07-17 00:23:17,/r/EDAnonymous/comments/ce5njl/my_office_had_a_weight_loss_contest/eu032n2/,bruh,False,False
eu0216v,t3_ce5njl,t1_etzvvml,secretschuylersister,1,2019-07-17 00:15:33,/r/EDAnonymous/comments/ce5njl/my_office_had_a_weight_loss_contest/eu0216v/,this reminded me of the office too!,False,False
eu01fbv,t3_ce5njl,t3_ce5njl,_nocturnalvoid,1,2019-07-17 00:10:54,/r/EDAnonymous/comments/ce5njl/my_office_had_a_weight_loss_contest/eu01fbv/,"Sucks that you relapsed but I'm glad you got the money. Also, I'm young so I've never worked, but what kind of jobs have weight loss programs? Office jobs? Are they common?",False,False
eu01bgy,t3_ce5njl,t3_ce5njl,PurplePoogle,1,2019-07-17 00:10:04,/r/EDAnonymous/comments/ce5njl/my_office_had_a_weight_loss_contest/eu01bgy/,It do be like that  Really thought I'm sorry. I've done that. Not that much money at stake but I did do it and won and got some decent change. Kinda wanna do it again.,False,False
etzz24p,t3_ce5njl,t1_etzvvml,sabine_strohem_moss,1,2019-07-16 23:53:08,/r/EDAnonymous/comments/ce5njl/my_office_had_a_weight_loss_contest/etzz24p/,"My workplace does this too, and bases it on % of weight lost, not overall number of pounds.  We got gift certificates for exercising a specified number of hours, so that's usually what the underweight/normal weight people did.",False,False
etzwpfh,t3_ce5njl,t3_ce5njl,landfill7707,1,2019-07-16 23:36:25,/r/EDAnonymous/comments/ce5njl/my_office_had_a_weight_loss_contest/etzwpfh/,1. Are they hiring? 2. Is this a regular event??,False,False
etzvy5q,t3_ce5njl,t1_etzvvml,livipup,1,2019-07-16 23:31:01,/r/EDAnonymous/comments/ce5njl/my_office_had_a_weight_loss_contest/etzvy5q/,What was that from the office?,False,False
etzvvml,t3_ce5njl,t1_etzv81y,StarvingMuse,1,2019-07-16 23:30:30,/r/EDAnonymous/comments/ce5njl/my_office_had_a_weight_loss_contest/etzvvml/,"Right, like how is that fair to people already thin?  If you do not have much weight to lose, you cannot participate.  I know it's to encourage people to lose weight if they are heavy, but damn.  Reminds me of The Office when they had a contest and Kelly passed out.",False,False
etzv81y,t3_ce5njl,t3_ce5njl,livipup,1,2019-07-16 23:25:52,/r/EDAnonymous/comments/ce5njl/my_office_had_a_weight_loss_contest/etzv81y/,I feel that you must have a pretty unhealthy workplace if the higher-ups thought it was worthwhile to hold a contest to see who can lose the most weight. Were a lot of your coworkers obese or something? I feel like the workplace wouldn't have done something like this without good reason.,False,False
etzlooa,t3_ce5njl,t3_ce5njl,ri-ri,1,2019-07-16 22:18:08,/r/EDAnonymous/comments/ce5njl/my_office_had_a_weight_loss_contest/etzlooa/,Ugh my work would send me to counselling. Good job though,False,False
etzd5eh,t3_ce5njl,t3_ce5njl,Sal4Sale,1,2019-07-16 21:23:06,/r/EDAnonymous/comments/ce5njl/my_office_had_a_weight_loss_contest/etzd5eh/,"Fuck me if I relapsed at my work they’d fire me, kinda sick that they rewarded toxic habits",False,False
etzcidi,t3_ce5njl,t1_etz0gax,lilmissdisappearing,1,2019-07-16 21:18:59,/r/EDAnonymous/comments/ce5njl/my_office_had_a_weight_loss_contest/etzcidi/,What the fuck why can't my job do that  We just got an employee appreciation dinner at a Mexican restaurant fml,False,False
etzawl5,t3_ce5njl,t3_ce5njl,SalehRobbins,1,2019-07-16 21:08:18,/r/EDAnonymous/comments/ce5njl/my_office_had_a_weight_loss_contest/etzawl5/,"My normal brain: Having a weight loss contest is fucking stupid.   The voice: It just shows how much weight and appearance plays into how much you'll succeed and how much it matters to others. You'll never succeed if you don't ""diet.""",False,False
etz0gax,t3_ce5njl,t1_etyzu1h,GhostGangGiGi,1,2019-07-16 20:00:24,/r/EDAnonymous/comments/ce5njl/my_office_had_a_weight_loss_contest/etz0gax/,Like $700-800 after taxes but yea it was a pretty comfy check. 2nd place got $500 too I believe and third got $100.,False,True
etyzu1h,t3_ce5njl,t3_ce5njl,JuBelen,1,2019-07-16 19:56:16,/r/EDAnonymous/comments/ce5njl/my_office_had_a_weight_loss_contest/etyzu1h/,They had a what 😬😬😬😬 HOW MUCH NFKDKFFJDN,False,False
