Comment ID,Link ID,Parent ID,Author,Score,Publish Date,Permalink,Text,Stickied,Is Submitter
eb95jh4,t3_a3h3g4,t3_a3h3g4,squishyskeleton,1,2018-12-06 18:10:03,/r/EDAnonymous/comments/a3h3g4/sex_when_you_feel_like_a_fucking_fat_whale/eb95jh4/,"I’ve been having a hard time feeling “sexy”. Thanks to my ED, I feel so disgusting I can hardly stand to be naked. But it’s something I’m wanting to work on because intimacy is important. But it’s really difficult. I just feel so fat and ugly. I immediately want to hide in the biggest clothes when I see myself naked. ",False,False
eb88cqn,t3_a3h3g4,t1_eb652x2,birdsbirdsbirds339,1,2018-12-06 12:05:53,/r/EDAnonymous/comments/a3h3g4/sex_when_you_feel_like_a_fucking_fat_whale/eb88cqn/,I hate the sound of my tiddy slapping against each other. I feel like I should wrangle them apart,False,False
eb7c52u,t3_a3h3g4,t1_eb6g6pn,samema,1,2018-12-06 03:40:28,/r/EDAnonymous/comments/a3h3g4/sex_when_you_feel_like_a_fucking_fat_whale/eb7c52u/,It is,False,False
eb7aldp,t3_a3h3g4,t1_eb78u7m,taikutsuu,1,2018-12-06 02:59:02,/r/EDAnonymous/comments/a3h3g4/sex_when_you_feel_like_a_fucking_fat_whale/eb7aldp/,Big fucker. Hopefully not a fucker of you ever again.,False,False
eb79yqx,t3_a3h3g4,t3_a3h3g4,girlinamber,1,2018-12-06 02:41:17,/r/EDAnonymous/comments/a3h3g4/sex_when_you_feel_like_a_fucking_fat_whale/eb79yqx/,it's the absolute worst. im rarely ever on top anymore because all i can think about is my partner seeing my fifty chins and my horrible fluctu-fucked body from below. i've put on some weight in the past 7 months and it's even more extreme now than it was before. i get worried that he thinks im not interested sometimes,False,False
eb79wfd,t3_a3h3g4,t1_eb6w5yw,girlinamber,1,2018-12-06 02:39:31,/r/EDAnonymous/comments/a3h3g4/sex_when_you_feel_like_a_fucking_fat_whale/eb79wfd/,"jesus, are you me? i do this all the time. i always feel so embarassed",False,False
eb78u7m,t3_a3h3g4,t3_a3h3g4,here4thedietcoke,1,2018-12-06 02:09:36,/r/EDAnonymous/comments/a3h3g4/sex_when_you_feel_like_a_fucking_fat_whale/eb78u7m/,I was overweight (maybe obese by BMI) and dating this dude years ago who once off-handedly mentioned how unattractive the angle was when I was on top. It's never left my head.  Fucker.,False,False
eb75u98,t3_a3h3g4,t3_a3h3g4,princessvana,1,2018-12-06 00:51:01,/r/EDAnonymous/comments/a3h3g4/sex_when_you_feel_like_a_fucking_fat_whale/eb75u98/,"He’ll grab my tummy and it makes me want to die :( He doesn’t understand why  Last time we had sex I flipped to get on top of him and I was acutely aware of how fucking humongous I was. I like any position where I’m lying down because then I can pretend my body is just gone, being on top I just felt so on display. Never again :(",False,False
eb72n8o,t3_a3h3g4,t1_eb72ipy,rqrqsj,1,2018-12-05 23:41:45,/r/EDAnonymous/comments/a3h3g4/sex_when_you_feel_like_a_fucking_fat_whale/eb72n8o/,I’m so fucking sorry. That sounds really hard. ,False,False
eb72ipy,t3_a3h3g4,t3_a3h3g4,feelsomethinggg,1,2018-12-05 23:39:14,/r/EDAnonymous/comments/a3h3g4/sex_when_you_feel_like_a_fucking_fat_whale/eb72ipy/,"Dude same.  Crush begged to hang out for 2 weeks even after I flaked a bunch promising he was interested and didn't want just sex. Went on Sunday, ended up having sex (stupid i know) and haven't heard from him since. Fasting until I don't feel so much shame. ",False,False
eb71f6w,t3_a3h3g4,t1_eb67kjg,lilllyyy,1,2018-12-05 23:17:48,/r/EDAnonymous/comments/a3h3g4/sex_when_you_feel_like_a_fucking_fat_whale/eb71f6w/,me. I don’t even turn on lights to shower anymore. Only a dim light so I can see where the shampoo is 😂,False,False
eb6wikz,t3_a3h3g4,t3_a3h3g4,hamaesa,1,2018-12-05 21:53:18,/r/EDAnonymous/comments/a3h3g4/sex_when_you_feel_like_a_fucking_fat_whale/eb6wikz/,Soooo glad I'm asexual for this reason,False,False
eb6w5yw,t3_a3h3g4,t3_a3h3g4,buffalocoinz,1,2018-12-05 21:47:54,/r/EDAnonymous/comments/a3h3g4/sex_when_you_feel_like_a_fucking_fat_whale/eb6w5yw/,"In the dark, on the bottom, sucking in my gut, extending my neck, with my top still on. I just got really sad typing this :(",False,False
eb6qgkx,t3_a3h3g4,t1_eb67kjg,asheristrasher,1,2018-12-05 20:25:12,/r/EDAnonymous/comments/a3h3g4/sex_when_you_feel_like_a_fucking_fat_whale/eb6qgkx/,lol me my entire high school years,False,False
eb6qej1,t3_a3h3g4,t3_a3h3g4,asheristrasher,1,2018-12-05 20:24:26,/r/EDAnonymous/comments/a3h3g4/sex_when_you_feel_like_a_fucking_fat_whale/eb6qej1/,"yep. i have gender dysphoria + ednos and i'm in a relationship with a dude with body dysmorphia so we both have most of our clothes on during sex (in the dark). since i give him a lot of hickies and made him bleed once he calls me a vampire top lmao. but the whole body issue things really messes with our sex life. he always needs music playing (he says the sounds trigger him), and usually has his eyes closed. it probably seems strange to other people but i'm glad i fell in love with someone like him, because we understand and can accommodate for each other.",False,False
eb6luy7,t3_a3h3g4,t3_a3h3g4,fuckminicinabons,1,2018-12-05 19:20:50,/r/EDAnonymous/comments/a3h3g4/sex_when_you_feel_like_a_fucking_fat_whale/eb6luy7/,I haven’t had sex in so long bc of THIS. I hate it I hate it I’m 18 I should be enjoying the single life &amp; I can’t even do that lmao. ,False,False
eb6gko7,t3_a3h3g4,t3_a3h3g4,BoringSesameBun,1,2018-12-05 18:19:46,/r/EDAnonymous/comments/a3h3g4/sex_when_you_feel_like_a_fucking_fat_whale/eb6gko7/,When your legs are splayed apart and all you can see is cellulite/gross fat piled on the bed...  I hated it even when I was ten pounds thinner. I haven't had sex in over a year because of the weight gain.,False,False
eb6g6pn,t3_a3h3g4,t1_eb6co97,OkWorking7,1,2018-12-05 18:15:30,/r/EDAnonymous/comments/a3h3g4/sex_when_you_feel_like_a_fucking_fat_whale/eb6g6pn/,I've heard a few guys say the slapping noise is hot actually... ,False,False
eb6eb97,t3_a3h3g4,t3_a3h3g4,saltsplendasriracha,1,2018-12-05 17:55:37,/r/EDAnonymous/comments/a3h3g4/sex_when_you_feel_like_a_fucking_fat_whale/eb6eb97/,"Yeah, I think it’s common for us all to be self conscious of our bodies when we’re naked and being touched all over.  He likes when I’m in top, im just like close your dayum eyes",False,False
eb6d6e3,t3_a3h3g4,t3_a3h3g4,-FragileSunflower-,1,2018-12-05 17:43:00,/r/EDAnonymous/comments/a3h3g4/sex_when_you_feel_like_a_fucking_fat_whale/eb6d6e3/,The best thing is noticing progress while mid fuck ,False,False
eb6co97,t3_a3h3g4,t1_eb652x2,junkyard-josie,1,2018-12-05 17:37:21,/r/EDAnonymous/comments/a3h3g4/sex_when_you_feel_like_a_fucking_fat_whale/eb6co97/,"ugh this, I hate that slapping noise. Just my fat flapping against each other. I have to have sex with music or noise on. Can’t deal with the fat smacking sounds.",False,False
eb6arin,t3_a3h3g4,t3_a3h3g4,chorusabyss,1,2018-12-05 17:14:30,/r/EDAnonymous/comments/a3h3g4/sex_when_you_feel_like_a_fucking_fat_whale/eb6arin/,"me and my girlfriend are both in the ""hating our bodies boat"" for different reasons. we usually keep our shirts on, and weve made specific boundaries where were not okay being touched. it makes things a lot more comfortable. having a blanket/dim lighting helps too.",False,False
eb67kjg,t3_a3h3g4,t3_a3h3g4,Little_Bear716,1,2018-12-05 16:36:45,/r/EDAnonymous/comments/a3h3g4/sex_when_you_feel_like_a_fucking_fat_whale/eb67kjg/,I just don’t have sex and remain clothed until I must bathe. No on can see this train wreck lol,False,False
eb67fll,t3_a3h3g4,t3_a3h3g4,ChubbieToad,1,2018-12-05 16:35:05,/r/EDAnonymous/comments/a3h3g4/sex_when_you_feel_like_a_fucking_fat_whale/eb67fll/,I feel you here. I don't want to be on top anymore. The mirror is near the bed &amp; I'd rather die than have the lights on. Not exaggerating,False,False
eb652x2,t3_a3h3g4,t3_a3h3g4,creedbrattenberg,1,2018-12-05 16:06:50,/r/EDAnonymous/comments/a3h3g4/sex_when_you_feel_like_a_fucking_fat_whale/eb652x2/,Whenever there’s that slapping noise during sex all I think about it how it sounds like my thighs slapping against each other when I run down the stairs w no tights on,False,False
