Comment ID,Link ID,Parent ID,Author,Score,Publish Date,Permalink,Text,Stickied,Is Submitter
f6xr96b,t3_dt9zgh,t1_f6x20wj,EzraCelestine,1,2019-11-08 17:38:19,/r/EDAnonymous/comments/dt9zgh/i_dont_snack_anymore_so_i_lost_tons_of_weight/f6xr96b/,"And if you drink your own piss after smoking meth, you get a much more distilled version of it that's apparently like three times as strong",False,False
f6x20wj,t3_dt9zgh,t1_f6wqdhz,Duskyroses,1,2019-11-08 13:08:58,/r/EDAnonymous/comments/dt9zgh/i_dont_snack_anymore_so_i_lost_tons_of_weight/f6x20wj/,😏,False,False
f6wqpaj,t3_dt9zgh,t1_f6wl3pl,Lizten182,1,2019-11-08 11:04:54,/r/EDAnonymous/comments/dt9zgh/i_dont_snack_anymore_so_i_lost_tons_of_weight/f6wqpaj/,Meth works really well and if you don’t abuse it then it’s relatively safe. Taking it to not be hungry however is abuse your body requires food sadly,False,False
f6wqdhz,t3_dt9zgh,t1_f6vjdgv,Lizten182,1,2019-11-08 11:01:20,/r/EDAnonymous/comments/dt9zgh/i_dont_snack_anymore_so_i_lost_tons_of_weight/f6wqdhz/,Coke will make you less hungry but meth lasts longer more bang for the buck,False,False
f6wpq8s,t3_dt9zgh,t3_dt9zgh,loquaciouslucie,1,2019-11-08 10:54:26,/r/EDAnonymous/comments/dt9zgh/i_dont_snack_anymore_so_i_lost_tons_of_weight/f6wpq8s/,I usually just shut those convos down by saying “cool” or “that’s nice” and walking away. We’re not here to validate you.,False,False
f6wovpm,t3_dt9zgh,t1_f6wclqj,schnappi357,1,2019-11-08 10:45:22,/r/EDAnonymous/comments/dt9zgh/i_dont_snack_anymore_so_i_lost_tons_of_weight/f6wovpm/,"Ugh I totally feel you. I have a sedentary job, and I’m also very short so I basically have to eat nothing to lose weight. People bragging about cutting one thing out and losing tons of weight makes me want to rip my hair out",False,True
f6womxq,t3_dt9zgh,t1_f6vxu84,schnappi357,1,2019-11-08 10:42:44,/r/EDAnonymous/comments/dt9zgh/i_dont_snack_anymore_so_i_lost_tons_of_weight/f6womxq/,Nah don’t worry she is a trust fund baby,False,True
f6wl3pl,t3_dt9zgh,t1_f6w61r6,little-pinkie,1,2019-11-08 10:04:30,/r/EDAnonymous/comments/dt9zgh/i_dont_snack_anymore_so_i_lost_tons_of_weight/f6wl3pl/,"It’s not even affordable in the states either. Coke sucks too. The high doesn’t last it’s numbing and stimulating which sucks. Meth is cheap and it works like a charm only you’ll lose your sanity while tweaking and end up fried for ever. I’ll take being fat over addiction any day, only because you can work out and lose weight. You can’t ever get addiction off your back.",False,False
f6wclqj,t3_dt9zgh,t3_dt9zgh,stevieisbored,1,2019-11-08 08:27:05,/r/EDAnonymous/comments/dt9zgh/i_dont_snack_anymore_so_i_lost_tons_of_weight/f6wclqj/,"Oh man I freaking hate this. I had a bf who quit soda. Like literally that's it. And he lost so much weight so quickly people thought he had cancer. Meanwhile, I am always trying to lose weight and I'm still overweight. I don't even drink non-diet soda. I don't even drink calories, so it's not like I could repeat that process.  Also, being very short and having a sedentary job means even when I restrict pretty low it doesn't result in speedy weight loss because my body needs less calories to survive. Ugh.",False,False
f6w61r6,t3_dt9zgh,t3_dt9zgh,Jellygator0,1,2019-11-08 06:54:12,/r/EDAnonymous/comments/dt9zgh/i_dont_snack_anymore_so_i_lost_tons_of_weight/f6w61r6/,"YOOOO CAN I TELL YOU ALL A STORY...  So I tried to buy drugs online (coke specifically) because I was so desperate to lose weight and I fell for an actual freaking Nigerian Prince gift card scam. Like right up until he told me up scratch the code and send it to him over text so he could verify it I was legit believing him about how he'd been given fake notes before so now he only does gift cards for first time customers. Thank god I play steam games cause I've got $500 of steam gift cards in my room right now...the Australian drug market is so overpriced.  The lesson here is, coke is only affordable as a weight loss option in the States, and that I'm an over educated but under brain developed bulimic.",False,False
f6w4f2t,t3_dt9zgh,t1_f6vkgja,Duskyroses,1,2019-11-08 06:26:30,/r/EDAnonymous/comments/dt9zgh/i_dont_snack_anymore_so_i_lost_tons_of_weight/f6w4f2t/,For real? I was just trying to be funny I totally thought it was actually just Coca Cola 😮,False,False
f6vzavw,t3_dt9zgh,t1_f6vxu84,missyou2017,1,2019-11-08 04:30:20,/r/EDAnonymous/comments/dt9zgh/i_dont_snack_anymore_so_i_lost_tons_of_weight/f6vzavw/,Or food..,False,False
f6vxu84,t3_dt9zgh,t3_dt9zgh,hypomargoteros,1,2019-11-08 03:50:49,/r/EDAnonymous/comments/dt9zgh/i_dont_snack_anymore_so_i_lost_tons_of_weight/f6vxu84/,I've considered a coke addiction but it is a hell of a lot more expensive than cola light. She probably doesn't even have money to buy snacks,False,False
f6vxqn4,t3_dt9zgh,t1_f6vi6y3,crossdressingcarp,1,2019-11-08 03:48:07,/r/EDAnonymous/comments/dt9zgh/i_dont_snack_anymore_so_i_lost_tons_of_weight/f6vxqn4/,i automatically assumed coke meant diet coke and the possibility of it being cocaine didn’t even cross my mind until this comment..... 🥴,False,False
f6vtybe,t3_dt9zgh,t3_dt9zgh,rachihc,1,2019-11-08 02:08:21,/r/EDAnonymous/comments/dt9zgh/i_dont_snack_anymore_so_i_lost_tons_of_weight/f6vtybe/,"I would get tired and snap.  Like unless your snacks were 50% of her energy input, I would say us your coke addiction.",False,False
f6vkgja,t3_dt9zgh,t1_f6vi6y3,schnappi357,1,2019-11-07 22:56:25,/r/EDAnonymous/comments/dt9zgh/i_dont_snack_anymore_so_i_lost_tons_of_weight/f6vkgja/,Cocaine ...... 😂,False,True
f6vkfdh,t3_dt9zgh,t1_f6vi6y3,schnappi357,1,2019-11-07 22:55:53,/r/EDAnonymous/comments/dt9zgh/i_dont_snack_anymore_so_i_lost_tons_of_weight/f6vkfdh/,Cocaine..... 😂,False,True
f6vjdgv,t3_dt9zgh,t1_f6vj9jw,Duskyroses,1,2019-11-07 22:39:30,/r/EDAnonymous/comments/dt9zgh/i_dont_snack_anymore_so_i_lost_tons_of_weight/f6vjdgv/,Always checking for them weight loss secrets... you never know ;),False,False
f6vj9jw,t3_dt9zgh,t1_f6vi6y3,FlipperSeventeen,1,2019-11-07 22:37:58,/r/EDAnonymous/comments/dt9zgh/i_dont_snack_anymore_so_i_lost_tons_of_weight/f6vj9jw/,i think you know which one 😂😂,False,False
f6vi6y3,t3_dt9zgh,t3_dt9zgh,Duskyroses,1,2019-11-07 22:22:53,/r/EDAnonymous/comments/dt9zgh/i_dont_snack_anymore_so_i_lost_tons_of_weight/f6vi6y3/,Coke...as in Coca cola? Or coke ....as in cocaine? 😂,False,False
