Comment ID,Link ID,Parent ID,Author,Score,Publish Date,Permalink,Text,Stickied,Is Submitter
f33gp6q,t3_dcyt1d,t1_f2cywbd,insomni666,1,2019-10-09 11:24:36,/r/EDAnonymous/comments/dcyt1d/found_boyfriend_googling_mean_shit_about_me/f33gp6q/,How are you doing now? *hugs*,False,False
f2mckyb,t3_dcyt1d,t1_f2d91xr,here4thesadmemes,3,2019-10-05 14:34:46,/r/EDAnonymous/comments/dcyt1d/found_boyfriend_googling_mean_shit_about_me/f2mckyb/,"Exactly, just cut him off in whatever way you can so that when you’re feeling particularly low and vulnerable, you don’t have to worry about him pulling you back in. Lots of people struggle to emotionally detach from their abusers, especially when they’ve been going through some rough stuff. It doesn’t make you weak, just a person who has been through some shit and is currently in a relationship with an emotionally abusive piece of trash.",False,False
f2ici4m,t3_dcyt1d,t1_f2ea1fd,CosineMeSenpi,1,2019-10-05 01:01:20,/r/EDAnonymous/comments/dcyt1d/found_boyfriend_googling_mean_shit_about_me/f2ici4m/,"Wow, this is so painfully accurate - it totally makes sense, and is super heartbreaking to consider how little we value ourselves at times. 💔   Great insight though.   Also, concur that we collectively yeet him into the sun.",False,False
f2ffc4t,t3_dcyt1d,t3_dcyt1d,boring-unicorn,1,2019-10-04 14:18:33,/r/EDAnonymous/comments/dcyt1d/found_boyfriend_googling_mean_shit_about_me/f2ffc4t/,"Definitely get rid of him, he doesn't deserve anyone",False,False
f2f5q92,t3_dcyt1d,t3_dcyt1d,morose_adipose,1,2019-10-04 12:47:49,/r/EDAnonymous/comments/dcyt1d/found_boyfriend_googling_mean_shit_about_me/f2f5q92/,"I just got out of a really weird toxic and damaging relationship with someone I dated and then broke up with but still lived with as roommates for several years (yeah not at all recommended but anywho) who sounds a lot like this shit stick. First of all, I am SO PROUD of you for getting out of there. I stayed because my self worth was so fucking shit that I didn't get that he was emotionally abusive as fuck until I found someone who treats me right and values me for what I am, not what he can get from me. My mental health has improved so much just getting that toxic piece of shit out of my life. I hope you will find someone who values you for YOU bc man this guy sounds like he needs to sit on a bear trap and fuck right off outta this planet. But until then I'm so proud of you for valuing yourself enough to not take this guy's bullshit and leaving him. 💙",False,False
f2f5i5b,t3_dcyt1d,t3_dcyt1d,TessTobias,1,2019-10-04 12:45:16,/r/EDAnonymous/comments/dcyt1d/found_boyfriend_googling_mean_shit_about_me/f2f5i5b/,YOU DESERVE BETTER!! Please do not sell yourself short and allow this stupid shit to manipulate you!,False,False
f2eyuwa,t3_dcyt1d,t3_dcyt1d,Dovahkiin14,1,2019-10-04 11:31:40,/r/EDAnonymous/comments/dcyt1d/found_boyfriend_googling_mean_shit_about_me/f2eyuwa/,How could someone be so shitty. And probably transphobic as well. He seems like a horrible person and you deserve so much better. Someone that actually loves and supports you through this stuff instead of an asshole like this.,False,False
f2eodiz,t3_dcyt1d,t1_f2cywbd,aquaticmollusc,1,2019-10-04 09:47:46,/r/EDAnonymous/comments/dcyt1d/found_boyfriend_googling_mean_shit_about_me/f2eodiz/,We call this the Dakota Divorce.  You finish it by throwing his shit out on the lawn.,False,False
f2enwxt,t3_dcyt1d,t3_dcyt1d,thinfritatas,1,2019-10-04 09:42:33,/r/EDAnonymous/comments/dcyt1d/found_boyfriend_googling_mean_shit_about_me/f2enwxt/,"Ding ding, it's time to leave 🤷‍♀️ Sorry it happened, I dont think there is a need to confront him, just end the relationship and focus on yourself and feeling better",False,False
f2emy7o,t3_dcyt1d,t3_dcyt1d,yikesmonster505,1,2019-10-04 09:31:36,/r/EDAnonymous/comments/dcyt1d/found_boyfriend_googling_mean_shit_about_me/f2emy7o/,"Love from your partner should be someone who makes you love yourself more. I’m sorry this happened to you love, you beyond deserve someone who adores you and not treat you like this.",False,False
f2ej3jk,t3_dcyt1d,t3_dcyt1d,Kvltshroom,1,2019-10-04 08:44:53,/r/EDAnonymous/comments/dcyt1d/found_boyfriend_googling_mean_shit_about_me/f2ej3jk/,"Sending you lots of love, he's such a shitty person. On the up side you get to fly home and will probably never have to see this guy again. You're not dumb or stupid for wanting a relationship with him, you'll just be able to use this as a learning experience so next time (hopefully) you'll be out at the first red flag. I know it hurts man but I can tell you 100% that you'll be so much happier without him trying to attack your insecurities. He's such a fucking loser.",False,False
f2ego5g,t3_dcyt1d,t1_f2e12k1,_vindication,1,2019-10-04 08:12:32,/r/EDAnonymous/comments/dcyt1d/found_boyfriend_googling_mean_shit_about_me/f2ego5g/,Yup. This is actually what stopped me from getting implants that I had been planning to get for years. I'm still getting a lift but I watched a video alexandrasgirlytalk on YouTube made about it and then started reading about it online and it changed my whole opinion of implants. I'm a weak bitch who gets sick easily so I know it's not a good idea.,False,False
f2eg719,t3_dcyt1d,t3_dcyt1d,mayonezz,1,2019-10-04 08:05:51,/r/EDAnonymous/comments/dcyt1d/found_boyfriend_googling_mean_shit_about_me/f2eg719/,"Dump his ass, please and thank you.",False,False
f2eevgh,t3_dcyt1d,t1_f2cy1j7,RarityDerp,1,2019-10-04 07:46:33,/r/EDAnonymous/comments/dcyt1d/found_boyfriend_googling_mean_shit_about_me/f2eevgh/,"YOU ARE NOT A FOOL!  I stayed in an abusive relationship for a year before I left. He cheated on me, emotionally abused me, and FUELED my ED. He would tell me to loose weight.   When you are in a toxic relationship, it fucks with you and it makes it hard for you to leave.  Best of luck to you! Please check in with us when you are are free!",False,False
f2edr96,t3_dcyt1d,t3_dcyt1d,Aryma_Saga,1,2019-10-04 07:29:28,/r/EDAnonymous/comments/dcyt1d/found_boyfriend_googling_mean_shit_about_me/f2edr96/,just leave rthis post open in his pc and mobile and see how he react to it   report back to us ?,False,False
f2ed991,t3_dcyt1d,t1_f2dlmen,frostfromfire,1,2019-10-04 07:21:32,/r/EDAnonymous/comments/dcyt1d/found_boyfriend_googling_mean_shit_about_me/f2ed991/,"If it’s not something you really, really want for yourself, don’t do it!  I went from an A to small B cup all the way up to H because of breastfeeding; never wanted a big chest and I hate them so much.  If you think you have any sag now, the weight of bigger breasts makes them fall even lower.  Plus it’s super hard to exercise without your chest pulling/sliding all around (painful and makes sag worse).  Worst of all, if you love clothing, they make buying clothing a nightmare—those size XS clothes that used to fit now can’t stretch over your chest and you have to wear size M or L which is huge around the waist so even tees look like they need to be tailored.  Also, anyone that would rag on your body for any reason besides health and hygiene is *not* someone you want to be with.  I don’t know how you didn’t immediately respond with “if you want someone who looks like that, then I’m not the person you want to be with.”",False,False
f2ed14i,t3_dcyt1d,t1_f2dr5r6,Iammeandyouareme,1,2019-10-04 07:17:50,/r/EDAnonymous/comments/dcyt1d/found_boyfriend_googling_mean_shit_about_me/f2ed14i/,This is the type of passive aggressive that I love.,False,False
f2eakmk,t3_dcyt1d,t3_dcyt1d,scudderbuggy,1,2019-10-04 06:34:46,/r/EDAnonymous/comments/dcyt1d/found_boyfriend_googling_mean_shit_about_me/f2eakmk/,Oh god yeah leave that guy he sounds really awful? Esp about liking someone else and the green card thing?? How long have you been dating him?,False,False
f2eadxj,t3_dcyt1d,t3_dcyt1d,Rainbow_Bowser,1,2019-10-04 06:31:19,/r/EDAnonymous/comments/dcyt1d/found_boyfriend_googling_mean_shit_about_me/f2eadxj/,dump his ass,False,False
f2ea1fd,t3_dcyt1d,t1_f2dyd22,Sparklewhores,1,2019-10-04 06:24:46,/r/EDAnonymous/comments/dcyt1d/found_boyfriend_googling_mean_shit_about_me/f2ea1fd/,"We accept the love we think we deserve. I think it's very telling of people's self esteem - I don't mean this on a horrible way, just as a reason why there seems to be so many scummy boyfriends on here.    I agree though, he needs yeeting.",False,False
f2e9xzq,t3_dcyt1d,t1_f2dlmen,Sparklewhores,1,2019-10-04 06:22:54,/r/EDAnonymous/comments/dcyt1d/found_boyfriend_googling_mean_shit_about_me/f2e9xzq/,"I'm not saying whether to do it or not to do it, just think about if you want the procedure for YOU or for HIM. if all of your reasons revolved around ""for him"", then it's not a decision based on your wants.",False,False
f2e9jku,t3_dcyt1d,t1_f2d96js,thirteenoneseven,1,2019-10-04 06:15:06,/r/EDAnonymous/comments/dcyt1d/found_boyfriend_googling_mean_shit_about_me/f2e9jku/,I too am team “yeet that boi”,False,False
f2e9ebh,t3_dcyt1d,t3_dcyt1d,slavicshiba,1,2019-10-04 06:12:10,/r/EDAnonymous/comments/dcyt1d/found_boyfriend_googling_mean_shit_about_me/f2e9ebh/,"just from what i've read: you need to get out of this relationship because you're currently in an extremely vulnerable state. trust me, you don't need anymore thoughts that could batter your self-esteem while you're dealing with an eating disorder. i hope you figure this out soon, and find somebody who loves and cares for you: no matter what shape or size you come in. someone to help you get through times and changes like this. good luck! :)",False,False
f2e7kr5,t3_dcyt1d,t1_f2cywbd,unipigs_fly,1,2019-10-04 05:32:49,/r/EDAnonymous/comments/dcyt1d/found_boyfriend_googling_mean_shit_about_me/f2e7kr5/,Was about to comment “leave him” but I see I’m late to the party.       You deserve wayyy better.,False,False
f2e7b9h,t3_dcyt1d,t3_dcyt1d,unmellojello,1,2019-10-04 05:26:36,/r/EDAnonymous/comments/dcyt1d/found_boyfriend_googling_mean_shit_about_me/f2e7b9h/,🏃‍♀️💨   👦❌,False,False
f2e79dn,t3_dcyt1d,t3_dcyt1d,Annainchains000,1,2019-10-04 05:25:22,/r/EDAnonymous/comments/dcyt1d/found_boyfriend_googling_mean_shit_about_me/f2e79dn/,"Break up with that idiot before it's too late you don't need someone like that. People who focus only on what they get out of you without giving any consideration or compassion in reality while they might be kind to your face are cancer, you will only end up increasingly more hurt the longer you keep him around.",False,False
f2e78uz,t3_dcyt1d,t1_f2dr5r6,minor_details,1,2019-10-04 05:25:02,/r/EDAnonymous/comments/dcyt1d/found_boyfriend_googling_mean_shit_about_me/f2e78uz/,yessssss,False,False
f2e6ama,t3_dcyt1d,t1_f2dr5r6,heids7,1,2019-10-04 05:00:52,/r/EDAnonymous/comments/dcyt1d/found_boyfriend_googling_mean_shit_about_me/f2e6ama/,"I *emphatically* support this method, fuck yeah   OP, do this one ☝🏻",False,False
f2e6131,t3_dcyt1d,t3_dcyt1d,violetferns,1,2019-10-04 04:53:54,/r/EDAnonymous/comments/dcyt1d/found_boyfriend_googling_mean_shit_about_me/f2e6131/,"I hope you've booked your flight by now. This is so awful, fuck that asshole.",False,False
f2e3qxc,t3_dcyt1d,t3_dcyt1d,essieelf,1,2019-10-04 03:48:46,/r/EDAnonymous/comments/dcyt1d/found_boyfriend_googling_mean_shit_about_me/f2e3qxc/,"This is so heartbreaking OP. I can’t believe someone would treat you like that - especially the man who is supposed to love you. I hope you’re able to get out of this relationship as clearly it’s not healthy at all and he won’t change. You’re so strong, I wish you all the best with this 💕",False,False
f2e3oyi,t3_dcyt1d,t3_dcyt1d,mimibleu,1,2019-10-04 03:47:08,/r/EDAnonymous/comments/dcyt1d/found_boyfriend_googling_mean_shit_about_me/f2e3oyi/,"Get rid! Then just focus on yourself, give yourself some love! Nobody deserves that. As a 30yo I've been there too many times to count.  I've now found a lovely guy who is trying to fix all the damage done to me throughout the years and thinks I'm amazing. That's what you deserve. A man who thinks your are the best!",False,False
f2e1yff,t3_dcyt1d,t3_dcyt1d,SHybrid,1,2019-10-04 02:57:29,/r/EDAnonymous/comments/dcyt1d/found_boyfriend_googling_mean_shit_about_me/f2e1yff/,DUMP DUMP DUMP DUMP DUMP DUMP DUMP,False,False
f2e1aob,t3_dcyt1d,t3_dcyt1d,rachihc,1,2019-10-04 02:39:31,/r/EDAnonymous/comments/dcyt1d/found_boyfriend_googling_mean_shit_about_me/f2e1aob/,"While is wrong to check his history, I can totally understand why you did it if he is being like that. And now you know how awful he is to you.  DUMP his nasty ass girl, you deserve someone that loves you unconditionally,  someone that will love you and choose you no matter how you look now and in 40 years.    If I where you I will go back home and disappear him from your life, take advantage of the distance (if you have it)",False,False
f2e12k1,t3_dcyt1d,t1_f2dohda,CosineMeSenpi,1,2019-10-04 02:33:30,/r/EDAnonymous/comments/dcyt1d/found_boyfriend_googling_mean_shit_about_me/f2e12k1/,"You sound like a really awesome woman, and I know you say the good outweighs the bad (and I do believe you) but *please* understand it’s not simply some water balloons in your chest.   It’s a serious procedure, inserting a foreign body and expecting the body to heal around it correctly. Many women successfully have breast augmentation surgery, but I implore you to look up breast implant illness - it’s not 100% conclusively proven to be a ‘thing’, but the evidence is there. Women are having severe autoimmune reactions, wherein the body begins to attack itself **constantly** through inflammatory responses because of the breast implant.   It’s not guaranteed to happen by any means, but be careful with what you do to yourself in the name of love. Take care of yourself gorgeous!",False,False
f2e0ylh,t3_dcyt1d,t3_dcyt1d,excusemebro,1,2019-10-04 02:30:38,/r/EDAnonymous/comments/dcyt1d/found_boyfriend_googling_mean_shit_about_me/f2e0ylh/, Nobody deserves that. I don’t know you or what kind of person you are but nobody deserves to be in a relationship with someone who thinks of them that way. Dump that loser,False,False
f2e0ukq,t3_dcyt1d,t1_f2cykmy,CosineMeSenpi,1,2019-10-04 02:27:39,/r/EDAnonymous/comments/dcyt1d/found_boyfriend_googling_mean_shit_about_me/f2e0ukq/,"You’re not dumb at all, even if that’s how it feels - you were manipulated, used and you deserve so much better than this. Immeasurably so. I’m so sorry you’re going through this right now.   It’s wonderful that you’re taking the power back from him, because he doesn’t deserve to occupy even a nanogram of mental energy. Ever again.   Go on with your bad-ass self girl, eat cake, cry it out, take a long bath and take good care of yourself. 💕",False,False
f2e0ixx,t3_dcyt1d,t1_f2dapa1,MyWhatBigEyes,1,2019-10-04 02:19:09,/r/EDAnonymous/comments/dcyt1d/found_boyfriend_googling_mean_shit_about_me/f2e0ixx/,This would 100% be my move. It’s petty AF but this guy is an asshole and totally deserves it. Let his next google search be “where do girlfriends go when they leave?” because you’re about to ghost so hard you straight up evaporated.,False,False
f2dzno1,t3_dcyt1d,t3_dcyt1d,musictakeheraway,1,2019-10-04 01:57:18,/r/EDAnonymous/comments/dcyt1d/found_boyfriend_googling_mean_shit_about_me/f2dzno1/,he googles extremely weird shit. he can fuck off too ps,False,False
f2dz2ht,t3_dcyt1d,t3_dcyt1d,[deleted],1,2019-10-04 01:43:17,/r/EDAnonymous/comments/dcyt1d/found_boyfriend_googling_mean_shit_about_me/f2dz2ht/,[deleted],False,False
f2dyd5o,t3_dcyt1d,t3_dcyt1d,lasaucerouge,1,2019-10-04 01:27:07,/r/EDAnonymous/comments/dcyt1d/found_boyfriend_googling_mean_shit_about_me/f2dyd5o/,"The fuck??! Boy needs to grow some, and figure out what to do with his life by himself. You deserve way better than a shitty man child who can’t solve an issue without google. Screw him.",False,False
f2dyd22,t3_dcyt1d,t3_dcyt1d,MoveAlongIdiotz,1,2019-10-04 01:27:03,/r/EDAnonymous/comments/dcyt1d/found_boyfriend_googling_mean_shit_about_me/f2dyd22/,"Why does everyone in this sub have the absolute worst boyfriends.....  That aside, I hope you find someone better. That behavior is ridiculous and he doesn't even respect you as a human being.",False,False
f2dy07i,t3_dcyt1d,t3_dcyt1d,lizavcecil,1,2019-10-04 01:19:00,/r/EDAnonymous/comments/dcyt1d/found_boyfriend_googling_mean_shit_about_me/f2dy07i/,"Please please pease leave. These situations do not get better; his shitty behaviors will only worsen, and you might feel more obligated to stay with him as more time passes. I peeked at your post history and he seems to have a trend of shittiness. Just know you deserve much better",False,False
f2dxn3m,t3_dcyt1d,t3_dcyt1d,islea,1,2019-10-04 01:10:42,/r/EDAnonymous/comments/dcyt1d/found_boyfriend_googling_mean_shit_about_me/f2dxn3m/,what a fucking asshole. I’m so sorry that happened to you. you don’t deserve this. sending love ❤️ you can get through this,False,False
f2dvbve,t3_dcyt1d,t3_dcyt1d,dietcokehoe,2,2019-10-04 00:21:49,/r/EDAnonymous/comments/dcyt1d/found_boyfriend_googling_mean_shit_about_me/f2dvbve/,"The best revenge would be to contact ICE and have him be put on a red flag list. Good luck getting to America now, betch ;)",False,False
f2du1oq,t3_dcyt1d,t1_f2dqb4h,punkybrewster215,3,2019-10-03 23:57:06,/r/EDAnonymous/comments/dcyt1d/found_boyfriend_googling_mean_shit_about_me/f2du1oq/,"Thank you and I def agree but hear me out for a sec. His mom and sister have both had gastric bypass and breast implants (his sister was only 15 when she had those things done). My bf is a self proclaimed “ass guy” (as opposed to a boob guy) so I didn’t see it coming and I’m not sure that it’s a total deal breaker, since he’s.. definitely not UNhappy. It’s just confusing for me, as someone who as always fixated on being smaller in every sense, to be told they’re too small. I don’t focus on it, because frankly I’d rather live a shorter,  more confident life, than a long unsatisfied one. I probably make no sense. Don’t mind me🤦🏻‍♀️",False,False
f2dtoy1,t3_dcyt1d,t3_dcyt1d,ChixCzech,3,2019-10-03 23:50:33,/r/EDAnonymous/comments/dcyt1d/found_boyfriend_googling_mean_shit_about_me/f2dtoy1/,What a fucking prick. Walk out and never look back.,False,False
f2dt10z,t3_dcyt1d,t3_dcyt1d,futurelullaby,3,2019-10-03 23:38:34,/r/EDAnonymous/comments/dcyt1d/found_boyfriend_googling_mean_shit_about_me/f2dt10z/,Just leave. It won't get better.,False,False
f2dt042,t3_dcyt1d,t1_f2cywbd,i-destroy-me,5,2019-10-03 23:38:07,/r/EDAnonymous/comments/dcyt1d/found_boyfriend_googling_mean_shit_about_me/f2dt042/,I'm glad you're packing get the f out of there! Dump his disgusting ass!,False,False
f2dsv96,t3_dcyt1d,t3_dcyt1d,fourteencarrots,2,2019-10-03 23:35:46,/r/EDAnonymous/comments/dcyt1d/found_boyfriend_googling_mean_shit_about_me/f2dsv96/,dump him asap. he sounds like such a loser.,False,False
f2ds55r,t3_dcyt1d,t1_f2dnmx7,papercut-princess,9,2019-10-03 23:23:29,/r/EDAnonymous/comments/dcyt1d/found_boyfriend_googling_mean_shit_about_me/f2ds55r/,Your username is blessed too.    OP: grad you're getting out of there.,False,False
f2ds12e,t3_dcyt1d,t3_dcyt1d,macnsleaze,4,2019-10-03 23:21:39,/r/EDAnonymous/comments/dcyt1d/found_boyfriend_googling_mean_shit_about_me/f2ds12e/,"Fuuuuuuck that guy. Please don’t internalize his twisted standards. I lost a ton of weight last year, and now I have zero muscles and am kinda saggy-skinny and ‘soft.’ So everything he googled hits a nerve for me. I’m so sorry!  Whatever you do, do NOT keep him around. I can say with certainty that you are lovely and perfect as you are.",False,False
f2drbm4,t3_dcyt1d,t3_dcyt1d,CupOfCakes666,2,2019-10-03 23:10:27,/r/EDAnonymous/comments/dcyt1d/found_boyfriend_googling_mean_shit_about_me/f2drbm4/,"Shitty. Boyfriend. Ever!  I’m legit so angry for you,",False,False
f2dr6zb,t3_dcyt1d,t1_f2dohda,naomii_love,7,2019-10-03 23:08:26,/r/EDAnonymous/comments/dcyt1d/found_boyfriend_googling_mean_shit_about_me/f2dr6zb/,It probably won't stop with a boob job. Js,False,False
f2dr5r6,t3_dcyt1d,t1_f2cywbd,HappierHungry,19,2019-10-03 23:07:54,/r/EDAnonymous/comments/dcyt1d/found_boyfriend_googling_mean_shit_about_me/f2dr5r6/,"you could always type ""breaking up with boyfriend after finding out he's scum"" into Google and leave the search results open for him to find 🙃",False,False
f2dr2x8,t3_dcyt1d,t3_dcyt1d,naomii_love,3,2019-10-03 23:06:39,/r/EDAnonymous/comments/dcyt1d/found_boyfriend_googling_mean_shit_about_me/f2dr2x8/,"What the actual FUCK is wrong with him, i really really really suggest you break up with him, and I don't do this often. I'd call him a cunt but he has no depth ir warmth, I wonder what's going through his mind to make him think this is okay, he just sounds like a self absorbed and entitled bitch, wow",False,False
f2dqy6j,t3_dcyt1d,t3_dcyt1d,[deleted],1,2019-10-03 23:04:37,/r/EDAnonymous/comments/dcyt1d/found_boyfriend_googling_mean_shit_about_me/f2dqy6j/,[deleted],False,False
f2dqb4h,t3_dcyt1d,t1_f2dlmen,EmilyVS,8,2019-10-03 22:55:20,/r/EDAnonymous/comments/dcyt1d/found_boyfriend_googling_mean_shit_about_me/f2dqb4h/,"Girl... Cosmetic surgery, especially on such a central area, like the breasts, shouldn’t be taken lightly. There are a lot of risks that can come with it. I don’t know what the rest of your relationship is like, but a good significant other, in my opinion, wouldn’t put his girlfriend at such risk just so he can have something to look at. That is a massive red flag.",False,False
f2dq2np,t3_dcyt1d,t1_f2dapa1,Aphor1st,28,2019-10-03 22:52:06,/r/EDAnonymous/comments/dcyt1d/found_boyfriend_googling_mean_shit_about_me/f2dq2np/,I aspire to be this level of petty,False,False
f2dploa,t3_dcyt1d,t3_dcyt1d,Brief_Somewhere,7,2019-10-03 22:45:49,/r/EDAnonymous/comments/dcyt1d/found_boyfriend_googling_mean_shit_about_me/f2dploa/,"Dump him before he tries to use you. Dangerously. for citizen ship and then who knows what else. like usually i dont jump on the ""DUMP YOUR BF"" train but pls just go home with out him",False,False
f2dphat,t3_dcyt1d,t3_dcyt1d,TheShortGerman,7,2019-10-03 22:44:04,/r/EDAnonymous/comments/dcyt1d/found_boyfriend_googling_mean_shit_about_me/f2dphat/,"DUMP THAT DEADWEIGHT  INSTANT WEIGHT LOSS  ETA: I've heard that loose skin can tighten up a bit over time with a lil strength training and whatnot, skin is fairly elastic, so as long as you didn't lose more than like 50 lbs, don't worry about that nonsense.",False,False
f2dp7f6,t3_dcyt1d,t3_dcyt1d,stressedplant,5,2019-10-03 22:40:20,/r/EDAnonymous/comments/dcyt1d/found_boyfriend_googling_mean_shit_about_me/f2dp7f6/,time to pack your bags!!!! you deserve so much better than to be treated like that!,False,False
f2dohda,t3_dcyt1d,t1_f2dnv90,punkybrewster215,2,2019-10-03 22:30:41,/r/EDAnonymous/comments/dcyt1d/found_boyfriend_googling_mean_shit_about_me/f2dohda/,"Right, but the pros still outweigh the cons in my opinion. If a water balloon in each of my boobs with make him happy, I can deal with that. I pride myself on our connection and I’m not ready to let go based on a request for physical enhancement.   I’d never advise anyone to think the way I do, but it is what it is.",False,False
f2do5nf,t3_dcyt1d,t1_f2dnmfp,punkybrewster215,9,2019-10-03 22:26:16,/r/EDAnonymous/comments/dcyt1d/found_boyfriend_googling_mean_shit_about_me/f2do5nf/,"Dude I’ve thought about that so much. He’s losing his hair so if he really pisses me off, I have that card in my back pocket. I think it pisses him off how confident I am in my body, without the modifications that he’s used to seeing. It makes me feel powerful but now that I’m typing it out, I see how this is pretty fucked up lol",False,False
f2dnv90,t3_dcyt1d,t1_f2dlmen,OhNoOreos,7,2019-10-03 22:22:24,/r/EDAnonymous/comments/dcyt1d/found_boyfriend_googling_mean_shit_about_me/f2dnv90/,"Wow what a asshole, there are actual nice men out there that would never say such a thing.",False,False
f2dnoqq,t3_dcyt1d,t3_dcyt1d,OhNoOreos,6,2019-10-03 22:20:03,/r/EDAnonymous/comments/dcyt1d/found_boyfriend_googling_mean_shit_about_me/f2dnoqq/,"I'm so sorry OP, that is worst nightmare level. =(",False,False
f2dnmx7,t3_dcyt1d,t1_f2d78qy,g_bay,23,2019-10-03 22:19:20,/r/EDAnonymous/comments/dcyt1d/found_boyfriend_googling_mean_shit_about_me/f2dnmx7/,This comment is blessed ❤️❤️,False,False
f2dnmfp,t3_dcyt1d,t1_f2dlmen,PM_ME_YER_SHIBA_INUS,13,2019-10-03 22:19:09,/r/EDAnonymous/comments/dcyt1d/found_boyfriend_googling_mean_shit_about_me/f2dnmfp/,"Tell him you'll buy him penis enlargement surgery whenever he tells you that, and start describing the ""improvements"" you want. Might realize how shitty it feels to have your SO treat your body like a game of customizable build-a-bitch.",False,False
f2dne7l,t3_dcyt1d,t3_dcyt1d,judgejudystan,7,2019-10-03 22:16:01,/r/EDAnonymous/comments/dcyt1d/found_boyfriend_googling_mean_shit_about_me/f2dne7l/,"Damn, I don’t know what I was expecting when I opened this, but I didn’t expect to be full on pissed. Dump his ass girl. No one fucking deserves this.",False,False
f2dmm05,t3_dcyt1d,t3_dcyt1d,ShoopDaWhoopBurrito,5,2019-10-03 22:05:10,/r/EDAnonymous/comments/dcyt1d/found_boyfriend_googling_mean_shit_about_me/f2dmm05/,"Wow, fuck this shit. Don’t put up with him!",False,False
