Comment ID,Link ID,Parent ID,Author,Score,Publish Date,Permalink,Text,Stickied,Is Submitter
f8d7fs3,t3_e05grj,t1_f8c4zmz,couldbefatter,1,2019-11-22 21:42:50,/r/EDAnonymous/comments/e05grj/think_thin/f8d7fs3/,Ohhh ok I totally missed your point lol,False,False
f8d6qmx,t3_e05grj,t1_f8c4zmz,ohgodwhyjesus,1,2019-11-22 21:32:33,/r/EDAnonymous/comments/e05grj/think_thin/f8d6qmx/,just tHiNk tHiN sweaty,False,False
f8co3pz,t3_e05grj,t1_f8chmga,strawberrybubblegam,1,2019-11-22 17:18:45,/r/EDAnonymous/comments/e05grj/think_thin/f8co3pz/,that makes me even more angry! i don’t have enough brain cells to think!! /s,False,True
f8cmphc,t3_e05grj,t3_e05grj,romeodendron,1,2019-11-22 17:01:42,/r/EDAnonymous/comments/e05grj/think_thin/f8cmphc/,Totally agree,False,False
f8ci32u,t3_e05grj,t1_f8c5d4g,here4thesadmemes,1,2019-11-22 16:11:47,/r/EDAnonymous/comments/e05grj/think_thin/f8ci32u/,"It’s not super low calorie but it is pretty good and it makes me feel better about my eating habits because it’s “”healthy.”” Imo if I’m gonna have a protein bar or shake, it’d better have as much damn protein as they can shove in it, which is why I live for those premier protein shakes.",False,False
f8chmga,t3_e05grj,t3_e05grj,resistantbanana,1,2019-11-22 16:06:58,/r/EDAnonymous/comments/e05grj/think_thin/f8chmga/,"They recently rebranded, they’re no longer “Think Thin” but just “Think”",False,False
f8cdhvn,t3_e05grj,t3_e05grj,bleepbloophumanoid,1,2019-11-22 15:25:48,/r/EDAnonymous/comments/e05grj/think_thin/f8cdhvn/,"They’re good as meal replacement bars, especially if you weight lift. And they have vegan options. I have a whole box in my desk lol.",False,False
f8c5d4g,t3_e05grj,t1_f8c1cgx,strawberrybubblegam,1,2019-11-22 14:00:22,/r/EDAnonymous/comments/e05grj/think_thin/f8c5d4g/,ooo i only knew of the protein bars. now oatmeal i could get behind 🤠,False,True
f8c51f8,t3_e05grj,t1_f8bzz1m,strawberrybubblegam,1,2019-11-22 13:56:46,/r/EDAnonymous/comments/e05grj/think_thin/f8c51f8/,i always binge protein bars omg like entire boxes it just doesn’t work for me:(( i feel u bro,False,True
f8c4zmz,t3_e05grj,t1_f8c281v,strawberrybubblegam,1,2019-11-22 13:56:13,/r/EDAnonymous/comments/e05grj/think_thin/f8c4zmz/,"i have never tasted one so i’m not gonna pass judgement, and everyone’s got different ideas of what high calorie is (to me 150 would be wasted on a bar i’d eat really fast!). but the real issue for me is the name of the brand cuz diet culture sucks!",False,True
f8c281v,t3_e05grj,t3_e05grj,couldbefatter,1,2019-11-22 13:25:33,/r/EDAnonymous/comments/e05grj/think_thin/f8c281v/,My favorite protein bar is ThinkThin! They have a line of 150 cal bars which I don't consider high? The smores and vanilla cupcake are delicious!,False,False
f8c1cgx,t3_e05grj,t3_e05grj,here4thesadmemes,1,2019-11-22 13:15:50,/r/EDAnonymous/comments/e05grj/think_thin/f8c1cgx/,tbh i really like their protein/fiber oatmeal but YEAH for a brand called “think thin” their shit is high calorie,False,False
f8bzz1m,t3_e05grj,t3_e05grj,simplyskyla,1,2019-11-22 13:00:27,/r/EDAnonymous/comments/e05grj/think_thin/f8bzz1m/,"Right?! And on top of that their bars cause so much bloating, even the smaller 150 cal ones, because of all the sugar alcohol in it. I binged on like 3 of those once when I was craving sweets and I had the WORST stomach and intestinal bloating. Fuck that brand",False,False
