Comment ID,Link ID,Parent ID,Author,Score,Publish Date,Permalink,Text,Stickied,Is Submitter
el37v8b,t3_bdxjwe,t1_el37euo,dostoyefski,1,2019-04-17 04:24:17,/r/EDAnonymous/comments/bdxjwe/friendly_reminder_that_when_youre_fasting_your/el37v8b/,Yes thank you! I can never remember,False,False
el37euo,t3_bdxjwe,t1_el363zm,BEDBulimic,1,2019-04-17 04:11:21,/r/EDAnonymous/comments/bdxjwe/friendly_reminder_that_when_youre_fasting_your/el37euo/,(iirc it stands for “total daily energy expenditure”),False,False
el363zm,t3_bdxjwe,t1_el35yba,dostoyefski,1,2019-04-17 03:33:24,/r/EDAnonymous/comments/bdxjwe/friendly_reminder_that_when_youre_fasting_your/el363zm/,"I can’t remember what the acronym actually stands for but it’s basically how many calories you burn on the average day, i.e. how much you would need to eat to maintain",False,False
el35yba,t3_bdxjwe,t3_bdxjwe,hoarderline,1,2019-04-17 03:28:42,/r/EDAnonymous/comments/bdxjwe/friendly_reminder_that_when_youre_fasting_your/el35yba/,what's tdee?,False,False
el26sng,t3_bdxjwe,t3_bdxjwe,arabella_05,1,2019-04-16 18:26:32,/r/EDAnonymous/comments/bdxjwe/friendly_reminder_that_when_youre_fasting_your/el26sng/,"i love seeing little positive threads on this sub, i hope you're doing well bakedeggwhites. also may I say what a delicious diet friendly username, ugh egg white omelette with sea salt and paprika 🤤 it's the little things in life lmao",False,False
el1nqin,t3_bdxjwe,t1_el1nmq1,bakedeggwhites,1,2019-04-16 14:53:21,/r/EDAnonymous/comments/bdxjwe/friendly_reminder_that_when_youre_fasting_your/el1nqin/,I love you too petaldust 💕,False,True
el1nmq1,t3_bdxjwe,t3_bdxjwe,petaldust,1,2019-04-16 14:52:23,/r/EDAnonymous/comments/bdxjwe/friendly_reminder_that_when_youre_fasting_your/el1nmq1/,"i did and i love you. take care of yourself too, delicious baked egg whites.",False,False
