Comment ID,Link ID,Parent ID,Author,Score,Publish Date,Permalink,Text,Stickied,Is Submitter
eghvvpq,t3_9y998h,t3_9y998h,donwon61,1,2019-02-14 18:23:18,/r/EDAnonymous/comments/9y998h/tall_person_ed_problems/eghvvpq/,I worry  no sorry I think about it but try not to let it worry me anymore... you / I are not anyone else we are unique... ,False,False
ea3u4uo,t3_9y998h,t1_ea0n871,HolisticlyImprobable,1,2018-11-20 09:46:57,/r/EDAnonymous/comments/9y998h/tall_person_ed_problems/ea3u4uo/,"Nah that's not huge, 18.5 BMI is underweight so you're defo in the low end.",False,False
ea16wdk,t3_9y998h,t3_9y998h,coldbrewkweeen,1,2018-11-19 07:56:59,/r/EDAnonymous/comments/9y998h/tall_person_ed_problems/ea16wdk/,5’8 and I feel this. It used to bother me a lot that I’d never get get below 100 without being sickly thin (and honestly I don’t want that) but now I’m accepting that my body is mine and fuck all the voices that tell me I’m a fat failure.,False,False
ea0x2j4,t3_9y998h,t1_ea035op,Chunky-chunker,1,2018-11-19 03:28:04,/r/EDAnonymous/comments/9y998h/tall_person_ed_problems/ea0x2j4/,No I wouldn't say it's privileged at all hun! We're all lowkey here cause we're not happy with ourselves in some way or another. I'm just on the opposite side in regards to height. It's a classic saying we all want what we don't have xx  &amp;#x200B;,False,False
ea0s050,t3_9y998h,t3_9y998h,aleksndrars,1,2018-11-19 00:50:10,/r/EDAnonymous/comments/9y998h/tall_person_ed_problems/ea0s050/,Yes 😔 I'm 5'9.5,False,False
ea0oojn,t3_9y998h,t3_9y998h,pelicandreaming,1,2018-11-18 23:29:16,/r/EDAnonymous/comments/9y998h/tall_person_ed_problems/ea0oojn/,Yeah being tall and having a gw of 100 is risky business. I’m 5.11 and reached 100 and kept losing. Lowest I got was in the 90’s. Reaching that weight was great until I couldn’t walk more than a few hundred steps without having to lay down and barely being able to push open doors. Had a health scare that spooked me into putting on enough weight to be somewhat functioning as a human.,False,False
ea0n871,t3_9y998h,t3_9y998h,tseokii,1,2018-11-18 22:58:19,/r/EDAnonymous/comments/9y998h/tall_person_ed_problems/ea0n871/,yep. there's that thing where people say girls over 130 are gross/unfuckable. guess who is over 130 lbs? i'm like a bmi of 19-20 though... that's not huge... right? i don't even know anymore ,False,False
ea0lqx1,t3_9y998h,t3_9y998h,PearNecessities,1,2018-11-18 22:29:14,/r/EDAnonymous/comments/9y998h/tall_person_ed_problems/ea0lqx1/,5’8 woman here. Don’t compare your weight to shorter people’s if at all possible. ,False,False
ea09zcn,t3_9y998h,t3_9y998h,douche-chills,1,2018-11-18 19:22:48,/r/EDAnonymous/comments/9y998h/tall_person_ed_problems/ea09zcn/,"i feel this 100%, im far enough away from my first gw anyway, and even that is 130 (i’m 5’11, 142lbs) it makes me sad that i will never probably even get down to 120, let alone like 100 because i for real would prob be dead ",False,False
ea0725s,t3_9y998h,t3_9y998h,MellowMelly,2,2018-11-18 18:36:20,/r/EDAnonymous/comments/9y998h/tall_person_ed_problems/ea0725s/,"100 lbs is a magical number because of the measuring unit. I'm glad I use kilograms. 45,4 kilograms don't sound like a Milestone number 😅",False,False
ea035op,t3_9y998h,t1_e9zyhgr,249947,1,2018-11-18 17:37:38,/r/EDAnonymous/comments/9y998h/tall_person_ed_problems/ea035op/,"Thank you for your insight, I appreciate it. There are most definitely ups and downs of being any height, and being tall is generally seen as a desirable trait. I’m glad that I’m tall, it helps my passing as a trans guy and allows me to be a little more lenient with my calories. Despite this I still wish I was shorter, and I know that’s a privileged thing to think.",False,True
ea01djy,t3_9y998h,t1_ea01cnx,Bot_Metric,1,2018-11-18 17:11:52,/r/EDAnonymous/comments/9y998h/tall_person_ed_problems/ea01djy/,"100.0 lbs ≈ 45.4 kilograms ^(1 pound ≈ 0.45kg)    ^(I'm a bot. Downvote to remove.)   _____    ^| ^[Info](https://www.reddit.com/user/Bot_Metric/comments/8lt7af/i_am_a_bot/) ^| ^[PM](https://www.reddit.com/message/compose?to=Ttime5) ^| ^[Stats](http://botmetric.pythonanywhere.com) ^| ^[Opt-out](https://www.reddit.com/message/compose?to=Bot_Metric&amp;subject=Don't%20reply%20to%20me&amp;message=If%20you%20send%20this%20message,%20I%20will%20no%20longer%20reply%20to%20your%20comments%20and%20posts.) ^| ^[v.4.4.6](https://www.reddit.com/user/Bot_Metric/comments/8o9vgz/updates/) ^|",False,False
ea01cnx,t3_9y998h,t3_9y998h,SuicidalSuccubus,1,2018-11-18 17:11:30,/r/EDAnonymous/comments/9y998h/tall_person_ed_problems/ea01cnx/,I feel this. I'm half an inch shy of six feet. I was always so jealous of the posts on proED of scales showing 99 or less. If I tried to get under 100 lbs I'd probably die lol,False,False
e9zyhgr,t3_9y998h,t3_9y998h,Chunky-chunker,1,2018-11-18 16:30:49,/r/EDAnonymous/comments/9y998h/tall_person_ed_problems/e9zyhgr/,"Honestly I'm not the shortest of the shorts but I'm 5ft 3. I wish I was taller even just 5ft 4.  The main reason is I feel bc of my height even if I ""recover "" for me to stay slim / healthy I could only ever eat 1300 for maintence.  Even with exercise my genes naturally pack on weight (thanks past famine impacted relatives lmao glad u survives tho Ty)  I do have to follow a fairly low sugar / carb diet too as again my body is sensitive and I grow.   On most days even if I exercise I would consider maintence 1000 and don't ever reach that unless I've binged  The smaller I want to get too the less that number gets.  Sure I can be 50kg and considered healthy bmi but to ever get slim or to my goal (48-45kg)  I literally would probably maintain on 800 or something absurd meaning if I ever want to eat I will have to make up for it with restriction,  excess exercerise or in my weak moments not keep it down and how anxiety purges.    Take being taller as a gift. The number does matter but the long term eating and how your body looks carrying weight is always an envy I've had towards tall / taller people  At least,  I can wear large platforms and heels without being a skyscraper - the only benefit I've noticed about being short thus far. ",False,False
e9zxiau,t3_9y998h,t1_e9zo8u9,JayLenoBlows,1,2018-11-18 16:17:06,/r/EDAnonymous/comments/9y998h/tall_person_ed_problems/e9zxiau/,We’re almost identical stats and Jesus Christ nothing ever fits. ,False,False
e9zx1wv,t3_9y998h,t3_9y998h,Bomby57,1,2018-11-18 16:10:41,/r/EDAnonymous/comments/9y998h/tall_person_ed_problems/e9zx1wv/,Short people have other kinds of problems like that time I actually got muscle sprains when trying to reach the upper part of my wardrobe 😅 there is no win with height as a girl... ,False,False
e9zs62h,t3_9y998h,t3_9y998h,_Spicy_Lemon_,1,2018-11-18 15:06:28,/r/EDAnonymous/comments/9y998h/tall_person_ed_problems/e9zs62h/,Honestly I wish I was a couple inches taller so I could have an excuse to weigh more naturally. Even at 5'6 (literally so close to 5'7) I feel like getting to 100 would be to rough. (I've seen plenty of stats were they are that low though)...,False,False
e9zowmv,t3_9y998h,t1_e9zo8u9,249947,1,2018-11-18 14:30:52,/r/EDAnonymous/comments/9y998h/tall_person_ed_problems/e9zowmv/,YES I’ve resigned to living the baggy shirt life™,False,True
e9zobhe,t3_9y998h,t1_e9znspk,249947,1,2018-11-18 14:24:58,/r/EDAnonymous/comments/9y998h/tall_person_ed_problems/e9zobhe/,"Thanks for the reply, made me laugh. I’m trying to think positively like that more often!!",False,True
e9zo8u9,t3_9y998h,t3_9y998h,Hairless_Human,1,2018-11-18 14:24:12,/r/EDAnonymous/comments/9y998h/tall_person_ed_problems/e9zo8u9/,"Yes I hate it im 6ft and 125lbs thats a BMI of 16.3. It also really sucks being tall cause large shirts fit me length wise but width wise they are absolutely massive. If I buy a brand new XS shirt I fit length and width wise but as soon as I wash it, it turns into a crop top lmao. And well crop tops don't really belong on dudes.",False,False
e9znspk,t3_9y998h,t3_9y998h,PoorLama,1,2018-11-18 14:19:38,/r/EDAnonymous/comments/9y998h/tall_person_ed_problems/e9znspk/,"Don't feel ashamed. I definitely understand, I'm 6ft so it can definitely be stressful to see a higher number on the scale. I always tell myself that I have a lot more surface area so of course I'm going to weigh more.    My 5'2 friend told me I weighed a lot and I was just like, no shit, I have nearly an entire extra foot of bone, organ, blood, and muscle. ",False,False
