Comment ID,Link ID,Parent ID,Author,Score,Publish Date,Permalink,Text,Stickied,Is Submitter
ex2tcwh,t3_cr44jo,t3_cr44jo,peachsy,1,2019-08-16 12:03:02,/r/EDAnonymous/comments/cr44jo/my_bmi_is_higher_than_i_thought/ex2tcwh/,"I have been told lately I am getting too skinny, yet my BMI is 21.9 ,, forgive me while I continue to whither away",False,False
ex2pyb8,t3_cr44jo,t3_cr44jo,tofu_snob,1,2019-08-16 11:37:07,/r/EDAnonymous/comments/cr44jo/my_bmi_is_higher_than_i_thought/ex2pyb8/,"For what its worth, ethnicity and activity level are not factors used to calculate BMI. BMI tells a very limited and often misleading story. I know for damn sure that my body is in full shut-down mode when I'm around BMI 20 (due to muscle mass and various other reasons). I understand your thoughts toward it, but try to take it with a grain of salt.",False,False
ex2kmis,t3_cr44jo,t1_ex21k6g,littlesmol,1,2019-08-16 10:57:38,/r/EDAnonymous/comments/cr44jo/my_bmi_is_higher_than_i_thought/ex2kmis/,Haha oof I wish it had told me that. Instead it told me I need to lose weight. Gotta love those binge cycles 🥴,False,False
ex2izu8,t3_cr44jo,t3_cr44jo,livipup,1,2019-08-16 10:44:35,/r/EDAnonymous/comments/cr44jo/my_bmi_is_higher_than_i_thought/ex2izu8/," [Meme](https://imgur.com/a/mW0HYgL)   This is the only place I've ever seen this kind of BMI calculation, but I am also partial to trusting NHS so I'm not sure what to make of this. I would say that you should just stick to the regular way people check BMI unless this eventually becomes standard.",False,False
ex2bmkx,t3_cr44jo,t3_cr44jo,i_am_the_melon_lord,1,2019-08-16 09:40:37,/r/EDAnonymous/comments/cr44jo/my_bmi_is_higher_than_i_thought/ex2bmkx/,"Yo, literally the same! I felt that Ive gained weight, but I wasnt near a scale for a while. Yesterday I was finally able to do it, and my bmi is 19,8 today... i need to lose too. I am not that surprised, because i know i have gained. But knowing the actual number made think.",False,False
ex21uhi,t3_cr44jo,t1_ex21plp,rachihc,1,2019-08-16 08:10:31,/r/EDAnonymous/comments/cr44jo/my_bmi_is_higher_than_i_thought/ex21uhi/,"jaja they they are the ones doing the warning too late, no worries.",False,False
ex21plp,t3_cr44jo,t1_ex21k6g,hanhansal,1,2019-08-16 08:09:09,/r/EDAnonymous/comments/cr44jo/my_bmi_is_higher_than_i_thought/ex21plp/,Lmaoooo I laughed out loud. I didn't notice that! Sorry everyone,False,True
ex21k6g,t3_cr44jo,t3_cr44jo,rachihc,1,2019-08-16 08:07:40,/r/EDAnonymous/comments/cr44jo/my_bmi_is_higher_than_i_thought/ex21k6g/,"When given the result :   ""If you are receiving treatment for an eating disorder then this tool is NOT to be used.""    Too late dumbass you already  have been used.",False,False
ex1unge,t3_cr44jo,t3_cr44jo,-YoureJustADeadDude,1,2019-08-16 06:51:50,/r/EDAnonymous/comments/cr44jo/my_bmi_is_higher_than_i_thought/ex1unge/,Shit. I just used the same calculator and I’m also in the healthy spectrum. Gotta lose about 3kg more :(,False,False
