Comment ID,Link ID,Parent ID,Author,Score,Publish Date,Permalink,Text,Stickied,Is Submitter
endcadk,t3_bnvdit,t3_bnvdit,MidwestSkinnyCow,1,2019-05-13 15:53:19,/r/EDAnonymous/comments/bnvdit/im_in_trader_joes/endcadk/,$8 a pint???   Damn &amp; to think I'm bitching about $3-5 a pint. I won't buy em unless they're at the shady fruit Mart for $1 a pint.,False,False
enc7eq5,t3_bnvdit,t1_ena1hyo,kitterfly,1,2019-05-13 10:41:04,/r/EDAnonymous/comments/bnvdit/im_in_trader_joes/enc7eq5/,im also on the frozen berries train! I make them into smoothies/ smoothie bowls with some almond milk or açai bowls if i'm feeling really fancy and it's really satisfying and tasty,False,False
enbmt6j,t3_bnvdit,t1_enaxt1s,bluelanced,1,2019-05-13 07:35:23,/r/EDAnonymous/comments/bnvdit/im_in_trader_joes/enbmt6j/,ayyyyyyyy,False,False
enaxt1s,t3_bnvdit,t1_enafj0h,FowWithSocks,1,2019-05-13 02:13:06,/r/EDAnonymous/comments/bnvdit/im_in_trader_joes/enaxt1s/,I’m sure they’ll *finger guns* cashew later.,False,False
enanfa7,t3_bnvdit,t1_en9rugf,NuclearSpark,1,2019-05-13 00:11:13,/r/EDAnonymous/comments/bnvdit/im_in_trader_joes/enanfa7/,I never buy cashews anymore. Honey roasted nuts are my JAM but honestly my one legit fear food. Everything else I can do in moderation (or bp lmao) but nuts OMFG. A pain to bp and a handful is like 400 cal and non-filling.,False,False
enafj0h,t3_bnvdit,t1_en9rugf,bluelanced,1,2019-05-12 22:50:24,/r/EDAnonymous/comments/bnvdit/im_in_trader_joes/enafj0h/,GOD i miss cashews they scare me too,False,False
ena1hyo,t3_bnvdit,t3_bnvdit,laisserai,1,2019-05-12 20:51:11,/r/EDAnonymous/comments/bnvdit/im_in_trader_joes/ena1hyo/,Bousberries and raspberries are so expensive here too :(   At one point cherries were $11 per lb!   I buy frozen berries bc it's so much cheaper,False,False
en9rugf,t3_bnvdit,t3_bnvdit,dumbfeels,3,2019-05-12 19:25:55,/r/EDAnonymous/comments/bnvdit/im_in_trader_joes/en9rugf/,Holy FUCK a box of blueberries is like $3 at the most here!! im sorry that's so grossly exorbitant wtf :(   I cried at CVS today re: nuts so i feel you on the public weeping lmao. Cashews were on sale but they're way too scary?? Why.,False,False
