Comment ID,Link ID,Parent ID,Author,Score,Publish Date,Permalink,Text,Stickied,Is Submitter
ec5lmdz,t3_a7qgcm,t3_a7qgcm,drugstore-diet,1,2018-12-19 20:37:02,/r/EDAnonymous/comments/a7qgcm/fuck_pizza/ec5lmdz/,My work had a holiday party last night and I got drunk and ate basically an entire pizza in front of everybody. solidarity my friend,False,False
ec55f30,t3_a7qgcm,t1_ec4xm5f,Yeet666boi,1,2018-12-19 16:35:51,/r/EDAnonymous/comments/a7qgcm/fuck_pizza/ec55f30/,Like a dog. You're a dog. Just inhale everything in sight.,False,False
ec4y9vf,t3_a7qgcm,t1_ec4xvf9,WITCH79,1,2018-12-19 15:03:52,/r/EDAnonymous/comments/a7qgcm/fuck_pizza/ec4y9vf/,They def aren’t staring it does feel like it tho :),False,False
ec4xvf9,t3_a7qgcm,t1_ec4xm5f,aliensdid9ll,1,2018-12-19 14:58:49,/r/EDAnonymous/comments/a7qgcm/fuck_pizza/ec4xvf9/,i always get worried people are just staring at me while I’m eating :( i feel u ,False,True
ec4xm5f,t3_a7qgcm,t3_a7qgcm,WITCH79,1,2018-12-19 14:55:31,/r/EDAnonymous/comments/a7qgcm/fuck_pizza/ec4xm5f/,Ugh pizza sucks I binged in front of my class once because my prof brought in 4 boxes... I don’t think anyone noticed I had 5 slices but at the time I was sure everyone was staring at me shoveling it down... half a damn pizza,False,False
