Comment ID,Link ID,Parent ID,Author,Score,Publish Date,Permalink,Text,Stickied,Is Submitter
epp5ad2,t3_bvfyv4,t1_epoxtmn,tornessa,1,2019-05-31 23:48:34,/r/EDAnonymous/comments/bvfyv4/whats_something_other_than_food_i_can_deprive/epp5ad2/,"Yes, caffeine would be a good one!",False,True
epp59w5,t3_bvfyv4,t1_epp4okh,tornessa,1,2019-05-31 23:48:18,/r/EDAnonymous/comments/bvfyv4/whats_something_other_than_food_i_can_deprive/epp59w5/,Ha! I gave up sex a few weeks ago.,False,True
epp4okh,t3_bvfyv4,t3_bvfyv4,snefferu,1,2019-05-31 23:37:04,/r/EDAnonymous/comments/bvfyv4/whats_something_other_than_food_i_can_deprive/epp4okh/,"Sex and masturbation? I’ve heard people rave about it and claim physical and spiritual benefits... not sure I buy into it but you could try, seems like a safer option than food restriction!",False,False
epoz7ob,t3_bvfyv4,t3_bvfyv4,secretsofacat,1,2019-05-31 22:04:54,/r/EDAnonymous/comments/bvfyv4/whats_something_other_than_food_i_can_deprive/epoz7ob/,"Do you swear a lot? You could restrict from cussing.   Or if you have any anxiety habits like biting your nails or lips, you could try giving up those!",False,False
epoxtmn,t3_bvfyv4,t3_bvfyv4,cocochaichai,1,2019-05-31 21:43:11,/r/EDAnonymous/comments/bvfyv4/whats_something_other_than_food_i_can_deprive/epoxtmn/,"I totally get what you mean, maybe caffeine? I know a lot of people on here have quite an addiction to it myself included",False,False
