Comment ID,Link ID,Parent ID,Author,Score,Publish Date,Permalink,Text,Stickied,Is Submitter
efr70h3,t3_amzg4e,t1_efr5lbp,kittenbun,1,2019-02-04 16:22:14,/r/EDAnonymous/comments/amzg4e/dae_get_on_the_scales_510x_til_they_see_a_number/efr70h3/,ME TOO LOL,False,True
efr5lbp,t3_amzg4e,t3_amzg4e,_Jelly_King_,1,2019-02-04 16:05:06,/r/EDAnonymous/comments/amzg4e/dae_get_on_the_scales_510x_til_they_see_a_number/efr5lbp/,"I’ll move it to different parts of the floor, hoping it’ll be lower somewhere else. ",False,False
efqjnrc,t3_amzg4e,t3_amzg4e,relapseandrecovery,1,2019-02-04 11:46:45,/r/EDAnonymous/comments/amzg4e/dae_get_on_the_scales_510x_til_they_see_a_number/efqjnrc/,This is why I can't have a scale. I'll spend hours a day just retrying on different surfaces and at different times,False,False
efptbas,t3_amzg4e,t1_efpt8lw,bullymeahhh,1,2019-02-04 04:14:38,/r/EDAnonymous/comments/amzg4e/dae_get_on_the_scales_510x_til_they_see_a_number/efptbas/,"Umm sorry i dont remember what its called. It also gives a body fat percentage estimate which is cool tho. If youre anything like me, i wasnt byying anything more than like 15. I bought this one finally for 40, and now when i step on even 15-20 times in a row, it gives me the same number. ",False,False
efpt8lw,t3_amzg4e,t1_efpt5ki,kittenbun,1,2019-02-04 04:12:15,/r/EDAnonymous/comments/amzg4e/dae_get_on_the_scales_510x_til_they_see_a_number/efpt8lw/,oooh what kind of scale did you get? we have digital ones and you'd think they'd be hyper accurate but they are so temperamental and some days you get like 3 different readings sighhh,False,True
efpt5ki,t3_amzg4e,t3_amzg4e,bullymeahhh,1,2019-02-04 04:09:34,/r/EDAnonymous/comments/amzg4e/dae_get_on_the_scales_510x_til_they_see_a_number/efpt5ki/,Lol yes but i invested a bought a more expensive scale that gives more consistent weight numbers,False,False
