Comment ID,Link ID,Parent ID,Author,Score,Publish Date,Permalink,Text,Stickied,Is Submitter
ez9bm6i,t3_d08nvv,t3_d08nvv,StressedCookie,1,2019-09-06 08:58:32,/r/EDAnonymous/comments/d08nvv/fasted_for_52_hrs/ez9bm6i/,My dad heated some mac and cheese for me. He's rarely at home so I felt guilty for not eating it.,False,False
ez90qjn,t3_d08nvv,t3_d08nvv,1YearWonder,1,2019-09-06 06:23:31,/r/EDAnonymous/comments/d08nvv/fasted_for_52_hrs/ez90qjn/,"Big ooof. I relate.   I'm on day three right now, and am being threatened by a half eaten piece of cold toast my partner left on the counter. I don't want it but it's all I can think about.   There's not even any reason for this fast, I can 'afford' to eat that toast if I want. There's no need for this anxiety. Damn brain.",False,False
ez8jlny,t3_d08nvv,t3_d08nvv,horehoundtea,1,2019-09-05 23:52:40,/r/EDAnonymous/comments/d08nvv/fasted_for_52_hrs/ez8jlny/,the worst is when you break a fast to eat something to help you not faint and your ed still has the audacity to make you feel guilty about that,False,False
ez89gu0,t3_d08nvv,t1_ez81ohj,SkinnyMochi,1,2019-09-05 21:37:12,/r/EDAnonymous/comments/d08nvv/fasted_for_52_hrs/ez89gu0/,"Definitely! Not having the calorie information sucks and I either fast to make up for it or say screw it and eat whatever I want cause just the one meal is probably over my goal intake anyways.  And thank you! But no, I just thought it sounded cute haha 😅",False,False
ez81ohj,t3_d08nvv,t1_ez7xdq5,Thunder_B1rd,3,2019-09-05 20:08:36,/r/EDAnonymous/comments/d08nvv/fasted_for_52_hrs/ez81ohj/,"I feel you! It sucks because I want to eat and enjoy it but it’s so scary consuming something with unknown calories.   On an unrelated note: I love your username, fellow ARMY?",False,True
ez7xdq5,t3_d08nvv,t3_d08nvv,SkinnyMochi,5,2019-09-05 19:29:19,/r/EDAnonymous/comments/d08nvv/fasted_for_52_hrs/ez7xdq5/,Glad to know I’m not the only one. A few weeks ago I fasted for 3 days just so I could have lunch with my mom and then it didn’t even happen. I was somehow relieved and pissed off at the same time.,False,False
