Comment ID,Link ID,Parent ID,Author,Score,Publish Date,Permalink,Text,Stickied,Is Submitter
eik9m9s,t3_b0h4d0,t1_eiienl1,CastleInTheAttic,1,2019-03-14 22:06:01,/r/EDAnonymous/comments/b0h4d0/any_other_poc/eik9m9s/,I spent so much time trying to distance myself from my culture/heritage but now that I’ve moved to a place where I don’t have it I kind of miss it Homesick I guess,False,False
eiienl1,t3_b0h4d0,t1_eiie96o,super_throwaway_8118,1,2019-03-14 09:20:23,/r/EDAnonymous/comments/b0h4d0/any_other_poc/eiienl1/,Why does it make you sad?,False,True
eiie96o,t3_b0h4d0,t1_eiidd8r,CastleInTheAttic,1,2019-03-14 09:15:44,/r/EDAnonymous/comments/b0h4d0/any_other_poc/eiie96o/,I moved to the lower 48 this year and everyone assumes I’m either half Japanese or one of those “I’m .00000001% native” people Which I would have loved when I was younger but now it just makes me kinda sad,False,False
eiidd8r,t3_b0h4d0,t1_eiid7ps,super_throwaway_8118,1,2019-03-14 09:05:02,/r/EDAnonymous/comments/b0h4d0/any_other_poc/eiidd8r/,"That’s an interesting perspective. I feel like there’s a balance, or fine line between acting white and trying to avoid racial stereotypes that’s kind of a lose-lose scenario.",False,True
eiid7ps,t3_b0h4d0,t3_b0h4d0,CastleInTheAttic,1,2019-03-14 09:03:07,/r/EDAnonymous/comments/b0h4d0/any_other_poc/eiid7ps/,"I’m Alaska Native. In Alaska, there is a HUGE stereotype that natives are dumb, fat, ugly, alcoholics who do nothing but live the lazy life off of government money.  Especially in Anchorage where half the population moved up there from Texas for oil.  I spent so much time trying to “not be like other natives.”  I’m really white-passing, I’ve always felt like I had to be thin so no one assumed I was stupid and lazy.  I was so happy in high school when my friend told me “yeah but you’re not really native, you’re pretty and smart” (paraphrased) But that also means I get accused of trying to be white all the time too.  Which honestly I Probably was for a while.....maybe I still am?",False,False
eih5oks,t3_b0h4d0,t3_b0h4d0,jasr0se,1,2019-03-13 20:11:34,/r/EDAnonymous/comments/b0h4d0/any_other_poc/eih5oks/,"I'm black! I'm not mixed, but I'm very light skinned. So I really do relate to the whole ""people thinking you're trying to whitewash yourself"" thing. Though sometimes I do wonder if I was trying to whitewash myself. At least as a teen. I grew up in a mostly white area in the suburbs. Something my old therapist suggested is that my self-esteem issues and possibly my ED may stem from growing up black with only white friends. The white boys at school never asked me out. I didn't have a boyfriend until I was 22. I didn't get asked to prom. Meanwhile my white friends had boyfriends and whatnot. She suggested I may have internalized that and began thinking I was less than or ugly. When I stumbled across the bullshit that was pro-ana when I was a young impressionable twelve-year-old, I would idolize these white thin models. I was terrified of being ""thicc"" (even though I was never even overweight to begin with). So it's interesting the way internalized anti-blackness/feelings of being ""other"" affected my ED.   I always feel weird speaking about the black community, though, idk. Because like I said, I'm very light skinned and colorism is a huge issue. I get asked ""what are you?"" or have people think I'm Latina or, like I said, mixed race. So I recognize my privilege and definitely have not been through half of what other black girls have been through. Still, I do think mental illness in general but especially EDs are prevalent in the community but not spoken about. A lot of people are STILL under the notion that anorexia is a ""rich white girl"" disease. Or a choice where ""just eat"" is the solution. Or that because someone is overweight, they're just ""eating good"" and people don't even consider BED. Like you said, there is an emphasis on being ""thicc"", not thin. People may not even realize they or a loved one have BED because of lack of knowledge, awareness and cultural norms about being bigger rather than small maybe?",False,False
eigl54e,t3_b0h4d0,t3_b0h4d0,fritterly,1,2019-03-13 16:12:11,/r/EDAnonymous/comments/b0h4d0/any_other_poc/eigl54e/,"I'm asian and there's a strong pressure to be a naturally thin girl who loves food. We greet each other with have you eaten yet?  Try to show our love by going out to eat and overfilling plates at functions.  Super common to be a 'foodie'.  Also.. you must do all of this while being 90lbs.  I see a lot of disordered eating habits among my friends and family.  My mom takes laxatives.. my friends overexercise, undereat, fast, purge, have body dysmorphia etc.  But on the surface they have to portray effortless thinness.  Every one else seems to just accept it as what you gotta do to be thin and it's super taboo to label it as an eating disorder.  Also kind of a nuance.. but I'm southeast asian and have a very different body type from my east asian peers, but I'm expected to conform to the east asian beauty standard ?  Like I have curves- I have breasts and an ass.  My legs are strong. But popular media right now is all *east* asian so I'm expected to be at levels of frail-like thinness that wouldn't make sense for my body type. :/",False,False
eifvgp0,t3_b0h4d0,t1_eifva3t,trashy_cakes,1,2019-03-13 11:42:56,/r/EDAnonymous/comments/b0h4d0/any_other_poc/eifvgp0/,Thanks so much! You're inspiration and motivation for me.,False,False
eifva3t,t3_b0h4d0,t1_eifnugz,bluecokezero,1,2019-03-13 11:40:59,/r/EDAnonymous/comments/b0h4d0/any_other_poc/eifva3t/,That’s fuckin amazing !! We need more people like you! I’ve dabbled with the idea of going into the mental health field but I don’t think I can handle it with where I’m at right now. I wish you luck on your journey !,False,False
eifo53j,t3_b0h4d0,t1_eifnmwe,super_throwaway_8118,1,2019-03-13 10:21:50,/r/EDAnonymous/comments/b0h4d0/any_other_poc/eifo53j/,"Yeah one of my greatest fears is to be a fat angry loud black woman. And for my whole life I’ve been praised b everyone, family included, for being thin. And considering I have no other attractive features it’s the one thin I hold on to.",False,True
eifnugz,t3_b0h4d0,t1_eieu4nr,trashy_cakes,1,2019-03-13 10:18:29,/r/EDAnonymous/comments/b0h4d0/any_other_poc/eifnugz/,This is one of the main reasons why I'm going back to school. We need more mental health advocates in the black/Latino community. I want to be a part of reducing stigma and educating others on mental illness and health ,False,False
eifnmwe,t3_b0h4d0,t3_b0h4d0,Jerry-Larry-Garry,1,2019-03-13 10:16:04,/r/EDAnonymous/comments/b0h4d0/any_other_poc/eifnmwe/,"Making my first comment on a 2 year old account just to agree with this.  As a dark-skinned black woman in a predominantly white area, it is incredibly hard to tune out popular opinions on how people see black women. I’ve held on so closely to being small and petite, as I feel like it is the one attractive and feminine thing about me. Every time I gain a pound, all I see is a stereotype.  It makes it very hard to recover when I feel like my weight is my only redeeming quality.",False,False
eifk7co,t3_b0h4d0,t1_eifg2l0,super_throwaway_8118,1,2019-03-13 09:35:58,/r/EDAnonymous/comments/b0h4d0/any_other_poc/eifk7co/,"Omg yes, I usually wear my hair straight because it’s easier to maintain and going to the hairdresser helps keep it healthy. And they see they see that as trying to be white. But what’s funny when girls wear weaves and wigs they don’t get that flack. I’ve been told I talk white because I don’t use a lot of slang, when it’s just the people I was around (family and all) talked that way too. My music taste is usually rock too. My best friend and boyfriend are both white. So I guess I just must hate myself for being black.  It’s interesting coming from a darker skinned woman because I feel like colorism has a role in it too. One of my college friends briefly had a bout of b/p and she was also light skinned. It’s as if you’re thin and light skinned you’re trying to be white, you’re thin and dark skinned then you have to be thin cuz they don’t like dark skin.   It’s also kind of hard when I look around at school at all the thicc girls and know that I will never have that body type. I’ve always been thin and small framed with a low body fat percentage. Not that I want that body, but I wish they could understand that.",False,True
eifg2l0,t3_b0h4d0,t3_b0h4d0,NueNesta,1,2019-03-13 08:43:57,/r/EDAnonymous/comments/b0h4d0/any_other_poc/eifg2l0/,"I'm Black, dark skin and have literally had people tell me to my face that I cannot afford to be fat, since as a dark woman, that's the only thing that will make me look beautiful 🙄 strangers and family.   You know... The dreaded ""fat black woman"" stereotype.   Family didn't say it as blunt, but it was still there. Being from the Caribbean doesn't help either... where it feels like every native dish is drenched in oil and heavy meat.   Hey, that and I still get funny looks when people realize I'm vegan (I don't get preachy, this only ever comes out when people comment on my food when eating out) ",False,False
eifdkxs,t3_b0h4d0,t1_eif8opa,super_throwaway_8118,1,2019-03-13 08:09:09,/r/EDAnonymous/comments/b0h4d0/any_other_poc/eifdkxs/,"Yeah I’ve had it on both sides. Growing up I was really in a predominantly white/Asian area where everyone was thin. I never really had binging problems as I kid because my family was pretty health conscious. But now I go to an HBCU where it’s the opposite. In high school, I recall, I told my mom black boys wouldn’t like me because I’m not thick but white boys wouldn’t like me because I’m not white. Now at college, being a thin, light skinned girl with a white boyfriend, I feel like the kids don’t take me seriously. Yet I also feel like every other race views me like that.",False,True
eif8opa,t3_b0h4d0,t3_b0h4d0,shark_robinson,1,2019-03-13 06:46:55,/r/EDAnonymous/comments/b0h4d0/any_other_poc/eif8opa/,"I’m black and my sister and I (we both grew up with binging issues and turned to restriction in our teens and twenties) have talked about this but kind of in the opposite context. We grew up in a mostly white community and both feel pressure to be thin to fit in with white peers and not be stereotyped as poor, obese black people who don’t take care of themselves. Essentially there’s not much we can do to avoid racism (we’re both light skinned but not at all white passing) but we can still lose weight to avoid fat-stigma. It’s fucked up. ",False,False
eif3vmo,t3_b0h4d0,t1_eieu4nr,rachihc,1,2019-03-13 04:52:33,/r/EDAnonymous/comments/b0h4d0/any_other_poc/eif3vmo/,"I partially feel you. I am from Peru, and I also was always told "" you eat like a bird"". And food being the center of any social gathering. How ever, there is an idealization of thinness too, paradoxical. But never got never got dumb comments by liking rock and metal tbh, my mom is a Kiss fan.    It still baffles me how so many people find so taboo the mental health thing. Like same that you dont choose to get the flu, you dont choose this. It is so hard for some people to get this, that we are not broken weirdos that should be away from society.",False,False
eif3mtv,t3_b0h4d0,t3_b0h4d0,rachihc,1,2019-03-13 04:45:29,/r/EDAnonymous/comments/b0h4d0/any_other_poc/eif3mtv/,"Thanks for bringing this up, and altho I come from other place I can totally understand and see your point. A few days ago, someone opened the discussion of E.D. on Asian cultures, and many people shared theirs. Also males speaking about no representation. This is very important for all.   E.D.s hit everyone, no matter sex, race, age, social conditions. We have to stick together, and for that is good to understand that each group has different backgrounds and experiences. Cultural background plays a big role on our mental health and social constructs (as beauty standards).    We should bring up this discussions, it helps people and to bring awareness of toxic society habits &amp; ideas.",False,False
eif36wn,t3_b0h4d0,t3_b0h4d0,SummerShandied,1,2019-03-13 04:32:28,/r/EDAnonymous/comments/b0h4d0/any_other_poc/eif36wn/,"hey, nonblack poc here. in my culture, there's no emphasis on thickness or anything, being frail and small is something to set your sights on. that is, of course, until a person starts acting ""weird"" about it - the only thing my culture deems weirder than being above 110 pounds is having a mental illness or god forbid eating disorder. it's a tough balance because i'll get applauded for my weight loss until my family notices how little i eat / what i eat when i do, then it's a problem because it'll effect my brain and schoolwork. no problem before that though.  many cultures have prevalence of EDs that aren't talked about, which is really unfortunate. the ""look"" is still what is sought after, but if the means are disordered enough to be noticed, then it's frowned upon... but then the culture will still ask for the look from you.",False,False
eieu4nr,t3_b0h4d0,t3_b0h4d0,bluecokezero,1,2019-03-13 00:34:49,/r/EDAnonymous/comments/b0h4d0/any_other_poc/eieu4nr/,"Im Latino and I can relate to the emphasis my family and community puts on food and being thick. Not being hungry (even just normally!) I get called a mouse and get shamed for not being hungry!! Like what the fuck!! My brother came over and asked if I wanted anything to eat and I said mozzarella sticks and he acted disgusted that was ALL I’m eating. I don’t get it. Everyone around me has always been chubby &amp; overweight including me. :/  Also I’ve been told I’m trying to be white by relatives and strangers more than I’d like. I went through an emo phase when I was younger and wearing converse and listening to rock was considered “white people shit” ??? Idk man I rarely talk to them anymore and im sure you can tell why.  Mental health education and awareness in minority communities is incredibly bare. It sucks. Such topics are so taboo people are insulted when you even bring it up. Being depressed, eating disorders, being suicidal or emotional even is white people shit or just nonexistent. I really do think that mentally stems from lack of mental health education/awareness in these communities- and I am by no way blaming any of them for thinking that way. But it’s just tough to get through when they’re stubborn and won’t even try to change their mind.  It does get exhausting after a while ",False,False
eierctr,t3_b0h4d0,t3_b0h4d0,UnusualReport,1,2019-03-12 23:43:03,/r/EDAnonymous/comments/b0h4d0/any_other_poc/eierctr/,I'm Asian. Being thin is expected. If you're fat you're no good if you have a doctorate and make good money… you're the one that got fat in America and your mother already had a child at your age. ,False,False
