Comment ID,Link ID,Parent ID,Author,Score,Publish Date,Permalink,Text,Stickied,Is Submitter
ex46bpn,t3_cr8v02,t3_cr8v02,holly-mint,1,2019-08-16 18:49:52,/r/EDAnonymous/comments/cr8v02/raise_ur_hand_if/ex46bpn/,"Absolutely, it's PMDD time 😭 I always get bingey and often end up eating vegetarian for this week even though I both want to be vegan (and eat vegan the other 3 weeks) and have bad reactions to dairy products (digestive issues and breakouts). On top of that I'm under a lot of stress and pressure in my life and I pretty much can't even afford to eat 3 meals a day right now and don't start working again until the end of this month...did I mention it's my birthday on Sunday? 💔",False,False
ex3xk7g,t3_cr8v02,t3_cr8v02,pointsaresingular,1,2019-08-16 17:16:23,/r/EDAnonymous/comments/cr8v02/raise_ur_hand_if/ex3xk7g/,I've been binging like crazy but I'm trying to get it back under control because I just lost some weight and really don't want to gain it back. I feel gross.,False,False
ex3lhtz,t3_cr8v02,t3_cr8v02,hatefulkoala,1,2019-08-16 15:31:10,/r/EDAnonymous/comments/cr8v02/raise_ur_hand_if/ex3lhtz/,"Same here, but instead of it being a week it's been like six months for me. I hit my lowest weight after losing like 20 pounds last year and now it's all back again fmll just wanna bury myself somewhere",False,False
ex322ie,t3_cr8v02,t3_cr8v02,skele_grow,1,2019-08-16 13:09:20,/r/EDAnonymous/comments/cr8v02/raise_ur_hand_if/ex322ie/,"Same! The in-laws are in town and HOLY SHIT THEY EAT SO MUCH! I've been permanently bloated since they arrived. I hate to say it, but I am looking forward to them leaving and me going back to work 🙄",False,False
ex2rx8b,t3_cr8v02,t3_cr8v02,sintos-compa,1,2019-08-16 11:51:50,/r/EDAnonymous/comments/cr8v02/raise_ur_hand_if/ex2rx8b/,"yeah this is me. i'm having a health scare tho, my feet are ballooning to ridiculous size due to binging, i basically had to bitch myself out in the car on the way home to get the point across to the ""hungry baby"" inside me that just wants to eat eat eat.",False,False
