Comment ID,Link ID,Parent ID,Author,Score,Publish Date,Permalink,Text,Stickied,Is Submitter
eavbeot,t3_a1y9a9,t1_eatp7j9,trade4holographic,1,2018-12-01 12:55:37,/r/EDAnonymous/comments/a1y9a9/what_the_fuck_is_wrong_with_me/eavbeot/,I can't stand that I compare myself to children. It's obnoxious.,False,False
eauz168,t3_a1y9a9,t1_eatu8mw,CastleInTheAttic,1,2018-12-01 10:13:10,/r/EDAnonymous/comments/a1y9a9/what_the_fuck_is_wrong_with_me/eauz168/,Are you me? I’m 5’7” and keep that as my thinspo. Lmao,False,False
eauscka,t3_a1y9a9,t3_a1y9a9,izzyoof,1,2018-12-01 08:27:13,/r/EDAnonymous/comments/a1y9a9/what_the_fuck_is_wrong_with_me/eauscka/,I look at pictures of myself as a kid as thinspo :(,False,False
eatznrn,t3_a1y9a9,t3_a1y9a9,happybumblebree,1,2018-11-30 21:36:17,/r/EDAnonymous/comments/a1y9a9/what_the_fuck_is_wrong_with_me/eatznrn/,"i look down a lot, so naturally the first things i see in people are their legs.  from far away i'd see the tiniest skinniest little frail legs and feel so jealous until i look up and realize those are the legs of a child.  i wish i had childlike legs.",False,False
eatwa9u,t3_a1y9a9,t3_a1y9a9,_Pulltab_,1,2018-11-30 20:40:08,/r/EDAnonymous/comments/a1y9a9/what_the_fuck_is_wrong_with_me/eatwa9u/,I have a male student (in his early 20s) who has legs skinnier than my arms. And I’m average weight right now. I constantly wish I had his legs.   There’s nothing rational about this. ,False,False
eatu8mw,t3_a1y9a9,t3_a1y9a9,duskedfur,1,2018-11-30 20:08:11,/r/EDAnonymous/comments/a1y9a9/what_the_fuck_is_wrong_with_me/eatu8mw/,"i feel that but on the opposite side. christian bale in the machinist is my ultimate goal, as a 5’7” girl ",False,False
eatqn7e,t3_a1y9a9,t3_a1y9a9,eyjafjallafuckyall,1,2018-11-30 19:12:07,/r/EDAnonymous/comments/a1y9a9/what_the_fuck_is_wrong_with_me/eatqn7e/,"as a grown ass adult, I am jealous of one of my professor’s elementary-school-aged children for being so skinny. :(",False,False
eatp7j9,t3_a1y9a9,t3_a1y9a9,secrets2327,1,2018-11-30 18:49:35,/r/EDAnonymous/comments/a1y9a9/what_the_fuck_is_wrong_with_me/eatp7j9/,"Sometimes I, an adult female, see a child and wish I could be as skinny. So don’t worry you’re not alone. ",False,False
