Comment ID,Link ID,Parent ID,Author,Score,Publish Date,Permalink,Text,Stickied,Is Submitter
ety5kmv,t3_cdqw2x,t1_ety4zfk,bovineuniversitygrad,1,2019-07-16 16:43:33,/r/EDAnonymous/comments/cdqw2x/i_dont_want_to_be_fit/ety5kmv/,I love that girls everything ❤️❤️❤️,False,False
ety4zfk,t3_cdqw2x,t1_etx2qx0,sparklypinktutu,1,2019-07-16 16:39:21,/r/EDAnonymous/comments/cdqw2x/i_dont_want_to_be_fit/ety4zfk/,I love that girl’s armssss,False,False
ety4vi4,t3_cdqw2x,t1_etwwzv3,sparklypinktutu,1,2019-07-16 16:38:35,/r/EDAnonymous/comments/cdqw2x/i_dont_want_to_be_fit/ety4vi4/,All I want is to look like Cindy Crawford’s daughter lmao.,False,False
etxumul,t3_cdqw2x,t1_etw06ns,rlg95,1,2019-07-16 15:08:51,/r/EDAnonymous/comments/cdqw2x/i_dont_want_to_be_fit/etxumul/,"same, uuugh. I just want to be skinny.",False,False
etxtitj,t3_cdqw2x,t3_cdqw2x,leogrl,1,2019-07-16 14:57:08,/r/EDAnonymous/comments/cdqw2x/i_dont_want_to_be_fit/etxtitj/,"I love working out but I wanna be small and skinny, not fit looking. That’s why I mostly run and try to avoid strength training, though I know it’s good and supposedly burns more calories. I think it’s because I’m already petite (5’1) and young looking that I want to just be super tiny.",False,False
etxotku,t3_cdqw2x,t3_cdqw2x,oanbjfknabd,1,2019-07-16 14:07:31,/r/EDAnonymous/comments/cdqw2x/i_dont_want_to_be_fit/etxotku/,I'm perpetually by wanting to be skinny and wanting more muscle so my TDEE is higher,False,False
etxj2jt,t3_cdqw2x,t3_cdqw2x,AlarmedRefrigerator5,1,2019-07-16 13:06:55,/r/EDAnonymous/comments/cdqw2x/i_dont_want_to_be_fit/etxj2jt/,"Yeah I want to be delicate, not super fit. I'm also too lazy to spend that much time trying to look all fit and toned. I do the bare minimum of muscle preservation during restricting periods so I don't end up flabby since I'm already overweight.",False,False
etxfg25,t3_cdqw2x,t3_cdqw2x,maryam1014,1,2019-07-16 12:29:56,/r/EDAnonymous/comments/cdqw2x/i_dont_want_to_be_fit/etxfg25/,"Ya same!! Not completely fragile, but if I had to choose between being shaped like Kylie or Kendal Jenner, I’d definitely choose Kendals body. It’s just so slender and gives me a light, “fresh” vibe idk if that makes sense",False,False
etxb61b,t3_cdqw2x,t3_cdqw2x,lovenote123,1,2019-07-16 11:45:43,/r/EDAnonymous/comments/cdqw2x/i_dont_want_to_be_fit/etxb61b/,"Same. I feel like I’m the weird girl at my gym who lifts kind of heavy but maintains a 18.0 BMI while all the girls that lift are all thicc. I love skinny long legs and hate any weight that goes to my thighs. Though if I don’t eat much I won’t be gaining a butt, but I’d rather have skinny thighs 🙃",False,False
etx4uhz,t3_cdqw2x,t3_cdqw2x,chrundle420,1,2019-07-16 10:39:06,/r/EDAnonymous/comments/cdqw2x/i_dont_want_to_be_fit/etx4uhz/,"same omg, I don't wanna have a curvy ""womanly"" figure at all, I want like a runway model body, super skinny and kinda androgynous looking lol",False,False
etx2qx0,t3_cdqw2x,t3_cdqw2x,bovineuniversitygrad,1,2019-07-16 10:16:03,/r/EDAnonymous/comments/cdqw2x/i_dont_want_to_be_fit/etx2qx0/,Yep me too. For me think Nancy from stranger things ❤️,False,False
etx1y9i,t3_cdqw2x,t3_cdqw2x,theunachievable,1,2019-07-16 10:07:16,/r/EDAnonymous/comments/cdqw2x/i_dont_want_to_be_fit/etx1y9i/,"I feel that. My form of punishment when I binge or overeat is to exercise it off. So when I'm going through a good restriction streak my body starts looking toned and fit and that's, like, not, the aesthetic I'm going for but I just can't ever get out of my binge - exercise - restrict loop",False,False
etwwzv3,t3_cdqw2x,t1_etw06ns,IkarosFalling,1,2019-07-16 09:10:47,/r/EDAnonymous/comments/cdqw2x/i_dont_want_to_be_fit/etwwzv3/,Same. This floppy ass and jiggling thighs can fuck off. Gimme that Kira knightly bod....,False,False
etwtucg,t3_cdqw2x,t3_cdqw2x,cryingwhiledoingmath,1,2019-07-16 08:31:52,/r/EDAnonymous/comments/cdqw2x/i_dont_want_to_be_fit/etwtucg/,Ugh totally agree. It’s so easy for me to gain muscle and I don’t like the look on me at allll,False,False
etwsu4c,t3_cdqw2x,t3_cdqw2x,lasirenexx,1,2019-07-16 08:18:37,/r/EDAnonymous/comments/cdqw2x/i_dont_want_to_be_fit/etwsu4c/,"I want to want to be fit... my ortho husband is always encouraging me to do squats/bodyweight fitness. He isn’t trying to shame me into building a better ass (he prefers me thin &amp; likes my pitiful bum the way it is, lol) but thinks that strength training would improve my general health, and I know he’s right, but I’m so afraid that if I build any muscle on my lower body, my thigh gap wont be as prominent. Honestly, I need to stop being such a baby about it, because I can see that I’ve lost lean muscle mass since I quit abusing stimulants, and I’m tired of feeling weak.",False,False
etwmv6p,t3_cdqw2x,t1_etwl7d8,ci-fre,1,2019-07-16 06:46:47,/r/EDAnonymous/comments/cdqw2x/i_dont_want_to_be_fit/etwmv6p/,&gt; Don't feel bad.  sigh  I know this is directed to OP and not me but to be honest it's hard reading this when my preferences arise from my ED,False,False
etwm8m2,t3_cdqw2x,t3_cdqw2x,unicorn6642,1,2019-07-16 06:35:31,/r/EDAnonymous/comments/cdqw2x/i_dont_want_to_be_fit/etwm8m2/,Holy shit same. And every single weight loss workout I find only causes you to gain muscles like no 🤢 the only way to achieve the look I want is to keep starving and jogging I guess,False,False
etwm7s8,t3_cdqw2x,t1_etwfhdl,leavetheredhen4,1,2019-07-16 06:35:05,/r/EDAnonymous/comments/cdqw2x/i_dont_want_to_be_fit/etwm7s8/,I guess I mean a proportionally tiny waist. Like the slim thick/hourglass look. It doesn’t appeal to me and I’d rather have more straight lines than the super small waist and big ass if that makes sense,False,True
etwl7d8,t3_cdqw2x,t3_cdqw2x,DF-Juice,1,2019-07-16 06:15:28,/r/EDAnonymous/comments/cdqw2x/i_dont_want_to_be_fit/etwl7d8/,"I'm ""thicc,"" but my boyfriend prefers toned petite girls with thigh gaps. It might be trendy, but it's not a preference held by everyone.",False,False
etwksc6,t3_cdqw2x,t3_cdqw2x,ci-fre,1,2019-07-16 06:06:55,/r/EDAnonymous/comments/cdqw2x/i_dont_want_to_be_fit/etwksc6/,"Me too, I also don't want to look fit. To be honest, I don't want to just be ""delicate"" either. I want to look visibly ""bony"", not like a doll but... idk, just like someone who isn't storing much fat on their body.  Tbh I feel sort of hurt by the sorts of comments here saying things like ""you do you! it's great you're not bending to society"" because I know it has to do with my ED and those sorts of things sort of are... ""praising"" my ED, in a way.",False,False
etwfzyv,t3_cdqw2x,t3_cdqw2x,Chronicallyoddsgirl,1,2019-07-16 04:14:40,/r/EDAnonymous/comments/cdqw2x/i_dont_want_to_be_fit/etwfzyv/,"My mom has labeled my ideal body type as both 'heroin chic' and 'drug waif', and tbh she's not wrong. I don't want hips and boobs and a flat stomach, I want ribs and hipbones and flat ass and boobs. Frail, perhaps even delicate, but certainly not fit or curvy or thicc. Emaciated, not attractive. I don't want to be sexy.",False,False
etwfhdl,t3_cdqw2x,t3_cdqw2x,MissNietzsche,1,2019-07-16 04:01:32,/r/EDAnonymous/comments/cdqw2x/i_dont_want_to_be_fit/etwfhdl/,You say you don’t want a tiny waist but also want to be skinny? Can’t compute,False,False
etwdo0c,t3_cdqw2x,t3_cdqw2x,roseprints,1,2019-07-16 03:16:29,/r/EDAnonymous/comments/cdqw2x/i_dont_want_to_be_fit/etwdo0c/,I love the fit girl trend on anyone but me. I’m trying to tailor my exercise routine specifically so I DON’T build muscle. Idk how well it’s going to work though but fingers crossed. I just want to be thin and delicate looking,False,False
etwdav0,t3_cdqw2x,t3_cdqw2x,Astronautee,1,2019-07-16 03:07:40,/r/EDAnonymous/comments/cdqw2x/i_dont_want_to_be_fit/etwdav0/,Bro my friends call me skinny fit and i wanna kms like i just want to be a sticc,False,False
etwbkky,t3_cdqw2x,t3_cdqw2x,ci-fre,1,2019-07-16 02:27:32,/r/EDAnonymous/comments/cdqw2x/i_dont_want_to_be_fit/etwbkky/,"sigh tbh I don't wanna look ""healthy"" or desirable :C",False,False
etw0z75,t3_cdqw2x,t3_cdqw2x,Ughleigh,1,2019-07-15 23:11:35,/r/EDAnonymous/comments/cdqw2x/i_dont_want_to_be_fit/etw0z75/,I want to look small and delicate. Not into the whole huge ass and thick thighs trend at all tbh,False,False
etw0wvt,t3_cdqw2x,t3_cdqw2x,fritterly,1,2019-07-15 23:10:38,/r/EDAnonymous/comments/cdqw2x/i_dont_want_to_be_fit/etw0wvt/,"Sort of a tangent, but I hate when people say lifting doesn't make you look bulky. -__-   YES IT DOES. Sure I don't look like the terminator when I lift but I freaking have rectangles all over me when I just want to look slim, waify, and soft!!  Also lifting hella makes me look bigger because muscle isn't the absence of fat! Muscle develops under fat unless I... wait for it... cut hella calories like I was going to do in the first place. But now it's harder to restrict because lifting causes raging appetite and I'll actually pass out if I don't eat enough while lifting. -___-    Like yes lifting can be a great fun exercise but don't tell me it'll get me the body I want bc I'm disordered af.",False,False
etw06ns,t3_cdqw2x,t3_cdqw2x,coolestcitrus,1,2019-07-15 22:59:59,/r/EDAnonymous/comments/cdqw2x/i_dont_want_to_be_fit/etw06ns/,"YES. My natural shape is literally the whole “slim thicc” look. Like my weight all goes to my butt/thighs and I hate it!! I’ve always wanted to be slim and I just kind of want to look fragile?? But like in a dainty way, not a sick way (but also low key in a sick way too bc I’m very mentally ill yknow) 😬",False,False
etvxxu6,t3_cdqw2x,t3_cdqw2x,Oni-hime,1,2019-07-15 22:28:19,/r/EDAnonymous/comments/cdqw2x/i_dont_want_to_be_fit/etvxxu6/,"Omg I know exactly what you mean, I feel the same way. I can see why people find fit girls attractive but I would never want to be like that. I’ve always thought I was obsessed with being tiny and delicate cuz I have daddy issues and I like being man handled lol. I’m 5’1 105 pounds and I’m scared if I gain any weight either from muscle or fat people won’t find me adorable anymore.",False,False
etvxata,t3_cdqw2x,t3_cdqw2x,fishonthesun,1,2019-07-15 22:19:44,/r/EDAnonymous/comments/cdqw2x/i_dont_want_to_be_fit/etvxata/,"I love working out and lifting and running. But I want to be frail  Like if I could lift heavy, not get super muscular (maybe just like, abs), and stay skinny I'd be all over that  But rn it's like, either eat more, inevitably gain a little muscle, so I can still deadlift 135 and feel awesome as fuck **or**  Restrict heavily and mainly do abs and cardio and be skinny and frail  Like I know I cant have both and I'm so frustrated",False,False
etvwvrn,t3_cdqw2x,t3_cdqw2x,mackcleaver,1,2019-07-15 22:14:17,/r/EDAnonymous/comments/cdqw2x/i_dont_want_to_be_fit/etvwvrn/,"nah dude society is fucked up i remember reading that they've done studies of certain cultures before they were influenced by western norms and these societies had lower rates of eating disorders, pop culture is fucking toxic man",False,False
etvw6mo,t3_cdqw2x,t3_cdqw2x,Marissla,1,2019-07-15 22:05:12,/r/EDAnonymous/comments/cdqw2x/i_dont_want_to_be_fit/etvw6mo/,"Everyone has different preferences, Good on you for not following the crowd",False,False
etvv21w,t3_cdqw2x,t3_cdqw2x,OatmealCum,1,2019-07-15 21:51:08,/r/EDAnonymous/comments/cdqw2x/i_dont_want_to_be_fit/etvv21w/,SAME. I keep hearing girls now saying “fuck skinny bitches. we like fit girls” and like... i cant relate. I wanna look thin and frail and like Ill break. I love stick thin legs although it seems to be in trend now to have thicc thighs etc,False,False
