Comment ID,Link ID,Parent ID,Author,Score,Publish Date,Permalink,Text,Stickied,Is Submitter
fhyiyvf,t3_eqz706,t1_ff2pc09,ks788,1,2020-02-17 16:00:56,/r/EDAnonymous/comments/eqz706/do_you_guys_have_celebrity_thinspos/fhyiyvf/,Me too when I was younger I would look up to older models and tell myself I’ll be as pretty and skinny as them when I’m their age but now the models are my age and I’m not as skinny.,False,False
fhyisb1,t3_eqz706,t3_eqz706,ks788,1,2020-02-17 15:59:11,/r/EDAnonymous/comments/eqz706/do_you_guys_have_celebrity_thinspos/fhyisb1/,Emily Ratajikowski and literally every VS model,False,False
fgepbxx,t3_eqz706,t3_eqz706,Jenicaaaa,1,2020-02-02 22:52:31,/r/EDAnonymous/comments/eqz706/do_you_guys_have_celebrity_thinspos/fgepbxx/,Madison Beer,False,False
ff2pc09,t3_eqz706,t1_fezof5j,lioneyssy,1,2020-01-20 04:54:44,/r/EDAnonymous/comments/eqz706/do_you_guys_have_celebrity_thinspos/ff2pc09/,The fact that I’m the same age as her is making me sad :((,False,False
ff24geq,t3_eqz706,t3_eqz706,bluediner,2,2020-01-19 22:12:21,/r/EDAnonymous/comments/eqz706/do_you_guys_have_celebrity_thinspos/ff24geq/,natalia dyer lol,False,False
ff1u7qa,t3_eqz706,t3_eqz706,wispybubble,1,2020-01-19 20:11:29,/r/EDAnonymous/comments/eqz706/do_you_guys_have_celebrity_thinspos/ff1u7qa/,This is kinda fucked up but here lately i’ve literally gotten to the point I think most celebrities are kinda fat???? Am i going insane??! Maybe.,False,False
ff1egra,t3_eqz706,t3_eqz706,catwaterbottle,1,2020-01-19 17:56:08,/r/EDAnonymous/comments/eqz706/do_you_guys_have_celebrity_thinspos/ff1egra/,tzuyu from twice. that flat belly oh GOD,False,False
ff181iz,t3_eqz706,t3_eqz706,ughbleh,2,2020-01-19 17:22:05,/r/EDAnonymous/comments/eqz706/do_you_guys_have_celebrity_thinspos/ff181iz/,Natalie Portman for sure,False,False
ff0xnlp,t3_eqz706,t1_fezxfg3,bodiescollide,1,2020-01-19 16:35:22,/r/EDAnonymous/comments/eqz706/do_you_guys_have_celebrity_thinspos/ff0xnlp/,Right? Their bodies and outfits were perfect omg.,False,True
ff0p4bd,t3_eqz706,t3_eqz706,sapolica,4,2020-01-19 15:55:08,/r/EDAnonymous/comments/eqz706/do_you_guys_have_celebrity_thinspos/ff0p4bd/,"For the shorties, Ariana grande for sure",False,False
ff08g20,t3_eqz706,t3_eqz706,virgotaurus,3,2020-01-19 14:37:49,/r/EDAnonymous/comments/eqz706/do_you_guys_have_celebrity_thinspos/ff08g20/,Models from the heroin chic era of the industry.,False,False
fezxfg3,t3_eqz706,t1_fezsm21,BittyBeau,3,2020-01-19 13:42:24,/r/EDAnonymous/comments/eqz706/do_you_guys_have_celebrity_thinspos/fezxfg3/,God Friends is so triggering. Monica and Rachel are like ballerina sized.,False,False
fezsm21,t3_eqz706,t3_eqz706,plzsendhelpobama,1,2020-01-19 13:12:04,/r/EDAnonymous/comments/eqz706/do_you_guys_have_celebrity_thinspos/fezsm21/,idk her irl name but monica geller from friends... i can't watch friends,False,False
fezpu14,t3_eqz706,t1_fezof5j,bodiescollide,1,2020-01-19 12:55:51,/r/EDAnonymous/comments/eqz706/do_you_guys_have_celebrity_thinspos/fezpu14/,Oooof I feel this too lol,False,True
fezof5j,t3_eqz706,t3_eqz706,howareudoying2day,3,2020-01-19 12:47:42,/r/EDAnonymous/comments/eqz706/do_you_guys_have_celebrity_thinspos/fezof5j/,Kaia gerber,False,False
fezn054,t3_eqz706,t3_eqz706,VonnegutsBallerina,2,2020-01-19 12:39:41,/r/EDAnonymous/comments/eqz706/do_you_guys_have_celebrity_thinspos/fezn054/,Sylvie Guillem in her prime.,False,False
feziyar,t3_eqz706,t3_eqz706,mayolespa,2,2020-01-19 12:16:53,/r/EDAnonymous/comments/eqz706/do_you_guys_have_celebrity_thinspos/feziyar/,Young sigourney weaver lol,False,False
fezci7h,t3_eqz706,t3_eqz706,CloudySideDown,2,2020-01-19 11:45:54,/r/EDAnonymous/comments/eqz706/do_you_guys_have_celebrity_thinspos/fezci7h/,Used to be gigi hadid but lately Bella!,False,False
fezc623,t3_eqz706,t3_eqz706,simplyskyla,1,2020-01-19 11:44:09,/r/EDAnonymous/comments/eqz706/do_you_guys_have_celebrity_thinspos/fezc623/,Angelina Jolie.  A classic 😍,False,False
fezb7o5,t3_eqz706,t3_eqz706,lioneyssy,1,2020-01-19 11:40:06,/r/EDAnonymous/comments/eqz706/do_you_guys_have_celebrity_thinspos/fezb7o5/,Kendall Jenner 🙄,False,False
fez9c24,t3_eqz706,t3_eqz706,P0rkeePigg,2,2020-01-19 11:30:40,/r/EDAnonymous/comments/eqz706/do_you_guys_have_celebrity_thinspos/fez9c24/,"Zendaya is my idol, shes flawwwless 😍",False,False
