Comment ID,Link ID,Parent ID,Author,Score,Publish Date,Permalink,Text,Stickied,Is Submitter
faun60p,t3_ea161k,t1_fapbm9t,whatsupbuttercup5,1,2019-12-14 12:57:58,/r/EDAnonymous/comments/ea161k/is_my_doctor_stupid/faun60p/,"5'2"" and 128 lbs is BMI 23.4. Overweight is 25. The doctor could have considered what time of day it was, but I don't think it was wrong of her to point out she's approaching that 25 mark, especially if she has gained since the last visit. More doctors should point this out to people, because most have no idea where overweight/obese starts, especially in America as most people are overweight and think it's normal because so it everyone else.",False,False
fau09ls,t3_ea161k,t1_fappgza,lavenderbruises,1,2019-12-14 11:06:25,/r/EDAnonymous/comments/ea161k/is_my_doctor_stupid/fau09ls/,"Am Chinese, can confirm.",False,False
fapuyxr,t3_ea161k,t1_fapp29g,lavenderbruises,1,2019-12-13 21:23:35,/r/EDAnonymous/comments/ea161k/is_my_doctor_stupid/fapuyxr/,Thanks dear &lt;3,False,False
fapushg,t3_ea161k,t1_faolbmd,hallsofterris,1,2019-12-13 21:22:23,/r/EDAnonymous/comments/ea161k/is_my_doctor_stupid/fapushg/,"i said receptionist level because in my original comment i didn’t really mean ‘nurse’, i meant /someone other than the doctor who might be weighing the patient/, for example a receptionist (yes i have had receptionists weigh me before at mental health clinics!)",False,False
fapukwh,t3_ea161k,t1_faolbmd,hallsofterris,1,2019-12-13 21:20:57,/r/EDAnonymous/comments/ea161k/is_my_doctor_stupid/fapukwh/,"i was talking about that task, not being a nurse. i assume you do more than weigh people. i don’t know why you’re so sensitive about the subject but you are blowing what i said way out of proportion. my mother is a nurse, for christ’s sake.",False,False
fappnvk,t3_ea161k,t1_fapoj85,knuggles_da_empanada,1,2019-12-13 20:46:41,/r/EDAnonymous/comments/ea161k/is_my_doctor_stupid/fappnvk/,"And you're welcome, I'm sure you're a beautiful soul and the doctor maybe didnt mean it hurtfully. (Still rude imo, better ways to mention that)",False,False
fappgza,t3_ea161k,t1_fapoj85,knuggles_da_empanada,1,2019-12-13 20:45:21,/r/EDAnonymous/comments/ea161k/is_my_doctor_stupid/fappgza/,"I don't want to sound ignorant, but if your doctor is from a different country that place womens' looks over her capability, that attitude may be stemming from that.   Like I've heard Asian people say mentioning weight is not taboo in itself but they definitely pick on people casually",False,False
fapp29g,t3_ea161k,t1_faolbmd,turnedonbytweed,1,2019-12-13 20:42:35,/r/EDAnonymous/comments/ea161k/is_my_doctor_stupid/fapp29g/,It was definitely the doctor!! The nurse was sooo sweet I wish she was my doctor!! Congrats on the degree!!💕,False,True
fapoj85,t3_ea161k,t1_fao5xrn,turnedonbytweed,1,2019-12-13 20:38:54,/r/EDAnonymous/comments/ea161k/is_my_doctor_stupid/fapoj85/,Thanks for the support!!❤️  I was surprised too because of the HAES stuff!!,False,True
fapnwwm,t3_ea161k,t1_fanrmny,turnedonbytweed,1,2019-12-13 20:34:42,/r/EDAnonymous/comments/ea161k/is_my_doctor_stupid/fapnwwm/,The humor on this subreddit is what keeps me coming back😭,False,True
fapnjsa,t3_ea161k,t1_fang9gl,turnedonbytweed,1,2019-12-13 20:32:14,/r/EDAnonymous/comments/ea161k/is_my_doctor_stupid/fapnjsa/,Right??!!,False,True
fapnfbu,t3_ea161k,t1_fang8do,turnedonbytweed,1,2019-12-13 20:31:21,/r/EDAnonymous/comments/ea161k/is_my_doctor_stupid/fapnfbu/,Thankyou so much for the support!!!❤️  It was so frustrating!!!,False,True
fapn72j,t3_ea161k,t1_fapbm9t,turnedonbytweed,1,2019-12-13 20:29:44,/r/EDAnonymous/comments/ea161k/is_my_doctor_stupid/fapn72j/,Thanks for the support!!! I feel a lot more validated❤️,False,True
fapmt8m,t3_ea161k,t1_faneu24,turnedonbytweed,1,2019-12-13 20:27:14,/r/EDAnonymous/comments/ea161k/is_my_doctor_stupid/fapmt8m/,😂😩❤️,False,True
fapmmgh,t3_ea161k,t1_fanawqu,turnedonbytweed,1,2019-12-13 20:26:01,/r/EDAnonymous/comments/ea161k/is_my_doctor_stupid/fapmmgh/,❤️❤️,False,True
fapbm9t,t3_ea161k,t3_ea161k,jjustvibingg,1,2019-12-13 18:54:29,/r/EDAnonymous/comments/ea161k/is_my_doctor_stupid/fapbm9t/,This made me say “bitch wtf” out loud. I’m 5’1” &amp; 117 lb &amp; if I lose any more weight I would be noticeably sick. I’m guessing we look about the same. .... you’re definitely not flirting with overweight. I think you should change doctors. They work for you &amp; if they’re contributing to your ED they gotta go.,False,False
faolbmd,t3_ea161k,t1_fanyatw,lavenderbruises,1,2019-12-13 13:55:05,/r/EDAnonymous/comments/ea161k/is_my_doctor_stupid/faolbmd/,"“receptionist level task”...wow totally not demeaning. TIL I got a 4 year degree just to weigh people, cool. Also, on my unit, the nurses actually know more about the patient’s medical history, social history, and unique needs than the doctors themselves.",False,False
fao5xrn,t3_ea161k,t1_fao05p2,knuggles_da_empanada,1,2019-12-13 11:25:24,/r/EDAnonymous/comments/ea161k/is_my_doctor_stupid/fao5xrn/,"Really? I imagine it's the opposite with all the HAES stuff going on, like it's not even worth mentioning because the issues it causes. I never got a single comment when I was 20lb over weight  I know that not everyone is the same, but the average person who is 30lbs overweight is most likely not due to weight training. Same for people at dangerously low weights.   And people may have good biometrics (BP, cholesterol, etc) because they are in their 20s but that catches.  That doesnt excuse the dr in OP's post though",False,False
fao05p2,t3_ea161k,t1_fanbjdy,Strazdiscordia,1,2019-12-13 10:29:04,/r/EDAnonymous/comments/ea161k/is_my_doctor_stupid/fao05p2/,they have to. theres a LOT of pressure for doctors (no matter why the person comes in) to comment on their weight. it's archaic and destroys people confidence and you can't actually tell how healthy a person is by looking at how much they weigh,False,False
fanyatw,t3_ea161k,t1_fanwycf,hallsofterris,1,2019-12-13 10:09:22,/r/EDAnonymous/comments/ea161k/is_my_doctor_stupid/fanyatw/,wasn’t bashing nurses.,False,False
fanx2dd,t3_ea161k,t3_ea161k,pop_chip_boi,1,2019-12-13 09:56:03,/r/EDAnonymous/comments/ea161k/is_my_doctor_stupid/fanx2dd/,"the weight is a ballpark range. she's just throwing out a range to stay within. They weigh you clothed, isn't it obvious they aren't THAT concerned with your exact weight? If it mattered that much, they would weigh you in a gown with nothing else on (like if you're being monitored). the doctor probably glanced at the number, saw it was higher, and made what is an idle comment to her but something else to you.  the only thing the doctors really care about is if your weight is changing a lot or if it's drastically out of range.",False,False
fanwycf,t3_ea161k,t1_fanvqdq,lavenderbruises,1,2019-12-13 09:54:52,/r/EDAnonymous/comments/ea161k/is_my_doctor_stupid/fanwycf/,"as a nurse, I definitely wouldnt say that to a patient and I dont know any nurses who would....",False,False
fanvqdq,t3_ea161k,t3_ea161k,hallsofterris,1,2019-12-13 09:41:40,/r/EDAnonymous/comments/ea161k/is_my_doctor_stupid/fanvqdq/,was she a nurse? definitely doesn’t sound like she should have a medical degree...,False,False
fanrmny,t3_ea161k,t1_fanqmr1,ChristianVeganUke,1,2019-12-13 08:55:39,/r/EDAnonymous/comments/ea161k/is_my_doctor_stupid/fanrmny/,Malnourished small boob gang *saw yeehaw*,False,False
fanqmr1,t3_ea161k,t1_fanoxpq,MyDietIsPureTea,1,2019-12-13 08:43:50,/r/EDAnonymous/comments/ea161k/is_my_doctor_stupid/fanqmr1/,a cup gang 😔✌️,False,False
fanoxpq,t3_ea161k,t1_fannkh1,sadsadmegan,1,2019-12-13 08:23:00,/r/EDAnonymous/comments/ea161k/is_my_doctor_stupid/fanoxpq/,Im annoyed that I cant say my boobs are more of my weight than they are now rip,False,False
fannkh1,t3_ea161k,t1_faneu24,ifuckpineapples,1,2019-12-13 08:05:36,/r/EDAnonymous/comments/ea161k/is_my_doctor_stupid/fannkh1/,for anyone curious 32h boobs weigh 2 pounds each. there's a chart you can consult to find out.,False,False
fang9gl,t3_ea161k,t1_faneu24,phenylammonium,1,2019-12-13 06:14:32,/r/EDAnonymous/comments/ea161k/is_my_doctor_stupid/fang9gl/,Also like has she ever worn jeans? Mine are at least a lb whatttt,False,False
fang8do,t3_ea161k,t3_ea161k,phenylammonium,1,2019-12-13 06:13:58,/r/EDAnonymous/comments/ea161k/is_my_doctor_stupid/fang8do/,"??? What the fuck??? That's so not OK. Gee, I thought you have to be smart to be a doctor. If the bar's this low, I really shouldn't be nervous for my future career aspirations.  Jesus christ I'm so sorry you had to go through that. Some people need to grow some common sense.",False,False
faneu24,t3_ea161k,t3_ea161k,kindbear_kindbud,1,2019-12-13 05:47:09,/r/EDAnonymous/comments/ea161k/is_my_doctor_stupid/faneu24/,"Your doctor is stupid. Like, bitch how much do you think these titties weigh?!",False,False
fanbjdy,t3_ea161k,t3_ea161k,knuggles_da_empanada,1,2019-12-13 04:34:31,/r/EDAnonymous/comments/ea161k/is_my_doctor_stupid/fanbjdy/,I'm surprised that doctors even comment on that stuff anymore,False,False
fanawqu,t3_ea161k,t3_ea161k,mud_octopus,1,2019-12-13 04:19:22,/r/EDAnonymous/comments/ea161k/is_my_doctor_stupid/fanawqu/,*hugs*,False,False
