Comment ID,Link ID,Parent ID,Author,Score,Publish Date,Permalink,Text,Stickied,Is Submitter
fb9fgnp,t3_ebpvwi,t3_ebpvwi,gentlerose,1,2019-12-17 20:46:13,/r/EDAnonymous/comments/ebpvwi/fuck_secret_santa/fb9fgnp/,"ffs at your BMI you definitely objectively don’t, and wouldn’t appear as though, you need to go on a diet. a BMI of 22 is thin and you probably look gorgeous. your secret santa is either just rude, jealous, lazy or all of the above lmao",False,False
fb8i6nu,t3_ebpvwi,t3_ebpvwi,coffeeandnarcissism,1,2019-12-17 14:28:08,/r/EDAnonymous/comments/ebpvwi/fuck_secret_santa/fb8i6nu/,What the ACTUAL fuck. You’re telling me an adult....a real life adult....an actual human being...did that to you????,False,False
fb7xkzg,t3_ebpvwi,t1_fb7fax4,JurassicParkourr,1,2019-12-17 10:53:54,/r/EDAnonymous/comments/ebpvwi/fuck_secret_santa/fb7xkzg/,That’s such a good perspective thank u!,False,True
fb7xhil,t3_ebpvwi,t1_fb7b7hg,JurassicParkourr,1,2019-12-17 10:52:54,/r/EDAnonymous/comments/ebpvwi/fuck_secret_santa/fb7xhil/,"Not ok, we look BEAUTIFUL 🥺😭",False,True
fb7ujid,t3_ebpvwi,t3_ebpvwi,M00nSugar,1,2019-12-17 10:21:40,/r/EDAnonymous/comments/ebpvwi/fuck_secret_santa/fb7ujid/,This is just...gross. It sounds like bullying behaviour to me and I would NOT let it lie.,False,False
fb7rayj,t3_ebpvwi,t3_ebpvwi,bannaberry,1,2019-12-17 09:46:00,/r/EDAnonymous/comments/ebpvwi/fuck_secret_santa/fb7rayj/,"Fuuk that. I would have just chucked it then and there, in front of all coworker. That’s so messed up.",False,False
fb7ow3q,t3_ebpvwi,t3_ebpvwi,MadSourCherry,1,2019-12-17 09:18:19,/r/EDAnonymous/comments/ebpvwi/fuck_secret_santa/fb7ow3q/,"Wowwww I'm so sorry babe. Definitely report that to hr, that's bullying/harassment.",False,False
fb7os3t,t3_ebpvwi,t1_fb6wzdp,Edith-Anne-Newton,1,2019-12-17 09:16:58,/r/EDAnonymous/comments/ebpvwi/fuck_secret_santa/fb7os3t/,Or if you're feeling creative turn it into art lol,False,False
fb7mih7,t3_ebpvwi,t3_ebpvwi,Annielizabeth319,1,2019-12-17 08:49:46,/r/EDAnonymous/comments/ebpvwi/fuck_secret_santa/fb7mih7/,"What in the actual hell. I work in HR and would definitely bring it up to someone who works in HR. That was incredibly insensitive and there needs to be a conversation with that employee about the types of behaviors and gifts that are and are not acceptable in the workplace. Work environments should feel safe, inclusive and accepting. That gift is anything but. 🖤",False,False
fb7fax4,t3_ebpvwi,t3_ebpvwi,doesglitterhavecarbs,1,2019-12-17 07:09:02,/r/EDAnonymous/comments/ebpvwi/fuck_secret_santa/fb7fax4/,"Woah wait, secret’s out, your Santa is most certainly a dick. Think of it this way: you have one or two days out of the entire year where you’ll feel upset about this event. But, with everything else, time will make it better. This chick has to go an entire 365 days being herself....",False,False
fb7b7hg,t3_ebpvwi,t3_ebpvwi,mustyday,1,2019-12-17 05:53:36,/r/EDAnonymous/comments/ebpvwi/fuck_secret_santa/fb7b7hg/,Omg we have the same bmi and i look ok??? I think??? I’d be so mad,False,False
fb78vfg,t3_ebpvwi,t3_ebpvwi,karentakethekids,1,2019-12-17 04:58:52,/r/EDAnonymous/comments/ebpvwi/fuck_secret_santa/fb78vfg/,Ok this is actullay rude,False,False
fb76fvk,t3_ebpvwi,t3_ebpvwi,rachihc,1,2019-12-17 03:55:11,/r/EDAnonymous/comments/ebpvwi/fuck_secret_santa/fb76fvk/,"That is so fucked up. I also once got a book of self help aymd enlightenment or some bs like that, I was so pissed, it was someone that knows me, but that is not nearly as offensive as yours. I just thought oh thia must be a re gift cos they are lazy af.",False,False
fb75048,t3_ebpvwi,t3_ebpvwi,iampieman,1,2019-12-17 03:17:37,/r/EDAnonymous/comments/ebpvwi/fuck_secret_santa/fb75048/,"Damn that’s fucked up. So someone specifically got you, and chose that as their gift? That makes me so angry what a fuckhead (them not you lmao)",False,False
fb6wzdp,t3_ebpvwi,t3_ebpvwi,foxx_ghost,1,2019-12-17 00:19:03,/r/EDAnonymous/comments/ebpvwi/fuck_secret_santa/fb6wzdp/,"Whoever gifted that is an AH   If it was myself I would try and find out who gifted that only to mess with them, making comments about how serious the diet book is to you and how it “cHaNgEd you”   But seriously, toss the book. Your BMI is fine and I’m sure you look great 💕",False,False
fb6vbjy,t3_ebpvwi,t1_fb6ppai,weightwasted,1,2019-12-16 23:49:07,/r/EDAnonymous/comments/ebpvwi/fuck_secret_santa/fb6vbjy/,Oof I was gonna day maybe they heard you talking about food and dieting and thought it would be something interesting but damn...,False,False
fb6q1n6,t3_ebpvwi,t1_fb6ppai,IDKijustdrinkhere,1,2019-12-16 22:25:29,/r/EDAnonymous/comments/ebpvwi/fuck_secret_santa/fb6q1n6/,"Yikes. Well, maybe she is just clueless. That’s totally something my mother would give me and be shocked that I found it offensive.",False,False
fb6ppai,t3_ebpvwi,t1_fb6n73k,JurassicParkourr,1,2019-12-16 22:20:43,/r/EDAnonymous/comments/ebpvwi/fuck_secret_santa/fb6ppai/,"Oh I knew the second I opened it, and it was a small secret Santa and everyone found out who they had. She’s like way older than me and we’ve never really spoken before so I was pretty blindsided",False,True
fb6n73k,t3_ebpvwi,t1_fb6mrwb,IDKijustdrinkhere,1,2019-12-16 21:47:37,/r/EDAnonymous/comments/ebpvwi/fuck_secret_santa/fb6n73k/,Nah. I wouldn’t even do that to someone I very much dislike. Will you find out who it is?,False,False
fb6mrwb,t3_ebpvwi,t1_fb6mh1y,JurassicParkourr,1,2019-12-16 21:42:26,/r/EDAnonymous/comments/ebpvwi/fuck_secret_santa/fb6mrwb/,haha jk... unless? 👀,False,True
fb6mh1y,t3_ebpvwi,t3_ebpvwi,IDKijustdrinkhere,1,2019-12-16 21:38:52,/r/EDAnonymous/comments/ebpvwi/fuck_secret_santa/fb6mh1y/,"Also, as an aside, I was just lamenting today that I hadn’t been given any gifts yet this year to regift to my coworker that I dislike very much. So, pass that my way? Haha just kidding. Kinda.",False,False
fb6lp3y,t3_ebpvwi,t1_fb6lhng,IDKijustdrinkhere,1,2019-12-16 21:29:41,/r/EDAnonymous/comments/ebpvwi/fuck_secret_santa/fb6lp3y/,"I hope you find out who that person is and then give them the death stare. Just any time they say anything to you, look at them with a cold stare and hesitate for like 5 minutes before you respond coldly to whatever they asked you.",False,False
fb6lhng,t3_ebpvwi,t1_fb6k325,JurassicParkourr,1,2019-12-16 21:27:14,/r/EDAnonymous/comments/ebpvwi/fuck_secret_santa/fb6lhng/,"Right?? I was just shocked, my coworkers audibly gasped when everyone saw and so I had to try and play it off cool in front of EVERYONE 😭😭😭",False,True
fb6lc5m,t3_ebpvwi,t1_fb6kkg3,JurassicParkourr,1,2019-12-16 21:25:26,/r/EDAnonymous/comments/ebpvwi/fuck_secret_santa/fb6lc5m/,"That last point actually made me laugh so hard, definitely must’ve been it 😂",False,True
fb6kkg3,t3_ebpvwi,t3_ebpvwi,SemicolonButterfly,1,2019-12-16 21:16:18,/r/EDAnonymous/comments/ebpvwi/fuck_secret_santa/fb6kkg3/,"Sheesh. That is an incredibly stupid secret santa gift under any circumstances. Donate or chuck it! Or rip it up for the catharsis. That’s BS.   Possible semi-amusing spins... - They’re regifting it because *they* got it last week as a shitty white elephant gift - It ChANgeD tHeiR LiFE and they are Moses come down from the mount - It *didn’t* change their life and they’re sick of seeing it on their bookshelf and they left secret santa shopping till the morning of and then thought, “heyyyy...”",False,False
fb6k325,t3_ebpvwi,t3_ebpvwi,IDKijustdrinkhere,1,2019-12-16 21:10:36,/r/EDAnonymous/comments/ebpvwi/fuck_secret_santa/fb6k325/,"What the fuck. That is literally never ok to give someone. Even if they asked for it, give them a fucking gift card for a book store instead. Rude as shit. I’m sorry.",False,False
