Comment ID,Link ID,Parent ID,Author,Score,Publish Date,Permalink,Text,Stickied,Is Submitter
ffquqg5,t3_etgsi6,t3_etgsi6,SecretIdentity8594,1,2020-01-27 10:54:43,/r/EDAnonymous/comments/etgsi6/morning_skinny_is_the_only_thing_keeping_me/ffquqg5/,I’d love to obtain any kind of skinny at all.,False,False
ffijqik,t3_etgsi6,t1_ffgy0c4,undercoverbunky,1,2020-01-25 12:05:16,/r/EDAnonymous/comments/etgsi6/morning_skinny_is_the_only_thing_keeping_me/ffijqik/,size 2 sausage in a size 1 casing,False,False
ffidzcd,t3_etgsi6,t3_etgsi6,moth-woman,1,2020-01-25 10:59:59,/r/EDAnonymous/comments/etgsi6/morning_skinny_is_the_only_thing_keeping_me/ffidzcd/,i havent had morning skinny in so long ive forgotten what it feels like 😭just chronic constipation tingz!,False,False
ffi2bvu,t3_etgsi6,t1_ffh7yte,merwookiee,1,2020-01-25 08:36:54,/r/EDAnonymous/comments/etgsi6/morning_skinny_is_the_only_thing_keeping_me/ffi2bvu/,"I must have forgotten I commented here already. Hello, me.",False,False
ffi0lu4,t3_etgsi6,t3_etgsi6,not-aaliyah,1,2020-01-25 08:10:30,/r/EDAnonymous/comments/etgsi6/morning_skinny_is_the_only_thing_keeping_me/ffi0lu4/,I''ve never been morning skinny damn,False,False
ffi00yl,t3_etgsi6,t1_ffgxn5t,Oac24,1,2020-01-25 08:01:05,/r/EDAnonymous/comments/etgsi6/morning_skinny_is_the_only_thing_keeping_me/ffi00yl/,That’s the worst waiting game,False,False
ffhz67a,t3_etgsi6,t3_etgsi6,ketothrowaway95,1,2020-01-25 07:46:45,/r/EDAnonymous/comments/etgsi6/morning_skinny_is_the_only_thing_keeping_me/ffhz67a/,same ugh,False,False
ffhz1t0,t3_etgsi6,t1_ffho21z,CepheidVox,1,2020-01-25 07:44:39,/r/EDAnonymous/comments/etgsi6/morning_skinny_is_the_only_thing_keeping_me/ffhz1t0/,"Really sorry to hear this, I think we often forget that most people with EDs have BED... there is r/BingeEatingDisorder  wishing you well",False,False
ffhyuid,t3_etgsi6,t1_ffho7yb,CepheidVox,1,2020-01-25 07:41:09,/r/EDAnonymous/comments/etgsi6/morning_skinny_is_the_only_thing_keeping_me/ffhyuid/,stupid biology and its dumb trying to keep me alive,False,False
ffhyfpv,t3_etgsi6,t3_etgsi6,rosebyeveryothername,1,2020-01-25 07:34:02,/r/EDAnonymous/comments/etgsi6/morning_skinny_is_the_only_thing_keeping_me/ffhyfpv/,I’m totally doing it wrong because I woke up and I’m still fat :(,False,False
ffhpde9,t3_etgsi6,t3_etgsi6,heartemoji,1,2020-01-25 04:06:23,/r/EDAnonymous/comments/etgsi6/morning_skinny_is_the_only_thing_keeping_me/ffhpde9/,1000%,False,False
ffho7yb,t3_etgsi6,t1_ffhax5z,84692929,1,2020-01-25 03:36:37,/r/EDAnonymous/comments/etgsi6/morning_skinny_is_the_only_thing_keeping_me/ffho7yb/,No not skinny as defined by people with EDs because human beings have organs and one of them expands temporarily to accommodate food for awhile while it breaks it down before shitting it out.,False,False
ffho21z,t3_etgsi6,t3_etgsi6,84692929,1,2020-01-25 03:32:27,/r/EDAnonymous/comments/etgsi6/morning_skinny_is_the_only_thing_keeping_me/ffho21z/,God it’s time to unsubscribe. I have either EDNOS or BED and I haven’t been skinny in my fucking life not even for one morning. Sick of seeing this shit. Is there a sub for people with EDs who are overweight only? If there’s not would anyone be interested in one? Shit like this post makes me feel like hot fucking garbage.,False,False
ffhnr70,t3_etgsi6,t3_etgsi6,darkspacecreature,1,2020-01-25 03:24:51,/r/EDAnonymous/comments/etgsi6/morning_skinny_is_the_only_thing_keeping_me/ffhnr70/,SAME,False,False
ffhmm8d,t3_etgsi6,t1_ffgejjp,StaticChocolate,1,2020-01-25 02:56:04,/r/EDAnonymous/comments/etgsi6/morning_skinny_is_the_only_thing_keeping_me/ffhmm8d/,"Last night I bloated maybe 6 inches, the jeans that usually need a belt and fall off were majorly cutting into my tummy. Screw night time.  I feel this.",False,False
ffhgu45,t3_etgsi6,t3_etgsi6,cr0nchynapk1n,1,2020-01-25 00:44:00,/r/EDAnonymous/comments/etgsi6/morning_skinny_is_the_only_thing_keeping_me/ffhgu45/,"Man i don’t have a Morning skinny, just constant fat.",False,False
ffhfeik,t3_etgsi6,t1_ffhax5z,Samantha039,1,2020-01-25 00:15:55,/r/EDAnonymous/comments/etgsi6/morning_skinny_is_the_only_thing_keeping_me/ffhfeik/,It’s got to be a fairy tale.,False,False
ffhf6wi,t3_etgsi6,t3_etgsi6,wetblanketdreams,1,2020-01-25 00:11:46,/r/EDAnonymous/comments/etgsi6/morning_skinny_is_the_only_thing_keeping_me/ffhf6wi/,I wake up bloated like I'm 4mos pregnant most days and by bedtime I'm *full term*.,False,False
ffhcycq,t3_etgsi6,t1_ffhc8i3,ceruleanohara,1,2020-01-24 23:31:54,/r/EDAnonymous/comments/etgsi6/morning_skinny_is_the_only_thing_keeping_me/ffhcycq/,"We’re so broken. It’s all or nothing. It’s so hard to live with someone who tries to control his own eating- dh lost about 80 lbs 5 years ago and doesn’t want to go back. So he has his restrictions, but they aren’t like mine. It’s fucking with me so hard.",False,False
ffhcprt,t3_etgsi6,t3_etgsi6,apple_buns,1,2020-01-24 23:27:52,/r/EDAnonymous/comments/etgsi6/morning_skinny_is_the_only_thing_keeping_me/ffhcprt/,Ooof this is too real. Sometimes I wake up and can barely stand and I've legit just had to lie on the bathroom floor until everything stops spinning and the nausea goes away. I won't even drink any water or anything until I get on the scale. It's worth it just for the feeling of seeing the number go down from the day before.,False,False
ffhc8i3,t3_etgsi6,t1_ffhan4f,stefanica,1,2020-01-24 23:19:53,/r/EDAnonymous/comments/etgsi6/morning_skinny_is_the_only_thing_keeping_me/ffhc8i3/,"I hear you. I think I'm broken. Weighed myself this morning when I first got up, was happy. Drank some water, ate one boiled egg, took a massive BM, then got back on the scale for fun. Up 3.5 lbs. That's, like, breaking the laws of physics! My scale is new and not cheap...  I also feel better when I've been able to fast long enough to not feel hungry. But I broke it with that one stupid egg, and been ravenous all day (and gave in, mostly).",False,False
ffhax5z,t3_etgsi6,t3_etgsi6,misskaminsk,1,2020-01-24 22:58:35,/r/EDAnonymous/comments/etgsi6/morning_skinny_is_the_only_thing_keeping_me/ffhax5z/,I’m so out of the loop. Is all day skinny a thing?,False,False
ffhan4f,t3_etgsi6,t1_ffgejjp,ceruleanohara,1,2020-01-24 22:54:12,/r/EDAnonymous/comments/etgsi6/morning_skinny_is_the_only_thing_keeping_me/ffhan4f/,"Hey you can barely walk to the bathroom to expel as much as you can, and gray out between the toilet and the scale, but Fuck you’re not gonna drink any water until that scale says what you want.   And fuck him when he says “do you want breakfast?” Bitch when I was single nobody asked me that! I start with breakfast, then need lunch, then dinner! Can I not?  But I’m hungry. And the scale just gave me a win. So here I am, needing to eat like a normal person. And he loves me and doesn’t deserve me being a cunt to him.   And I just maintain, day after day.   And my head kills me like I’m a goddamned failure.   I hate this.",False,False
ffh7yte,t3_etgsi6,t3_etgsi6,galacticshock,1,2020-01-24 22:14:48,/r/EDAnonymous/comments/etgsi6/morning_skinny_is_the_only_thing_keeping_me/ffh7yte/,‘Morning skinny’. I wish. At the moment I’m experiencing ‘constant fatty’,False,False
ffh2mbd,t3_etgsi6,t3_etgsi6,Cali_Ali,1,2020-01-24 21:03:56,/r/EDAnonymous/comments/etgsi6/morning_skinny_is_the_only_thing_keeping_me/ffh2mbd/,I got really sick a few days ago and my weak dehydrated body looks so good right now 😂,False,False
ffh23b1,t3_etgsi6,t3_etgsi6,Poltergeisha0517,1,2020-01-24 20:57:15,/r/EDAnonymous/comments/etgsi6/morning_skinny_is_the_only_thing_keeping_me/ffh23b1/,Too close for sure. The laxes have stopped working lately and my heart aches for morning skinny again. 😞😞😞,False,False
ffh1o3y,t3_etgsi6,t1_ffgy0c4,pondfrogs,1,2020-01-24 20:51:57,/r/EDAnonymous/comments/etgsi6/morning_skinny_is_the_only_thing_keeping_me/ffh1o3y/,bruh yes!! in the morning everything fits so perfectly and then by the end of the day i look like violet beauregard when she becomes a blueberry,False,True
ffh007g,t3_etgsi6,t3_etgsi6,raebrownofficial,1,2020-01-24 20:30:59,/r/EDAnonymous/comments/etgsi6/morning_skinny_is_the_only_thing_keeping_me/ffh007g/,BIGGEST MOOD EVER,False,False
ffgzx6r,t3_etgsi6,t1_ffgejjp,manymanybutts,1,2020-01-24 20:29:56,/r/EDAnonymous/comments/etgsi6/morning_skinny_is_the_only_thing_keeping_me/ffgzx6r/,fuk this hit home,False,False
ffgy9nt,t3_etgsi6,t3_etgsi6,judgejudystan,1,2020-01-24 20:09:20,/r/EDAnonymous/comments/etgsi6/morning_skinny_is_the_only_thing_keeping_me/ffgy9nt/,I don’t even have morning skinny anymore I hate myself,False,False
ffgy0c4,t3_etgsi6,t3_etgsi6,soybeansaus,1,2020-01-24 20:06:06,/r/EDAnonymous/comments/etgsi6/morning_skinny_is_the_only_thing_keeping_me/ffgy0c4/,Oof but then I put on cute clothes and bloat to hindenburg proportions during the day 😔😔,False,False
ffgxn5t,t3_etgsi6,t3_etgsi6,hamsterolic,1,2020-01-24 20:01:34,/r/EDAnonymous/comments/etgsi6/morning_skinny_is_the_only_thing_keeping_me/ffgxn5t/,Except when u binge the night before and haven't shit anything out by the next day 🤣,False,False
ffgx8c1,t3_etgsi6,t1_ffgjz5j,oenone_,1,2020-01-24 19:56:17,/r/EDAnonymous/comments/etgsi6/morning_skinny_is_the_only_thing_keeping_me/ffgx8c1/,"Lol same, rip",False,False
ffgum6u,t3_etgsi6,t3_etgsi6,pink-strawberry_,1,2020-01-24 19:24:32,/r/EDAnonymous/comments/etgsi6/morning_skinny_is_the_only_thing_keeping_me/ffgum6u/,I don't even have morning skinny you are lucky,False,False
ffguhsb,t3_etgsi6,t1_ffgncfh,TheShortGerman,1,2020-01-24 19:23:02,/r/EDAnonymous/comments/etgsi6/morning_skinny_is_the_only_thing_keeping_me/ffguhsb/,there are dozens of us!,False,False
ffgtoby,t3_etgsi6,t3_etgsi6,ilikebigbooks98765,1,2020-01-24 19:13:05,/r/EDAnonymous/comments/etgsi6/morning_skinny_is_the_only_thing_keeping_me/ffgtoby/,Morning skinny is the best. My goal is to achieve all day skinny too but right now that only happens when I just plain don't eat during the day lmao.,False,False
ffgqp58,t3_etgsi6,t1_ffgncfh,_fidgetspinner,1,2020-01-24 18:37:06,/r/EDAnonymous/comments/etgsi6/morning_skinny_is_the_only_thing_keeping_me/ffgqp58/,damn i guess we are the same person lol. ugh it really sucks :/,False,False
ffgnxkk,t3_etgsi6,t3_etgsi6,emily_renae99,1,2020-01-24 18:04:23,/r/EDAnonymous/comments/etgsi6/morning_skinny_is_the_only_thing_keeping_me/ffgnxkk/,I feel this on a deeply spiritual level.,False,False
ffgncfh,t3_etgsi6,t1_ffgjz5j,Cantstandyaxo,1,2020-01-24 17:57:34,/r/EDAnonymous/comments/etgsi6/morning_skinny_is_the_only_thing_keeping_me/ffgncfh/,Wow are you me? Same.,False,False
ffgkf9x,t3_etgsi6,t3_etgsi6,CapitanAI,1,2020-01-24 17:24:33,/r/EDAnonymous/comments/etgsi6/morning_skinny_is_the_only_thing_keeping_me/ffgkf9x/,12:23AM. Gained 7lbs in the last month. I'm bloody starving right now. But here's hoping I'll be down tomorrow,False,False
ffgjz5j,t3_etgsi6,t3_etgsi6,_fidgetspinner,1,2020-01-24 17:19:39,/r/EDAnonymous/comments/etgsi6/morning_skinny_is_the_only_thing_keeping_me/ffgjz5j/,god i miss the all day skinny. these days i can't even achieve morning skinny lol help,False,False
ffgejjp,t3_etgsi6,t1_ffgbqpr,pondfrogs,1,2020-01-24 16:21:07,/r/EDAnonymous/comments/etgsi6/morning_skinny_is_the_only_thing_keeping_me/ffgejjp/,when u wake up severely dehydrated and barely able to stand but at least your stomach is flat 🥰🥰🥰,False,True
ffgbqpr,t3_etgsi6,t3_etgsi6,CeslieLondon,1,2020-01-24 15:52:13,/r/EDAnonymous/comments/etgsi6/morning_skinny_is_the_only_thing_keeping_me/ffgbqpr/,Legit best part of my day,False,False
