Comment ID,Link ID,Parent ID,Author,Score,Publish Date,Permalink,Text,Stickied,Is Submitter
eb8otst,t3_a3dgpn,t1_eb88lrn,markexclamationmark,1,2018-12-06 15:08:34,/r/EDAnonymous/comments/a3dgpn/dry_brittle_hair/eb8otst/,"Hahaha 😂 whatever works right? I feel you with the struggle for long hair. It seems like once I hit a certain length, any extra growth comes with super dry ends. My UGW present to myself is gonna be some bombass extensions ",False,True
eb88lrn,t3_a3dgpn,t1_eb65em6,JackFallsDown,1,2018-12-06 12:08:43,/r/EDAnonymous/comments/a3dgpn/dry_brittle_hair/eb88lrn/,I'd reccomend when your shampooing to give yourself a few minutes to really massage it. You can do it on dry hair too though! I've started doing it with my head hanging off the bed to help blood circulate that way to promote hair growth. (That's sort of a myth but I'm willing to try anything to help my hair grow longer.),False,False
eb7dfu2,t3_a3dgpn,t1_eb7cb7j,OkWorking7,1,2018-12-06 04:14:07,/r/EDAnonymous/comments/a3dgpn/dry_brittle_hair/eb7dfu2/,"Oh yeah Korean hair is way different to caucasian hair so maybe it's not the right brand for you. I've heard that moroccan oil can damage hair too actually.. One thing that really helped my hair besides deep conditioning is that I stopped heat styling it for a few months, it really made a difference. I guess since we're here there's still a good chance it could be a diet based issue though. ",False,False
eb7cb7j,t3_a3dgpn,t1_eb6im4l,markexclamationmark,1,2018-12-06 03:45:01,/r/EDAnonymous/comments/a3dgpn/dry_brittle_hair/eb7cb7j/,"It's not crap exactly... It wasn't cheap, it's a Korean brand and I reckon my white-ass hair can't handle it. I read that Asian hair is more resistant to drying out? It has pretty stellar reviews online.  I have tried hair masks and use moroccan oil pretty frequently, I also take 3000mg of fish oil most days, so I'll see how I go with biotin 😊 ",False,True
eb6im4l,t3_a3dgpn,t3_a3dgpn,OkWorking7,1,2018-12-05 18:42:17,/r/EDAnonymous/comments/a3dgpn/dry_brittle_hair/eb6im4l/,"If your shampoo is crap then it's probably partially that. Try doing a hair mask just on your ends. Restricting can cause hair issues so definitely grab some biotin. Healthy fats are really good for hair skin and nails so try adding some salmon, tuna, and avocado into your diet.",False,False
eb65em6,t3_a3dgpn,t1_eb5igd8,markexclamationmark,1,2018-12-05 16:10:42,/r/EDAnonymous/comments/a3dgpn/dry_brittle_hair/eb65em6/,Thankyou for the recommendation! I'll definitely give them a try. Are scalp massages something you'd do in the shower or with dry hair? ,False,True
eb5igd8,t3_a3dgpn,t3_a3dgpn,JackFallsDown,1,2018-12-05 11:54:23,/r/EDAnonymous/comments/a3dgpn/dry_brittle_hair/eb5igd8/,As a hairdresser I can add that using a bad shampoo can absolutely do this. I would recommend the Redken Extreme Shampoo and Conditioner duo to try and help repair it!   Also taking multivitamins or biotin will help as well as giving yourself scalp massages frequently. :),False,False
eb59f2w,t3_a3dgpn,t3_a3dgpn,pinkglitterbunny,1,2018-12-05 10:08:04,/r/EDAnonymous/comments/a3dgpn/dry_brittle_hair/eb59f2w/,Weight loss definitely is a contributing factor... at my lowest weight my hair was brittle and broken and falling out all the time. Biotin might help but I heard it might also cause breakouts. Sorry this is happening 😔💖,False,False
