Comment ID,Link ID,Parent ID,Author,Score,Publish Date,Permalink,Text,Stickied,Is Submitter
ffznfqm,t3_evid0p,t1_ffwz2ky,steffnizzle,1,2020-01-30 06:23:00,/r/EDAnonymous/comments/evid0p/i_feel_like_pictures_of_me_taken_over_the_last_5/ffznfqm/,"From what I’ve read, I think they can tell. I’ve switched dentists a few times over the years, so I don’t know if any of them knew, but one of my back molars had to be pulled because half of it chipped off and then was maybe getting infected. Apparently the same tooth on the other side has a giant cavity in it. New dentist said maybe it was damaged when I got my wisdom teeth out, but I wonder if it’s from enamel loss. And then there’s the staining from so much coffee and Diet Coke over the years too 😬",False,False
ffxgvqv,t3_evid0p,t1_ffwyoz5,apple_buns,1,2020-01-29 13:08:15,/r/EDAnonymous/comments/evid0p/i_feel_like_pictures_of_me_taken_over_the_last_5/ffxgvqv/,I feel like a lot of the people in those classes are disordered in some way. I only took it because it's a requirement for nursing. I never used to calorie count or worry about macros so much before that class,False,False
ffx2ch1,t3_evid0p,t3_evid0p,foxforcefiv5,1,2020-01-29 10:44:13,/r/EDAnonymous/comments/evid0p/i_feel_like_pictures_of_me_taken_over_the_last_5/ffx2ch1/,"i was bulimic in the beginning of high school, but i knocked out my teeth in an accident and i was too afraid to damage my feelings so i just started restricting :p i’m so glad i’m working on recovery, my body has been put through hell",False,False
ffwzagg,t3_evid0p,t1_ffwtwyi,westcoastwanderer,1,2020-01-29 10:12:45,/r/EDAnonymous/comments/evid0p/i_feel_like_pictures_of_me_taken_over_the_last_5/ffwzagg/,hahah amen amen,False,True
ffwz7o6,t3_evid0p,t1_ffwm61v,westcoastwanderer,1,2020-01-29 10:11:55,/r/EDAnonymous/comments/evid0p/i_feel_like_pictures_of_me_taken_over_the_last_5/ffwz7o6/,dude same. I like look at old pics and think about how I thought I looked so terrible and now I look at those pics as inspo,False,True
ffwz2ky,t3_evid0p,t1_ffwgteg,westcoastwanderer,1,2020-01-29 10:10:26,/r/EDAnonymous/comments/evid0p/i_feel_like_pictures_of_me_taken_over_the_last_5/ffwz2ky/,lmfao the TEETH. I've known my dentist for basically my whole life and I feel like she's scared to say something lol but if I notice sure as fuck a professional does lol,False,True
ffwysba,t3_evid0p,t1_ffw3kql,westcoastwanderer,1,2020-01-29 10:07:25,/r/EDAnonymous/comments/evid0p/i_feel_like_pictures_of_me_taken_over_the_last_5/ffwysba/,the truth hurts,False,True
ffwyoz5,t3_evid0p,t1_ffwlgm4,westcoastwanderer,1,2020-01-29 10:06:27,/r/EDAnonymous/comments/evid0p/i_feel_like_pictures_of_me_taken_over_the_last_5/ffwyoz5/,"LOL wow all these girls in my hometown are taking this ""holistic nutritionist"" bullsh*t degree... but they all skinny af and have lit instagrams so sign me the heck up",False,True
ffwyg76,t3_evid0p,t1_ffwdolw,westcoastwanderer,1,2020-01-29 10:03:53,/r/EDAnonymous/comments/evid0p/i_feel_like_pictures_of_me_taken_over_the_last_5/ffwyg76/,SOMEONE PUT US IN CONGRESS,False,True
ffwxt38,t3_evid0p,t1_ffwlgm4,Nicolo_Ultra,1,2020-01-29 09:57:14,/r/EDAnonymous/comments/evid0p/i_feel_like_pictures_of_me_taken_over_the_last_5/ffwxt38/,"[Nice](https://images.app.goo.gl/wyGC8ZEQNwU13WeJ9), thanks for the helpful tip!",False,False
ffwwr5y,t3_evid0p,t3_evid0p,littlelivethings,1,2020-01-29 09:46:06,/r/EDAnonymous/comments/evid0p/i_feel_like_pictures_of_me_taken_over_the_last_5/ffwwr5y/,"I lost a lot of weight when I was young and my EDNOS was mostly restrictive and I only purged a few times a month. Now I my tendencies are way more bulimic (doing really well with not purging for over a month but still binge and then restrict or exercise in excess to ""balance it out""), and I am 40 lbs over my lw and down 10 lbs from my hw and haven't lost more than 15 lbs in years and have never successfully kept it off. Fuck bulimia.",False,False
ffwwbem,t3_evid0p,t1_ffwt12s,levelupgirl,1,2020-01-29 09:41:26,/r/EDAnonymous/comments/evid0p/i_feel_like_pictures_of_me_taken_over_the_last_5/ffwwbem/,Oh my goddddddd some people just have no fucking clue. Being considerate isn’t this hard.,False,False
ffwtwyi,t3_evid0p,t3_evid0p,Main-Regular,1,2020-01-29 09:15:08,/r/EDAnonymous/comments/evid0p/i_feel_like_pictures_of_me_taken_over_the_last_5/ffwtwyi/,"I feel like if I were a kid and saw that I'd get huffy and be like ""NO it'll WORK for me because I'm the SPECIAL one!!!! &gt;:(""",False,False
ffwt12s,t3_evid0p,t1_ffwq4oa,apple_buns,1,2020-01-29 09:05:14,/r/EDAnonymous/comments/evid0p/i_feel_like_pictures_of_me_taken_over_the_last_5/ffwt12s/,"The worst part is that she critiqued them afterwards and made us make a new plan for an ""ideal day"" based on all her suggestions.",False,False
ffwrjxd,t3_evid0p,t3_evid0p,pokeupokeu,1,2020-01-29 08:48:12,/r/EDAnonymous/comments/evid0p/i_feel_like_pictures_of_me_taken_over_the_last_5/ffwrjxd/,I went from purging to c/sing thinking it would be better for me and help me lose weight and woohoo still just as shitty. Turns out eating disorders suck in general?,False,False
ffwq4oa,t3_evid0p,t1_ffwlgm4,levelupgirl,1,2020-01-29 08:31:19,/r/EDAnonymous/comments/evid0p/i_feel_like_pictures_of_me_taken_over_the_last_5/ffwq4oa/,"Duuuude I had to do the same thing, I just lied cause I couldn’t handle the stress of someone else judging what I actually ate in a week. Oof. Sorry that happened to you.",False,False
ffwo0ey,t3_evid0p,t1_ffwl7sn,crymeacoffeetable,1,2020-01-29 08:05:05,/r/EDAnonymous/comments/evid0p/i_feel_like_pictures_of_me_taken_over_the_last_5/ffwo0ey/,The puffy face is the first thing I see in all of the photos from my bulimic stage (bloating everywhere tbh but most noticeably in the face). Like many people on this forum I could only stop the b/p cycle by trading it for heavy restriction - too bad no one tells you you can get addicted to the b/p feeling 😒 I swear its a goddamn drug. Indeed worse subscription ever.,False,False
ffwm61v,t3_evid0p,t3_evid0p,MarieAmber,1,2020-01-29 07:41:06,/r/EDAnonymous/comments/evid0p/i_feel_like_pictures_of_me_taken_over_the_last_5/ffwm61v/,"I looked at pictures of myself just from last year and I’m jealous.. I’m no longer as thin as I used to be and I called myself fat.   Now I actually am fat and I’m stuck in a loop. Starve all day, eat a shit ton at night, then take pills to fall asleep because I can’t deal with my inability to resist.",False,False
ffwlgm4,t3_evid0p,t1_ffwk4od,apple_buns,1,2020-01-29 07:31:34,/r/EDAnonymous/comments/evid0p/i_feel_like_pictures_of_me_taken_over_the_last_5/ffwlgm4/,All you gotta do is a take a triggering as heck nutrition class where they make you count your calories for an entire week and then you realize how much you've been eating. Then slowly devolve back into disordered habits over the course of a year. Guaranteed to make you hate yourself again!,False,False
ffwl7sn,t3_evid0p,t3_evid0p,AShelterFromPigs,1,2020-01-29 07:28:15,/r/EDAnonymous/comments/evid0p/i_feel_like_pictures_of_me_taken_over_the_last_5/ffwl7sn/,"I literally gained weight, and once I went to treatment the weight came back off. Funny how eating like 10,000 cals a day of SHIT food doesn’t actually get you skinny (regardless of how hard you puke it all out)   Also it makes your face so puffy",False,False
ffwk4od,t3_evid0p,t1_ffwgjgh,Nicolo_Ultra,1,2020-01-29 07:13:04,/r/EDAnonymous/comments/evid0p/i_feel_like_pictures_of_me_taken_over_the_last_5/ffwk4od/,Yo I’m going to need to get in on that trade deal sis.,False,False
ffwgteg,t3_evid0p,t3_evid0p,steffnizzle,1,2020-01-29 06:21:45,/r/EDAnonymous/comments/evid0p/i_feel_like_pictures_of_me_taken_over_the_last_5/ffwgteg/,"Same! I discovered one day that I could look through my weight history on MFP, and yep, I’ve successfully lost and gained 25 pounds over and over since 2012. And never got to a point of being skinny or anywhere close to underweight, just cycling back and forth between healthy weight and overweight, with worse teeth than I started with.",False,False
ffwgjgh,t3_evid0p,t3_evid0p,apple_buns,1,2020-01-29 06:17:01,/r/EDAnonymous/comments/evid0p/i_feel_like_pictures_of_me_taken_over_the_last_5/ffwgjgh/,This hits. I struggled with bulimia for a good 5 years before I managed to recover. Now after a nice 6ish years eating disorder free I relapsed last year and now it's the complete opposite and I restrict. Yaaay I've traded one eating disorder for another.,False,False
ffwfsu2,t3_evid0p,t3_evid0p,mustyday,1,2020-01-29 06:03:42,/r/EDAnonymous/comments/evid0p/i_feel_like_pictures_of_me_taken_over_the_last_5/ffwfsu2/,I wouldn’t wish this shit on my worst enemy,False,False
ffwdolw,t3_evid0p,t1_ffwcy15,edie_carm,1,2020-01-29 05:21:38,/r/EDAnonymous/comments/evid0p/i_feel_like_pictures_of_me_taken_over_the_last_5/ffwdolw/,"Worst trade deal in the history of trade deals, possibly ever",False,False
ffwcy15,t3_evid0p,t3_evid0p,common_potato,1,2020-01-29 05:05:21,/r/EDAnonymous/comments/evid0p/i_feel_like_pictures_of_me_taken_over_the_last_5/ffwcy15/,Bulimia is hands down the worst deal I‘ve ever made,False,False
ffw3kql,t3_evid0p,t3_evid0p,dontfeedthehippos,1,2020-01-29 01:26:49,/r/EDAnonymous/comments/evid0p/i_feel_like_pictures_of_me_taken_over_the_last_5/ffw3kql/,Lmfao yeeeppppp,False,False
