Comment ID,Link ID,Parent ID,Author,Score,Publish Date,Permalink,Text,Stickied,Is Submitter
fn340cj,t3_f0e3y6,t1_fgupksc,m3r3d1th_,1,2020-04-11 08:37:46,/r/EDAnonymous/comments/f0e3y6/real_life_thinspo_is_so_much_more_triggering_than/fn340cj/,ah at least you have a bf!! Bitches like me are too obese for boys to even look at me lol,False,False
fguv9o4,t3_f0e3y6,t1_fguad3t,medieval-spirit,1,2020-02-07 20:50:02,/r/EDAnonymous/comments/f0e3y6/real_life_thinspo_is_so_much_more_triggering_than/fguv9o4/,"This is what living in Los Angeles is like. In LA...underweight is normal, common even, though no one likes to admit that it's the product of **intense** diet culture and expectations  I'd go so far as to say that the vast majority of the thinner people here (not just girls/women, actually a lot of men too) don't have a healthy relationship with food. It's incredibly triggering because not eating/undereating is considered ""normal.""",False,False
fgupksc,t3_f0e3y6,t3_f0e3y6,0seagirl,1,2020-02-07 19:47:49,/r/EDAnonymous/comments/f0e3y6/real_life_thinspo_is_so_much_more_triggering_than/fgupksc/,"Oh god, I couldn't agree more.   Especially if my bf is with me, I just want the ground to eat me up. I have actually ran home before I've been so triggered. This is why I'm not looking forward to the summer in the UK at all.",False,False
fgup5af,t3_f0e3y6,t3_f0e3y6,[deleted],1,2020-02-07 19:43:09,/r/EDAnonymous/comments/f0e3y6/real_life_thinspo_is_so_much_more_triggering_than/fgup5af/,[deleted],False,False
fgum3lu,t3_f0e3y6,t3_f0e3y6,thr0wawaynametaken,1,2020-02-07 19:10:04,/r/EDAnonymous/comments/f0e3y6/real_life_thinspo_is_so_much_more_triggering_than/fgum3lu/,"those constant ""that person has an eating disorder... and they're better at it than i am"" thoughts (:",False,False
fgudfak,t3_f0e3y6,t3_f0e3y6,Logical-Impact,2,2020-02-07 17:28:25,/r/EDAnonymous/comments/f0e3y6/real_life_thinspo_is_so_much_more_triggering_than/fgudfak/,This is why I need my daily dose of /r/instagramreality,False,False
fguad3t,t3_f0e3y6,t3_f0e3y6,k_otamatone,1,2020-02-07 16:54:21,/r/EDAnonymous/comments/f0e3y6/real_life_thinspo_is_so_much_more_triggering_than/fguad3t/,"A lot of the time, I try to realize that these stick thin girls probably don’t live a healthy life style. When I was super duper skinny, people commented on it all the time, but I wasn’t healthy. It’s triggering though, I know what you mean",False,False
