Comment ID,Link ID,Parent ID,Author,Score,Publish Date,Permalink,Text,Stickied,Is Submitter
eue0g17,t3_cfsh3r,t3_cfsh3r,tigerchik,1,2019-07-21 13:02:23,/r/EDAnonymous/comments/cfsh3r/expectation_vs_reality_ed_edition/eue0g17/,reality: GI issues,False,False
eudx1gj,t3_cfsh3r,t1_euda7tg,elhae,1,2019-07-21 12:21:17,/r/EDAnonymous/comments/cfsh3r/expectation_vs_reality_ed_edition/eudx1gj/,"that’s an excellent point. i would either lie to him, or be completely honest about my behaviors and make him crazy with worry. doesn’t sound ideal :(",False,False
eudt61y,t3_cfsh3r,t1_euc7cw1,Poopyoo,1,2019-07-21 11:34:30,/r/EDAnonymous/comments/cfsh3r/expectation_vs_reality_ed_edition/eudt61y/,"Oh fuck i did this the other day. My roommate brought home dominos. I was in the kiddle of making salmon and rice. He asks if i want any. I say, WhiLe CoOkIng, “uhh i guess ill try the pasta. But just a bit, im gonna eat all of this lol”  He proceeds to give me a bit of everything including a chicken wing and part of a lava cake. I actually really hat their lava cakes, its like eating pure sugar.   As son as he left i tasted the cake and buried it in the trash. I feel bad, but i did tell him i only wanted to try one bite of pasta.",False,False
eudbxc7,t3_cfsh3r,t1_eucuax1,strangerousdangers,1,2019-07-21 07:23:36,/r/EDAnonymous/comments/cfsh3r/expectation_vs_reality_ed_edition/eudbxc7/,"Telling mine was a good idea. If your boyfriend is understanding, do it, but if he’s going to be ignorant and say dumb triggering shit, maybe don’t.",False,False
eudbe86,t3_cfsh3r,t1_eucqwnj,Kriskross88,1,2019-07-21 07:13:03,/r/EDAnonymous/comments/cfsh3r/expectation_vs_reality_ed_edition/eudbe86/,"I’m sure this whole subreddit would want to help out, too.",False,False
eudaug3,t3_cfsh3r,t3_cfsh3r,ilikebigbooks98765,1,2019-07-21 07:01:35,/r/EDAnonymous/comments/cfsh3r/expectation_vs_reality_ed_edition/eudaug3/,Wow this should be a movie lol i could see everything in perfect detail in my head,False,False
eudab13,t3_cfsh3r,t1_eucyz9k,angilnibreathnach,1,2019-07-21 06:49:47,/r/EDAnonymous/comments/cfsh3r/expectation_vs_reality_ed_edition/eudab13/,"Yep, that and so many other shameful activities.",False,False
euda7tg,t3_cfsh3r,t1_eucuax1,angilnibreathnach,1,2019-07-21 06:47:52,/r/EDAnonymous/comments/cfsh3r/expectation_vs_reality_ed_edition/euda7tg/,"It depends what stage you’re at. If you’re still actively pursuing weight loss, you’ll end up lying to him and that will destroy trust. Same in all addiction. But if you’re fighting your way out, someone to keep you in check and support you can be very beneficial.",False,False
euda1sd,t3_cfsh3r,t1_euc7cw1,angilnibreathnach,1,2019-07-21 06:44:10,/r/EDAnonymous/comments/cfsh3r/expectation_vs_reality_ed_edition/euda1sd/,"So sad, isn’t it.",False,False
eud96tz,t3_cfsh3r,t3_cfsh3r,angilnibreathnach,1,2019-07-21 06:24:28,/r/EDAnonymous/comments/cfsh3r/expectation_vs_reality_ed_edition/eud96tz/,"Also reality: needs a colostomy bag because intestines stop performing peristalsis because of laxatives, throat and mouth cancer because of vomiting, osteoporosis leaving someone unable to do any funny activities because their bones break and crumble so easily, permanent cognitive deficit, loss of custody of children, divorce, unemployment, heart attacks, sudden death, rotting teeth, loss of friends, depression, the lost is endless and I’ve witnessed it all first hand. I imagine many of you are at earlier stages but this is where all roads lead.",False,False
eud5vmd,t3_cfsh3r,t3_cfsh3r,nakazanie,1,2019-07-21 04:59:02,/r/EDAnonymous/comments/cfsh3r/expectation_vs_reality_ed_edition/eud5vmd/,"This is my life, except I'm a lesbian and my SO says some hurtful shit sometimes like ""are you anorexic now??"" when I don't wanna eat the caloric bomb she's proposing me... Like... Babe, I've had an ED since the 7th grade, thought you understood that you can't just ""get over it"" and especially that one just doesn't ""become anorexic"" from one day to the other just to spite you.  At the same time I get where she's coming from... but hell, it does make it harder to exist and keep my ED mind at bay when I have to pretend to enjoy all that food and be okay just for somebody else's sake. AND THEN THEY TELL ME THAT.  To be an adult with an ED, a novel.",False,False
eud4t68,t3_cfsh3r,t1_eucq7ox,omg_for_real,1,2019-07-21 04:30:25,/r/EDAnonymous/comments/cfsh3r/expectation_vs_reality_ed_edition/eud4t68/,Same.,False,False
eud0j4j,t3_cfsh3r,t1_eucuax1,tomathoe,1,2019-07-21 02:41:56,/r/EDAnonymous/comments/cfsh3r/expectation_vs_reality_ed_edition/eud0j4j/,"It personally didn’t change much for me! If anything, he’s been helpful for the recovery process. For example, we bought a lock box to store his snacks in so that I don’t torture myself with the knowledge that there’s binge food in the house/eat all his snacks.   It was a little challenging at first since he didn’t understand bulimia very well (why can’t you just like stop purging??) but he’s good now!",False,False
eucyz9k,t3_cfsh3r,t3_cfsh3r,sintos-compa,1,2019-07-21 02:06:49,/r/EDAnonymous/comments/cfsh3r/expectation_vs_reality_ed_edition/eucyz9k/,You haven’t hid food from loved ones until you go dump it in the outside trash.,False,False
eucyogf,t3_cfsh3r,t1_eucq7ox,eyeinmaiden,1,2019-07-21 02:00:06,/r/EDAnonymous/comments/cfsh3r/expectation_vs_reality_ed_edition/eucyogf/,Omg 😅😅 yup.,False,False
eucvuf1,t3_cfsh3r,t3_cfsh3r,eardingu,1,2019-07-21 01:00:56,/r/EDAnonymous/comments/cfsh3r/expectation_vs_reality_ed_edition/eucvuf1/,I want to read an entire play like this now,False,False
eucuax1,t3_cfsh3r,t1_eucelwe,elhae,1,2019-07-21 00:31:40,/r/EDAnonymous/comments/cfsh3r/expectation_vs_reality_ed_edition/eucuax1/,i’m thinking about telling my boyfriend soon... does it really change that much?,False,False
euctcpe,t3_cfsh3r,t1_eucqwnj,beezythegiraffe,1,2019-07-21 00:14:24,/r/EDAnonymous/comments/cfsh3r/expectation_vs_reality_ed_edition/euctcpe/,Wait no can we leave the sugar coating in please? Sugar is one of my very few safe foods 😭,False,False
eucqwnj,t3_cfsh3r,t1_euceyaz,saltsplendasriracha,1,2019-07-20 23:32:23,/r/EDAnonymous/comments/cfsh3r/expectation_vs_reality_ed_edition/eucqwnj/,"You're onto something.  A book about the really unglamorous and sad interactions without humor, sugar-coating, or beautiful writing.",False,False
eucqs1j,t3_cfsh3r,t3_cfsh3r,saltsplendasriracha,1,2019-07-20 23:30:19,/r/EDAnonymous/comments/cfsh3r/expectation_vs_reality_ed_edition/eucqs1j/,"I'm so sorry that's your reality right now.  I hope that you can find a way out, together.",False,False
eucq7ox,t3_cfsh3r,t3_cfsh3r,AlarmedRefrigerator5,1,2019-07-20 23:21:06,/r/EDAnonymous/comments/cfsh3r/expectation_vs_reality_ed_edition/eucq7ox/,"Expectation: To The Bone   Reality: My 600-lb Life, but with purging",False,False
eucoeq3,t3_cfsh3r,t3_cfsh3r,1inthebox1inthebush,1,2019-07-20 22:53:01,/r/EDAnonymous/comments/cfsh3r/expectation_vs_reality_ed_edition/eucoeq3/,This is so relatable it hurts.  - signed a 34 year old too old for this bullshit but unwilling to change a damn thing. Sigh,False,False
eucjvhs,t3_cfsh3r,t1_eucelwe,IceK1ng,1,2019-07-20 21:46:40,/r/EDAnonymous/comments/cfsh3r/expectation_vs_reality_ed_edition/eucjvhs/,my friends that know have been very supportive about it but as soon as we’re drunk and they go to mcdonald’s for a night snack it just goes to hell. i really wish it wasn’t so hard to tell people lol,False,False
euceyaz,t3_cfsh3r,t3_cfsh3r,bulimicomrade,1,2019-07-20 20:39:46,/r/EDAnonymous/comments/cfsh3r/expectation_vs_reality_ed_edition/euceyaz/,This needs to be a book! It would be such a good addition to the eating disorder genre. Like a book contrasting stereotypical scenes from ED media with the reality,False,False
eucelwe,t3_cfsh3r,t3_cfsh3r,Kitizen,1,2019-07-20 20:35:07,/r/EDAnonymous/comments/cfsh3r/expectation_vs_reality_ed_edition/eucelwe/,I don't want that to be me. I wish I never told my SO about my ED.,False,False
eucecov,t3_cfsh3r,t3_cfsh3r,thinfritatas,1,2019-07-20 20:31:42,/r/EDAnonymous/comments/cfsh3r/expectation_vs_reality_ed_edition/eucecov/,"Expectation : being skinny, be loved, don't have problems anymore Reality : being fat, smelling like vomit and sadness, using your ED as a way to escape from reality 👌🏻",False,False
euce5cp,t3_cfsh3r,t3_cfsh3r,TheAdjunctTavore,1,2019-07-20 20:28:58,/r/EDAnonymous/comments/cfsh3r/expectation_vs_reality_ed_edition/euce5cp/,"This reminds me, I have a costco sample I hid in my purse that I have to bury.",False,False
euc7cw1,t3_cfsh3r,t3_cfsh3r,lilmissdisappearing,1,2019-07-20 18:58:04,/r/EDAnonymous/comments/cfsh3r/expectation_vs_reality_ed_edition/euc7cw1/,"Oof ouch owie  Close to home, sorry love. Just did the same raccoon trash burying shit with my husband.",False,False
