Comment ID,Link ID,Parent ID,Author,Score,Publish Date,Permalink,Text,Stickied,Is Submitter
famni22,t3_e9xexi,t3_e9xexi,0applecrumble,1,2019-12-12 21:35:17,/r/EDAnonymous/comments/e9xexi/whats_your_favourite_flavour_of_halo_top/famni22/,Choc hazelnut is my actual life. And toasted coconut,False,False
famn1hw,t3_e9xexi,t1_famhuem,plantbasedbitchh,1,2019-12-12 21:30:03,/r/EDAnonymous/comments/e9xexi/whats_your_favourite_flavour_of_halo_top/famn1hw/,the mint SLAPS! also the caramel flavor too,False,False
famlhwi,t3_e9xexi,t3_e9xexi,sushigem,1,2019-12-12 21:12:17,/r/EDAnonymous/comments/e9xexi/whats_your_favourite_flavour_of_halo_top/famlhwi/,birthday cake and pistachio,False,False
famk0u4,t3_e9xexi,t3_e9xexi,cyclecycleaddict,1,2019-12-12 20:55:23,/r/EDAnonymous/comments/e9xexi/whats_your_favourite_flavour_of_halo_top/famk0u4/,Oatmeal cookies yo.,False,False
famjsoq,t3_e9xexi,t3_e9xexi,kindbear_kindbud,1,2019-12-12 20:52:47,/r/EDAnonymous/comments/e9xexi/whats_your_favourite_flavour_of_halo_top/famjsoq/,"I've only tried the vegan flavors, I love PB cup and chocolate chip cookie dough. I'm jealous of all the dairy flavors",False,False
famhuem,t3_e9xexi,t3_e9xexi,babyfaced-bitch,1,2019-12-12 20:30:25,/r/EDAnonymous/comments/e9xexi/whats_your_favourite_flavour_of_halo_top/famhuem/,I like the mint chocolate chip,False,False
famht9f,t3_e9xexi,t3_e9xexi,kimooni,1,2019-12-12 20:30:04,/r/EDAnonymous/comments/e9xexi/whats_your_favourite_flavour_of_halo_top/famht9f/,"Candy bar, then regular ole vanilla bean.",False,False
famfpnn,t3_e9xexi,t3_e9xexi,sp00py13,1,2019-12-12 20:05:59,/r/EDAnonymous/comments/e9xexi/whats_your_favourite_flavour_of_halo_top/famfpnn/,That’s my favorite as well!,False,False
