Comment ID,Link ID,Parent ID,Author,Score,Publish Date,Permalink,Text,Stickied,Is Submitter
f4n69g0,t3_dku2xh,t3_dku2xh,TheMilkierMan,2,2019-10-21 14:29:19,/r/EDAnonymous/comments/dku2xh/wish_i_was_the_same_weight_but_like_6in_taller/f4n69g0/,"Same. Whenever I tell people my weight they say something to the effect of ""really? That's so small, you look like you should be heavier"" like YEAH THAT'S CAUSE I'M JUST SHORT",False,False
f4myjgr,t3_dku2xh,t3_dku2xh,MentalIceAge,2,2019-10-21 13:49:55,/r/EDAnonymous/comments/dku2xh/wish_i_was_the_same_weight_but_like_6in_taller/f4myjgr/,Same. What I would give to be a normal height.,False,False
f4kqh0u,t3_dku2xh,t3_dku2xh,Mohatmogeansai,1,2019-10-21 06:10:31,/r/EDAnonymous/comments/dku2xh/wish_i_was_the_same_weight_but_like_6in_taller/f4kqh0u/,I feel this in my soul,False,False
f4kknb9,t3_dku2xh,t3_dku2xh,CaterpillarTears,1,2019-10-21 05:21:32,/r/EDAnonymous/comments/dku2xh/wish_i_was_the_same_weight_but_like_6in_taller/f4kknb9/,I'd share some inches if I could.  I just want to be small and petite. Yet im tall and generally feel like godzilla.,False,False
f4kbs4t,t3_dku2xh,t3_dku2xh,penis-ylvania,1,2019-10-21 02:56:18,/r/EDAnonymous/comments/dku2xh/wish_i_was_the_same_weight_but_like_6in_taller/f4kbs4t/,Being short sucks because I know my weight is probably someone’s UGW but I look like a tree stump,False,False
f4kb7sh,t3_dku2xh,t1_f4jw3no,the_real_blobfish,1,2019-10-21 02:42:04,/r/EDAnonymous/comments/dku2xh/wish_i_was_the_same_weight_but_like_6in_taller/f4kb7sh/,Fuckin same dude,False,False
f4k3kdu,t3_dku2xh,t1_f4jw3no,mystic-dweller,1,2019-10-21 00:01:48,/r/EDAnonymous/comments/dku2xh/wish_i_was_the_same_weight_but_like_6in_taller/f4k3kdu/,"5'0 here, fml",False,False
f4k2vg2,t3_dku2xh,t3_dku2xh,petiteVSangel,1,2019-10-20 23:49:54,/r/EDAnonymous/comments/dku2xh/wish_i_was_the_same_weight_but_like_6in_taller/f4k2vg2/,"At this point, I would accept being 3 inches taller",False,False
f4k2e8a,t3_dku2xh,t1_f4jw3no,etherealaqua,1,2019-10-20 23:41:53,/r/EDAnonymous/comments/dku2xh/wish_i_was_the_same_weight_but_like_6in_taller/f4k2e8a/,sameeee ://,False,False
f4jwhu8,t3_dku2xh,t1_f4jw3no,notracisthasblackcat,4,2019-10-20 22:15:10,/r/EDAnonymous/comments/dku2xh/wish_i_was_the_same_weight_but_like_6in_taller/f4jwhu8/,Literally same,False,False
f4jw3no,t3_dku2xh,t1_f4jvffx,drinkpiss69420,5,2019-10-20 22:10:05,/r/EDAnonymous/comments/dku2xh/wish_i_was_the_same_weight_but_like_6in_taller/f4jw3no/,I’m literally 5’1 my TDEE is so damn low,False,True
f4jvffx,t3_dku2xh,t3_dku2xh,notracisthasblackcat,4,2019-10-20 22:03:47,/r/EDAnonymous/comments/dku2xh/wish_i_was_the_same_weight_but_like_6in_taller/f4jvffx/,Lol if I were 6 in taller I could gain 15lbs and still be happy. This being short shit sucks,False,False
f4jtiym,t3_dku2xh,t3_dku2xh,mish321,3,2019-10-20 21:46:57,/r/EDAnonymous/comments/dku2xh/wish_i_was_the_same_weight_but_like_6in_taller/f4jtiym/,this right here is a big mood officer,False,False
