Comment ID,Link ID,Parent ID,Author,Score,Publish Date,Permalink,Text,Stickied,Is Submitter
fbir511,t3_dscou3,t3_dscou3,doublemetalaxis,1,2019-12-21 00:43:36,/r/EDAnonymous/comments/dscou3/purged_in_a_toilet_and_my_puke_plopped_the_water/fbir511/,This has happened to me too 😭😭😭 and I use the toilet paper trick that’s supposed to prevent splashback 😔,False,False
f6q9ua3,t3_dscou3,t3_dscou3,crystal-power,1,2019-11-06 14:50:23,/r/EDAnonymous/comments/dscou3/purged_in_a_toilet_and_my_puke_plopped_the_water/f6q9ua3/,Have you ever had it splash back into your throat? Ooooooof.,False,False
f6p56lu,t3_dscou3,t3_dscou3,many_mishaps_melly,1,2019-11-06 07:42:17,/r/EDAnonymous/comments/dscou3/purged_in_a_toilet_and_my_puke_plopped_the_water/f6p56lu/,I KNOW EXACTLY WHAT THIS IS LIKE. I haven't purged through vomiting in a really long time but this is not something you forget the feeling of.  I could literally feel that feeling while reading this.,False,False
f6p4dwt,t3_dscou3,t3_dscou3,Pink_salts,1,2019-11-06 07:31:10,/r/EDAnonymous/comments/dscou3/purged_in_a_toilet_and_my_puke_plopped_the_water/f6p4dwt/,Splashbacks are the worst. It’s like vomit karma.,False,False
f6p2u9k,t3_dscou3,t3_dscou3,unbearably-white,1,2019-11-06 07:08:14,/r/EDAnonymous/comments/dscou3/purged_in_a_toilet_and_my_puke_plopped_the_water/f6p2u9k/,Poseidon's kiss :'),False,False
f6oz916,t3_dscou3,t3_dscou3,galacticshock,1,2019-11-06 06:08:24,/r/EDAnonymous/comments/dscou3/purged_in_a_toilet_and_my_puke_plopped_the_water/f6oz916/,I’ve had a near miss and was on edge for the rest of the day.  A tough experience!!   Now I just keep my eyes closed. I don’t wanna see anyway. It’s like watching me give up on life and literally flush it down the sewer.,False,False
f6oprc8,t3_dscou3,t3_dscou3,cowboyhatcowboyhat,1,2019-11-06 02:20:09,/r/EDAnonymous/comments/dscou3/purged_in_a_toilet_and_my_puke_plopped_the_water/f6oprc8/,"put toilet paper in over the water first hun , makes it quiter too if that's a concern . lots of love to you x",False,False
