Comment ID,Link ID,Parent ID,Author,Score,Publish Date,Permalink,Text,Stickied,Is Submitter
f18mvtu,t3_d80kvy,t3_d80kvy,antisocialbeach,1,2019-09-23 12:38:09,/r/EDAnonymous/comments/d80kvy/being_sick_is_nice_in_a_messed_up_way/f18mvtu/,"Totally get it.   My current restriction period all started with a flu.  I couldn't eat for a couple days, so once I felt better I though why not just keep it going?! Fmlllllll -20lbs later...",False,False
f16jggl,t3_d80kvy,t3_d80kvy,seastaralgebras,1,2019-09-22 23:52:27,/r/EDAnonymous/comments/d80kvy/being_sick_is_nice_in_a_messed_up_way/f16jggl/,"I get it. This was back when I wasn’t that fat, but I lost about 5 lbs in a weekend because I was anemic and had a could, so I was too weak to even make myself microwaveable mac and cheese. I basically depended on my roommates to even have a small meal. Now I’m really wishing that could happen to me so I could just stop being fat. :(",False,False
f16casl,t3_d80kvy,t3_d80kvy,now_everybodys_DEAD,1,2019-09-22 22:10:33,/r/EDAnonymous/comments/d80kvy/being_sick_is_nice_in_a_messed_up_way/f16casl/,"Not so much sick but I really wish I had an excuse to be hospitalized again (for non ed reasons). I was in the ICU for a week and in the hospital for a while after a few years ago (bad accident) and *maaaan* was it nice. 3 meals a day, which you order by ticking little boxes on a menu paper (so satisfying) and when you dont eat, it's fine because ""oh honey you're on a ton of pain meds, no appetite is normal!"" And then since you're so hopped up on meds you are basically in a dream state 24/7. So nice. And no stress or responsibilities.....",False,False
f16avh5,t3_d80kvy,t3_d80kvy,Annieboot,1,2019-09-22 21:51:57,/r/EDAnonymous/comments/d80kvy/being_sick_is_nice_in_a_messed_up_way/f16avh5/,My throat is sore now and I’m just exhausted so if I can just sleep and have broth I should lose a few kg hopefully  I hate how much I’ve gained in recovery,False,True
f16ary4,t3_d80kvy,t3_d80kvy,PeachyyAsian,2,2019-09-22 21:50:46,/r/EDAnonymous/comments/d80kvy/being_sick_is_nice_in_a_messed_up_way/f16ary4/,Definitely. I got a sore throat once and didn't eat for days. Now that it's becoming fall a small part of me wishes that I'll get sick again soon.,False,False
