Comment ID,Link ID,Parent ID,Author,Score,Publish Date,Permalink,Text,Stickied,Is Submitter
eauc1az,t3_a1yuhg,t3_a1yuhg,__jam__,1,2018-12-01 01:50:07,/r/EDAnonymous/comments/a1yuhg/fasted_then_binged_now_sharp_stomach_pains/eauc1az/,Peppermint and ginger helps with digestion and stomach issues. Maybe try some of that? I know that you can get both in a tea and it’s wonderful.,False,False
eau2zvm,t3_a1yuhg,t3_a1yuhg,cakeghoul,1,2018-11-30 22:31:34,/r/EDAnonymous/comments/a1yuhg/fasted_then_binged_now_sharp_stomach_pains/eau2zvm/,"It could be too much acid in your stomach maybe? A little bit of milk usually helps for me, at first I also thought carbs would make it better but i found dairy works best ",False,False
eau2s1f,t3_a1yuhg,t3_a1yuhg,veganvapinggeekazoid,1,2018-11-30 22:27:45,/r/EDAnonymous/comments/a1yuhg/fasted_then_binged_now_sharp_stomach_pains/eau2s1f/,That happens to me every time.  Takes hours to leave and hurts like crap,False,False
eatxmvn,t3_a1yuhg,t1_eatuedo,wildermonsters,1,2018-11-30 21:01:58,/r/EDAnonymous/comments/a1yuhg/fasted_then_binged_now_sharp_stomach_pains/eatxmvn/,I don't think it just gas unless it's trapped weirdly in my stomach. I'm about to go get meds but I'm not sure what would solve the problem ha. Peppermint tea is a good idea too!!,False,True
eatuedo,t3_a1yuhg,t3_a1yuhg,losingmattie,1,2018-11-30 20:10:38,/r/EDAnonymous/comments/a1yuhg/fasted_then_binged_now_sharp_stomach_pains/eatuedo/,Is it gas? Do you have medicine or peppermint tea?,False,False
