Comment ID,Link ID,Parent ID,Author,Score,Publish Date,Permalink,Text,Stickied,Is Submitter
fdfac40,t3_el1zfa,t1_fdfa0rg,___nonymous,2,2020-01-06 18:30:11,/r/EDAnonymous/comments/el1zfa/calorie_counting/fdfac40/,"Well alrighty, German Google says 237 cals (per 100g)😂 I guess 220-300 cals per 100g are realistic :)",False,False
fdfa0rg,t3_el1zfa,t1_fdf9xqz,bailsforreal,2,2020-01-06 18:26:37,/r/EDAnonymous/comments/el1zfa/calorie_counting/fdfa0rg/,Chicken back. I didn’t wanna say it cause I sound southern af eating chicken back 😭😂,False,True
fdf9xqz,t3_el1zfa,t3_el1zfa,___nonymous,2,2020-01-06 18:25:40,/r/EDAnonymous/comments/el1zfa/calorie_counting/fdf9xqz/,What is it?,False,False
fdf6wd7,t3_el1zfa,t1_fdf59p4,bailsforreal,3,2020-01-06 17:51:33,/r/EDAnonymous/comments/el1zfa/calorie_counting/fdf6wd7/,I did. Most say with or without bone and the only one using measurements said 3.5 oz 173 so I put it in my fitness pass based on that,False,True
fdf59p4,t3_el1zfa,t3_el1zfa,ZiggyStardustWasHere,5,2020-01-06 17:33:39,/r/EDAnonymous/comments/el1zfa/calorie_counting/fdf59p4/,Make sure to check the grams/cups/ozs.,False,False
