Comment ID,Link ID,Parent ID,Author,Score,Publish Date,Permalink,Text,Stickied,Is Submitter
f0sgedv,t3_d69ehd,t3_d69ehd,Firequeeeeeen,1,2019-09-19 09:48:26,/r/EDAnonymous/comments/d69ehd/does_anyone_else_have_hella_problems_with_sleep/f0sgedv/,I literally just came here to post this thought. I’ve been sleeping so poorly! And every time I toss and turn I need to body check. But like what is the solution?? Eat??,False,False
f0sgaou,t3_d69ehd,t3_d69ehd,DavidFrumTheBlock,1,2019-09-19 09:47:43,/r/EDAnonymous/comments/d69ehd/does_anyone_else_have_hella_problems_with_sleep/f0sgaou/,It comes and goes.  Either I’m tired and asleep by 8:30 or I’m up until 3am,False,False
f0revs6,t3_d69ehd,t3_d69ehd,PM_ME_YER_SHIBA_INUS,1,2019-09-19 03:29:06,/r/EDAnonymous/comments/d69ehd/does_anyone_else_have_hella_problems_with_sleep/f0revs6/,Apparently my body reacts to heavy restriction nowadays with liquid shitting and compulsive vomiting that leaves me swallowing my own blood.  At *3 freakin am.*  It's like the worst symptoms of this shit got together and had a fiesta.,False,False
f0rb2oy,t3_d69ehd,t3_d69ehd,bir_die,1,2019-09-19 02:39:36,/r/EDAnonymous/comments/d69ehd/does_anyone_else_have_hella_problems_with_sleep/f0rb2oy/,"Yeah, I basically plan my eating around when I’m going to bed. I save some calories for bedtime so I can actually sleep before work.   Otherwise, I’m weirdly exhausted during the day and frequently nap. But when I need to sleep??? Absolutely not.",False,False
f0r9lqb,t3_d69ehd,t3_d69ehd,cfarthing77,1,2019-09-19 02:20:00,/r/EDAnonymous/comments/d69ehd/does_anyone_else_have_hella_problems_with_sleep/f0r9lqb/,"It’s 2am, and I haven’t slept yet. Don’t even really feel tired.",False,False
f0r63rc,t3_d69ehd,t3_d69ehd,paraphrasis,1,2019-09-19 01:35:58,/r/EDAnonymous/comments/d69ehd/does_anyone_else_have_hella_problems_with_sleep/f0r63rc/,"Yup, I do. Restriction + 27 years of insomnia is definitely not working for me. I only sleep because of my sleeping pills, that I am now widely dependent on.",False,False
f0r3qel,t3_d69ehd,t3_d69ehd,notoftheearth,1,2019-09-19 01:06:40,/r/EDAnonymous/comments/d69ehd/does_anyone_else_have_hella_problems_with_sleep/f0r3qel/,Yes I’m so exhausted but I couldn’t sleep last night.,False,False
