Comment ID,Link ID,Parent ID,Author,Score,Publish Date,Permalink,Text,Stickied,Is Submitter
ewg5npv,t3_co2tv1,t3_co2tv1,cocoakobra,1,2019-08-09 13:13:53,/r/EDAnonymous/comments/co2tv1/this_thread_is_for_my_nasty_eders_only/ewg5npv/,"I used to purge small amounts into straws in paper cups while in public. A lot of my friends know I have an eating disorder, so I couldn’t just slip away to the bathroom most times I went out to eat with friends. So, to get around that and still do what I had to do, I’d regurgitate small amounts and push them down the straw and hope it just looked like I was drinking. By the end of the night my cup would be full again, this time just with vomit.  I also purged into empty cans a Lot. I used to forget about my purge cans in my truck and at the end of a bad week I’d end up throwing away 6-7 full cans of (because they’d been left in the truck and I live in Arizona) hot vomit.   One time when I was teenager one of my vomit cups was knocked over on a table. Can not describe to you how humiliated I was.",False,False
ewg5bz9,t3_co2tv1,t1_ewg3vrl,BigBootySnitches,1,2019-08-09 13:10:30,/r/EDAnonymous/comments/co2tv1/this_thread_is_for_my_nasty_eders_only/ewg5bz9/,"Also, my cat is named Pootie and so I love the username!",False,True
ewg5bqt,t3_co2tv1,t3_co2tv1,tokieofrivia,1,2019-08-09 13:10:26,/r/EDAnonymous/comments/co2tv1/this_thread_is_for_my_nasty_eders_only/ewg5bqt/,"I’ve been suffering from anorexia since I was 10/11 (I’m 23 now) but when I was in high school, I’d b/p from time to time. One of those times, I ate an entire loaf of chocolate chip banana bread before school and didn’t realize my mom was still home until it was too late. I couldn’t purge if she was home! She knew too much already!  So I ran out the door, got into my car, and drove to the nearest grocery store to purge. However, their bathrooms were broken so I just had to rush to school. Everyone knew about my eating disorder (it was, and still is, painfully obvious) so I couldn’t purge at school but I couldn’t keep this loaf of banana bread in my stomach so... I grabbed a plastic grocery bag, crawled into the backseat of my car, hunkered down and purged right there in the parking lot.  I thought I was in the clear! Nope. There was a hole in the bag. The world really didn’t want me to purge that day. Vomit was leaking out all over my car and I had to think QUICK. My course of action? Dump the bag out all over the back of my car and on myself to make it look like I got sick and drove back home.  Yea. My mom knew. Why would the vomit be in a plastic bag (that I forgot to toss) and in the BACKSEAT if I “randomly” got sick. I was in treatment less than a month later 😕",False,False
ewg5agn,t3_co2tv1,t1_ewg2a6h,SmokeMeAKipper-,1,2019-08-09 13:10:03,/r/EDAnonymous/comments/co2tv1/this_thread_is_for_my_nasty_eders_only/ewg5agn/,/r/BoneAppleTea,False,False
ewg586d,t3_co2tv1,t1_ewg3vrl,BigBootySnitches,1,2019-08-09 13:09:24,/r/EDAnonymous/comments/co2tv1/this_thread_is_for_my_nasty_eders_only/ewg586d/,"Thank you, I feel so clean!!! My legs fell asleep, my back was aching, and I was so sweaty by the end of it, but damn if I didn't IMMEDIATELY step back on that scale like the nasty goblin that I am, and boy was that validation a rush 😂😂",False,True
ewg4eta,t3_co2tv1,t1_ewg40ah,DisguisedAsMe,1,2019-08-09 13:00:56,/r/EDAnonymous/comments/co2tv1/this_thread_is_for_my_nasty_eders_only/ewg4eta/,Lmao it doesn't burn half as much as other foods for sure,False,False
ewg40ah,t3_co2tv1,t1_ewfhdfk,pineconestan,1,2019-08-09 12:56:45,/r/EDAnonymous/comments/co2tv1/this_thread_is_for_my_nasty_eders_only/ewg40ah/,Purging ice cream is so nice ngl,False,False
ewg3vrl,t3_co2tv1,t3_co2tv1,Pootties,1,2019-08-09 12:55:25,/r/EDAnonymous/comments/co2tv1/this_thread_is_for_my_nasty_eders_only/ewg3vrl/,Congratulations! I fucking feel so amazing after a huge poop. One of life's simple pleasures.,False,False
ewg3lqe,t3_co2tv1,t3_co2tv1,ifuckpineapples,1,2019-08-09 12:52:28,/r/EDAnonymous/comments/co2tv1/this_thread_is_for_my_nasty_eders_only/ewg3lqe/,"not as nasty but when im making cookies and theres a little dough left over but not enough for a full cookie, i scoop it into my mouth, c&amp;s it, and spit it directly into the garbage disposal.  Ive also accidentally c&amp;s'd onto my own arm when i wasnt paying attention to where the bag was relative to my mouth. That was fun to deal with in my car.",False,False
ewg2trp,t3_co2tv1,t1_ewg2o2x,EzraCelestine,1,2019-08-09 12:44:17,/r/EDAnonymous/comments/co2tv1/this_thread_is_for_my_nasty_eders_only/ewg2trp/,Never underestimate the horniness of repressed rural high schoolers.  Goes for me too lmao. May or may not have still gone down on that one girl after she threw up on me. Mama didn't raise a quitter but she did raise a dumb bitch,False,False
ewg2o2x,t3_co2tv1,t1_ewfrk1n,sanfranciscofranco,1,2019-08-09 12:42:38,/r/EDAnonymous/comments/co2tv1/this_thread_is_for_my_nasty_eders_only/ewg2o2x/,Damn who are these people who know they have the flu but are still more than willing to make out with someone?,False,False
ewg2a6h,t3_co2tv1,t1_ewfhdfk,squishykiss,1,2019-08-09 12:38:41,/r/EDAnonymous/comments/co2tv1/this_thread_is_for_my_nasty_eders_only/ewg2a6h/,“lack toast in toddler ants” i fucking can’t lmaooooo,False,False
ewg15qf,t3_co2tv1,t1_ewfyuwh,flamingtrashmonster,1,2019-08-09 12:27:02,/r/EDAnonymous/comments/co2tv1/this_thread_is_for_my_nasty_eders_only/ewg15qf/,"That sounds rough. I create a circulation-booster pill cocktail that consists of magnesium, potassium, and moringa powder (super good for iron) which helps me and my poor circulatory health. Though of course your issues could be different.",False,False
ewg0mf4,t3_co2tv1,t1_ewg0hj5,vanillabake,1,2019-08-09 12:21:33,/r/EDAnonymous/comments/co2tv1/this_thread_is_for_my_nasty_eders_only/ewg0mf4/,They all know I’m anorexic. I’m not sure if they know that I c/s. They know I purge so maybe they thought it was that or rotten food :s,False,False
ewg0hj5,t3_co2tv1,t1_ewfvjsv,LowCalPal,1,2019-08-09 12:20:07,/r/EDAnonymous/comments/co2tv1/this_thread_is_for_my_nasty_eders_only/ewg0hj5/,What would a normal person even think of a c/s bag?,False,False
ewfz4oq,t3_co2tv1,t1_ewfsoka,alibunn,1,2019-08-09 12:06:41,/r/EDAnonymous/comments/co2tv1/this_thread_is_for_my_nasty_eders_only/ewfz4oq/,"19 was a real time for me too. My personal worst/best was over the edge of an empty multi-story car park onto the sidewalk below while my friend used it to ride around on his skateboard (he was giving me lessons, and I was “taking a break” so he went around on his own- timing was very essential)",False,False
ewfyuwh,t3_co2tv1,t1_ewfu02n,fatpigeon_,1,2019-08-09 12:03:57,/r/EDAnonymous/comments/co2tv1/this_thread_is_for_my_nasty_eders_only/ewfyuwh/,"I’m not sure, I’ve had this problem for ages and I get blood tested 2 or 3 times a year by my psychiatrist. I know he checks for anemia or other vitamin deficiencies.",False,False
ewfyoz5,t3_co2tv1,t1_ewfv88j,alibunn,1,2019-08-09 12:02:18,/r/EDAnonymous/comments/co2tv1/this_thread_is_for_my_nasty_eders_only/ewfyoz5/,"This happened to me in college once lol. After eating a great deal in the cafeteria I went to the second floor wheelchair access private bathroom and there was already some puke on the toilet. Not lots, but enough that a normal person would probably have been grossed out. I just wiped it off and got on with my own business like “nbd sister, I feel u”",False,False
ewfykev,t3_co2tv1,t1_ewfrhrk,hammerprice,1,2019-08-09 12:01:02,/r/EDAnonymous/comments/co2tv1/this_thread_is_for_my_nasty_eders_only/ewfykev/,Oh I can major relate to those binges. I'm so glad you got out of there - you're incredibly strong!,False,False
ewfyei8,t3_co2tv1,t1_ewfv88j,EzraCelestine,1,2019-08-09 11:59:25,/r/EDAnonymous/comments/co2tv1/this_thread_is_for_my_nasty_eders_only/ewfyei8/,"Reminds me of that graffiti on the underside of a toilet seat that got posted to /r/EDanonymemes a month or so back that said ""Drunk, or purging?""",False,False
ewfxav2,t3_co2tv1,t3_co2tv1,rubbernoodle,1,2019-08-09 11:48:36,/r/EDAnonymous/comments/co2tv1/this_thread_is_for_my_nasty_eders_only/ewfxav2/,"I wanted to throw out some Nutella so I wouldn’t be tempted but realized the plastic jar was recyclable. (It was already used so I couldn’t donate it.) I let most of it drip into the trash can, then stuck my BARE HAND like a raccoon into the jar and c/s’d the remnants over the trash can.",False,False
ewfw89l,t3_co2tv1,t1_ewfhdfk,WildConclusion,1,2019-08-09 11:38:20,/r/EDAnonymous/comments/co2tv1/this_thread_is_for_my_nasty_eders_only/ewfw89l/,This is next level,False,False
ewfvjsv,t3_co2tv1,t3_co2tv1,vanillabake,1,2019-08-09 11:31:36,/r/EDAnonymous/comments/co2tv1/this_thread_is_for_my_nasty_eders_only/ewfvjsv/,"I like to chew and spit entire pizzas and chocolate into a bag while I’m drunk in my room 🙃 once I left the bag in my car on a hot day, my family member borrowed the car and said:  “We cleaned out the car for you, it smelled rotten and like vinegar in there!”  Cue mini heart attack from them possibly finding my c/s bag",False,False
ewfv88j,t3_co2tv1,t1_ewftnu8,LowCalPal,1,2019-08-09 11:28:28,/r/EDAnonymous/comments/co2tv1/this_thread_is_for_my_nasty_eders_only/ewfv88j/,"Once I stayed with my parents at a fancy hotel and we ate breakfast at the restaurant there.  Obviously, 80% of the way through, I excused myself to purge.  In the fancy hotel bathroom, I lifted up the toilet seat and there was *already* mostly wiped-clean barf on the toilet bowl.  I was like, ""Gross, but also, I understand you, my sister""",False,False
ewfu02n,t3_co2tv1,t1_ewft8fb,flamingtrashmonster,1,2019-08-09 11:17:50,/r/EDAnonymous/comments/co2tv1/this_thread_is_for_my_nasty_eders_only/ewfu02n/,It sounds like you could be anemic?,False,False
ewftnu8,t3_co2tv1,t1_ewfsoka,flamingtrashmonster,1,2019-08-09 11:15:09,/r/EDAnonymous/comments/co2tv1/this_thread_is_for_my_nasty_eders_only/ewftnu8/,"Dude same. I'd purge (and binge) anywhere, if I had to. I was so done with it all, I just didn't care if someone heard or saw me or whatever. I felt like a wild animal, especially when I'd puke in a forest/bush/outside on the ground and then bury the puke with dirt lol.",False,False
ewft8fb,t3_co2tv1,t3_co2tv1,fatpigeon_,1,2019-08-09 11:11:45,/r/EDAnonymous/comments/co2tv1/this_thread_is_for_my_nasty_eders_only/ewft8fb/,"Gross in a different way than what other people might respond. I have undiagnosed circulation problems and suspected heart issues (present before but probably exacerbated by restriction).   I’m constantly freezing and I sometimes lose feeling in my fingers or toes/feet. They also turn purple/grey going towards black when it’s really bad. I don’t know if it’s the colder streak weather but I have been unable to move my two baby toes  for almost a week and they aren’t changing back from purple. I’m going to hit goal weight by the end August/mid-September and I won’t go to the doctor because they’ll tell me to quote smoking and caffeine. I need that shit to restrict, if I lose some of my fucking toes for this...",False,False
ewfsoka,t3_co2tv1,t1_ewfrhrk,LowCalPal,1,2019-08-09 11:07:30,/r/EDAnonymous/comments/co2tv1/this_thread_is_for_my_nasty_eders_only/ewfsoka/,"Sounds like me at 19 tbh.  That whole couple of years is just a blur of puking in my bathroom, other people's bathrooms, public bathrooms, ditches, allies, behind schools, behind grocery stores, between dumpsters, in the woods, in parking lots, on the side of the road, in the park, in garbage cans, on construction sites.  I was super unclassy with my vomiting.",False,False
ewfrk1n,t3_co2tv1,t1_ewfrb2d,EzraCelestine,1,2019-08-09 10:59:26,/r/EDAnonymous/comments/co2tv1/this_thread_is_for_my_nasty_eders_only/ewfrk1n/,Step 1: Have a bit of a reputation as someone who'll hook up with whoever's down  Step 2: Find people with the flu  Step 3: Make out with those people,False,False
ewfrhrk,t3_co2tv1,t1_ewfqoy3,flamingtrashmonster,1,2019-08-09 10:58:58,/r/EDAnonymous/comments/co2tv1/this_thread_is_for_my_nasty_eders_only/ewfrhrk/,"I was fucked up man. At the time of the bucket fiasco (when I was 19), I was B/Ping on around $80-$100 of food a day. That’s literally all I’d do, from waking to sleeping, aside from when I’d go out to get more food.   Thankfully I’m way better now and am actually really healthy aside from some hormonal issues.",False,False
ewfrb2d,t3_co2tv1,t1_ewfn92t,ksck135,1,2019-08-09 10:57:39,/r/EDAnonymous/comments/co2tv1/this_thread_is_for_my_nasty_eders_only/ewfrb2d/,wtf how do you purposely catch flu?,False,False
ewfr19l,t3_co2tv1,t1_ewfqops,EzraCelestine,1,2019-08-09 10:55:44,/r/EDAnonymous/comments/co2tv1/this_thread_is_for_my_nasty_eders_only/ewfr19l/,Oh dude it was so safe feeling the only issue was I couldn't skedaddle to the garage immediately after every meal without drawing suspicion so the purging didn't actually do anything for my weight it just fucked up my teeth,False,False
ewfqoy3,t3_co2tv1,t1_ewfjlgq,hammerprice,1,2019-08-09 10:53:16,/r/EDAnonymous/comments/co2tv1/this_thread_is_for_my_nasty_eders_only/ewfqoy3/,It got too heavy for you to lift in half a day?? Damn!,False,False
ewfqops,t3_co2tv1,t1_ewfpzl1,flamingtrashmonster,1,2019-08-09 10:53:13,/r/EDAnonymous/comments/co2tv1/this_thread_is_for_my_nasty_eders_only/ewfqops/,In a way I guess that would feel safer? Like you have your own little place to purge and be freely bulimic? When I lived with my parents I would unwittingly hoard wrappers in my bedroom and buckets of puke (though mainly because I had no way of removing them without risking getting caught).,False,False
ewfpzl1,t3_co2tv1,t1_ewfphl2,EzraCelestine,1,2019-08-09 10:48:20,/r/EDAnonymous/comments/co2tv1/this_thread_is_for_my_nasty_eders_only/ewfpzl1/,"Hey, don't knock it, it's an effective tactic. Due to some weird-ass reasons I don't feel like getting into, my desk was in the garage in high school, and the garage was a separate building. I went to firehouse subs and got one of their 2-dollar 5-gallon pickle brining buckets and would purge in there. Not only was it in a separate building (so no one could hear), but the thing smelled so fucking strongly of pickles that it honestly overpowered the vomit for like, the first three gallons",False,False
ewfphl2,t3_co2tv1,t1_ewfjlgq,5FootArmrest,1,2019-08-09 10:44:44,/r/EDAnonymous/comments/co2tv1/this_thread_is_for_my_nasty_eders_only/ewfphl2/,wtf lol,False,False
ewfn92t,t3_co2tv1,t3_co2tv1,EzraCelestine,1,2019-08-09 10:29:00,/r/EDAnonymous/comments/co2tv1/this_thread_is_for_my_nasty_eders_only/ewfn92t/,I have purposefully caught the flu 6 different times in my life with the express purpose of losing weight,False,False
ewfjlgq,t3_co2tv1,t3_co2tv1,flamingtrashmonster,1,2019-08-09 09:51:43,/r/EDAnonymous/comments/co2tv1/this_thread_is_for_my_nasty_eders_only/ewfjlgq/,The water got shut off in my apartment building for like half a day once. I found this huge bucket that must have been used to carry paint. Like it must have been able to hold a gallon of liquid.   My bulimic ass used that the purge into. Only it became too fucking heavy for me to move. But thankfully my big ED brain self went and paid a homeless guy/guy who was collecting bottles nearby to help me lift the bucket into the dumpster (lid was on the bucket thankfully).,False,False
ewfhdfk,t3_co2tv1,t3_co2tv1,fishonthesun,1,2019-08-09 09:27:46,/r/EDAnonymous/comments/co2tv1/this_thread_is_for_my_nasty_eders_only/ewfhdfk/,"Sometimes if I know I'll be home alone, I'll eat a low cal dairy treat (aka halo top). And then a few hours later when the lack toast in toddler ants hits, I eat ben and Jerry's like a madman before I gotta shit. And then I purge it into a bucket while I have diarrhea from the earlier lactose. Bonus points if it's the only thing i ate that day. And then when I'm done I'm grinning like a madman because of that reLeAsE from purging",False,False
