Comment ID,Link ID,Parent ID,Author,Score,Publish Date,Permalink,Text,Stickied,Is Submitter
ffxi5o4,t3_evnc2k,t3_evnc2k,MentalIceAge,1,2020-01-29 13:20:24,/r/EDAnonymous/comments/evnc2k/my_ed_made_me_a_bad_student/ffxi5o4/,"For some reason I got good results but I was a terrible student, I used to sleep in every chemistry and English when I was restricting because I was at the back lol. And the skiving off to obsessively walk around with my crappy little pedometer. And fainting twice in orchestra...",False,False
ffxbjj2,t3_evnc2k,t1_ffwuean,ash_alah,1,2020-01-29 12:16:12,/r/EDAnonymous/comments/evnc2k/my_ed_made_me_a_bad_student/ffxbjj2/,"If you like reading, i‘ve heard that her bulimia is brought up more in the books!",False,False
ffwygby,t3_evnc2k,t3_evnc2k,littlelivethings,1,2020-01-29 10:03:55,/r/EDAnonymous/comments/evnc2k/my_ed_made_me_a_bad_student/ffwygby/,"As someone who graduated from college the year that my ED was really bad, I feel this. I was very disciplined until I started drinking a bottle of wine a night and skipping classes because I felt like shit from drinking a lot and not eating and having lots of casual sex because I was finally \*thin\*  Now I am a professor (I know, fucked up) as part of my PhD program, and I urge you to go to your counseling center and get some kind of treatment/accommodations so you don't waste your parents' money/loan money and can pass your classes. Sorry if it seems like I am momming you...I just feel so much for my students who are skipping class due to mental illness and would much rather they withdraw and seek help than force me to fail them.",False,False
ffwuqxp,t3_evnc2k,t1_ffwuean,potentialperfection,1,2020-01-29 09:24:24,/r/EDAnonymous/comments/evnc2k/my_ed_made_me_a_bad_student/ffwuqxp/,"Honestly! I wish during one season (like even in the background), she attended treatment for her relapse or something. That would be nice.",False,False
ffwuean,t3_evnc2k,t1_ffwruk1,athenaoof,1,2020-01-29 09:20:24,/r/EDAnonymous/comments/evnc2k/my_ed_made_me_a_bad_student/ffwuean/,nicee!! i just started with gossip girl and felt so heard when blair ate and purged the entire pie in that one episode. wished they touched on it more tho as i could only imagine how prevalent eds are in rich suburban good ol us of a,False,True
ffwruk1,t3_evnc2k,t3_evnc2k,potentialperfection,1,2020-01-29 08:51:40,/r/EDAnonymous/comments/evnc2k/my_ed_made_me_a_bad_student/ffwruk1/,Heyyy I binge while watching Gossip Girl or shortly after too,False,False
