Comment ID,Link ID,Parent ID,Author,Score,Publish Date,Permalink,Text,Stickied,Is Submitter
fagdshx,t3_e8nlep,t3_e8nlep,demonicaboss,1,2019-12-11 01:37:39,/r/EDAnonymous/comments/e8nlep/my_pancake_addiction_down/fagdshx/,yay! 😁 It's back!,False,True
fadg696,t3_e8nlep,t1_fadei58,demonicaboss,1,2019-12-10 03:23:03,/r/EDAnonymous/comments/e8nlep/my_pancake_addiction_down/fadg696/,My friend is and they said that they had a database corruption and have to revert a few hundred posts... Something about the search index too?,False,True
fadf5jd,t3_e8nlep,t1_faderls,tea-addicted-taemint,1,2019-12-10 02:57:08,/r/EDAnonymous/comments/e8nlep/my_pancake_addiction_down/fadf5jd/,"Same here. I know we recently got upgraded but unscheduled downtime is difficult as it shuts down a major resource for me. One of the reasons I left OGMPA is because it was mega glitchy, don't want pancakes to go that way.",False,False
faderls,t3_e8nlep,t3_e8nlep,radicalcantaloop,1,2019-12-10 02:47:17,/r/EDAnonymous/comments/e8nlep/my_pancake_addiction_down/faderls/,there was something about updating the search index earlier tonight but now I get a server error  it’s really stressing me out tbh :(,False,False
fadei58,t3_e8nlep,t3_e8nlep,diistortiion_,1,2019-12-10 02:40:44,/r/EDAnonymous/comments/e8nlep/my_pancake_addiction_down/fadei58/,"no clue. its been down since yesterday(?) *curse this useless brain of mine, cant remember a damn thing*  its giving me a site-side error when i try to visit. if it were scheduled downtime, we would have been told so beforehand. i think pancake will return to us soon, and i imagine admin and mods with have some info about the sudden downtime for us  if someone is part of the pancake discord, has anything been said about this? i havent joined as of yet",False,False
