Comment ID,Link ID,Parent ID,Author,Score,Publish Date,Permalink,Text,Stickied,Is Submitter
evp5x5m,t3_ck97vy,t1_evn3ydk,sororityengineer,1,2019-08-01 08:40:21,/r/EDAnonymous/comments/ck97vy/any_asian_women_on_this_sub_could_use_someone_to/evp5x5m/,"Lolol that’s basically me. “Tall”, like we get you’re trying to insult me lol",False,True
evp5n95,t3_ck97vy,t1_evlajly,sororityengineer,1,2019-08-01 08:37:37,/r/EDAnonymous/comments/ck97vy/any_asian_women_on_this_sub_could_use_someone_to/evp5n95/,Omg you’re making me wanting to move to NYC:(,False,True
evoy5vn,t3_ck97vy,t1_evlvbst,bbluebellknoll,1,2019-08-01 07:09:41,/r/EDAnonymous/comments/ck97vy/any_asian_women_on_this_sub_could_use_someone_to/evoy5vn/,"&gt;We all know the types. The skinny, rich international student. The studious high schieving types. The pretty, well dressed professionals. ABGs. I'm none of the above. As a kid I could never compete with the (all chinese) girls that were excelling in music and piano and math that my mother compared me to. I'm a humanities student with no job prospects, I'm not attractive by asian standards or western standards.  yo this one hit different......... too stupid for \~profitable STEM job that will make my family proud\~, too ugly for everything else that I want in life (i'm sure you look better than you think though)",False,False
evoaibo,t3_ck97vy,t3_ck97vy,invincibletitan33,1,2019-08-01 01:48:50,/r/EDAnonymous/comments/ck97vy/any_asian_women_on_this_sub_could_use_someone_to/evoaibo/,"Half filipino half english here. Luckily in England I've never felt isolated due to my ethnicity...tbh I didn't even know I was mixed until quite late as my mum just told me I'm as white as any other English person. Now I love the fact that I'm mixed, and it's a point of pride. I like being different. It meant I could be part of several friendship groups e.g. the Asian kids (even though I definitely didn't feel smart enough). And I'm on the smaller and slimmer side than many of my white friends. Having said that, genetically I'm predisposed to fat on my stomach, whereas all my friends have bigger boobs and butt, and flat stomachs 😭.   However coming to the Philippines, I definitely stand out as the ""non-filipino"" with blue-green eyes and I get a lot of stares. A lot of my relatives say I look so English which makes me feel really invalidated. On the flip side, I'm skinnier and a little taller than my female relatives so they can't really fat shame me, but they have been feeding me so much and I can't get away with not eating or ""dieting"".",False,False
evo8tt7,t3_ck97vy,t1_evlajly,invincibletitan33,1,2019-08-01 01:31:01,/r/EDAnonymous/comments/ck97vy/any_asian_women_on_this_sub_could_use_someone_to/evo8tt7/,"Half English half Filipino here, and omg you've literally just described my last two weeks in the Philippines.  Just eaten? Get offered more food and snacks.   Just eaten a food with no rice? Get given food with rice because if it doesn't include rice it's not considered a real meal.   Say yes to food? Get fat because every food is carb and fat/sugar heavy.  Say no? Get told ""Eat! No diet here!""  Say you're full? Get told ""eat more! You didn't eat enough!  Say you'll eat later? Get harassed every five minutes until you eat.   And if you've put on any weight? Get fat shamed.   You can't fucking win. As much as I love my family, this is the one thing I'm looking forward to leaving behind.",False,False
evo5h0v,t3_ck97vy,t3_ck97vy,wickedwitchofthebees,1,2019-08-01 00:55:51,/r/EDAnonymous/comments/ck97vy/any_asian_women_on_this_sub_could_use_someone_to/evo5h0v/,Holy shit yes! I live with lots of filipinos around me and if they’re not a muscly swimmer or tall and thin tennis player they’re naturally skinny. My friends around me can wear whatever they want and drink all the boba but I’m just the funny chubby friend :(,False,False
evnw9d6,t3_ck97vy,t3_ck97vy,n0kikin0ki,1,2019-07-31 23:25:57,/r/EDAnonymous/comments/ck97vy/any_asian_women_on_this_sub_could_use_someone_to/evnw9d6/,"I'm not Asian but I live in China (5 years) and the ""iphone thin"" legs women are so few and far in between. That's more of a stereotype than anything else. Most women here are average sized but there are still quite a few overweight. I think traveling to Asia and seeing what the normal women look like could do you some good.",False,False
evng7rt,t3_ck97vy,t3_ck97vy,_1231throwaway1231_,1,2019-07-31 20:53:57,/r/EDAnonymous/comments/ck97vy/any_asian_women_on_this_sub_could_use_someone_to/evng7rt/,"Oh my god. I relate to this on a personal level. I’m Japanese-American and I feel so incredibly out of place in both countries. I’m not Japanese enough(skinny,tiny enough) to be considered Japanese but too different to be an American and it honestly sucks.",False,False
evne7br,t3_ck97vy,t3_ck97vy,Astronautee,1,2019-07-31 20:36:44,/r/EDAnonymous/comments/ck97vy/any_asian_women_on_this_sub_could_use_someone_to/evne7br/,"i can relate so much. growing up in korea, china has really impacted me. everyone is thin- not thin? = FAT. and they expect you to eat alot. its fucking wild. the double standards and the judgement. and for the fucking boys? they get brushed off even if theyre obese as fuck. its what really got me into feminism tbh; i realized that this is fucked up.",False,False
evn3ydk,t3_ck97vy,t3_ck97vy,_awkward_drawkwa_,1,2019-07-31 19:12:00,/r/EDAnonymous/comments/ck97vy/any_asian_women_on_this_sub_could_use_someone_to/evn3ydk/,"Omg yes. Growing up, the first word my grandmas friends would use to describe me were “tall”. Which I translated to “big”. I’m 5’5 but I’ve always felt too big compared to my cousins and grandparents friends kids.",False,False
evn04v1,t3_ck97vy,t3_ck97vy,webtrauma,1,2019-07-31 18:40:02,/r/EDAnonymous/comments/ck97vy/any_asian_women_on_this_sub_could_use_someone_to/evn04v1/,I’m wasian and ed behaviours are so normalised with my asian side,False,False
evmglef,t3_ck97vy,t3_ck97vy,-Zamasu-,2,2019-07-31 16:15:50,/r/EDAnonymous/comments/ck97vy/any_asian_women_on_this_sub_could_use_someone_to/evmglef/,"Sorry I'm white but can relate as I'm coming from Eastern Europe... you know, ultra thin women with extra thin legs and tiny waists.  I feel like nowadays Japanese girls tend to be ""skinny fat"" (hate that term tbh), like obviously they are small but not that small like they used to be portrayed in the West. Maybe the superskinny diet fad that was popular 6-10 years ago has faded? It's still a health conscious society but maybe ideals have changed regarding body weight. Sorry this is bit of topic, I've just been thinking about these lately.",False,False
evmfu6u,t3_ck97vy,t3_ck97vy,atla302,2,2019-07-31 16:10:53,/r/EDAnonymous/comments/ck97vy/any_asian_women_on_this_sub_could_use_someone_to/evmfu6u/,"im Chinese American and I totally feel you on not fitting in with other Asians. Growing up, I always felt like I was too big to fit into the standards of beauty of Asia but also didn’t fit into the standards here.",False,False
evmdsz0,t3_ck97vy,t3_ck97vy,laisserai,2,2019-07-31 15:57:40,/r/EDAnonymous/comments/ck97vy/any_asian_women_on_this_sub_could_use_someone_to/evmdsz0/,South asian but I feel you sis 💕,False,False
evm2u10,t3_ck97vy,t1_evlxig8,omchill,1,2019-07-31 14:48:42,/r/EDAnonymous/comments/ck97vy/any_asian_women_on_this_sub_could_use_someone_to/evm2u10/,Come to CA! You’ll feel normal!,False,False
evm2qyx,t3_ck97vy,t3_ck97vy,squishykiss,1,2019-07-31 14:48:08,/r/EDAnonymous/comments/ck97vy/any_asian_women_on_this_sub_could_use_someone_to/evm2qyx/,"tall Asian, here. I literally feel like a giant Sasquatch compared to every other Asian girl I come across lmao",False,False
evlxig8,t3_ck97vy,t1_evlnoif,sororityengineer,2,2019-07-31 14:15:23,/r/EDAnonymous/comments/ck97vy/any_asian_women_on_this_sub_could_use_someone_to/evlxig8/,I just moved here for a new job but I’m definitely trying to relocate!,False,True
evlw89g,t3_ck97vy,t3_ck97vy,fritterly,2,2019-07-31 14:07:18,/r/EDAnonymous/comments/ck97vy/any_asian_women_on_this_sub_could_use_someone_to/evlw89g/,"Do you struggle with identity?  There seems to be a lot of competition with other AA women in your post and seeking validation from AA men.  And attempts of entering and then isolating yourself from the AA community while questioning your own identity as an Asian woman.  Do you avoid asians because you don't want to be tested on 'how asian you are'?  Did you stay with that douchey chinese guy because he made you feel more asian?  Do you think being thin would make you more asian?  Not trying to attack, I can't think of a more tactful way to start the convo right now...    I think the most prominent AA voices out there currently cater to east asians, and it can be difficult for southeast asians to completely relate to them.  I'm Vietnamese so even though the culture overlaps quite a bit with southern china, I still feel like my body type is completely different from the ~east asian ideal~. And Filipinos, despite having an early start in the Americas, are still barely being represented in the media.  (My theory is it's partly because Filipinos are quicker to assimilate due to their English, while other asians are forced to carve out enclaves due to the language barrier.) The Philippines has a very unique history unlike most east asian countries, and as you know, has been marked by a lot of colonialism, so it's just starting to get its footing as an independent country.  So Filipinos-Americans are in this grey area, where because of colonialism they can culturally relate a lot to white-americans but genetically and geographically they also relate to east-asians.  Yet neither of these communities completely represent (or welcome) Filipino-Americans so it's a battle of identity.    In the Viet-American community there's a lot of self-hate in terms of identity.  Because of the war VAs tend to attribute more value to whites and east asians who have aligned themselves with America (SKorea, Japan). All the while hating Vietnam because well, the VAs here lost the war, but in doing so they are hating their own people and as an extension themselves... so it's quite insidious.  It's now quite popular to idolize the kpop look, which is problematic for body image, because we are genetically different!  Our faces, body types, mannerisms, and culture are different!  But I think a lot of SE asians see that there's at least a chance to look east asian, because looking white is completely off the table lol.  Me included... I hate my build.  I want to be waify.  But I have my body, which includes a big bust, butt and strong legs, and it cannot conform to east asian standards.  This however, does not take away from my asian-ness.   I am learning to accept my shape a little more every year, especially as body acceptance in America (for women at least) is broadening to include more body types. (:",False,False
evlvbst,t3_ck97vy,t3_ck97vy,daeboo,2,2019-07-31 14:01:38,/r/EDAnonymous/comments/ck97vy/any_asian_women_on_this_sub_could_use_someone_to/evlvbst/,"I'm Chinese Canadian, in the sense that both my parents are Chinese, but I was born and raised in Canada, English was my first language, and I introduce myself as Canadian.   The city I live in (and the school I attend) has a very high population of Asians (both asian canadians like myself and internationl student types). This is a good time to say that I'm a bad person, an envious and competitive person. I see other asian women not as my peers but as my competition, because I feel alienated from every ""category"" of asian woman in my city.  We all know the types. The skinny, rich international student. The studious high schieving types. The pretty, well dressed professionals. ABGs. I'm none of the above. As a kid I could never compete with the (all chinese) girls that were excelling in music and piano and math that my mother compared me to. I'm a humanities student with no job prospects, I'm not attractive by asian standards or western standards.   Don't get me wrong, I've never wanted to ""fit in"" with any group and I've never tried to. But its hammered in the feeling of being isolated and that I'll never be enough for anything. It justifies the self hatred and the starving and binging and purging.",False,False
evlnoif,t3_ck97vy,t3_ck97vy,omchill,1,2019-07-31 13:15:11,/r/EDAnonymous/comments/ck97vy/any_asian_women_on_this_sub_could_use_someone_to/evlnoif/,Fuck I'm sorry. Is moving possible?,False,False
evlm4ly,t3_ck97vy,t3_ck97vy,elhae,1,2019-07-31 13:06:00,/r/EDAnonymous/comments/ck97vy/any_asian_women_on_this_sub_could_use_someone_to/evlm4ly/,"unrelated, but your writing style is beautiful",False,False
evliagc,t3_ck97vy,t3_ck97vy,min_imalist,1,2019-07-31 12:43:54,/r/EDAnonymous/comments/ck97vy/any_asian_women_on_this_sub_could_use_someone_to/evliagc/,iPhone thighs. Why does it sound so weirdly *beautiful*?? On my goals list it goes then ^sigh,False,False
evlayda,t3_ck97vy,t3_ck97vy,mayonezz,1,2019-07-31 12:01:06,/r/EDAnonymous/comments/ck97vy/any_asian_women_on_this_sub_could_use_someone_to/evlayda/,"I was borned in Korea, was told I was fat all my life. The moment I realized that I CAN CONTROL my weight by restricting and purging it was downhill from there. Welp.",False,False
evlajly,t3_ck97vy,t3_ck97vy,sadslap,1,2019-07-31 11:58:51,/r/EDAnonymous/comments/ck97vy/any_asian_women_on_this_sub_could_use_someone_to/evlajly/,"Hi I'm Chinese-American!!! Talk to me!!!   Those guys who tell you ""If you’re so lonely being the only Asian, why don’t you travel and go to Asia?"" are honestly so stupid - totally misses the point of what you're saying. I think it's very important to have a strong Asian-American community in the US. Honestly I have very little connection with actual Chinese culture beyond what my parents have share with me. Therefore having friends who were raised similarly (in this case...constantly beat down by their parents/other ppl about their weight) makes working through these struggles a lot easier. To be honest, I do surround myself with primarily Asian-American friends (I have more diversity in other friendships, but my core group is Asian-American), and that's really helped me get over a lot of the self-hate, guilt, etc. that I struggle with. My friends also have similar struggles of having their parents call them fat or relatives tell them they needed to lose weight - but simultaneously Asian food culture encourages you to eat a lot and if you don't eat a lot, it's offensive. Therefore, you're caught in this catch-22 where if you eat, you're fat, but if you don't eat, you're rude and people will keep bothering you. The gold standard of skinnyness is effortless skinny, where you can eat a ton of food but still be &lt;100 lbs.   Obviously I have a lot of thoughts on this, but I know how hard it is to be an Asian American in the US - it's very lonely if you don't have a community and just based on how you look, you are clearly always ""the other."" I grew up in the South where I could be the only Asian for miles, but now I live in NYC and being surrounded by diversity but also people like me has helped SO MUCH. I used to really prize proximity to whiteness (having white friends, etc.) but now I feel so good and confident about being Asian American and I really hope you can get there too! Being Asian American is awesome, I wouldn't trade it for anything!!!!!!",False,False
evkyxp6,t3_ck97vy,t3_ck97vy,yeetmee,1,2019-07-31 10:51:34,/r/EDAnonymous/comments/ck97vy/any_asian_women_on_this_sub_could_use_someone_to/evkyxp6/,"I’m 50/50. So are both my parents. The term generally used is Eurasian, I’m about half white and half asian. Live in and have grown up in Malaysia. Speak the language fluently. I got to a Chinese-majority secondary school (I’m 16) so I totally understand the pressure of twig-like girls. I can get away with a bit more because “Europeans are allowed to weigh more” but that doesn’t make it any less triggering nor does it make the standards much better.  Starting from the first day of secondary school, when most of us were twelve going on thirteen, there was a hierarchy made of “skinny girls” who, regardless of actual attractiveness, were made out to be paragons of beauty. 35kg (77lb) was a totally healthy weight and in fact was what girls were encouraged to weigh! Despite the fact that average height was probably around 4’11 and that was underweight even at that age. Despite the fact that standards now are barely much higher. These “skinny girls” are sixteen now, barely touch 40kg (88lb) and would definitely be described as less pretty than they were because they’re “fatter”.  Walking into the bathroom whilst girls are changing is annoying and triggering as all fuck. Girls with BMIs of 17 complain that they’re too fat. Girls with BMIs above 23 barely dare change outside of one of the stalls— heaven forbid they show off their still healthy weight range bodies! There’s only one girl in my year who has an overweight BMI, as far as I know, and she’s basically been shunned by most social circles in the school. This may or may not be due to the fact that she’s also got a fairly crappy personality, but I can’t help but feel that she would have a lot more friends if she was one of the “skinny pretty girls”.  And the double standard is insane. The average weight of girls in my class is probably around 45kg (99lb) but the guys probably have an average around 65kg (143lb). This despite the fact that the guys are only just hitting their growth spurts. There’s also a lot of very skinny guys who pull down the average, around 33% are obviously overweight or obese. No girl in my class has a BMI above 22. Yet a guy has to be obese to be made fun of or teased as “fat” whereas a girl just needs to read a bmi of 23 or higher and all of a sudden they’re “obese and unhealthy”.",False,False
