Comment ID,Link ID,Parent ID,Author,Score,Publish Date,Permalink,Text,Stickied,Is Submitter
ewsepld,t3_cl3m8p,t1_evtzlqz,riseaboveitx,1,2019-08-13 14:53:37,/r/EDAnonymous/comments/cl3m8p/i_impulsively_cut_my_hair_at_2am_and_its/ewsepld/,"I know this is way late, but do it if you want to! Just bring a friend that will hold your hand and brace yourself for the second one. I squeezed the shit out of my sister’s hand but as long as you go to a place with good reviews it’s not so bad. I got mine at a tattoo shop, if you do go through with it make sure to wash them thoroughly and actually move the bar then find something other than a loofa that won’t catch. I usually use the corner of a washcloth",False,False
evw86u9,t3_cl3m8p,t1_evt10n6,Lemon_bird,1,2019-08-03 13:39:24,/r/EDAnonymous/comments/cl3m8p/i_impulsively_cut_my_hair_at_2am_and_its/evw86u9/,god i felt this after i shaved my head i liked it for 5 minutes and then i just felt dumb all the time,False,False
evvltdt,t3_cl3m8p,t3_cl3m8p,grossenten98,1,2019-08-03 09:02:59,/r/EDAnonymous/comments/cl3m8p/i_impulsively_cut_my_hair_at_2am_and_its/evvltdt/,I did my mustache the same way one 🤦‍♂️ 😞 😂,False,False
evv9cgj,t3_cl3m8p,t1_evsw4md,lunaticleg,1,2019-08-03 05:01:51,/r/EDAnonymous/comments/cl3m8p/i_impulsively_cut_my_hair_at_2am_and_its/evv9cgj/,to me it's the opposite. Imo long hair makes my face look rounder :( that's okay tho i love my bob hairstyle,False,False
evuj1y4,t3_cl3m8p,t3_cl3m8p,idkhowigotheretbh,1,2019-08-02 20:44:19,/r/EDAnonymous/comments/cl3m8p/i_impulsively_cut_my_hair_at_2am_and_its/evuj1y4/,I did this 2 months ago RIP,False,False
evui4tv,t3_cl3m8p,t3_cl3m8p,lilsofish,1,2019-08-02 20:32:09,/r/EDAnonymous/comments/cl3m8p/i_impulsively_cut_my_hair_at_2am_and_its/evui4tv/,"I'VE DONE THE EXACT SAME THING BEFORE HSKDHF  i literally cut my hair until it was at my chin and it was.... horrible, since then i've never let scissors touch my hair unless it was to trim my split ends &gt;\_&lt;  i'm planning on growing it out until it's at my elbows and keeping it there, never going short again",False,False
evuci2r,t3_cl3m8p,t1_evsw4md,bipolarspacecop,1,2019-08-02 19:17:09,/r/EDAnonymous/comments/cl3m8p/i_impulsively_cut_my_hair_at_2am_and_its/evuci2r/,"We need a new alternative to those damn capes. Can't we at least get translucent ones that don't accentuate our fat necks and face bloat?? 🤮 If cameras add 10 pounds, hairdressers mirror adds like 30.",False,False
evucdkf,t3_cl3m8p,t1_evtuvd3,pondsandbeyond,1,2019-08-02 19:15:30,/r/EDAnonymous/comments/cl3m8p/i_impulsively_cut_my_hair_at_2am_and_its/evucdkf/,"yes!!!!! my brain knows that curves are feminine, but is terrified that curves = fat, so instead I’m like if I don’t want curves, I’ll have long feminine hair instead",False,False
evu7j59,t3_cl3m8p,t3_cl3m8p,poop_dawg,1,2019-08-02 18:14:16,/r/EDAnonymous/comments/cl3m8p/i_impulsively_cut_my_hair_at_2am_and_its/evu7j59/,"Dude. I did this after the last traumatic event I went through. Went from hair down to my butt to just above my shoulders. That whole week was a blur, and I think all I consumed for at least three days was water and liquor.  Once the shock wears off, try to have fun with new styles. I certainly did :) I don't think I'll cut my hair again, but having it shorter wasn't as bad as I thought.  Feel better. Sending love 💚💚",False,False
evu1874,t3_cl3m8p,t3_cl3m8p,madamebutterface,1,2019-08-02 16:59:11,/r/EDAnonymous/comments/cl3m8p/i_impulsively_cut_my_hair_at_2am_and_its/evu1874/,"I don't even like to have my hair up in a pony tail because I have a ""moon face"". My coworkers think I just like to always do my hair in the morning. No, it's because I look like a sloppy cow if I don't.",False,False
evu0c96,t3_cl3m8p,t3_cl3m8p,cbunni666,1,2019-08-02 16:49:12,/r/EDAnonymous/comments/cl3m8p/i_impulsively_cut_my_hair_at_2am_and_its/evu0c96/,I normally leave it to my stylist to see what will look right for my face shape. I'm too indecisive.,False,False
evtzlqz,t3_cl3m8p,t1_evts3j4,ImNotUnique____,1,2019-08-02 16:41:03,/r/EDAnonymous/comments/cl3m8p/i_impulsively_cut_my_hair_at_2am_and_its/evtzlqz/,"I've been wanting to reward myself with nipple piercings for about a year now but I'm always finding x, y, or z excuse why I can't let myself get them yet.... some ED, some just not being happy with myself. Finally landed a job in a different industry though so I think its time!",False,False
evtzlq8,t3_cl3m8p,t3_cl3m8p,suika-smoothie,1,2019-08-02 16:41:03,/r/EDAnonymous/comments/cl3m8p/i_impulsively_cut_my_hair_at_2am_and_its/evtzlq8/,I have no choice. I have alopecia areata so every few years my immune system decides to say a big fuck you to random clumps of hair follicles and then I'm bald. And then growing out is even worse. Nothing to hide behind or use to distract .  I feel you. Hope your hair gets to where you like it soon,False,False
evtyy71,t3_cl3m8p,t1_evsw4md,UnderseaK,1,2019-08-02 16:33:49,/r/EDAnonymous/comments/cl3m8p/i_impulsively_cut_my_hair_at_2am_and_its/evtyy71/,YES! It’s like the mirrors are specifically designed to make people look awful. And then you have a glamorous hairstylist in all black flouncing around...ugh. It makes me feel like a swamp troll every time. 🙃😂,False,False
evtxno6,t3_cl3m8p,t1_evsw4md,crankyhedgiebutt,1,2019-08-02 16:19:28,/r/EDAnonymous/comments/cl3m8p/i_impulsively_cut_my_hair_at_2am_and_its/evtxno6/,Yes!!!! I agree. They’ve gotta change the lighting ffs. I always feel like a troll which is not good considering I go to a salon to try to feel pretty!,False,False
evtw5ym,t3_cl3m8p,t3_cl3m8p,Adrenalize_me,1,2019-08-02 16:02:58,/r/EDAnonymous/comments/cl3m8p/i_impulsively_cut_my_hair_at_2am_and_its/evtw5ym/,"My hair is as long as it is because I sincerely believe I am too fat for short hair... So, yes.",False,False
evtuvd3,t3_cl3m8p,t1_evszkpd,jaydika,1,2019-08-02 15:48:46,/r/EDAnonymous/comments/cl3m8p/i_impulsively_cut_my_hair_at_2am_and_its/evtuvd3/,"Dude, I feel this. My stupid brain combined it with the toxic notion that being fat is unfeminine so now I feel like I ""need"" that extra boost. I haven't cut my hair in like 3 years because my last trim was WAY too much for me.",False,False
evttb0n,t3_cl3m8p,t3_cl3m8p,innocentkitty,1,2019-08-02 15:31:46,/r/EDAnonymous/comments/cl3m8p/i_impulsively_cut_my_hair_at_2am_and_its/evttb0n/,i cut myself a fringe on tuesday and i haven’t left my house in 3 days!!!!!,False,False
evts3j4,t3_cl3m8p,t3_cl3m8p,riseaboveitx,1,2019-08-02 15:18:44,/r/EDAnonymous/comments/cl3m8p/i_impulsively_cut_my_hair_at_2am_and_its/evts3j4/,I feel you but it was nipple piercings instead of cutting my hair lol,False,False
evtolcz,t3_cl3m8p,t3_cl3m8p,Imnotkeepingon,1,2019-08-02 14:41:35,/r/EDAnonymous/comments/cl3m8p/i_impulsively_cut_my_hair_at_2am_and_its/evtolcz/,I legit always randomly cut my hair when I have a mental breakdown.  And legit there are so many hairstyles ill never be able to pull off bc of my puffy ass face,False,False
evtnngh,t3_cl3m8p,t3_cl3m8p,bakermillerfloyd,1,2019-08-02 14:31:37,/r/EDAnonymous/comments/cl3m8p/i_impulsively_cut_my_hair_at_2am_and_its/evtnngh/,I just dyed my hair blue and my ED began six years ago the first time my hair was blue so now I can feel the relapse trickling in lmao,False,False
evti0bt,t3_cl3m8p,t3_cl3m8p,88Wolves,1,2019-08-02 13:33:41,/r/EDAnonymous/comments/cl3m8p/i_impulsively_cut_my_hair_at_2am_and_its/evti0bt/,"My hair has been down to my butt for years. I just got a foot cut off last week to donate and even though it looks the same from the front, it made me acutely aware of my ass. So now I’m down 10 lbs.",False,False
evthi1p,t3_cl3m8p,t3_cl3m8p,rejected_desk_puppy,1,2019-08-02 13:28:30,/r/EDAnonymous/comments/cl3m8p/i_impulsively_cut_my_hair_at_2am_and_its/evthi1p/,I literally just got a perm. And I feel you,False,False
evtfqc7,t3_cl3m8p,t3_cl3m8p,Orixess,1,2019-08-02 13:10:23,/r/EDAnonymous/comments/cl3m8p/i_impulsively_cut_my_hair_at_2am_and_its/evtfqc7/,I've been waiting to get a cute bob again. I can't do it while I'm this weight. I absolutely understand.,False,False
evtd380,t3_cl3m8p,t3_cl3m8p,hammerprice,1,2019-08-02 12:43:50,/r/EDAnonymous/comments/cl3m8p/i_impulsively_cut_my_hair_at_2am_and_its/evtd380/,I really really want to try shaving my head at least once in my life but I also think it would look awful while I'm still fat. My neck would look so unflattering and it would be all lumpy and my face would look even rounder and puffier than it is now and agghh. I still want to do it but maybe not until I've gotten my binging back under control.,False,False
evtb26u,t3_cl3m8p,t3_cl3m8p,GuillotineGash,1,2019-08-02 12:23:24,/r/EDAnonymous/comments/cl3m8p/i_impulsively_cut_my_hair_at_2am_and_its/evtb26u/,Oh my god yes. I've always wanted a pixie cut or something cute and short but my face and neck and jawline are all wayy too chubby for that and it'd be so unflattering. I feel like i need the rest of the pixie aesthetic before I get the hair lol,False,False
evt63s4,t3_cl3m8p,t3_cl3m8p,lavenderelf,1,2019-08-02 11:33:44,/r/EDAnonymous/comments/cl3m8p/i_impulsively_cut_my_hair_at_2am_and_its/evt63s4/,"I had short hair for the majority of my teen years and I'm *finally* growing it out. I need to be able to hide behind my hair again because no matter how low my weight gets I'll always have a chubby baby face. it's hilarious because if I saw someone with my face shape and they had short hair I'd be like, ""you look great!""",False,False
evt3mhp,t3_cl3m8p,t3_cl3m8p,Nearby_Associate,1,2019-08-02 11:08:34,/r/EDAnonymous/comments/cl3m8p/i_impulsively_cut_my_hair_at_2am_and_its/evt3mhp/,"Yesss. My last relapse was triggered after I shaved this beautiful long blonde hair off. I couldn’t hide even a part of my face, which meant that not a part of my face could be puffy from sodium nor alcohol without me looking like my drug addict brother. The growing part has been even worse.",False,False
evt3dvs,t3_cl3m8p,t3_cl3m8p,linedryonly,1,2019-08-02 11:06:06,/r/EDAnonymous/comments/cl3m8p/i_impulsively_cut_my_hair_at_2am_and_its/evt3dvs/,Only every day😘✂️,False,False
evt10n6,t3_cl3m8p,t3_cl3m8p,Renlywinsthethrone,1,2019-08-02 10:42:00,/r/EDAnonymous/comments/cl3m8p/i_impulsively_cut_my_hair_at_2am_and_its/evt10n6/,"I impuslively cut my hair a couple nights ago, shaved it all to an even 2"", and *I* thought it made me, a 22 year old man, look like Cersei Lannister, but my friends and I were joking about it and one of them said I had ""Holocaust survivor hair""  Which is fucked up. But wanna know what's even more fucked up? Ever since then every time I catch sight of myself or even remember what I look like I think ""I'm too fat to look like a Holocaust survivor""",False,False
evt0fqo,t3_cl3m8p,t3_cl3m8p,strawberrybubblegam,1,2019-08-02 10:36:08,/r/EDAnonymous/comments/cl3m8p/i_impulsively_cut_my_hair_at_2am_and_its/evt0fqo/,dude me as FUCK,False,False
evt08xt,t3_cl3m8p,t3_cl3m8p,jazledisko,1,2019-08-02 10:34:10,/r/EDAnonymous/comments/cl3m8p/i_impulsively_cut_my_hair_at_2am_and_its/evt08xt/,"Just remind yourself it's temporary and maybe have a few moments in front of the mirror to tell yourself you're owning it.  At the very worst, there's always wine and beanies til it grows back. Be safe and i hope you find something you love about yourself today. You're beautiful ♡♡♡",False,False
evszkpd,t3_cl3m8p,t3_cl3m8p,pondsandbeyond,1,2019-08-02 10:27:17,/r/EDAnonymous/comments/cl3m8p/i_impulsively_cut_my_hair_at_2am_and_its/evszkpd/,I feel this so much - my friends comment on how long my hair is and I’m like mmhm maybe if it’s long it’ll make me look long and thin too idk,False,False
evsw4md,t3_cl3m8p,t3_cl3m8p,stevieisbored,1,2019-08-02 09:51:26,/r/EDAnonymous/comments/cl3m8p/i_impulsively_cut_my_hair_at_2am_and_its/evsw4md/,"Omg every time my hair gets cut a little too short I start getting panic attacks from looking in the mirror because I feel like my face looks 10000000% puffier/chubbier with a bob, which eventually spirals me into shitty ed stuff.  &amp;#x200B;  Honestly, when they put the cape on me and my hair is wet and I see my reflection - that alone is enough to trigger me tbh. Like how does that specific circumstance make me look the ugliest I have ever looked.",False,False
evsuklz,t3_cl3m8p,t3_cl3m8p,need2bskinnyplz,1,2019-08-02 09:35:09,/r/EDAnonymous/comments/cl3m8p/i_impulsively_cut_my_hair_at_2am_and_its/evsuklz/,Lmao. I was growing my hair and it was already pretty long and on a depressive episode i went to get it dyed and cut.,False,False
evssv04,t3_cl3m8p,t3_cl3m8p,amooni95,1,2019-08-02 09:16:58,/r/EDAnonymous/comments/cl3m8p/i_impulsively_cut_my_hair_at_2am_and_its/evssv04/,I didnt know haircuts were supposed to make you feel better about yourself. One day I'll love to experience such a feeling.,False,False
evssp73,t3_cl3m8p,t3_cl3m8p,Edith-Anne-Newton,1,2019-08-02 09:15:14,/r/EDAnonymous/comments/cl3m8p/i_impulsively_cut_my_hair_at_2am_and_its/evssp73/,"Yeah honestly, there's this haircut I kept getting and I couldn't figure out why I hated the way it looked on me. Then I finally realized that it was because it makes my face look fat. Bruh.",False,False
evsmyoz,t3_cl3m8p,t3_cl3m8p,forestdark,1,2019-08-02 08:07:28,/r/EDAnonymous/comments/cl3m8p/i_impulsively_cut_my_hair_at_2am_and_its/evsmyoz/,Yes. And it's a horrible feeling. I'm so sorry.,False,False
