Comment ID,Link ID,Parent ID,Author,Score,Publish Date,Permalink,Text,Stickied,Is Submitter
eionkhm,t3_b1s1tq,t1_eiol8g9,uggggggggggghhhhhhhh,1,2019-03-16 15:24:10,/r/EDAnonymous/comments/b1s1tq/a_subscriber_to_my_youtube_channel_went_through/eionkhm/,yeah for sure!! i do have my whole face in my videos which i debated for a long time. but i was more worried about people in my personal life finding out about my channel rather than the other way round which i should’ve seen coming!   on the bright side i am fairly open about my ED to the people who do know and my work is one of them :) my supervisor actually had an ED so she’s super supportive. thank you again💛,False,True
eiol8g9,t3_b1s1tq,t1_eioetlo,MissNietzsche,1,2019-03-16 14:52:33,/r/EDAnonymous/comments/b1s1tq/a_subscriber_to_my_youtube_channel_went_through/eiol8g9/,"Yep :) Sounds like you know what to do now! Maybe wait a bit before you mention the new Reddit account though!  Do you have your whole face in your YT videos? If so, people could have definitely linked your ED to not just your YT life, but your personal life as well. People online are crazy. They'll call your work and stuff when your channel gets bigger if something scandalous like that gets out :/ be safe out there!!",False,False
eiofc5w,t3_b1s1tq,t1_einsbip,uggggggggggghhhhhhhh,1,2019-03-16 13:37:48,/r/EDAnonymous/comments/b1s1tq/a_subscriber_to_my_youtube_channel_went_through/eiofc5w/,thank you so much! I have an email address for business enquiries which sometimes i have subscribers email asking for personal videos which has my full name on it so I’m going to try to get rid of that. my name is quite uncommon so i’m not too surprised after a bit of digging they would find my facebook - it’s all set to private so i’m not scared they’ll get my personal info but i still don’t really fancy getting private messages from subscribers on facebook.   i reply to a lot of comments but not all of them so ignoring it probably is the best bet. you were super helpful thank you and thank you so much for your kind words as well it actually meant a lot !!💛,False,True
eioetlo,t3_b1s1tq,t1_einz9yv,uggggggggggghhhhhhhh,1,2019-03-16 13:31:31,/r/EDAnonymous/comments/b1s1tq/a_subscriber_to_my_youtube_channel_went_through/eioetlo/,"yep, should have never been so naive to think no one would look through my account!! ive deleted all my posts and as many of my comments as i can (all of the ones in ASMR and ED subs are gone) and will be deleting my old account if i can figure out how as it doesn’t seem you can on the app.   i made a new reddit account with my channel name as the username &amp; will probably mention it in a video as if i’ve never had reddit before &amp; link to that account in my descriptions so it’ll be like the other one was just a subscriber or hopefully never even existed.   you’re right that i definitely don’t want to own up to it! i was hoping to subtly make videos with positive affirmations for ED sufferers with the impression that i’m an outsider trying to help sooo... might give it a good few months before i try anything like that now!! thank you so much for your help i’d hate for my reddit history of all things ruin something i enjoy doing. ",False,True
eio9vec,t3_b1s1tq,t1_einz9yv,ThatChicBitch,1,2019-03-16 12:29:48,/r/EDAnonymous/comments/b1s1tq/a_subscriber_to_my_youtube_channel_went_through/eio9vec/,"Doubling on the *this.* OP, your career or hobby isn't ruined yet. You've probably still got a decent chance at fixing this situation right now since you were able to catch it early on before it gets out of hand which means the ball is still in your park. The above comment is spot on with everything; nuke it, man. You're still a small channel so it most likely won't escalate and you can always start over. ",False,False
eio6x8j,t3_b1s1tq,t1_einz1wy,uggggggggggghhhhhhhh,1,2019-03-16 11:51:52,/r/EDAnonymous/comments/b1s1tq/a_subscriber_to_my_youtube_channel_went_through/eio6x8j/,"yeah that’s what i thought:/ if i’d posted in a birth control subreddit to say i had a miscarriage i doubt they’d comment ‘did you have a miscarriage?’ so why is this any less invasive. i think you’re right that i should ignore it, i might delete it if i can. ",False,True
eio1odu,t3_b1s1tq,t1_einz9yv,Baby-Baphomet,1,2019-03-16 10:49:06,/r/EDAnonymous/comments/b1s1tq/a_subscriber_to_my_youtube_channel_went_through/eio1odu/,This ,False,False
einz9yv,t3_b1s1tq,t3_b1s1tq,MissNietzsche,1,2019-03-16 10:18:49,/r/EDAnonymous/comments/b1s1tq/a_subscriber_to_my_youtube_channel_went_through/einz9yv/,"Rule #1 of a YouTube channels: don't ever link them to any old accounts.  People can easily retrieve deleted posts/comments from a username on Reddit.   My recommendation? Delete everything. Delete the comment. Delete all the ASMR posts on the other Reddit account. Nuke everything while your channel is small. The person won't be bothered enough to care.  Then do what you should have done all along: make a new Reddit account for all your YT stuff.  Or, if you can, play it off like that Reddit account isn't yours, but idk the situation well enough to know if you can/should do that. Deleting and forgetting is probably your best bet.  Unless you can/want to own up to it..but it sounds as though you don't.",False,False
einz1wy,t3_b1s1tq,t3_b1s1tq,LolitaJane,1,2019-03-16 10:16:00,/r/EDAnonymous/comments/b1s1tq/a_subscriber_to_my_youtube_channel_went_through/einz1wy/,"It’s an invasive question from an internet stranger, and you’re under no obligation to respond.  If I were you, I’d ignore it completely.  It’s so rude to ask people about their personal medical history.",False,False
einsbip,t3_b1s1tq,t3_b1s1tq,BEDBulimic,1,2019-03-16 08:43:41,/r/EDAnonymous/comments/b1s1tq/a_subscriber_to_my_youtube_channel_went_through/einsbip/,"yikes sorry you're dealing with that :( i mean i would personally just not reply to them lmao, unless you usually respond to every single comment and it's sus if you don't respond?  not sure if i can provide any good advice because i don't do youtube things BUT it is a good idea to safeguard your privacy. do you know how they managed to find your fb? cos yeah that's a bit concerning...  also i'm hella proud that you're trying to recover!! you're amazing, i know it's hard but people who assume people with ED look a certain way, they can fuck off because that's absolutely not true. keep trucking! i hope someone else can give u good advice tho :/",False,False
