Comment ID,Link ID,Parent ID,Author,Score,Publish Date,Permalink,Text,Stickied,Is Submitter
f2z54h3,t3_desrz7,t1_f2z3rkn,not_the_cicada,1,2019-10-07 22:53:02,/r/EDAnonymous/comments/desrz7/just_watched_someone_get_destroyed_on_a_certain/f2z54h3/,"She really really is :) she’s an incredible woman and I’m so lucky to know her. (Plus like, she forces food on me so it’s like she gives me permission to eat which is actually kind of nice🤗). Wonderful Polish/Italian woman 💕",False,False
f2z3rkn,t3_desrz7,t1_f2z3icg,thatbirch,1,2019-10-07 22:32:57,/r/EDAnonymous/comments/desrz7/just_watched_someone_get_destroyed_on_a_certain/f2z3rkn/,"\&gt;My MIL says the women at the center all consider themselves girls still   Damn, that is so fucking true, haha.  She seems wise.",False,False
f2z3icg,t3_desrz7,t1_f2z1xgf,not_the_cicada,1,2019-10-07 22:29:16,/r/EDAnonymous/comments/desrz7/just_watched_someone_get_destroyed_on_a_certain/f2z3icg/,"Nice on you for doing that!!! I could be better about that, I just get quiet and try to disappear or leave :/  It really sucks, there are some insecurities that just cling to us I think. Plus mentally it’s really hard to grow up. My MIL says the women at the center all consider themselves girls still, and I’m starting to understand what she means. Idk tho, knowledge is power and the more we understand WHY we are compelled to do things, perhaps the gentler we can be to ourselves and others.",False,False
f2z1xgf,t3_desrz7,t1_f2z08tu,thatbirch,1,2019-10-07 22:08:02,/r/EDAnonymous/comments/desrz7/just_watched_someone_get_destroyed_on_a_certain/f2z1xgf/,"Yeah, coworkers talking about it makes me want to slam my head against the wall, because not only is it irritating and triggering, it's also oddly boring because they are default boring people (not their fault, it's just that it's work).   The worst is when someone I care about does it.  My boyfriend's mom has been constantly talking about her diet/weigh lately.  It's so awful because she is a grown ass woman, like probably going to be a grandmother in the next 5 years, and it just makes me so sad.  Like, she is very independently successful and lives a full life, but seeing this crack in her is so demotivating.  Like oh, you can raise amazing children, work your ass off to build up a successful company, have loved and lived more than most people, and yet you can still be an insecure little girl who feels too fat underneath it all.  Makes me sad as fuck.  Also, she is very beautiful and petite - I feel like a giant ogre next to her, so how does she think it makes me feel when she laments a little bit of excess fat when I am technically a blimp in comparison?  I take a weird pride in never talking to anyone about my weight or body image or eating habits.  I try to shut down any diet talk IRL,  especially around other women.",False,False
f2z08tu,t3_desrz7,t1_f2yvf2k,not_the_cicada,1,2019-10-07 21:47:10,/r/EDAnonymous/comments/desrz7/just_watched_someone_get_destroyed_on_a_certain/f2z08tu/,"Yes holy fuck please do not speak to me about your eating habits, coworkers, I can hardly handle the general food talk without looking like a psycho, please don’t trigger the shit out of me :/",False,False
f2yy0k9,t3_desrz7,t3_desrz7,starfish31,1,2019-10-07 21:19:49,/r/EDAnonymous/comments/desrz7/just_watched_someone_get_destroyed_on_a_certain/f2yy0k9/,"The issue with that post is that they, even in the title, blamed ""everyone in the sub"" for developing an ED. Then got mad that people missed the point in the body of her post that some people are susceptible to EDs. Coming off aggressively isn't going to be recepted well by most people honestly.",False,False
f2yvli0,t3_desrz7,t1_f2yvf2k,sp00py13,1,2019-10-07 20:51:14,/r/EDAnonymous/comments/desrz7/just_watched_someone_get_destroyed_on_a_certain/f2yvli0/,THIS.,False,True
f2yvknq,t3_desrz7,t3_desrz7,sp00py13,1,2019-10-07 20:50:59,/r/EDAnonymous/comments/desrz7/just_watched_someone_get_destroyed_on_a_certain/f2yvknq/,THIS. I’ve felt the exact same way for as long as I’ve had my own issues,False,True
f2yvf2k,t3_desrz7,t3_desrz7,thatbirch,1,2019-10-07 20:49:17,/r/EDAnonymous/comments/desrz7/just_watched_someone_get_destroyed_on_a_certain/f2yvf2k/,"I'm honestly surprised we don't see more of those posts.  Probably because people just don't realize it or just move on to the next diet...or those posts get deleted/ignored/downvoted.  I'm convinced that anyone who isn't born with perfect corresponding genetics and didn't grow up in a household that made food a perfectly normal thing has disordered eating, at least in any given first world country.  Like truly, anyone on any of the weight loss/diet subreddits has a problem with food, that's just a fact.  The severity varies and you can always get better, but it's so easy to get obsessive. Instead of treating the heart of the problem, they start keto!  Try to tell me an ultra-restrictive diet that your whole life revolves around isn't extremely disordered eating.   Also, I don't want to fucking hear about your stupid fucking diet unless I actually ask.  That is for private internet time only with anonymous people, not casual lunch talk or work talk.  Especially because I don't want to cringe when you eventually give it up in a few weeks and feel guilty about it.  I have my own issues to deal with, thanks.  I honestly think I only know like three people who sincerely don't have food issues.",False,False
f2ytd5e,t3_desrz7,t1_f2yt1wt,sp00py13,1,2019-10-07 20:26:21,/r/EDAnonymous/comments/desrz7/just_watched_someone_get_destroyed_on_a_certain/f2ytd5e/,"Huh, maybe. I remember it just being along the lines of “I would always come to this sub for reassurance that I was actually being healthy and they would encourage me to keep up my good work.” I didn’t interpret it as blaming, but that’s the thing with the internet — everyone can interpret what they read in their own way, and two people can get totally different meaning from it 🤷🏼‍♀️",False,True
f2yt1wt,t3_desrz7,t3_desrz7,thr0waway124816,1,2019-10-07 20:23:05,/r/EDAnonymous/comments/desrz7/just_watched_someone_get_destroyed_on_a_certain/f2yt1wt/,I saw that. I can’t find it now but didn’t they say they were blaming everyone in the sub for causing them to become disordered? I understand jumping on someone for that. It was not worded well.,False,False
f2ysds0,t3_desrz7,t3_desrz7,notracisthasblackcat,1,2019-10-07 20:15:09,/r/EDAnonymous/comments/desrz7/just_watched_someone_get_destroyed_on_a_certain/f2ysds0/,"Now I'm just trying to find the thread lol. Yeah that's the thing with online communities, you can't avoid the groupthink and if you do you face repercussions. Any diet can turn into an eating disorder and with all the online encouragement it makes it even more inevitable if you're susceptible.",False,False
