Comment ID,Link ID,Parent ID,Author,Score,Publish Date,Permalink,Text,Stickied,Is Submitter
eiavvv3,t3_azffg7,t3_azffg7,Aisukyubuu,1,2019-03-11 15:23:36,/r/EDAnonymous/comments/azffg7/safe_foods/eiavvv3/,"eggs, OATMEAL, clementines, those gerber puffs, gyoza (300 calories for 8 of them), coffee with a hot chocolate packet (&lt;100 calorie café mocha) or even with a royal milk tea packet. those are my safe foods, if I eat them I won't feel the desire to binge.   progresso soups and lean cuisines are good too but they don't leave me as full as my safe foods, so those are just favorite low cal foods that used to be eaten regularly but now I have to limit. ",False,False
eia6wsu,t3_azffg7,t1_ei9o5c3,ReneeLouvier,1,2019-03-11 10:48:03,/r/EDAnonymous/comments/azffg7/safe_foods/eia6wsu/,"Spending time with my in-laws. This is the last huge time however, because my 5 year old starts school this coming school year.",False,False
ei9rrvk,t3_azffg7,t3_azffg7,MuddyWalruss,1,2019-03-11 07:09:10,/r/EDAnonymous/comments/azffg7/safe_foods/ei9rrvk/,"I actually have quite a few.   - canned tuna - rice cakes - potatoes - brown rice (i'm very cautious about the amount though, i only get pre packaged instant rice) - apples - low fat and sugar free yogurt - instant porridge - weetbix - vegemite  - most vegetables (special mention to broccoli, peas and corn) - hard boiled eggs - basa fillets - sometimes milk - vegetable soup (i found a really low cal recipe that tastes really good!) - watermelon  I have a few others but this list is already too long ",False,False
ei9rhs2,t3_azffg7,t1_ei7ycqs,MuddyWalruss,1,2019-03-11 07:03:37,/r/EDAnonymous/comments/azffg7/safe_foods/ei9rhs2/,Tuna is one of my ultimate safe foods. Specifically canned tuna. 69 cal per can and 15g of protein? sign me up!,False,False
ei9o5c3,t3_azffg7,t1_ei8p17y,waystosaygoodbye33,1,2019-03-11 05:48:06,/r/EDAnonymous/comments/azffg7/safe_foods/ei9o5c3/,That’s where my best friend is from! What are you in NJ for if you don’t mind my asking ,False,False
ei8uruc,t3_azffg7,t3_azffg7,softcoffee,1,2019-03-10 19:57:26,/r/EDAnonymous/comments/azffg7/safe_foods/ei8uruc/,"I swear they change too often. For the last few weeks its been oatmeal, dates bananas, almonds, 85% organic dark chocolate and cranberry antioxidant mix. This is basically all I have been eating. I'm about to fast for a while and I think the only safe food after that will be fruit, veggies, nuts and seeds. ",False,False
ei8p17y,t3_azffg7,t1_ei8op4x,ReneeLouvier,1,2019-03-10 18:41:07,/r/EDAnonymous/comments/azffg7/safe_foods/ei8p17y/,Yeah can't wait to see if they have them back home in SC actually! I've been up here for like...6+ months I'm so ready to go back home...,False,False
ei8op4x,t3_azffg7,t1_ei8onfb,waystosaygoodbye33,1,2019-03-10 18:36:38,/r/EDAnonymous/comments/azffg7/safe_foods/ei8op4x/,Oh no way! I grew up in NJ - I’m actually leaving now via the philly airport! I’m located in Atlanta for now - I’ll have to see if they have them! Thank you!! ,False,False
ei8onfb,t3_azffg7,t1_ei8kjlc,ReneeLouvier,1,2019-03-10 18:35:59,/r/EDAnonymous/comments/azffg7/safe_foods/ei8onfb/,"Chef Ernesto's Veggie Burgers. 2 to a package for $1. It's in the fridge/freezer section, and it's a small green box. Might be easy to miss!!   Usually near the pancakes section! (Out of the four different ones I've been in around Toms River, NJ.",False,False
ei8nedt,t3_azffg7,t3_azffg7,FridgethatRidge,1,2019-03-10 18:19:27,/r/EDAnonymous/comments/azffg7/safe_foods/ei8nedt/,"Edamame and popcorn are my main safe foods, +  most fruits and veg. I also have some weird safe foods, like pre-packaged ice cream (think popsicles and ice cream sandwiches) and chow mein (also pre-packaged) ",False,False
ei8kjlc,t3_azffg7,t1_ei7p0lz,waystosaygoodbye33,1,2019-03-10 17:42:32,/r/EDAnonymous/comments/azffg7/safe_foods/ei8kjlc/,Wait DOLLAR TREE VEGGIE BURGER? I need to check this out ASAP,False,False
ei8h3y7,t3_azffg7,t3_azffg7,lorabore,1,2019-03-10 16:57:56,/r/EDAnonymous/comments/azffg7/safe_foods/ei8h3y7/,"Light string cheese, rice cakes, celery with the pre-portioned 0.75 ounce peanut butter cup, cascade ice zero calorie, light and fit Greek yogurt, baked tofu, green beans",False,False
ei8fbxy,t3_azffg7,t3_azffg7,cinnamonbicycle,1,2019-03-10 16:35:37,/r/EDAnonymous/comments/azffg7/safe_foods/ei8fbxy/,"Meals: literally any vegetable, tofu, salsa, oatmeal, smallish sweet potatoes, low-cal bread, certain fruits depending on the day (sometimes fruits scare me though lol)  Snacks: the idea of actual food between meals freaks me out so drinks ftw. Black coffee, herbal tea, sparkling water, Bai drinks. My Sbux go-to is a grande americano with one pump of sugar free vanilla syrup.",False,False
ei8bv8q,t3_azffg7,t3_azffg7,XiuCyx,1,2019-03-10 15:52:18,/r/EDAnonymous/comments/azffg7/safe_foods/ei8bv8q/,"Apples, celery, watermelon, anything that seems 90% water. Of course doing Keto for a few months have kind of made me fear fruit so thats cool /s.   Pickles. I eat waaaaayyyyy too many pickles.   And Spinach. I’ll just have a huge spinach salad with a drizzle of other toppings.   Lunch meat turkey and sometimes, rarely though, I feel ok with a turkey sandwich on whole grain bread. ",False,False
ei8bfz0,t3_azffg7,t3_azffg7,ciggiesandcabbage,1,2019-03-10 15:47:03,/r/EDAnonymous/comments/azffg7/safe_foods/ei8bfz0/,"Safe foods: COTTON CANDY, diet soda, uncrustables (grape jelly) phô, fiber one 90cal bars, black coffee, pickled veggies, fresh non starchy veggies, rice cakes Fear foods: Meat (non fish), chocolate cake, most dairy, olive oil, any restaurant meal I haven't fasted before ",False,False
ei89svt,t3_azffg7,t3_azffg7,witchy2628,1,2019-03-10 15:26:58,/r/EDAnonymous/comments/azffg7/safe_foods/ei89svt/,"Oatmeal Mac n cheese that I can eat super slowly, one noodle at a time Anything I can eat reallly slowlyy",False,False
ei87ypl,t3_azffg7,t3_azffg7,PoorLama,1,2019-03-10 15:04:39,/r/EDAnonymous/comments/azffg7/safe_foods/ei87ypl/,Right now my only safe food is 50cal tortillas and salsa....,False,False
ei83moo,t3_azffg7,t3_azffg7,_Trappedinacorner,1,2019-03-10 14:11:18,/r/EDAnonymous/comments/azffg7/safe_foods/ei83moo/,"Fruits: grapefruit, avocado, strawberries, pears, watermelon, banana, pomegranate  Veg: asparagus, tomato, spinach, brussels sprouts, carrots  Grains: plain oatmeal  Drinks: water, hot tea  Protein: 1 egg or polar smoked herring (I don't eat chicken or beef)",False,False
ei7ycqs,t3_azffg7,t3_azffg7,invincibletitan33,1,2019-03-10 13:08:09,/r/EDAnonymous/comments/azffg7/safe_foods/ei7ycqs/,Safe foods: - Bananas - Oatmeal - Broccoli - Small potatoes - Most fruit and veg - Mushrooms - Bread (if I definitely know the cals) - Low fat natural yogurt - almond and soya milk  Fear food: - Pasta (discovered how many cals are in pasta yesterday 😨)  - Bagels - Pesto - Cheese - Cream - Rice,False,False
ei7tvuo,t3_azffg7,t3_azffg7,sodiddlydone,1,2019-03-10 12:14:42,/r/EDAnonymous/comments/azffg7/safe_foods/ei7tvuo/,"im feel pretty safe with most fruits and veggies except potatoes i guess. i fear pasta, rice, bread, fast food, pastries or anything sweet really although i do occasionally eat those i try to avoid them as much as possible",False,False
ei7skqk,t3_azffg7,t3_azffg7,coffidu,1,2019-03-10 11:58:33,/r/EDAnonymous/comments/azffg7/safe_foods/ei7skqk/,"Frozen veggies! I pretty much live off of broccoli, cauliflower, peas, sweet corn, green beans, and baby carrots. I also love chick peas. &lt;3",False,False
ei7s803,t3_azffg7,t3_azffg7,clithub,1,2019-03-10 11:54:16,/r/EDAnonymous/comments/azffg7/safe_foods/ei7s803/,Right now it’s been soup. Vegetables about to go bad? Boil all of them and then use an immersion blender. Instant sweet potato soup with carrots and red curry paste. Super filing and I never finish more than two cups. ,False,False
ei7rets,t3_azffg7,t3_azffg7,3cats_in_atrenchcoat,1,2019-03-10 11:44:23,/r/EDAnonymous/comments/azffg7/safe_foods/ei7rets/,I don't have a particularly limited diet. The only foods I will not eat are:   - ice cream (though I do have it out sometimes)  - nuts  - chips  - soda with sugar  - juice  - chocolate bars - fast food (with maybe three items I'll eat)  - bagels  - pastries or any prepackaged baked good -  protein powder (it just always makes me want to puke)  - pizza  - processed meats  ,False,False
ei7p0lz,t3_azffg7,t3_azffg7,ReneeLouvier,1,2019-03-10 11:14:07,/r/EDAnonymous/comments/azffg7/safe_foods/ei7p0lz/,"Anything easy to cook and eat that are also low calorie. And preferably cheap as hell too!  * Bibigo mini chicken wontons (17 cal each) * Bumblebee fat free tuna salad kit (150 cal total) * Blackberries (34 cals per 2 oz) * Applesauce (50-60 cals) * Mini veggie egg rolls (55 cal each) * Dollar tree veggie burger (130 cal each)  Plus a lot of stuff I can't remember TBH.  If my upper mouth is hurting and I have to remove my upper plate denture I'll eat half portions of oatmeal, applesauce, and minced low calorie meat. I'll probably end up boiling/steaming the wontons.",False,False
ei7jtkq,t3_azffg7,t3_azffg7,paintedlies,1,2019-03-10 10:02:13,/r/EDAnonymous/comments/azffg7/safe_foods/ei7jtkq/,"Rice is a safe food for me so is Apple's, strawberries, mushrooms and olives.",False,False
ei7imci,t3_azffg7,t3_azffg7,thinraindrop,1,2019-03-10 09:43:33,/r/EDAnonymous/comments/azffg7/safe_foods/ei7imci/,"All I've been eating as of late are Japanese sweet potatoes, steamed veggies and kelp Noodles. ",False,False
ei7etqc,t3_azffg7,t3_azffg7,_koala_master_,1,2019-03-10 08:37:27,/r/EDAnonymous/comments/azffg7/safe_foods/ei7etqc/,"Oatmeal is a Safe Food of mine as well! Others include: Chia seeds, protein powder, protein custard, Greek yogurt, apples, blueberries, strawberry and melon (all kinds) also all non starchy vegetables, but also pumpkin and chicken breast and deli meat l oh low fat cheese as well and potatoes and sweet potatoes sometomes and pickles   Fear foods are butter, toast, nutella, deep fried anything, full fat milk, full fat cheese, full sugar soda, all juices, rice, pasta, anything made with cream, donuts, pastries, bread in general, chips, fries, white chocolate, baked goods, lasagna ",False,False
ei7d51y,t3_azffg7,t3_azffg7,juicypickle_,1,2019-03-10 08:03:45,/r/EDAnonymous/comments/azffg7/safe_foods/ei7d51y/,Also oatmeal! Which I’ve seen a lot of people say that it is a fear food for them!,False,True
