Comment ID,Link ID,Parent ID,Author,Score,Publish Date,Permalink,Text,Stickied,Is Submitter
f9sb3rh,t3_e6fxh9,t1_f9pyaw2,p0m0sapien,1,2019-12-05 17:35:20,/r/EDAnonymous/comments/e6fxh9/tracking_apps_vs_notes/f9sb3rh/,I get that. I have filled and thrown out so many cheapo notebooks over the years. My handwriting is awful and I never say anything more than my mood and cals. I feel a bit bad about my shitty handwriting but it's a nice way to power through perfectionism. No one needs to see my notes!,False,False
f9rys38,t3_e6fxh9,t3_e6fxh9,MentalIceAge,1,2019-12-05 15:59:59,/r/EDAnonymous/comments/e6fxh9/tracking_apps_vs_notes/f9rys38/,Just notes so I can drastically overestimate all my calories and then delete the whole thing in a huff when I inevitably screw it up,False,False
f9qkwbx,t3_e6fxh9,t3_e6fxh9,snugglejuice,1,2019-12-05 10:20:33,/r/EDAnonymous/comments/e6fxh9/tracking_apps_vs_notes/f9qkwbx/,I honestly use mfp because I just hate math that much.,False,False
f9q3f2r,t3_e6fxh9,t1_f9prwqs,lovenote123,1,2019-12-05 08:00:48,/r/EDAnonymous/comments/e6fxh9/tracking_apps_vs_notes/f9q3f2r/,What’s the source that you trust to find calories? I’m the same way sometimes but mfp is so much easier. I just tend to double check on the usda website,False,False
f9q2dgy,t3_e6fxh9,t3_e6fxh9,cappuccinomore,1,2019-12-05 07:51:39,/r/EDAnonymous/comments/e6fxh9/tracking_apps_vs_notes/f9q2dgy/,I thought I was the only one who used my notes app!,False,False
f9pyhgb,t3_e6fxh9,t1_f9prwqs,hazyjays,1,2019-12-05 07:15:28,/r/EDAnonymous/comments/e6fxh9/tracking_apps_vs_notes/f9pyhgb/,i think it’s the not trusting the calorie counts in the apps that really stops me from using them tbh,False,True
f9pyaw2,t3_e6fxh9,t1_f9pxwwc,hazyjays,1,2019-12-05 07:13:31,/r/EDAnonymous/comments/e6fxh9/tracking_apps_vs_notes/f9pyaw2/,if i didn’t have a perfectionist streak that won’t quit i’d be all over using physical notebooks to track,False,True
f9pxxam,t3_e6fxh9,t3_e6fxh9,coffeevodkaaddict,1,2019-12-05 07:09:29,/r/EDAnonymous/comments/e6fxh9/tracking_apps_vs_notes/f9pxxam/,im using my plate at the moment but i change my app every few weeks lol,False,False
f9pxwwc,t3_e6fxh9,t3_e6fxh9,p0m0sapien,1,2019-12-05 07:09:22,/r/EDAnonymous/comments/e6fxh9/tracking_apps_vs_notes/f9pxwwc/,"I have actual physical notebooks. Honestly, seems quicker.",False,False
f9prwqs,t3_e6fxh9,t3_e6fxh9,lemonye,1,2019-12-05 06:00:39,/r/EDAnonymous/comments/e6fxh9/tracking_apps_vs_notes/f9prwqs/,"I write it down in a daily planner lol, i'm old school. But I don't trust the cal counter in mfp",False,False
f9prbu5,t3_e6fxh9,t3_e6fxh9,kiwi_487,1,2019-12-05 05:53:14,/r/EDAnonymous/comments/e6fxh9/tracking_apps_vs_notes/f9prbu5/,"Oh wow, that’s so much work. I literally just put everything into Lifesum",False,False
f9pqg8t,t3_e6fxh9,t3_e6fxh9,olivia1135,1,2019-12-05 05:41:44,/r/EDAnonymous/comments/e6fxh9/tracking_apps_vs_notes/f9pqg8t/,i use mfp bc it’s easy and everything is basically right there but i put my daily totals in notes,False,False
