Comment ID,Link ID,Parent ID,Author,Score,Publish Date,Permalink,Text,Stickied,Is Submitter
etg77i8,t3_cb5dqp,t3_cb5dqp,ddmar,1,2019-07-10 13:58:42,/r/EDAnonymous/comments/cb5dqp/i_cant_fucking_stand_bananas_help_me/etg77i8/,Xanthan gum! A really small amount goes a long way,False,False
etfxb27,t3_cb5dqp,t3_cb5dqp,hypotheticalfox,1,2019-07-10 12:25:04,/r/EDAnonymous/comments/cb5dqp/i_cant_fucking_stand_bananas_help_me/etfxb27/,Silken tofu! It tastes a little tofu-y but it isn't very strong flavor so if you have berries or sth delicious it will probably overpower the tofu flavor :),False,False
eteejw9,t3_cb5dqp,t1_etdpzp9,summerservice,1,2019-07-09 22:47:00,/r/EDAnonymous/comments/cb5dqp/i_cant_fucking_stand_bananas_help_me/eteejw9/,I just bought some chia seeds! thanks!!,False,True
eteej9q,t3_cb5dqp,t1_etd75je,summerservice,1,2019-07-09 22:46:44,/r/EDAnonymous/comments/cb5dqp/i_cant_fucking_stand_bananas_help_me/eteej9q/,ooh I’ve never thought about adding spinach... will try it ♥️,False,True
eteei55,t3_cb5dqp,t1_etd8fte,summerservice,1,2019-07-09 22:46:18,/r/EDAnonymous/comments/cb5dqp/i_cant_fucking_stand_bananas_help_me/eteei55/,ah I haven’t tried that! thank you!!,False,True
eteb7cs,t3_cb5dqp,t3_cb5dqp,my-destructive-side,1,2019-07-09 22:02:06,/r/EDAnonymous/comments/cb5dqp/i_cant_fucking_stand_bananas_help_me/eteb7cs/,Apples if your blender is strong enough.,False,False
etdpzp9,t3_cb5dqp,t3_cb5dqp,OkieNope,1,2019-07-09 17:46:18,/r/EDAnonymous/comments/cb5dqp/i_cant_fucking_stand_bananas_help_me/etdpzp9/,"Avocado, frozen cucumber , frozen zucchini, steamed then frozen cauliflower :)",False,False
etd8fte,t3_cb5dqp,t3_cb5dqp,thisfightisnotover,1,2019-07-09 14:42:59,/r/EDAnonymous/comments/cb5dqp/i_cant_fucking_stand_bananas_help_me/etd8fte/,Freeze some of your fruit first! Super thick,False,False
etd75je,t3_cb5dqp,t3_cb5dqp,orkestrels,1,2019-07-09 14:29:59,/r/EDAnonymous/comments/cb5dqp/i_cant_fucking_stand_bananas_help_me/etd75je/,"i usually use spinach and frozen berries as a base, with a bit of water, then add more for the consistency i want 💖",False,False
