Comment ID,Link ID,Parent ID,Author,Score,Publish Date,Permalink,Text,Stickied,Is Submitter
ej07k9t,t3_axe7sz,t3_axe7sz,__peewee,1,2019-03-20 20:22:46,/r/EDAnonymous/comments/axe7sz/something_you_may_not_have_considered/ej07k9t/,My hero,False,False
ehtim4w,t3_axe7sz,t3_axe7sz,103xxiivv,1,2019-03-04 22:29:21,/r/EDAnonymous/comments/axe7sz/something_you_may_not_have_considered/ehtim4w/,"And you can mix it with tea! Kinda weird but some flavors really work, like fruity teas and dessert teas with a little milk ",False,False
ehtghzc,t3_axe7sz,t1_ehtfxcd,LolitaJane,1,2019-03-04 21:45:36,/r/EDAnonymous/comments/axe7sz/something_you_may_not_have_considered/ehtghzc/,That’s fair.  I have textures I can’t deal with either.,False,True
ehtfxcd,t3_axe7sz,t3_axe7sz,nextlvlrattata,1,2019-03-04 21:37:28,/r/EDAnonymous/comments/axe7sz/something_you_may_not_have_considered/ehtfxcd/,"It's too bad I can't do jello's texture. It really, truly is.",False,False
eht4c4y,t3_axe7sz,t1_eht43rw,attenuatingpixie333,1,2019-03-04 19:05:24,/r/EDAnonymous/comments/axe7sz/something_you_may_not_have_considered/eht4c4y/,"Hahaha you posted it before I even went to the store! This is what I get for not browsing this sub 24/7, damn. 😂 ",False,False
eht43rw,t3_axe7sz,t1_eht3znc,LolitaJane,1,2019-03-04 19:02:19,/r/EDAnonymous/comments/axe7sz/something_you_may_not_have_considered/eht43rw/,"Lol, Sorry I was late!",False,True
eht3znc,t3_axe7sz,t3_axe7sz,attenuatingpixie333,1,2019-03-04 19:00:47,/r/EDAnonymous/comments/axe7sz/something_you_may_not_have_considered/eht3znc/,I saw this after I got back from the store with a bag full of jello   Next time.... Haha ,False,False
eht14o2,t3_axe7sz,t1_eht0wqu,LolitaJane,1,2019-03-04 18:22:45,/r/EDAnonymous/comments/axe7sz/something_you_may_not_have_considered/eht14o2/,Genius!,False,True
eht0wqu,t3_axe7sz,t3_axe7sz,Appolinaris9,1,2019-03-04 18:19:55,/r/EDAnonymous/comments/axe7sz/something_you_may_not_have_considered/eht0wqu/,"You can also mix it with almond milk or so, a little (flavoured maybe) sweetener and have almost convincing panna cotta! ",False,False
