Comment ID,Link ID,Parent ID,Author,Score,Publish Date,Permalink,Text,Stickied,Is Submitter
ehxk672,t3_ax9w5y,t1_ehsrmbz,cheriibelle,1,2019-03-06 12:02:11,/r/EDAnonymous/comments/ax9w5y/men_are_such_a_trigger_for_me/ehxk672/,what is your fasting schedule?,False,False
ehu4h3s,t3_ax9w5y,t3_ax9w5y,lasirenexx,1,2019-03-05 06:52:52,/r/EDAnonymous/comments/ax9w5y/men_are_such_a_trigger_for_me/ehu4h3s/,"Sometimes my husband “triggers” me in that I’m so ENVIOUS of his relationship to food... he’s ortho (not sure if orthorexia is really a thing or a bad thing if it is but I’ll stop myself before I rant about processed food), eats lots of healthy food and doesn’t count calories, and maintains a well-built body. I wonder if that’s what my relationship with food would be like if I were male and not obsessed with being as thin as possible, but then I realize that I’d probably be an obsessive gym bro with muscle dysmorphia. It’d be a slightly healthier obsession, but emotionally draining nonetheless.",False,False
ehtt02o,t3_ax9w5y,t1_ehsfhm9,cummo22,1,2019-03-05 01:57:29,/r/EDAnonymous/comments/ax9w5y/men_are_such_a_trigger_for_me/ehtt02o/,"The thing is, if we are talking about *all* men then that includes men with ED’s. We are not separate people. They were all ‘normal’ men before they developed the ED. Does that mean they all made fun of ED’s / fat people before the switch? It’s unfair to generalise a whole gender into one behaviour.   I can totally see where you’re coming from in terms of women having to focus on looks more then men. That makes sense to me. I’m not sure that’s what was being discussed in the original post, though. Or at least that wasn’t what I got from it.  As for the tacos, the possibilities I can think of probably are, he either   1) uses the caloric surplus to gain muscle if he is a gym goer, which also makes one look less fat 2) you binge at times when he doesn’t 3) he stops there and barely eats anything for the rest of the day. He has a few extra hundred calories than you and therefore theoretically would have a proportionally bigger appetite  4) you restricted a lot and lowered your metabolism that way ",False,False
ehtdyow,t3_ax9w5y,t1_ehtdb78,NewBullMoose,1,2019-03-04 21:10:04,/r/EDAnonymous/comments/ax9w5y/men_are_such_a_trigger_for_me/ehtdyow/,"You could have posted an almost identical thing, just be a little more careful when you are making generalizations about people.   The science you're talking about is not the issue. Like I said, men do have higher TDEEs and such but that doesn't mean it's any easier for men than women to be a healthy weight. You don't really think that 1,500 calories is the same to a 5' 3"" girl and a 6' guy, do you? You would likely be much more satisfied on 1,500 calories than a guy would, so naturally it's no easier to be healthy despite the higher TDEE.   As for the fat part, I think that's an interesting point because to me women can be considered more attractive for longer than men as fat increases. For some reason once a man reaches an unattractive point it's little more than a laughing matter whereas once a woman reaches that point (which I would argue is higher) she definitely receives a much harsher attitude from others. So it's not even but each has their own ups and downs. ",False,False
ehtdb78,t3_ax9w5y,t1_ehtcpk5,citrus_juuiice,1,2019-03-04 21:01:12,/r/EDAnonymous/comments/ax9w5y/men_are_such_a_trigger_for_me/ehtdb78/,"Well I posted it here because I don’t have friends to vent to about this. But I mean there is science out there that proves that men generally do have an easier time than women losing weight and they have faster metabolisms than women because of they generally have lower body fat percentages and more lean muscle. When I walk around and see men thinner than me and eating much more and get triggered, where am I supposed to vent? Cuz no one I talk to would understand the frustration it gives me. ",False,True
ehtcpk5,t3_ax9w5y,t1_ehtbpc5,NewBullMoose,1,2019-03-04 20:53:25,/r/EDAnonymous/comments/ax9w5y/men_are_such_a_trigger_for_me/ehtcpk5/,"If you're so sure not all guys are like this maybe you shouldn't make such broad, sweeping claims. Again, I don't doubt the legitimacy that the men you refer to are triggering. I had friends who seemed to have crazy metabolisms; they ate whatever they wanted and still looked incredible no matter what. Who wouldn't be triggered by that? But to generalise that to all non-ED men is ridiculous and downright harmful. Somebody in the comments pointed out how unfair it is that men have higher TDEEs. Do you not think men also have a greater appetite to accompany that higher TDEE? There's nothing fair or unfair about it, and on top of that we have no control over it whatsoever. To make it seem like men have inherited some goldmine is wrong (at least in this context).   This sort of post would be fine if it was just venting to a friend, but this is a large community that, despite the several period posts a day, has some guys on it. I'm sorry if this offends you but something had to be said because nobody seems to think anything is wrong with this. ",False,False
ehtbpc5,t3_ax9w5y,t1_ehtb4fy,citrus_juuiice,1,2019-03-04 20:40:36,/r/EDAnonymous/comments/ax9w5y/men_are_such_a_trigger_for_me/ehtbpc5/,"I mean, I just remember from my IP and PHP stays the guys there talking about how mean other men were to them. I’m sure not all guys are like this, but in my experience and the experiences of others that I’ve heard, it’s pretty prevalent.",False,True
ehtb4fy,t3_ax9w5y,t1_ehsqoi9,NewBullMoose,1,2019-03-04 20:33:16,/r/EDAnonymous/comments/ax9w5y/men_are_such_a_trigger_for_me/ehtb4fy/,Maybe you shouldn't make sweeping statements about all non-ED men??? I'm sure it wasn't intended to be harmful but it 100% is. The only reason this isn't being more openly criticized is because this sub is mostly women. ,False,False
ehtauhs,t3_ax9w5y,t3_ax9w5y,SadnGayRonnie,1,2019-03-04 20:29:49,/r/EDAnonymous/comments/ax9w5y/men_are_such_a_trigger_for_me/ehtauhs/,"Im a not so tall guy but my BMR is still high and yes I do agree that guys in general are skinnier despite the crappy diet. Still that didnt save me from my ED. If I get fat, it mostly got stored in my legs and face so when I ate alot before and didnt care of what calories I consume, I had a generally skinny body with a puffy face and fat-ish legs. Whenever I look at photos of myself before my EDs I feel repulsed how ""fat"" I am specially my face. My brother who is taller than me eats a junk diet of burger kings and mcdonalds looks just as skinny and thin as I am now who has an ED. ",False,False
eht8pjv,t3_ax9w5y,t3_ax9w5y,BittyBeau,1,2019-03-04 20:02:34,/r/EDAnonymous/comments/ax9w5y/men_are_such_a_trigger_for_me/eht8pjv/,I'm a transguy watching my thin bf eat a giant ass burger with french fries while I skip dinner and cry myself to sleep. I feel you man,False,False
eht78fx,t3_ax9w5y,t3_ax9w5y,Belarie,1,2019-03-04 19:43:16,/r/EDAnonymous/comments/ax9w5y/men_are_such_a_trigger_for_me/eht78fx/,Im not even a guy but I would do anything to be close to the physique of the guys in my swim class the guys my age are still thin and lanky I’d trade being flat forever for being thin istg,False,False
eht704q,t3_ax9w5y,t1_ehsbggx,Grellous8,1,2019-03-04 19:40:17,/r/EDAnonymous/comments/ax9w5y/men_are_such_a_trigger_for_me/eht704q/,"At the risk of downvotes, I had to say I totally agree here. Just saying.",False,False
ehszon4,t3_ax9w5y,t3_ax9w5y,astr4lproject,1,2019-03-04 18:03:47,/r/EDAnonymous/comments/ax9w5y/men_are_such_a_trigger_for_me/ehszon4/,"My bf routinely eats a loaf of olive bread with an entire block of brie for lunch, but struggles to not be underweight! He has to make a concerted effort to maintain at like 19 as opposed to lower. ~God I wish that were me~",False,False
ehsyhe2,t3_ax9w5y,t3_ax9w5y,Scarab-Beetle,1,2019-03-04 17:48:10,/r/EDAnonymous/comments/ax9w5y/men_are_such_a_trigger_for_me/ehsyhe2/,"When I was in lab my lab mates were talking about their weight and two of them are really skinny and they were saying how much they weigh and they were much heavier than me but they also looked SO MUCH THINNER! Like, can you guys stop having my dream body. ",False,False
ehsxzc5,t3_ax9w5y,t1_ehsfk72,LillyWhiteAndFrozen,1,2019-03-04 17:41:48,/r/EDAnonymous/comments/ax9w5y/men_are_such_a_trigger_for_me/ehsxzc5/,This ^^ ,False,False
ehstyih,t3_ax9w5y,t1_ehsj3y4,citrus_juuiice,1,2019-03-04 16:50:55,/r/EDAnonymous/comments/ax9w5y/men_are_such_a_trigger_for_me/ehstyih/,That’s partly why I seldom dated in Middle and high school. I was big and fat with hips and tits and the boys were thin and had great bodies and could eat a ton.,False,True
ehst4b4,t3_ax9w5y,t3_ax9w5y,tcs_hearts,1,2019-03-04 16:40:54,/r/EDAnonymous/comments/ax9w5y/men_are_such_a_trigger_for_me/ehst4b4/,"Me too. Male fat distribution isn't fair :(  I'm also gay, so luckily I'm not trying to attract them. That's been nice. I can avoid them if I need to.",False,False
ehsszsq,t3_ax9w5y,t3_ax9w5y,babybighorn,1,2019-03-04 16:39:24,/r/EDAnonymous/comments/ax9w5y/men_are_such_a_trigger_for_me/ehsszsq/,"Yes, I had an ex that would do that “forget to eat” nonsense and look so good, or he’d eat very little and I’d refuse to eat more than him and have to throttle my eating speed to match his. My fiancé is a big 6’7 man so I don’t have to worry about being near his weight but he’s also of course a big water and can eat almost whatever and as much as he wants and still looks amazing and I have to make myself eat less and less to keep losing. Men have it (usually) so much easier.",False,False
ehssam5,t3_ax9w5y,t3_ax9w5y,KingOfTheMusicScene,1,2019-03-04 16:31:02,/r/EDAnonymous/comments/ax9w5y/men_are_such_a_trigger_for_me/ehssam5/,"Lately Klaus Hargreeves from Umbrella Academy has been making me feel like shit, so that's the tea on that :/",False,False
ehsrmbz,t3_ax9w5y,t3_ax9w5y,Raynx,1,2019-03-04 16:22:59,/r/EDAnonymous/comments/ax9w5y/men_are_such_a_trigger_for_me/ehsrmbz/,"As a guy, physically speaking, we have the short end of the stick : all our fat is focused on our stomach, and much more visible than women, who for the same bf% will be more balanced. However, society will be kinder on our bodies. A fat guy is just a guy; a fat woman is a tragedy.  But I don't care about society. I don't want to be objectively fat. Sure, I don't have daily remarks about ""letting myself go""; but I see my pants getting tighter by the day if I dare stop fasting for a while. I literally can't afford to eat every day.  I think what you're seeing are younger boys who are more active than average on a daily basis. Later in life then will have to make a choice : be even more active, consciously, or eat less. Most people choose neither.",False,False
ehsrcku,t3_ax9w5y,t3_ax9w5y,mutilatedlemon,1,2019-03-04 16:19:44,/r/EDAnonymous/comments/ax9w5y/men_are_such_a_trigger_for_me/ehsrcku/,I fucking hate my fat distribution ,False,False
ehsr550,t3_ax9w5y,t1_ehspjes,jcoleiscorny,1,2019-03-04 16:17:17,/r/EDAnonymous/comments/ax9w5y/men_are_such_a_trigger_for_me/ehsr550/,exactly my thighs might as well be fucking logs at this point LMAO,False,False
ehsqoi9,t3_ax9w5y,t1_ehsq69q,citrus_juuiice,1,2019-03-04 16:11:44,/r/EDAnonymous/comments/ax9w5y/men_are_such_a_trigger_for_me/ehsqoi9/,"I mean, there is science behind it. But everybody is different. You mentioned BDD so perhaps your mind is tricking you a lil bit. However, you shouldn’t feel more or less of a man because of this.",False,True
ehsq69q,t3_ax9w5y,t1_ehspt62,Grellous8,1,2019-03-04 16:05:43,/r/EDAnonymous/comments/ax9w5y/men_are_such_a_trigger_for_me/ehsq69q/,"While there is definitely truth to the idea that I often see on posts like these how men store/need less fat, BDD and some self-awareness makes me think that this generalization can't be made for everyone, most of all, me...",False,False
ehspt62,t3_ax9w5y,t1_ehspnmu,citrus_juuiice,1,2019-03-04 16:01:22,/r/EDAnonymous/comments/ax9w5y/men_are_such_a_trigger_for_me/ehspt62/,Why does it make you feel not male?,False,True
ehspnmu,t3_ax9w5y,t3_ax9w5y,Grellous8,1,2019-03-04 15:59:35,/r/EDAnonymous/comments/ax9w5y/men_are_such_a_trigger_for_me/ehspnmu/,"lmao why tf do i always enter these kinds of threads complaining about men. it always triggers me like ""well guess i ain't male then""",False,False
ehspjes,t3_ax9w5y,t1_ehsa0uk,Grellous8,1,2019-03-04 15:58:13,/r/EDAnonymous/comments/ax9w5y/men_are_such_a_trigger_for_me/ehspjes/,"big oof i guess im not a guy, then...",False,False
ehspid5,t3_ax9w5y,t1_ehsgp2e,frostfromfire,1,2019-03-04 15:57:52,/r/EDAnonymous/comments/ax9w5y/men_are_such_a_trigger_for_me/ehspid5/,"On the one hand—ow, and that’s uncomfortable and possibly life altering if intestine needs to be removed.  On the other hand...boy is it relieving to get all of that garbage out of your body quickly.  ",False,False
ehspcku,t3_ax9w5y,t1_ehs8keh,frostfromfire,1,2019-03-04 15:56:03,/r/EDAnonymous/comments/ax9w5y/men_are_such_a_trigger_for_me/ehspcku/,"I’m a woman who had a job in a high stakes toxic workplace and the most insulting, demeaning, and outright cruel co-workers I had were a group of middle aged women.  They would stand next to my office and loudly talk about how shitty I looked so that I would hear, talking about my hair, my body, my clothes.  They mostly hated my “cheap clothes” but nothing was off limits when shit talking me.  HR also informed me that they started a rumor that I fucked my way into my position.  I had men working with me who were assholes in how they talked to me, but they’d insult specific things I made an error on or keep bringing up times I was a klutz.  It never got really personal in the way that it did with the women.  Fuck people like that.",False,False
ehsoqsf,t3_ax9w5y,t1_ehscxzt,frostfromfire,1,2019-03-04 15:49:00,/r/EDAnonymous/comments/ax9w5y/men_are_such_a_trigger_for_me/ehsoqsf/,"Ugh, it would be so nice if changing your body could possibly change the behavior of assaulters but it doesn’t.  The common denominator in sexual assault is that the criminal wanted to do it—doesn’t matter if the victim is fat or thin, pretty or ugly, dressed to the nines or wearing an oversized sweatshirt and pajama pants. :(   The most unwanted, negative sexual attention I’ve gotten from men was when I was severely underweight even when I was wearing a winter coat and scarf.  Women are never invisible to predators.",False,False
ehsokxw,t3_ax9w5y,t3_ax9w5y,BlurJAMD,1,2019-03-04 15:47:09,/r/EDAnonymous/comments/ax9w5y/men_are_such_a_trigger_for_me/ehsokxw/,"My brother is currently underweight despite eating trash constantly, meanwhile I'm starving myself and still look like a squat goblin. It really doesn't make any sense, he's the skinny brother and I'm the fat one 😢",False,False
ehsn5cv,t3_ax9w5y,t1_ehsiqgk,spoopyghostboi,1,2019-03-04 15:30:55,/r/EDAnonymous/comments/ax9w5y/men_are_such_a_trigger_for_me/ehsn5cv/,Trans masc and this is so relatable it hurts ,False,False
ehsmkmc,t3_ax9w5y,t3_ax9w5y,Valer_bear,1,2019-03-04 15:24:29,/r/EDAnonymous/comments/ax9w5y/men_are_such_a_trigger_for_me/ehsmkmc/,Ugh yes guys can eat so much and not gain ,False,False
ehsl7f0,t3_ax9w5y,t3_ax9w5y,AmbiguousCat,1,2019-03-04 15:09:18,/r/EDAnonymous/comments/ax9w5y/men_are_such_a_trigger_for_me/ehsl7f0/,And then I have that one guy friend who’s fat and he is always frustrated about it. The dude says he’s gonna work out and rarely goes. When he does it’s like 20-30min casual biking. And then goes home and eats and entire thing of chili right after. Like dude you probably ate like 4x more than you just burned.... I know some people struggle with weight more than others but COME ON?!!! ,False,False
ehskeat,t3_ax9w5y,t3_ax9w5y,Bomby57,1,2019-03-04 15:00:12,/r/EDAnonymous/comments/ax9w5y/men_are_such_a_trigger_for_me/ehskeat/,Until they hit 25... ,False,False
ehsk8l4,t3_ax9w5y,t3_ax9w5y,jirbl,1,2019-03-04 14:58:25,/r/EDAnonymous/comments/ax9w5y/men_are_such_a_trigger_for_me/ehsk8l4/,I feel you. I watch what my boyfriend eats and he's still so thin and doesn't have to care and I'm so jealous. It's really unfair l,False,False
ehsjx56,t3_ax9w5y,t3_ax9w5y,wildflower_0ne,1,2019-03-04 14:54:55,/r/EDAnonymous/comments/ax9w5y/men_are_such_a_trigger_for_me/ehsjx56/,Dude. Yes. My boyfriend is ultra lanky and I just watch him chow down on fudge-covered Oreos and chips and cookies and gulp down 3 full calorie sodas in one sitting and I’m just like.......... *does not compute*,False,False
ehsj3y4,t3_ax9w5y,t3_ax9w5y,vomitandthrowaway,1,2019-03-04 14:45:55,/r/EDAnonymous/comments/ax9w5y/men_are_such_a_trigger_for_me/ehsj3y4/,"Oh god, yes. I dated a few guys smaller than me as a teen (now I'm an adult everyone has levelled out in proportion) and being bigger was the worst trigger. ",False,False
ehsiqgk,t3_ax9w5y,t3_ax9w5y,Hippiethecat124,1,2019-03-04 14:41:47,/r/EDAnonymous/comments/ax9w5y/men_are_such_a_trigger_for_me/ehsiqgk/,"Tbh I'm non-binary and seeing well-dressed guys and androgynous masculine people really triggers me as well. I wanted to make a post here about it but I didn't know if anyone would relate.  I'm AFAB (assigned female at birth) and my fat distribution REALLY shows it, so seeing people who can pull off the ""dapper slim"" look without their hips protruding like goddamn saddlebags makes me feel - uh, Not Good.",False,False
ehsgp2e,t3_ax9w5y,t3_ax9w5y,utterlyuncertain,1,2019-03-04 14:18:48,/r/EDAnonymous/comments/ax9w5y/men_are_such_a_trigger_for_me/ehsgp2e/,I was asking a guy coworker the other day how he gets away with eating so much and is still skinny. He apparently shits it all out because of his IBS.,False,False
ehsg52i,t3_ax9w5y,t3_ax9w5y,sstephenn,1,2019-03-04 14:12:32,/r/EDAnonymous/comments/ax9w5y/men_are_such_a_trigger_for_me/ehsg52i/,I WANT OBLIQUES,False,False
ehsfulg,t3_ax9w5y,t1_ehsfqlf,citrus_juuiice,1,2019-03-04 14:09:11,/r/EDAnonymous/comments/ax9w5y/men_are_such_a_trigger_for_me/ehsfulg/,"Yeah exactly,",False,True
ehsfqlf,t3_ax9w5y,t1_ehscxzt,losingmattie,1,2019-03-04 14:07:54,/r/EDAnonymous/comments/ax9w5y/men_are_such_a_trigger_for_me/ehsfqlf/,"This is exactly my struggle with my weight. I feel like if I'm thin enough, no one and nothing can touch me anymore. I hate feeling like prey, and the world at large encourages men to act like that towards women, starting from a very young age. It sucks to be afraid in your own body.",False,False
ehsfk72,t3_ax9w5y,t3_ax9w5y,PhoneWalletSanity,1,2019-03-04 14:05:53,/r/EDAnonymous/comments/ax9w5y/men_are_such_a_trigger_for_me/ehsfk72/,"The downvoting in this thread makes me mad. We can't just circlejerk and make sweeping generalisations of men (with EDs and no EDs alike) just because we struggle with our own weight and self image and because this sub has a female majority.   Men struggle with unrealistic expectations of masculinity and their bodies as well and frankly, I've been shamed for my body far more by women far more than men. Not that it matters it makes me point any more valid, but I'm a tiny woman with a pathetically low BMR so I'm not defending myself.   Come on, gals, this is supposed to be supportive community. You can voice your opinions, but downvoting other people's opinions and experiences is unfair. ",False,False
ehsfhm9,t3_ax9w5y,t1_ehsbggx,citrus_juuiice,1,2019-03-04 14:05:03,/r/EDAnonymous/comments/ax9w5y/men_are_such_a_trigger_for_me/ehsfhm9/,"I’m not talking about men with EDs. I’m talking about men that don’t have them and shame men with EDs and fat shame women. I get that women have societal pressure to look a certain way and I’m not trying to devalue what men go through. But in my experience, not universally just my expierence, it’s tougher on women than men. ",False,True
ehsf1aa,t3_ax9w5y,t3_ax9w5y,jayrambling,1,2019-03-04 13:59:51,/r/EDAnonymous/comments/ax9w5y/men_are_such_a_trigger_for_me/ehsf1aa/,"My best friend is a guy who's natural bmi is probably just above underweight. This dude eats SO much, whenever we go out to eat he gets two entrees. Somehow he stays the same size, it's so unfair",False,False
ehsdn29,t3_ax9w5y,t1_ehsbzds,PyrotechnicTurtle,1,2019-03-04 13:43:56,/r/EDAnonymous/comments/ax9w5y/men_are_such_a_trigger_for_me/ehsdn29/,"Its mostly women I know, but its hard to to apply the sentiment to general society (even though I know its not accurate). I think I get criticized about pretty normal guy stuff. Weight stuff (hence ED lol), jawline, muscles, and at least from my perspective general unattractiveness.  Some of them see no issue tearing a guy's looks apart, yet even the idea of doing the same to them gets them up in arms.  Really, its just a few toxic women, I'm lucky enough to have far more supportive friends of both genders. But when adding to my other mental health issues its hard to ignore the toxic.  Sorry to hear you know how it feels to be called ugly, no one deserves that :(",False,False
ehscxzt,t3_ax9w5y,t1_ehscl6v,citrus_juuiice,1,2019-03-04 13:36:02,/r/EDAnonymous/comments/ax9w5y/men_are_such_a_trigger_for_me/ehscxzt/,"Yes, I feel you on your second paragraph. I’ve been sexually assaulted by one, stalked by another, and sexually used by a few. When I was a kid they used to bully me and left me to be friends with prettier girls. Then as I got older they just turned into predators. Part of why I want to be thin is so thin is so they don’t want to prey on me, so I’m invisible to them.",False,True
ehscl6v,t3_ax9w5y,t3_ax9w5y,pearyball,1,2019-03-04 13:31:58,/r/EDAnonymous/comments/ax9w5y/men_are_such_a_trigger_for_me/ehscl6v/,"My boyfriend's TDEE is 1100 more than mine..... it really is tragic. I love him, we're in very different stages of life where I'm maintaining an UW BMI and he's going from UW (non-ED, he's just not a big eater) to a normal BMI, so he gets to eat soooo much....   In general, men are an ED trigger for me, and not in the way they'd like to think. It isn't triggering because I get reminded I want to be desirable/skinny for them (some have very kindly assumed), it's because I'm reminded of how horrible I felt being assaulted by one when I was a healthy weight, how their stares disgust me, how I hate feeling like they're mapping out my body, predatory fucking cartographers. It's sure easy being a relatively lower weight and looking down on women who are much shorter when you have an extra thousand fucking calories to consume at your will, too. ",False,False
ehsbzds,t3_ax9w5y,t1_ehs8keh,citrus_juuiice,1,2019-03-04 13:25:02,/r/EDAnonymous/comments/ax9w5y/men_are_such_a_trigger_for_me/ehsbzds/,"What is the objectification like? Does it come from society or women you know? I’m sorry they called you ugly, I know how it feels to be called ugly. ",False,True
ehsbv9a,t3_ax9w5y,t1_ehsab7f,citrus_juuiice,1,2019-03-04 13:23:45,/r/EDAnonymous/comments/ax9w5y/men_are_such_a_trigger_for_me/ehsbv9a/,"Yeah, especially the curves. Their fat is evenly distributed and masked by muscle where as all of mine is in my curves. I don’t want curves.",False,True
ehsbszl,t3_ax9w5y,t1_ehs8keh,cummo22,1,2019-03-04 13:23:01,/r/EDAnonymous/comments/ax9w5y/men_are_such_a_trigger_for_me/ehsbszl/,"Absolutely, we have to cut to very very low levels of fat to get the good jawline / six pack, and also get enough calories to gain muscle. All the girls I interact with in public are absolutely looks focused. I think the people in this thread just want an excuse to say it’s hard being them - I mean - if this post were accurate I would feel pretty pathetic about being a Male with an ED. ",False,False
ehsbspj,t3_ax9w5y,t1_ehsa0uk,citrus_juuiice,1,2019-03-04 13:22:56,/r/EDAnonymous/comments/ax9w5y/men_are_such_a_trigger_for_me/ehsbspj/,"Yes, I see guys in campus all the time in skinny jeans and they look good. Meanwhile I look like a beached whale, so I avoid skinny jeans.",False,True
ehsbggx,t3_ax9w5y,t1_ehs9y2w,cummo22,1,2019-03-04 13:19:04,/r/EDAnonymous/comments/ax9w5y/men_are_such_a_trigger_for_me/ehsbggx/,"Absolutely , but that’s not at all what this post is saying. From what I can see, she’s saying:  - Men are inherently fat shamers, have high body standards and make fun of fellow men with ED’s  This behaviour is absolutely not gender specific, these apply to both genders  - Men don’t have to do anything to look good  Why do you think we develop ED’s too? It’s insulting. We may burn more calories but we also have to eat in a surplus if we are expected to gain any muscle for aesthetics, or we are skinny and unattractive. By the same token, we also have to reach much lower levels of body fat in order to get that sexy jawline / elusive six pack that women desire.   Also yes, obviously the taco thing was exaggerated. But I think the much more likely explanation is that men generally do not turn to food as a form of escapism. It’s just less likely for men, they are more likely to turn to video games, alcohol. ",False,False
ehsb80y,t3_ax9w5y,t3_ax9w5y,rachelcoiling,1,2019-03-04 13:16:22,/r/EDAnonymous/comments/ax9w5y/men_are_such_a_trigger_for_me/ehsb80y/,"I’m more easily triggered by men too, but for entirely different reasons.   It’s because I’m afraid of being heavier than my boyfriend. If my female friends and co-workers are slimmer, it doesn’t feel like a big deal. But my ex was almost the same weight as me (he was 6’2” and had an underweight BMI). There was nothing magical about his metabolism - he just had a physically demanding job and a lot of GI problems.   This is NOT his fault/men’s fault/anybody’s. Just an internalized societal pressure to be smaller than my partner 🤷🏻‍♀️",False,False
