Comment ID,Link ID,Parent ID,Author,Score,Publish Date,Permalink,Text,Stickied,Is Submitter
fe87u1x,t3_emj014,t1_fdpia2g,DuckieIsMyHero88,1,2020-01-13 07:52:37,/r/EDAnonymous/comments/emj014/im_starting_to_think_i_might_be_the_tiniest_bit/fe87u1x/,*currently doing laps in my kitchen while browsing reddit* where'd that chair come from?!,False,False
fdrk2ja,t3_emj014,t1_fdqntg5,DogTeeth_Val,1,2020-01-10 13:47:09,/r/EDAnonymous/comments/emj014/im_starting_to_think_i_might_be_the_tiniest_bit/fdrk2ja/,I've got a strong saddle on my ED now. I still struggle but I manage myself a lot better,False,False
fdqrgun,t3_emj014,t1_fdqoaw6,annielovesbacon,1,2020-01-10 10:21:38,/r/EDAnonymous/comments/emj014/im_starting_to_think_i_might_be_the_tiniest_bit/fdqrgun/,"I was the exact same way. My Fitbit broke last year and I never replaced it (the original one was a gift and I couldn’t afford a new one) and eventually my obsession subsided.   I don’t have OCD but I think I displayed some obsessive/compulsive tendencies regarding my step count... it wasn’t even just getting a certain number of steps, it was also that I had to get EXACTLY 15,000 (or whatever) and when I hit that I would go to bed and not move for the rest of the day.",False,False
fdqoaw6,t3_emj014,t1_fdp8drs,fouram444,1,2020-01-10 09:48:48,/r/EDAnonymous/comments/emj014/im_starting_to_think_i_might_be_the_tiniest_bit/fdqoaw6/,"I'm scared that soon I'll become really obsessed with my step count.  Like back when I first started my weightloss ""journey"" I didnt want to eat dangerously low but slowly everything got more harsh and I wanted to be lower.  Now I'm afraid my steps will get in the way of some things.  Yesterday i wouldnt stop until i hit 15000 (which i dont know if it's a lot or a little depending on the person) but I had to study for my test the next day but I didnt care, I just had to.  Eventually I stopped there, and didnt walk purposefully after that.  Right now I'm pacing since I just came back from school, will probably do this for 30 minutes before I settle down and plan the rest of my day.  Ever since hitting anything above 10000, 8000 itself seems too little for me.",False,True
fdqnyle,t3_emj014,t1_fdq3i8w,fouram444,1,2020-01-10 09:45:14,/r/EDAnonymous/comments/emj014/im_starting_to_think_i_might_be_the_tiniest_bit/fdqnyle/,IMAGINE.  Cant do that.  My friend slept for most of the day yesterday (think 4 pm to 12) and spent the rest of the night studying for a test we had in a few hours but also had more than a cup of rice for dinner at 2 am.  If that were me I would have told myself to hold out until tomorrow morning.,False,True
fdqntg5,t3_emj014,t1_fdp0wre,fouram444,1,2020-01-10 09:43:43,/r/EDAnonymous/comments/emj014/im_starting_to_think_i_might_be_the_tiniest_bit/fdqntg5/,"Damn I'm sorry to hear that, I hope things are a little better now?",False,True
fdqnqr5,t3_emj014,t1_fdpia2g,fouram444,1,2020-01-10 09:42:56,/r/EDAnonymous/comments/emj014/im_starting_to_think_i_might_be_the_tiniest_bit/fdqnqr5/,"""Sorry neck, but it's all for fat burning"" YES that's exactly what goes on in my head, and then halfway through I notice I'm hunched and looking down and too close to my phone so I fix that.",False,True
fdqamrw,t3_emj014,t3_emj014,barbie_bitch666,1,2020-01-10 07:01:40,/r/EDAnonymous/comments/emj014/im_starting_to_think_i_might_be_the_tiniest_bit/fdqamrw/,"when i am home alone during the day I go up and down the stairs about 100 times, on top of pacing the kitchen while eating, but i also work out like 2-3 hours a day. I like to eat while I pace the kitchen because i feel less like i am sinning from eating an apple if i walk off half the cals before i finish it 😂",False,False
fdq3i8w,t3_emj014,t1_fdp13ak,SymptomOfTheStorm,1,2020-01-10 04:44:35,/r/EDAnonymous/comments/emj014/im_starting_to_think_i_might_be_the_tiniest_bit/fdq3i8w/,Yeah when normal people feel like that they usually just feed their bodies.   My boyfriend has been dieting after New Years but yesterday he was hungry and felt crappy. It was a big day of important meetings at his job - so what did he do? Dude ate breakfast AND lunch so he could feel his brain work it’s best.   When he came home and told me this over dinner I was like damn wow that’s goals,False,False
fdq1zac,t3_emj014,t3_emj014,princess-kitty-belle,1,2020-01-10 04:08:28,/r/EDAnonymous/comments/emj014/im_starting_to_think_i_might_be_the_tiniest_bit/fdq1zac/,"I used to pace so much in my hospital room because I wasn't on 24 hour supervision. Used to wake up early to do it. So many regrets about this.  I used to also run on the spot when I was at my lowest at home, I couldn't go out and walk because I was freaked out that I'd faint.",False,False
fdptg9p,t3_emj014,t3_emj014,waywardzero,1,2020-01-10 01:03:22,/r/EDAnonymous/comments/emj014/im_starting_to_think_i_might_be_the_tiniest_bit/fdptg9p/,I relate so much. When I was at my worst I would pace back and forth in my living room somewhere between 11pm and 5am to hide the exercise. While doing this I’d either watch Grey’s Anatomy on my TV or YouTube on my phone. My eyes would hurt and I got dizzy but I needed entertainment,False,False
fdpia2g,t3_emj014,t3_emj014,PetitCinnamonPumpkin,1,2020-01-09 22:09:22,/r/EDAnonymous/comments/emj014/im_starting_to_think_i_might_be_the_tiniest_bit/fdpia2g/,"I do the same thing while being on reddit and doing things on my phone. Sorry neck, but it’s all for fat burning",False,False
fdpi56i,t3_emj014,t1_fdp6di2,fluentsyntax,1,2020-01-09 22:07:38,/r/EDAnonymous/comments/emj014/im_starting_to_think_i_might_be_the_tiniest_bit/fdpi56i/,"omg i do this too, while pretending my having a convo w someone. scenarios about when i’m thin enough lmaoo",False,False
fdpi27t,t3_emj014,t3_emj014,fluentsyntax,1,2020-01-09 22:06:33,/r/EDAnonymous/comments/emj014/im_starting_to_think_i_might_be_the_tiniest_bit/fdpi27t/,omg i have a treadmill in my tiny ass studio and run on it whenever i feel manic and trapped. blast my music and try to think about pretty things.,False,False
fdp8drs,t3_emj014,t3_emj014,annielovesbacon,1,2020-01-09 20:13:21,/r/EDAnonymous/comments/emj014/im_starting_to_think_i_might_be_the_tiniest_bit/fdp8drs/,"When I lived abroad I had no access to any place to exercise (except on the sidewalk, in a huge city) so I would pace or jog in place in my bedroom for hours every night. I was obsessed with my step count and it sucked.",False,False
fdp6di2,t3_emj014,t3_emj014,Anonymous_fiend,1,2020-01-09 19:50:57,/r/EDAnonymous/comments/emj014/im_starting_to_think_i_might_be_the_tiniest_bit/fdp6di2/,I pace all the time while maladaptive daydreaming but I’m also on the spectrum. I don’t mind it since it ups my tdee.,False,False
fdp13ak,t3_emj014,t3_emj014,sevenswns,1,2020-01-09 18:51:30,/r/EDAnonymous/comments/emj014/im_starting_to_think_i_might_be_the_tiniest_bit/fdp13ak/,"non disordered people don't really do this, no, unless they're dealing with something else that makes them restless. you get dizzy and headachey because you're malnourished",False,False
fdp0wre,t3_emj014,t3_emj014,DogTeeth_Val,1,2020-01-09 18:49:29,/r/EDAnonymous/comments/emj014/im_starting_to_think_i_might_be_the_tiniest_bit/fdp0wre/,"At low points I had to exercise in secret to avoid arguments. I would sometimes pace around my room for hours at a time, and then I started to jog on the spot with a pillow on the ground to muffle my step sounds. This was often done at night for ages while I mentally abused myself for eating during the day.",False,False
