Comment ID,Link ID,Parent ID,Author,Score,Publish Date,Permalink,Text,Stickied,Is Submitter
emxbr5h,t3_bm8pi5,t1_emw7j9l,k473anderson,1,2019-05-09 10:00:43,/r/EDAnonymous/comments/bm8pi5/non_traditional_recovery/emxbr5h/,"The other thing I'd really encourage is pushing back on your internal thoughts about thinness: why do you value being thin so much? Is it something you *want* to value? What do you fear will happen if you gain weight? I realized I moralize thin bodies, and also that I assume everyone else does, so that if I have a larger body my friends/partners/family will think I'm bad/lazy/weak. I realized that regardless of my body I want to pick friends/partners that love me with less regard for my size ❤️",False,False
emxbcyl,t3_bm8pi5,t1_emxb8pt,DelicateBones,1,2019-05-09 09:56:47,/r/EDAnonymous/comments/bm8pi5/non_traditional_recovery/emxbcyl/,Thank you! I’m going to look into this!,False,True
emxb8pt,t3_bm8pi5,t1_emw7j9l,k473anderson,1,2019-05-09 09:55:40,/r/EDAnonymous/comments/bm8pi5/non_traditional_recovery/emxb8pt/,"I don't think intuitive eating (meaning non tracking) is the only answer for recovery. Have you read the intuitive eating book? Even though I don't do the whole smorgasbord, reading it helped me realize how my behaviors were leaching joy in little ways and encouraged me to pursue harm reduction. I realized feeling growly hunger isn't sustainable and if I want to lose weight I have to figure out a way to do it that doesn't make me grouchy and tired and dumb :P I highly recommend weighing less, helps so much with mood! I had to ask my partner to keep my scale in his car/apartment in order to achieve this, because willpower is a limited resource.",False,False
emx1xjv,t3_bm8pi5,t1_emuvjem,tofu_snob,1,2019-05-09 08:18:50,/r/EDAnonymous/comments/bm8pi5/non_traditional_recovery/emx1xjv/,"For what its worth, it could be worth doing an initial consultation just to see what its like.",False,False
emwyqj0,t3_bm8pi5,t1_emvsjq2,stopandbelieve,1,2019-05-09 07:42:49,/r/EDAnonymous/comments/bm8pi5/non_traditional_recovery/emwyqj0/,"Your weight can normalize and settle to where it’s meant to be in your set point range (ie whether from too low or too high, like from binge eating), but to me it sounds like you want to keep your weight artificially low. That just isn’t healthy for your body, and it will probably fight to get back to your range.   It’s not fair but we’re the ones who have fucked up relationships with food. Other people don’t have that burden.",False,False
emw7j9l,t3_bm8pi5,t1_emuz9e9,DelicateBones,1,2019-05-08 23:29:18,/r/EDAnonymous/comments/bm8pi5/non_traditional_recovery/emw7j9l/,"Thanks for this! I feel like I’m currently on a similar path. I’m trying to break myself of the habit of weighing myself daily because I’ve been letting the number reflected back at me determine how my day is going to go, subconsciously. It’s not a good way to start every single day when weight naturally fluctuates here and there for any old reason. I’m hoping once I lose the weight I want to, to gradually begin increasing my calories. Right now I eat around 800 a day and it’s (surprise, surprise) causing me to have binge urges. My “binges” still fall under my TDEE, but still come with their fair share of guilt and stress, so finding a healthy amount of calories to eat per day and maintain is my end goal. I do try and eat out here and there. I’ve tried to be up front about it with my ”kind of” partner and my therapist. I just refuse to eat intuitively because after a decade of trying it off and on, I whole heartedly don’t believe it works for me. It has encouraged cyclic behavior that I’m trying to break. So whether or not people think that I’m still living in terms of my eating disorder by hitting a goal weight and working to maintain it, I’m still living in terms of my ED by eating intuitively, and cycling back to restriction. I’m a very petite woman, so a small amount of weight gain is painfully noticeable and triggering for me.",False,True
emvsjq2,t3_bm8pi5,t1_emvpbr7,DelicateBones,1,2019-05-08 20:21:30,/r/EDAnonymous/comments/bm8pi5/non_traditional_recovery/emvsjq2/,"It’s just silly to me that someone without a history of disordered eating can reach a goal weight, work to maintain it, and it’s normal and fine.  But for some reason, someone with a history of disordered eating absolutely can not do the same thing while learning to have a healthier relationship with food and their body. Either you oblige to a cookie cutter recovery plan, or iT’s NoT wHaT rEcOvErY lOoKs LiKe.",False,True
emvpbr7,t3_bm8pi5,t3_bm8pi5,stopandbelieve,1,2019-05-08 19:43:20,/r/EDAnonymous/comments/bm8pi5/non_traditional_recovery/emvpbr7/,What you want isn’t really recovery. It’s still a life with an eating disorder.   I don’t mean to judge but I don’t think you should kid yourself into thinking that’s what recovery looks like,False,False
emvp407,t3_bm8pi5,t1_emvcjeb,stopandbelieve,1,2019-05-08 19:40:46,/r/EDAnonymous/comments/bm8pi5/non_traditional_recovery/emvp407/,I wholeheartedly agree with this,False,False
emvnnyl,t3_bm8pi5,t1_emuvjem,MissNietzsche,1,2019-05-08 19:23:28,/r/EDAnonymous/comments/bm8pi5/non_traditional_recovery/emvnnyl/,"Lmao, I'm in school to be an RD too, and same hahhahaahah",False,False
emvhsv0,t3_bm8pi5,t1_emvcjeb,DelicateBones,1,2019-05-08 18:11:26,/r/EDAnonymous/comments/bm8pi5/non_traditional_recovery/emvhsv0/,Accurate 🤷🏻‍♀️,False,True
emvcjeb,t3_bm8pi5,t3_bm8pi5,princess-kitty-belle,1,2019-05-08 17:12:08,/r/EDAnonymous/comments/bm8pi5/non_traditional_recovery/emvcjeb/,"Recovery truly means letting go of losing weight and your happiness being derived from a number on the scale. My treatment team would absolutely refuse what you are proposing, as it's coming from your eating disorder, rather than from your healthy self. It sounds like you are really trying to find a way to live by your eating disorders terms, a 'quasi-recovery' per say.",False,False
emuz9e9,t3_bm8pi5,t3_bm8pi5,k473anderson,1,2019-05-08 15:07:36,/r/EDAnonymous/comments/bm8pi5/non_traditional_recovery/emuz9e9/,"Wanted to pitch in a few thoughts about ""nontraditional recovery.""    I've never been underweight, or honestly anything less than solidly mid-range healthy BMI, so YMMV, but I have been tracking/restricting for about 15 years. My ""recovery"" has mainly focused on noticing the ways in which my ED behaviors/thoughts make me unhappy and take away from my life, and implementing small changes over time to minimize those negatives. This has looked like recognizing/choosing ""bumpers,"" which are like mini personal red flags that my ED is taking up too much space in my life. Some of my bumpers (ED fallout I'm unwilling to tolerate for long periods) include (1) hampering my work performance due to tiredness, obsessive thoughts, etc.; (2) impacting my relationships due to anxiety/moodiness, unwillingness to eat out, insecurity from body checks, desire to lie to my partners; (3) any sort of weight goal ""deadline"". Currently I do track, and aim for a small calorie deficit (300 cals/day) most days with one maintenance day per week and one maintenance week per month, weighing myself as little as possible (about once a month). This is working well for me right now because the relatively high calories (1700/day) mean I don't binge, and I trust that my weight won't go up based on my tracking/experience, but it gives me some of the accomplishment/control feelings I like without the negatives feelings from seeing daily weight fluctuations. I'd say the other big part of my recovery has been brainwashing myself with pretty pictures of plus size models and dressing myself well so I feel attractive at a relatively ""high"" weight.   I've done a couple stints of intuitive eating and maintained my weight (note that I'm on the high end of ""healthy BMI"" for my height), but I was also maintaining it while tracking/restricting. I've been at this weight for a couple years, so it seems like my body likes it/isn't fighting it.",False,False
emuvjem,t3_bm8pi5,t1_emuvfbi,DelicateBones,1,2019-05-08 14:34:08,/r/EDAnonymous/comments/bm8pi5/non_traditional_recovery/emuvjem/,"Oof, yeah not interested in that. 😬",False,True
emuvfbi,t3_bm8pi5,t1_emur37o,tofu_snob,1,2019-05-08 14:32:59,/r/EDAnonymous/comments/bm8pi5/non_traditional_recovery/emuvfbi/,"Those are the kind of things that RDNs help people heal from. Calorie counting, fear foods, the fear of gaining weight... that's all in a dietitian's scope of practice, moreso than a therapist. Recovery isn't meant to be restrictive, harmful, and perpetuate ED thoughts. Its sure as hell scary, but it is meant to be freeing.",False,False
emur37o,t3_bm8pi5,t1_emuqmp4,DelicateBones,1,2019-05-08 13:49:12,/r/EDAnonymous/comments/bm8pi5/non_traditional_recovery/emur37o/,"I wouldn’t see anyone until after I lose more weight. I’m talking about maintaining the LW, and being allowed to keep my calorie counting and fear foods.",False,True
emuqwwe,t3_bm8pi5,t1_emupjj3,lotsofsqs,1,2019-05-08 13:47:27,/r/EDAnonymous/comments/bm8pi5/non_traditional_recovery/emuqwwe/,"Exactly. That's why I'd be as explicit and detailed as possible when describing your desired outcomes and hard beliefs up front, to avoid situations where you get a few sessions in just to realize they really want you eating a doughnut every meal or that they're very inflexible.  I have no idea what the liabilities they have to avoid. E.g. they might not be comfortable helping someone with an ED at a healthy weight lose more weight.",False,False
emuqmp4,t3_bm8pi5,t1_emuqhkp,tofu_snob,1,2019-05-08 13:44:33,/r/EDAnonymous/comments/bm8pi5/non_traditional_recovery/emuqmp4/,What is the specific goal you have that you are currently worried a dietitian will not be okay with? Are you referring to wanting to lose more weight?,False,False
emuqk6p,t3_bm8pi5,t1_emuqftb,tofu_snob,1,2019-05-08 13:43:50,/r/EDAnonymous/comments/bm8pi5/non_traditional_recovery/emuqk6p/,"I figured you already knew, I just wanted to ensure the OP knew there was a good option haha. In 2024, we'll be required to have Master's degrees too.",False,False
emuqhkp,t3_bm8pi5,t1_emupn2w,DelicateBones,1,2019-05-08 13:43:05,/r/EDAnonymous/comments/bm8pi5/non_traditional_recovery/emuqhkp/,Got it. So you’re saying that seeing a professional means the above mentioned hopes are down the drain?,False,True
emuqftb,t3_bm8pi5,t1_emupz2z,LowCalPal,1,2019-05-08 13:42:34,/r/EDAnonymous/comments/bm8pi5/non_traditional_recovery/emuqftb/,"For sure, a dietitian is an actual professional with a rigorous education and accountability.  I should have noted in my comment not to conflate the two.",False,False
emupz2z,t3_bm8pi5,t1_emuol0f,tofu_snob,1,2019-05-08 13:37:40,/r/EDAnonymous/comments/bm8pi5/non_traditional_recovery/emupz2z/,"Registered Dietitian Nutritionists are NOT in this category. We are required to have a Bachelor's degree, complete an extremely competitive internship (my alma mater takes 10 students out of 100 applicants), pass a national examination, and become licensed in certain states. We have a governing body similar to the American Medical Association called the Academy of Nutrition and Dietetics. But u/LowCalPal is completely right that someone that is just a ""nutritionist"" should not be seen.",False,False
emuppca,t3_bm8pi5,t1_emuoae6,tofu_snob,1,2019-05-08 13:34:48,/r/EDAnonymous/comments/bm8pi5/non_traditional_recovery/emuppca/,I think the therapist meant Registered Dietitian Nutritionist. It would be really nice if other health professionals could learn how to use the term properly. T\_T,False,False
emupn2w,t3_bm8pi5,t3_bm8pi5,tofu_snob,1,2019-05-08 13:34:09,/r/EDAnonymous/comments/bm8pi5/non_traditional_recovery/emupn2w/,"So a nutritionist is not a credentialed term. The specialist she means is a registered dietitian nutritionist (RDN). I think they are absolutely essential for eating disorder recovery, and you should particularly seek out an RDN that specializes in eating disorders. When you see an RDN, its not going to be ""your plan"" anymore because your current plan is based on the wants and needs of an eating disorder. They will help you view food in a more healthy manner and learn how food is fuel for your body. I'm currently in a dietetic internship grad school to become an RDN, so I am a little biased. However, I the RDNs in the treatment centers I was in were essential for my recovery a few years back.",False,False
emupjj3,t3_bm8pi5,t1_emuoyvs,DelicateBones,1,2019-05-08 13:33:07,/r/EDAnonymous/comments/bm8pi5/non_traditional_recovery/emupjj3/,"Thanks! This is helpful. My therapist did say that if I wasn’t 100% pleased with the information or plan proposed by a professional, I don’t have to feel obligated to working with them and can look at other options.",False,True
emuoyvs,t3_bm8pi5,t3_bm8pi5,lotsofsqs,1,2019-05-08 13:27:07,/r/EDAnonymous/comments/bm8pi5/non_traditional_recovery/emuoyvs/,"I'm going to meet with a dietitian (boyfriend's friend) who has done ED work before but doesn't specialize in it. I feel confident that she won't put me on her old ED clinic's meal plan (which I've heard is excessive from someone else who works there) and that she'll respect my desire to stay at the low-end of healthy. I also know she has some weird ideas about food sensitivities though, which I am not interested in since I have no digestion/health problems otherwise. I'll comment if she's helpful.  From what I am gathered from your post though, is that you have enough information to create your own ideal meal plan. I'm sure you know what restricting is from a caloric perspective. What if you proposed one to your therapist and had your therapist keep you accountable? Especially since you don't want to give up counting calories, this seems like a good option? I do want to quit counting, but have no idea how to let go of that without overdoing it food-wise and gaining, like you mentioned.   I guess I'd write out what you want to get from your nutritionist first. Then meet with people and make sure they're willing to work with your goals.",False,False
emuol0f,t3_bm8pi5,t1_emuoae6,DelicateBones,1,2019-05-08 13:23:03,/r/EDAnonymous/comments/bm8pi5/non_traditional_recovery/emuol0f/,"Noted. She was going to talk to her colleagues and the nutritionist was going to be selected on a referral basis, but that makes me uncomfortable in itself because the selection process is still based on my having an ED.",False,True
emuoae6,t3_bm8pi5,t3_bm8pi5,LowCalPal,1,2019-05-08 13:19:55,/r/EDAnonymous/comments/bm8pi5/non_traditional_recovery/emuoae6/,"I'm extremely turned off by the idea of a nutritionist because literally anyone can hang out a shingle and call themselves a nutritionist.  There is no education requirement, no governing body, no standard.  It's like calling yourself a witch or a psychic or a life coach.  The word is meaningless, and you could be talking to any crazy person.",False,False
