Comment ID,Link ID,Parent ID,Author,Score,Publish Date,Permalink,Text,Stickied,Is Submitter
f9x23rb,t3_e751bk,t1_f9vtoao,xosfx,1,2019-12-07 01:20:59,/r/EDAnonymous/comments/e751bk/recovery_tips/f9x23rb/,"I can't tell you how helpful this is, thank you so much for talking the time to write such a long list! I definitely already knew the first one but for some reason it dawned on me like a piece of magic information I've never seen before. I really appreciate this, thank you and I wish you well too in continuing to recover",False,True
f9w4bxw,t3_e751bk,t3_e751bk,Joy_BBSolution,1,2019-12-06 20:46:26,/r/EDAnonymous/comments/e751bk/recovery_tips/f9w4bxw/,I’m a recovered compulsive eater and would love to help. DM me if you would like to chat more.,False,False
f9vvxst,t3_e751bk,t1_f9vtoao,chloesmiddlefinger,1,2019-12-06 19:13:31,/r/EDAnonymous/comments/e751bk/recovery_tips/f9vvxst/,I needed to read all of these things just now and would genuinely like to thank you for this comment. Tabitha is a real gem.,False,False
f9vtoao,t3_e751bk,t3_e751bk,intertropical,1,2019-12-06 18:44:22,/r/EDAnonymous/comments/e751bk/recovery_tips/f9vtoao/,"what's helping me is to remind myself that:  \- although I might feel anxious, the anxiety will not last indefinitely if I continue on recovery and eventually be healthy. however, if I continue with my disordered eating habits, I will forever be stuck in its destructive cycles :/  \- at my lowest weight I was not happy. granted, sometimes I might think that I feel even worse now (with all the anxiety!), but even when I 'was skinny' I still hated my body, obsessed endlessly over food, felt like crap physically, felt incredibly isolated and lonely, etc... whereas when I was at a higher weight, before my relationship with food got messed up, I was happier and more functional. Restricting and even losing weight has never brought me genuine, long-term happiness.   \- the more I restrict, the more I'll binge. And I'm terrified of bingeing! I'd been gaining some weight from a binge-restrict cycle, so sometimes I tell myself that my 'recovered set point' weight might even be lower than what I'd weigh if I endless try to restrict and hence endlessly continue to bingeing.   \- I should think of my own values -- not the ED's! I value kindness, courage, health, etc. It's only the ED that's obsessed about numbers and appearance. That's not me. And that's not the life I'll have to live.   \- it's possible to rewire my brain through deliberately doing  things that are against disordered urges. for example, I used to be terrified by peanut butter, but I've been letting myself have some during breakfast and it's gradually getting easier each time I do it. I want to try this for my other food rules/fears as well.   \-  if it's tough, it's probably working!!  \- not weighing myself.  \- wearing comfortable clothes -- can't stress this enough!!  I also recommend follow recovered/recovering people on social media!  I personally love Tabitha Farrar and Megsy Recovery -- they're on youtube.   all the best!! &lt;3",False,False
f9vgr41,t3_e751bk,t1_f9vgbna,xosfx,1,2019-12-06 16:08:42,/r/EDAnonymous/comments/e751bk/recovery_tips/f9vgr41/,"thank you so much! it's so nice to see support and someone who understands. I know that I should stop counting calories but it will probably be one of the last steps I take. this is my third time round with a relapse, I've been a healthy weight while counting calories and I've been underweight, my goal is to one day not count anymore, but that feels incredibly distant. anyway, thank you again so much, your support and tips are really helpful!",False,True
f9vgbna,t3_e751bk,t1_f9vfmlj,alexandrapanken,1,2019-12-06 16:03:55,/r/EDAnonymous/comments/e751bk/recovery_tips/f9vgbna/,"Do you still count calories? If you do, letting go of that and just eating whatever your body wants/ until your body is satisfied is something that could help you. If you feel like you’re doing the wrong thing it’s probably because that’s what your ED wants you to feel.Not you. It wants you to feel like recovery and eating enough food is bad because it needs starvation to survive and thrive. Don’t listen to it. I also felt like shit when I started eating again. It was like immediately when I started going against my ED it made things hard for me. I saw myself as HUGE. I felt like shit too. My body dysmorphia was super bad. In reality I wasn’t huge. At all. It was my ED trying to get me back by making me feel like eating enough=feeling like shit.   Sending you hugs and support. You got this!💖",False,False
f9vfmlj,t3_e751bk,t1_f9vf6x3,xosfx,1,2019-12-06 15:56:19,/r/EDAnonymous/comments/e751bk/recovery_tips/f9vfmlj/,"thank you! so far I'm just doing things and eating ""enough"" but what's hard is feeling like shit, wanting to quit and feeling like I'm doing the wrong thing",False,True
f9vf6x3,t3_e751bk,t3_e751bk,alexandrapanken,1,2019-12-06 15:51:32,/r/EDAnonymous/comments/e751bk/recovery_tips/f9vf6x3/,"Find what feels difficult for you to do (eating alone, eating with others, eating fear foods, eating at a certain time etc..) and slowly challenge your ”rules” or ”habits”. Go slow at first and start with small wins.  You got this💖",False,False
