Comment ID,Link ID,Parent ID,Author,Score,Publish Date,Permalink,Text,Stickied,Is Submitter
ev7pbfe,t3_cih5s2,t3_cih5s2,BronArianwyn,1,2019-07-27 16:23:02,/r/EDAnonymous/comments/cih5s2/love_of_coffee_has_replaced_the_enjoyment_i_got/ev7pbfe/,This was really relaxing to read. Very wholesome,False,False
ev70xcq,t3_cih5s2,t3_cih5s2,DietCokeQween,1,2019-07-27 13:56:49,/r/EDAnonymous/comments/cih5s2/love_of_coffee_has_replaced_the_enjoyment_i_got/ev70xcq/,Literally me. Coffee is my life and the one way I can get a few guilt free(ish) calories in if I’m in a social situation.,False,False
ev5smj1,t3_cih5s2,t3_cih5s2,sstephenn,1,2019-07-27 09:37:04,/r/EDAnonymous/comments/cih5s2/love_of_coffee_has_replaced_the_enjoyment_i_got/ev5smj1/,I have a keurig does that count,False,False
ev5ndnu,t3_cih5s2,t1_ev5lxix,sugardeficiency,1,2019-07-27 09:05:26,/r/EDAnonymous/comments/cih5s2/love_of_coffee_has_replaced_the_enjoyment_i_got/ev5ndnu/,"Hit up TJmaxx or Target, they have metal straws for a good price. Always ask for a straw at cafés too even if you order a hot coffee. People will look at you weird, but who will be laughing in the end is you with you bright white teeth 😂",False,False
ev5lxix,t3_cih5s2,t1_ev5jvge,fatpigeon_,1,2019-07-27 08:55:44,/r/EDAnonymous/comments/cih5s2/love_of_coffee_has_replaced_the_enjoyment_i_got/ev5lxix/,"Water is the beverage most dear to my heart even if it tastes like nothing!  I’ll definitely be getting some straws though, I already smoke so I don’t need to make things even worse with coffee stains.",False,True
ev5jvge,t3_cih5s2,t3_cih5s2,sugardeficiency,1,2019-07-27 08:41:27,/r/EDAnonymous/comments/cih5s2/love_of_coffee_has_replaced_the_enjoyment_i_got/ev5jvge/,"I can relate. Now I’m a coffee snob and I can only take it black and strong. Nothing wrong with that but 2 tips for you.   1. For every cup of coffee, drink 2-3 of water so your skin is not dehydrated cause we don’t want premature aging up in here  2. Drink through a straw to the back if your mouth. Being skinny is cute but not when you have yellow teeth.",False,False
