Comment ID,Link ID,Parent ID,Author,Score,Publish Date,Permalink,Text,Stickied,Is Submitter
ea0wy2v,t3_9y869y,t1_ea0eh6h,AnaTroi,1,2018-11-19 03:23:39,/r/EDAnonymous/comments/9y869y/how_do_you_fight_against_black_and_white_thinking/ea0wy2v/,Thank you! 💙💙💙,False,False
ea0eh6h,t3_9y869y,t1_e9zi9c1,ALittleBitChowderNow,1,2018-11-18 20:31:32,/r/EDAnonymous/comments/9y869y/how_do_you_fight_against_black_and_white_thinking/ea0eh6h/,I think that IS a huge accomplishment!  Congrats!,False,False
ea01lnu,t3_9y869y,t1_e9zem3v,SuicidalSuccubus,1,2018-11-18 17:15:03,/r/EDAnonymous/comments/9y869y/how_do_you_fight_against_black_and_white_thinking/ea01lnu/,I never though about it this way! What a great analogy. Thanks! ,False,False
e9zic0i,t3_9y869y,t1_e9zem3v,im_disappearing,1,2018-11-18 13:13:19,/r/EDAnonymous/comments/9y869y/how_do_you_fight_against_black_and_white_thinking/e9zic0i/,"Wow, thank you for this",False,False
e9zi9c1,t3_9y869y,t3_9y869y,AnaTroi,1,2018-11-18 13:12:31,/r/EDAnonymous/comments/9y869y/how_do_you_fight_against_black_and_white_thinking/e9zi9c1/,"TW  I've always been a ""restricter"" but I started purging off and on last year. I hated it so much. But that's the exact way I would think. ""I've already blown it for the day, so I'll just have a massive binge and then purge.""  It started out infrequently but it quickly grew to a problem that was spiraling out of control. My glands were swollen, my head hurt all the time, and I just felt like rubbish. I wanted to stop but couldn't.   I kept making these grand promises to myself that ""today will be the last time"" etc. But it never was because I'd justify it with that logic. ""I've already screwed up. Might as well keep going."" Almost like punishment.  I've been binge (and subsequently purge) free the entire month of November so far. I know that's not a huge accomplishment, but it is for me. It took changing my thinking just slightly to conquer it.  Now, I tell myself purging isn't an option RIGHT before I start eating. And I tell myself AS I'm eating. And the most important thing I tell myself is: I have permission to eat and I have permission to make mistakes.  I have to repeat it to myself a lot, but it's worth it.",False,False
e9zem3v,t3_9y869y,t3_9y869y,RachAgainstLeMachine,1,2018-11-18 12:30:45,/r/EDAnonymous/comments/9y869y/how_do_you_fight_against_black_and_white_thinking/e9zem3v/,"I saw this analogy somewhere and it’s helped me a lot: if you have one flat tire, why would you slash the rest?   In other words, 1900 still isn’t bad. Yeah, it’s more than usual, but it’s not terrible. And dealing with a 700 calorie surplus is way more manageable than dealing with a 3000+ calorie surplus! Just like dealing with 1 flat tire is much easier to manage than 4 flats!",False,False
