Comment ID,Link ID,Parent ID,Author,Score,Publish Date,Permalink,Text,Stickied,Is Submitter
f6l33ag,t3_drlmbk,t1_f6kkz89,lioneyssy,1,2019-11-04 22:19:08,/r/EDAnonymous/comments/drlmbk/dae_get_this_sudden_kick_of_motivation/f6l33ag/,Oh god lol I’ve never considered it lmao I really need to go to psychiatrist sometimes hahaha,False,True
f6kmncv,t3_drlmbk,t3_drlmbk,drinksriracha,1,2019-11-04 18:57:14,/r/EDAnonymous/comments/drlmbk/dae_get_this_sudden_kick_of_motivation/f6kmncv/,Dude yes. I'll be in full binge mode for months and then wake up one random day like a restriction goddess with the willpower of the world at her fingertips.,False,False
f6kkz89,t3_drlmbk,t3_drlmbk,r3sistcarnism,1,2019-11-04 18:36:54,/r/EDAnonymous/comments/drlmbk/dae_get_this_sudden_kick_of_motivation/f6kkz89/,Sounds a bit like mania lol. Are you bipolar too?,False,False
f6kkfqg,t3_drlmbk,t3_drlmbk,hammerprice,1,2019-11-04 18:31:36,/r/EDAnonymous/comments/drlmbk/dae_get_this_sudden_kick_of_motivation/f6kkfqg/,"Sometimes it's a wave of ""motivation"" but other times it's like... I'll be in the middle of a 2-month-long binge where I'm spending and eating like I'm going to die (lol) and then I wake up one morning with like. Zero interest in food. Like I'm not put off by it but it's like all my binge instincts are finally gone. Now, if I'm still mentally messed up I can totally force myself to binge anyway and rip start Binge 2.0, but if I'm doing a little bit better, I can use that momentum to get back into calorie-tracking and maintenance. And like you and the other poster said it's like a switch being flipped and I have NO control over it lmao. All I can do is try and ride it while it lasts!!",False,False
f6kdu9u,t3_drlmbk,t1_f6jtgvm,throwaway00501,1,2019-11-04 17:38:38,/r/EDAnonymous/comments/drlmbk/dae_get_this_sudden_kick_of_motivation/f6kdu9u/,I just watch sailor moon for like a week and then I’m back on my shit.,False,False
f6k292v,t3_drlmbk,t3_drlmbk,nxhshchskbxn,1,2019-11-04 15:43:04,/r/EDAnonymous/comments/drlmbk/dae_get_this_sudden_kick_of_motivation/f6k292v/,gotta love those ednos mood swings!!!,False,False
f6jtgvm,t3_drlmbk,t3_drlmbk,thatchedrooves,1,2019-11-04 14:39:26,/r/EDAnonymous/comments/drlmbk/dae_get_this_sudden_kick_of_motivation/f6jtgvm/,literally it’s like a switch flips in my brain and it becomes so easy but i never know how to do it on purpose,False,False
