Comment ID,Link ID,Parent ID,Author,Score,Publish Date,Permalink,Text,Stickied,Is Submitter
erjmcl8,t3_c2cn8n,t3_c2cn8n,rotting_the_crown,1,2019-06-19 04:42:34,/r/EDAnonymous/comments/c2cn8n/iae_romanticizing_a_restriction_period_you_had/erjmcl8/,"Omg yes. I keep mournfully looking at the 3 pics I took when I was at my lowest (I felt sooo skinny and beautiful) and really it’s only like 9 lb away but even now looking at those pics I’m like hmm I could probably lose 10 lb ofdbod that. So I guess I’m 19 lb away 😂 but seriously I was batshit crazy (severe mixed bipolar episode) but like I want to get back to that point so I can have some control in my life? Like wtf. I was doing really good in January restricting but it went downhill (graph: 📈)  but now I’m getting crazy stressed out and depressed so I’m ridiculously hoping that I’ll somehow get back to that point, without the absolute batshit crazy part.",False,False
erjlw6f,t3_c2cn8n,t3_c2cn8n,transedthrowaway,1,2019-06-19 04:30:53,/r/EDAnonymous/comments/c2cn8n/iae_romanticizing_a_restriction_period_you_had/erjlw6f/,Aaabsolutely. I restricted a ton a couple of years ago and lost like 20 lbs in 1 week and I desperately wish I could do that again but no matter what it doesn't work out. :( idk what's so different about then and now but it's super annoying lmfao,False,False
erjl8ez,t3_c2cn8n,t3_c2cn8n,yinneo,1,2019-06-19 04:13:36,/r/EDAnonymous/comments/c2cn8n/iae_romanticizing_a_restriction_period_you_had/erjl8ez/,holy shit yea. it's eerie as fuck to see we all struggle with the exact same things.,False,False
erjkn16,t3_c2cn8n,t3_c2cn8n,colderbytheminute,1,2019-06-19 03:57:50,/r/EDAnonymous/comments/c2cn8n/iae_romanticizing_a_restriction_period_you_had/erjkn16/,Oof yes. Used to restrict easily then I ended up in an ugly binge-restrict cycle (which I'm still trying to get out of now),False,False
erjk2iv,t3_c2cn8n,t3_c2cn8n,floweredfox,1,2019-06-19 03:42:46,/r/EDAnonymous/comments/c2cn8n/iae_romanticizing_a_restriction_period_you_had/erjk2iv/,"God yeah, in my senior year of high school I lost a ton of weight. Probably averaged under 500cals a day. Between classes and having a job where I was on my feet all shift I really didn't eat much besides a bit of a wrap at school and a small dinner on nights I didn't work. I just have too much downtime to boredom eat/binge now. And I go out drinking pretty often. I'm desperate to reach that weight again.",False,False
erjinhr,t3_c2cn8n,t3_c2cn8n,celinat0r,1,2019-06-19 03:05:42,/r/EDAnonymous/comments/c2cn8n/iae_romanticizing_a_restriction_period_you_had/erjinhr/,i couldve written this :-( best wishes to u op,False,False
erjhue5,t3_c2cn8n,t3_c2cn8n,Rustlingjimmies87,1,2019-06-19 02:45:25,/r/EDAnonymous/comments/c2cn8n/iae_romanticizing_a_restriction_period_you_had/erjhue5/,"Dropped 30 lbs last year by eating 600 cals a day, basically did a zucchini and Walden farms mono, then bounced back up to where I started due to getting cocky about being skinny. Now I’m back on that 600 cal zucchini WF life and have stayed around the same 3 lb fluctuations. Fml. Adding a new game changer in the mix... a detox so I can see the number change. 🙄🙄🙄",False,False
erjhhxw,t3_c2cn8n,t3_c2cn8n,dmmge,1,2019-06-19 02:37:00,/r/EDAnonymous/comments/c2cn8n/iae_romanticizing_a_restriction_period_you_had/erjhhxw/,All day every day :) :) :),False,False
erjflas,t3_c2cn8n,t3_c2cn8n,linedryonly,1,2019-06-19 01:53:26,/r/EDAnonymous/comments/c2cn8n/iae_romanticizing_a_restriction_period_you_had/erjflas/,Only every day of my life🙃,False,False
erjfjnr,t3_c2cn8n,t3_c2cn8n,taoshka,1,2019-06-19 01:52:26,/r/EDAnonymous/comments/c2cn8n/iae_romanticizing_a_restriction_period_you_had/erjfjnr/,Oof to the max :/,False,False
erjfg7l,t3_c2cn8n,t3_c2cn8n,ppid,1,2019-06-19 01:50:23,/r/EDAnonymous/comments/c2cn8n/iae_romanticizing_a_restriction_period_you_had/erjfg7l/,"I asked this because I want to stop having an ED, but also lose weight.  Restriction just isn't working for me, and my mental health from nonstop binging has really ruined my life for the last few years.  I'm trying to work up the courage to follow treatment guidelines. I'm in the limbo, hoping that one day it will click and I'll just be able to restrict to a GW like I did at 16 and again at 23..... I don't think it'll happen again for me. I think I've been hoping for that magical restriction streak for many years and it's not gonna happen, so might as well recover instead.  Who knows maybe recovery will be the best outcome for me, even if it doesn't mean losing the weight I want to. Idk, but I'm really drained from getting nowhere in life. I want my life back.",False,True
erjezn6,t3_c2cn8n,t3_c2cn8n,PM_ME_BrusselSprouts,1,2019-06-19 01:40:31,/r/EDAnonymous/comments/c2cn8n/iae_romanticizing_a_restriction_period_you_had/erjezn6/,Literally me every day.,False,False
erjd8fe,t3_c2cn8n,t3_c2cn8n,orryvsworld,1,2019-06-19 01:04:46,/r/EDAnonymous/comments/c2cn8n/iae_romanticizing_a_restriction_period_you_had/erjd8fe/,"right?? like i used to be so able to just not eat, and suddenly a switch flipped and now it’s hard to not eat EVERYTHING. it’s so frustrating.",False,False
erjd7mp,t3_c2cn8n,t3_c2cn8n,piizza,1,2019-06-19 01:04:20,/r/EDAnonymous/comments/c2cn8n/iae_romanticizing_a_restriction_period_you_had/erjd7mp/,That’s been me for the past several weeks fml,False,False
erjc1th,t3_c2cn8n,t3_c2cn8n,thinknv,1,2019-06-19 00:42:21,/r/EDAnonymous/comments/c2cn8n/iae_romanticizing_a_restriction_period_you_had/erjc1th/,"Hell yeah I feel too called out right now,,,",False,False
erjadn6,t3_c2cn8n,t3_c2cn8n,sickcupcake,1,2019-06-19 00:11:21,/r/EDAnonymous/comments/c2cn8n/iae_romanticizing_a_restriction_period_you_had/erjadn6/,can someone explain what the fuck happened for us to lose our magical resisting powers?,False,False
erj9dcw,t3_c2cn8n,t3_c2cn8n,lameanonymous,1,2019-06-18 23:53:47,/r/EDAnonymous/comments/c2cn8n/iae_romanticizing_a_restriction_period_you_had/erj9dcw/,yeah :( struggling so hard to lose weight like I used to it makes me so disappointed,False,False
erj8szb,t3_c2cn8n,t3_c2cn8n,leptictidium00,1,2019-06-18 23:44:11,/r/EDAnonymous/comments/c2cn8n/iae_romanticizing_a_restriction_period_you_had/erj8szb/,yup!!!! College days of restricting 800 or under and consistently losing. I also never ever dealt with binges. Now every day is a battle to not binge and gain.,False,False
