Comment ID,Link ID,Parent ID,Author,Score,Publish Date,Permalink,Text,Stickied,Is Submitter
ffsxwz3,t3_euwcbv,t1_ffspl8g,smi-ad,1,2020-01-28 01:38:19,/r/EDAnonymous/comments/euwcbv/vent_query/ffsxwz3/,thabk you so much for this comment :'),False,True
ffspl8g,t3_euwcbv,t3_euwcbv,tamarindsicle,1,2020-01-27 23:08:02,/r/EDAnonymous/comments/euwcbv/vent_query/ffspl8g/,"No I don’t think the disorder ever goes away, but I think it can get much, much better. It’s weird but I watched an older relative of mine struggle from her teens into her forties with it.   While sometimes it seems like she struggles, she only gets healthier and more settled in who she is and that seems to help. Getting older isn’t a cure-all, but it does give you time to figure out what works for you and what makes you tick and what YOU need to feel okay eating.   So if that means you don’t eat in front of people much (or ever) because it makes you upset? That’s okay. If eating is a private act to you and is only shared with people you love? That’s okay, too.   I really lucked out in a sense. Watching her made me realize that it won’t be perfect or fixed probably ever, but that it can be managed, sometimes badly but sometimes very very gracefully, just like any other illness. It doesn’t define you. It’s not who you are. It’s just an aspect of yourself you’ll need to get to know better in order to keep yourself safe.",False,False
ffs63bn,t3_euwcbv,t1_ffrz06b,possumgal,1,2020-01-27 19:14:17,/r/EDAnonymous/comments/euwcbv/vent_query/ffs63bn/,That is the worst feeling ever. Then scrambling to find the second best safe option in front of everyone. Aughhh,False,False
ffs0i2t,t3_euwcbv,t3_euwcbv,sintos-compa,1,2020-01-27 18:09:21,/r/EDAnonymous/comments/euwcbv/vent_query/ffs0i2t/,"my brain is weird like, i'll binge during the weekend. then around monday noon, it will be like ""i'm cured now, you can buy anything in the store, don't worry""",False,False
ffrz06b,t3_euwcbv,t1_ffryv2v,smi-ad,1,2020-01-27 17:52:28,/r/EDAnonymous/comments/euwcbv/vent_query/ffrz06b/,"I learned after going out this weekend that I need to research menus online beforehand, the thing I picked after 10 minutes the waiter told me they didnt have and I genuinely could have cried :(",False,True
ffryv2v,t3_euwcbv,t3_euwcbv,possumgal,1,2020-01-27 17:50:51,/r/EDAnonymous/comments/euwcbv/vent_query/ffryv2v/,"I panic about eating around new people too. The first time i went out to lunch with my work group i was upset for about a week ahead of it. It was hard to hide that my hands were shaking pretty bad and i kept almost choking lol. I dont eat meat, and for some reason that embarasses me terribly. So of course my team found out about my veg diet and cracked jokes 😭. They meant it in a light hearted way but im soo sensitive. I know where your coming from. You arent alone !!",False,False
