Comment ID,Link ID,Parent ID,Author,Score,Publish Date,Permalink,Text,Stickied,Is Submitter
f6kroc9,t3_drjn6o,t1_f6kc91s,blahpunchlineblah,1,2019-11-04 19:57:27,/r/EDAnonymous/comments/drjn6o/how_many_sets_are_your_weightlifting_workouts/f6kroc9/,Of course!,False,False
f6kc91s,t3_drjn6o,t1_f6kbtzn,Duskyroses,1,2019-11-04 17:25:34,/r/EDAnonymous/comments/drjn6o/how_many_sets_are_your_weightlifting_workouts/f6kc91s/,Thanks for the details!,False,True
f6kbtzn,t3_drjn6o,t1_f6k31uv,blahpunchlineblah,1,2019-11-04 17:21:14,/r/EDAnonymous/comments/drjn6o/how_many_sets_are_your_weightlifting_workouts/f6kbtzn/,"About 30 minutes. I am at a small local gym, so there isn't wait time for machines/weights, which helps. Sometimes I'll just do machines, sometimes free weights, or follow a fitness YouTube workout (Blogalaties has great muscle isolates). I just make sure to follow my rotation of groups, abs, arms/shoulders, legs, and back. If I do an extra day I'll do cardio and a long stretch routine.",False,False
f6k31uv,t3_drjn6o,t1_f6jmj8j,Duskyroses,1,2019-11-04 15:48:55,/r/EDAnonymous/comments/drjn6o/how_many_sets_are_your_weightlifting_workouts/f6k31uv/,How long does the weight lifting take you?,False,True
f6jsd2t,t3_drjn6o,t1_f6jjxl9,deskmonstir,1,2019-11-04 14:31:32,/r/EDAnonymous/comments/drjn6o/how_many_sets_are_your_weightlifting_workouts/f6jsd2t/,You’re welcome! I’m glad I could help! 😁,False,False
f6jmj8j,t3_drjn6o,t1_f6jk12c,blahpunchlineblah,1,2019-11-04 13:49:39,/r/EDAnonymous/comments/drjn6o/how_many_sets_are_your_weightlifting_workouts/f6jmj8j/,"Usually 4, sometimes 5 if I am not busy on the weekend.",False,False
f6jk12c,t3_drjn6o,t1_f6jeked,Duskyroses,1,2019-11-04 13:31:18,/r/EDAnonymous/comments/drjn6o/how_many_sets_are_your_weightlifting_workouts/f6jk12c/,Thank you for your comment!  How many days do you workout per week?,False,True
f6jjxl9,t3_drjn6o,t1_f6jc6qu,Duskyroses,1,2019-11-04 13:30:37,/r/EDAnonymous/comments/drjn6o/how_many_sets_are_your_weightlifting_workouts/f6jjxl9/,"Thank you! This was brilliantly insightful and also I did some research into hamstrings vs. quads after you brought it up and might actually change some things around that, thanks!!",False,True
f6jjv7l,t3_drjn6o,t1_f6jc6qu,Duskyroses,1,2019-11-04 13:30:10,/r/EDAnonymous/comments/drjn6o/how_many_sets_are_your_weightlifting_workouts/f6jjv7l/,"Thank you! This was brilliantly insightful and also I did some research into hamstrings vs. quads after you brought it up and might actually change some things around that, thanks!!",False,True
f6jeked,t3_drjn6o,t3_drjn6o,blahpunchlineblah,1,2019-11-04 12:51:40,/r/EDAnonymous/comments/drjn6o/how_many_sets_are_your_weightlifting_workouts/f6jeked/,"I usually do 3 sets of 10. First set at a ""warmup"" weight, and then increasing each set. By the end of my third set I am struggling, so if I only get 8 in I'm okay with it.   I usually do 30ish minutes of cardio to start then an isolated muscle group each day.",False,False
f6jc6qu,t3_drjn6o,t1_f6j2usf,deskmonstir,1,2019-11-04 12:34:01,/r/EDAnonymous/comments/drjn6o/how_many_sets_are_your_weightlifting_workouts/f6jc6qu/,"No problem! It would usually take me 1.5 to 2 hours to get through everything, depending on how many people talked to me. I typically rest 3 min between my main heavy lifts (bench, squat, deadlift) and 30-60 sec between accessory lifts. One good way to keep yourself moving and get stuff done faster is supersets. I think the best way is to pair exercises for different/opposing muscle groups, e.g. bicep curls &amp; tricep kickbacks or RDLs &amp; goblet squats. I usually wear a basic sports watch that shows the time with seconds, so I just take note of the time after a set/superset to know when I need to start the next one.  I will say that I did very high volume strength workouts. They’re not for everyone, especially if you’re fairly new to lifting, and you can definitely build muscle doing less than that. The main keys when it comes to building muscle are compound exercises using proper form, progressive overload, consistency, and sufficient/surplus calorie and protein intake.",False,False
f6j2usf,t3_drjn6o,t1_f6iw95v,Duskyroses,1,2019-11-04 11:25:06,/r/EDAnonymous/comments/drjn6o/how_many_sets_are_your_weightlifting_workouts/f6j2usf/,Thanks for your input! How long would your sets take you? Sounds like you had even more than me but my problem is I take so long. I don’t feel I rest too much it just ends up taking forever. I want to reduce to maybe 3 exercises per body part if that would still help me gain a bit of muscle.   And I just call it glute day because I have a bit more emphasis with thrust exercises. As for delts and triceps I put those in my bicep day :),False,True
f6iw95v,t3_drjn6o,t3_drjn6o,deskmonstir,1,2019-11-04 10:35:49,/r/EDAnonymous/comments/drjn6o/how_many_sets_are_your_weightlifting_workouts/f6iw95v/,"When I was fully dedicating my time to lifting (now I do CrossFit with a bit of bodybuilding), I would typically do 3 to 4 sets each of 7 to 11 exercises. My leg days contained fewer exercises than upper days because leg days contained more compound exercises, making the workout more taxing.   One comment on your current split: you’re going to be hitting your glutes with almost any movement, unless you’re just doing leg extension/curl machines. I’d do a quad/hammie split instead. If you really want, you could throw in a little glute isolation both days if building your booty is most important to you.",False,False
