Comment ID,Link ID,Parent ID,Author,Score,Publish Date,Permalink,Text,Stickied,Is Submitter
fffuy5e,t3_eta1dk,t1_fffesqz,beyondhopeful,1,2020-01-24 12:59:11,/r/EDAnonymous/comments/eta1dk/my_second_day_of_eating_intuitively/fffuy5e/,You just have to cut the cord loose. Take a screenshot if you need to of your streak. It’ll be hard but you just gotta rip that bandaid off and go a day without using it!!,False,False
fffs83z,t3_eta1dk,t3_eta1dk,sadgorlthrowwaway,1,2020-01-24 12:31:05,/r/EDAnonymous/comments/eta1dk/my_second_day_of_eating_intuitively/fffs83z/,GOALS. This post gave me so much hope. I’m fighting the worst fight right now with this disorder and I’m so scared. Thank you for sharing.,False,False
fffesqz,t3_eta1dk,t3_eta1dk,sadrgnoises,1,2020-01-24 10:13:15,/r/EDAnonymous/comments/eta1dk/my_second_day_of_eating_intuitively/fffesqz/,"This is awesome, I am so glad you took this step! You can do this.  The MFP point really hits home. I have a 996 day streak... and it's like, but if you stop you lose the streak... urgh. But at the end of the day all the streak is is a stupid counter, so why should it matter?  This post may have just given me some courage to end my MFP streak, too. Best of luck to you :-)",False,False
fffcww3,t3_eta1dk,t3_eta1dk,zucchinipie,1,2020-01-24 09:53:15,/r/EDAnonymous/comments/eta1dk/my_second_day_of_eating_intuitively/fffcww3/,proud of you!! this is a great step towards recovery and taking control away from your disorder. you got this!! &lt;3,False,False
fff0k68,t3_eta1dk,t3_eta1dk,cafeconmilk,1,2020-01-24 07:25:20,/r/EDAnonymous/comments/eta1dk/my_second_day_of_eating_intuitively/fff0k68/,"this is a really big step, congratulations!",False,False
