Comment ID,Link ID,Parent ID,Author,Score,Publish Date,Permalink,Text,Stickied,Is Submitter
fg1fdnq,t3_ew8lsk,t1_fg1eb4i,fluentsyntax,1,2020-01-30 17:15:12,/r/EDAnonymous/comments/ew8lsk/i_just_realised_my_eating_disorder_stems_from/fg1fdnq/,"ah, i’m sorry you had to go through all that! hope you’re doing better. 💜 and that’s what i meant when i said that i understand that certain health issues may get in the way of weight loss, but people take that reasoning and use it as an excuse to not do anything about it, making them bitter and unhappy. i’ve been on enough diet subs to know that older people with problems can lose just as much weight as anyone younger than them.  it’s in the progress pics. lmao",False,False
fg1eb4i,t3_ew8lsk,t1_fg1d7uw,TheShortGerman,2,2020-01-30 17:06:12,/r/EDAnonymous/comments/ew8lsk/i_just_realised_my_eating_disorder_stems_from/fg1eb4i/,"I mean if we wanna talk health and excuses, I have hypothyroidism and from ages 17-19 was on all the psych drugs most notorious for weight gain (mood stabilizers and anti-psychotics). My last anorexia relapse was literally when I was still on those meds and I lost tons of weight.  But funny those don't seem to matter when someone says I'm genetically thin and clearly don't have to try because I'm young.... but their self-diagnosed ""thyroid issue"" is why they're 300 lbs. Like tell me your most recent TSH and T4 please, or shut up.   None of this directed at you btw, this just makes me irrationally angry. People dismissing my hard work in the gym/on my diet enrages me, and people self diagnosing thyroid problems is super frustrating. Like, girl, you don't have a thyroid issue just because you struggle to lose weight, there's a lot more to it than that. I lost almost all my hair, developed cystic acne, and was exhausted 24/7 before my hypo diagnosis, but they never wanna talk about the other side effects.",False,False
fg1d7uw,t3_ew8lsk,t1_fg14xne,fluentsyntax,2,2020-01-30 16:57:27,/r/EDAnonymous/comments/ew8lsk/i_just_realised_my_eating_disorder_stems_from/fg1d7uw/,"this is it for the most part. a lot of people gain weight because they stop giving a fuck and they make excuses for themselves. i’ve been guilty of this too. i know that other factors like health and illness come into play, but let’s be honest. mid thirties are when people start settling down into their lazy lifestyles because of complacency and children. i understand that life gets in the way, but there are a ton of healthy and fit older people who keep their health in check and look great. these women are telling you this because they’re jealous/threatened of your figure and they want to make themselves feel better about letting their own bodies go to shit. like, i’m almost 29 and i’m at my 19year old weight right now lmao. ugh, i’m pmsing.  edit: i don’t have any kids, but i hear post partum depression can be a bitch, just like any depression. it’s easy to fall into bad habits, i get it and i struggle w it too, but don’t comment on other people’s bodies and spread false info to make yourself feel better. not you, them lol.",False,False
fg1c7ou,t3_ew8lsk,t3_ew8lsk,fluentsyntax,1,2020-01-30 16:49:12,/r/EDAnonymous/comments/ew8lsk/i_just_realised_my_eating_disorder_stems_from/fg1c7ou/,"this is how i relapsed. i gained a bunch of weight in my mid twenties and now as i approach 29, i’m my slender self again and most people guess that i’m in my early twenties. it’s kind of unnerving , but also rewarding to see everyone else my age gain more weight than me, especially the hipper than thou people from my past. i have my own flaws, so this keeps my self esteem at least kind of functional. .. oh who am i kidding, my mind is problematic as hell.",False,False
fg18b20,t3_ew8lsk,t3_ew8lsk,cyclecycleaddict,1,2020-01-30 16:17:15,/r/EDAnonymous/comments/ew8lsk/i_just_realised_my_eating_disorder_stems_from/fg18b20/,I'm thinner at 36 + 2 kids than I was in my early 20s and I've always been thin.,False,False
fg14xne,t3_ew8lsk,t3_ew8lsk,TheShortGerman,3,2020-01-30 15:47:05,/r/EDAnonymous/comments/ew8lsk/i_just_realised_my_eating_disorder_stems_from/fg14xne/,"Cue EVERY SINGLE WOMAN OVER 30 saying ""oh honey, I was skinny like you once too, enjoy it while it lasts, you'll get fat when you're older/once you have a kid/etc""  it's so fucking condescending and literally not true. weight gain happens in pregnancy but if you don't gain a fuck ton and stick to what's recommended then you can easily lose it in the 3-6 months postpartum  metabolisms don't magically \*slow\* you just burn less because you're more sedentary and your muscle mass goes down  oh and also you eat too much, Brenda, get the fuck out of my face, your jealousy is showing  also I literally do not believe them anymore when they say they used to be ""skinny like me"" either, every single woman didn't weigh 100 lbs soaking wet in her 20s. They were all probably a normal weight and are looking at the past with rose colored lenses.",False,False
fg0y50p,t3_ew8lsk,t1_fg0csoe,cornycorncorny,1,2020-01-30 14:48:40,/r/EDAnonymous/comments/ew8lsk/i_just_realised_my_eating_disorder_stems_from/fg0y50p/,"Same! Except for junior year for me, then I lost my cycle, still don't have it, and afraid I have to constantly gain weight because my mom keeps trying to force feed me more than I need. I already gained 8 lbs over a month and it's more than I am supposed to, but my mom keeps telling me I still need to gain :( I'm afraid she'll make me obese and I'll gain even more in college",False,False
fg0t0ll,t3_ew8lsk,t1_fg0csoe,_yeeza_,1,2020-01-30 14:00:35,/r/EDAnonymous/comments/ew8lsk/i_just_realised_my_eating_disorder_stems_from/fg0t0ll/,freshman 15?? well it seems I'm certain going backwards... mega oof moment right here-,False,False
fg0q0u0,t3_ew8lsk,t1_fg0nxld,pokeupokeu,1,2020-01-30 13:32:53,/r/EDAnonymous/comments/ew8lsk/i_just_realised_my_eating_disorder_stems_from/fg0q0u0/,GOD theres a woman at my job like this who always says to enjoy being thin while it lasts like!!!! No!!!! Absolutely no way will i allow this to happen and then i go home and exercise until i cant feel my muscles,False,False
fg0ptns,t3_ew8lsk,t3_ew8lsk,pokeupokeu,1,2020-01-30 13:31:04,/r/EDAnonymous/comments/ew8lsk/i_just_realised_my_eating_disorder_stems_from/fg0ptns/,Oh same my mom always tells me i have her figure when she was younger but then i hear her and my aunts complain of how your metabolism slows down and you gain weight as you age? Terrifying.  Ive got it in my head that if i can be a skinny 50 year old im fine with aging. All the older female super skinnys on supersize vs superskinny always looks so good to me. I want a flat tummy after having 3 kids wtf,False,False
fg0prz3,t3_ew8lsk,t3_ew8lsk,ijustreallymissmydog,1,2020-01-30 13:30:37,/r/EDAnonymous/comments/ew8lsk/i_just_realised_my_eating_disorder_stems_from/fg0prz3/,"wowowow i feel this!!! especially because obesity has run in my family. my sister has the same fear of gaining weight like our family members and has also developed an ed. whenever i see an older woman who is fit and healthy, it gives me hope :)",False,False
fg0phr2,t3_ew8lsk,t1_fg0n22e,lokiidokii,1,2020-01-30 13:28:00,/r/EDAnonymous/comments/ew8lsk/i_just_realised_my_eating_disorder_stems_from/fg0phr2/,"Same with wanting to be skinny into old age. All of the older (50-60+) women I admire at my dance/fitness studio are tall and quite slender. If they dyed their long white/grey locks, you'd seriously think they were only in their mid/late 30s at most.   I feel like a lot of the tendency to accept weight gain, esp for women, is a lack of care. It's not necessary that they don't care in general, they just have babies and turn all their attention to their children rather than themselves. I'm in my late 20s but I see a lot of women my age doing this. They're unaware of their weight gain because they're too busy making/taking care of kiddos. For men, it seems like a lot of them settle down and start taking desk jobs. They stop playing sports and being as active and it's their inactivity and relationship complacency that leads to weight gain. I've noticed a lot of the hetero older gentlemen that are slim/fit/extra conscious of their appearance are usually ones that are out of their 1st/2nd marriages or the immature ones that can't be bothered to settle down and would rather focus on sleeping around with younger women and spending money on sports cars.",False,False
fg0nxld,t3_ew8lsk,t3_ew8lsk,bluediner,1,2020-01-30 13:13:31,/r/EDAnonymous/comments/ew8lsk/i_just_realised_my_eating_disorder_stems_from/fg0nxld/,"I definitely feel this. Every time I go to a family event its basically just different (women, mostly!! which makes it so much worse!!) telling me how I better ""enjoy my figure now"" because I'm gonna gain weight whether I like it or not. It's SO fucking triggering",False,False
fg0n22e,t3_ew8lsk,t3_ew8lsk,MissLovelorn,1,2020-01-30 13:04:55,/r/EDAnonymous/comments/ew8lsk/i_just_realised_my_eating_disorder_stems_from/fg0n22e/,It seems like us Americans have accepted that gaining a ton of weight in your thirties and forties is normal or even healthy... I'm only 24 but my life goal is to be so skinny that nobody will believe my age when I turn 40 lmao,False,False
fg0csoe,t3_ew8lsk,t3_ew8lsk,potentialperfection,1,2020-01-30 11:24:42,/r/EDAnonymous/comments/ew8lsk/i_just_realised_my_eating_disorder_stems_from/fg0csoe/,I didnt hear about the freshman 15 until I was a sophomore in HS and I remember laughing because my ED went full blown when I was a fresh man and I wound up losing 15 lbs instead of gaining. The same thing happened in college.,False,False
