Comment ID,Link ID,Parent ID,Author,Score,Publish Date,Permalink,Text,Stickied,Is Submitter
fc4h2de,t3_efziw5,t3_efziw5,floppykitty,1,2019-12-26 21:14:07,/r/EDAnonymous/comments/efziw5/cried_and_threw_a_tantrum_because_the_restaurant/fc4h2de/,Omg this happened to me today with my Starbucks today when my husband and brought me to Starbucks I sat in the car and had a mental break down and cried,False,False
fc4gpcx,t3_efziw5,t1_fc3ostd,evenifitmakesmeblue,1,2019-12-26 21:09:09,/r/EDAnonymous/comments/efziw5/cried_and_threw_a_tantrum_because_the_restaurant/fc4gpcx/,"I have had my meals stolen from delivery guys before too!! Thanks, Brazil :|",False,False
fc3stjs,t3_efziw5,t1_fc3ssum,colazerocultleader,1,2019-12-26 16:02:11,/r/EDAnonymous/comments/efziw5/cried_and_threw_a_tantrum_because_the_restaurant/fc3stjs/,thank you good bot,False,False
fc3ssum,t3_efziw5,t1_fc3ssr9,smile-bot-2019,1,2019-12-26 16:01:55,/r/EDAnonymous/comments/efziw5/cried_and_threw_a_tantrum_because_the_restaurant/fc3ssum/,I noticed one of these... :(      So here take this... :D,False,False
fc3ssr9,t3_efziw5,t1_fc3ostd,colazerocultleader,1,2019-12-26 16:01:54,/r/EDAnonymous/comments/efziw5/cried_and_threw_a_tantrum_because_the_restaurant/fc3ssr9/,oh I see that makes sense :(   what the hell? I'm so sorry to hear all this. pretty infuriating,False,False
fc3oy9l,t3_efziw5,t1_fc3lg39,cupcakelimao,1,2019-12-26 15:16:29,/r/EDAnonymous/comments/efziw5/cried_and_threw_a_tantrum_because_the_restaurant/fc3oy9l/,"This was many weeks ago. Never ordered anything again. Now if there's nothing to eat, well, I use it as an excuse to not eat 🙃",False,True
fc3ostd,t3_efziw5,t1_fc3gcmu,cupcakelimao,1,2019-12-26 15:14:41,/r/EDAnonymous/comments/efziw5/cried_and_threw_a_tantrum_because_the_restaurant/fc3ostd/,"Oh, because it's Brazil 🇧🇷  The delivery guy is from an app. If he went back to get the right soda and return it would be on him (he would spend the gas and the time to correct the restaurant's mistake: he wouldn't do that).  And even if I trusted him to take back the regular coke and bring back the zero, well, he probably wouldn't.  There are delivery guys here STEALING PEOPLE'S MEALS.",False,True
fc3lg39,t3_efziw5,t3_efziw5,bongshelter,1,2019-12-26 14:34:44,/r/EDAnonymous/comments/efziw5/cried_and_threw_a_tantrum_because_the_restaurant/fc3lg39/,I would at least expect a refund for the drink.  Posts like this kind of make me happy that my anxiety won't let me order food delivery.,False,False
fc3gcmu,t3_efziw5,t3_efziw5,colazerocultleader,1,2019-12-26 13:39:50,/r/EDAnonymous/comments/efziw5/cried_and_threw_a_tantrum_because_the_restaurant/fc3gcmu/,why the hell wouldn't he return it? if this was his fault then he should make it right,False,False
fc3fg1j,t3_efziw5,t3_efziw5,applecinnamonnn,1,2019-12-26 13:30:20,/r/EDAnonymous/comments/efziw5/cried_and_threw_a_tantrum_because_the_restaurant/fc3fg1j/,I would’ve reacted the same exact way. Don’t feel weird,False,False
