Comment ID,Link ID,Parent ID,Author,Score,Publish Date,Permalink,Text,Stickied,Is Submitter
f5ufen8,t3_dkbyo5,t1_f4ddpx1,coconuthead00,1,2019-10-30 16:53:57,/r/EDAnonymous/comments/dkbyo5/is_anyone_else_premed_here/f5ufen8/,I’m so sorry :/// EDs just suck ass honestly,False,True
f5ufbi9,t3_dkbyo5,t1_f4co7fx,coconuthead00,1,2019-10-30 16:53:26,/r/EDAnonymous/comments/dkbyo5/is_anyone_else_premed_here/f5ufbi9/,"Omg I’m neuroscience too!! Definitely relate- my ED just takes so much out of me that it’s crazy. Thank you so much, and likewise- my dms are always open &lt;3",False,True
f5uf4rw,t3_dkbyo5,t1_f4gvgen,coconuthead00,1,2019-10-30 16:52:14,/r/EDAnonymous/comments/dkbyo5/is_anyone_else_premed_here/f5uf4rw/,I did that last year- and unfortunately can’t have two in a row or my medical school chances will be about as good as gone :/// I really really wish I could- it seems to be getting worse if anything. I really appreciate your reply though- thank you &lt;3,False,True
f5uewf2,t3_dkbyo5,t1_f4j4ukt,coconuthead00,1,2019-10-30 16:50:44,/r/EDAnonymous/comments/dkbyo5/is_anyone_else_premed_here/f5uewf2/,I’m so sorry- me too. Honestly even questioning if I should be at this point :// sending love!!,False,True
f4j4ukt,t3_dkbyo5,t3_dkbyo5,normalsizedsnail,1,2019-10-20 18:12:44,/r/EDAnonymous/comments/dkbyo5/is_anyone_else_premed_here/f4j4ukt/,Hey I am a premed too and I am failing hard at life!,False,False
f4gvgen,t3_dkbyo5,t3_dkbyo5,absent-dream,1,2019-10-20 10:28:32,/r/EDAnonymous/comments/dkbyo5/is_anyone_else_premed_here/f4gvgen/,"Have you considered doing a medical withdrawal and focusing on treatment? That way when you return to college, you won't have the ED messing up your grades &amp; ECs and will have a better shot at med school.",False,False
f4ddpx1,t3_dkbyo5,t3_dkbyo5,aimerix,1,2019-10-19 22:13:50,/r/EDAnonymous/comments/dkbyo5/is_anyone_else_premed_here/f4ddpx1/,premed failing at life here too ☹️,False,False
f4co7fx,t3_dkbyo5,t3_dkbyo5,atla302,1,2019-10-19 19:35:52,/r/EDAnonymous/comments/dkbyo5/is_anyone_else_premed_here/f4co7fx/,"hi lol I’m a neuroscience major trying to be premed but failing miserably. I’ve been thinking about how getting into medical school is a HUgE amount of work for a “normal” person...so add in the emotional physical and mental toll of an ED....well, you already know. Just know I feel your pain and if you ever want to talk, pm me!",False,False
