Comment ID,Link ID,Parent ID,Author,Score,Publish Date,Permalink,Text,Stickied,Is Submitter
elbce18,t3_bbix7a,t3_bbix7a,crazeecatladee,1,2019-04-19 20:42:40,/r/EDAnonymous/comments/bbix7a/i_wish_the_rproed_page_still_exist/elbce18/,I just came back to Reddit after a year long break and found out it’s gone :( That was my safe place. Feeling more isolated than ever now.,False,False
ekm0nun,t3_bbix7a,t3_bbix7a,RichardStarrkey,1,2019-04-11 01:49:28,/r/EDAnonymous/comments/bbix7a/i_wish_the_rproed_page_still_exist/ekm0nun/,PSSSTTTT  https://goutiest-zorse-5012.dataplicity.io  PROED ARCHIVE,False,False
eklnmbf,t3_bbix7a,t3_bbix7a,happybumblebree,1,2019-04-10 21:40:44,/r/EDAnonymous/comments/bbix7a/i_wish_the_rproed_page_still_exist/eklnmbf/,"yes dude. i was SO active on the other sub. since it got deleted, i'm super hesitant to invest in this one. i know it's still all the same users, i just don't trust it as much, i can't explain it.",False,False
ekjutcs,t3_bbix7a,t1_ekj7ql3,bluehydrangea98,1,2019-04-10 09:58:50,/r/EDAnonymous/comments/bbix7a/i_wish_the_rproed_page_still_exist/ekjutcs/,How do you browse the old posts?,False,False
ekjsjn2,t3_bbix7a,t3_bbix7a,MyBodyIsACage_,1,2019-04-10 09:32:00,/r/EDAnonymous/comments/bbix7a/i_wish_the_rproed_page_still_exist/ekjsjn2/,I miss it too. So supportive and understanding.,False,False
ekjlh3m,t3_bbix7a,t3_bbix7a,notyourpeach,1,2019-04-10 08:02:34,/r/EDAnonymous/comments/bbix7a/i_wish_the_rproed_page_still_exist/ekjlh3m/,"Me too!!!! It was such a supportive community. Luckily we still have a space like this one here, even tho is not ~completely~ the same, we can still vent and talk about our problems without feeling judge I guess.   Much love to you and everyone 🖤🖤",False,False
ekjip0v,t3_bbix7a,t3_bbix7a,JavaBean17,1,2019-04-10 07:21:24,/r/EDAnonymous/comments/bbix7a/i_wish_the_rproed_page_still_exist/ekjip0v/,Feeling exactly the same way about this. :/ I tried another forum but nowhere has the feel that the old sub did. It blows.,False,False
ekj7ql3,t3_bbix7a,t3_bbix7a,PM_ME_YER_SHIBA_INUS,1,2019-04-10 03:02:31,/r/EDAnonymous/comments/bbix7a/i_wish_the_rproed_page_still_exist/ekj7ql3/,"This's the nicest subreddit I browse, even on my main account. I hope you like it here just as much.  If you want, they have mirrors up that can browse the old sub's posts!",False,False
ekj7n8y,t3_bbix7a,t3_bbix7a,greensvoice,1,2019-04-10 02:59:53,/r/EDAnonymous/comments/bbix7a/i_wish_the_rproed_page_still_exist/ekj7n8y/,yea pretty much the same. i stopped talking to pretty much everyone in my life about any of my issues besides my therapist for formality. i’d rather not bring others irl down at this point,False,False
