Comment ID,Link ID,Parent ID,Author,Score,Publish Date,Permalink,Text,Stickied,Is Submitter
fa1b4cs,t3_e7ba7z,t1_f9xso18,doesglitterhavecarbs,1,2019-12-07 19:12:34,/r/EDAnonymous/comments/e7ba7z/coworkers_you_dont_have_to_worry_about_your_diet/fa1b4cs/,You have money you don’t need to go to work!  You have a house you don’t need to pay rent!,False,True
fa0akh3,t3_e7ba7z,t1_f9xoqmc,doesglitterhavecarbs,2,2019-12-07 14:48:00,/r/EDAnonymous/comments/e7ba7z/coworkers_you_dont_have_to_worry_about_your_diet/fa0akh3/,You have money you won’t need to go to work!  You have a house you don’t need to pay rent/mortgage!,False,True
f9yjx2s,t3_e7ba7z,t1_f9xp0lq,bestrongandfast,1,2019-12-07 08:41:10,/r/EDAnonymous/comments/e7ba7z/coworkers_you_dont_have_to_worry_about_your_diet/f9yjx2s/,"This is my number one pet peeve, how stupid can you be Debbie",False,False
f9xzgzl,t3_e7ba7z,t1_f9xoqmc,ChristieFox,1,2019-12-07 06:15:36,/r/EDAnonymous/comments/e7ba7z/coworkers_you_dont_have_to_worry_about_your_diet/f9xzgzl/,"People always only see the one thing you eat and assume you ""have to have a high metabolism to be this skinny while eating so much"".",False,False
f9xso18,t3_e7ba7z,t3_e7ba7z,rotting_the_crown,1,2019-12-07 05:19:56,/r/EDAnonymous/comments/e7ba7z/coworkers_you_dont_have_to_worry_about_your_diet/f9xso18/,"“Why do you have a diet drink, you don’t need it”   Bitch why do you think I look like this",False,False
f9xp0lq,t3_e7ba7z,t3_e7ba7z,sma123456789,1,2019-12-07 04:47:11,/r/EDAnonymous/comments/e7ba7z/coworkers_you_dont_have_to_worry_about_your_diet/f9xp0lq/,"When people say just eat whatever you want, youre skinny anyway. How do you thin ended up this way?",False,False
f9xoqmc,t3_e7ba7z,t3_e7ba7z,the_real_blobfish,1,2019-12-07 04:44:30,/r/EDAnonymous/comments/e7ba7z/coworkers_you_dont_have_to_worry_about_your_diet/f9xoqmc/,"“oH mY gOd how do you eat whatever you want and stay so skinny!??!!1!??” First of all, no.",False,False
f9x3s8q,t3_e7ba7z,t3_e7ba7z,lovenote123,1,2019-12-07 01:35:37,/r/EDAnonymous/comments/e7ba7z/coworkers_you_dont_have_to_worry_about_your_diet/f9x3s8q/,Holy yes,False,False
