Comment ID,Link ID,Parent ID,Author,Score,Publish Date,Permalink,Text,Stickied,Is Submitter
eaakxvw,t3_9zkz3q,t1_eaa7q5f,watchmedisapr,1,2018-11-23 05:35:18,/r/EDAnonymous/comments/9zkz3q/i_just_got_dumped/eaakxvw/,"Also Beyonce's ""to the left""",False,False
eaadnhu,t3_9zkz3q,t1_eaacves,cocochaichai,1,2018-11-23 03:13:35,/r/EDAnonymous/comments/9zkz3q/i_just_got_dumped/eaadnhu/,Right?! Like wtf I at least deserved a phone call ,False,True
eaacves,t3_9zkz3q,t1_eaa4762,raspbunni,1,2018-11-23 02:58:50,/r/EDAnonymous/comments/9zkz3q/i_just_got_dumped/eaacves/,and through text?! i’m so sorry :(,False,False
eaa7q5f,t3_9zkz3q,t1_eaa7ht8,cocochaichai,1,2018-11-23 01:01:53,/r/EDAnonymous/comments/9zkz3q/i_just_got_dumped/eaa7q5f/,"Haha great suggestion, I will do that! ",False,True
eaa7ht8,t3_9zkz3q,t3_9zkz3q,alanismorisette69,1,2018-11-23 00:57:03,/r/EDAnonymous/comments/9zkz3q/i_just_got_dumped/eaa7ht8/,"Listen to Ariana Grande’s “thank u, next”. Just as good as therapy and much cheaper. ",False,False
eaa4762,t3_9zkz3q,t1_eaa0vhs,cocochaichai,1,2018-11-22 23:48:16,/r/EDAnonymous/comments/9zkz3q/i_just_got_dumped/eaa4762/,"Right?! Like I literally woke up to the message, why not just wait one day? Thanks so much, I ended up powering through today mainly cuz I didn’t wanna talk about it and not eating would’ve raised questions... 💛💛 what you said means a lot ",False,True
eaa0vhs,t3_9zkz3q,t3_9zkz3q,Lunar_Heart,1,2018-11-22 22:41:56,/r/EDAnonymous/comments/9zkz3q/i_just_got_dumped/eaa0vhs/,"i'm so sorry you're going through that. what a shitty thing to do. like, he couldn't hold off a SINGLE DAY longer? total dick move to ruin your holiday. it's understandable to not feel up to dealing with eating after something like that, but remember that you *deserve* to eat and that there's nothing to be ashamed of. it's too much though, maybe you could use the break up as an excuse? ",False,False
eaa0eyc,t3_9zkz3q,t1_ea9zygz,cocochaichai,1,2018-11-22 22:32:56,/r/EDAnonymous/comments/9zkz3q/i_just_got_dumped/eaa0eyc/,"Thank you, sorry you had to go through this too 💛",False,True
ea9zygz,t3_9zkz3q,t3_9zkz3q,almondbones,1,2018-11-22 22:24:06,/r/EDAnonymous/comments/9zkz3q/i_just_got_dumped/ea9zygz/,I'm so sorry lovebug. That's really difficult. I really feel for you. It happened to me recently too. My direct message is always open to you. 💛 Stay safe and stay strong,False,False
