Comment ID,Link ID,Parent ID,Author,Score,Publish Date,Permalink,Text,Stickied,Is Submitter
fglzz5j,t3_eyfize,t1_fgim0ra,3mptycupofcare,1,2020-02-05 09:03:56,/r/EDAnonymous/comments/eyfize/me_every_time_i_lose_even_the_slightest_grip_on/fglzz5j/,Definitely easy science.,False,False
fgl0w8j,t3_eyfize,t1_fghurbl,eli-the-hobbit,1,2020-02-04 22:57:07,/r/EDAnonymous/comments/eyfize/me_every_time_i_lose_even_the_slightest_grip_on/fgl0w8j/,"Ha! I’m on a coffee, water, and vodka fast rn",False,False
fgiwcff,t3_eyfize,t1_fgijn5d,annihilatress,1,2020-02-04 10:05:27,/r/EDAnonymous/comments/eyfize/me_every_time_i_lose_even_the_slightest_grip_on/fgiwcff/,100% true!,False,False
fgis5j5,t3_eyfize,t1_fghurbl,TheBoyWhoCriedTapir,1,2020-02-04 09:21:46,/r/EDAnonymous/comments/eyfize/me_every_time_i_lose_even_the_slightest_grip_on/fgis5j5/,add nicotine and bang energy drinks to the list,False,False
fgiov0g,t3_eyfize,t1_fghurbl,54y95s785,1,2020-02-04 08:45:02,/r/EDAnonymous/comments/eyfize/me_every_time_i_lose_even_the_slightest_grip_on/fgiov0g/,divine,False,False
fgim0ra,t3_eyfize,t1_fgigajy,vpuvwv,1,2020-02-04 08:10:50,/r/EDAnonymous/comments/eyfize/me_every_time_i_lose_even_the_slightest_grip_on/fgim0ra/,when you're vibrating through your skin because of anxiety/stress/panic - it cancels out the calories in vodka right? easy science,False,False
fgijn5d,t3_eyfize,t3_eyfize,dismyedun,1,2020-02-04 07:39:54,/r/EDAnonymous/comments/eyfize/me_every_time_i_lose_even_the_slightest_grip_on/fgijn5d/,"My thing is, if things are going wrong, at least if I'm restricting I know at least that is handled. Like, things can go wrong but at least I'm not gaining.",False,False
fgij0z5,t3_eyfize,t3_eyfize,cassie_kitty,1,2020-02-04 07:31:34,/r/EDAnonymous/comments/eyfize/me_every_time_i_lose_even_the_slightest_grip_on/fgij0z5/,"Well, I plan on doing this, but I end up eating everything in sight, so...",False,False
fgigajy,t3_eyfize,t1_fghg48k,3mptycupofcare,1,2020-02-04 06:51:53,/r/EDAnonymous/comments/eyfize/me_every_time_i_lose_even_the_slightest_grip_on/fgigajy/,"Alkohol doesn’t have calories, change my mind",False,False
fgig80g,t3_eyfize,t1_fghurbl,normal_sauce,1,2020-02-04 06:50:46,/r/EDAnonymous/comments/eyfize/me_every_time_i_lose_even_the_slightest_grip_on/fgig80g/,I feel extremely seen.,False,False
fgidciu,t3_eyfize,t3_eyfize,samema,1,2020-02-04 06:01:52,/r/EDAnonymous/comments/eyfize/me_every_time_i_lose_even_the_slightest_grip_on/fgidciu/,Lmaoo,False,False
fgi9j6e,t3_eyfize,t3_eyfize,sugarsugarsalt,1,2020-02-04 04:38:56,/r/EDAnonymous/comments/eyfize/me_every_time_i_lose_even_the_slightest_grip_on/fgi9j6e/,"yeah, being betrayed deeply by a friend and made to feel sub-human pairs really well with not eating at all",False,False
fgi6gjg,t3_eyfize,t3_eyfize,juovla,1,2020-02-04 03:20:06,/r/EDAnonymous/comments/eyfize/me_every_time_i_lose_even_the_slightest_grip_on/fgi6gjg/,Me: I won’t have time to be upset about other shit if my ED ruins my entire life,False,False
fgi3w5h,t3_eyfize,t1_fghof87,amaravi,1,2020-02-04 02:18:27,/r/EDAnonymous/comments/eyfize/me_every_time_i_lose_even_the_slightest_grip_on/fgi3w5h/,"...and when the realisation hits, then starve yourself",False,False
fgi3tjt,t3_eyfize,t3_eyfize,jrms_,1,2020-02-04 02:16:52,/r/EDAnonymous/comments/eyfize/me_every_time_i_lose_even_the_slightest_grip_on/fgi3tjt/,I'm being exposed,False,False
fgi1po0,t3_eyfize,t3_eyfize,wetblanketdreams,1,2020-02-04 01:32:20,/r/EDAnonymous/comments/eyfize/me_every_time_i_lose_even_the_slightest_grip_on/fgi1po0/,It's like the first thing I grab for to get control back. I is stupid.,False,False
fghurbl,t3_eyfize,t3_eyfize,Rivka90,1,2020-02-03 23:34:19,/r/EDAnonymous/comments/eyfize/me_every_time_i_lose_even_the_slightest_grip_on/fghurbl/,coffee weed and wine fast,False,False
fghq92d,t3_eyfize,t3_eyfize,darklightdiana,1,2020-02-03 22:34:38,/r/EDAnonymous/comments/eyfize/me_every_time_i_lose_even_the_slightest_grip_on/fghq92d/,I’m not a person who restricts but I’ve been so miserable lately that I had to force myself to eat today and my god I’m happy to be at home finally because no one is going to force me to eat here,False,False
fghogb3,t3_eyfize,t3_eyfize,pnurplert,1,2020-02-03 22:13:06,/r/EDAnonymous/comments/eyfize/me_every_time_i_lose_even_the_slightest_grip_on/fghogb3/,Wait thats so funny..thats me..,False,False
fghof87,t3_eyfize,t3_eyfize,Beconelle,1,2020-02-03 22:12:45,/r/EDAnonymous/comments/eyfize/me_every_time_i_lose_even_the_slightest_grip_on/fghof87/,I think you mean eat everything in sight,False,False
fghngn3,t3_eyfize,t3_eyfize,vavveggie,1,2020-02-03 22:01:27,/r/EDAnonymous/comments/eyfize/me_every_time_i_lose_even_the_slightest_grip_on/fghngn3/,You can’t panic if your are to deprived of nutrition to barely live,False,False
fghg48k,t3_eyfize,t3_eyfize,unicorns-n-mermaids,1,2020-02-03 20:40:52,/r/EDAnonymous/comments/eyfize/me_every_time_i_lose_even_the_slightest_grip_on/fghg48k/,Me this week with the completely unintentional 48 hour sorta fast (only alcohol calories lmao),False,False
fghcwp3,t3_eyfize,t3_eyfize,gamemurray,1,2020-02-03 20:07:14,/r/EDAnonymous/comments/eyfize/me_every_time_i_lose_even_the_slightest_grip_on/fghcwp3/,whoa how did you get into my brain?,False,False
fgh2as0,t3_eyfize,t3_eyfize,my-destructive-side,1,2020-02-03 18:09:58,/r/EDAnonymous/comments/eyfize/me_every_time_i_lose_even_the_slightest_grip_on/fgh2as0/,More or less my life’s motto: keep calm and starve on.,False,False
fggye0o,t3_eyfize,t3_eyfize,throwaway1221-,1,2020-02-03 17:25:58,/r/EDAnonymous/comments/eyfize/me_every_time_i_lose_even_the_slightest_grip_on/fggye0o/,Deadass. Like literally I can have not at all related problem and my mind would be like iT’s BeCauSe I aM fAT iSn’T iT,False,False
fggxhft,t3_eyfize,t3_eyfize,strangernumberone,1,2020-02-03 17:16:02,/r/EDAnonymous/comments/eyfize/me_every_time_i_lose_even_the_slightest_grip_on/fggxhft/,Sounds about right .,False,False
