Comment ID,Link ID,Parent ID,Author,Score,Publish Date,Permalink,Text,Stickied,Is Submitter
ehl4xgp,t3_aw0a89,t1_ehjcl2y,TheManyArchetypes,1,2019-03-01 16:22:18,/r/EDAnonymous/comments/aw0a89/my_scale_has_been_lying_maybe_yours_has_too/ehl4xgp/,And then proceed to move it and weigh 3 more times....and then maybe repeat depending on how neurotic I may be feeling. ,False,False
ehkr24l,t3_aw0a89,t3_aw0a89,Bomby57,1,2019-03-01 13:43:48,/r/EDAnonymous/comments/aw0a89/my_scale_has_been_lying_maybe_yours_has_too/ehkr24l/,I always weight myself 2 or 3 times and on different scales. Just to make sure...   I also try to never move them. ,False,False
ehjcl2y,t3_aw0a89,t3_aw0a89,OkWorking7,1,2019-03-01 00:20:09,/r/EDAnonymous/comments/aw0a89/my_scale_has_been_lying_maybe_yours_has_too/ehjcl2y/,That's why I weigh myself 3 times on my digital scale and try not to move it if I can help it. RIP,False,False
ehjbr6p,t3_aw0a89,t3_aw0a89,luvvthatforme,1,2019-03-01 00:05:00,/r/EDAnonymous/comments/aw0a89/my_scale_has_been_lying_maybe_yours_has_too/ehjbr6p/,I just got up to weigh myself. Lol,False,False
ehj7sed,t3_aw0a89,t3_aw0a89,nasihljeung,1,2019-02-28 22:58:48,/r/EDAnonymous/comments/aw0a89/my_scale_has_been_lying_maybe_yours_has_too/ehj7sed/,that explains why i thought i hit 124 two weeks ago... :P,False,False
