Comment ID,Link ID,Parent ID,Author,Score,Publish Date,Permalink,Text,Stickied,Is Submitter
fcsneo6,t3_ehzfaj,t1_fcooa61,ColesEyebrows,1,2020-01-01 17:12:24,/r/EDAnonymous/comments/ehzfaj/daily_discussion_tuesday_december_31_2019/fcsneo6/,You're not starting over. You're continuing the success you started despite a blip. &lt;3,False,False
fcsna6m,t3_ehzfaj,t1_fcnldrs,ColesEyebrows,1,2020-01-01 17:10:52,/r/EDAnonymous/comments/ehzfaj/daily_discussion_tuesday_december_31_2019/fcsna6m/,Thank you so much for this comment. I read it yesterday after just barely stopping myself and it meant a lot and said a lot to me. I didn't purge at all yesterday despite thinking about it relentlessly and it's just gone 11pm now today and I haven't today either. This is off the back of what felt like endless daily purging that started in like October? Maybe? Dunno when exactly it went from 'frequent' to 'constant' but it was really killing me.   Today I ate and I ate a lot but I didn't binge and I really enjoyed and thought about all of the food I ate. And I haven't purged. Hopefully the urge dies down with lack of fulfilment.  \#newyearnewme  Again: thank you. So much.,False,False
fcpbtmz,t3_ehzfaj,t3_ehzfaj,vilej_ideut,1,2019-12-31 23:45:25,/r/EDAnonymous/comments/ehzfaj/daily_discussion_tuesday_december_31_2019/fcpbtmz/,Why doesn't this shit kill me  I don't want to be alive. Literally 2/3 of my life I've spent wishing I was dead. Pointless suffering. Put me out of my misery.,False,False
fcp6xyr,t3_ehzfaj,t3_ehzfaj,helloitsmeme,1,2019-12-31 22:21:44,/r/EDAnonymous/comments/ehzfaj/daily_discussion_tuesday_december_31_2019/fcp6xyr/,"I binged on a whole pound of puerco beans. I loved them. 600 calories, so I'm not eating anything else tonight. Only vodka and rum for this lonely pirate. My stomach hates me so much.",False,False
fcp09li,t3_ehzfaj,t3_ehzfaj,oh-em-jizzles,1,2019-12-31 20:42:23,/r/EDAnonymous/comments/ehzfaj/daily_discussion_tuesday_december_31_2019/fcp09li/,"just turned down my only offer for NYE plans (not even a party, just a pity invite to a ""friends"" house bc i posted on my insta story about spending NYE alone) bc i ate an actual dinner and some dessert so i feel full and bloated and disgusting :((((( good way to go into 2020",False,False
fcoxs03,t3_ehzfaj,t3_ehzfaj,kindbear_kindbud,1,2019-12-31 20:08:36,/r/EDAnonymous/comments/ehzfaj/daily_discussion_tuesday_december_31_2019/fcoxs03/,Getting drunk by myself tonight lads,False,False
fcord1k,t3_ehzfaj,t3_ehzfaj,Ieyeku,1,2019-12-31 18:44:50,/r/EDAnonymous/comments/ehzfaj/daily_discussion_tuesday_december_31_2019/fcord1k/,Well all my hard work was ruined in 3 days. I hate the feeling 9f anything in my gi track.,False,False
fcooa61,t3_ehzfaj,t1_fcofqgd,tigerchik,1,2019-12-31 18:07:20,/r/EDAnonymous/comments/ehzfaj/daily_discussion_tuesday_december_31_2019/fcooa61/,update. I binged. I have moved to bed. Tomorrow can come soon please so I can start over. I was doing so well,False,False
fcoih98,t3_ehzfaj,t1_fcnbqqs,eelings,1,2019-12-31 16:57:12,/r/EDAnonymous/comments/ehzfaj/daily_discussion_tuesday_december_31_2019/fcoih98/,So this year wasn't done with me. Surprise 4k Bill.,False,False
fcofqgd,t3_ehzfaj,t3_ehzfaj,tigerchik,1,2019-12-31 16:25:43,/r/EDAnonymous/comments/ehzfaj/daily_discussion_tuesday_december_31_2019/fcofqgd/,am on here so I don't binge...,False,False
fcofpso,t3_ehzfaj,t1_fcmq1ly,tigerchik,1,2019-12-31 16:25:30,/r/EDAnonymous/comments/ehzfaj/daily_discussion_tuesday_december_31_2019/fcofpso/,just wanted to say hi and I'm sorry you feel sad and alone,False,False
fcofn5l,t3_ehzfaj,t1_fcny8vx,tigerchik,1,2019-12-31 16:24:40,/r/EDAnonymous/comments/ehzfaj/daily_discussion_tuesday_december_31_2019/fcofn5l/,"if you get pure apple cider vinegar, make sure to buy the UNFILTERED version. Try like 1 tbsp per 8 oz of hot water. (The kevita things are great but super expensive)",False,False
fcoc4lu,t3_ehzfaj,t3_ehzfaj,bunn681,1,2019-12-31 15:43:45,/r/EDAnonymous/comments/ehzfaj/daily_discussion_tuesday_december_31_2019/fcoc4lu/,Fuck the holidays,False,False
fcny8vx,t3_ehzfaj,t1_fcnqgi2,crymeacoffeetable,1,2019-12-31 13:32:43,/r/EDAnonymous/comments/ehzfaj/daily_discussion_tuesday_december_31_2019/fcny8vx/,BUYING SOME ON PAYDAY,False,False
fcnwgh5,t3_ehzfaj,t3_ehzfaj,YVRebecca,1,2019-12-31 13:17:00,/r/EDAnonymous/comments/ehzfaj/daily_discussion_tuesday_december_31_2019/fcnwgh5/,"Is the new decade throwing anyone through a bad brain loop? I was first diagnosed/hospitalized in 2010, and it feels scary to be taking my ED into this new decade. I find it hard to connect with my original diagnosis now that it's transformed into over exercising rather than pure restriction. I've never been so functional at such a physically unhealthy state and everything is going well in my life - I am incredibly lucky to have a career I love and pays more than the bills, but my relationships with certain friends and my sister are severely faltering. They say they're uncomfortable around me and don't want to see me in the way I am. But I've been way worse, and feel shockingly functional right now.  I'm struggling to find motivation that isn't just about making people stop being upset with me. Any advice would be appreciated.",False,False
fcnu6j2,t3_ehzfaj,t3_ehzfaj,Saturndrawz,1,2019-12-31 12:54:46,/r/EDAnonymous/comments/ehzfaj/daily_discussion_tuesday_december_31_2019/fcnu6j2/,"I’m so upset, what I was gonna eat today was centered around what my parents were going to make for New Years and they just decided to change the plan and make something wayyy outside my comfort zone. Now I just feel like saying fuck it and just binging",False,False
fcnt5r8,t3_ehzfaj,t1_fcngrwj,lbredj,1,2019-12-31 12:45:25,/r/EDAnonymous/comments/ehzfaj/daily_discussion_tuesday_december_31_2019/fcnt5r8/,test it with some dumbbells if u have some!,False,False
fcnqgi2,t3_ehzfaj,t1_fcnpquo,tigerchik,1,2019-12-31 12:21:38,/r/EDAnonymous/comments/ehzfaj/daily_discussion_tuesday_december_31_2019/fcnqgi2/,"I think it helps with pooping, LOL. The unfiltered stuff, like those in the drinks, is a great source of probiotics. It's been touted for ages as a digestive aid.",False,False
fcnpquo,t3_ehzfaj,t1_fcnpaj7,crymeacoffeetable,1,2019-12-31 12:15:19,/r/EDAnonymous/comments/ehzfaj/daily_discussion_tuesday_december_31_2019/fcnpquo/,What does apple cider vinegar do?,False,False
fcnpcki,t3_ehzfaj,t1_fcnirbx,tigerchik,1,2019-12-31 12:11:31,/r/EDAnonymous/comments/ehzfaj/daily_discussion_tuesday_december_31_2019/fcnpcki/,you can do it!,False,False
fcnpaj7,t3_ehzfaj,t1_fcnl47w,tigerchik,1,2019-12-31 12:10:59,/r/EDAnonymous/comments/ehzfaj/daily_discussion_tuesday_december_31_2019/fcnpaj7/,"yes, yes, yes. Get some digestive enzymes, probiotics, and Kevita Apple Cider Vinegar tonics. Those always help me",False,False
fcnldrs,t3_ehzfaj,t1_fcnirbx,0463517228539110,1,2019-12-31 11:35:46,/r/EDAnonymous/comments/ehzfaj/daily_discussion_tuesday_december_31_2019/fcnldrs/,"Any reason to not engage in behaviors is valid, so yes absolutely 100% if vanity is the only thing keeping you on track, then use that as your motivation!  But I bet if you thought for a while (&amp; maybe even made a list), you could come up with many more reasons not to purge.  Finding a distraction can help as well -- going for a walk (weather-permitting), some kind of art/craft, video games, reading a book, maybe laundry or other household chores (away from the kitchen/bathroom, tho!), etc. etc..  For me the best way to help not engage is to occupy my mind as well, even if it's just watching reality tv or something.  Again: you got this!!",False,False
fcnl47w,t3_ehzfaj,t3_ehzfaj,crymeacoffeetable,1,2019-12-31 11:33:41,/r/EDAnonymous/comments/ehzfaj/daily_discussion_tuesday_december_31_2019/fcnl47w/,Anyone else experiencing AWFUL gastrointestinal symptoms from eating outside of their comfort zone? I’ve been constipated for 3 days and today I’m sweating and either pooping every hour OR I have the urge to and I’m constipated again. like WHAT. Ugh. I didn’t even binge too much I just ate stuff other than soup and frozen veggies 😩😩😩 I thought it would be fine I prepared myself for the mental aftermath but not for the physical I didn’t sign up for this lol no good deed goes unpunished.,False,False
fcnius5,t3_ehzfaj,t1_fcmq1ly,ColesEyebrows,1,2019-12-31 11:15:52,/r/EDAnonymous/comments/ehzfaj/daily_discussion_tuesday_december_31_2019/fcnius5/,You have yourself and you're all you need xx,False,False
fcnirbx,t3_ehzfaj,t1_fcnclt1,ColesEyebrows,1,2019-12-31 11:15:05,/r/EDAnonymous/comments/ehzfaj/daily_discussion_tuesday_december_31_2019/fcnirbx/,Its very tempting. 1714 now. To be honrst I'm just sick of the puffy face. Like is changing for vanity even valid?,False,False
fcngrwj,t3_ehzfaj,t3_ehzfaj,2low-key,1,2019-12-31 10:56:29,/r/EDAnonymous/comments/ehzfaj/daily_discussion_tuesday_december_31_2019/fcngrwj/,I have this overwhelming feeling that my digital scale is lying to me. Guess I’ll buy a third scale -___-,False,False
fcnfcig,t3_ehzfaj,t3_ehzfaj,ToastNoodles,1,2019-12-31 10:42:40,/r/EDAnonymous/comments/ehzfaj/daily_discussion_tuesday_december_31_2019/fcnfcig/,Spending new years in bed crying.  Idk whether to fast the whole day or binge on a pizza later.  I don't have any drugs to dissociate. I'm stuck.  Happy new year.,False,False
fcndnuh,t3_ehzfaj,t1_fcn4qaq,severedclouds,1,2019-12-31 10:25:10,/r/EDAnonymous/comments/ehzfaj/daily_discussion_tuesday_december_31_2019/fcndnuh/,her @?,False,False
fcnclt1,t3_ehzfaj,t1_fcn8hrp,0463517228539110,1,2019-12-31 10:13:33,/r/EDAnonymous/comments/ehzfaj/daily_discussion_tuesday_december_31_2019/fcnclt1/,One day at a time -- you got this!!!,False,False
fcnbqqs,t3_ehzfaj,t3_ehzfaj,eelings,1,2019-12-31 10:04:00,/r/EDAnonymous/comments/ehzfaj/daily_discussion_tuesday_december_31_2019/fcnbqqs/,"You ever have one of those moments when life just serves to prove your ED and Depression correct? Tonight is that for me. At least I'll be staying under my restriction goal, even after the pity invite from my elderly neighbour for a drink when they found out I am alone tonight.  Not sure if it's the ed, the depression or that I just really suck that's done me out of invites tonight but maybe it's all 3.",False,False
fcn8isw,t3_ehzfaj,t3_ehzfaj,StressedCookie,1,2019-12-31 09:26:59,/r/EDAnonymous/comments/ehzfaj/daily_discussion_tuesday_december_31_2019/fcn8isw/,"It's unreal how disgusting I feel no matter how dolled up I am. I put on the clothes, the best clothes I can pick from my wardrobe, then.. I LOOK in the mirror and feel disgusted. Every angle disgust me. I feel disgusted then self hatred, but DISGUST is my first reaction.",False,False
fcn8hrp,t3_ehzfaj,t3_ehzfaj,ColesEyebrows,1,2019-12-31 09:26:39,/r/EDAnonymous/comments/ehzfaj/daily_discussion_tuesday_december_31_2019/fcn8hrp/,I am not going to purge today. It's 1526 and I've said the same thing for a couple weeks now. Today's the day.,False,False
fcn5niy,t3_ehzfaj,t1_fcmq1ly,oh-em-jizzles,1,2019-12-31 08:51:59,/r/EDAnonymous/comments/ehzfaj/daily_discussion_tuesday_december_31_2019/fcn5niy/,rt,False,False
fcn4qaq,t3_ehzfaj,t3_ehzfaj,dragaynite,1,2019-12-31 08:40:13,/r/EDAnonymous/comments/ehzfaj/daily_discussion_tuesday_december_31_2019/fcn4qaq/,"There’s this girl I follow on Instagram who has the cutest aesthetic and is super tiny. Like I follow a lot of Instagram fitness gorls too who are goals, but this one girl is so small and toned looking and her ig isn’t fitness based so i just get insanely jealous that she looks incredible but how?? I wanna know if she works out and how much she eats and ahahhhhhhh I feel creepy saying that but it’s all I can think about. I just wanna imitate her lifestyle to get her body :((",False,False
fcn304c,t3_ehzfaj,t3_ehzfaj,wispybubble,1,2019-12-31 08:17:21,/r/EDAnonymous/comments/ehzfaj/daily_discussion_tuesday_december_31_2019/fcn304c/,Today is my day that my body had decided to feel like absolute shift from restricting. I thought I had somehow skipped it this time(usually comes on day 3. today is day 8). Today was supposed to be a low restrict day but goddamn I want some chicken minis lmao. Those are like crack to me.,False,False
fcn16j6,t3_ehzfaj,t3_ehzfaj,egosolussto,1,2019-12-31 07:51:22,/r/EDAnonymous/comments/ehzfaj/daily_discussion_tuesday_december_31_2019/fcn16j6/,Got a xiaomi mi band 4 and finally went outside to walk last night. I haven't gone outside to walk in like a year :/,False,False
fcmwncl,t3_ehzfaj,t1_fcmqw85,mintedcheeto,1,2019-12-31 06:33:36,/r/EDAnonymous/comments/ehzfaj/daily_discussion_tuesday_december_31_2019/fcmwncl/,fuck yes that genuinely made me happy ok its what you deserve,False,False
fcmv01h,t3_ehzfaj,t3_ehzfaj,bindingin,1,2019-12-31 05:59:12,/r/EDAnonymous/comments/ehzfaj/daily_discussion_tuesday_december_31_2019/fcmv01h/,"I bailed on my bf , ditched a beautiful weekend away bc I binged for 3 days.",False,False
fcmtiq3,t3_ehzfaj,t1_fcmqw85,maple-dipped,1,2019-12-31 05:25:28,/r/EDAnonymous/comments/ehzfaj/daily_discussion_tuesday_december_31_2019/fcmtiq3/,This made me smile. I'm happy for you!,False,False
fcmqw85,t3_ehzfaj,t3_ehzfaj,tea-addicted-taemint,1,2019-12-31 04:22:49,/r/EDAnonymous/comments/ehzfaj/daily_discussion_tuesday_december_31_2019/fcmqw85/,I had amazing sushi with my friend today and I feel so happy. Everything is gonna be ok.,False,False
fcmq1ly,t3_ehzfaj,t3_ehzfaj,nnlssthrpl,1,2019-12-31 04:02:44,/r/EDAnonymous/comments/ehzfaj/daily_discussion_tuesday_december_31_2019/fcmq1ly/,"i have no one to spend new years with , not friends, not family tbh i just feel sad and alone",False,False
fcmp2jk,t3_ehzfaj,t3_ehzfaj,katarina-stratford,1,2019-12-31 03:39:33,/r/EDAnonymous/comments/ehzfaj/daily_discussion_tuesday_december_31_2019/fcmp2jk/,That fuckin whoosh tho.,False,False
