Comment ID,Link ID,Parent ID,Author,Score,Publish Date,Permalink,Text,Stickied,Is Submitter
eknqefr,t3_bbubgo,t3_bbubgo,inadaze319,1,2019-04-11 15:20:03,/r/EDAnonymous/comments/bbubgo/what_sort_of_wins_have_you_made_recently/eknqefr/,I have been in rocovery for about 50 days and only b/p’d once. I’ve had a handful of binges (maybe like 6?) but at least I didn’t purge. It’s hard to give myself credit though because I still feel like a fat loser sometimes but hey at least this girl isn’t spending all of her money on shit she’s just gonna flush down the toilet. I actually have some savings now! Yay!,False,False
ekmh7ul,t3_bbubgo,t1_ekm2ee8,molotov-cocktail,1,2019-04-11 07:09:16,/r/EDAnonymous/comments/bbubgo/what_sort_of_wins_have_you_made_recently/ekmh7ul/,thanks!!!!!,False,False
ekm9xmo,t3_bbubgo,t3_bbubgo,ziyal79,1,2019-04-11 05:14:36,/r/EDAnonymous/comments/bbubgo/what_sort_of_wins_have_you_made_recently/ekm9xmo/,I started lifting heavy last week. I'm really enjoying it. I'm working hard to not low restrict as well. I'm trying to build as much muscle as I can because I finally got it through my thick head that more muscle = less fat over time.,False,False
ekm9rbm,t3_bbubgo,t3_bbubgo,smokvenjak,1,2019-04-11 05:11:17,/r/EDAnonymous/comments/bbubgo/what_sort_of_wins_have_you_made_recently/ekm9rbm/,"Stopped counting calories and fasting this monday, made a cup of instant coffee even though the classmates mixed sugar in with the grains, had a snack/breakfast during the day (at college) for the first time since november.. Just trying to eat intuitively and focus on more important things.",False,False
ekm2fcb,t3_bbubgo,t1_eklq7qa,PieldeSapo,1,2019-04-11 02:28:58,/r/EDAnonymous/comments/bbubgo/what_sort_of_wins_have_you_made_recently/ekm2fcb/,Kittens &lt;3,False,False
ekm2ee8,t3_bbubgo,t1_eklokls,PieldeSapo,1,2019-04-11 02:28:21,/r/EDAnonymous/comments/bbubgo/what_sort_of_wins_have_you_made_recently/ekm2ee8/,That's huge!! Congrats,False,False
eklvedx,t3_bbubgo,t3_bbubgo,aceetone,1,2019-04-10 23:33:05,/r/EDAnonymous/comments/bbubgo/what_sort_of_wins_have_you_made_recently/eklvedx/,I've switched all my winter clothing for warmer weather clothing and booked a trip to the tropics,False,False
ekltqpk,t3_bbubgo,t3_bbubgo,whaleterweight,1,2019-04-10 23:07:24,/r/EDAnonymous/comments/bbubgo/what_sort_of_wins_have_you_made_recently/ekltqpk/,"I finally forced myself to schedule an appointment to try on wedding dresses this weekend, and I told my doctor I have an eating disorder and I have an appointment next week.",False,False
eklq7qa,t3_bbubgo,t3_bbubgo,fatandfuckingawkward,1,2019-04-10 22:15:27,/r/EDAnonymous/comments/bbubgo/what_sort_of_wins_have_you_made_recently/eklq7qa/,"i'm really getting my apartment organized and together and it's the cleanest it has been for like, 3 years 👍 Also ready to get cats, so that's exciting!",False,False
eklokls,t3_bbubgo,t3_bbubgo,molotov-cocktail,1,2019-04-10 21:52:55,/r/EDAnonymous/comments/bbubgo/what_sort_of_wins_have_you_made_recently/eklokls/,"i don't count calories anymore, i just try to intuitively eat to maintenance and i've managed to do so for a couple months so far :)",False,False
