Comment ID,Link ID,Parent ID,Author,Score,Publish Date,Permalink,Text,Stickied,Is Submitter
edajtui,t3_abqffl,t1_edajrbw,thebluestbanana,1,2019-01-05 05:04:23,/r/EDAnonymous/comments/abqffl/i_wish_there_was_a_word_for_that_exhilarating_and/edajtui/,Thank you :D,False,False
edajrbw,t3_abqffl,t1_ed2n16x,b-carbonate,1,2019-01-05 05:03:00,/r/EDAnonymous/comments/abqffl/i_wish_there_was_a_word_for_that_exhilarating_and/edajrbw/,This is literally the best word,False,False
ed43fgz,t3_abqffl,t3_abqffl,bbtvvz,1,2019-01-02 17:44:33,/r/EDAnonymous/comments/abqffl/i_wish_there_was_a_word_for_that_exhilarating_and/ed43fgz/,Zwiegespalten? It means to have mixed feelings. ,False,False
ed3ji7t,t3_abqffl,t1_ed3deag,ci-fre,1,2019-01-02 13:56:59,/r/EDAnonymous/comments/abqffl/i_wish_there_was_a_word_for_that_exhilarating_and/ed3ji7t/,"Ohh, I didn’t know it was used as a medical vocabulary :o",False,False
ed3deag,t3_abqffl,t1_ed2ikq5,nodamncatnodamncradl,1,2019-01-02 12:42:41,/r/EDAnonymous/comments/abqffl/i_wish_there_was_a_word_for_that_exhilarating_and/ed3deag/,"FYI this term is also used to describe specific ASMR-type responses, so I think it would include things like goosebumps and tingles in areas of the body etc  https://en.wikipedia.org/wiki/Frisson",False,False
ed3by20,t3_abqffl,t1_ed2yxv9,apricaught,1,2019-01-02 12:24:51,/r/EDAnonymous/comments/abqffl/i_wish_there_was_a_word_for_that_exhilarating_and/ed3by20/,"Ah yes, the quintessential ""I don't eat bc I'm small, I'm not small because I don't eat!""",False,False
ed3288k,t3_abqffl,t3_abqffl,nodamncatnodamncradl,1,2019-01-02 10:22:23,/r/EDAnonymous/comments/abqffl/i_wish_there_was_a_word_for_that_exhilarating_and/ed3288k/,"**wanton** kinda works (unduly lavish,LEWD, BAWDY,being without check or limitation)  Related words I considered that don't work but are related/interesting:  **compunction** (anxiety arising from awareness of guilt, a twinge of misgiving)  **rapacious** (aggressively greedy or grasping)  Also I didn't know this: (I was looking into the word Hedonism to see if it might fit)  Hedonism comes from the Greek hēdonē (“pleasure”), which also provides the root of the word **anhedonia** (“a psychological condition characterized by inability to experience pleasure in normally pleasurable acts”).  ",False,False
ed2zf6i,t3_abqffl,t1_ed2yxv9,Redditnotes,1,2019-01-02 09:43:36,/r/EDAnonymous/comments/abqffl/i_wish_there_was_a_word_for_that_exhilarating_and/ed2zf6i/,&gt; ahaahaaaaahfslafdsklajfkdlaghklar  Forget Freudscham or frission; that mash of letters truly represents the hyper panic. ,False,True
ed2yxv9,t3_abqffl,t3_abqffl,RaggedDoll,1,2019-01-02 09:36:36,/r/EDAnonymous/comments/abqffl/i_wish_there_was_a_word_for_that_exhilarating_and/ed2yxv9/,"""Wow! Your lunch is so tiny, is that all you're having?""  ""Yeah haha I don't eat that much I'm pretty small""  Internally: ahaahaaaaahfslafdsklajfkdlaghklar",False,False
ed2x15s,t3_abqffl,t1_ed2wwpn,thebluestbanana,1,2019-01-02 09:07:44,/r/EDAnonymous/comments/abqffl/i_wish_there_was_a_word_for_that_exhilarating_and/ed2x15s/,"That is hilarious :D Yeah, sometimes chain words are hard to understand because of the fact that you can separate it into different words depending on where exactly you ""cut"" them, but other than that it makes long words easy to understand :)",False,False
ed2wwpn,t3_abqffl,t1_ed2wl2j,rachihc,1,2019-01-02 09:05:46,/r/EDAnonymous/comments/abqffl/i_wish_there_was_a_word_for_that_exhilarating_and/ed2wwpn/,"Or get one of [THIS](http://i.imgur.com/h3p3f4g.png) hahaha.    Actually once I realized the chaining, it was less scary and easy to understand new words =\]",False,False
ed2wlsp,t3_abqffl,t1_ed2n16x,ksck135,1,2019-01-02 09:00:57,/r/EDAnonymous/comments/abqffl/i_wish_there_was_a_word_for_that_exhilarating_and/ed2wlsp/,"&gt;Essstörung  &gt;sss  German is beautiful.  (Yes, I know this word is already composed of two words, but triple s is just great)",False,False
ed2wl2j,t3_abqffl,t1_ed2wgey,thebluestbanana,1,2019-01-02 09:00:38,/r/EDAnonymous/comments/abqffl/i_wish_there_was_a_word_for_that_exhilarating_and/ed2wl2j/,Wouldn't you have to put two Scrabble boards together for that one? 😂,False,False
ed2wgey,t3_abqffl,t1_ed2n16x,rachihc,1,2019-01-02 08:58:34,/r/EDAnonymous/comments/abqffl/i_wish_there_was_a_word_for_that_exhilarating_and/ed2wgey/,"good old fashion German, chaining words, fear of the scrabble table &lt;3    ",False,False
ed2na4o,t3_abqffl,t1_ed2n86w,thebluestbanana,1,2019-01-02 05:45:07,/r/EDAnonymous/comments/abqffl/i_wish_there_was_a_word_for_that_exhilarating_and/ed2na4o/,I made a comment above and gave it a try anyway :D,False,False
ed2n86w,t3_abqffl,t1_ed2n5hc,taikutsuu,1,2019-01-02 05:43:33,/r/EDAnonymous/comments/abqffl/i_wish_there_was_a_word_for_that_exhilarating_and/ed2n86w/,"I avoid that word with all I can, though! And I don't really think the word applies, it's fictional anyway haha",False,False
ed2n5hc,t3_abqffl,t1_ed2knzw,thebluestbanana,1,2019-01-02 05:41:23,/r/EDAnonymous/comments/abqffl/i_wish_there_was_a_word_for_that_exhilarating_and/ed2n5hc/,"'Schämen"" in that context has less to do with shame and more to do with cringing if you ask me :/",False,False
ed2n16x,t3_abqffl,t1_ed2jqbl,thebluestbanana,1,2019-01-02 05:37:54,/r/EDAnonymous/comments/abqffl/i_wish_there_was_a_word_for_that_exhilarating_and/ed2n16x/,Essstörungsvalidierungserstreben is what you're referring to.  Essstörung - ED  validierungs- means validation  erstreben - seeking,False,False
ed2loxo,t3_abqffl,t1_ed2jqbl,Just-Another-Mom,1,2019-01-02 04:57:31,/r/EDAnonymous/comments/abqffl/i_wish_there_was_a_word_for_that_exhilarating_and/ed2loxo/,What would you call it?,False,False
ed2knzw,t3_abqffl,t3_abqffl,taikutsuu,1,2019-01-02 04:26:05,/r/EDAnonymous/comments/abqffl/i_wish_there_was_a_word_for_that_exhilarating_and/ed2knzw/,"How about Freudscham? XD 'Freude' is german for excitement, 'Scham' is german for shame, and it sounds awfully similar to 'Fremdscham' which means to be either embarrassed for, or laughing about, something somebody else did, aka making a comment towards us!  I think that's the closest fictional word I've managed to come up with, maybe I can think of something better LOL",False,False
ed2jqbl,t3_abqffl,t1_ed2h60q,b-carbonate,1,2019-01-02 03:56:25,/r/EDAnonymous/comments/abqffl/i_wish_there_was_a_word_for_that_exhilarating_and/ed2jqbl/,Can’t you make up one?  I remember when I was 15 the teacher would make us invent words and it was amazing !,False,False
ed2ikq5,t3_abqffl,t3_abqffl,ci-fre,1,2019-01-02 03:20:30,/r/EDAnonymous/comments/abqffl/i_wish_there_was_a_word_for_that_exhilarating_and/ed2ikq5/,Try frission. According to Oxford Dictionaries: a sudden strong feeling of excitement or fear; a thrill.,False,False
ed2h60q,t3_abqffl,t3_abqffl,thebluestbanana,1,2019-01-02 02:37:13,/r/EDAnonymous/comments/abqffl/i_wish_there_was_a_word_for_that_exhilarating_and/ed2h60q/,"Am German, can confirm that we, in fact, don't have a word for it. Sure, you could make one up that *technically* makes sense, but that doesn't change anything.  Nonetheless, I feel you on this one.",False,False
