Comment ID,Link ID,Parent ID,Author,Score,Publish Date,Permalink,Text,Stickied,Is Submitter
e9ywsgl,t3_9xoztk,t1_e9ueh33,MewMcMeowington,1,2018-11-18 10:12:59,/r/EDAnonymous/comments/9xoztk/we_have_been_contacted_by_reddit_admin/e9ywsgl/,I don’t subscribe so my no one sees these subs in my feed. :(   I’m literally so bummed out rn. ,False,False
e9xflsl,t3_9xoztk,t3_9xoztk,IvoryBoneGoddess,1,2018-11-17 19:17:31,/r/EDAnonymous/comments/9xoztk/we_have_been_contacted_by_reddit_admin/e9xflsl/,"It's just so sad and frustrating that we have to be self conscious of yet another thing in our lives, while other subs can freely post about hating women and tips for raping. It's more of a crime to be mentally ill and congregate to support one another than to fantasize about/ plan a rape. Sometimes I hate the world. But I am infinitely grateful we still have a home here, hopefully we'll be 33k strong again soon. ",False,False
e9wlr3o,t3_9xoztk,t1_e9wkt9c,Bomby57,1,2018-11-17 13:47:53,/r/EDAnonymous/comments/9xoztk/we_have_been_contacted_by_reddit_admin/e9wlr3o/,Thanks! I really appreciate all the support here. I hope so hard Reddit is not going to fuck us over again 💕,False,False
e9wkt9c,t3_9xoztk,t1_e9wkfo1,gigi-has-issues,1,2018-11-17 13:38:27,/r/EDAnonymous/comments/9xoztk/we_have_been_contacted_by_reddit_admin/e9wkt9c/,Good idea! I just put up the crowdsourced resources but will edit and improve it over time.  I just wanted to get something up soon.,False,True
e9wkfo1,t3_9xoztk,t3_9xoztk,Bomby57,1,2018-11-17 13:34:26,/r/EDAnonymous/comments/9xoztk/we_have_been_contacted_by_reddit_admin/e9wkfo1/,"I dont know if that is possible or even part of the plan, but we should make local contacts for ED institutions. Not everyone lives in the US and that is now necessary in some countries (mine as an example) to give local relevant contacts to people struggling with ED.   Thanks again for the group! ",False,False
e9wh381,t3_9xoztk,t1_e9vqll9,smallest_madeline,1,2018-11-17 13:00:36,/r/EDAnonymous/comments/9xoztk/we_have_been_contacted_by_reddit_admin/e9wh381/,"exactly. Sometimes you actually do need an objective eye to say ""yes you really have lost weight"" when you think you haven't ",False,False
e9wbh0a,t3_9xoztk,t1_e9vqdi9,PandorasMusicalBox,1,2018-11-17 11:55:01,/r/EDAnonymous/comments/9xoztk/we_have_been_contacted_by_reddit_admin/e9wbh0a/,"It was ""no unsolicited recovery advice.""   Continuing your line of questioning, are we going to have to post ""please recover"" on every single post? As in, will that have to be a disclaimer/requirement whenever someone comments?",False,False
e9w9fce,t3_9xoztk,t1_e9w1w2n,woollyshirt,1,2018-11-17 11:31:00,/r/EDAnonymous/comments/9xoztk/we_have_been_contacted_by_reddit_admin/e9w9fce/,"&lt;3 thank you. i know this isn't entirely my fault or anything, but i still wish that reddit admins approached us with these honestly sensible requests instead of banning us and causing so much panic for so many people",False,False
e9w1w2n,t3_9xoztk,t1_e9u8j1q,iuile,1,2018-11-17 09:53:49,/r/EDAnonymous/comments/9xoztk/we_have_been_contacted_by_reddit_admin/e9w1w2n/,"Woolly, you were an amazing mod and always helped out everyone! Please don't apologize for not realising that Reddit would start to cater to their advertisers instead of standing up for free speech and community/emotional support.",False,False
e9vzg0d,t3_9xoztk,t1_e9ueh33,SpankinDaBagel,1,2018-11-17 09:25:53,/r/EDAnonymous/comments/9xoztk/we_have_been_contacted_by_reddit_admin/e9vzg0d/,I never thought going private was going to do much more than isolate us from others. I think we can deal with trolls if it allows more people who need help to find a supportive community. ,False,False
e9vvicc,t3_9xoztk,t1_e9v5wg5,FreeSpeechWarrior,1,2018-11-17 08:44:54,/r/EDAnonymous/comments/9xoztk/we_have_been_contacted_by_reddit_admin/e9vvicc/,"Raddle is not in any way an uncensored site, but if they are willing to accept your community I'm glad to hear that.  It's almost certainly a better option than reddit.",False,False
e9vto78,t3_9xoztk,t1_e9vk3ce,smallest_madeline,1,2018-11-17 08:25:11,/r/EDAnonymous/comments/9xoztk/we_have_been_contacted_by_reddit_admin/e9vto78/,Yeah I wish we all agreed on a place to go that was real. I feel like our group is splintered everywhere. All the forums are too young and way too ~pro ana~. It's like the only options available are encouraging eds (MPA) or recovery online but there's no middle ground where you could just be free and open like r/proed,False,False
e9vrqiv,t3_9xoztk,t1_e9u10pw,talkingdonkeys,1,2018-11-17 08:02:46,/r/EDAnonymous/comments/9xoztk/we_have_been_contacted_by_reddit_admin/e9vrqiv/,Huh TIL being non judgemental is glorifying. Guess now if people are trying to use dangerous weight loss methods we shouldn’t tell them how to do it less dangerously and just shame them. That will go really well. ,False,False
e9vqll9,t3_9xoztk,t1_e9v122r,bumblebatty00,1,2018-11-17 07:48:33,/r/EDAnonymous/comments/9xoztk/we_have_been_contacted_by_reddit_admin/e9vqll9/,"nope keep your body to yourself, be ashamed, don't feel good about it any day whatsoever until you're recovered  also because duh ED == underweight only",False,False
e9vqhqv,t3_9xoztk,t1_e9uo7e3,bumblebatty00,1,2018-11-17 07:47:12,/r/EDAnonymous/comments/9xoztk/we_have_been_contacted_by_reddit_admin/e9vqhqv/,"a wiki with links to major threads could also be useful. I know of city subs that have a wiki with links to threads for things like best restaurants, best things to do in [city], etc",False,False
e9vqdi9,t3_9xoztk,t1_e9ul38t,bumblebatty00,1,2018-11-17 07:45:45,/r/EDAnonymous/comments/9xoztk/we_have_been_contacted_by_reddit_admin/e9vqdi9/,&gt; and not to make any rules discouraging treatment.  There never was one...?,False,False
e9vq9pv,t3_9xoztk,t1_e9ub1ns,bumblebatty00,1,2018-11-17 07:44:29,/r/EDAnonymous/comments/9xoztk/we_have_been_contacted_by_reddit_admin/e9vq9pv/,"&gt; So much archives stuff just gone!!  That might be a good thing, to them.",False,False
e9vq8hm,t3_9xoztk,t1_e9u6wf3,bumblebatty00,1,2018-11-17 07:44:04,/r/EDAnonymous/comments/9xoztk/we_have_been_contacted_by_reddit_admin/e9vq8hm/,I think a wiki could be useful for having a collection of things like this.,False,False
e9vq0uw,t3_9xoztk,t1_e9ut6g4,bumblebatty00,1,2018-11-17 07:41:26,/r/EDAnonymous/comments/9xoztk/we_have_been_contacted_by_reddit_admin/e9vq0uw/,admins are in waaaaaaay over their heads trying to regulate a mental health support group that even educated professionals admit confusion about  waaaaaaaay over their heads. And probably don't care.,False,False
e9vprtz,t3_9xoztk,t1_e9vpnoj,bumblebatty00,1,2018-11-17 07:38:26,/r/EDAnonymous/comments/9xoztk/we_have_been_contacted_by_reddit_admin/e9vprtz/,"or  &gt; person: [vents about struggles, mentions high anxiety because EC stacks and that's a very known common likely shitty side effect] &gt; other person: what's an EC stack?  should we just ignore them? or censor our vents?",False,False
e9vpnoj,t3_9xoztk,t1_e9uel9l,bumblebatty00,1,2018-11-17 07:36:58,/r/EDAnonymous/comments/9xoztk/we_have_been_contacted_by_reddit_admin/e9vpnoj/,"&gt; Telling someone to try it to lose weight?   Did we ever fucking say that?  Mostly I saw EC posts go like this.  &gt; person: learned about EC stacks, how do you use them? what's safe? &gt; other person: [describes the typical dosage and the myriad of side effects and health warnings and dangers]",False,False
e9vp9ct,t3_9xoztk,t1_e9u5v3h,bumblebatty00,1,2018-11-17 07:31:59,/r/EDAnonymous/comments/9xoztk/we_have_been_contacted_by_reddit_admin/e9vp9ct/,"&gt; This is what we have to deal with now. It’s just the reality of it. Let’s make the most of it. I think 90% of the challenge is being mindful of appearances.   I understand this....really, I do. I agree with the changes that need to be made...mostly...and I get it..but  &gt; I never was “encouraged” or triggered by proED but someone without an ED could definitely get the wrong impression by proED.   GET THE FUCK OUT OF OUR SAFE SPACE THEN AND LET US BE. THIS PLACE IS NOT FOR YOU.  *breathes deeply* sorry..",False,False
e9vox7p,t3_9xoztk,t1_e9tzc9f,bumblebatty00,1,2018-11-17 07:27:32,/r/EDAnonymous/comments/9xoztk/we_have_been_contacted_by_reddit_admin/e9vox7p/,"Yeah I'm always careful to not friend minors on peach because it makes me uncomfortable. Then again, I was a teenager suffering with an ED at some point in time. Would have been nice to know some harm reduction advice about protein, water, electrolytes from the older wiser miserables and I felt completely alone, but it's a super fine line. Didn't need to ask tips about hiding it from my parents though, they were completely oblivious :)",False,False
e9volsv,t3_9xoztk,t1_e9uvnbq,bumblebatty00,1,2018-11-17 07:23:32,/r/EDAnonymous/comments/9xoztk/we_have_been_contacted_by_reddit_admin/e9volsv/,&gt;and we lost all of our threads  that actually might be worth it to them,False,False
e9vof32,t3_9xoztk,t1_e9un1jo,bumblebatty00,1,2018-11-17 07:21:08,/r/EDAnonymous/comments/9xoztk/we_have_been_contacted_by_reddit_admin/e9vof32/,"&gt; I guess they'd have to clarify whether they've gotten closer to a healthier weight, um, healthily?  Aaaaand this is why people are worried this is going to be a push recovery on people sub now.",False,False
e9vk3ce,t3_9xoztk,t3_9xoztk,ALittleBitChowderNow,1,2018-11-17 06:18:31,/r/EDAnonymous/comments/9xoztk/we_have_been_contacted_by_reddit_admin/e9vk3ce/,"First, huge thank you to the mod (mods?) who are trying to negotiate this with reddit admin.  Whatever happens to this sub (even if it turns to shit with the new rules) the mod deserves a ton of respect for trying.  Next, we all know that this place is going to change for the worse in its new and ""improved"" reddit-admin-approved state.  If you look at other subs that have been reformed (after being deleted and then agreeing to whatever reddit wanted) they are shells of what they used to be.  (I'm thinking here of research chemicals, SI subs, etc.)  I know we won't have to become a recovery sub per se, but we will have to mimic one so closely that the real support we used to give one another will be gone.   The hammer of censorship will definitely change the dynamics on this sub so that we won't recognize it. I'm really sad to see the culture of proed go because it supported everyone in the current moment of THEIR journey, while always suggesting that the best final outcome was recovery.  Reddit's problem is it couldn't see the subtlety of that message.  Fuck you, reddit admins.",False,False
e9vg8qa,t3_9xoztk,t1_e9u861t,brlouse,1,2018-11-17 05:04:33,/r/EDAnonymous/comments/9xoztk/we_have_been_contacted_by_reddit_admin/e9vg8qa/,"I'm wondering - is there anyway for reddit to just unban the other one and give us a chance to redesign or are they really adamant about not letting it be up anymore? It just seems silly that theyre deleting everything without warning and then making us create a brand new thing from scratch. At the very least, letting the poor other 30 thousand people who haven't found this sub know that we've moved and we're reformatting. Was there any kind of understanding from the reddit admins about what happened? ",False,False
e9vdsb5,t3_9xoztk,t1_e9ueh33,noir-,1,2018-11-17 04:05:12,/r/EDAnonymous/comments/9xoztk/we_have_been_contacted_by_reddit_admin/e9vdsb5/,Don't want lost souls to not be able to find us :(,False,False
e9vdleo,t3_9xoztk,t1_e9v122r,truemearoundyou,1,2018-11-17 04:00:34,/r/EDAnonymous/comments/9xoztk/we_have_been_contacted_by_reddit_admin/e9vdleo/,"the body check posts are going to be... problematic. because if someone looks seriously underweight and everyone is commenting ""you're beautiful! you look great!"" then i guarantee you admin will have an issue.   maybe we just do OOTD threads? so that the focus is more on what we're wearing/how we're feeling? ",False,False
e9vcxxb,t3_9xoztk,t1_e9u5xvg,markexclamationmark,1,2018-11-17 03:42:38,/r/EDAnonymous/comments/9xoztk/we_have_been_contacted_by_reddit_admin/e9vcxxb/,"It sucks to think just a slip of the tongue could land us in hot water. And that kind of thinking makes me, someone with self-diagnosed BED who struggles to stay in the normal weight range, feel ignored. Weight loss IS progress for me :( so we're left with the impression that we so often get from ignorant people, that if you're not underweight you can't have an eating disorder and BED is actually just lack of willpower",False,False
e9vcx0e,t3_9xoztk,t1_e9uv37o,circa90melancholy,1,2018-11-17 03:41:52,/r/EDAnonymous/comments/9xoztk/we_have_been_contacted_by_reddit_admin/e9vcx0e/,Do you remember what the podcast was? ,False,False
e9vcpp8,t3_9xoztk,t3_9xoztk,juniorasparagus13,1,2018-11-17 03:35:33,/r/EDAnonymous/comments/9xoztk/we_have_been_contacted_by_reddit_admin/e9vcpp8/,"If anyone needs treatment scholarships, the Renfrew center has a foundation that provides treatment scholarships. Their number is 1-800-RENFREW",False,False
e9v9t0s,t3_9xoztk,t3_9xoztk,erin281,1,2018-11-17 02:07:32,/r/EDAnonymous/comments/9xoztk/we_have_been_contacted_by_reddit_admin/e9v9t0s/,I got more tips and ideas for restricting from the r/ fasting sub.,False,False
e9v9ffz,t3_9xoztk,t3_9xoztk,erin281,1,2018-11-17 01:54:57,/r/EDAnonymous/comments/9xoztk/we_have_been_contacted_by_reddit_admin/e9v9ffz/,Dear Reddit Admins: we already had that safe space 🤦,False,False
e9v91y5,t3_9xoztk,t1_e9v55um,lightfeathers,1,2018-11-17 01:42:30,/r/EDAnonymous/comments/9xoztk/we_have_been_contacted_by_reddit_admin/e9v91y5/,"I found proed by looking through someone's post history. It wasn't easy to find in the first place, that was years ago though.",False,False
e9v6h08,t3_9xoztk,t1_e9v122r,smallest_madeline,1,2018-11-17 00:25:32,/r/EDAnonymous/comments/9xoztk/we_have_been_contacted_by_reddit_admin/e9v6h08/,It was nice to see people’s outfits and selfies too!,False,False
e9v5wg5,t3_9xoztk,t1_e9u8pg9,dragonoa,1,2018-11-17 00:09:48,/r/EDAnonymous/comments/9xoztk/we_have_been_contacted_by_reddit_admin/e9v5wg5/,"Please people, instead of censoring yourselves and hiding, use this platform to link people to an uncensored site that promises to be a safe space for you all.",False,False
e9v55um,t3_9xoztk,t1_e9upv65,7x-2x,1,2018-11-16 23:50:23,/r/EDAnonymous/comments/9xoztk/we_have_been_contacted_by_reddit_admin/e9v55um/,Tbh I found proed because someone on 1200isplenty mentioned it. They were calling someone out for cross posting or something.,False,False
e9v5280,t3_9xoztk,t1_e9ui0xs,7x-2x,1,2018-11-16 23:47:51,/r/EDAnonymous/comments/9xoztk/we_have_been_contacted_by_reddit_admin/e9v5280/,"One possible pro for going private would be that the mods could make people read the rules before adding them to the sub.  It would (help) prevent people from making rule-breaking posts because they wouldn’t be able to start posting right away.  But that depends on if there are enough mods to consistently write messages to people saying “here are the rules, please let me know when you’ve read them, then I’ll add you.” It would be pretty tedious.",False,False
e9v429n,t3_9xoztk,t1_e9ueh33,GlitterCollarbones,1,2018-11-16 23:23:55,/r/EDAnonymous/comments/9xoztk/we_have_been_contacted_by_reddit_admin/e9v429n/,"Keep it open. We’re still missing so many people, and so many more might find this sub the same way we found proed. We can handle some creeps.",False,False
e9v122r,t3_9xoztk,t3_9xoztk,smallest_madeline,1,2018-11-16 22:18:46,/r/EDAnonymous/comments/9xoztk/we_have_been_contacted_by_reddit_admin/e9v122r/,"What about body checks instead of calling it progress pictures? And strict rules not to say ""good job"" on weight loss?",False,False
e9uxsba,t3_9xoztk,t1_e9uvjux,HoldenCaulfield7,1,2018-11-16 21:15:14,/r/EDAnonymous/comments/9xoztk/we_have_been_contacted_by_reddit_admin/e9uxsba/,Ah I’m sorry that’s awful ,False,False
e9uxnwx,t3_9xoztk,t3_9xoztk,QueenAdreena,1,2018-11-16 21:12:56,/r/EDAnonymous/comments/9xoztk/we_have_been_contacted_by_reddit_admin/e9uxnwx/,Cool.   www.nationaleatingdisorders.org  www.beateatingdisorders.org.uk  www.mind.org.uk/information-support/types-of-mental-health-problems/eating-problems   ,False,False
e9uvnbq,t3_9xoztk,t1_e9u82rk,HoldenCaulfield7,1,2018-11-16 20:37:05,/r/EDAnonymous/comments/9xoztk/we_have_been_contacted_by_reddit_admin/e9uvnbq/,Right? They just deleted an entire community and we lost all of our threads... it’s sad they didn’t reach out to mods before deleting it ,False,False
e9uvjux,t3_9xoztk,t1_e9uvf1t,gigi-has-issues,1,2018-11-16 20:35:25,/r/EDAnonymous/comments/9xoztk/we_have_been_contacted_by_reddit_admin/e9uvjux/,"2 years after being hardcore bulimic (teenager) I needed 17 fillings. I’ve had several more since being an adult but never that many again. To be fair, I grew up in a country without fluoride added to the water. ",False,True
e9uvf1t,t3_9xoztk,t1_e9u75vy,HoldenCaulfield7,1,2018-11-16 20:33:05,/r/EDAnonymous/comments/9xoztk/we_have_been_contacted_by_reddit_admin/e9uvf1t/,How many years were you bulimic when it started to affect your teeth? I haven’t had anything major yet but I’m waiting on it. It’s been 7 years of it for me :(,False,False
e9uvalt,t3_9xoztk,t3_9xoztk,rejected_desk_puppy,1,2018-11-16 20:30:59,/r/EDAnonymous/comments/9xoztk/we_have_been_contacted_by_reddit_admin/e9uvalt/,I say if you decide to go private wait a while so all the lost babies can find us ,False,False
e9uv37o,t3_9xoztk,t1_e9u10pw,HoldenCaulfield7,1,2018-11-16 20:27:19,/r/EDAnonymous/comments/9xoztk/we_have_been_contacted_by_reddit_admin/e9uv37o/,"I was just listening to a podcast about getting through trauma, pain and even dealing with grief. Humour is one of the best ways to get through it. It’s no joke when people say laughter is the best medicine. It truly is. I think we should be able to laugh at our struggles because it’s healing and cathartic for many of us. Thank you for communicating with admins. ",False,False
e9uu25j,t3_9xoztk,t1_e9u75vy,bumblebatty00,1,2018-11-16 20:08:54,/r/EDAnonymous/comments/9xoztk/we_have_been_contacted_by_reddit_admin/e9uu25j/,I wish harm reduction and support for WHERE YOU ARE was understood better. Sadly it looks like where you are is banned until you're better.. that's not helpful,False,False
e9utyoc,t3_9xoztk,t1_e9u10pw,bumblebatty00,1,2018-11-16 20:07:12,/r/EDAnonymous/comments/9xoztk/we_have_been_contacted_by_reddit_admin/e9utyoc/,"Can they not understand how dark humor, self deprecating humor, can be a thing that makes life bearable? Is there no compassion for not being perfect? It breaks my heart. I was starving and alone before. Proed made me starving and not alone and it made it more bearable and let me see the abuse was I was going through was not normal. I just. It's just lost on others. Don't isolate us further than the disease already does.",False,False
e9ut6g4,t3_9xoztk,t1_e9uix7e,GimmeYourHands,1,2018-11-16 19:53:10,/r/EDAnonymous/comments/9xoztk/we_have_been_contacted_by_reddit_admin/e9ut6g4/,Please believe me my frustrations are not at all at anyone in this community. I can see you guys are doing your level best to work something out. I’m just frustrated the admins are being so vague about this with you guys.   I really feel for the position you’re in.,False,False
e9ut29d,t3_9xoztk,t1_e9uq8xd,gigi-has-issues,1,2018-11-16 19:51:08,/r/EDAnonymous/comments/9xoztk/we_have_been_contacted_by_reddit_admin/e9ut29d/,Agree. ,False,True
e9usr1h,t3_9xoztk,t3_9xoztk,Rosietaylo,1,2018-11-16 19:45:40,/r/EDAnonymous/comments/9xoztk/we_have_been_contacted_by_reddit_admin/e9usr1h/,"Ah alright, makes sense ",False,False
e9ushhg,t3_9xoztk,t3_9xoztk,aceshighsays,1,2018-11-16 19:40:51,/r/EDAnonymous/comments/9xoztk/we_have_been_contacted_by_reddit_admin/e9ushhg/,So... why didn't the admin contact r/proed re the issue bf shutting it down? New rules could have been implemented then. I think their goal was to decrease the community. We are about 10% what we were before.,False,False
e9us74m,t3_9xoztk,t1_e9uhkmu,bumblebatty00,1,2018-11-16 19:35:42,/r/EDAnonymous/comments/9xoztk/we_have_been_contacted_by_reddit_admin/e9us74m/,"I think there are a lot of problematic things that could be removed from the previous sub. Goal weights, daily calorie counts, weekly progress pics. I think proed did a good thing about eliminating thinspo posts. Those other daily or weekly posts I understand are enabling and problematic, and I understand it is part of the disorder to have a nice place to post that. But I don't think too much is lost from removing that though.  What I think was very lost from just straight up banning was 1) people in the depths of this disorder are going to search ""proed"" and not finding such a hard reduction focused, supportive community is going to HURT people 2) these discussions about how to reduce enabling problematic things could have been done by an open dialogue before banning, and 32,000 people suffering were not given that opportunity",False,False
e9uri90,t3_9xoztk,t1_e9uix7e,eternalcoffeebreak,1,2018-11-16 19:23:28,/r/EDAnonymous/comments/9xoztk/we_have_been_contacted_by_reddit_admin/e9uri90/,Every bit of effort you guys are putting into maintaining this community is appreciated. Let’s hope the admins are willing to listen to your perspective and input and the sub can continue to have a widespread positive impact. ,False,False
e9uqpqz,t3_9xoztk,t1_e9ueh33,NoaahFoster,1,2018-11-16 19:09:42,/r/EDAnonymous/comments/9xoztk/we_have_been_contacted_by_reddit_admin/e9uqpqz/,It would be way too hard for lost ED sufferers in need to find it if it went private,False,False
e9uq95d,t3_9xoztk,t1_e9u8pg9,FreeSpeechWarrior,1,2018-11-16 19:01:58,/r/EDAnonymous/comments/9xoztk/we_have_been_contacted_by_reddit_admin/e9uq95d/,"&gt; Censorship is never over for those who have experienced it. It is a brand on the imagination that affects the individual who has suffered it, forever. &gt; &gt; — Nadine Gordimer",False,False
e9uq8xd,t3_9xoztk,t1_e9u4sq7,bumblebatty00,1,2018-11-16 19:01:51,/r/EDAnonymous/comments/9xoztk/we_have_been_contacted_by_reddit_admin/e9uq8xd/,Would have been nice if a dialogue was opened up before going ban hammer,False,False
e9uq60j,t3_9xoztk,t1_e9ueh33,bumblebatty00,1,2018-11-16 19:00:29,/r/EDAnonymous/comments/9xoztk/we_have_been_contacted_by_reddit_admin/e9uq60j/,I don't see a pro for going private.. People looking for help and support are more important imo,False,False
e9upv65,t3_9xoztk,t1_e9uheo5,-dreams-,1,2018-11-16 18:55:18,/r/EDAnonymous/comments/9xoztk/we_have_been_contacted_by_reddit_admin/e9upv65/,"definitely this, if it wasn't for /r/proed being open before I never would have been able to find this whole community ",False,False
e9uposq,t3_9xoztk,t3_9xoztk,FreeSpeechWarrior,1,2018-11-16 18:52:27,/r/EDAnonymous/comments/9xoztk/we_have_been_contacted_by_reddit_admin/e9uposq/,"Reddit's admins are lying scumbags and not to be trusted.  Some promises reddit has made in the past:  &gt; At reddit we care deeply about not imposing ours or anyone elses’ opinions on how people use the reddit platform. We are adamant about not limiting the ability to use the reddit platform even when we do not ourselves agree with or condone a specific use. &gt; &gt; ... &gt; &gt; We will tirelessly defend the right to freely share information on reddit in any way we can, even if it is offensive or discusses something that may be illegal.  &gt; &gt; ... &gt; &gt; We stand for free speech. This means we are not going to ban distasteful subreddits. We will not ban legal content even if we find it odious or if we personally condemn it. Not because that's the law in the United States - because as many people have pointed out, privately-owned forums are under no obligation to uphold it - but because we believe in that ideal independently, and that's what we want to promote on our platform. We are clarifying that now because in the past it wasn't clear, and (to be honest) in the past we were not completely independent and there were other pressures acting on reddit. Now it's just reddit, and we serve the community, we serve the ideals of free speech, and we hope to ultimately be a universal platform for human discourse",False,False
e9up15q,t3_9xoztk,t1_e9uohhc,NeutralSmithHotel,1,2018-11-16 18:42:03,/r/EDAnonymous/comments/9xoztk/we_have_been_contacted_by_reddit_admin/e9up15q/,"Yeah, I'm not all the way recovered, but honestly I would have probably pushed down much much lower if not for the sub. I totally agree that it is a hard line to walk... you don't want people to be encouraging people to harm themselves, but you also need to allow people to talk about some hard things. I hope we can make this new one work. I have a colleague who is still really struggling and this is the only place she can go besides talking to me and she REALLY needs it. ",False,False
e9uoj11,t3_9xoztk,t3_9xoztk,crodka,1,2018-11-16 18:34:31,/r/EDAnonymous/comments/9xoztk/we_have_been_contacted_by_reddit_admin/e9uoj11/,For New Zealanders: https://www.ed.org.nz ,False,False
e9uohhc,t3_9xoztk,t1_e9uo1vh,gigi-has-issues,1,2018-11-16 18:33:53,/r/EDAnonymous/comments/9xoztk/we_have_been_contacted_by_reddit_admin/e9uohhc/,Likewise. I still have issues but am at least no longer purging regularly thanks to the old sub. The mods are just trying to make sure we have an easily accessible place to share our feelings without getting banned. It’s a tight rope to walk because most people don’t understand. I know it’s not ideal and I wish the old sub wasn’t banned but we need to deal with the fact it was. ,False,True
e9uob2x,t3_9xoztk,t1_e9uo7e3,HitchHikeHawk,1,2018-11-16 18:31:14,/r/EDAnonymous/comments/9xoztk/we_have_been_contacted_by_reddit_admin/e9uob2x/,Ok great! Sounds good with me!,False,False
