Comment ID,Link ID,Parent ID,Author,Score,Publish Date,Permalink,Text,Stickied,Is Submitter
erhdrry,t3_c22xz7,t3_c22xz7,thatwasprettydumb,1,2019-06-18 10:51:55,/r/EDAnonymous/comments/c22xz7/i_find_recovery_difficult_to_accept_because_its/erhdrry/,"I so get where you're coming from, and my biggest fear is going to a dietician who secretly just wants me to get really big (even though this is definitely an irrational fear because no good trained professional would do this).  And even though I can't follow my own advice/thoughts, I really do believe that being overweight and mentally healthy can be better than being normal and super stressed/tired/obsessed with food.  So in some cases, yes, there is 'too big', but if someone can live a happy life carrying around a few extra pounds it's better in the long run.",False,False
erhbxj6,t3_c22xz7,t3_c22xz7,livipup,1,2019-06-18 10:32:41,/r/EDAnonymous/comments/c22xz7/i_find_recovery_difficult_to_accept_because_its/erhbxj6/,"Don't worry about other people. Focus on your health. It's hard for your body to maintain itself while underweight. Losing hair is just the first sign that something is wrong it tends to happen pretty early. At my lowest weight my BMI was still above 16 and I was losing a lot of hair. I'm back to a healthy weight now, only had to gain 15 lbs from my lowest weight, and I'm noticing hair regrowth now. My hair hardly ever sheds. There will also be broken strands of course, but I stop just losing hair constantly. In terms of things that are less noticable my chest stopped feeling tight, I don't experience frequent numbness in my extremities anymore, I'm not as lethargic all the time (*I do have other health issues which contribute to this one though so that hasn't entirely stopped, rather just improved*), and I don't feel quite as cold as I used to.",False,False
erhbu0o,t3_c22xz7,t3_c22xz7,rdnvl,1,2019-06-18 10:31:38,/r/EDAnonymous/comments/c22xz7/i_find_recovery_difficult_to_accept_because_its/erhbu0o/,"The only ""fat logic"" that bothers me is metabolic damage and set point theory -- and only because they give me terrible anxiety. I don't really care about how set point theory works I just don't want to hear it at all, however irrational that makes me.",False,False
erhbs9m,t3_c22xz7,t3_c22xz7,DelicateBones,1,2019-06-18 10:31:07,/r/EDAnonymous/comments/c22xz7/i_find_recovery_difficult_to_accept_because_its/erhbs9m/,This resonates with me on a spiritual level and these are the reasons why recovery is such a challenging thing for me to try and push myself towards.,False,False
erha1b1,t3_c22xz7,t3_c22xz7,whonoses,1,2019-06-18 10:12:17,/r/EDAnonymous/comments/c22xz7/i_find_recovery_difficult_to_accept_because_its/erha1b1/,BMI looks horrendous on me. But in the other way. Too fat.,False,False
erha0mt,t3_c22xz7,t3_c22xz7,lotsofsqs,1,2019-06-18 10:12:04,/r/EDAnonymous/comments/c22xz7/i_find_recovery_difficult_to_accept_because_its/erha0mt/,"But *your* recovery doesn't have to be associated with fat logic and pseudoscience.  CICO being real doesn't mean you can also eat intuitively and not obsess over food.  Recovery doesn't mean you become obese, it means you become at peace with food. Forget about what Karen is saying -- she's a moron.",False,False
