Comment ID,Link ID,Parent ID,Author,Score,Publish Date,Permalink,Text,Stickied,Is Submitter
egx7sru,t3_as41go,t3_as41go,shittypebbles,1,2019-02-20 19:29:36,/r/EDAnonymous/comments/as41go/youth_and_thinness_matter_more_than_everything/egx7sru/,"It's like St Vincent's Los Ageless    ""How can anybody have you and lose you and not lose their minds?""",False,False
egtcmcw,t3_as41go,t3_as41go,thinandmint,1,2019-02-19 11:36:22,/r/EDAnonymous/comments/as41go/youth_and_thinness_matter_more_than_everything/egtcmcw/,"I feel this so hard but then again back when I was skinny, after the attention high wore off, I realized all these people are superficial and only after my looks which are fleeting af and that really got me down too. I still desperately envied the average looking girls who had true friends and loving boyfriends and somehow didn't care that they had a little pooch or some thigh fat and magically the people around them didn't seem to care either?  I think the main issue is feeling like I didn't have inherent worth so I needed to make up for it by being as superficially attractive as possible. And then I look at those happy girls and I wonder why they DO have that inherent worth and don't even need to worry about all this shit. ",False,False
egt3bz1,t3_as41go,t1_egrnue1,throwawayourfood,1,2019-02-19 09:52:37,/r/EDAnonymous/comments/as41go/youth_and_thinness_matter_more_than_everything/egt3bz1/,"Yeah I've noticed the prettier girls I know end up getting ""used"" and played a lot, or not taken seriously... the bigger/less attractive ones who managed to get good jobs and loving husbands :/ I want to be thin, of course, but I do think aside from superficial first-look ""niceness"" it's not all that great. Adriana Lima ended up getting a divorce and left with 2 kids alone, many models who were tossed aside for their smarter, older counterpart (Clooney's ex's vs his current wife for example), and most successful billionaires with steady marriages have wives that are about the same in looks as them... i.e. Bill Gates, Zucc.  There is definitely more pressure against women in the silliest of things, but I remember the reality around me and realize maybe it's not all what it seems.",False,False
egt0hwu,t3_as41go,t1_egs3kjd,button_eyed_coraline,1,2019-02-19 09:19:27,/r/EDAnonymous/comments/as41go/youth_and_thinness_matter_more_than_everything/egt0hwu/,"I’ve always been a really smiley person, but now that I’m skinny again I can’t smile at some men without them taking it as an invitation to be creepy. I don’t smile so much now. ",False,False
egsvp59,t3_as41go,t3_as41go,ravenclawmouse,1,2019-02-19 08:16:32,/r/EDAnonymous/comments/as41go/youth_and_thinness_matter_more_than_everything/egsvp59/,"It's such a sad reality because I can say fuck the patriarchy but then here I am, existing in the world as woman chasing thinness and youth. I can go on about everything wrong with society and how it's fucked, but in the end, I don't want to loose the benefits of playing into it. Wanting to be thin to be attractive isn't how i got into this mess, but it's not like I don't want that as well. ",False,False
egsuua7,t3_as41go,t3_as41go,_vindication,1,2019-02-19 08:04:19,/r/EDAnonymous/comments/as41go/youth_and_thinness_matter_more_than_everything/egsuua7/,"I've been there. And i went back. I don't want to sound cynical. I don't feel like its right to agree with you but I do. I have been on both sides and after a few years of telling myself it's fine, recovery is always better, I've come to the sad realization that I will never be as loved unless I fit a certain ideal. I never thought I would relapse again and the last two weeks have just rapidly gone downhill and yet I love it. I've done this enough to know I WONT love it in say, four months, but I honestly don't give a fuck. I just want to be thin and pretty again. I want people to be kind to me. I want my husband to state at me and tell me I'm beautiful  again. I know I sound shallow. Crazy how much your mindset can change in a month.",False,False
egsqcfj,t3_as41go,t3_as41go,rachihc,1,2019-02-19 06:52:45,/r/EDAnonymous/comments/as41go/youth_and_thinness_matter_more_than_everything/egsqcfj/,Is a fucked up world we life in huh... ,False,False
egslnl1,t3_as41go,t3_as41go,giraffle9,1,2019-02-19 05:10:46,/r/EDAnonymous/comments/as41go/youth_and_thinness_matter_more_than_everything/egslnl1/,"That's what I thought too.  Until you're sad and tired all the time and you can't go on a date without spending 5 minutes ordering a salad to your specifications and taking the rest home. And your skin will wrinkle and you'll get extra hair all over your body, your breath will start to get bad. you won't be able to hold a proper conversation. You can't really go to the beach or on hikes because you'll get tired.  You can be beautiful and smart at the same time, you can be skinny and have a good social life, but you can't really have an ED and have anything else in life. ",False,False
egs8ujr,t3_as41go,t3_as41go,kilpi_kona,1,2019-02-18 23:53:50,/r/EDAnonymous/comments/as41go/youth_and_thinness_matter_more_than_everything/egs8ujr/,It can feel like that from a distorted ed mindset but seriously there's so much more to life than your appearance. I've wasted most of my life hating myself and I regret it more than anything. I'm 25 and wish I hadn't had an ed for the last 15 years because it hasn't brought me anything I value at this point. Being pretty or fuckable to men is worthless to me now and I'm jealous of people who can be okay with themselves and work on their qualities that actually matter. It's so fucked up young girls have to go through this,False,False
egs3kjd,t3_as41go,t3_as41go,dumplingbby,1,2019-02-18 22:25:42,/r/EDAnonymous/comments/as41go/youth_and_thinness_matter_more_than_everything/egs3kjd/,"people smile at me in public now it's wild, i don't know how to get used to it ",False,False
egrzmya,t3_as41go,t1_egrnue1,trixieevans,1,2019-02-18 21:27:57,/r/EDAnonymous/comments/as41go/youth_and_thinness_matter_more_than_everything/egrzmya/,"Not the OP but ugh I needed to see this comment so badly right now. Thank you so much &lt;3 hope you are being kind to yourself as well, you are worth it! ",False,False
egrzawt,t3_as41go,t3_as41go,circa90melancholy,1,2019-02-18 21:23:17,/r/EDAnonymous/comments/as41go/youth_and_thinness_matter_more_than_everything/egrzawt/,"I really used to despise thinking of myself as yet another cog in the machine, unable to act outside of it, only within it, influenced by whatever happens within it.  I had this false conception that I simply wasn't affected by what larger society wanted, and while I still can not give any less of a shit about a lot of body ideals, this post made me realize that it's undeniable that I care about some of them.   It's really sad things are this way; that whether a person is conscious of it or not - and at this point I'm not fond of assuming it's confidence first that made the difference - they judge what invisible qualities the person has based on what they look like. No one should have to feel bad about something that's largely out of their control, and it's really a shame that often this extends to personal value. No one should have to feel like they're nothing for not reaching a standard that most will probably fall out of simply by aging. ",False,False
egrxu2s,t3_as41go,t3_as41go,OkWorking7,1,2019-02-18 21:03:01,/r/EDAnonymous/comments/as41go/youth_and_thinness_matter_more_than_everything/egrxu2s/,Is it possible your attitude and confidence has changed or increased without you realising? Maybe you’re easier to approach now and more open to speaking with people and speaking publicly?   Idk what your self worth was like before vs now but it could be that losing weight means you don’t second guess yourself as much etc. and therefore you’re noticing positive interactions more than negative ones. ,False,False
egrrry5,t3_as41go,t1_egrrl0j,Hfgxejm,1,2019-02-18 19:40:59,/r/EDAnonymous/comments/as41go/youth_and_thinness_matter_more_than_everything/egrrry5/,You too ❤😢,False,False
egrrqlz,t3_as41go,t3_as41go,SmolCoffeeCat,1,2019-02-18 19:40:30,/r/EDAnonymous/comments/as41go/youth_and_thinness_matter_more_than_everything/egrrqlz/,I noticed this too when I first lost weight and it just makes me sad that many people are so incredibly shallow,False,False
egrrl0j,t3_as41go,t1_egrre4m,fatpigeon_,1,2019-02-18 19:38:26,/r/EDAnonymous/comments/as41go/youth_and_thinness_matter_more_than_everything/egrrl0j/,"Big mood, I’m one big stressor from just ending it all. Maybe this is not a bad time to be a “coward”, hang in there ❤️",False,True
egrre4m,t3_as41go,t3_as41go,Hfgxejm,1,2019-02-18 19:35:51,/r/EDAnonymous/comments/as41go/youth_and_thinness_matter_more_than_everything/egrre4m/,These are my thoughts when I can't help thinking about killing myself. Too bad i'm a coward and don't have the willpower.,False,False
egrnwny,t3_as41go,t3_as41go,grandeicedcovfefe,1,2019-02-18 18:47:47,/r/EDAnonymous/comments/as41go/youth_and_thinness_matter_more_than_everything/egrnwny/,I feel this on the daily. I’m nearing 30 and the thought of losing my youth gives me extreme anxiety. ,False,False
egrnue1,t3_as41go,t3_as41go,icy271,1,2019-02-18 18:46:53,/r/EDAnonymous/comments/as41go/youth_and_thinness_matter_more_than_everything/egrnue1/,Being physically attractive and having men consider you 'fuckable' may make life easier but it does NOT determine your worth as a person. Not eating and spending 2 hours on skincare and makeup a day does not equal taking care of yourself. Taking care of yourself is realizing you have worth regardless of your attractiveness to others. Be kind to yourself please &lt;3,False,False
egrmpbv,t3_as41go,t3_as41go,kissmyshrinkingass,1,2019-02-18 18:30:59,/r/EDAnonymous/comments/as41go/youth_and_thinness_matter_more_than_everything/egrmpbv/,"If you tell me, let me know. It's the shitty reality of our society and it sucks ass ",False,False
