Comment ID,Link ID,Parent ID,Author,Score,Publish Date,Permalink,Text,Stickied,Is Submitter
f4s9lln,t3_dlkza5,t1_f4rubsp,mmiphaaa,1,2019-10-22 15:23:01,/r/EDAnonymous/comments/dlkza5/can_i_somehow_prevent_the_risk_of_heart_attacks/f4s9lln/,"Thanks for the fix, English isn't my first language so I get terms mixed up sometimes. I will follow your advice, and make an appointment tomorrow.",False,True
f4rubsp,t3_dlkza5,t3_dlkza5,etherealaqua,1,2019-10-22 14:14:54,/r/EDAnonymous/comments/dlkza5/can_i_somehow_prevent_the_risk_of_heart_attacks/f4rubsp/,"don’t quote me on this, but “heart disease” is something different entirely (I think). what’s happening here is your heart is quite literally shrinking from malnutrition and growing weaker and weaker until ultimately it will fail entirely. this is heart failure. and you will die. please please be entirely honest with your doctor and if they won’t listen to you; find one who will, and/or take yourself to the hospital xx",False,False
f4rdpbh,t3_dlkza5,t1_f4rb2ou,mmiphaaa,1,2019-10-22 12:42:52,/r/EDAnonymous/comments/dlkza5/can_i_somehow_prevent_the_risk_of_heart_attacks/f4rdpbh/,"Thanks for the advice, I think I'm gonna try to make an appointment tomorrow. I'm not really on good terms with my doctor regarding my eating habits but she might be able to help me with the heart palpitations. I just hope it's anxiety related..",False,True
f4rcyon,t3_dlkza5,t3_dlkza5,3cats_in_atrenchcoat,1,2019-10-22 12:38:29,/r/EDAnonymous/comments/dlkza5/can_i_somehow_prevent_the_risk_of_heart_attacks/f4rcyon/,"Seconding the other comment, you’re best bet is to get things checked out by a doctor. They might be able to help with medication, recommendations and at the very least can run tests and give you more information",False,False
f4rb2ou,t3_dlkza5,t3_dlkza5,SpaceWhale88,1,2019-10-22 12:26:55,/r/EDAnonymous/comments/dlkza5/can_i_somehow_prevent_the_risk_of_heart_attacks/f4rb2ou/,"Get a checkup and see what your blood pressure and pulse are.   Unfortunately there's no way to fully reverse heart damage, depending on how bad it is and they only way to prevent more damage is to maintain a higher weight if you are currently underweight.",False,False
