Comment ID,Link ID,Parent ID,Author,Score,Publish Date,Permalink,Text,Stickied,Is Submitter
eji0gql,t3_b5yqd7,t1_ejh7m7a,dwaiiiii,1,2019-03-27 10:14:57,/r/EDAnonymous/comments/b5yqd7/kcal_to_cal/eji0gql/,Yeah I think you’re right!! It seems as if it’s a typo. Ugh I should’ve checked properly before I ate it...thank you so much!!,False,True
ejh7m7a,t3_b5yqd7,t3_b5yqd7,altoristics,1,2019-03-27 00:50:54,/r/EDAnonymous/comments/b5yqd7/kcal_to_cal/ejh7m7a/,"kilocalories and Calories (upper case C) are the same thin, we just refer to them both as calories in food. I think you may have seen either a typo (410 and 140 with the 1 and 4 switched around) or it could be kilojoules (caloriesx4.2 essentially).",False,False
ejgxx37,t3_b5yqd7,t3_b5yqd7,animperfectangel,1,2019-03-26 22:05:33,/r/EDAnonymous/comments/b5yqd7/kcal_to_cal/ejgxx37/,maybe kilojoules?,False,False
ejgw6nf,t3_b5yqd7,t3_b5yqd7,meimeiya,1,2019-03-26 21:42:29,/r/EDAnonymous/comments/b5yqd7/kcal_to_cal/ejgw6nf/,"they should be the same (it's ""Calorie"" with a capital that's different), it's possible that it's a typo, since they have the same numbers and all. do you know what kind of snack it is? or if not, you can take a photo and upload to imgur and then post the link here",False,False
ejguy4y,t3_b5yqd7,t3_b5yqd7,Hairless_Human,1,2019-03-26 21:26:39,/r/EDAnonymous/comments/b5yqd7/kcal_to_cal/ejguy4y/,:O i thought they were the same aswell just different ways to say it. Following.,False,False
