Comment ID,Link ID,Parent ID,Author,Score,Publish Date,Permalink,Text,Stickied,Is Submitter
fi8draf,t3_f5smxm,t1_fi0us16,zumlepurzo,1,2020-02-20 16:39:00,/r/EDAnonymous/comments/f5smxm/dae_feel_like_if_you_could_just_get_to_your_ugw/fi8draf/,Thanks,False,False
fi365wy,t3_f5smxm,t1_fi1rdsm,villager43,1,2020-02-19 03:00:31,/r/EDAnonymous/comments/f5smxm/dae_feel_like_if_you_could_just_get_to_your_ugw/fi365wy/,"I feel this one, I want to recover, but I don’t want to lose control.",False,False
fi32azx,t3_f5smxm,t3_f5smxm,sunsetlover19,1,2020-02-19 01:35:08,/r/EDAnonymous/comments/f5smxm/dae_feel_like_if_you_could_just_get_to_your_ugw/fi32azx/,"Yes I do, only in some moments though. My perspective towards both my problem and 'when' or 'if' I'll be ready for recovery seems to be different everyday. This is why the nature of eating disorders are dangerous. Your mind convinces you that you need to reach a certain standard weight wise in order to have willingness for recovery and accept help.   If you think about it from a logical standpoint, that way of thinking is completely distorted. Take no offense to this but in my view, recovery should be an attempt to getting better. While a lot of us myself included have tried to make ourselves sicker and deeper into our eating disorders just so we feel we can get help? It doesn't make any sense to me. In doing this we are actually letting our eating disorders win and we only lose almost everything in the process (we lose our health, our friends and family, our sanity sometimes even).   The ""when I'll be ready for recovery"" is controversial to many. I am starting to think an ugw is just an illusion and the eating disorders' way to keep me ill. I reach my desired weight and mostly conclude that I am unhappy and unsatisfied with it. I feel like the stigma of eating disorders is also what prevents a lot of people from getting help or support. I find this sad and unfortunate, it shouldn't be that way at all and I hope it changes one day.",False,False
fi2u90p,t3_f5smxm,t3_f5smxm,youryuumtsau,1,2020-02-18 23:14:47,/r/EDAnonymous/comments/f5smxm/dae_feel_like_if_you_could_just_get_to_your_ugw/fi2u90p/,Omg meeeee. But let’s be honest. We all clowns here thinking we will recover after we hit our goal weight.,False,False
fi2dqpq,t3_f5smxm,t3_f5smxm,Gees_sass,1,2020-02-18 19:56:32,/r/EDAnonymous/comments/f5smxm/dae_feel_like_if_you_could_just_get_to_your_ugw/fi2dqpq/,I mean... yeah? If I reached my gw by restricting/purging and then exercised alot to maintain it? That's healthy right?,False,False
fi2bkri,t3_f5smxm,t3_f5smxm,serendipitousbluejay,1,2020-02-18 19:32:43,/r/EDAnonymous/comments/f5smxm/dae_feel_like_if_you_could_just_get_to_your_ugw/fi2bkri/,"That’s what I thought, until i reached my first (totally unsustainable UGW) and immediately thought: wow that’s it? huh better lose even more weight in case I gain weight in recovery. I don’t think the cycle ends.",False,False
fi2a8dq,t3_f5smxm,t1_fi1kg2s,MarieAmber,1,2020-02-18 19:18:03,/r/EDAnonymous/comments/f5smxm/dae_feel_like_if_you_could_just_get_to_your_ugw/fi2a8dq/,No matter my weight I always believed I was a “phony” because I wasn’t in the hospital every day or being rushed by ambulance or I wasn’t fainting and hurting myself. All I did was restrict and waste my day in bed.,False,False
fi2a4dy,t3_f5smxm,t1_fi1rdsm,MarieAmber,1,2020-02-18 19:16:51,/r/EDAnonymous/comments/f5smxm/dae_feel_like_if_you_could_just_get_to_your_ugw/fi2a4dy/,"For me, my idea of recovery is being at a healthy weight and able to not eat too much. However, I’ve been in the underweight area and still had the same “recovery idea.” Whenever I asked myself if that meant no more restricting, I couldn’t imagine that. How could I eat normally if I’ll just blow up after all my hard work?   So basically recovery, to me, was meant to make others think I was healthy and okay when I really wasn’t.",False,False
fi29vlg,t3_f5smxm,t1_fi0gs58,MarieAmber,1,2020-02-18 19:14:09,/r/EDAnonymous/comments/f5smxm/dae_feel_like_if_you_could_just_get_to_your_ugw/fi29vlg/,I had the same feeling. I hit a couple and my final goal just kept going lower and lower. Kept asking myself how low could I go before I get too sickly that it’ll be obvious even through my clothes?,False,False
fi29iby,t3_f5smxm,t1_fi0s9wx,Elliedee1,1,2020-02-18 19:09:56,/r/EDAnonymous/comments/f5smxm/dae_feel_like_if_you_could_just_get_to_your_ugw/fi29iby/,"It’s uncanny how similar it the mechanism is to my drug addiction that I’m now in recovery from (3 years ). I don’t think I could honestly say I WANTED to recover, I felt like I had to once I decided I really didn’t want to die that way yet. But I still don’t want to stop doing the drugs. I just resist because I knew I was losing my chance to move forward very fucking quickly .       Same thing with my ED. I still want to fuck around with food but I don’t want “that life”. So I’m trying to resist.",False,False
fi22m6l,t3_f5smxm,t3_f5smxm,robotsintrees,1,2020-02-18 17:54:11,/r/EDAnonymous/comments/f5smxm/dae_feel_like_if_you_could_just_get_to_your_ugw/fi22m6l/,"I never had a goal weight; ED just wants lower, less. &gt;!I got down to 60lbs as a 31 year old man. I'm currently maintaining \~82lbs and ED says it's too much because it's not 60.!&lt;",False,False
fi21jn0,t3_f5smxm,t3_f5smxm,thesugarbowl,1,2020-02-18 17:42:44,/r/EDAnonymous/comments/f5smxm/dae_feel_like_if_you_could_just_get_to_your_ugw/fi21jn0/,I did get to my UGW and I still wasn't thin enough. I panicked and then gained back ten pounds 🤷🏾‍♀️,False,False
fi20fcm,t3_f5smxm,t3_f5smxm,myEDNOSaccount,1,2020-02-18 17:30:58,/r/EDAnonymous/comments/f5smxm/dae_feel_like_if_you_could_just_get_to_your_ugw/fi20fcm/,Ye i feel like I'd magically eat at maintenance once i reach my gw,False,False
fi1v7r9,t3_f5smxm,t3_f5smxm,x24throwaway,1,2020-02-18 16:37:40,/r/EDAnonymous/comments/f5smxm/dae_feel_like_if_you_could_just_get_to_your_ugw/fi1v7r9/,Yes. I decided this year I’m getting to my ugw no matter what and then I’ll recover.,False,False
fi1sn1t,t3_f5smxm,t3_f5smxm,jar-fish,2,2020-02-18 16:12:57,/r/EDAnonymous/comments/f5smxm/dae_feel_like_if_you_could_just_get_to_your_ugw/fi1sn1t/,Well... i can accept recovering at the weight I was before I started really having trouble with disordered eating but I can’t for the life of me do it at a higher weigh. I tried recovering at a weight that I was more or less okay with just to gain super fast and I was so uncomfortable I couldn’t sleep because I would be hyper aware of all the fat I wasn’t used to having. It took like 2 weeks for my body to gain 13-15lbs and it made such a huge difference I can’t believe it.. like I was still at a healthy weight but it’s crazy how different it feels. However that experience was super recent and made me relapse like crazy so yeah...I guess you either need to take things slow or really work through the mental part as much as possible with a specialist or you end up scarred emotionally.,False,False
fi1sacn,t3_f5smxm,t3_f5smxm,someone52207,2,2020-02-18 16:09:38,/r/EDAnonymous/comments/f5smxm/dae_feel_like_if_you_could_just_get_to_your_ugw/fi1sacn/,"In actually finally told my therapist about my ED shit when I hit my UGW. I'm not recovery ready, but also aware that my UGW was not good enough to make me happy and something needed to change",False,False
fi1rsa4,t3_f5smxm,t3_f5smxm,[deleted],1,2020-02-18 16:04:55,/r/EDAnonymous/comments/f5smxm/dae_feel_like_if_you_could_just_get_to_your_ugw/fi1rsa4/,[deleted],False,False
fi1rdsm,t3_f5smxm,t1_fi0tle5,LowCalPal,1,2020-02-18 16:01:09,/r/EDAnonymous/comments/f5smxm/dae_feel_like_if_you_could_just_get_to_your_ugw/fi1rdsm/,"In my anecdotal experience, I want to recover, but I don't want it all the time.  I told my treatment team this when I started treatment, and they said that was completely normal.  I've found that the longer I'm in treatment and just DO the recovery activities the best I can, whether I feel like it or not, the greater part of me wants to recover.",False,False
fi1r6mw,t3_f5smxm,t3_f5smxm,flannelfuk,1,2020-02-18 15:59:20,/r/EDAnonymous/comments/f5smxm/dae_feel_like_if_you_could_just_get_to_your_ugw/fi1r6mw/,WHOLE ASS REASON WHY I WONT RECOVER. i fantasize about recovering all the time and then im like well wait i could always lose the weight then maintain it in a healthy way,False,False
fi1r3cv,t3_f5smxm,t1_fi0hswd,LowCalPal,2,2020-02-18 15:58:30,/r/EDAnonymous/comments/f5smxm/dae_feel_like_if_you_could_just_get_to_your_ugw/fi1r3cv/,"It makes me think of the Zeno's Paradox, where you can never quite reach the finish line, because you have to get halfway there first, and no matter how close you are, there's always another halfway point between you and the end",False,False
fi1qz7m,t3_f5smxm,t3_f5smxm,Spectrachic311311,1,2020-02-18 15:57:28,/r/EDAnonymous/comments/f5smxm/dae_feel_like_if_you_could_just_get_to_your_ugw/fi1qz7m/,"I would get to my UGW and still think my body was flabby and massive, so it kept getting lower and lower. I’m sure I’ll never hit mine because it’s just wayyy too low.  So I’m stuck in quasi recovery and kind of trying to be okay with my weight and not do anything to make people worry.",False,False
fi1kg2s,t3_f5smxm,t1_fi0xrn3,unforgettable_potato,1,2020-02-18 14:58:03,/r/EDAnonymous/comments/f5smxm/dae_feel_like_if_you_could_just_get_to_your_ugw/fi1kg2s/,My brain tells me that I don't have an ED because I have an obese Bmi. 🙃 I am a fake and phony.,False,False
fi1i7dk,t3_f5smxm,t3_f5smxm,scaredyk4t,1,2020-02-18 14:37:40,/r/EDAnonymous/comments/f5smxm/dae_feel_like_if_you_could_just_get_to_your_ugw/fi1i7dk/,"Yes. I’m right around my GW so I feel okay eating “normally” for a few days, which makes me feel like I’m recovering but then I feel shitty and restrict or fast for a few days. I’ve even been eating a lot of my fear foods. My weight only fluctuates a lb or two. I also have realized that if I don’t binge and gain it’s only water weight and I’ll go back down in a day.   My only real worry is I’ve basically come to the point where the ED is apart of me. Like I weird comfort. Also the feeling of control if something crazy is happening in my life.   So yeah I know I’m not recovered but this new cycle makes me think I am and also has gotten people off my back because they see me eating more.",False,False
fi1h6si,t3_f5smxm,t3_f5smxm,BrowncoatIona,1,2020-02-18 14:28:02,/r/EDAnonymous/comments/f5smxm/dae_feel_like_if_you_could_just_get_to_your_ugw/fi1h6si/,"As you said, it's a lie we tell ourselves, one of many.   For me, trying to recover becomes notably more challenging the more medical complications arise. I guess when that happens it's supposed to be more a wake-up call. But when I know that recovery now involves things like refeeding syndrome, or having to wear nappies because you've messed up your body so bad with ED and laxatives, or the thousand other medical complications that come with EDs. The more there are, the harder I find it to work towards recovery.",False,False
fi1gvwq,t3_f5smxm,t1_fi0hswd,nintentions,1,2020-02-18 14:25:06,/r/EDAnonymous/comments/f5smxm/dae_feel_like_if_you_could_just_get_to_your_ugw/fi1gvwq/,yup. on my 3rd atm.,False,False
fi1dzmr,t3_f5smxm,t3_f5smxm,lilzbeans,1,2020-02-18 13:57:35,/r/EDAnonymous/comments/f5smxm/dae_feel_like_if_you_could_just_get_to_your_ugw/fi1dzmr/,"My ugw is still a healthy weight - low, but still healthy. I really wanted to hit it before I got my tattoo but...I really don’t think it’s going to happen. In my head, I can hit it and then maintain. I hope I can.",False,False
fi1cwhj,t3_f5smxm,t3_f5smxm,k_otamatone,1,2020-02-18 13:47:13,/r/EDAnonymous/comments/f5smxm/dae_feel_like_if_you_could_just_get_to_your_ugw/fi1cwhj/,I passed my UGW at Easter 2019 by three pounds. Still wasn’t happy with it. My expectations just got higher,False,False
fi168yn,t3_f5smxm,t3_f5smxm,bubblyqueer,1,2020-02-18 12:44:15,/r/EDAnonymous/comments/f5smxm/dae_feel_like_if_you_could_just_get_to_your_ugw/fi168yn/,Ugh me. Legit bawled in the shower the night before my assessment thinking they wouldn’t take me seriously because I weigh “too much”. Nope. The therapist said most likely residential.,False,False
fi165tq,t3_f5smxm,t3_f5smxm,thetachibabe,1,2020-02-18 12:43:25,/r/EDAnonymous/comments/f5smxm/dae_feel_like_if_you_could_just_get_to_your_ugw/fi165tq/,I was so convinced when I lost 30 pounds and reached me high school weight I'd stop. Well I'm here and I'm still unhappy with myself so.,False,False
fi15xhc,t3_f5smxm,t3_f5smxm,isthised,1,2020-02-18 12:41:16,/r/EDAnonymous/comments/f5smxm/dae_feel_like_if_you_could_just_get_to_your_ugw/fi15xhc/,Yup. Then it crept down by five pounds then ten pounds. I haven’t hit any of those milestones yet I’ve hit other milestones and kept going. I still think hitting an UGW or in that range might chill me out enough but who knows. Past precedent suggests otherwise.,False,False
fi15qdk,t3_f5smxm,t1_fi0xrn3,cygetsfit,1,2020-02-18 12:39:24,/r/EDAnonymous/comments/f5smxm/dae_feel_like_if_you_could_just_get_to_your_ugw/fi15qdk/,mood.,False,False
fi15dbo,t3_f5smxm,t3_f5smxm,caj065,1,2020-02-18 12:35:59,/r/EDAnonymous/comments/f5smxm/dae_feel_like_if_you_could_just_get_to_your_ugw/fi15dbo/,i know im never gonna reach mine. in the back of my head im 100% aware it isn’t realistic by any means. but i still wanna try,False,False
fi15a75,t3_f5smxm,t3_f5smxm,foxforcefiv5,1,2020-02-18 12:35:08,/r/EDAnonymous/comments/f5smxm/dae_feel_like_if_you_could_just_get_to_your_ugw/fi15a75/,"for years and years i’ve always had a delusional mindset than when i reach my ugw i’ll lose 5 extra pounds so i can have some wiggle room, and stay that weight/put on some muscle so i look good into adulthood. i know one day i want to be a mom and before then i was to be fit enough that i’ll bounce back. my eating disorder literally stemmed from as a child noticing how people get fatter as they age",False,False
fi13cxa,t3_f5smxm,t3_f5smxm,strawberri_shorti,1,2020-02-18 12:16:30,/r/EDAnonymous/comments/f5smxm/dae_feel_like_if_you_could_just_get_to_your_ugw/fi13cxa/,You will never be satisfied if you only focus on the numbers.. But what's an ED without numbers hah..,False,False
fi135mz,t3_f5smxm,t1_fi0hswd,manicpixiefearfood,1,2020-02-18 12:14:44,/r/EDAnonymous/comments/f5smxm/dae_feel_like_if_you_could_just_get_to_your_ugw/fi135mz/,"My issue is like... I don't feel like I need to reach my UGW to be ready for recovery, but I do feel like I need to reach *a* goal weight. I just don't feel like recovery will stick for me unless I'm below a certain weight. Not even a particularly low one, considering how low my UGW is. Like, legit the exact middle of normal BMI is what I think I'd need to be ready for recovery. Just am scared I'd never be able to stick to it without being low enough that I won't still want to lose a ton once I'm out",False,False
fi11zia,t3_f5smxm,t1_fi0xrn3,FeatherWorld,1,2020-02-18 12:04:04,/r/EDAnonymous/comments/f5smxm/dae_feel_like_if_you_could_just_get_to_your_ugw/fi11zia/,I don't even know if my current ugw is even underweight. I've been overweight for most of my life :/,False,False
fi10qrs,t3_f5smxm,t1_fi0xrn3,Horizonaaa,1,2020-02-18 11:53:10,/r/EDAnonymous/comments/f5smxm/dae_feel_like_if_you_could_just_get_to_your_ugw/fi10qrs/,Man same,False,False
fi10h5p,t3_f5smxm,t3_f5smxm,syntheticseasalt,1,2020-02-18 11:50:49,/r/EDAnonymous/comments/f5smxm/dae_feel_like_if_you_could_just_get_to_your_ugw/fi10h5p/,I told myself i’d refuse to gain weight (or even let myself mentally feel better) until i experienced serious medical consequences. But my plans were thwarted when my treatment team convinced my parents not to let me go to college until my BMI was 22 lol,False,False
fi0zldn,t3_f5smxm,t1_fi0v9cq,villager43,1,2020-02-18 11:43:07,/r/EDAnonymous/comments/f5smxm/dae_feel_like_if_you_could_just_get_to_your_ugw/fi0zldn/,"Haha you didn’t scare, but thanks and all the luck for your recovery too when you’re ready!",False,False
fi0ygf3,t3_f5smxm,t3_f5smxm,almost-dainty,1,2020-02-18 11:33:20,/r/EDAnonymous/comments/f5smxm/dae_feel_like_if_you_could_just_get_to_your_ugw/fi0ygf3/,haha I'm so close at this point... just a little longer and then I'll recover for sure,False,False
fi0yfg3,t3_f5smxm,t3_f5smxm,klownfukr,1,2020-02-18 11:33:07,/r/EDAnonymous/comments/f5smxm/dae_feel_like_if_you_could_just_get_to_your_ugw/fi0yfg3/,Man my original gw was 110 and I got a body scan and found out to achieve that I’d have to have literally 0% body fat,False,False
fi0xrn3,t3_f5smxm,t3_f5smxm,DootDeeDootDeeDoo,1,2020-02-18 11:27:34,/r/EDAnonymous/comments/f5smxm/dae_feel_like_if_you_could_just_get_to_your_ugw/fi0xrn3/,I'll worry about that when I'm not obese anymore.,False,False
fi0xd6u,t3_f5smxm,t1_fi0stgo,hedge-mustard,1,2020-02-18 11:24:09,/r/EDAnonymous/comments/f5smxm/dae_feel_like_if_you_could_just_get_to_your_ugw/fi0xd6u/,this,False,False
fi0v9cq,t3_f5smxm,t1_fi0uvr5,thr0wawaynametaken,1,2020-02-18 11:04:34,/r/EDAnonymous/comments/f5smxm/dae_feel_like_if_you_could_just_get_to_your_ugw/fi0v9cq/,"didn't mean to scare you off of it by any means, lol! what i've also seen people experience is that actually jumping into recovery and getting through the very beginning stages alleviates that feeling because, as hard as it is to eat enough and refrain from behaviors, it really is a better life. best of luck in your recovery!",False,False
fi0v78l,t3_f5smxm,t1_fi0hswd,MakingBadDecisions,1,2020-02-18 11:04:00,/r/EDAnonymous/comments/f5smxm/dae_feel_like_if_you_could_just_get_to_your_ugw/fi0v78l/,"Eeeexactly. My first UGW was 120 which would put me 11lbs underweight for my height. Get to 120. ""That girl is so pretty and graceful and weighs 90lbs... I would be just like her if I was 90lbs...""",False,False
fi0uvr5,t3_f5smxm,t1_fi0umcb,villager43,1,2020-02-18 11:00:54,/r/EDAnonymous/comments/f5smxm/dae_feel_like_if_you_could_just_get_to_your_ugw/fi0uvr5/,"Thanks for answering! I thought that it would sort of apply to all, I hope I sometime do 100% want to recover lol. Also thanks for sharing your source, I will read into it!",False,False
fi0us16,t3_f5smxm,t1_fi0u5a5,Iscariiot,1,2020-02-18 10:59:54,/r/EDAnonymous/comments/f5smxm/dae_feel_like_if_you_could_just_get_to_your_ugw/fi0us16/,You’re welcome to DM if you’ve got questions then! C:,False,False
fi0umcb,t3_f5smxm,t1_fi0tle5,thr0wawaynametaken,1,2020-02-18 10:58:23,/r/EDAnonymous/comments/f5smxm/dae_feel_like_if_you_could_just_get_to_your_ugw/fi0umcb/,"well it's not a guarantee that everyone will go through it and it's not a requirement of having an ed! just a common experience.  that said, i don't really know how to source it, it's just kind of known, something you can read about on ed recovery blogs or even ed treatment provider websites. eds tend to be treatment-resistant and overcoming that is part of the therapy in a way that it isn't for, say, depression or anxiety. it's something i heard from other patients when i was in treatment programs, from more people than not honestly. but again, not for 100% of people, so *never* may have been too broad of a statement!",False,False
fi0u5a5,t3_f5smxm,t1_fi0gs58,zumlepurzo,1,2020-02-18 10:53:46,/r/EDAnonymous/comments/f5smxm/dae_feel_like_if_you_could_just_get_to_your_ugw/fi0u5a5/,"Curious. How did you decide them?   Also, if we can discuss this in private, I would prefer that.",False,False
fi0tweb,t3_f5smxm,t3_f5smxm,zumlepurzo,1,2020-02-18 10:51:24,/r/EDAnonymous/comments/f5smxm/dae_feel_like_if_you_could_just_get_to_your_ugw/fi0tweb/,"I almost reached my gw, but then bounced back up (for reasons ¯\\_(ツ)_/¯)  I am now back on my way to going down, and this time I would want to reach further. [Because now I already know I can do it]  If I reach my ugw (i don't have one fixed yet), I think I would just feel more confident going lower.",False,False
fi0tle5,t3_f5smxm,t1_fi0s9wx,villager43,1,2020-02-18 10:48:29,/r/EDAnonymous/comments/f5smxm/dae_feel_like_if_you_could_just_get_to_your_ugw/fi0tle5/,"Out of curiosity, do EDs really make it so you don’t want to recover a 100%? (If you have a source, do you mind sharing?)",False,False
fi0stgo,t3_f5smxm,t3_f5smxm,fanofbananas,1,2020-02-18 10:40:59,/r/EDAnonymous/comments/f5smxm/dae_feel_like_if_you_could_just_get_to_your_ugw/fi0stgo/,I love knowing I'm being delusional and going along with it anyway,False,False
fi0s9wx,t3_f5smxm,t3_f5smxm,thr0wawaynametaken,1,2020-02-18 10:35:45,/r/EDAnonymous/comments/f5smxm/dae_feel_like_if_you_could_just_get_to_your_ugw/fi0s9wx/,"it's a common thought and i think a relief to hold in the back of your head but it's also exactly like you said - a lie.  the thing about wanting to recover is that eds will never let you (general ""you"") *fully* want recovery. you have to decide the desire to have a better life is worth fighting that percent of you that still wants to lose weight and fuck around with food.",False,False
fi0npc4,t3_f5smxm,t3_f5smxm,KieranBoonee,1,2020-02-18 09:50:45,/r/EDAnonymous/comments/f5smxm/dae_feel_like_if_you_could_just_get_to_your_ugw/fi0npc4/,Ill recover when i hit my goal weight.  And other lies we tell ourselves.,False,False
fi0hswd,t3_f5smxm,t3_f5smxm,talkingdonkeys,1,2020-02-18 08:48:21,/r/EDAnonymous/comments/f5smxm/dae_feel_like_if_you_could_just_get_to_your_ugw/fi0hswd/,The problem is you never really reach your ugw. The Ed will always move the goalposts,False,False
fi0gs58,t3_f5smxm,t3_f5smxm,Iscariiot,1,2020-02-18 08:36:56,/r/EDAnonymous/comments/f5smxm/dae_feel_like_if_you_could_just_get_to_your_ugw/fi0gs58/,"I hit two UGWs and it made me feel nothing but the desire to lower the numbers. Now my UGW will put me in the hospital. And yet, I’m still aiming for it and not far away.   Get help before you hit the UGW! This isn’t worth it.",False,False
