Comment ID,Link ID,Parent ID,Author,Score,Publish Date,Permalink,Text,Stickied,Is Submitter
fh6uq1i,t3_f1duc1,t3_f1duc1,princess-kitty-belle,1,2020-02-09 21:49:44,/r/EDAnonymous/comments/f1duc1/my_scale_just_read_less_than_what_i_was_expecting/fh6uq1i/,"I can easily put on 2kg (4.4lbs) during my period and other people have told me they put on more, so it's pretty normal to have some weight drop from that plus fasting on top of that.",False,False
fh5vsz4,t3_f1duc1,t3_f1duc1,GirlWearingMyDress,2,2020-02-09 17:59:30,/r/EDAnonymous/comments/f1duc1/my_scale_just_read_less_than_what_i_was_expecting/fh5vsz4/,"This is what scales do. Mine is a digital scale that remembers the most recent weight and if you’re close to that, it’ll show that weight again to make it looks like it’s more accurate.    I trick my scale by putting half of my weight on a couple of times and then getting back on to get the actual range of what my scale thinks I am.",False,False
fh568rv,t3_f1duc1,t1_fh55x66,AS123x,2,2020-02-09 15:57:05,/r/EDAnonymous/comments/f1duc1/my_scale_just_read_less_than_what_i_was_expecting/fh568rv/,depending on the minimum weight your scale registers you could try like a gallon of water (8.3 lbs). They sell gallon waters at pretty much any grocery store. Then afterwards you get hydrated!,False,False
fh55x66,t3_f1duc1,t1_fh4vpxo,jcsxx,2,2020-02-09 15:55:18,/r/EDAnonymous/comments/f1duc1/my_scale_just_read_less_than_what_i_was_expecting/fh55x66/,Thank you! I don’t have any idea of what I could set on it that has a standard weight heavy enough to register on it,False,True
fh4vpxo,t3_f1duc1,t3_f1duc1,AS123x,3,2020-02-09 15:09:18,/r/EDAnonymous/comments/f1duc1/my_scale_just_read_less_than_what_i_was_expecting/fh4vpxo/,Maybe try calibrating your scale. Get something you know the weight of and see if your scale is right,False,False
