Comment ID,Link ID,Parent ID,Author,Score,Publish Date,Permalink,Text,Stickied,Is Submitter
evoa40p,t3_ck0vlr,t1_evn0z1q,adrawnangel,1,2019-08-01 01:44:40,/r/EDAnonymous/comments/ck0vlr/food_challenge_dare_me_to_eat_something_crazy_and/evoa40p/,that was probably super yummy! I'm glad you're having fun!! :),False,False
evn0z1q,t3_ck0vlr,t1_evlqr9r,grossenten98,1,2019-07-31 18:47:07,/r/EDAnonymous/comments/ck0vlr/food_challenge_dare_me_to_eat_something_crazy_and/evn0z1q/,"I just SMASHED a Poptart and Peanut Butter sandwich. Lol FYI I’m really angry at my Ed because of all the pain that it’s been causing me, that’s why I love doing challenges. Plus, it makes recovery so very fun.",False,True
evm07ad,t3_ck0vlr,t1_evlqr9r,grossenten98,3,2019-07-31 14:31:48,/r/EDAnonymous/comments/ck0vlr/food_challenge_dare_me_to_eat_something_crazy_and/evm07ad/,I actually finished and I’m out of Reese’s cups but... POPTART AND CHOCOLATE? Hello baby! 😂 I got 2 just for the occasion and some candies too.,False,True
evlqr9r,t3_ck0vlr,t3_ck0vlr,adrawnangel,1,2019-07-31 13:33:22,/r/EDAnonymous/comments/ck0vlr/food_challenge_dare_me_to_eat_something_crazy_and/evlqr9r/,Poptarts and a reeses cup x,False,False
evl6bps,t3_ck0vlr,t3_ck0vlr,grossenten98,1,2019-07-31 11:34:36,/r/EDAnonymous/comments/ck0vlr/food_challenge_dare_me_to_eat_something_crazy_and/evl6bps/,"The Cheesy Pasta was great, I wanted to cash out on the cheese flavor so I used some Sharp Cheddar:)",False,True
evkmfh1,t3_ck0vlr,t1_evkkaaf,grossenten98,1,2019-07-31 09:33:50,/r/EDAnonymous/comments/ck0vlr/food_challenge_dare_me_to_eat_something_crazy_and/evkmfh1/,Thx! Xx,False,True
evkkaaf,t3_ck0vlr,t1_evj3gzt,wild_banana_cookie,1,2019-07-31 09:19:04,/r/EDAnonymous/comments/ck0vlr/food_challenge_dare_me_to_eat_something_crazy_and/evkkaaf/,Glad to hear you are doing this challenge. Good luck!,False,False
evkap0p,t3_ck0vlr,t1_evk3wf1,sunnykitty300,1,2019-07-31 08:07:22,/r/EDAnonymous/comments/ck0vlr/food_challenge_dare_me_to_eat_something_crazy_and/evkap0p/,Yay!! That sounds even better than chocolate chips,False,False
evk3wf1,t3_ck0vlr,t1_evifs81,grossenten98,1,2019-07-31 07:10:20,/r/EDAnonymous/comments/ck0vlr/food_challenge_dare_me_to_eat_something_crazy_and/evk3wf1/,"They were delicious, I had to use a Milky Way lol because I was out of chocolate chips so I broke that up  xx",False,True
evk3qot,t3_ck0vlr,t1_evhzpla,grossenten98,1,2019-07-31 07:09:03,/r/EDAnonymous/comments/ck0vlr/food_challenge_dare_me_to_eat_something_crazy_and/evk3qot/,I had a spoonful of PB for you 😉,False,True
evk3m1c,t3_ck0vlr,t3_ck0vlr,grossenten98,1,2019-07-31 07:07:58,/r/EDAnonymous/comments/ck0vlr/food_challenge_dare_me_to_eat_something_crazy_and/evk3m1c/,For lunch I may make some Chicken with Fettuccine noodles and cheese 🧀,False,True
evk3en0,t3_ck0vlr,t3_ck0vlr,grossenten98,1,2019-07-31 07:06:14,/r/EDAnonymous/comments/ck0vlr/food_challenge_dare_me_to_eat_something_crazy_and/evk3en0/,"BREAKFAST WAS GREAT,  I made some chocolate Matzo (panbread/flatbread) with Peanut Butter, marshmallows, and a milkyway since I didn’t have any normal chocolate.  It was awesome and satiating, I thought the sugar would just load it down and make me hungrier. But I’ve learned that when you want something sweet just do it, it’s like when you’re thirsty",False,True
evjlxr2,t3_ck0vlr,t1_evjlcpc,grossenten98,1,2019-07-31 04:25:12,/r/EDAnonymous/comments/ck0vlr/food_challenge_dare_me_to_eat_something_crazy_and/evjlxr2/,Alright cool,False,True
evjlcpc,t3_ck0vlr,t1_evjk5sd,BEDBulimic,1,2019-07-31 04:19:41,/r/EDAnonymous/comments/ck0vlr/food_challenge_dare_me_to_eat_something_crazy_and/evjlcpc/,"Cool! to be honest, I haven't heard of any of the youtubers you've mentioned but I might look into them! :)",False,False
evjk5sd,t3_ck0vlr,t1_evj80k6,grossenten98,1,2019-07-31 04:08:11,/r/EDAnonymous/comments/ck0vlr/food_challenge_dare_me_to_eat_something_crazy_and/evjk5sd/,"Thx, that’s why I’m learning as much as possible and listening to my supportive people and trying my best. x Ps. Autumn Brianne Just sent me a voicemail congratulating my efforts =] (look her up, she’s really big on self love and supporting others)",False,True
evj80k6,t3_ck0vlr,t1_evj6jmv,BEDBulimic,1,2019-07-31 02:13:57,/r/EDAnonymous/comments/ck0vlr/food_challenge_dare_me_to_eat_something_crazy_and/evj80k6/,"Yay glad you’re doing alright mentally! I’m hoping that you’ve got formal recovery support helping ya along the way, just as a safety precaution that your extreme hunger doesn’t evolve into a different ED or pesky compensatory behaviours start creeping up. Stay strong friend and good luck x",False,False
evj6jmv,t3_ck0vlr,t1_evj2qii,grossenten98,1,2019-07-31 02:00:22,/r/EDAnonymous/comments/ck0vlr/food_challenge_dare_me_to_eat_something_crazy_and/evj6jmv/,"Thanks a bunch for your concerns! And that was before I took on my biggest one by 2days. I’ve gotten better about it after some great reinforcement by FAMOUS YOUTUBERS :) I told them about my struggles in recovery and I’ve received personal messages from: Stephanie Everyingham, Jax Fanucci, Tommy Kelly, And Recovery Bakes. After hearing from these people and reading so many articles on extreme hunger (perceived binging, not really binging it turns out) I learned that that is all just part of recovery and I feel happier than ever.  Btw if you’ve got Instagram (or anyone) @James_1054e follow me, I’m working really hard to get people Ik to be aware of ED amongst Males and females alike. Xoxo",False,True
evj3gzt,t3_ck0vlr,t1_evj39ws,grossenten98,1,2019-07-31 01:32:48,/r/EDAnonymous/comments/ck0vlr/food_challenge_dare_me_to_eat_something_crazy_and/evj3gzt/,+ Chicken was a big challenge food that my Dietician requested for me to eat a while back so great choice,False,True
evj39ws,t3_ck0vlr,t1_evii0rv,grossenten98,1,2019-07-31 01:30:58,/r/EDAnonymous/comments/ck0vlr/food_challenge_dare_me_to_eat_something_crazy_and/evj39ws/,"I don’t have any chicken nuggets, so for dinner I’ll make something with chicken, I’ll make a mix of a lot of these foods. Chicken and Pancakes/waffles! Or fajitas.",False,True
evj2xlt,t3_ck0vlr,t1_evisqju,grossenten98,1,2019-07-31 01:27:55,/r/EDAnonymous/comments/ck0vlr/food_challenge_dare_me_to_eat_something_crazy_and/evj2xlt/,"Yes I’ll make something similar to those, I just got a bunch of baking ingredients so I’m going to cook some up",False,True
evj2qii,t3_ck0vlr,t1_evhyiht,BEDBulimic,1,2019-07-31 01:26:17,/r/EDAnonymous/comments/ck0vlr/food_challenge_dare_me_to_eat_something_crazy_and/evj2qii/,"Hey OP I’m glad that you’re excited to challenge your AN :)   Please excuse me for looking at your post history (because I remember seeing your edanonymemes post recently) but I just wanted to wish you good luck and check that you’re doing okay? I saw your post to the binge eating disorder sub about how you felt depressed after the challenge, just wary that these huge challenges may be mentally taxing. Take care of yourself x",False,False
evisqju,t3_ck0vlr,t1_evhyiht,PM_ME_YER_SHIBA_INUS,1,2019-07-30 23:48:49,/r/EDAnonymous/comments/ck0vlr/food_challenge_dare_me_to_eat_something_crazy_and/evisqju/,this is the most powerful thing I've ever read,False,False
evii0rv,t3_ck0vlr,t3_ck0vlr,wild_banana_cookie,1,2019-07-30 22:16:28,/r/EDAnonymous/comments/ck0vlr/food_challenge_dare_me_to_eat_something_crazy_and/evii0rv/,"I really love tacos or chicken nuggets with fries, you choose whichever you like more!",False,False
evifs81,t3_ck0vlr,t1_evi0fqr,sunnykitty300,1,2019-07-30 21:58:37,/r/EDAnonymous/comments/ck0vlr/food_challenge_dare_me_to_eat_something_crazy_and/evifs81/,Hope they turn out well and you enjoy!!,False,False
evi3ah5,t3_ck0vlr,t3_ck0vlr,grossenten98,1,2019-07-30 20:25:47,/r/EDAnonymous/comments/ck0vlr/food_challenge_dare_me_to_eat_something_crazy_and/evi3ah5/,"I need something else, I’ll do one more thing? Anyone got an idea, Fav food?",False,True
evi2ygy,t3_ck0vlr,t1_evi2utt,grossenten98,1,2019-07-30 20:23:14,/r/EDAnonymous/comments/ck0vlr/food_challenge_dare_me_to_eat_something_crazy_and/evi2ygy/,Thx!,False,True
evi2utt,t3_ck0vlr,t1_evi2tjh,tired_and_alonex,1,2019-07-30 20:22:25,/r/EDAnonymous/comments/ck0vlr/food_challenge_dare_me_to_eat_something_crazy_and/evi2utt/,Good luck tomorrow,False,False
evi2tjh,t3_ck0vlr,t1_evhytvf,grossenten98,1,2019-07-30 20:22:08,/r/EDAnonymous/comments/ck0vlr/food_challenge_dare_me_to_eat_something_crazy_and/evi2tjh/,"Wait I’ll have to get some cokes, I just went to check and my brother drank them all :(",False,True
evi0fqr,t3_ck0vlr,t1_evhzq2t,grossenten98,1,2019-07-30 20:04:06,/r/EDAnonymous/comments/ck0vlr/food_challenge_dare_me_to_eat_something_crazy_and/evi0fqr/,"I’ll try and make some from scratch, I do have some chocolate so don’t despair 😜",False,True
evi0b76,t3_ck0vlr,t1_evhzpla,grossenten98,1,2019-07-30 20:03:10,/r/EDAnonymous/comments/ck0vlr/food_challenge_dare_me_to_eat_something_crazy_and/evi0b76/,4sho :3,False,True
evhzq2t,t3_ck0vlr,t1_evhzfkt,sunnykitty300,1,2019-07-30 19:58:42,/r/EDAnonymous/comments/ck0vlr/food_challenge_dare_me_to_eat_something_crazy_and/evhzq2t/,I usually just make the mix that you just add water to but she made them with eggs and oil and all the stuff you’re actually supposed to use and they were scary but so fluffy and good,False,False
evhzpla,t3_ck0vlr,t3_ck0vlr,ricebowlbitch,1,2019-07-30 19:58:36,/r/EDAnonymous/comments/ck0vlr/food_challenge_dare_me_to_eat_something_crazy_and/evhzpla/,have a spoonful of pb for me 😭,False,False
evhzfkt,t3_ck0vlr,t1_evhzbkb,grossenten98,1,2019-07-30 19:56:32,/r/EDAnonymous/comments/ck0vlr/food_challenge_dare_me_to_eat_something_crazy_and/evhzfkt/,"Yes, and oh my I want some now lol",False,True
evhzbkb,t3_ck0vlr,t1_evhz52o,sunnykitty300,1,2019-07-30 19:55:42,/r/EDAnonymous/comments/ck0vlr/food_challenge_dare_me_to_eat_something_crazy_and/evhzbkb/,Oh nooo :( my mom made me some chocolate chip pancakes the other day and I’ve been wanting more ever since lol,False,False
evhz52o,t3_ck0vlr,t1_evhywx6,grossenten98,1,2019-07-30 19:54:23,/r/EDAnonymous/comments/ck0vlr/food_challenge_dare_me_to_eat_something_crazy_and/evhz52o/,Im out of those ingredients :(,False,True
evhyzxj,t3_ck0vlr,t3_ck0vlr,grossenten98,1,2019-07-30 19:53:18,/r/EDAnonymous/comments/ck0vlr/food_challenge_dare_me_to_eat_something_crazy_and/evhyzxj/,Cheesy pasta  Pepsi  I Can do,False,True
evhywx6,t3_ck0vlr,t3_ck0vlr,sunnykitty300,1,2019-07-30 19:52:38,/r/EDAnonymous/comments/ck0vlr/food_challenge_dare_me_to_eat_something_crazy_and/evhywx6/,Pancakes or waffles whichever you prefer!! With syrup because it’s necessary. Ooo and chocolate chips.,False,False
evhytvf,t3_ck0vlr,t1_evhyqlr,tired_and_alonex,1,2019-07-30 19:51:59,/r/EDAnonymous/comments/ck0vlr/food_challenge_dare_me_to_eat_something_crazy_and/evhytvf/,Happy to help. Maybe a milkshake or full sugar coke as well?,False,False
evhyqlr,t3_ck0vlr,t1_evhy3al,grossenten98,1,2019-07-30 19:51:17,/r/EDAnonymous/comments/ck0vlr/food_challenge_dare_me_to_eat_something_crazy_and/evhyqlr/,"Alright, Cheesy pasta 🍝 accepted! And I’ll be making a post of these foods tomorrow, my requests are limited. I’ll have that for lunch btw :)",False,True
evhyiht,t3_ck0vlr,t3_ck0vlr,grossenten98,1,2019-07-30 19:49:32,/r/EDAnonymous/comments/ck0vlr/food_challenge_dare_me_to_eat_something_crazy_and/evhyiht/,"I have AN and I just completed the 10,000Calorie challenge!!!  So, TRY ME! =]",False,True
evhy3al,t3_ck0vlr,t3_ck0vlr,tired_and_alonex,1,2019-07-30 19:46:21,/r/EDAnonymous/comments/ck0vlr/food_challenge_dare_me_to_eat_something_crazy_and/evhy3al/,Cheesy pasta,False,False
