Comment ID,Link ID,Parent ID,Author,Score,Publish Date,Permalink,Text,Stickied,Is Submitter
fdebg1k,t3_ekq6vd,t1_fdebfod,SuicideAwarenessBot,1,2020-01-06 12:29:21,/r/EDAnonymous/comments/ekq6vd/last_meal_conundrum/fdebg1k/,"If you or someone you know is contemplating suicide, please do not hesitate to talk to someone.  **US:**  Call 1-800-273-8255 or text HOME to 741-741  **Non-US:**  [https://en.wikipedia.org/wiki/List_of_suicide_crisis_lines](https://en.wikipedia.org/wiki/List_of_suicide_crisis_lines)    ---    ^^I ^^am ^^a ^^bot.  ^^Feedback ^^appreciated.",False,False
fdebfod,t3_ekq6vd,t3_ekq6vd,cosmicdaydreams,1,2020-01-06 12:29:15,/r/EDAnonymous/comments/ekq6vd/last_meal_conundrum/fdebfod/,I have a similar issue but instead because I'm suicidal 🙃 I figure if I'm going to kill myself soon anyway might as well eat my favorite food as a last meal. But then I don't end up going through with it. I'm a real clown,False,False
fddf68d,t3_ekq6vd,t1_fddf0t7,paperklipp,3,2020-01-06 05:18:14,/r/EDAnonymous/comments/ekq6vd/last_meal_conundrum/fddf68d/,"Aw hun, don’t be. We all screw up. I estimated about half that number for the cookies originally before working up the courage to actually check.   Every time I let myself down like this, I try to reframe it in my head as just an opportunity to start over and do better going forward.   You’re gonna be okay, don’t be too hard on yourself.",False,False
fddf0t7,t3_ekq6vd,t1_fddehzs,MagiPan,2,2020-01-06 05:14:45,/r/EDAnonymous/comments/ekq6vd/last_meal_conundrum/fddf0t7/,I'm so disappointed in myself,False,True
fddehzs,t3_ekq6vd,t1_fddegpt,paperklipp,2,2020-01-06 05:02:43,/r/EDAnonymous/comments/ekq6vd/last_meal_conundrum/fddehzs/,Holy fuck.,False,False
fddegpt,t3_ekq6vd,t1_fddef6r,MagiPan,2,2020-01-06 05:01:52,/r/EDAnonymous/comments/ekq6vd/last_meal_conundrum/fddegpt/,I thought i was eating 1000 cal a day. I recently totaled it. It was...40 less than urs,False,True
fddef6r,t3_ekq6vd,t3_ekq6vd,paperklipp,7,2020-01-06 05:00:52,/r/EDAnonymous/comments/ekq6vd/last_meal_conundrum/fddef6r/,"I was gonna fast on Thursday and Friday last week so naturally on Wednesday night I ate 24 Safeway bakery cookies for a total of &gt;!5,000 kcal!&lt; 🤡",False,False
