Comment ID,Link ID,Parent ID,Author,Score,Publish Date,Permalink,Text,Stickied,Is Submitter
exex6vk,t3_csh7df,t3_csh7df,LowCalPal,1,2019-08-19 10:11:59,/r/EDAnonymous/comments/csh7df/diet_products/exex6vk/,It sounds like fibre pills.  Metamucil does the same thing for less money.,False,False
exevdvx,t3_csh7df,t1_exeqg0e,SaintAelphaba,1,2019-08-19 09:51:16,/r/EDAnonymous/comments/csh7df/diet_products/exevdvx/,Thanks!,False,True
exevdha,t3_csh7df,t1_exeqteh,SaintAelphaba,1,2019-08-19 09:51:08,/r/EDAnonymous/comments/csh7df/diet_products/exevdha/,Thank you.,False,True
exeqteh,t3_csh7df,t3_csh7df,questionably-sane,1,2019-08-19 08:58:21,/r/EDAnonymous/comments/csh7df/diet_products/exeqteh/,"As a general rule if something is market as an OTC weight loss aid it probably doesn't work.  If you're interested in checking your specific product you can google it's name (or the ingredients) plus ncbi to find research on its effectiveness.  Or particular interest should be literature reviews of those are available.  In the case of the two you listed the evidcence doesn't find any effect on weight loss.  As for safety information drugs.com is worth a look especially if you take perscription medication.  It lists information for both of the drugs you are interested in including risks, contraindications and effects.",False,False
exeqg0e,t3_csh7df,t3_csh7df,Ael-GN,1,2019-08-19 08:54:04,/r/EDAnonymous/comments/csh7df/diet_products/exeqg0e/,"Nothong terrible will happen. Glucomman will just expend and make you feel full - so if you have it before a meal you'll eat less, that's all.",False,False
