Comment ID,Link ID,Parent ID,Author,Score,Publish Date,Permalink,Text,Stickied,Is Submitter
ev07y60,t3_chvv15,t3_chvv15,ready2rope,1,2019-07-26 04:29:57,/r/EDAnonymous/comments/chvv15/my_boyfriends_comments_are_fixing_to_trigger_me/ev07y60/,"Anybody commenting on my eating habits makes me freak out, and those rare comments are never ill-intentioned like your boyfriend’s obviously are. Men like that could never understand the suffering that comes with an eating disorder.",False,False
euzst50,t3_chvv15,t1_euyjk0e,DeathlyDee,1,2019-07-26 02:21:58,/r/EDAnonymous/comments/chvv15/my_boyfriends_comments_are_fixing_to_trigger_me/euzst50/,Why would anyone answer that question that you asked him with someone other than yourself? He's in a relationship with you. Truly fucked up. I agree with the others. He's doing this shit on purpose.. no one who really cared about your health would say shit like that. Reminds me of Roy from the office.,False,False
euzjr2o,t3_chvv15,t3_chvv15,strangernumberone,1,2019-07-26 01:02:17,/r/EDAnonymous/comments/chvv15/my_boyfriends_comments_are_fixing_to_trigger_me/euzjr2o/,Seriously- dump his ass.,False,False
euyjk0e,t3_chvv15,t1_euyj3cf,alchademy,1,2019-07-25 20:14:19,/r/EDAnonymous/comments/chvv15/my_boyfriends_comments_are_fixing_to_trigger_me/euyjk0e/,"I have a hunch he likes smaller girls. His ideal type is emma watson. One time we were at hooters &amp; I asked him which girl he liked the most, he happened to pick the shortest &amp; skinniest one there. Ugh.",False,True
euyj3cf,t3_chvv15,t3_chvv15,Astronautee,1,2019-07-25 20:10:12,/r/EDAnonymous/comments/chvv15/my_boyfriends_comments_are_fixing_to_trigger_me/euyj3cf/,Throw the whole POS away. Has he shown signs of liking underweight women or smth?? Or is he fatshaming in general? I really dont like where this is going. He knows your ed but he fucking makes those comments?,False,False
