Comment ID,Link ID,Parent ID,Author,Score,Publish Date,Permalink,Text,Stickied,Is Submitter
ey1i6b6,t3_cuyca2,t3_cuyca2,phaeo15,1,2019-08-24 21:31:55,/r/EDAnonymous/comments/cuyca2/dry_skin_advice/ey1i6b6/,"Take a trip to r/skincareaddiction, tons of awesome dry skin advice on there 😁",False,False
ey1c5wn,t3_cuyca2,t3_cuyca2,horrendouswhore,1,2019-08-24 20:14:27,/r/EDAnonymous/comments/cuyca2/dry_skin_advice/ey1c5wn/,"Ungvita Ointment is the only thing that works for me. Smells like a dead fish but I cake myself with it at night, then wash it off in the morning and apply cetaphil restoraderm moisturiser. Hope this helps, dry skin is a real bitch.",False,False
ey0ukzt,t3_cuyca2,t3_cuyca2,Rosalie_aqua,1,2019-08-24 16:51:26,/r/EDAnonymous/comments/cuyca2/dry_skin_advice/ey0ukzt/,"Yeah I get this, I use a face wash specifically for dry skin and moisturise every night and it really helps.",False,False
ey0qu6o,t3_cuyca2,t3_cuyca2,thoughtfulfox,1,2019-08-24 16:29:01,/r/EDAnonymous/comments/cuyca2/dry_skin_advice/ey0qu6o/,"Cocoa butter is my life in the winter especially. I use it on my face, lips, body, everywhere. I buy plain cocoa butter, melt it down and combine it with a couple cattier oils. Once it cools, I whip it until it looks like frosting and a small amount will last me for months. Alternatively, you can just look for body butters. I apply it after a shower and then as needed throughout the day if I’m really dry.   Sweet almond oil is my favorite when it’s warmer out or if my skin isn’t overly dry.",False,False
ey0lfwc,t3_cuyca2,t3_cuyca2,Peanut2ur_Tostito,1,2019-08-24 16:01:57,/r/EDAnonymous/comments/cuyca2/dry_skin_advice/ey0lfwc/,I have had this same issue for a while now. I always mix skin oil with my lotion before I rub it all over my body. I sleep with strong lip healing balm on my lips every night &amp; moisturizer on my face.,False,False
ey0cyh1,t3_cuyca2,t3_cuyca2,junebug-2019,1,2019-08-24 15:12:43,/r/EDAnonymous/comments/cuyca2/dry_skin_advice/ey0cyh1/,"Limit baths, turn down temp of shower. Bath oil to put on skin right after shower/bath. Dont rub your skin to dry off but pat it dry with a towel.  Also the thicker lotions that are sold in tubs are better for hydration than pump lotions. If really desperate/broke the cheapest and most effective skin moisturizer is crisco ( yes the stuff that normal people cook and bake with). It will stain sheets/clothes but is works great",False,False
