Comment ID,Link ID,Parent ID,Author,Score,Publish Date,Permalink,Text,Stickied,Is Submitter
exkqnb7,t3_ctdewg,t3_ctdewg,piipiistorm,1,2019-08-21 09:11:14,/r/EDAnonymous/comments/ctdewg/how_do_you_avoid_someone_whos_making_you_relapse/exkqnb7/,Have you talked to your CO about it? Most would want to know about it because their unit reflects on them.,False,False
exkgqqi,t3_ctdewg,t1_exkbvk2,4gotmyfuckinpassword,1,2019-08-21 07:02:28,/r/EDAnonymous/comments/ctdewg/how_do_you_avoid_someone_whos_making_you_relapse/exkgqqi/,There is one but it’s the army’s mental healthcare system so it’s not exactly helpful lmao,False,True
exkbvk2,t3_ctdewg,t1_exkbaaz,ingefaer_,1,2019-08-21 05:31:01,/r/EDAnonymous/comments/ctdewg/how_do_you_avoid_someone_whos_making_you_relapse/exkbvk2/,"oh sorry, mental health team! im not from the us either haha",False,False
exkbcrj,t3_ctdewg,t1_exk9kqi,4gotmyfuckinpassword,1,2019-08-21 05:19:14,/r/EDAnonymous/comments/ctdewg/how_do_you_avoid_someone_whos_making_you_relapse/exkbcrj/,"They actually suggested I talk to her about it - like maybe she’ll feel less alone and like someone understands. And I love the idea of it, just she’s SO MUCH SKINNIER than me and it makes me insecure and I feel like she wouldn’t believe me or think I’m too fat for an ED (because I feel that way and I’m projecting lmao) and I’m scared if I speak to her it can actually trigger me more and put me in total relapse mode. Fuck. I wanna help but I also am scared for myself",False,True
exkbaaz,t3_ctdewg,t1_exk9ae4,4gotmyfuckinpassword,1,2019-08-21 05:17:43,/r/EDAnonymous/comments/ctdewg/how_do_you_avoid_someone_whos_making_you_relapse/exkbaaz/,I don’t wanna be moved to a dif unit -  I work with doggies and I only have 3 months left lol so it’s not worth it. But idk what an MH team is - I’m not in the American army 😜,False,True
exk9kqi,t3_ctdewg,t3_ctdewg,snefferu,1,2019-08-21 04:36:22,/r/EDAnonymous/comments/ctdewg/how_do_you_avoid_someone_whos_making_you_relapse/exk9kqi/,"You could either talk to her about it or you could discuss it with your supervisors (the latter is probably the most sensible). It’s almost impossible to live with someone when you both have EDs and not make each other worse, even when you’re trying to support each other (ime). Good luck to you both in recovery.",False,False
exk9ae4,t3_ctdewg,t3_ctdewg,ingefaer_,1,2019-08-21 04:29:19,/r/EDAnonymous/comments/ctdewg/how_do_you_avoid_someone_whos_making_you_relapse/exk9ae4/,can you be moved to a different unit? is there a MH team in the army where you are? ❤️,False,False
