Comment ID,Link ID,Parent ID,Author,Score,Publish Date,Permalink,Text,Stickied,Is Submitter
fgo2r3a,t3_ezatpc,t3_ezatpc,henej,1,2020-02-05 21:06:57,/r/EDAnonymous/comments/ezatpc/this_is_how_we_all_lose/fgo2r3a/,"I’m doing this too rn, like I feel comfortable all the time and that doesn’t really make me feel good. Like I want to feel deserving of food and comfort idk",False,False
fgnb1m0,t3_ezatpc,t1_fgmug9t,j4jackj,1,2020-02-05 16:18:43,/r/EDAnonymous/comments/ezatpc/this_is_how_we_all_lose/fgnb1m0/,The point of cortisol being anti-inflammatory is to direct energy at escaping the stress instead of at healing.,False,False
fgn8kcg,t3_ezatpc,t1_fgm0in1,wuylia,1,2020-02-05 15:55:22,/r/EDAnonymous/comments/ezatpc/this_is_how_we_all_lose/fgn8kcg/,thank you for taking the time to respond kindly :) i’ll be keeping this in mind and try to lessen the stress on my body!,False,True
fgmug9t,t3_ezatpc,t1_fgms60q,YellowReasons,1,2020-02-05 13:51:24,/r/EDAnonymous/comments/ezatpc/this_is_how_we_all_lose/fgmug9t/,"Yes. Cortisol levels rise whenever we are stressed. Cortisol can cause lots of fatigue on top of stress. If she doesn’t allow her body to heal, she is going to be fatigued with just as much inflammation. Perhaps I wasn’t super clear.",False,False
fgms60q,t3_ezatpc,t1_fgm0in1,j4jackj,1,2020-02-05 13:29:16,/r/EDAnonymous/comments/ezatpc/this_is_how_we_all_lose/fgms60q/,cortisol is an anti-inflammatory hormone actually,False,False
fgm0in1,t3_ezatpc,t3_ezatpc,YellowReasons,1,2020-02-05 09:09:53,/r/EDAnonymous/comments/ezatpc/this_is_how_we_all_lose/fgm0in1/,"Be consistent. I typically have a lot of constipation after a binge and forgive my body for it’s harder-than-usual belly. Try to pin point WHY you feel “fat” so that you’re able to remediate the problem.   Stress causes increased levels of cortisol which increases your body’s inflammation. So, try your best to slow down... your body is going to go through a lot after a binge cycle.",False,False
