Comment ID,Link ID,Parent ID,Author,Score,Publish Date,Permalink,Text,Stickied,Is Submitter
ef5kehr,t3_akfxxj,t3_akfxxj,Jenny_Roberts,1,2019-01-27 23:39:23,/r/EDAnonymous/comments/akfxxj/psa_getting_skinny_does_not_fix_your_life/ef5kehr/,"I'm gonna go out on a limb and say that I agree...but it mainly applies to restrictive EDs.   A lot of people (including myself) have BED and losing significant weight would probably have a big impact on our health. I can't wait to exercise without joint pain, and to shop and have a medium fit me. My heart will be healthier, and it will signify me finally developing discapline that I know I need in other areas too.   In short, losing weight can improve your life...but it isn't always skinnier = happier. A 140lb person may be happier than a 200lb person, but a 80lb person isn't really happier than someone 120lbs. ",False,False
ef5iw12,t3_akfxxj,t1_ef5hu0s,reddotm,1,2019-01-27 23:14:23,/r/EDAnonymous/comments/akfxxj/psa_getting_skinny_does_not_fix_your_life/ef5iw12/,Exactly ,False,True
ef5ityd,t3_akfxxj,t1_ef5hpj3,reddotm,1,2019-01-27 23:13:27,/r/EDAnonymous/comments/akfxxj/psa_getting_skinny_does_not_fix_your_life/ef5ityd/,yeah I definitely agree!!,False,True
ef5hxfh,t3_akfxxj,t1_ef4u3oo,throwawayfemcelite,1,2019-01-27 22:59:37,/r/EDAnonymous/comments/akfxxj/psa_getting_skinny_does_not_fix_your_life/ef5hxfh/,"same. i'm at the low point of a healthy bmi but when i was at my lw i was bmi 16 and it's when i got the most male attention and people were just nicer to me and i was more social, then i binged up to bmi 18 and became depressed, and it's like people just forgot i existed and i broke up with my first (and probably last) bf because i thought he thought i was ugly now that i weigh more. +++i gain a lot of my weight in my face :(",False,False
ef5hu0s,t3_akfxxj,t3_akfxxj,avakadava,1,2019-01-27 22:58:17,/r/EDAnonymous/comments/akfxxj/psa_getting_skinny_does_not_fix_your_life/ef5hu0s/,"Good reality check, but at least there'll be some improvement with losing weight so I'll continue to try. I think the thing is dont ONLY focus on that if you're trying to improve your life ",False,False
ef5hpj3,t3_akfxxj,t3_akfxxj,throwawayfemcelite,1,2019-01-27 22:56:24,/r/EDAnonymous/comments/akfxxj/psa_getting_skinny_does_not_fix_your_life/ef5hpj3/,"personally i think it only doesn't fix your life if you have an ED, because generally women's lives improve if they become more attractive because society places our worth on our looks, and halo effect makes people treat attractive people better, but for some people the weight less will never be enough and they'll just spiral",False,False
ef5es28,t3_akfxxj,t3_akfxxj,Doctordoomduck,1,2019-01-27 22:16:30,/r/EDAnonymous/comments/akfxxj/psa_getting_skinny_does_not_fix_your_life/ef5es28/,95 pounds down and not much has changed for me.  Still not stopping though.,False,False
ef4wkh8,t3_akfxxj,t1_ef4k8iy,noonelovesacowgirl,1,2019-01-27 18:35:04,/r/EDAnonymous/comments/akfxxj/psa_getting_skinny_does_not_fix_your_life/ef4wkh8/,Yeah...I mean the reason people say that is because the disorder makes us think so. What other reason to obsess over losing weight is there other than imagining some light at the end of the tunnel. ,False,False
ef4u3oo,t3_akfxxj,t3_akfxxj,kalstl,1,2019-01-27 18:05:01,/r/EDAnonymous/comments/akfxxj/psa_getting_skinny_does_not_fix_your_life/ef4u3oo/,Even though I was truly going insane over food and fasting for 5 days then eating 1000s of calories in one sitting when I was at my LW I still feel like my life was better because of all of the positive attention and now I want to hide away until I can get there again :( fuck,False,False
ef4llw2,t3_akfxxj,t1_ef4k8iy,reddotm,1,2019-01-27 16:14:45,/r/EDAnonymous/comments/akfxxj/psa_getting_skinny_does_not_fix_your_life/ef4llw2/,"I’ve seen a lot of posts and comments on this sub and others for a while now that would say otherwise and I know people that have felt that way, so I thought I would share my experience in hopes that it would maybe deter some from thinking that it will change things and just giving perspective. When did I act like anything was easy? Living with this shit is hell no matter what weight, that was my point. I was trying to give words of encouragement. Apologies that this rubbed you the wrong way, but everyones disorders are different and it could be useful to someone else. Also had no intentions of trying to cure anyone of their disorder, just some food for thought. I’ve had an eating disorder for 7 years, I know it’s not a choice and I’m not saying that at all.. ",False,True
ef4lb3w,t3_akfxxj,t3_akfxxj,tseokii,1,2019-01-27 16:10:25,/r/EDAnonymous/comments/akfxxj/psa_getting_skinny_does_not_fix_your_life/ef4lb3w/,"i've been at my ugw before. I felt terrible. Sad, anxious, angry, crazy. BUT! I looked amazing. I think the last few years of my ED are me slowly learning how to get that small again without going crazy in the process.",False,False
ef4k8iy,t3_akfxxj,t3_akfxxj,yssjfs,1,2019-01-27 15:52:41,/r/EDAnonymous/comments/akfxxj/psa_getting_skinny_does_not_fix_your_life/ef4k8iy/,"Mmmmmm not gonna lie this post reads a little /r/wowthanksimcured. I don’t think many people here are under the impression that getting skinny will fix their lives.    I feel like this is an argument that I’ve been getting into A LOT on this subreddit lately, but nobody CHOOSES to have an eating disorder, and acting like it’s that easy totally minimizes the struggles of the people coming here for support. If I were capable of choosing to just love myself that would be awesome! But I’m not. And I wasn’t when I was underweight either.    Eating disorders are DISORDERS. Full stop.",False,False
ef4jdv8,t3_akfxxj,t3_akfxxj,zombeezinthetrap,1,2019-01-27 15:41:10,/r/EDAnonymous/comments/akfxxj/psa_getting_skinny_does_not_fix_your_life/ef4jdv8/,This post won’t stop me because I can’t read  /s   On a side note I told my friend this who is overweight. Our other friend whose a normal weight got mad at me and basically called me a hypocrite for not wanting our friend to improve her self esteem ???? 🙄🙄🙄🙄,False,False
