Comment ID,Link ID,Parent ID,Author,Score,Publish Date,Permalink,Text,Stickied,Is Submitter
ezjtofw,t3_d1533n,t3_d1533n,mal31_,1,2019-09-08 08:43:37,/r/EDAnonymous/comments/d1533n/is_there_such_thing_as_a_water_disorder/ezjtofw/,Bro if anyone finds this please tell me I remember being really young and refusing to drink water bc I didn’t want to have to pee during school like restrictive as hell but with water  yikes,False,False
ezjgd7x,t3_d1533n,t3_d1533n,BathT1m3,1,2019-09-08 07:03:30,/r/EDAnonymous/comments/d1533n/is_there_such_thing_as_a_water_disorder/ezjgd7x/,"Yeop. I don’t drink water. I have AN too, but cannot drink much water.",False,False
ezipyq4,t3_d1533n,t3_d1533n,vanillastevia,1,2019-09-08 03:27:57,/r/EDAnonymous/comments/d1533n/is_there_such_thing_as_a_water_disorder/ezipyq4/,It can happen but it’s usually accompanied by an underlying ed. [Here’s an article.](https://www.theatlantic.com/health/archive/2014/04/the-girl-who-wouldnt-drink-water/360342/),False,False
eziod0s,t3_d1533n,t1_ezihg8t,sstephenn,1,2019-09-08 03:14:45,/r/EDAnonymous/comments/d1533n/is_there_such_thing_as_a_water_disorder/eziod0s/,Hmmm I’ve heard of people being afraid to drink water bc they think it has calories,False,False
ezihg8t,t3_d1533n,t1_ezigzyj,MuddyWalruss,1,2019-09-08 02:19:22,/r/EDAnonymous/comments/d1533n/is_there_such_thing_as_a_water_disorder/ezihg8t/,"Not really. I was thinking more of a restrictive version, kinda like a restrictive eating disorder but with water.",False,True
ezigzyj,t3_d1533n,t3_d1533n,sstephenn,1,2019-09-08 02:15:38,/r/EDAnonymous/comments/d1533n/is_there_such_thing_as_a_water_disorder/ezigzyj/,Do you mean people who drink water excessively?,False,False
ezhe12p,t3_d1533n,t3_d1533n,SubBiscuit,1,2019-09-07 21:18:37,/r/EDAnonymous/comments/d1533n/is_there_such_thing_as_a_water_disorder/ezhe12p/,"When it says eating it means ""consumption"" so I'm assuming something involving water would still fall under an eating disorder.",False,False
