Comment ID,Link ID,Parent ID,Author,Score,Publish Date,Permalink,Text,Stickied,Is Submitter
f9g33pu,t3_e4ibci,t1_f9fdqqy,liskovaa,1,2019-12-02 07:14:48,/r/EDAnonymous/comments/e4ibci/is_anyone_else_on_here_lonely_as_fuck/f9g33pu/,I do have some friends don’t worry! I kinda wish I did AA. According to my therapist it’s extremely rare for someone to get sober and stay sober without AA or rehab so... go me? Lol,False,False
f9fn0xd,t3_e4ibci,t3_e4ibci,mtnkt,1,2019-12-02 03:44:02,/r/EDAnonymous/comments/e4ibci/is_anyone_else_on_here_lonely_as_fuck/f9fn0xd/,Yeah :( I’m living in a new country and I have no friends and no money do to anything lol,False,False
f9fdxab,t3_e4ibci,t3_e4ibci,TheShortGerman,1,2019-12-02 00:24:53,/r/EDAnonymous/comments/e4ibci/is_anyone_else_on_here_lonely_as_fuck/f9fdxab/,PM me  I feel this so hard. My bf of 2 years dumped me in fucking March of 2018 and I haven't had anyone to love me since. It's coming up on 2 years alone and I just feel so isolated and like the only thing that makes me feel better is obsessing over my ED and food,False,False
f9fdt1n,t3_e4ibci,t1_f9c3bz5,TheShortGerman,1,2019-12-02 00:22:48,/r/EDAnonymous/comments/e4ibci/is_anyone_else_on_here_lonely_as_fuck/f9fdt1n/,yep about to graduate in December and feel like I'm gonna lose a huge part of what forces me to get out of bed in the morning,False,False
f9fdqqy,t3_e4ibci,t1_f9dnmrp,TheShortGerman,1,2019-12-02 00:21:38,/r/EDAnonymous/comments/e4ibci/is_anyone_else_on_here_lonely_as_fuck/f9fdqqy/,"I'm also an alcoholic and have an ED and now all my friends are gym and AA friends  just wanted to throw it out there, yes I'm isolating hardcore, but it is possible to have friends to hang with that don't require food or booze",False,False
f9fbayc,t3_e4ibci,t3_e4ibci,fabluous,1,2019-12-01 23:39:05,/r/EDAnonymous/comments/e4ibci/is_anyone_else_on_here_lonely_as_fuck/f9fbayc/,"I kind of want someone to just tell me what to do so that i have a purpose.  Not like as a ""submission of power"" or anything sexual, but i have no will, at all.  Now that I'm trying to explain what i want, basically, i want a friend so I'll have motivation/incentive to be functional.   I realize now I'm probably clinically depressed. What do?   Getting ""help"" is such a weird thing to even consider. Like, why would i do that. I don't see how ""getting help"" would help. I never got help for my eating disorder or my anxiety because at the end of the day i know it's just about doing my best to manage my afflictions and i don't need someone to tell me that or give me advice on how to. Because ""managing"" doesn't factor in that i lack the will to even want to.  When i say friend i guess i just mean i literally want company. Isn't that a given though when someone says they want a friend? Why am i even clarifying lol  Yes I'm lonely as fuck but also I'm scared of people.  Loneliness makes you not want to take care of yourself. I still shower every day and go where I have to go because i know i can do that much. But it's tempting to just not, and see what happens, i guess.  I hate writing this out because i know i sound like a self-involved edgelord wallowing in my own misery. I promise i'm chill.   I really light up when I'm around others. I like laughing and smiling and i like being outside and i love the sun and if there's no sun out i love the fresh air. I love cats and dogs and i love working with my hands and being absorbed in my work and i love moving around and exercising and being part of something.",False,False
f9ex9lz,t3_e4ibci,t3_e4ibci,MadLassWithABox,1,2019-12-01 20:32:19,/r/EDAnonymous/comments/e4ibci/is_anyone_else_on_here_lonely_as_fuck/f9ex9lz/,"Lonely as all fuck.  I’m bad at relationships, romantic or platonic. I’ve been single for years. Said ‘if dating was meant to happen it’d happen’.  Finally put some effort into it. Put myself out there (meeting people online) and two I’ve actually gotten to the point of meeting in person ghosted me after the first meeting.  Feeling super lovable right now /s.  It’s bittersweet to see I’m not alone in struggling with this. Hope everyone finds some happiness.",False,False
f9eotkd,t3_e4ibci,t1_f9dgj0d,1--___--1zZz,3,2019-12-01 18:48:27,/r/EDAnonymous/comments/e4ibci/is_anyone_else_on_here_lonely_as_fuck/f9eotkd/,Me too :( At least I can say I have a rich inner life.,False,False
f9elh1l,t3_e4ibci,t3_e4ibci,ojiua,1,2019-12-01 18:20:32,/r/EDAnonymous/comments/e4ibci/is_anyone_else_on_here_lonely_as_fuck/f9elh1l/,I feel this. I’ve been off work for six days and have hardly left my house. I’ve deleted all my social media too because it was making me feel worse but now I literally have no outlet to my friends/family other than like... texting. I’ve honestly never felt so alone in my life but I don’t have the motivation to do anything about it. Not to be cliché but food is the only control I have right now. My self esteem is pretty much 0% and its making me isolate myself. I want to do nice things for myself but I won’t let myself. Want my nails done? My hair? New clothes? Want to go to dinner with friends? Not until you lose x amount of weight. I hate myself for being this way.,False,False
f9eicwf,t3_e4ibci,t3_e4ibci,ew_gross_stop_no,2,2019-12-01 17:57:03,/r/EDAnonymous/comments/e4ibci/is_anyone_else_on_here_lonely_as_fuck/f9eicwf/,Oh man are you me??? I can’t socialize now that I’m out of college because I feel like I spend all my time either at work or working out and I can’t give up either of those things for a social life so I just have no friends. It’s awful. You aren’t alone!,False,False
f9efej2,t3_e4ibci,t1_f9cz16a,Sprudosbbz,3,2019-12-01 17:36:56,/r/EDAnonymous/comments/e4ibci/is_anyone_else_on_here_lonely_as_fuck/f9efej2/,sending you much love. &lt;3,False,False
f9eemv1,t3_e4ibci,t1_f9ee777,medicinal-blueberry,1,2019-12-01 17:31:47,/r/EDAnonymous/comments/e4ibci/is_anyone_else_on_here_lonely_as_fuck/f9eemv1/,Feel free to message me! :),False,True
f9eedm8,t3_e4ibci,t1_f9dh1b9,medicinal-blueberry,2,2019-12-01 17:30:10,/r/EDAnonymous/comments/e4ibci/is_anyone_else_on_here_lonely_as_fuck/f9eedm8/,You got this too!! Hang in there :),False,True
f9ee7lu,t3_e4ibci,t1_f9dnum8,medicinal-blueberry,3,2019-12-01 17:29:09,/r/EDAnonymous/comments/e4ibci/is_anyone_else_on_here_lonely_as_fuck/f9ee7lu/,Hugs. Feel free to message me :),False,True
f9ee777,t3_e4ibci,t3_e4ibci,Arroya-,2,2019-12-01 17:29:05,/r/EDAnonymous/comments/e4ibci/is_anyone_else_on_here_lonely_as_fuck/f9ee777/,"Hi, fresh out of college (graduated in August) and I feel this. Hard.  Could definitely use a support system too",False,False
f9ee30u,t3_e4ibci,t1_f9dx4gu,medicinal-blueberry,1,2019-12-01 17:28:22,/r/EDAnonymous/comments/e4ibci/is_anyone_else_on_here_lonely_as_fuck/f9ee30u/,"Omg! You are so sweet. Thank you for taking the time to help me &lt;3 I absolutely love the massage idea!! I think I’m going to do that. You’re spot on.... like, I saw my sister over thanksgiving and while watching TV I was laying on her lap and she aimlessly scratched my head for like 15 minutes.  Even though it was obviously platonic, just having that human touch made me realize how much I miss it. Wonderful ideas, I appreciate you :)",False,True
f9edne4,t3_e4ibci,t1_f9e879k,medicinal-blueberry,1,2019-12-01 17:25:26,/r/EDAnonymous/comments/e4ibci/is_anyone_else_on_here_lonely_as_fuck/f9edne4/,Yes message me :),False,True
f9e9q89,t3_e4ibci,t1_f9bt613,nothingelsetosaynow,3,2019-12-01 17:00:55,/r/EDAnonymous/comments/e4ibci/is_anyone_else_on_here_lonely_as_fuck/f9e9q89/,I can definitely relate to this.,False,False
f9e879k,t3_e4ibci,t3_e4ibci,wannabegrapefruit,3,2019-12-01 16:51:54,/r/EDAnonymous/comments/e4ibci/is_anyone_else_on_here_lonely_as_fuck/f9e879k/,Can we please please please please please please be buds. Please.,False,False
f9e5ld5,t3_e4ibci,t1_f9c3bz5,spideywidey2013,5,2019-12-01 16:40:23,/r/EDAnonymous/comments/e4ibci/is_anyone_else_on_here_lonely_as_fuck/f9e5ld5/,Omg me,False,False
f9dxe08,t3_e4ibci,t1_f9c3bz5,dollbby,5,2019-12-01 16:00:48,/r/EDAnonymous/comments/e4ibci/is_anyone_else_on_here_lonely_as_fuck/f9dxe08/,I’m in the exact same boat. I’m literally terrified of what’s gonna come next because I have no motivation to actually do anything...,False,False
f9dx4gu,t3_e4ibci,t3_e4ibci,toasttocoast,4,2019-12-01 15:59:58,/r/EDAnonymous/comments/e4ibci/is_anyone_else_on_here_lonely_as_fuck/f9dx4gu/,"Hey, I'm sorry you are feeling this way right now &lt;3.  I know you're probably just venting and don't need obvious solutions but I'll list some anyways....  You should try joining the discord for this sub, or discord for some other subs.  It can be nice to have a group of people to talk to and you can even voice with people.  Do you play any video games?  I feel like most of my friendships are online with people I've met gaming and it's not quite the same if you can't hug them, but they are still real friendships.  Do you have a job? I think that's where 90% of people make new friends in adulthood.  If you're busy with school, maybe you could find a job or volunteer position that's only a few hours like one day a week.  Also, if it's in your budget, you could try getting a massage like once every 4-6 weeks.  It's kind of amazing what 30 minutes of human touch can do for your psyche if you're not getting it regularly, not to mention how amazing you'll feel afterwards.  If it's something you want to try and can afford right now, look into going to an actual licensed massage therapist and not a cheap spa with unlicensed people.  A real massage is soooo much more beneficial and enjoyable compared to a girl walking on your back for 10 minutes and doing some weird Swedish massage shit while she chats with another masseuse.",False,False
f9dqka1,t3_e4ibci,t3_e4ibci,miawallace99,3,2019-12-01 15:32:01,/r/EDAnonymous/comments/e4ibci/is_anyone_else_on_here_lonely_as_fuck/f9dqka1/,this was the year my ed got REALLY bad and it was also the year i lost all of my friends. all of them. i'm literally alone and i can't share anyone about my ed so i talk to myself i know it sounds depressing as fuck but it's the only thing i have left: myself.,False,False
f9dp48d,t3_e4ibci,t3_e4ibci,eas0913,5,2019-12-01 15:25:44,/r/EDAnonymous/comments/e4ibci/is_anyone_else_on_here_lonely_as_fuck/f9dp48d/,"I feel like i could write a novel-length response here sympathizing with everyone, but i can’t even put that into words. Just want to say this makes me feel so much better/not alone, bc i feel terribly lonely and sad and lame every single day and life sucks and it rarely feels like it’s going to get better. So thanks everyone for making me feel seen/slightly normal this Sunday.",False,False
f9dnxra,t3_e4ibci,t1_f9dgj0d,miawallace99,7,2019-12-01 15:20:58,/r/EDAnonymous/comments/e4ibci/is_anyone_else_on_here_lonely_as_fuck/f9dnxra/,same,False,False
f9dnum8,t3_e4ibci,t3_e4ibci,Spectrachic311311,7,2019-12-01 15:20:27,/r/EDAnonymous/comments/e4ibci/is_anyone_else_on_here_lonely_as_fuck/f9dnum8/,"I could have written this too. I spend my life restricting, exercising, meal planning, and working. I don’t go to church anymore and that used to be a big thing for me. I used to be really a good friend and now I’m just annoying to be around. I literally hate this disease. I’ll be your buddy—we need all we can get.",False,False
f9dnmrp,t3_e4ibci,t1_f9bj5b1,liskovaa,11,2019-12-01 15:19:12,/r/EDAnonymous/comments/e4ibci/is_anyone_else_on_here_lonely_as_fuck/f9dnmrp/,Yeppppp. Ever since I quit drinking (yay alcoholism lol) I basically lost all my friends. Who knew that the only acceptable social activities are drinking and eating 🙄,False,False
f9dlo7o,t3_e4ibci,t3_e4ibci,zesty_lime_manual,3,2019-12-01 15:11:21,/r/EDAnonymous/comments/e4ibci/is_anyone_else_on_here_lonely_as_fuck/f9dlo7o/,Relatable.  I keep my circle dumb right so I don't disappoint anyone or make to many opportunities to feel ashamed.  I basically just work Xbox repeat,False,False
f9dh1b9,t3_e4ibci,t3_e4ibci,UnderwearFighter,5,2019-12-01 14:51:07,/r/EDAnonymous/comments/e4ibci/is_anyone_else_on_here_lonely_as_fuck/f9dh1b9/,"I polarize between self isolation because I don’t want to burden people vs over socialization when I feel completely lonely and NEED human interaction. Recently, though, I’ve been more recurrently in a grey area where it’s been easier to be myself, make friends, hang out with people. I think it may be because I’ve completely given up on the idea of depending on human interaction/intimacy for my happiness. I don’t know if this is the natural result of having too many almost-romances and almost-friends, or if it’s mental illness, or budding self-sufficiency. I don’t know if/when it gets any easier. Despite everything, I’m still always on the edge of a panic attack about something or someone. I’ve fluctuated between almost obese to almost underweight and my satisfaction levels have been about the same. The only thing that truly let me be at peace (relatively) was to stop looking outwardly for affection, and to start treating myself like my partner in crime. I know it’s the same bullshit everyone preaches, but it’s worth something.  I don’t have any solutions to offer, but I just want to say that you are not alone. We’re in this together. Hope it gets better, sending you virtual hugs/cookies/equivalent to your love language.   You got this.",False,False
f9dgj0d,t3_e4ibci,t1_f9bt613,breadndread,15,2019-12-01 14:48:27,/r/EDAnonymous/comments/e4ibci/is_anyone_else_on_here_lonely_as_fuck/f9dgj0d/,I maladaptive daydream so hard and I feel it's only getting worse as I restrict :///,False,False
f9dg8to,t3_e4ibci,t3_e4ibci,scaredyk4t,3,2019-12-01 14:46:50,/r/EDAnonymous/comments/e4ibci/is_anyone_else_on_here_lonely_as_fuck/f9dg8to/,"Yes I feel so alone but I think I’m to blame. I haven’t seen my close group of friends in a while because my work has gotten a lot more busy and the rest of my free time is ed related. I come home at 9, shower, then spend like an hour figuring out what to eat, then take another 45 min to eat, then sleep. I also don’t like eating then going out. I feel like eating has to be the last thing I do before bed so I don’t come back home and eat more. So if I don’t work late and someone asks to hang out I usually say no because it will ruin my “dinner plans”.",False,False
f9dev3e,t3_e4ibci,t3_e4ibci,feiturdrengur,3,2019-12-01 14:41:02,/r/EDAnonymous/comments/e4ibci/is_anyone_else_on_here_lonely_as_fuck/f9dev3e/,"Yes, I am *so lonely*. I'm convinced nobody will ever love me and they're right not to.",False,False
f9dcxu7,t3_e4ibci,t3_e4ibci,beautifulchaos22,3,2019-12-01 14:32:22,/r/EDAnonymous/comments/e4ibci/is_anyone_else_on_here_lonely_as_fuck/f9dcxu7/,"Holy moly, I could have written this. I'm in pretty much the same boat right now. Broke up with my boyfriend in June because my mental health was too much for a relationship, it's definitely harder to find other singles when you're not in some sort of school or program. I'm not looking to get into a relationship right now, because I'm so messed up and I don't want to cause any more collateral damage.  My siblings are lovely and I love them to bits, but they too are in serious (like either married or have been together for 5+ years), and they have their own lives and I don't want to bother them with my stupid bullshit.   All my friends have either forgotten about me and don't respond when I've tried to reach out or they are busy being awesome and having kids or getting married or excelling in their careers. The good friends I do have are all over geographically, and I don't have any of my best friends near enough to visit often.   I've tried to make new friends, but I have social anxiety and it's so hard when I've been in and out of the hospital for my mental health.   &amp;#x200B;  My ED is kicking my ass, and it's like everyone else got the memo that the success train was leaving and I didn't and I got left in the dirt and had to catch the depressed express train to Shitsville. It's so hard and I don't know why I'm restricting/ doing other ED behaviours either. I'm so stuck and I'm trying to rebuild my life, but it's exhausting and I don't have that much energy to spare.  &amp;#x200B;  Sorry this turned into a friggin essay, but I can relate so hard. I'm really sorry that you're feeling like this, OP. I really am. You're not alone though. I hope you have a nice day and maybe find something nice to do for self care :)",False,False
f9dcead,t3_e4ibci,t1_f9czlxo,blueberry0666,3,2019-12-01 14:29:39,/r/EDAnonymous/comments/e4ibci/is_anyone_else_on_here_lonely_as_fuck/f9dcead/,wow this is painfully relatable,False,False
f9dc9aw,t3_e4ibci,t3_e4ibci,blueberry0666,3,2019-12-01 14:28:51,/r/EDAnonymous/comments/e4ibci/is_anyone_else_on_here_lonely_as_fuck/f9dc9aw/,ok ME! also nice username! :)   &amp;#x200B;  seriously. if anyone wants to chat for something hmu. I'm drowning in finals rn and life stress but i am also drowning in loneliness and haven't had a legitimate conversation with someone in person in probably months. help??,False,False
f9da2np,t3_e4ibci,t3_e4ibci,psybeams,3,2019-12-01 14:20:16,/r/EDAnonymous/comments/e4ibci/is_anyone_else_on_here_lonely_as_fuck/f9da2np/,i only talk to my bf i have 11 people on snap that i don’t speak to it’s gr8   jk i’m so fucking lonely why did i cut everyone off,False,False
f9da2eo,t3_e4ibci,t3_e4ibci,KATTxxK,3,2019-12-01 14:20:14,/r/EDAnonymous/comments/e4ibci/is_anyone_else_on_here_lonely_as_fuck/f9da2eo/,"Once i got ill with this ED i isolated myself.  I hated that every time anyone spoke to me they couldn't help but mention my weight, why do people think its okay to do that?  So anyway i just stopped talking and made excuses why i didn't want to see anyone.  I am 42 and hardly leave the house now,  i have only had issues for 3 years with restricted eating ( diagnosed A TYpical) although mental health problems most of my life.  I hope things improve for you hun xx",False,False
f9d9to3,t3_e4ibci,t3_e4ibci,violxtleader,7,2019-12-01 14:18:49,/r/EDAnonymous/comments/e4ibci/is_anyone_else_on_here_lonely_as_fuck/f9d9to3/,Plus everyone seems to only want to go out to eat as a way of socializing? Like ‘hey I haven’t seen you in a while let’s go out for a 2000kcal meal’ like??????,False,False
f9d9kes,t3_e4ibci,t3_e4ibci,crystal0001,6,2019-12-01 14:17:21,/r/EDAnonymous/comments/e4ibci/is_anyone_else_on_here_lonely_as_fuck/f9d9kes/,I’d LOVE to be buds,False,False
f9d9bph,t3_e4ibci,t3_e4ibci,deadby21haha,3,2019-12-01 14:16:02,/r/EDAnonymous/comments/e4ibci/is_anyone_else_on_here_lonely_as_fuck/f9d9bph/,Yeah   Like my disorder just pushes me away from everyone I care about because I don't go out with them and my family is always just worried,False,False
f9d6xdd,t3_e4ibci,t3_e4ibci,boo_snug,3,2019-12-01 14:06:40,/r/EDAnonymous/comments/e4ibci/is_anyone_else_on_here_lonely_as_fuck/f9d6xdd/,"Yeah I have a couple of close friends but they don’t know the extent of how much I don’t like myself. Haven’t had a boyfriend since I left an abusive relationship in 2017. Now I am absolutely convinced it’s because of the way I look.   Here’s to getting better, physically and mentally,  in 2020.",False,False
f9d6qpv,t3_e4ibci,t3_e4ibci,deadassimnot,2,2019-12-01 14:05:36,/r/EDAnonymous/comments/e4ibci/is_anyone_else_on_here_lonely_as_fuck/f9d6qpv/,"I definitely feel this. I’m mostly recovered at this point and it’s made me realize that all throughout my ED I wanted so badly to be small and unnoticeable and to be less cause I always felt like too much but it only made me temperamental, overshare, and super dependent. Its really really good progress that you’re looking at your own reasoning behind your behaviors and be gentle about any lack of logic that might exist because all your thoughts and feelings are still Valid.   And let’s be buds lmao message me",False,False
f9d2mla,t3_e4ibci,t3_e4ibci,bunchofbroccoli,2,2019-12-01 13:45:50,/r/EDAnonymous/comments/e4ibci/is_anyone_else_on_here_lonely_as_fuck/f9d2mla/,"Restriction leads to loneliness, loneliness makes me feel depressed, which fuels restriction. Cue vicious cycle.",False,False
f9d0e12,t3_e4ibci,t3_e4ibci,hedge-mustard,6,2019-12-01 13:34:50,/r/EDAnonymous/comments/e4ibci/is_anyone_else_on_here_lonely_as_fuck/f9d0e12/,"I’m in the same boat, I have very few friends and spend a lot of time alone with my thoughts and weird restriction behavior...if you ever want someone to talk to, feel free to reach out! I’m sorry that you’re going through this too &lt;3",False,False
f9czlxo,t3_e4ibci,t3_e4ibci,Edith-Anne-Newton,1,2019-12-01 13:32:17,/r/EDAnonymous/comments/e4ibci/is_anyone_else_on_here_lonely_as_fuck/f9czlxo/,"Lonely af. With u bro. All the hangriness turned me into a dickwad and made all the other issues I had with interacting with people way worse.   It's super weird being in that crack. You get sick and miss out on a lot of personal development and then when you gain some amount of clarity, everyone's gone. They moved on and self-actualized. Ive always been a lil behind my peers but having an ED fucked with my ability to do anything abt it.",False,False
f9czljw,t3_e4ibci,t3_e4ibci,northernboarder,1,2019-12-01 13:32:13,/r/EDAnonymous/comments/e4ibci/is_anyone_else_on_here_lonely_as_fuck/f9czljw/,I feel this too. Broke up with my ex in March then finished uni in April so all my friends from there left and moved to different cities. I have a full time job now and have friends from there but none of us are close enough to like hang out every night since they are all in a relationship or married. My best friend doesn’t live in my city anymore either so it is very lonely :(,False,False
f9cz16a,t3_e4ibci,t3_e4ibci,daqoseng,5,2019-12-01 13:29:23,/r/EDAnonymous/comments/e4ibci/is_anyone_else_on_here_lonely_as_fuck/f9cz16a/,"jesus this hits hard...  i started starving myself because growing up when i had a big friend group i was called the model for being tall and naturally skinny.  when i lost my friends due to depression i started starving myself so i could retain that “beauty” that i thought i originally had friends for. as my anorexia got worse i stopped wanting to be thin for beauty and instead wanted to be so painfully thin that people would give me attention and beg me to get better, or that i’d pass out and someone would have to notice me because i was in need of medical help.  it’s been 5 years and i still do not have any friends.  it is really sad writing this all out and realizing what had happened.   i hope one day we can allow ourselves to be loved unconditionally and as we are, just the way we do to others. we all deserve love.",False,False
f9crixx,t3_e4ibci,t3_e4ibci,jellyfishinaglassjar,1,2019-12-01 12:57:00,/r/EDAnonymous/comments/e4ibci/is_anyone_else_on_here_lonely_as_fuck/f9crixx/,I feel this. bf of four years dumped me 2 yrs ago and my close friend (We had some sort of closer than friend thing going over the summer) of almost 3 years started body shaming me for being overweight and then ghosted me which triggered my restrictive habits and isolation from friends and family. Ive signed up for classes and extracurriculars to fill that lonely void that my exes left and keep my mind and body active but i still get those pangs of loneliness from time to time. Sending best wishes to you &lt;3,False,False
f9che2g,t3_e4ibci,t1_f9cf7vj,medicinal-blueberry,2,2019-12-01 12:09:40,/r/EDAnonymous/comments/e4ibci/is_anyone_else_on_here_lonely_as_fuck/f9che2g/,"Jeez, similar stories. So sorry you’re going through this. Would love to chat if you’re up for it!!",False,True
f9cf7vj,t3_e4ibci,t3_e4ibci,pokeupokeu,6,2019-12-01 11:56:05,/r/EDAnonymous/comments/e4ibci/is_anyone_else_on_here_lonely_as_fuck/f9cf7vj/,So much of this disease is just the isolation. Whether self inflicted or mental. It really sucks my eating disorder relapsed hard after i graduated college and my boyfrjend of years and i broke up and suddenly im alone in so many ways. So much of this sub helps break the endless loneliness and provide support about this problem i cant talk about with anyone else. Because in real life i feel so endlessly alone,False,False
f9c6uwn,t3_e4ibci,t3_e4ibci,skinnylittlebitchh,1,2019-12-01 11:05:02,/r/EDAnonymous/comments/e4ibci/is_anyone_else_on_here_lonely_as_fuck/f9c6uwn/,"The older we get, the more lonely we get",False,False
f9c3bz5,t3_e4ibci,t3_e4ibci,franetics,2,2019-12-01 10:48:21,/r/EDAnonymous/comments/e4ibci/is_anyone_else_on_here_lonely_as_fuck/f9c3bz5/,I’m already lonely but I’m about to graduate college and I have no plans. I used to be someone with a lot of potential and it feels like it’s all evaporated. I have no clue what I’m gonna do but if I’m lonely now I’m terrified to see how I’ll be post grad,False,False
f9byz3o,t3_e4ibci,t1_f9bsq5w,undercoverbunky,2,2019-12-01 10:28:13,/r/EDAnonymous/comments/e4ibci/is_anyone_else_on_here_lonely_as_fuck/f9byz3o/,i hate how relatable this is,False,False
f9bt613,t3_e4ibci,t3_e4ibci,marilbs,2,2019-12-01 10:00:58,/r/EDAnonymous/comments/e4ibci/is_anyone_else_on_here_lonely_as_fuck/f9bt613/,"I literally replace all socializing with daydreams in my head tricking my fucking monkey brain into thinking I have fulfilling life, but the mind knows and she is not pleased with me fuck",False,False
f9bsq5w,t3_e4ibci,t3_e4ibci,ChaosBedlam,4,2019-12-01 09:58:19,/r/EDAnonymous/comments/e4ibci/is_anyone_else_on_here_lonely_as_fuck/f9bsq5w/,"i am so lonely it fucking hurts! i am literally worthless, i contribute nothing to society and no one even knows i exist. Life is hell.",False,False
