Comment ID,Link ID,Parent ID,Author,Score,Publish Date,Permalink,Text,Stickied,Is Submitter
f7o63a9,t3_dwyui3,t3_dwyui3,tigerchik,1,2019-11-16 10:25:37,/r/EDAnonymous/comments/dwyui3/the_referral_is_in/f7o63a9/,your mom sounds like maybe she knows her role in it and felt embarrassed about it.,False,False
f7njl8z,t3_dwyui3,t1_f7nacr9,agw212,1,2019-11-16 06:23:54,/r/EDAnonymous/comments/dwyui3/the_referral_is_in/f7njl8z/,"I know, I almost asked her if she just wanted me to starve.",False,True
f7nacr9,t3_dwyui3,t3_dwyui3,SaturdayNightCity,1,2019-11-16 02:13:35,/r/EDAnonymous/comments/dwyui3/the_referral_is_in/f7nacr9/,She doesn’t seem to understand that anorexia sufferers... have to eat... to stay alive,False,False
f7ms4dx,t3_dwyui3,t3_dwyui3,roybIair,1,2019-11-15 20:41:11,/r/EDAnonymous/comments/dwyui3/the_referral_is_in/f7ms4dx/,I'm happy for you!! its gonna be scary and tough at first but you're making the right decision!!! I know you can do it!!,False,False
f7mq961,t3_dwyui3,t3_dwyui3,Carodactyl,1,2019-11-15 20:14:52,/r/EDAnonymous/comments/dwyui3/the_referral_is_in/f7mq961/,"“I see him eat” well yeah, it’s a basic human function that doesn’t suddenly disappear when you develop an eating disorder, that’s not physically possible. What an odd thing to say, sorry you had to go through that! Shoutout to the doctor for taking you seriously despite her comments  On another note, I’m really happy you got referred to a clinic!! It’s scary but you’re right, it’s for the best. Wishing you the best! Xx",False,False
f7mpvxx,t3_dwyui3,t3_dwyui3,nosleeptill8,1,2019-11-15 20:09:44,/r/EDAnonymous/comments/dwyui3/the_referral_is_in/f7mpvxx/,"It’s a really mature thing to accept that maybe you aren’t okay and do need help. Good for you. 🥰 I’m so sorry about your mom, the things they say can cut so very deep.",False,False
