Comment ID,Link ID,Parent ID,Author,Score,Publish Date,Permalink,Text,Stickied,Is Submitter
ep7h433,t3_bt6x5b,t3_bt6x5b,manymanybutts,1,2019-05-28 17:15:35,/r/EDAnonymous/comments/bt6x5b/cant_wait_until_im_skinny_enough_to_actually_wear/ep7h433/,I’ve probably spent upwards of $1500-2000 on new clothes in the last year and 85% of them are too big for me lmao. I want to buy clothes in sizes I know I can’t fit but I’m worried I’d never get small enough to fit them,False,False
ep05jbj,t3_bt6x5b,t3_bt6x5b,softcoffee,1,2019-05-27 10:28:29,/r/EDAnonymous/comments/bt6x5b/cant_wait_until_im_skinny_enough_to_actually_wear/ep05jbj/,"I have a closet full of clothes but I still have to go shopping because those skinny clothes don't fit, and my hiding-the-fat clothes don't either. I always buy too small or too big when I know damn well I always end up in the middle.   I have a package of size s/xs clothes coming in the mail, and going straight to the closet 😭",False,False
eoydmbc,t3_bt6x5b,t3_bt6x5b,THE_KIWIS_SHALL_RISE,1,2019-05-27 01:30:04,/r/EDAnonymous/comments/bt6x5b/cant_wait_until_im_skinny_enough_to_actually_wear/eoydmbc/,relate relate relate,False,False
eoxj8tu,t3_bt6x5b,t1_eoxaj20,starsinmyeyess,1,2019-05-26 21:39:06,/r/EDAnonymous/comments/bt6x5b/cant_wait_until_im_skinny_enough_to_actually_wear/eoxj8tu/,"sorry about that, whoever's doing that is an asshole. &lt;3",False,True
eoxaj20,t3_bt6x5b,t1_eowri6z,AshamedAmphibian,1,2019-05-26 20:41:12,/r/EDAnonymous/comments/bt6x5b/cant_wait_until_im_skinny_enough_to_actually_wear/eoxaj20/,"Whoever's down voting all my comments, thank you. It makes it far, far easier for me to restrict. I hate myself a lot. :)",False,False
eox7xiy,t3_bt6x5b,t1_eowk1ar,starsinmyeyess,1,2019-05-26 20:24:50,/r/EDAnonymous/comments/bt6x5b/cant_wait_until_im_skinny_enough_to_actually_wear/eox7xiy/,"Buttttttttt you should also be prioritizing what you want and desire to wear over what he wants you to wear/what he prefers... he shouldn't get to decide what you wear, especially if it makes you uncomfortable. :/",False,True
eox3v9d,t3_bt6x5b,t1_eovuj7d,starsinmyeyess,1,2019-05-26 19:58:20,/r/EDAnonymous/comments/bt6x5b/cant_wait_until_im_skinny_enough_to_actually_wear/eox3v9d/,"Lol yeah, thanks for the reminder tho :))",False,True
eox3dbg,t3_bt6x5b,t1_eovvbod,thecheezyweezy,1,2019-05-26 19:54:55,/r/EDAnonymous/comments/bt6x5b/cant_wait_until_im_skinny_enough_to_actually_wear/eox3dbg/,"""No, it's your ED/OCD/EDNOS/job/parents""",False,False
eowri6z,t3_bt6x5b,t3_bt6x5b,AshamedAmphibian,1,2019-05-26 18:37:54,/r/EDAnonymous/comments/bt6x5b/cant_wait_until_im_skinny_enough_to_actually_wear/eowri6z/,I want to fit into Jack Skellington clothes in the future. Maybe once I get to a BMI 11 or so.,False,False
eowom7i,t3_bt6x5b,t3_bt6x5b,SymptomOfTheStorm,1,2019-05-26 18:18:00,/r/EDAnonymous/comments/bt6x5b/cant_wait_until_im_skinny_enough_to_actually_wear/eowom7i/,I finally look okay in athelesiure clothes and tbh it’s been my goal for like 8 years.   Now I wanna push it and look awesome in them,False,False
eowk1ar,t3_bt6x5b,t3_bt6x5b,tlb198,1,2019-05-26 17:47:59,/r/EDAnonymous/comments/bt6x5b/cant_wait_until_im_skinny_enough_to_actually_wear/eowk1ar/,"My bf fancies goth/grunge girls who post pics of them in harnesses and lingerie on insta and I'm too fat for that, I know how you feel lol",False,False
eow5lhq,t3_bt6x5b,t3_bt6x5b,byie,1,2019-05-26 16:15:40,/r/EDAnonymous/comments/bt6x5b/cant_wait_until_im_skinny_enough_to_actually_wear/eow5lhq/,I- you summarized fear in one sentence,False,False
eow12uo,t3_bt6x5b,t1_eouoo4l,livipup,1,2019-05-26 15:47:25,/r/EDAnonymous/comments/bt6x5b/cant_wait_until_im_skinny_enough_to_actually_wear/eow12uo/,I feel this really hard because most of the clothes I want to wear wouldn't look good on me because I have no boobs and a lot of stores don't even sell clothes in size S while I need XS or XXS depending on the brand. It's almost impossible to find anything that looks good on me.,False,False
eovy09b,t3_bt6x5b,t1_eouoo4l,jellyboness,1,2019-05-26 15:26:04,/r/EDAnonymous/comments/bt6x5b/cant_wait_until_im_skinny_enough_to_actually_wear/eovy09b/,I’m not even at my UGW yet and this happened to me. Now all my cute aesthetic clothes make me look fat because they’re all too big. Only leggings fit properly :(,False,False
eovvbod,t3_bt6x5b,t1_eovd1dm,hello_imdaisy,1,2019-05-26 15:06:49,/r/EDAnonymous/comments/bt6x5b/cant_wait_until_im_skinny_enough_to_actually_wear/eovvbod/,Do you think it is stuff that could be tailored? That's what I've done with a few things that I bought a little small but by the time tried it on again it was a little big in some places. can be less money than buying a whole new thing depending,False,False
eovv7fv,t3_bt6x5b,t1_eovshrb,girlinamber,1,2019-05-26 15:06:00,/r/EDAnonymous/comments/bt6x5b/cant_wait_until_im_skinny_enough_to_actually_wear/eovv7fv/,i also suffer from ugly chubby baby face 😭 even at my lowest. it sucks so bad,False,False
eovuj7d,t3_bt6x5b,t3_bt6x5b,Rabb1tH3ad,1,2019-05-26 15:01:18,/r/EDAnonymous/comments/bt6x5b/cant_wait_until_im_skinny_enough_to_actually_wear/eovuj7d/,"Well I've got bad news for you.   Doesn't matter how your body looks, you're never gonna be happy with how those clothes look on you, until you(and all of us) works on the inside-y parts.  But I'm sure you already know that.",False,False
eovshrb,t3_bt6x5b,t1_eoviy0w,obvious-human,1,2019-05-26 14:47:03,/r/EDAnonymous/comments/bt6x5b/cant_wait_until_im_skinny_enough_to_actually_wear/eovshrb/,ive accepted ive got a fat ugly chubby baby face for the rest of my life .... but at least my body can look good in clothes (maybe),False,False
eovq669,t3_bt6x5b,t3_bt6x5b,BowtieGhost,1,2019-05-26 14:30:39,/r/EDAnonymous/comments/bt6x5b/cant_wait_until_im_skinny_enough_to_actually_wear/eovq669/,"So true!  My current clothes are decent but not my aesthetic. Why spend money when I'm trying to lose weight?  Although the kind of people who lose weight and keep it off are ~generally~ the people who are comfortable with their body, even if I were to become that, what's the point of buying it at a ""happy"" fat if being that will mean I'll lose that weight and keep it off? I'd just have to buy it twice!",False,False
eovksxt,t3_bt6x5b,t3_bt6x5b,conicalsquare,1,2019-05-26 13:53:41,/r/EDAnonymous/comments/bt6x5b/cant_wait_until_im_skinny_enough_to_actually_wear/eovksxt/,Literally meeeee. I have an actual box of clothes from when I was at my UGW before that I can’t wait to wear again.,False,False
eovja7p,t3_bt6x5b,t3_bt6x5b,oatmilkslut,1,2019-05-26 13:42:40,/r/EDAnonymous/comments/bt6x5b/cant_wait_until_im_skinny_enough_to_actually_wear/eovja7p/,I’ve been saving a bunch of gift cards and not using them till I hit my goal weight.,False,False
eoviy0w,t3_bt6x5b,t1_eouoo4l,penny2cents,1,2019-05-26 13:39:59,/r/EDAnonymous/comments/bt6x5b/cant_wait_until_im_skinny_enough_to_actually_wear/eoviy0w/,"My fear is reaching my ugw and then realizing it wasn’t the clothes or my fat that was ugly, it was me lmao   Weight loss can’t fix ugly!",False,False
eovi2c7,t3_bt6x5b,t3_bt6x5b,sadslap,1,2019-05-26 13:33:24,/r/EDAnonymous/comments/bt6x5b/cant_wait_until_im_skinny_enough_to_actually_wear/eovi2c7/,"ugh over the past three or four weeks, ive been restricting a lot and therefore enjoying all these cute clothes in my closet i can wear BUT now im feeling horrible, so the cycle begins again where i hate myself and look longingly at all the outfits i COULD be wearing if i wasn't so big :(",False,False
eovhtlj,t3_bt6x5b,t3_bt6x5b,maddypip,1,2019-05-26 13:31:31,/r/EDAnonymous/comments/bt6x5b/cant_wait_until_im_skinny_enough_to_actually_wear/eovhtlj/,Even at my smallest I don’t have the body for my aesthetic clothes. I’ll never have the chicken legs I desire.,False,False
eovd1dm,t3_bt6x5b,t1_eouoo4l,tweeaboo,1,2019-05-26 12:47:52,/r/EDAnonymous/comments/bt6x5b/cant_wait_until_im_skinny_enough_to_actually_wear/eovd1dm/,"this actually happened to me, i live in baggy sweaters now. rip all the cute things i bought.",False,False
eov9ehk,t3_bt6x5b,t3_bt6x5b,claireupvotes,1,2019-05-26 12:15:43,/r/EDAnonymous/comments/bt6x5b/cant_wait_until_im_skinny_enough_to_actually_wear/eov9ehk/,"I used to feel this way, but when I got skinny enough I felt like a corpse. Now the goal is finding time for a tan 😭 it never stops",False,False
eov8xlp,t3_bt6x5b,t3_bt6x5b,lilzbeans,1,2019-05-26 12:12:13,/r/EDAnonymous/comments/bt6x5b/cant_wait_until_im_skinny_enough_to_actually_wear/eov8xlp/,Ugh mood. I was supposed to be my ugw for a ball i have in 2 days...it ain’t happening fam lol,False,False
eov8aue,t3_bt6x5b,t3_bt6x5b,Theyogithatcould,1,2019-05-26 12:07:22,/r/EDAnonymous/comments/bt6x5b/cant_wait_until_im_skinny_enough_to_actually_wear/eov8aue/,Same here. I have yoga pants and tight crop tops that yearn for the day they are worn with pride.,False,False
eov5mmr,t3_bt6x5b,t3_bt6x5b,wildflower_0ne,1,2019-05-26 11:44:23,/r/EDAnonymous/comments/bt6x5b/cant_wait_until_im_skinny_enough_to_actually_wear/eov5mmr/,bitch same,False,False
eov1pxq,t3_bt6x5b,t3_bt6x5b,Anxiety_Fox,1,2019-05-26 11:05:05,/r/EDAnonymous/comments/bt6x5b/cant_wait_until_im_skinny_enough_to_actually_wear/eov1pxq/,Yuuuup can’t wait for my festival clothes to actually look nice..,False,False
eov0ee5,t3_bt6x5b,t3_bt6x5b,asadghoul,1,2019-05-26 10:48:42,/r/EDAnonymous/comments/bt6x5b/cant_wait_until_im_skinny_enough_to_actually_wear/eov0ee5/,"yeah not gonna happen. hit my gw and i still don’t let myself dress cute, still think i’m ugly",False,False
eouzb3p,t3_bt6x5b,t3_bt6x5b,leebowery69,1,2019-05-26 10:34:51,/r/EDAnonymous/comments/bt6x5b/cant_wait_until_im_skinny_enough_to_actually_wear/eouzb3p/,Ugh I feel that,False,False
eoux9z1,t3_bt6x5b,t3_bt6x5b,MyNamelessFace,1,2019-05-26 10:09:06,/r/EDAnonymous/comments/bt6x5b/cant_wait_until_im_skinny_enough_to_actually_wear/eoux9z1/,"Same. Over the last years I bought so many nice clothes I wanted to wear, when I am skinny enough... but I never felt confident enough. But this summer I want to wear them!!!",False,False
eourlac,t3_bt6x5b,t3_bt6x5b,HorrorRefrigerator1,1,2019-05-26 08:52:15,/r/EDAnonymous/comments/bt6x5b/cant_wait_until_im_skinny_enough_to_actually_wear/eourlac/,big fucking mood,False,False
eouoo4l,t3_bt6x5b,t3_bt6x5b,obvious-human,1,2019-05-26 08:08:04,/r/EDAnonymous/comments/bt6x5b/cant_wait_until_im_skinny_enough_to_actually_wear/eouoo4l/,my fear is getting to my ugw only to come to find out they dont make my ugw clothes in a size small enough,False,False
eounqx3,t3_bt6x5b,t3_bt6x5b,kvltspoook,1,2019-05-26 07:52:23,/r/EDAnonymous/comments/bt6x5b/cant_wait_until_im_skinny_enough_to_actually_wear/eounqx3/,Feels fam,False,False
