Comment ID,Link ID,Parent ID,Author,Score,Publish Date,Permalink,Text,Stickied,Is Submitter
eghwpqp,t3_aqbtg7,t3_aqbtg7,godonvideocall,1,2019-02-14 18:34:43,/r/EDAnonymous/comments/aqbtg7/when_youve_been_avoiding_a_high_cal_food_all_day/eghwpqp/,oof me today fuck ,False,False
eggpxe1,t3_aqbtg7,t3_aqbtg7,feduprunner1,1,2019-02-14 10:06:32,/r/EDAnonymous/comments/aqbtg7/when_youve_been_avoiding_a_high_cal_food_all_day/eggpxe1/,I feel personally attacked,False,False
egfon3y,t3_aqbtg7,t3_aqbtg7,oil-of-okay,1,2019-02-13 22:00:56,/r/EDAnonymous/comments/aqbtg7/when_youve_been_avoiding_a_high_cal_food_all_day/egfon3y/,that time i didnt let myself have the fucking banana i was dreaming of and then proceeded to eat a bunch of stale gross chocolate in tiny bites  &gt;:(,False,False
egf6zvs,t3_aqbtg7,t1_egf1hg4,rainbowfuze,1,2019-02-13 18:05:52,/r/EDAnonymous/comments/aqbtg7/when_youve_been_avoiding_a_high_cal_food_all_day/egf6zvs/,Ended up having the donut anyway 🙃,False,True
egf1hg4,t3_aqbtg7,t3_aqbtg7,bluediner,1,2019-02-13 16:55:53,/r/EDAnonymous/comments/aqbtg7/when_youve_been_avoiding_a_high_cal_food_all_day/egf1hg4/,and then you STILL haven’t had the high cal thing so the craving sticks in your mind,False,False
egey725,t3_aqbtg7,t1_egevk4h,BunnyAwesome,1,2019-02-13 16:17:59,/r/EDAnonymous/comments/aqbtg7/when_youve_been_avoiding_a_high_cal_food_all_day/egey725/,SAME,False,False
egewngq,t3_aqbtg7,t3_aqbtg7,leiiel,1,2019-02-13 16:00:09,/r/EDAnonymous/comments/aqbtg7/when_youve_been_avoiding_a_high_cal_food_all_day/egewngq/,"Ugh I do the same. Also skipping meals and eating the calories back in ""snacks""",False,False
egevk4h,t3_aqbtg7,t3_aqbtg7,redhotjillypepper,1,2019-02-13 15:48:39,/r/EDAnonymous/comments/aqbtg7/when_youve_been_avoiding_a_high_cal_food_all_day/egevk4h/,Mood,False,False
