Comment ID,Link ID,Parent ID,Author,Score,Publish Date,Permalink,Text,Stickied,Is Submitter
f8s5y4y,t3_e1cb3i,t1_f8p5e31,isthised,1,2019-11-26 06:16:20,/r/EDAnonymous/comments/e1cb3i/daily_discussion_monday_november_25_2019/f8s5y4y/,❤️,False,False
f8rsvb4,t3_e1cb3i,t3_e1cb3i,milllklatte,1,2019-11-26 01:00:41,/r/EDAnonymous/comments/e1cb3i/daily_discussion_monday_november_25_2019/f8rsvb4/,"Retaining lots of water. Binged Saturday, been restricting since then (finished eating for the day today). Still bloated and feeling gross. My mood’s been better.",False,False
f8rlyij,t3_e1cb3i,t3_e1cb3i,pop_chip_boi,1,2019-11-25 22:57:50,/r/EDAnonymous/comments/e1cb3i/daily_discussion_monday_november_25_2019/f8rlyij/,"saw a pic of me eating 1 bite of cake from years ago. distinctly remember giving it to my mom after the one, singular, ""see i have consumed and partaken in this"" bite. and yet, somehow, she manages to take a picture of me, stooped, taking an ugly bite.  i saw this pic literally weeks ago and it's still haunting me. people can't know i tasted CAKE on NEW YEARS",False,False
f8rjsly,t3_e1cb3i,t1_f8r6ei5,ibapconflicted,1,2019-11-25 22:26:05,/r/EDAnonymous/comments/e1cb3i/daily_discussion_monday_november_25_2019/f8rjsly/,honey tbh? drop his ass u deserve so much better. you aren’t gross and you deserve happiness.,False,False
f8r6ei5,t3_e1cb3i,t3_e1cb3i,ammesonkaelmik,1,2019-11-25 19:50:47,/r/EDAnonymous/comments/e1cb3i/daily_discussion_monday_november_25_2019/f8r6ei5/,"I feel fucking disgusting. I just threw away all of the smaller clothes I bought and pulled out my old, bigger clothes. I haven't even gained weight. There's just no point in wearing smaller clothes when I still look huge and gross.  My boyfriend doesn't even care that I've lost 85 pounds. He couldn't give a single shit. He just wants to smoke weed, sleep, and play video games all day while I work and go to class. We haven't had sex in months so what's even the point. What's the point of anything.",False,False
f8r2aj3,t3_e1cb3i,t1_f8pq4w3,3flowerchilde,1,2019-11-25 19:03:02,/r/EDAnonymous/comments/e1cb3i/daily_discussion_monday_november_25_2019/f8r2aj3/,"I’ve been practicing my c/s in front of people, idk if you do that lmao",False,False
f8r214l,t3_e1cb3i,t3_e1cb3i,Rivka90,1,2019-11-25 18:59:53,/r/EDAnonymous/comments/e1cb3i/daily_discussion_monday_november_25_2019/f8r214l/,Went out to eat with a friend today. It was a hellish debate on whether or not I should order actual food or just stick with coffee say I wasn't hungry. I ordered food but I couldn't bring myself to eat it so I brought it home where I promptly sabotaged it by pouring gardening soil all over it. It's so fucking hilarious that I can binge on all of the shittiest foods but when I'm restricting an apple feels like too much. I'm losing weight again and I can feel it in my face and collar bones. I want to see my boobs disappear. I swear the boobs make me look 20 pounds heavier.,False,False
f8r1s05,t3_e1cb3i,t3_e1cb3i,loversalibi,1,2019-11-25 18:56:49,/r/EDAnonymous/comments/e1cb3i/daily_discussion_monday_november_25_2019/f8r1s05/,"i had a blood sugar crash the other night and it was super scary. my face got all hot, then i sat up in bed and my heart just started RACING. it got faster and faster and wouldn’t stop. i woke my boyfriend up and he sat with me while i took deep steady breaths, which helped my heart rate get back to normal. then i microwaved a lean pocket and ate that, and i was okay. but i had definitely been restricting that day, so i’m like 99% sure that’s what happened to me. i’m not diabetic or anything like that but me having low blood sugar makes sense.   so of course i  used this as an excuse to binge all weekend but i’m not even mad at myself for once bc i certainly don’t want THAT to happen to me again. i have to remember that i’m tall and if i must restrict there’s no shame in high restriction; but trying to go as low as an average height girl can really fuck me up",False,False
f8qsszt,t3_e1cb3i,t3_e1cb3i,silvernikki,1,2019-11-25 17:09:19,/r/EDAnonymous/comments/e1cb3i/daily_discussion_monday_november_25_2019/f8qsszt/,"Went to a therapist who told me i have an unhealthy fixation on weight. Wanted to tell her that she'd have the same thing if she was fat too, but I held my tongue.",False,False
f8qro3u,t3_e1cb3i,t3_e1cb3i,qtcarat,1,2019-11-25 16:56:29,/r/EDAnonymous/comments/e1cb3i/daily_discussion_monday_november_25_2019/f8qro3u/,god nothing feels better than being told im tiny!!!,False,False
f8qjlhv,t3_e1cb3i,t1_f8q01bq,oh-em-jizzles,1,2019-11-25 15:53:29,/r/EDAnonymous/comments/e1cb3i/daily_discussion_monday_november_25_2019/f8qjlhv/,ok i literally can't stop wtf bros 😥😥😥. finna FAST tmrw,False,False
f8qgevg,t3_e1cb3i,t3_e1cb3i,cisheterpatriarchy,1,2019-11-25 15:29:08,/r/EDAnonymous/comments/e1cb3i/daily_discussion_monday_november_25_2019/f8qgevg/,"i’m tired. i’ve been binging or restricting, no in between, for months now. i’ve told my friends i’m recovering so they stop worrying. i feel like i’m burdening everyone if i tell them how much i’m struggling. my skin is breaking out from the binging, obviously i’m gaining weight, and my self esteem is at an all time low.  what does this mean? I’m going to starve myself until i look decent again!   it’s just really fucking difficult. i want to recover so badly but i’m so unhappy with myself and the only thing that’ll make me happy right now is heavy restriction.",False,False
f8qb53k,t3_e1cb3i,t3_e1cb3i,arcoalien,1,2019-11-25 14:48:57,/r/EDAnonymous/comments/e1cb3i/daily_discussion_monday_november_25_2019/f8qb53k/,"Bought a new scale to keep at my boyfriend's place and I'm pretty sure it's inaccurate but it said we were both 4lb heavier than we actually are. Still making me paranoid as fuck and even though I'm 98% sure the scale is wrong, I'm going to weigh myself today at the gym on their physician scale and also on my home scale to be extra sure.",False,False
f8q9qd5,t3_e1cb3i,t1_f8pvhoy,basiltonic,1,2019-11-25 14:38:31,/r/EDAnonymous/comments/e1cb3i/daily_discussion_monday_november_25_2019/f8q9qd5/,I used to do that! No solutions though bc I’m 26 and still binging!!!!,False,False
f8q9fo2,t3_e1cb3i,t3_e1cb3i,basiltonic,1,2019-11-25 14:36:21,/r/EDAnonymous/comments/e1cb3i/daily_discussion_monday_november_25_2019/f8q9fo2/,"So fucking depressed. I just cried in my boyfriend’s lap and I am incredibly grateful for him on so many levels. He gets it, and knows how to support me, despite me not being able to articulate all the dark and in-depth distortions that I’m dealing with.   Depression sucks. My appetite is nothing today because of it and food tastes like nothing. This makes my ED brain happy but it makes me, my true self, sad because I know it’s getting bad again. It’s scary when it gets bad.",False,False
f8q01bq,t3_e1cb3i,t3_e1cb3i,oh-em-jizzles,1,2019-11-25 13:26:30,/r/EDAnonymous/comments/e1cb3i/daily_discussion_monday_november_25_2019/f8q01bq/,does anyone else immediately binge whenever they come home from college lmfao help,False,False
f8pvhoy,t3_e1cb3i,t3_e1cb3i,personne-inconnue,1,2019-11-25 12:52:15,/r/EDAnonymous/comments/e1cb3i/daily_discussion_monday_november_25_2019/f8pvhoy/,was gonna actually eat some oatmeal but that shit was so disgusting - threw all of it away after one bite. I guess the universe is telling me not to eat? lol,False,False
f8pss7o,t3_e1cb3i,t1_f8pl146,tea-addicted-taemint,1,2019-11-25 12:32:02,/r/EDAnonymous/comments/e1cb3i/daily_discussion_monday_november_25_2019/f8pss7o/,"I am catching up with a friend today, that should help.",False,False
f8pq4w3,t3_e1cb3i,t3_e1cb3i,alchademy,1,2019-11-25 12:12:05,/r/EDAnonymous/comments/e1cb3i/daily_discussion_monday_november_25_2019/f8pq4w3/,"I’ve been mentally preparing myself for thanksgiving all month, how tf do I nonchalantly eat as little as possible without being noticed?? Gah I hate eating with other people around",False,False
f8po3kx,t3_e1cb3i,t1_f8oqif1,LowCalPal,1,2019-11-25 11:56:45,/r/EDAnonymous/comments/e1cb3i/daily_discussion_monday_november_25_2019/f8po3kx/,ok but how do u feel about white cheddar rice cakes?,False,False
f8pl146,t3_e1cb3i,t1_f8o8tgm,tigerchik,1,2019-11-25 11:33:39,/r/EDAnonymous/comments/e1cb3i/daily_discussion_monday_november_25_2019/f8pl146/,I hear you and I was there yesterday. YOU CAN DO THIS! The urges will go away. How can you calm your anxiety?,False,False
f8pkosu,t3_e1cb3i,t3_e1cb3i,tigerchik,1,2019-11-25 11:31:00,/r/EDAnonymous/comments/e1cb3i/daily_discussion_monday_november_25_2019/f8pkosu/,"had 8 days w/o bingeing then binged last night. So, starting over, again",False,False
f8pebe0,t3_e1cb3i,t3_e1cb3i,Qa4646,1,2019-11-25 10:42:46,/r/EDAnonymous/comments/e1cb3i/daily_discussion_monday_november_25_2019/f8pebe0/,My final exam is today and i can't wait until its over so i can stop being stressed about exams.,False,False
f8p5e31,t3_e1cb3i,t1_f8ohn62,radicalcantaloop,1,2019-11-25 09:32:29,/r/EDAnonymous/comments/e1cb3i/daily_discussion_monday_november_25_2019/f8p5e31/,This is helpful and the logical thing to do but I’m literally incapable of reaching out to people in any meaningful capacity so I feel like I quite literally can’t   (I do appreciate it though and I know that you’re trying to give me helpful advice I’m just not really sure if I can take it at this point in time y’know),False,False
f8p12z4,t3_e1cb3i,t3_e1cb3i,glossier123,1,2019-11-25 08:57:45,/r/EDAnonymous/comments/e1cb3i/daily_discussion_monday_november_25_2019/f8p12z4/,"Hmmm I’m going to try to eat at maintenance today since I’m working ~12 hours on my feet and I really need the energy. Wish me luck haha I’m probably going to want to die any time I think about how much food is in my stomach!!  I fasted for 48 hours over the weekend and was planning to go more (my dumb ED Brain was going on about how eating was entirely unnecessary and I would be fine to never eat again) but I feel so slow and stupid when I go more than 36 hours so I ate a 400 calorie rice bowl last night. It was amazing but the guilt I felt afterward was intense. I keep trying to use my therapy skills to ‘think’ my way out of the guilt I feel but what keeps happening is that I still feel just as guilty, and I also feel stupid for knowing that it’s illogical to feel guilty according to therapy.",False,False
f8ox82r,t3_e1cb3i,t3_e1cb3i,0463517228539110,1,2019-11-25 08:24:57,/r/EDAnonymous/comments/e1cb3i/daily_discussion_monday_november_25_2019/f8ox82r/,"TW calories (hopefully i can get spoiler tags to work on mobile -- sorry!!!)  I'm extremely anxious today. My daily limit is &gt;!400!&lt; (not including alcohol) and I went over it p much every day, but not so much that I felt unsafe &amp; I'm still maintaining.  Until last night. I ended up eating &gt;!1,000!&lt; calories yesterday &amp; i feel so sick and bloated and disgusting today. Plus, fucken Thanksgiving is in 3 days, sooooo anxious about that. My goal this week is to just focus on work &amp; my partner, and not think about food the next 3 days.  Best!",False,False
f8oqif1,t3_e1cb3i,t3_e1cb3i,absolute_boy,1,2019-11-25 07:23:24,/r/EDAnonymous/comments/e1cb3i/daily_discussion_monday_november_25_2019/f8oqif1/,I would rather eat nothing at all than bland-tasting 'safe food' in portions so tiny you'd be hungry again in 15 minutes. I can't fathom wasting calories on plain rice cakes or unseasoned chicken breast.,False,False
f8ohn62,t3_e1cb3i,t1_f8oax3i,isthised,1,2019-11-25 05:31:07,/r/EDAnonymous/comments/e1cb3i/daily_discussion_monday_november_25_2019/f8ohn62/,"Of you’re over 18, you can go to the colleges mental health/counseling services without your parents knowing.",False,False
f8oax3i,t3_e1cb3i,t3_e1cb3i,radicalcantaloop,1,2019-11-25 02:34:50,/r/EDAnonymous/comments/e1cb3i/daily_discussion_monday_november_25_2019/f8oax3i/,I’m having a mental breakdown about college and I feel like shit and I don’t want to be here and I feel like I’m throwing away all of these great opportunities that I’m being given!! Love it!! And in 2 days I get to go home for a quick break and be with my family and cats but I always freak out more and binge at home so love that!! I’ve had untreated depression since I was 13 and untreated anxiety since I was fucking 10!! I’ve been drowning for nearly 10 years but I can’t seek help because I had one (1) bad reaction from my mom when I had a meltdown in front of her when I was 10!!! My ed is making me only eat soup for a week bc it’s easier to worry about eating on thanksgiving than worry about my future and how lonely I am!! I want to die!!,False,False
f8oaapq,t3_e1cb3i,t3_e1cb3i,Beep_boop_human,1,2019-11-25 02:19:31,/r/EDAnonymous/comments/e1cb3i/daily_discussion_monday_november_25_2019/f8oaapq/,Hey so I'm broke (like how am I gonna pay my rent broke). Better spend my last few dollars on a stupid amount of takeaway food tho good idea that'll make me feel better (:(:(:(:,False,False
f8o9zkk,t3_e1cb3i,t3_e1cb3i,phosphatidylserine_,1,2019-11-25 02:12:07,/r/EDAnonymous/comments/e1cb3i/daily_discussion_monday_november_25_2019/f8o9zkk/,I just want to eat normally for once - which apparently is too much to ask for,False,False
f8o8ydv,t3_e1cb3i,t3_e1cb3i,throwaway9338102,1,2019-11-25 01:48:04,/r/EDAnonymous/comments/e1cb3i/daily_discussion_monday_november_25_2019/f8o8ydv/,"being a skinny legend fucken sucks,, nearly passed out three times today then died of nausea in a bathroom stall for 20 minutes B) but at least i ate a full, well-rounded meal for lunch !!! my body just hasnt got the memo yet that food = good smh 🤦‍♀️",False,False
f8o8tgm,t3_e1cb3i,t3_e1cb3i,tea-addicted-taemint,1,2019-11-25 01:44:59,/r/EDAnonymous/comments/e1cb3i/daily_discussion_monday_november_25_2019/f8o8tgm/,"Anxiety is high, and therefore so are urges to b/p. I refuse to do it. Fuck my brain hm",False,False
