Comment ID,Link ID,Parent ID,Author,Score,Publish Date,Permalink,Text,Stickied,Is Submitter
ew91mo4,t3_cn008q,t1_ew5vwr1,red_ossifrage,1,2019-08-07 17:50:53,/r/EDAnonymous/comments/cn008q/anyone_else_feel_the_pressure_to_restrict_more/ew91mo4/,Or you can make like me and go for a grad degree just so you never have to leave school. Subscribe here for more Ana tipz &amp; trickz!!,False,False
ew90jgp,t3_cn008q,t3_cn008q,CepheidVox,1,2019-08-07 17:43:22,/r/EDAnonymous/comments/cn008q/anyone_else_feel_the_pressure_to_restrict_more/ew90jgp/,"Good god, yes. Threw recovery out the window in mid-July because I couldn't imagine being at college above a certain weight.",False,False
ew7kwpj,t3_cn008q,t1_ew6a1ny,obviouslynotjackie,1,2019-08-07 10:56:24,/r/EDAnonymous/comments/cn008q/anyone_else_feel_the_pressure_to_restrict_more/ew7kwpj/,You’re so lucky to be taking a ballet class though! I’ve always wanted to but my family never had the money :/,False,False
ew7408d,t3_cn008q,t3_cn008q,TeamG97,1,2019-08-07 08:49:42,/r/EDAnonymous/comments/cn008q/anyone_else_feel_the_pressure_to_restrict_more/ew7408d/,Yuppp being back on campus with a bunch of super skinny college kids is going to be TOUGH,False,False
ew71kq7,t3_cn008q,t3_cn008q,Nearby_Associate,1,2019-08-07 08:30:15,/r/EDAnonymous/comments/cn008q/anyone_else_feel_the_pressure_to_restrict_more/ew71kq7/,"Nah it’s okay, I know the biggest kick-start for my usual weight loss will start around November when my regular depression meets school anxiety and winter depression. And also being broke af 🤪",False,False
ew6cqnj,t3_cn008q,t3_cn008q,Zeeplez,1,2019-08-07 02:31:05,/r/EDAnonymous/comments/cn008q/anyone_else_feel_the_pressure_to_restrict_more/ew6cqnj/,"i feel you, i wanted to get to my goal weight before school started and i'm still at the same weight i was a month ago",False,False
ew6bmiy,t3_cn008q,t3_cn008q,dragonboi99,1,2019-08-07 02:07:54,/r/EDAnonymous/comments/cn008q/anyone_else_feel_the_pressure_to_restrict_more/ew6bmiy/,yep i’m going back in 2 weeks and i’ve been binging for months so ed brain would literally have me eat next to nothing if i wasn’t having dinners with my family 🙃,False,False
ew6b8d2,t3_cn008q,t3_cn008q,cardigante,1,2019-08-07 01:59:25,/r/EDAnonymous/comments/cn008q/anyone_else_feel_the_pressure_to_restrict_more/ew6b8d2/,"I’m 32 but work at an art college and I swear all the young 18-20 year old super skinny artistic kids that come in every year are goals, it kills me that I was like “I’m gonna lose all this weight over the summer” yet I look exactly the same!",False,False
ew6a1ny,t3_cn008q,t3_cn008q,Birdie49,1,2019-08-07 01:34:59,/r/EDAnonymous/comments/cn008q/anyone_else_feel_the_pressure_to_restrict_more/ew6a1ny/,"Ugh, so much. I'm taking a ballet class and I feel like I need to be Russian-ballerina skinny before I start it",False,False
ew65634,t3_cn008q,t3_cn008q,lbredj,1,2019-08-07 00:06:28,/r/EDAnonymous/comments/cn008q/anyone_else_feel_the_pressure_to_restrict_more/ew65634/,"in theory, yes, but I also just ate quarter of a box of cereal bc I'm stressed about classes lmao",False,False
ew5y69i,t3_cn008q,t1_ew5vwr1,lovenote123,1,2019-08-06 22:23:23,/r/EDAnonymous/comments/cn008q/anyone_else_feel_the_pressure_to_restrict_more/ew5y69i/,I’m a year older than you and took a couple gap years before starting college (now a junior) so pls don’t feel old lol,False,True
ew5wys9,t3_cn008q,t3_cn008q,wild_banana_cookie,1,2019-08-06 22:07:49,/r/EDAnonymous/comments/cn008q/anyone_else_feel_the_pressure_to_restrict_more/ew5wys9/,Yup! Currently on my first 24 hour fast lol. Also might cut my calories down to 1100 because I can't be lookin bad at this school. Honestly kinda sucks because it feels like a punishment lowkey.,False,False
ew5vwr1,t3_cn008q,t3_cn008q,SubBiscuit,1,2019-08-06 21:54:28,/r/EDAnonymous/comments/cn008q/anyone_else_feel_the_pressure_to_restrict_more/ew5vwr1/,"I'm out of school and therefore ancient. Seeing all the ""lose weight for school"" posts make me want to lose weight just to make up for being basically middle aged.",False,False
