Comment ID,Link ID,Parent ID,Author,Score,Publish Date,Permalink,Text,Stickied,Is Submitter
ek6aqa0,t3_b9lvlr,t1_ek68p1y,AlcoholicRacoon,1,2019-04-05 08:26:45,/r/EDAnonymous/comments/b9lvlr/well/ek6aqa0/,Thank you! ,False,False
ek68p1y,t3_b9lvlr,t1_ek67ukw,eyjafjallafuckyall,1,2019-04-05 07:57:13,/r/EDAnonymous/comments/b9lvlr/well/ek68p1y/,solidarity in death lmao. also love your username!!,False,True
ek67ukw,t3_b9lvlr,t3_b9lvlr,AlcoholicRacoon,1,2019-04-05 07:44:04,/r/EDAnonymous/comments/b9lvlr/well/ek67ukw/,"Also gained 10 pounds, also about to start my period, and haven’t pooped since Monday.  Let me die with you",False,False
ek5k93l,t3_b9lvlr,t1_ek5i2dm,eyjafjallafuckyall,1,2019-04-04 22:57:03,/r/EDAnonymous/comments/b9lvlr/well/ek5k93l/,yeah but I definitely did not gain 10 pounds after one workout :///,False,True
ek5i2dm,t3_b9lvlr,t1_ek5fv3t,usr687,1,2019-04-04 22:23:10,/r/EDAnonymous/comments/b9lvlr/well/ek5i2dm/,When you work out the water retained is in your muscles so you don’t feel/see it like other bloat!,False,False
ek5fv3t,t3_b9lvlr,t3_b9lvlr,eyjafjallafuckyall,1,2019-04-04 21:50:34,/r/EDAnonymous/comments/b9lvlr/well/ek5fv3t/,I mean to be fair I’m on my period and I ran earlier and I think cardio can make you retain water? but I don’t feel particularly bloated? fuckkk,False,True
