Comment ID,Link ID,Parent ID,Author,Score,Publish Date,Permalink,Text,Stickied,Is Submitter
ei7vlyg,t3_az7kx4,t3_az7kx4,YukiHase,1,2019-03-10 12:35:45,/r/EDAnonymous/comments/az7kx4/psa_targets_new_lingerie_brand_carries_32aa/ei7vlyg/,:o Holy shit brb going to target,False,False
ei7rogp,t3_az7kx4,t1_ei7hl4j,IDontLikeLollipops,1,2019-03-10 11:47:32,/r/EDAnonymous/comments/az7kx4/psa_targets_new_lingerie_brand_carries_32aa/ei7rogp/,"r/abrathatfits has a really good calculator, and Amazon has a really good return policy",False,False
ei7hlpv,t3_az7kx4,t1_ei6n37j,polyloneials,1,2019-03-10 09:27:04,/r/EDAnonymous/comments/az7kx4/psa_targets_new_lingerie_brand_carries_32aa/ei7hlpv/,Thank you for the rev!,False,False
ei7hl4j,t3_az7kx4,t1_ei6ojxa,polyloneials,1,2019-03-10 09:26:48,/r/EDAnonymous/comments/az7kx4/psa_targets_new_lingerie_brand_carries_32aa/ei7hl4j/,I think I’m gonna try amazon! I’m not positive about my size so it’s annoying not being able to try it on though.,False,False
ei6pefp,t3_az7kx4,t1_ei5vuve,usr687,1,2019-03-09 21:43:14,/r/EDAnonymous/comments/az7kx4/psa_targets_new_lingerie_brand_carries_32aa/ei6pefp/,"Yes! Some are more comfy than others but overall I love them! I got a T-shirt bra, a push-up, and a lacy push-up racerback",False,True
ei6ojxa,t3_az7kx4,t1_ei6hh6k,IDontLikeLollipops,1,2019-03-09 21:31:29,/r/EDAnonymous/comments/az7kx4/psa_targets_new_lingerie_brand_carries_32aa/ei6ojxa/,I get all my 28HH bras off Amazon,False,False
ei6nd1p,t3_az7kx4,t1_ei6hh6k,rotting_the_crown,1,2019-03-09 21:14:48,/r/EDAnonymous/comments/az7kx4/psa_targets_new_lingerie_brand_carries_32aa/ei6nd1p/,Right? Super misleading and annoying. When I saw that I knew I was being set up for disappointment ,False,False
ei6n37j,t3_az7kx4,t1_ei6hh6k,cinnamonspiderr,1,2019-03-09 21:10:58,/r/EDAnonymous/comments/az7kx4/psa_targets_new_lingerie_brand_carries_32aa/ei6n37j/,Brastop.com has D-K cups with small band sizes!,False,False
ei6hh6k,t3_az7kx4,t3_az7kx4,polyloneials,1,2019-03-09 19:49:45,/r/EDAnonymous/comments/az7kx4/psa_targets_new_lingerie_brand_carries_32aa/ei6hh6k/,“Sizes 32AA-46G” I hate when they say this but then don’t carry the large cups in small bands ,False,False
ei60h50,t3_az7kx4,t3_az7kx4,linedryonly,1,2019-03-09 15:46:53,/r/EDAnonymous/comments/az7kx4/psa_targets_new_lingerie_brand_carries_32aa/ei60h50/,How exciting! My first thought was that this might be a good resource for trans ladies too!,False,False
ei5z5e9,t3_az7kx4,t1_ei5voy5,grandeicedcovfefe,1,2019-03-09 15:29:06,/r/EDAnonymous/comments/az7kx4/psa_targets_new_lingerie_brand_carries_32aa/ei5z5e9/,"Oh yes I feel so awkward in the kids section haha. Thanks for the heads up though, excited they’re carrying more sizes  👏🏻",False,False
ei5vuve,t3_az7kx4,t3_az7kx4,lilllyyy,1,2019-03-09 14:45:17,/r/EDAnonymous/comments/az7kx4/psa_targets_new_lingerie_brand_carries_32aa/ei5vuve/,yes! is it the new line 'Auden' ? I was just looking at some of their bras because I saw they come in sooo many sizes which is great. how do they feel? are they comfy??,False,False
ei5voy5,t3_az7kx4,t1_ei5uplc,usr687,1,2019-03-09 14:43:09,/r/EDAnonymous/comments/az7kx4/psa_targets_new_lingerie_brand_carries_32aa/ei5voy5/,It’s their new line that they just started! I think it launched earlier this week or last week. They’re not super cheap but they’re cheaper than Aerie and it’s nice to not have to get the kid’s bras because lacy bras definitely feel more appropriate to me. I always feel awkward in the kid’s section ,False,True
ei5uplc,t3_az7kx4,t3_az7kx4,grandeicedcovfefe,1,2019-03-09 14:29:52,/r/EDAnonymous/comments/az7kx4/psa_targets_new_lingerie_brand_carries_32aa/ei5uplc/,Whaaaa. I was there the other day and didn’t see any! Left with 4 bras from the kids section. Will definitely check another store.   Aerie also carries small sizes but are more $ if you don’t get them on sale. ,False,False
