Comment ID,Link ID,Parent ID,Author,Score,Publish Date,Permalink,Text,Stickied,Is Submitter
elz4o54,t3_bhkjtz,t1_elwttbp,MyNamelessFace,1,2019-04-28 06:57:10,/r/EDAnonymous/comments/bhkjtz/you_dont_have_to_eat_it_just_cos_its_there/elz4o54/,"Thanks for your advice... But the plan already contains free days, but not too many because it's not possible. It's &gt;100 days of full studying and about 25 days to recapitulate all the learning matter. So I have less than 25 free days within those 150 days... And it won't help. I know myself. I started 16:8 intermitted fasting and it kinda helps at the moment... But I still eat a lot within those 8h. We'll see what happens :/",False,False
elx0kj3,t3_bhkjtz,t3_bhkjtz,invincibletitan33,1,2019-04-27 10:40:28,/r/EDAnonymous/comments/bhkjtz/you_dont_have_to_eat_it_just_cos_its_there/elx0kj3/,That's why I haven't opened my Easter eggs. Once I open them I will eat everything in one go. So long as I don't open them I'm safe.,False,False
elwttbp,t3_bhkjtz,t1_elu42vf,orthofuckyrself,1,2019-04-27 09:05:34,/r/EDAnonymous/comments/bhkjtz/you_dont_have_to_eat_it_just_cos_its_there/elwttbp/,"For me, having a timeline helps with stress. I too am challenging standardized tests, and due to a bureaucratic mess, I've spent most of the past month not knowing WHEN.   Now I know that the practical one will be on Tuesday, and I'll likely have upwards of a week (if not close to a month) to study for the theory one. So I just have to get through to Tuesday, and if some takeout/extra booze happens between now and Tuesday, it won't amount to much gain. I've yet to genuinely binge and don't think I will.  Since you have 150 days, maybe take one or two days to not study and re set? It'll probably help you get out of binge mode.",False,False
elujztu,t3_bhkjtz,t1_eluf8wd,ToostsieWooGirl92,1,2019-04-26 12:38:13,/r/EDAnonymous/comments/bhkjtz/you_dont_have_to_eat_it_just_cos_its_there/elujztu/,Everyone in my family is a different teletubby and my dad is the vacuum for this exact reason!,False,False
elugbxs,t3_bhkjtz,t3_bhkjtz,einhornschlag,1,2019-04-26 12:04:25,/r/EDAnonymous/comments/bhkjtz/you_dont_have_to_eat_it_just_cos_its_there/elugbxs/,??????  You don’t?? But I thought if it was sitting there you gotta eat it all NOW so you don’t eat it later?? 😰,False,False
eluf8wd,t3_bhkjtz,t3_bhkjtz,overdramaticteen,1,2019-04-26 11:54:09,/r/EDAnonymous/comments/bhkjtz/you_dont_have_to_eat_it_just_cos_its_there/eluf8wd/,"My friends call me “the vacuum cleaner from Teletubbies” because I WILL compulsively siphon up anything they don’t eat, even if it’s pizza crusts or the stems of vegetables. Something about seeing stuff going to waste seriously one me.",False,False
elu534m,t3_bhkjtz,t3_bhkjtz,hammerprice,1,2019-04-26 10:14:49,/r/EDAnonymous/comments/bhkjtz/you_dont_have_to_eat_it_just_cos_its_there/elu534m/,"Me lol.  I'm trying to treat myself less like a trash can, but it's so hard to see food wasted. If I don't need the calories then it's a waste either way, tho.",False,False
elu42vf,t3_bhkjtz,t1_elu0cto,MyNamelessFace,1,2019-04-26 10:04:51,/r/EDAnonymous/comments/bhkjtz/you_dont_have_to_eat_it_just_cos_its_there/elu42vf/,"I feel you.  I have my state examination in october, with a 150-days-studying-plan and I had my last 9 exams last week and I just ate EVERYTHING I found... And I don't know how I should manage to NOT do the same again while studying for the state exam (binging for 150 days?!).",False,False
elu0cto,t3_bhkjtz,t3_bhkjtz,orthofuckyrself,1,2019-04-26 09:28:00,/r/EDAnonymous/comments/bhkjtz/you_dont_have_to_eat_it_just_cos_its_there/elu0cto/,"Fucking mood  Lately, my DIY recovery had been going so well that I could put a whole tray of baking in the fridge and make it last a week.   But then came finals stress. I can't have ANYTHING in my apartment that doesn't need to be prepped before eating. And I mean ANYTHING- last night I ate a whole tin of raw pumpkin puree. It must be inedible in stored form.",False,False
eltr8nx,t3_bhkjtz,t3_bhkjtz,-deebrie-,1,2019-04-26 07:44:57,/r/EDAnonymous/comments/bhkjtz/you_dont_have_to_eat_it_just_cos_its_there/eltr8nx/,I'm in this post and I don't like it,False,False
eltnkvs,t3_bhkjtz,t3_bhkjtz,MyNamelessFace,1,2019-04-26 06:31:18,/r/EDAnonymous/comments/bhkjtz/you_dont_have_to_eat_it_just_cos_its_there/eltnkvs/,I feel caught.,False,False
