Comment ID,Link ID,Parent ID,Author,Score,Publish Date,Permalink,Text,Stickied,Is Submitter
erbpx9t,t3_c0yrjq,t1_er927zf,blmatsuu,1,2019-06-16 08:01:15,/r/EDAnonymous/comments/c0yrjq/being_a_runner_with_an_and_having_a_low_hr/erbpx9t/,"Lmao once mine hit over 200 which was wild, but tbf that was probably inaccurate because it was this heart rate thing built into the gym equipment if that makes any sense",False,False
erbbmvp,t3_c0yrjq,t3_c0yrjq,mfpbitch,1,2019-06-16 02:40:48,/r/EDAnonymous/comments/c0yrjq/being_a_runner_with_an_and_having_a_low_hr/erbbmvp/,"i'm a middle/long distance runner too, and i do figure skating at a pretty high level too. my rhr is low too at about 50 bpm when sitting and 65 when walking. i get mildly concerned because sometimes i stand up and nearly black out probably due to how low it is. i set off alarms when in hospital because my sleeping heart rate can go to 35bpm and all my doctors brushed it off because i wasn't underweight. my suggestion would be to ensure that you take multivitamins and keep electrolyte levels up, personally this really helped me. hope your running goes well!!",False,False
erag0tg,t3_c0yrjq,t3_c0yrjq,Blacknbruisey,1,2019-06-15 18:55:29,/r/EDAnonymous/comments/c0yrjq/being_a_runner_with_an_and_having_a_low_hr/erag0tg/,"Hi distance runner as well! My RHR is usually low 50's during the day and 40's at night. I had one Dr comment on it but I told her I'm an endurance runner and she just said ""oh ok that makes sense otherwise I'd be worried"". I believe mine hovered low 60s previously, but my mileage has increased a lot the last few years (I run marathons and ultras) so it's dropped over time. Just please make sure on the days you run that you do eat more protein and carbs. I usually aim for sweet potatoes, oatmeal, beets, etc. Plenty of nutrients to sustain longer runs and aid recovery.",False,False
era302a,t3_c0yrjq,t3_c0yrjq,ekwater,1,2019-06-15 16:42:38,/r/EDAnonymous/comments/c0yrjq/being_a_runner_with_an_and_having_a_low_hr/era302a/,I am a runner/underweight and my resting heart rate is \~48-50bpm and my doctor was worried (my heart rate has always been on the lower side but given my weight/eating issues my doctor was worried). I am currently not allowed to exercise/run and it is killing me BUT I also don't want to further damage my heart.  I would be really careful if I were you- you can always get back in shape but breaking down/putting stress on your heart is so dangerous,False,False
er9zksj,t3_c0yrjq,t1_er927zf,ohh_hello_,1,2019-06-15 16:10:37,/r/EDAnonymous/comments/c0yrjq/being_a_runner_with_an_and_having_a_low_hr/er9zksj/,"due to how low of a heart rate i normally had, my doctor found 150 a bit scary, but it’s probably perfectly normal",False,False
er9wpye,t3_c0yrjq,t3_c0yrjq,oheckingfrick,1,2019-06-15 15:43:56,/r/EDAnonymous/comments/c0yrjq/being_a_runner_with_an_and_having_a_low_hr/er9wpye/,"hey, this literally happened to me a few days ago.   i’m a long distance runner (i do half marathons) and my heart rate has always been low from that but lately since my relapse it’s been even lower (with my resting heart rate in like the 45-50 range).   when i went to the doctor, she was very concerned and asked me a bunch of questions just to make sure it was because of exercise and not because of any health issues, but overall i think it’s fine? a low heart rate is supposed to be healthy so",False,False
er9uy34,t3_c0yrjq,t3_c0yrjq,carbsandcaffeine,1,2019-06-15 15:26:58,/r/EDAnonymous/comments/c0yrjq/being_a_runner_with_an_and_having_a_low_hr/er9uy34/,"Do you know what your RHR was before you started running/were diagnosed with AN? Perhaps you can look into your medical records to see if it’s documented somewhere to see whether running/AN has affected your heart rate.   I have normal-lowish blood pressure (101/52) and a BMI of 18.9 and my RHR is naturally pretty low (55-58 bpm). I also ran cross country for a bit, and during that time, my RHR often fell to the 40s and occasionally mid-30s. I was not AN during this period of time. Despite these readings, my physician found everything else about me to be healthy.",False,False
er9rbrc,t3_c0yrjq,t1_er9cfhh,teapip99,1,2019-06-15 14:54:22,/r/EDAnonymous/comments/c0yrjq/being_a_runner_with_an_and_having_a_low_hr/er9rbrc/,Ok thanks so much everyone! I feel a lot better now! Yeah I definitely run pretty slow and I do stop before I feel like I’m gonna die haha,False,False
er9cfhh,t3_c0yrjq,t1_er927zf,thisaintheavymetal,1,2019-06-15 12:55:55,/r/EDAnonymous/comments/c0yrjq/being_a_runner_with_an_and_having_a_low_hr/er9cfhh/,160-170 is definitely normal for running.,False,False
er96tkc,t3_c0yrjq,t3_c0yrjq,usernameblahhhhh,1,2019-06-15 12:05:11,/r/EDAnonymous/comments/c0yrjq/being_a_runner_with_an_and_having_a_low_hr/er96tkc/,"It shouldn’t be too concerning unless this is a dramatic decrease from what your HR used to be (e.g., if it used to be like 65-85+). I have an anorexic bodyweight and I’m very athletic, and my HR is typically 45-55 when I’m sitting around, lower when sleeping and if I haven’t eaten recently. For me, this is OK because my heart rate has always been &lt;60 at any weight, it hasn’t been decreasing, and I have no issues with murmur/arrhythmia. So it’s not necessarily a problem in and of itself (especially given that you’re a runner), but if you’re having other issues, if it has dropped recently or if it continues dropping then it could be a problem. You should keep monitoring it with your doctor to make sure everything’s okay.",False,False
er96m53,t3_c0yrjq,t3_c0yrjq,heyy240,1,2019-06-15 12:03:22,/r/EDAnonymous/comments/c0yrjq/being_a_runner_with_an_and_having_a_low_hr/er96m53/,"Mine used to be pretty low, about 45ish too. I'm not a runner but walked and biked a lot. I didn't think it was much of an issue but my doctor expressed concern. I ate more regularly and it kinda got up to at least 60 bpm. I don't feel super different but I feel light headed a lot less which is good. I also havent fainted recently. I was also diagnosed with AN without being underweight, just really close to it.  My weight hasn't changed much while trying to raise my HR, if that's worrying you, it worried me. I hover around the same weight. Water can raise it sometimes so I suggest making sure u have enough of it!!",False,False
er958ll,t3_c0yrjq,t1_er927zf,unnecessaryletters,1,2019-06-15 11:51:19,/r/EDAnonymous/comments/c0yrjq/being_a_runner_with_an_and_having_a_low_hr/er958ll/,"my ""peak"" zone starts at 160 and i've gotten as high as 180 before, i think it's normal, just definitely slow it down if you start feeling sick 🙂",False,False
er94zjf,t3_c0yrjq,t3_c0yrjq,unnecessaryletters,1,2019-06-15 11:49:12,/r/EDAnonymous/comments/c0yrjq/being_a_runner_with_an_and_having_a_low_hr/er94zjf/,"i think you should keep an eye on it and report back to him if it goes any lower, but as long as you aren't having any other side effects, it could be okay. i have found that as i increase my weekly running mileage now that the weather is getting better, my rhr is steadily dropping. two months ago my weekly average was 61 and now it's 55. last night as i was getting ready for bed it was at 48 and it has never been that low before. the only thing i've changed is my mileage! i think just definitely track it and listen to your body 🙂",False,False
er93qlo,t3_c0yrjq,t3_c0yrjq,110_percent_bot,1,2019-06-15 11:38:17,/r/EDAnonymous/comments/c0yrjq/being_a_runner_with_an_and_having_a_low_hr/er93qlo/,"I have naturally low blood pressure and HR, when I'm not exercising my blood pressure is near the minimum of normal and my HR is around 60. When I run now (am not in shape, so only a few miles at a time) my HR is around 160-170.    When I was at my LW (20.5 BMI) I was more in shape. My runs were not super long distance but definitely 3-6 miles on most days. Anyway, my resting HR was usually around 50, under 50 if I hadn't eaten in a while and above 50 if I had. Sometimes it reached the low 40's, which was probably bad. I once saw it at 39. When running, it was usually 150-160, and 170 if I did sprints.   Last data point, my sister (no ED, does not exercise, normal weight) also has low blood pressure and a resting HR in the low 50s.   I guess what I'm trying to say is, in my experience, low HR can be genetic and completely normal, but also an ED can make your HR even lower in an unhealthy way. So stay safe, but also don't panic -- this might be norm for your body / fitness level",False,False
er927zf,t3_c0yrjq,t1_er8ze8i,teapip99,1,2019-06-15 11:25:07,/r/EDAnonymous/comments/c0yrjq/being_a_runner_with_an_and_having_a_low_hr/er927zf/,Is 150 BPM too high during activity ?? Mine goes up to 160-170 during running etc I always thought that was normal!,False,False
er8ze8i,t3_c0yrjq,t3_c0yrjq,ohh_hello_,1,2019-06-15 11:01:29,/r/EDAnonymous/comments/c0yrjq/being_a_runner_with_an_and_having_a_low_hr/er8ze8i/,"last spring i was playing soccer and track during the same season, i found my resting heart rate to be about the same as yours during my season but while doing physical activities it would go crazy high (like 150 BPM) stay safe. This disorder can mess with you in ways you won’t even realize until it’s a little late.",False,False
