Comment ID,Link ID,Parent ID,Author,Score,Publish Date,Permalink,Text,Stickied,Is Submitter
fc47due,t3_efzqrk,t1_fc43eor,Actualhumandisaster,1,2019-12-26 19:03:31,/r/EDAnonymous/comments/efzqrk/noticing_people_around_doing_edlike_behaviour/fc47due/,"Oh, that does change things..",False,False
fc43eor,t3_efzqrk,t1_fc3lkt2,kkdka,1,2019-12-26 18:13:17,/r/EDAnonymous/comments/efzqrk/noticing_people_around_doing_edlike_behaviour/fc43eor/,"Yeah, but she doesn’t do it normally. It’s like just because it’s Christmas and she’s eating a lot, she says it’s intermittent fasting",False,True
fc3p5t8,t3_efzqrk,t3_efzqrk,corndoglegs,1,2019-12-26 15:19:01,/r/EDAnonymous/comments/efzqrk/noticing_people_around_doing_edlike_behaviour/fc3p5t8/,"Intermittent fasting is based around a set alloted time for fasting. For example most people fast for 16 hours a day, and then have an 8 hour eating window. Your sister probably did 20 hours of fasting and a 4 hour eating window just for dinner.   There are a lot of resources for IF and it can help folks manage self-control, and to boost weight loss.",False,False
fc3lkt2,t3_efzqrk,t3_efzqrk,Actualhumandisaster,1,2019-12-26 14:36:16,/r/EDAnonymous/comments/efzqrk/noticing_people_around_doing_edlike_behaviour/fc3lkt2/,IF isn't an eating disorder just because it involves fasting..,False,False
fc3g3po,t3_efzqrk,t3_efzqrk,anrecovery,1,2019-12-26 13:37:10,/r/EDAnonymous/comments/efzqrk/noticing_people_around_doing_edlike_behaviour/fc3g3po/,"a lot of my family members are too  diet culture has normalized this type of talk, so it’s kind of become normal for people to think this way. think about the beginning of your ED behaviors (restriction, exercising, whatever it may be), did you know that this was an eating disorder? most people know what they’re doing, but don’t think it’s an ED. and most people have disordered eating without taking it to extremes of a full blown eating disorder.   it’s so sad to hear these words from families, you wanna just scream at them and say “no! you’re perfect how you are, you deserve to eat!!!” but on the other hand it’s like who are WE to be giving eating advice or comments to others.  it can definitely be triggering to hear this talk coming from people who don’t have an ED, or know you have one, but if it’s super bothering maybe try asking them to be more conscious of what they’re saying about food/ diets/ body images/ etc",False,False
