Comment ID,Link ID,Parent ID,Author,Score,Publish Date,Permalink,Text,Stickied,Is Submitter
f1gmj8z,t3_d96ple,t3_d96ple,Ilovebigkitties,1,2019-09-25 23:08:08,/r/EDAnonymous/comments/d96ple/omad_is_all_fun_and_games_until_you_eat_1000/f1gmj8z/,Damn I love oatmeal but the caaaarbs,False,False
f1g0wlu,t3_d96ple,t1_f1fk3mc,Ughleigh,1,2019-09-25 19:23:45,/r/EDAnonymous/comments/d96ple/omad_is_all_fun_and_games_until_you_eat_1000/f1g0wlu/,My 8 year old told me today she loves pooping and I was like GIRL SAME 😂,False,False
f1frhyf,t3_d96ple,t3_d96ple,starfish31,1,2019-09-25 17:41:35,/r/EDAnonymous/comments/d96ple/omad_is_all_fun_and_games_until_you_eat_1000/f1frhyf/,"I've loaded my bowl up with banana and peanut butter, other fruits too, and holy",False,False
f1foqye,t3_d96ple,t1_f1ffyke,etherealaqua,1,2019-09-25 17:08:13,/r/EDAnonymous/comments/d96ple/omad_is_all_fun_and_games_until_you_eat_1000/f1foqye/,couldn’t agree more lol,False,False
f1fogpu,t3_d96ple,t3_d96ple,tigerchik,1,2019-09-25 17:04:54,/r/EDAnonymous/comments/d96ple/omad_is_all_fun_and_games_until_you_eat_1000/f1fogpu/,Hi there twin. 6 instant oatmeal packets on Monday night,False,False
f1fk3mc,t3_d96ple,t1_f1fjkh9,stupidfuckingbitxh,1,2019-09-25 16:16:31,/r/EDAnonymous/comments/d96ple/omad_is_all_fun_and_games_until_you_eat_1000/f1fk3mc/,thank you I'm excited for bowel movement,False,True
f1fjkh9,t3_d96ple,t3_d96ple,howunfortunate_,1,2019-09-25 16:10:52,/r/EDAnonymous/comments/d96ple/omad_is_all_fun_and_games_until_you_eat_1000/f1fjkh9/,praying for your shits mate i did that once. it was rough. drink water (a lot),False,False
f1fj4wv,t3_d96ple,t1_f1fdvro,stupidfuckingbitxh,1,2019-09-25 16:06:25,/r/EDAnonymous/comments/d96ple/omad_is_all_fun_and_games_until_you_eat_1000/f1fj4wv/,yes,False,True
f1fj3lu,t3_d96ple,t1_f1fimlr,stupidfuckingbitxh,1,2019-09-25 16:06:02,/r/EDAnonymous/comments/d96ple/omad_is_all_fun_and_games_until_you_eat_1000/f1fj3lu/,it's a form of intermittent fasting but it won't take you any more than like an hour to eat,False,True
f1fimlr,t3_d96ple,t1_f1figpb,SHybrid,1,2019-09-25 16:01:05,/r/EDAnonymous/comments/d96ple/omad_is_all_fun_and_games_until_you_eat_1000/f1fimlr/,Ok it's similar to intermittant fasting I guess,False,False
f1figpb,t3_d96ple,t1_f1fh742,stupidfuckingbitxh,1,2019-09-25 15:59:25,/r/EDAnonymous/comments/d96ple/omad_is_all_fun_and_games_until_you_eat_1000/f1figpb/,"one meal a day, basically instead of small meals you just have one bigger one , it stops me from overeating",False,True
f1fh742,t3_d96ple,t3_d96ple,SHybrid,1,2019-09-25 15:46:41,/r/EDAnonymous/comments/d96ple/omad_is_all_fun_and_games_until_you_eat_1000/f1fh742/,"Again, sorry. I know no shit of the gergo. What is OMAD? Sooo sorry not a native english speaker 😅",False,False
f1fg0s5,t3_d96ple,t1_f1fdb3r,stupidfuckingbitxh,1,2019-09-25 15:34:54,/r/EDAnonymous/comments/d96ple/omad_is_all_fun_and_games_until_you_eat_1000/f1fg0s5/,fucking crazy,False,True
f1ffyke,t3_d96ple,t1_f1fflbb,stupidfuckingbitxh,1,2019-09-25 15:34:16,/r/EDAnonymous/comments/d96ple/omad_is_all_fun_and_games_until_you_eat_1000/f1ffyke/,so simple but so good,False,True
f1fflbb,t3_d96ple,t1_f1f7moy,etherealaqua,1,2019-09-25 15:30:35,/r/EDAnonymous/comments/d96ple/omad_is_all_fun_and_games_until_you_eat_1000/f1fflbb/,CLASSIC,False,False
f1fdvro,t3_d96ple,t3_d96ple,feiturdrengur,1,2019-09-25 15:13:01,/r/EDAnonymous/comments/d96ple/omad_is_all_fun_and_games_until_you_eat_1000/f1fdvro/,OatMeal A Day 👌,False,False
f1fdb3r,t3_d96ple,t3_d96ple,imputados,1,2019-09-25 15:06:55,/r/EDAnonymous/comments/d96ple/omad_is_all_fun_and_games_until_you_eat_1000/f1fdb3r/,I read this post while eating my OMAD oatmeal we really are all living the same life,False,False
f1f9lep,t3_d96ple,t3_d96ple,skeet_yeet_repeat,1,2019-09-25 14:28:13,/r/EDAnonymous/comments/d96ple/omad_is_all_fun_and_games_until_you_eat_1000/f1f9lep/,"Oh fuck I did that (1/2 oatmeal cals, 1/2 pb cals)  it was glorious And I was in so much pain I wanted to fucking die :D",False,False
f1f7moy,t3_d96ple,t1_f1f0n8l,stupidfuckingbitxh,1,2019-09-25 14:07:38,/r/EDAnonymous/comments/d96ple/omad_is_all_fun_and_games_until_you_eat_1000/f1f7moy/,I have with it with stevia and cacao,False,True
f1f7kyt,t3_d96ple,t1_f1f27x5,stupidfuckingbitxh,1,2019-09-25 14:07:08,/r/EDAnonymous/comments/d96ple/omad_is_all_fun_and_games_until_you_eat_1000/f1f7kyt/,I feel fine now but oml the initial pain was terrible,False,True
f1f27x5,t3_d96ple,t3_d96ple,frickinskinny,1,2019-09-25 13:18:16,/r/EDAnonymous/comments/d96ple/omad_is_all_fun_and_games_until_you_eat_1000/f1f27x5/,I once did the same exact thing and the next day my poop was absolutely glorious. Drink lots of water!,False,False
f1f0n8l,t3_d96ple,t3_d96ple,etherealaqua,1,2019-09-25 13:01:23,/r/EDAnonymous/comments/d96ple/omad_is_all_fun_and_games_until_you_eat_1000/f1f0n8l/,"....how?? like, plain oats or with other additions in it??",False,False
