Comment ID,Link ID,Parent ID,Author,Score,Publish Date,Permalink,Text,Stickied,Is Submitter
eztiiqu,t3_d1vgb5,t3_d1vgb5,hellodollyy,1,2019-09-10 10:58:48,/r/EDAnonymous/comments/d1vgb5/just_had_a_mental_breakdown_over_to_the_bone_so/eztiiqu/,I feel this 16877653467% when the step mom puts her on the scale and makes her look at herself and asks her if she thinks this is beautiful. she says no but we all know she means YES,False,False
ezsiwbw,t3_d1vgb5,t1_ezsicql,Pyxxiss,1,2019-09-10 00:28:30,/r/EDAnonymous/comments/d1vgb5/just_had_a_mental_breakdown_over_to_the_bone_so/ezsiwbw/,My relationship with my mom is both of Eli's parents at once so the ending is like a bullet to the chest,False,False
ezsicql,t3_d1vgb5,t1_ezsgbyk,Birdie49,1,2019-09-10 00:18:35,/r/EDAnonymous/comments/d1vgb5/just_had_a_mental_breakdown_over_to_the_bone_so/ezsicql/,"Fucking hell, that scene always makes me cry",False,False
ezsge3s,t3_d1vgb5,t1_ezsgbyk,unicorn6642,1,2019-09-09 23:45:25,/r/EDAnonymous/comments/d1vgb5/just_had_a_mental_breakdown_over_to_the_bone_so/ezsge3s/,Ffuckkkkkk yes that scene ruined me. So many scenes ruined me,False,True
ezsgbyk,t3_d1vgb5,t3_d1vgb5,Pyxxiss,1,2019-09-09 23:44:24,/r/EDAnonymous/comments/d1vgb5/just_had_a_mental_breakdown_over_to_the_bone_so/ezsgbyk/,The moment where her mom is feeding her with the bottle really got to me deep. I felt that.,False,False
