Comment ID,Link ID,Parent ID,Author,Score,Publish Date,Permalink,Text,Stickied,Is Submitter
fi7q3rr,t3_f6i0mi,t1_fi6el5p,kayteesays,1,2020-02-20 13:14:48,/r/EDAnonymous/comments/f6i0mi/tomorrow_is_fat_thursday_and_my_office_is_gonna/fi7q3rr/,Good for you! You deserve to enjoy every bite,False,False
fi6el5p,t3_f6i0mi,t1_fi6ehlw,PartyTimeSexyDisco,1,2020-02-20 03:31:06,/r/EDAnonymous/comments/f6i0mi/tomorrow_is_fat_thursday_and_my_office_is_gonna/fi6el5p/,"No worries, the only reason I know when moving holidays like Easter are is bc of the emails I get at work with office closure dates 😅 I've just barely figured out how to accommodate my donut and I'm determined to enjoy it as much as I can :')",False,True
fi6ehlw,t3_f6i0mi,t1_fi698xj,kayteesays,1,2020-02-20 03:28:42,/r/EDAnonymous/comments/f6i0mi/tomorrow_is_fat_thursday_and_my_office_is_gonna/fi6ehlw/,"Huh. I did not realize it was different! Sorry. Good luck today, you so got this!",False,False
fi698xj,t3_f6i0mi,t1_fi533me,PartyTimeSexyDisco,1,2020-02-20 01:31:23,/r/EDAnonymous/comments/f6i0mi/tomorrow_is_fat_thursday_and_my_office_is_gonna/fi698xj/,"Nope, it's today on Poland",False,True
fi533me,t3_f6i0mi,t3_f6i0mi,kayteesays,1,2020-02-19 17:11:05,/r/EDAnonymous/comments/f6i0mi/tomorrow_is_fat_thursday_and_my_office_is_gonna/fi533me/,"If it helps, fat tuesday isn't until next Tuesday. You're a week early.",False,False
