Comment ID,Link ID,Parent ID,Author,Score,Publish Date,Permalink,Text,Stickied,Is Submitter
ec1sy8z,t3_a77qeh,t3_a77qeh,CorrithLavellan,1,2018-12-18 09:53:46,/r/EDAnonymous/comments/a77qeh/has_anyone_else_noticed_an_increase_in_pins_and/ec1sy8z/,oh yeah! if i sit on the toilet for longer than 5 minutes both of my entire legs will go to sleep. so uncomfortable. and if i lay wrong my arms will go to sleep 😐,False,False
ec1se1p,t3_a77qeh,t3_a77qeh,gigi-has-issues,1,2018-12-18 09:46:15,/r/EDAnonymous/comments/a77qeh/has_anyone_else_noticed_an_increase_in_pins_and/ec1se1p/,B12! ,False,False
ec1ld3g,t3_a77qeh,t3_a77qeh,godonvideocall,1,2018-12-18 08:01:26,/r/EDAnonymous/comments/a77qeh/has_anyone_else_noticed_an_increase_in_pins_and/ec1ld3g/,It happens to me because I’m anemic. Like 5 minutes sitting in my feet and it’s dead lol. You might/probably have some kind of mild nutrient deficiency. A blood test wouldn’t be a bad idea. ,False,False
ec18rr3,t3_a77qeh,t3_a77qeh,norwegian_twat,1,2018-12-18 02:43:04,/r/EDAnonymous/comments/a77qeh/has_anyone_else_noticed_an_increase_in_pins_and/ec18rr3/,"yup. whenever im restricting the pins and needles become way more frequent. crossing my legs? nope cant do that anymore lmao  yoga also is a bitch when restricting cause nearly every pose calls for pins n needles.   when im eating normally its usually not so bad, so its most def to do with undereating.",False,False
ec16zrb,t3_a77qeh,t3_a77qeh,siyea,1,2018-12-18 01:49:20,/r/EDAnonymous/comments/a77qeh/has_anyone_else_noticed_an_increase_in_pins_and/ec16zrb/,"Oh!!! I'm glad you posted about this because I've been feeling this a lot in my arms and I was worried I was fucking up my spine! Thank you, I'd rather this be caused by an ED rather than a bad back lmao",False,False
ec16e60,t3_a77qeh,t3_a77qeh,VengefulBodied,1,2018-12-18 01:32:12,/r/EDAnonymous/comments/a77qeh/has_anyone_else_noticed_an_increase_in_pins_and/ec16e60/,Knee high socks help with the pins/needles and fake bug bites/crawls on my legs. I don't think mine is ED related I think it's from all the fucking drugs I did. ,False,False
ec14aam,t3_a77qeh,t3_a77qeh,LongGreySkirt,1,2018-12-18 00:36:50,/r/EDAnonymous/comments/a77qeh/has_anyone_else_noticed_an_increase_in_pins_and/ec14aam/,"yes, when i lie in bed i can feel my legs phase in and out of existence. get some B12 supplements, i recommend floradix because it also has iron",False,False
ec13mns,t3_a77qeh,t3_a77qeh,kernalmustache,1,2018-12-18 00:20:43,/r/EDAnonymous/comments/a77qeh/has_anyone_else_noticed_an_increase_in_pins_and/ec13mns/,I don't get the pins and needles sensation but numbness has definitely increased a lot.,False,False
ec12wie,t3_a77qeh,t3_a77qeh,chezpajama,1,2018-12-18 00:03:53,/r/EDAnonymous/comments/a77qeh/has_anyone_else_noticed_an_increase_in_pins_and/ec12wie/,Yeah especially when I’m falling asleep ,False,False
ec113kn,t3_a77qeh,t3_a77qeh,wickdhippy,1,2018-12-17 23:25:20,/r/EDAnonymous/comments/a77qeh/has_anyone_else_noticed_an_increase_in_pins_and/ec113kn/,Yeah my circulation is horrendous ,False,False
ec10yoz,t3_a77qeh,t3_a77qeh,bluecokezero,1,2018-12-17 23:22:34,/r/EDAnonymous/comments/a77qeh/has_anyone_else_noticed_an_increase_in_pins_and/ec10yoz/,I remember reading an old thread on the old sub about this being a thing so I don’t think you’re alone ,False,False
