Comment ID,Link ID,Parent ID,Author,Score,Publish Date,Permalink,Text,Stickied,Is Submitter
en7hy15,t3_bneiei,t1_en5pgd2,unforgettable_potato,1,2019-05-12 06:46:38,/r/EDAnonymous/comments/bneiei/had_a_genuine_mental_breakdown_because_i_grabbed/en7hy15/,Oh God. I did the same thing with a blood orange one. Fucking liars. It's a soda?! Label it as suck. Damn Walmart had it stocked near the La Croix ugh.,False,False
en5ppwy,t3_bneiei,t3_bneiei,princess-kitty-belle,1,2019-05-11 17:16:48,/r/EDAnonymous/comments/bneiei/had_a_genuine_mental_breakdown_because_i_grabbed/en5ppwy/,"When this happens I remind myself that my body barely knows the difference- an extra 100 calories is just burned off by your metabolism increasing.   &amp;#x200B;  But yeah, I've had several mental breakdowns over small amounts of calories and this thought has been my saving grace during them.",False,False
en5pgd2,t3_bneiei,t3_bneiei,herdofthebay,1,2019-05-11 17:13:48,/r/EDAnonymous/comments/bneiei/had_a_genuine_mental_breakdown_because_i_grabbed/en5pgd2/,I bought a case San Pellegrino limonata because I thought they were flavored sparkling water so you know 0 calories.. NOPE. 130 calories. Now there’s a box of calories that taunts me reminding me of my stupidity,False,False
en5nqfv,t3_bneiei,t3_bneiei,sintos-compa,1,2019-05-11 16:53:57,/r/EDAnonymous/comments/bneiei/had_a_genuine_mental_breakdown_because_i_grabbed/en5nqfv/,Haha holy shit I did this last night with dried shiitake,False,False
en5gsvv,t3_bneiei,t3_bneiei,heyy240,1,2019-05-11 15:50:41,/r/EDAnonymous/comments/bneiei/had_a_genuine_mental_breakdown_because_i_grabbed/en5gsvv/,"So glamorous. Getting vomit breath is SO trendy rn.  Srs fuck ppl who actually want Ed's because they think they're glamorous, and fuck the ppl telling other vulnerable people that they are.",False,False
