Comment ID,Link ID,Parent ID,Author,Score,Publish Date,Permalink,Text,Stickied,Is Submitter
ffhany2,t3_etcm0g,t1_fffmmyo,j4jackj,1,2020-01-24 22:54:34,/r/EDAnonymous/comments/etcm0g/guess_ill_just_starve_myself_about_it_tw/ffhany2/,water pills flush water,False,False
fffmw33,t3_etcm0g,t1_fffik1k,tseokii,1,2020-01-24 11:36:31,/r/EDAnonymous/comments/etcm0g/guess_ill_just_starve_myself_about_it_tw/fffmw33/,"Thank you &lt;3 guess it could be chilling in my cells but I'm baffled because I don't look like I'm retaining water. I do get water bloat like motherfucker but I don't see any of that on my body rn  Normally I don't even care that much about my weight but the one time my filthy rat brain DOES care, ofc my body is like ""fuck it, weight gain time!"" lol. Thank you for the kind words &lt;3",False,True
fffmqfe,t3_etcm0g,t1_fffg8re,tseokii,1,2020-01-24 11:34:54,/r/EDAnonymous/comments/etcm0g/guess_ill_just_starve_myself_about_it_tw/fffmqfe/,You are very kind &lt;3,False,True
fffmmyo,t3_etcm0g,t1_fffgrgf,tseokii,1,2020-01-24 11:33:55,/r/EDAnonymous/comments/etcm0g/guess_ill_just_starve_myself_about_it_tw/fffmmyo/,"Yeah water pills might be worth a try, idk exactly how they differ from drinking water thought aha. Thank you for the advice &lt;3",False,True
fffik1k,t3_etcm0g,t3_etcm0g,terriblelizerd,1,2020-01-24 10:52:04,/r/EDAnonymous/comments/etcm0g/guess_ill_just_starve_myself_about_it_tw/fffik1k/,"this happens to me too every time i try to water fast. im not super clear on the science but i think your cells and organs and whatnot can also be storing water if u were dehydrated before. i usually experience a whoosh like a day after breaking the fast for some reason, so don’t worry !! i know how awful it is to see the scale go up but please don’t torture yourself over it",False,False
fffgrgf,t3_etcm0g,t3_etcm0g,blvberi,1,2020-01-24 10:33:35,/r/EDAnonymous/comments/etcm0g/guess_ill_just_starve_myself_about_it_tw/fffgrgf/,"maybe water pills? even if you don’t think you’re retaining water. also, it sounds backwards, but eating actually could cause you to lose the weight because it sounds like you’re keeping in whatever you put in. changing things up works. also please be safe.",False,False
fffg8re,t3_etcm0g,t3_etcm0g,aggressivehealth9,1,2020-01-24 10:28:12,/r/EDAnonymous/comments/etcm0g/guess_ill_just_starve_myself_about_it_tw/fffg8re/,"you deserve to eat, please eat something",False,False
