Comment ID,Link ID,Parent ID,Author,Score,Publish Date,Permalink,Text,Stickied,Is Submitter
f865dqd,t3_dyn3qh,t3_dyn3qh,ainotna_,1,2019-11-20 16:48:36,/r/EDAnonymous/comments/dyn3qh/maintenance/f865dqd/,i literally google my maintenance calories almost every day and i literally can not BELIEVE how high they are compared to what i normally eat. and then i get surprised when ive lost even more weight and look even worse (but better..ED brain is fighting w rational brain about how im looking these days),False,False
f834kpq,t3_dyn3qh,t3_dyn3qh,thiccspo,1,2019-11-19 16:57:05,/r/EDAnonymous/comments/dyn3qh/maintenance/f834kpq/,I keep forgetting what my maintenance calories even are and have to google it a lot,False,False
f833f1j,t3_dyn3qh,t3_dyn3qh,my50ththrowaway,1,2019-11-19 16:45:32,/r/EDAnonymous/comments/dyn3qh/maintenance/f833f1j/,"**TW CALORIES**  i feel this so hard. realistically, i know that if i eat under maintenance i will lose no matter what, but somehow my dumb shit brain thinks i’ll gain if i eat over 800 calories. maybe it’s just about the control at this point. my rational brain knows and understands nutrition, but it’s not applicable to me. the lower i restrict, the worse eating normally feels and binging is so much worse.",False,False
f82rg62,t3_dyn3qh,t1_f82r555,lauryleah,1,2019-11-19 14:53:11,/r/EDAnonymous/comments/dyn3qh/maintenance/f82rg62/,!!!!!!!!!!!!!!!!,False,True
f82r555,t3_dyn3qh,t3_dyn3qh,MoosieGoose,1,2019-11-19 14:50:26,/r/EDAnonymous/comments/dyn3qh/maintenance/f82r555/,"*****TRIGGER WARNING*****   If I eat anything, everything will go to shit, including all progress. If I restrict, I'll suffer &amp; see little progress. If I intuitively eat, what the hell am I alive for? What can I use to distract me from the deafening howl of our bleak human existence? Addictions are shunned &amp; suicide is permanent. (Sorry for the rant!)",False,False
f82pcwd,t3_dyn3qh,t1_f82hx3n,pokeupokeu,1,2019-11-19 14:34:08,/r/EDAnonymous/comments/dyn3qh/maintenance/f82pcwd/,Eating more than a thousand calories is a binge and i cannot convince myself otherwise,False,False
f82n8is,t3_dyn3qh,t1_f82ac55,catzthedoctor,1,2019-11-19 14:14:50,/r/EDAnonymous/comments/dyn3qh/maintenance/f82n8is/,Same :( it sucks cus I’m actively losing muscle when I restrict and it just suuuuuucks,False,False
f82i6yw,t3_dyn3qh,t1_f82hx3n,lauryleah,1,2019-11-19 13:28:48,/r/EDAnonymous/comments/dyn3qh/maintenance/f82i6yw/,YES,False,True
f82hx3n,t3_dyn3qh,t3_dyn3qh,lemonye,1,2019-11-19 13:26:10,/r/EDAnonymous/comments/dyn3qh/maintenance/f82hx3n/,"Or when you just restrict higher... it suddenly feels like a binge when you’ve been restricting more for a while, so annoying 😤 I am so impatient with my weight loss, it’s lame",False,False
f82ac55,t3_dyn3qh,t3_dyn3qh,runhappy18,1,2019-11-19 12:14:57,/r/EDAnonymous/comments/dyn3qh/maintenance/f82ac55/,Yes I’m an athlete and I still don’t because I’m so scared wtf !! :(,False,False
f827k80,t3_dyn3qh,t3_dyn3qh,KieranBoonee,1,2019-11-19 11:47:22,/r/EDAnonymous/comments/dyn3qh/maintenance/f827k80/,just remember it's your ed brain being stupid and it's totally fine to eat a normal amount of food for your body. you deserve it :),False,False
f8256w8,t3_dyn3qh,t3_dyn3qh,Rivka90,1,2019-11-19 11:23:38,/r/EDAnonymous/comments/dyn3qh/maintenance/f8256w8/,Fucking AMEN,False,False
