Comment ID,Link ID,Parent ID,Author,Score,Publish Date,Permalink,Text,Stickied,Is Submitter
f6fl6ej,t3_dr0t97,t3_dr0t97,radicalcantaloop,1,2019-11-03 15:12:31,/r/EDAnonymous/comments/dr0t97/underweight_and_stretch_marks/f6fl6ej/,"stretch marks are super normal! and there’s plenty of thinspo girls that have them. they might edit them out of photos, but I promise you that there are tons of skinny girls running around with stretch marks",False,False
f6empap,t3_dr0t97,t1_f6ejr11,emmyemememem,1,2019-11-03 12:30:27,/r/EDAnonymous/comments/dr0t97/underweight_and_stretch_marks/f6empap/,That darn puberty!,False,False
f6ejr11,t3_dr0t97,t1_f6ej094,NekoChan1605,2,2019-11-03 12:14:41,/r/EDAnonymous/comments/dr0t97/underweight_and_stretch_marks/f6ejr11/,"I know they weren't there before, i started to lose at a lower weight, but it could be bc of puberty 🤔 thank you for the tips ( ^w^)/",False,True
f6ej094,t3_dr0t97,t3_dr0t97,emmyemememem,1,2019-11-03 12:11:16,/r/EDAnonymous/comments/dr0t97/underweight_and_stretch_marks/f6ej094/,"You probably had stretch marks beforehand even if they weren't noticeable. And the weight loss is just making them visible due to the loosening of your skin. Stretch marks are completely normal. I got them on my hips, butt, thighs and breasts because of growth-spurts during puberty. I didn't even know about it until I lost a bit of weight. You shouldn't compare yourself to thinspo because everyone's body is different.",False,False
f6e5hm7,t3_dr0t97,t1_f6e2v48,NekoChan1605,2,2019-11-03 11:00:17,/r/EDAnonymous/comments/dr0t97/underweight_and_stretch_marks/f6e5hm7/,I thought that maybe it's because my skin stretches so much on my hip bones (they're very prominent). Maybe it's the same with you but + from yoga? I just hope they fade with time;;,False,True
f6e2v48,t3_dr0t97,t3_dr0t97,drinksriracha,2,2019-11-03 10:47:38,/r/EDAnonymous/comments/dr0t97/underweight_and_stretch_marks/f6e2v48/,"How is it possible to get stretch marks whike getting thinner? This is the first I've heard of it  Sorry, OP. Im on the same place. I lost some weight but I'm seeing new stretch marks. I thought maybe it was from yoga? Like maybe my body is under more strain now.",False,False
f6dv9jj,t3_dr0t97,t3_dr0t97,Duskyroses,1,2019-11-03 10:08:15,/r/EDAnonymous/comments/dr0t97/underweight_and_stretch_marks/f6dv9jj/,They kind of fade with time but I have stretch marks too :) but I always thought stretch marks are kind of pretty and I don’t mind mine.,False,False
f6d7q53,t3_dr0t97,t1_f6d4d9i,NekoChan1605,2,2019-11-03 08:40:34,/r/EDAnonymous/comments/dr0t97/underweight_and_stretch_marks/f6d7q53/,"Good to know that i'm not the only one... i have lost weight the past days, hopefully that's the reason. Thank you for helping me ( ^w^)/",False,True
f6d4d9i,t3_dr0t97,t3_dr0t97,agw212,4,2019-11-03 08:27:30,/r/EDAnonymous/comments/dr0t97/underweight_and_stretch_marks/f6d4d9i/,You get stretch marks by either gaining or losing a lot of weight quickly. I’m underweight and I have plenty of them.,False,False
