Comment ID,Link ID,Parent ID,Author,Score,Publish Date,Permalink,Text,Stickied,Is Submitter
ejfqarx,t3_b5n8gb,t1_ejf051z,sintos-compa,1,2019-03-26 13:38:48,/r/EDAnonymous/comments/b5n8gb/accidentally_bought_laxatives_that_go_up_your_butt/ejfqarx/,Sentences i did not expect to read today ....,False,False
ejfq7mz,t3_b5n8gb,t1_ejeq87m,sintos-compa,1,2019-03-26 13:37:51,/r/EDAnonymous/comments/b5n8gb/accidentally_bought_laxatives_that_go_up_your_butt/ejfq7mz/,"honestly though, r/especiallywithcontext",False,False
ejfj7wm,t3_b5n8gb,t1_ejeusc4,Rosalie_aqua,1,2019-03-26 12:22:56,/r/EDAnonymous/comments/b5n8gb/accidentally_bought_laxatives_that_go_up_your_butt/ejfj7wm/,"True though, the fear when you take a mouth laxative the night before and you wake up for work / uni the next morning and still don’t need to shit is bad.",False,True
ejfj49q,t3_b5n8gb,t1_ejf4urs,Rosalie_aqua,1,2019-03-26 12:21:51,/r/EDAnonymous/comments/b5n8gb/accidentally_bought_laxatives_that_go_up_your_butt/ejfj49q/,Yeah mine said to add water. It was slipping round my fingers like jelly and I was scared it would fall in the toilet though! And oof if that’s anything like pulling out a dry tampon then yum,False,True
ejf4urs,t3_b5n8gb,t1_ejeutxv,TheManyArchetypes,1,2019-03-26 09:45:49,/r/EDAnonymous/comments/b5n8gb/accidentally_bought_laxatives_that_go_up_your_butt/ejf4urs/,"I was trained by nurses to administer suppositories and never once was told to put them in water. If OPs box says to do that, I would follow the directions on the package, but it is definitely strange.",False,False
ejf1a78,t3_b5n8gb,t3_b5n8gb,skelekey,1,2019-03-26 09:03:09,/r/EDAnonymous/comments/b5n8gb/accidentally_bought_laxatives_that_go_up_your_butt/ejf1a78/,"Suppositories are absolutely awful, but effective!  I couldn’t poop one time, so I stuck one up there (dulcolax) and sat back down on the couch. Almost instantly my stomach started cramping and gurgling, and I couldn’t even hold it in for 15 minutes. Works fast though!",False,False
ejf051z,t3_b5n8gb,t3_b5n8gb,ReneeLouvier,1,2019-03-26 08:48:59,/r/EDAnonymous/comments/b5n8gb/accidentally_bought_laxatives_that_go_up_your_butt/ejf051z/,"If your anus muscles are not as tight as you'd like, insert one, then lay on your stomach and when the feeling comes, hold your ass cheeks together as you go to the bathroom before you sit down.",False,False
ejevl32,t3_b5n8gb,t3_b5n8gb,everythingabove02,1,2019-03-26 07:46:33,/r/EDAnonymous/comments/b5n8gb/accidentally_bought_laxatives_that_go_up_your_butt/ejevl32/,"It's that type I use the most, they work effectively and you don't abuse them ",False,False
ejeutxv,t3_b5n8gb,t3_b5n8gb,CatsAreKids,1,2019-03-26 07:34:54,/r/EDAnonymous/comments/b5n8gb/accidentally_bought_laxatives_that_go_up_your_butt/ejeutxv/,"I didn’t know you were supposed to put suppositories in water first, I’ve been putting dry wax bullets in my ass wtf",False,False
ejeusc4,t3_b5n8gb,t1_ejemjym,CatsAreKids,1,2019-03-26 07:34:11,/r/EDAnonymous/comments/b5n8gb/accidentally_bought_laxatives_that_go_up_your_butt/ejeusc4/,"This gave me a laugh, thank you lmfao",False,False
ejeq87m,t3_b5n8gb,t1_ejemjym,asheristrasher,1,2019-03-26 06:12:03,/r/EDAnonymous/comments/b5n8gb/accidentally_bought_laxatives_that_go_up_your_butt/ejeq87m/,r/nocontext,False,False
ejenhl2,t3_b5n8gb,t1_ejemjym,PM_ME_BrusselSprouts,1,2019-03-26 05:08:04,/r/EDAnonymous/comments/b5n8gb/accidentally_bought_laxatives_that_go_up_your_butt/ejenhl2/,Comments like these are why I love this sub.  So much love and support.,False,False
ejemjym,t3_b5n8gb,t3_b5n8gb,Whypay,1,2019-03-26 04:43:10,/r/EDAnonymous/comments/b5n8gb/accidentally_bought_laxatives_that_go_up_your_butt/ejemjym/,They're the best kind though. They'll turn your arse inside out and only take an hour to work so you aren't rolling the dice on shitting yourself.,False,False
