Comment ID,Link ID,Parent ID,Author,Score,Publish Date,Permalink,Text,Stickied,Is Submitter
emerarw,t3_bjxp7o,t1_emdjuk3,lemonlime836,1,2019-05-03 08:51:06,/r/EDAnonymous/comments/bjxp7o/my_family_and_boyfriend_are_becoming_calorieaware/emerarw/,Oh goddd 😭 yup.,False,True
emer9wm,t3_bjxp7o,t1_emdbr7v,lemonlime836,1,2019-05-03 08:50:49,/r/EDAnonymous/comments/bjxp7o/my_family_and_boyfriend_are_becoming_calorieaware/emer9wm/,"Omg, spot on.   And yes!! Like if my parents are fasting and taking walks to be able to afford dinner, aM i EvEn DiSOrdEred? 🙃",False,True
emdjuk3,t3_bjxp7o,t3_bjxp7o,iam_theuniverse,1,2019-05-02 21:39:17,/r/EDAnonymous/comments/bjxp7o/my_family_and_boyfriend_are_becoming_calorieaware/emdjuk3/,Same thing happened with my so and I... he got an Apple Watch and became so calorie aware and obsessed with burning them.. triggered me. What did I do next? Bought an Apple Watch to obsessively see how many calories I can burn in a day..   What is life. 🙃,False,False
emdbr7v,t3_bjxp7o,t3_bjxp7o,thoughtpatrol20,1,2019-05-02 20:11:03,/r/EDAnonymous/comments/bjxp7o/my_family_and_boyfriend_are_becoming_calorieaware/emdbr7v/,"Daaaamn I can definitely feel that.  I oftentimes need to sort of hide my power level when people around me discuss calories and nutrition. People think it's weird when you just know the basics, and I could write a book at this point.  What sucks is that as people get wise and learn CICO, they sometimes start to exhibit certain disordered behaviors themselves. This can be confusing and scary. I do not envy your position.",False,False
emd3dp2,t3_bjxp7o,t1_emd3cw0,lemonlime836,2,2019-05-02 18:38:27,/r/EDAnonymous/comments/bjxp7o/my_family_and_boyfriend_are_becoming_calorieaware/emd3dp2/,BIG mood,False,True
emd3cw0,t3_bjxp7o,t3_bjxp7o,danithegreatish,2,2019-05-02 18:38:13,/r/EDAnonymous/comments/bjxp7o/my_family_and_boyfriend_are_becoming_calorieaware/emd3cw0/,"that would trigger me too, i’m sorry. fuck calories tho",False,False
emd1yof,t3_bjxp7o,t1_emc4mc4,lemonlime836,2,2019-05-02 18:23:08,/r/EDAnonymous/comments/bjxp7o/my_family_and_boyfriend_are_becoming_calorieaware/emd1yof/,"Thanks for the solidarity!! It’s brutal.   And ugh. That would drive me crazy. I’m in this weird headstate where I hate when anyone around me talks about or focuses about their body!! Its like you’re just waiting for the attention to shift to you, too.",False,True
emc4mc4,t3_bjxp7o,t3_bjxp7o,JackFallsDown,1,2019-05-02 13:05:50,/r/EDAnonymous/comments/bjxp7o/my_family_and_boyfriend_are_becoming_calorieaware/emc4mc4/,Oh my God I would have a breakdown if that were happening all around me. Stay strong OP.   I had just gotten into my ED tendencies when my brother started modeling for workout ads. It really affected me and made it hard to focus on my own goals.,False,False
