Comment ID,Link ID,Parent ID,Author,Score,Publish Date,Permalink,Text,Stickied,Is Submitter
f3vd07j,t3_dh218u,t3_dh218u,TheMilkierMan,1,2019-10-15 16:20:31,/r/EDAnonymous/comments/dh218u/why_do_gettogethers_have_to_be_so_food_focused/f3vd07j/,Current mood after thanksgiving,False,False
f3lk4c3,t3_dh218u,t3_dh218u,Illogicalbiologist,1,2019-10-13 09:25:53,/r/EDAnonymous/comments/dh218u/why_do_gettogethers_have_to_be_so_food_focused/f3lk4c3/,"Literally! One of the girls at work has her birthday next week and another co-worker said to me 'WE SHOULD HAVE A PUB-LUNCH'. Immediately started thinking of excuses, I cannot think of anything worse than eating a) out b) at a pub of all places.",False,False
f3k6md0,t3_dh218u,t3_dh218u,Turtle_data,1,2019-10-13 05:27:23,/r/EDAnonymous/comments/dh218u/why_do_gettogethers_have_to_be_so_food_focused/f3k6md0/,Usually I'm upset about having basically no friends but at least it lets me avoid this (:,False,False
f3jjpvj,t3_dh218u,t1_f3ifkny,hammerprice,1,2019-10-13 03:03:29,/r/EDAnonymous/comments/dh218u/why_do_gettogethers_have_to_be_so_food_focused/f3jjpvj/,"Aaahh I understand what you mean. It can be so awkward turning someone down when they offer you food bc you know they MEAN well but at the same time, having someone else watching/pay attention to you eat is like 37503558x more nerve-wracking...  You don't have to please everyone. You can please yourself too xx",False,False
f3jb4ka,t3_dh218u,t1_f3idagf,TheShortGerman,1,2019-10-13 01:57:56,/r/EDAnonymous/comments/dh218u/why_do_gettogethers_have_to_be_so_food_focused/f3jb4ka/,"I went to a cookout party tonight with 200 calories left in my budget for the day, ended up binging on 2000+, and I just spent the last 2 hours purging so much that by the end I was throwing up food I'd eaten over 12 hours earlier  And that's how I learned I have probably given myself gastroparesis",False,False
f3it1dn,t3_dh218u,t3_dh218u,dietcokehoe,1,2019-10-12 23:44:09,/r/EDAnonymous/comments/dh218u/why_do_gettogethers_have_to_be_so_food_focused/f3it1dn/,I live in the south. “Have ya eaten?” is how we say hello fml,False,False
f3ifkny,t3_dh218u,t1_f3idagf,drinkpiss69420,1,2019-10-12 22:06:12,/r/EDAnonymous/comments/dh218u/why_do_gettogethers_have_to_be_so_food_focused/f3ifkny/,"I honestly feel a little less worse about eating if it’s with someone else or if they offered it but still;; sometimes it can get in the way of my whole day’s plans and it makes me wanna hide and cry. But at the same time i’m way too big on pleasing people, i’ll eat almost anything that they want me to :/",False,True
f3idagf,t3_dh218u,t3_dh218u,hammerprice,1,2019-10-12 21:52:55,/r/EDAnonymous/comments/dh218u/why_do_gettogethers_have_to_be_so_food_focused/f3idagf/,Because that's the only time I give myself permission to overeat without feeling guilty about it so you'd better believe I make every social situation a social eat-uation lmao  But for real. It's so hard to just meet up and hang out with people without having to awkwardly turn down food OR end up binging on a million calories you didn't mean to have. I need to start taking friends to the park with me or something I swear.,False,False
f3i470b,t3_dh218u,t3_dh218u,StephenFrysleftsock,1,2019-10-12 21:00:41,/r/EDAnonymous/comments/dh218u/why_do_gettogethers_have_to_be_so_food_focused/f3i470b/,"Omg yes!!!!! Preach!!!! I know most people consider it a sign of love, care, social respect, personal pride, etc, to put on a huge spread at every work/family gathering, but it makes me and my issues go haywire. I really wish people would have more coffee/tea/possible light snack gatherings, instead of SMORGASBORD as the default.",False,False
