Comment ID,Link ID,Parent ID,Author,Score,Publish Date,Permalink,Text,Stickied,Is Submitter
fa9r6sp,t3_e7z4hn,t3_e7z4hn,b-carbonate,1,2019-12-09 04:33:43,/r/EDAnonymous/comments/e7z4hn/i_developed_anorexia_after_losing_over_100_pounds/fa9r6sp/,I was 180lbs in september and now i'm 150 now and no one even noticed the loss   i'm not even hiding the fact that i only eat once a day and that's usually soup from the café downstairs and no one even tics  i mean food for me i guess but also wow i wonder at what weight they will notice,False,False
fa9qiar,t3_e7z4hn,t3_e7z4hn,wallflowerbitca,1,2019-12-09 04:15:42,/r/EDAnonymous/comments/e7z4hn/i_developed_anorexia_after_losing_over_100_pounds/fa9qiar/,"This. When my diagnosed bulimia morphed into anorexia (so everyone around me KNEW I had and ED and had had it for 4 years) I was congratulated and praised up and down until I was comatose with a tube up my nose. And as soon as I was hospitalised suddenly everyone was concerned. My favourite saying for those of us with atypical/higher weight eating disorders: “When the thin girl gets thinner, everyone panics. When the fat girl gets thin, everyone celebrates.”  It’s utter bullshit and I don’t understand how when I eat a Diet Coke for lunch no one says anything, but if someone thin did that they’d all be in a panic. Disordered is disordered, and the fact that you’re losing weight unhealthily is horrible and sad and I wish I could find you for a hug.",False,False
fa9q244,t3_e7z4hn,t3_e7z4hn,iampieman,1,2019-12-09 04:03:41,/r/EDAnonymous/comments/e7z4hn/i_developed_anorexia_after_losing_over_100_pounds/fa9q244/,"This is me exactly. Except I was at 330 lbs in August and right now I’m 251 lbs. still got a lot to lose, but I’m doing it so unhealthily via severe restriction mainly. Even my doctor praised my quick and extreme weight loss. She was shocked at how much I lost but really praised me. Obviously this just fueled me to keep going.  The only person I’ve confided in who is very concerned is my therapist. Everyone else thinks I’m amazing and encouraging me to keep going. I feel like such a fraud and a loser. I still feel like I’m not doing enough.",False,False
fa9phod,t3_e7z4hn,t3_e7z4hn,warholsnotdead,1,2019-12-09 03:48:47,/r/EDAnonymous/comments/e7z4hn/i_developed_anorexia_after_losing_over_100_pounds/fa9phod/,"I recognise you from the Amberlynn sub. You have the best posts! I use her to motivate me to lose, do you do the same thing? It’s not exactly healthy. I’ve developed a terrible relationship with food.",False,False
fa9hrvx,t3_e7z4hn,t1_fa904hu,Istanbullsh1t,1,2019-12-09 00:50:03,/r/EDAnonymous/comments/e7z4hn/i_developed_anorexia_after_losing_over_100_pounds/fa9hrvx/,The hardest part about this sub is keeping myself I check because I know DAMN WELL that I gain soooooo much from you guys but also I’m envious a lot of the time. ITS STUPID.,False,False
fa9g20n,t3_e7z4hn,t1_fa8squt,toasttocoast,2,2019-12-09 00:18:16,/r/EDAnonymous/comments/e7z4hn/i_developed_anorexia_after_losing_over_100_pounds/fa9g20n/,"hah now I feel bad for even putting it in. I should know that everyone looks at spoilers! I'v gotten more than one message asking how. I'll just say it was not in a healthy way, that's for sure. Do not recommend, especially because I naturally want to eat a shit ton and I'm afraid I'll swing back like a pendulum.",False,False
fa904hu,t3_e7z4hn,t1_fa8squt,backandforthandlost,3,2019-12-08 20:36:42,/r/EDAnonymous/comments/e7z4hn/i_developed_anorexia_after_losing_over_100_pounds/fa904hu/,Same. I feel so bad but it’s a mix of sympathy and empathy and my own self loathing,False,False
fa8u861,t3_e7z4hn,t3_e7z4hn,tigerlili,3,2019-12-08 19:27:13,/r/EDAnonymous/comments/e7z4hn/i_developed_anorexia_after_losing_over_100_pounds/fa8u861/,"I relate big time I was so depressed at the beginning of this year that would hardly eat anything which eventually developed into me low restricting nearly all the time.  Once people noticed I was losing weight it only fueled the fire and made me feel better than them, stronger, more in control etc. (you know dumb stuff your ED makes you think).  Now I was like waaaaaay big when I started I’ve lost 200 pounds in the last year but nobody seems to think that’s not normal and that they should be concerned in fact they continue to ask me about weight loss tips, and tell me how proud they are of me. Also yeah idk about “getting better” people are nicer now.",False,False
fa8squt,t3_e7z4hn,t1_fa8pgz4,lover_007,8,2019-12-08 19:10:13,/r/EDAnonymous/comments/e7z4hn/i_developed_anorexia_after_losing_over_100_pounds/fa8squt/,I totally feel you but my disordered brain is begging me to ask how you did it 😅,False,False
fa8rakl,t3_e7z4hn,t1_fa83qdr,Lunaseki,6,2019-12-08 18:53:27,/r/EDAnonymous/comments/e7z4hn/i_developed_anorexia_after_losing_over_100_pounds/fa8rakl/,"When I’m average weight, people seem either neutral or annoyed when I look at them. When I’m skinny, people use it as an opportunity to strike up conversation or even flirt with me. It’s as simple as that, and it’s beyond sad",False,False
fa8qcd7,t3_e7z4hn,t3_e7z4hn,FoxInSocks98,4,2019-12-08 18:42:54,/r/EDAnonymous/comments/e7z4hn/i_developed_anorexia_after_losing_over_100_pounds/fa8qcd7/,"i relate a whole lot. started at 315 lb, now i’m at around 190. unfortunately i’m still too fat to get many compliments but it’s really frustrating. i think a lot to myself “if someone at a normal weight lost as much as i have, they’d be dead. but i’m still not even skinny yet.” and it just makes me feel so worthless and like all my efforts are for nothing.",False,False
fa8pgz4,t3_e7z4hn,t3_e7z4hn,toasttocoast,14,2019-12-08 18:33:32,/r/EDAnonymous/comments/e7z4hn/i_developed_anorexia_after_losing_over_100_pounds/fa8pgz4/,"My boyfriend is sooo happy with my &gt;!40lb!&lt; loss in &gt;!7 weeks!&lt; and it's nice that he's happy but it kills me everytime he says ""you're so skinny now, I love it"".  Like, okay, I feel like fucking death  but I'm so glad your dick is harder THATS COOL.  And you seriously don't notice me not eating/eating very little?? Also, what, you thought I was gross before?  Spoiler: I'll probably gain it back at some point because this is just how I fucking am.  Also, ""atypical anorexia"" is a very annoying term, but I guess that's what they call it when you're a normal or OW bmi.  You can still develop health problems even if you're not clinically underweight, not to mention the mental issues (something like 20% of ED deaths are from deliberate suicide, so yeah it's still dangerous).",False,False
fa8pae9,t3_e7z4hn,t3_e7z4hn,Briechick,4,2019-12-08 18:31:33,/r/EDAnonymous/comments/e7z4hn/i_developed_anorexia_after_losing_over_100_pounds/fa8pae9/,"I have always felt disturbed that one diagnostic criteria for anorexia is that a person’s weight be a certain percentage below the average weight guidelines. So there is only the diagnosis after the person has started to create unhealthy eating patterns. Seems like the anorexia diagnosis should be focused on the person’s beliefs about food, themselves, and their eating habits rather than their weight.  If I person is morbidly obese and loses weight, people often show positive responses and encouragement. The person could be engaging in unhealthy eating patterns and is receiving encouragement about their looks rather than if they are really becoming healthier.",False,False
fa8go6z,t3_e7z4hn,t3_e7z4hn,eattillithurts,2,2019-12-08 16:59:38,/r/EDAnonymous/comments/e7z4hn/i_developed_anorexia_after_losing_over_100_pounds/fa8go6z/,"i binged every day, for 12 days now. i am speaking of 7500 kals per day over my normal meals, which I eat so my husband will not be sad. its always the same. Every day. Something broke in my head I think.   I need help. Nobody is unhappy. Youre gaining, you look good now! (I am bmi 23 now... I dont even care, i just want to stop this binging.)   I knkw how you feel. Good luck. Maybe someone will help you. sorry, had to get it of my chest",False,False
fa8btzd,t3_e7z4hn,t1_fa80nz2,FeatherWorld,8,2019-12-08 16:27:08,/r/EDAnonymous/comments/e7z4hn/i_developed_anorexia_after_losing_over_100_pounds/fa8btzd/,Weight is a social currency :/,False,False
fa83qdr,t3_e7z4hn,t1_fa80nz2,hazyjays,7,2019-12-08 15:33:18,/r/EDAnonymous/comments/e7z4hn/i_developed_anorexia_after_losing_over_100_pounds/fa83qdr/,oof people treating you better/differently when you’re attractive (or even just thinner) is painfully relatable. i’ve noticed SO many seemingly minute ways the way i’m interacted with has changed   (to be fair i do wonder if maybe i’m presenting differently (like maybe i’m smiling more or maybe i’m holding myself more confidently) and that’s partly why people are nicer/more engaged/friendlier),False,False
fa80nz2,t3_e7z4hn,t3_e7z4hn,ProblematicText,6,2019-12-08 15:18:10,/r/EDAnonymous/comments/e7z4hn/i_developed_anorexia_after_losing_over_100_pounds/fa80nz2/,"I don’t relate completely, but I have lost a lot of weight this year and have a pretty similar experience (lots of people congratulating me on looking better). The positive reinforcement is why i don’t want to recover/makes it difficult to want to.   As a side note, I find that people are more pleasant to deal with when you’re attractive. Strangers will say sorry to you even if *you’ve* bumped into them, for example. It’s why I have started becoming more vein (hair extensions, continuous weight loss, eyelash extensions, more makeup than before, nails always done etc)",False,False
fa7z69a,t3_e7z4hn,t3_e7z4hn,hazyjays,13,2019-12-08 15:11:15,/r/EDAnonymous/comments/e7z4hn/i_developed_anorexia_after_losing_over_100_pounds/fa7z69a/,"can relate to everything but the being hit on part lmao started this year at 265lbs currently down 140lbs  literally no one (with the exception of my very vigilant gp) was worried until i ended up hospitalised and couldn’t keep the whole thing a secret anymore. once everyone found out just how much i’d lost and how i’d lost it they all realised they should have figured it out sooner but hey, when you’re as big as i was and you lose weight people don’t tend to jump to an anorexia conclusion ¯\_(ツ)_/¯ also “i’m not even sure i want help” is a Big Mood",False,False
