Comment ID,Link ID,Parent ID,Author,Score,Publish Date,Permalink,Text,Stickied,Is Submitter
eel6kfz,t3_ai2u3y,t3_ai2u3y,OodietcokeheadoO,1,2019-01-20 20:06:57,/r/EDAnonymous/comments/ai2u3y/does_ec_stacking_help_you_focus/eel6kfz/,"I just got kicked out of a pro ana Kik group for talking about ec stacks lol. Yeah, I think it helps with focus a lot. I'd start out with just half of one though.",False,False
eel1z84,t3_ai2u3y,t3_ai2u3y,beachnbum,1,2019-01-20 19:07:14,/r/EDAnonymous/comments/ai2u3y/does_ec_stacking_help_you_focus/eel1z84/,To me it reminds me of when I took oxielite pro. Only downside is you’ll feel a withdraw (bad headaches) after you cycle off of it which you should be doing around 2-3weeks. ,False,False
eekmo14,t3_ai2u3y,t3_ai2u3y,KitteeChaos,1,2019-01-20 16:17:30,/r/EDAnonymous/comments/ai2u3y/does_ec_stacking_help_you_focus/eekmo14/,"It gives me energy and puts me in a better mood,  I'm sure it's terrible for me but I love it. ",False,False
eeklhpj,t3_ai2u3y,t3_ai2u3y,smallerism,1,2019-01-20 16:06:08,/r/EDAnonymous/comments/ai2u3y/does_ec_stacking_help_you_focus/eeklhpj/,"if i take it too early in the morning, it makes me feel like im dying tbh (esp in my meditation class, when im purposefully trying to be In Tune with my body)  it doesnt give me more energy in the way of feeling more awake or anything, but it helps me focus. for the record, i have adhd, but i dont take any medication for it. gets me super jittery too.",False,False
eekkymi,t3_ai2u3y,t3_ai2u3y,atenderheart78,1,2019-01-20 16:01:17,/r/EDAnonymous/comments/ai2u3y/does_ec_stacking_help_you_focus/eekkymi/,Yes you can buy bronkaid without a script BUT you will need id and you have to get it through the pharmacy. It gives me energy. Others have reported feeling nervous and as if their heart is going extremely fast. I would suggest going slow until you see how your body reacts to it. ,False,False
