Comment ID,Link ID,Parent ID,Author,Score,Publish Date,Permalink,Text,Stickied,Is Submitter
el50mcm,t3_be7fh2,t3_be7fh2,hunnyangel,1,2019-04-17 16:56:04,/r/EDAnonymous/comments/be7fh2/i_saw_two_tall_stick_thin_goddesses_at_the_mall/el50mcm/,Your stats are my dream :(,False,False
el4txk2,t3_be7fh2,t3_be7fh2,arcoalien,1,2019-04-17 15:54:36,/r/EDAnonymous/comments/be7fh2/i_saw_two_tall_stick_thin_goddesses_at_the_mall/el4txk2/,I'd kill to have your stats :(,False,False
el4qz0z,t3_be7fh2,t3_be7fh2,StephenFrysleftsock,1,2019-04-17 15:28:33,/r/EDAnonymous/comments/be7fh2/i_saw_two_tall_stick_thin_goddesses_at_the_mall/el4qz0z/,"FYI, I (and pianists and artists too btw) find hands beautiful! I found a coffee table book of Georgia O’Keefe photographed by her partner and he featured her hands front and center as part of her beauty in many of the portraits. I bet yours are just as lovely! 😊",False,False
el3v7x0,t3_be7fh2,t3_be7fh2,hell-is,1,2019-04-17 10:12:02,/r/EDAnonymous/comments/be7fh2/i_saw_two_tall_stick_thin_goddesses_at_the_mall/el3v7x0/,"i’m the same height as you and people tell me almost every day how tall i am, i’m sure you are just as much of a goddess ~",False,False
el3uazc,t3_be7fh2,t3_be7fh2,financepadawan,1,2019-04-17 10:02:53,/r/EDAnonymous/comments/be7fh2/i_saw_two_tall_stick_thin_goddesses_at_the_mall/el3uazc/,I care about hands!!!! mine are so awful looking. :( Babe you're lovely,False,False
el3jmf2,t3_be7fh2,t3_be7fh2,NewBullMoose,1,2019-04-17 08:09:26,/r/EDAnonymous/comments/be7fh2/i_saw_two_tall_stick_thin_goddesses_at_the_mall/el3jmf2/,"Jack Kelly, lawyer, cares about hands!   &amp;#x200B;  In all seriousness though, I was on a walk yesterday and I thought something that isn't necessarily comforting so much as pragmatic: everybody always thinks the grass is greener on the other side, but you should only be upset about things that you have the power to change. Sticking with the grass metaphor, if your yard has really terrible soil or something, the grass isn't going to look as great. It's just not. You should definitely care about things you can change (mow the grass, water it, whatever; this metaphor is stupid), but the gist of it is that some things are just beyond our control. Some people are lucky enough to naturally be more attractive than others. And sure, we could brood over that for our whole lives if we want, but if we can't change it then what's the point? It just becomes misery for misery's sake (I'm as big a fan of this anyone but it isn't very productive).   &amp;#x200B;  Anyways, there are things you can change about yourself and things you can't. The things we can't change we have to learn to accept, or at least live with (minus the misery).   &amp;#x200B;  This one kind of got away from me, hope you feel better.",False,False
