Comment ID,Link ID,Parent ID,Author,Score,Publish Date,Permalink,Text,Stickied,Is Submitter
emdiqlp,t3_bk0yrz,t3_bk0yrz,peachbloompudding,1,2019-05-02 21:27:38,/r/EDAnonymous/comments/bk0yrz/legally_blonde/emdiqlp/,"I just looked up the movie poster to refresh my memory, and holy shit the photoshop/uncanny valley is insane. It looks like they've just slapped Reese's face onto a mannequin.",False,False
emdikmz,t3_bk0yrz,t1_emdg31r,adustydragon123,2,2019-05-02 21:25:58,/r/EDAnonymous/comments/bk0yrz/legally_blonde/emdikmz/,Oh my goodness yes! I was on a terrible binge the last 3 days and watched it today and seeing Elle has me getting my self together. cx,False,True
emdg31r,t3_bk0yrz,t3_bk0yrz,UnderseaK,3,2019-05-02 20:59:21,/r/EDAnonymous/comments/bk0yrz/legally_blonde/emdg31r/,"No joke, legally blonde was the movie that launched me into the very first round of my ED. 😂 It’s insane how triggering Elle is...plus all the sorority girls working out constantly.",False,False
emdazw8,t3_bk0yrz,t1_emczpc7,adustydragon123,1,2019-05-02 20:02:44,/r/EDAnonymous/comments/bk0yrz/legally_blonde/emdazw8/,She is so tiny and cute.,False,True
emczpc7,t3_bk0yrz,t3_bk0yrz,aliensdid9ll,1,2019-05-02 18:00:17,/r/EDAnonymous/comments/bk0yrz/legally_blonde/emczpc7/,i have always wanted to look like elle since I’ve watched it haha,False,False
