Comment ID,Link ID,Parent ID,Author,Score,Publish Date,Permalink,Text,Stickied,Is Submitter
er96t2x,t3_c0tmsq,t1_er8g9zr,livipup,1,2019-06-15 12:05:04,/r/EDAnonymous/comments/c0tmsq/recommendations_for_good_candies_that_take_a/er96t2x/,Those were good too,False,False
er8pexv,t3_c0tmsq,t3_c0tmsq,Aygurlitsyaalt,1,2019-06-15 09:33:44,/r/EDAnonymous/comments/c0tmsq/recommendations_for_good_candies_that_take_a/er8pexv/,"Not necessarily candy but, frozen grapes take me forever to eat. 30 of em for 102 calories is my nightly snack (because I won't/can't binge them). PLUS if you roll them in jello powder before freezing them they are hella sour!",False,False
er8n7gp,t3_c0tmsq,t3_c0tmsq,irishrimp,1,2019-06-15 09:13:53,/r/EDAnonymous/comments/c0tmsq/recommendations_for_good_candies_that_take_a/er8n7gp/,Warheads! Lol. Not sure they make anymore,False,False
er8g9zr,t3_c0tmsq,t1_er7fdve,BombAssTurdCutter,1,2019-06-15 08:05:00,/r/EDAnonymous/comments/c0tmsq/recommendations_for_good_candies_that_take_a/er8g9zr/,It used to be Russian Roulette when I was little and I’d ask my grandma for a candy. I’d either get one of those amazing strawberries or one of those striped peppermints wrapped in plastic that I absolutely hated.,False,False
er7ugsq,t3_c0tmsq,t3_c0tmsq,plntgirl,1,2019-06-15 03:40:19,/r/EDAnonymous/comments/c0tmsq/recommendations_for_good_candies_that_take_a/er7ugsq/,Hi-Chews are my fave! They’re not sour but take a looong time to chew each one and they’re only 21 calories each,False,False
er7ss4h,t3_c0tmsq,t3_c0tmsq,LurkLurkleton,1,2019-06-15 03:12:13,/r/EDAnonymous/comments/c0tmsq/recommendations_for_good_candies_that_take_a/er7ss4h/,Icebreaker sours,False,False
er7pftw,t3_c0tmsq,t3_c0tmsq,idonotcarrotall,1,2019-06-15 02:28:16,/r/EDAnonymous/comments/c0tmsq/recommendations_for_good_candies_that_take_a/er7pftw/,Jolly ranchers! I tried to move away from sugar free ones because they mess up my bowels 😒,False,False
er7fdve,t3_c0tmsq,t3_c0tmsq,livipup,1,2019-06-15 00:28:18,/r/EDAnonymous/comments/c0tmsq/recommendations_for_good_candies_that_take_a/er7fdve/,"I like those strawberry candies old ladies always seem to have, but they're not sour. Dollarama started selling them",False,False
er7ejan,t3_c0tmsq,t3_c0tmsq,ogre-ish,1,2019-06-15 00:17:42,/r/EDAnonymous/comments/c0tmsq/recommendations_for_good_candies_that_take_a/er7ejan/,"blow pops maybe? 60-70 cals apiece.  the lollipop tastes decent and then you have the gum to keep your mouth busy. i like the gum more and try to get the center as fast as i can, but it'll still take me like an hour.",False,False
