Comment ID,Link ID,Parent ID,Author,Score,Publish Date,Permalink,Text,Stickied,Is Submitter
ed8ciqw,t3_acaa3r,t3_acaa3r,iamspecies8472,1,2019-01-04 09:56:49,/r/EDAnonymous/comments/acaa3r/just_got_called_a_cow/ed8ciqw/,Your bf has the sense of humor of a 5 year old,False,False
ed6vfi1,t3_acaa3r,t3_acaa3r,cummo22,1,2019-01-03 18:55:27,/r/EDAnonymous/comments/acaa3r/just_got_called_a_cow/ed6vfi1/,"He should apologise -  but I don’t think he actually meant it. I mean, he did say you *sounded* like a cow, not looked like one. Obviously only you were there and but imo I wouldn’t let it really get to you if you can, but I know it’s not that easy :/ ",False,False
ed6jomz,t3_acaa3r,t1_ed6i8n4,deanhipchester,1,2019-01-03 16:21:52,/r/EDAnonymous/comments/acaa3r/just_got_called_a_cow/ed6jomz/,"you're completely right. I love and have so many of those relationships where insulting banter is the thing we do, but for some reason when he insults me it just hurts? but I know it's on me and my ed and trying to be perfect. if it was anyone else I know I would have just died laughing which makes bringing it up hard since I'm giving him another standard",False,True
ed6i8n4,t3_acaa3r,t3_acaa3r,nodamncatnodamncradl,1,2019-01-03 16:04:39,/r/EDAnonymous/comments/acaa3r/just_got_called_a_cow/ed6i8n4/,"this kinda goes without saying but if your boyfriend often calls you a cow and it bothers you please tell him it bothers you, and consider if he speaks to you respectfully/makes you feel respected...  &amp;#x200B;  I've had many relationships where playful insulting banter feels comfortable, and I know that most relationships require times where boundaries and feelings are negotiated and shared and mistakes are made  &amp;#x200B;  but you just made a post about your boyfriend calling you a cow... that sounds like it sucks",False,False
ed6gbl1,t3_acaa3r,t3_acaa3r,camaradaries,1,2019-01-03 15:43:10,/r/EDAnonymous/comments/acaa3r/just_got_called_a_cow/ed6gbl1/,"that's shitty of him, i'm sorry. i'm sure you're lovely. ",False,False
ed6ex57,t3_acaa3r,t3_acaa3r,TheElectricBodySings,1,2019-01-03 15:27:23,/r/EDAnonymous/comments/acaa3r/just_got_called_a_cow/ed6ex57/,sorry your boyfriend is an insensitive jerk face :-(,False,False
