Comment ID,Link ID,Parent ID,Author,Score,Publish Date,Permalink,Text,Stickied,Is Submitter
e9u4sq7,t3_9xoztk,t1_e9u408d,gigi-has-issues,1,2018-11-16 14:13:28,/r/EDAnonymous/comments/9xoztk/we_have_been_contacted_by_reddit_admin/e9u4sq7/,"Yes but imagine you didn’t have an ED and go to a subreddit where people have their current weight, goal weight and pounds lost on their flairs and everyone is talking about starving them selves...from the outside it looks really toxic and like we are some sick club trying to torture each other. The reality is we need to be mindful of how we appear to the outside &amp; foster a culture that focuses on support. I agree proED was supportive but to non-ED people it probably didn’t look that way. ",False,True
e9u4awd,t3_9xoztk,t1_e9u408d,Caketryahaim,1,2018-11-16 14:07:01,/r/EDAnonymous/comments/9xoztk/we_have_been_contacted_by_reddit_admin/e9u4awd/,"Right??? I really don't understand. If anything, prior to finding ProED, I used to think my ED experience was uniquely disgusting and fucked up, because the only depictions I'd seen in the media were far more ""glamorous"". ",False,False
e9u41w0,t3_9xoztk,t3_9xoztk,ShoopDaWhoopBurrito,1,2018-11-16 14:04:07,/r/EDAnonymous/comments/9xoztk/we_have_been_contacted_by_reddit_admin/e9u41w0/,I’m so so happy!! 😭💜,False,False
e9u408d,t3_9xoztk,t1_e9u10pw,BittyBeau,1,2018-11-16 14:03:36,/r/EDAnonymous/comments/9xoztk/we_have_been_contacted_by_reddit_admin/e9u408d/,"&gt;glorifying  Yeah all those posts about people shitting themselves, hair falling out, extreme heart palpitations, etc. really made it look sooooo glamorous /s  🙄",False,False
e9u3lus,t3_9xoztk,t1_e9tzy9d,sstephenn,1,2018-11-16 13:59:08,/r/EDAnonymous/comments/9xoztk/we_have_been_contacted_by_reddit_admin/e9u3lus/,I love this analogy so much,False,False
e9u2sn6,t3_9xoztk,t3_9xoztk,skelekey,1,2018-11-16 13:49:55,/r/EDAnonymous/comments/9xoztk/we_have_been_contacted_by_reddit_admin/e9u2sn6/,I wonder if they survey and petition helped?? That can’t be a coincidence!,False,False
e9u2pqk,t3_9xoztk,t3_9xoztk,PinkyOutYo,1,2018-11-16 13:48:58,/r/EDAnonymous/comments/9xoztk/we_have_been_contacted_by_reddit_admin/e9u2pqk/,"In the UK, BEAT runs: Adult Helpline: 0808 801 0677  Studentline: 0808 801 0811  Youthline: 0808 801 0711  And if course, The Samaritans on 116 123 (that works in both the UK and ROI).",False,False
e9u20w3,t3_9xoztk,t3_9xoztk,Admiral-Lasagna,1,2018-11-16 13:40:38,/r/EDAnonymous/comments/9xoztk/we_have_been_contacted_by_reddit_admin/e9u20w3/,"That’s somewhat good news I suppose. We’ll have to wait and see! If we get to keep this sub, does it means we can also have a sister sub for memes? Because godnibblets I need them xD",False,False
e9u1br4,t3_9xoztk,t1_e9u10pw,101_honey,1,2018-11-16 13:32:47,/r/EDAnonymous/comments/9xoztk/we_have_been_contacted_by_reddit_admin/e9u1br4/,fingers crossed!!! thank u ,False,False
e9u10pw,t3_9xoztk,t1_e9u0q7l,gigi-has-issues,1,2018-11-16 13:29:00,/r/EDAnonymous/comments/9xoztk/we_have_been_contacted_by_reddit_admin/e9u10pw/,"Nothing yet, I’m putting together rules this weekend and will get their input. Hopefully dark humor will be allowed. This issue is “glorifying” EDs and giving out harmful tips. I think dark humor should be ok given that there are huge subs for suicide memes. ",False,True
e9u0q7l,t3_9xoztk,t3_9xoztk,101_honey,1,2018-11-16 13:25:35,/r/EDAnonymous/comments/9xoztk/we_have_been_contacted_by_reddit_admin/e9u0q7l/,but what did they say about the memes?!!!,False,False
e9u0edp,t3_9xoztk,t1_e9u05pf,gigi-has-issues,1,2018-11-16 13:21:52,/r/EDAnonymous/comments/9xoztk/we_have_been_contacted_by_reddit_admin/e9u0edp/,I think dark humor will be okay but giving tips (other than harm reduction) will definitely not be allowed. Venting is fine. I’ll have more details over the coming days. ,False,True
e9u05pf,t3_9xoztk,t1_e9tzc9f,dharmaticate,1,2018-11-16 13:18:55,/r/EDAnonymous/comments/9xoztk/we_have_been_contacted_by_reddit_admin/e9u05pf/,"Did they elaborate at all what they meant by not approving of the ""culture""? Did they really just not like that we were self-deprecating and used dark humor to make ourselves feel better?",False,False
e9tzy9d,t3_9xoztk,t3_9xoztk,picalowpiepi,1,2018-11-16 13:16:24,/r/EDAnonymous/comments/9xoztk/we_have_been_contacted_by_reddit_admin/e9tzy9d/,This feels as if the admins are giving us soda and saying that it's diet but you don't know for sure.,False,False
e9tzozq,t3_9xoztk,t1_e9tzc9f,zachbrownies,1,2018-11-16 13:13:15,/r/EDAnonymous/comments/9xoztk/we_have_been_contacted_by_reddit_admin/e9tzozq/,"I think people have learned a lot about what the exact line is between support and encouragement. In my opinion, the important thing is to always let people know that their struggles are real, and relateable, and everything they feel is valid, and that they don't need to do anything they don't want to do - without crossing lines into helping them make things worse. Does that make sense? I want to make sure I have the right mindset.  But if that's how they see it, then fair enough, I suppose.",False,False
e9tzc9f,t3_9xoztk,t1_e9tz7d6,gigi-has-issues,1,2018-11-16 13:08:55,/r/EDAnonymous/comments/9xoztk/we_have_been_contacted_by_reddit_admin/e9tzc9f/,"I highly doubt that since it was the 'culture' of ProED that they did not approve of.  To be fair, sometimes I would see very young people seeking advice about how to hide ED from their parents, etc. and that made me v uncomfortable. ",False,True
e9tz7d6,t3_9xoztk,t1_e9tyt3t,zachbrownies,1,2018-11-16 13:07:16,/r/EDAnonymous/comments/9xoztk/we_have_been_contacted_by_reddit_admin/e9tz7d6/,"Is there any chance they'd be able to help in any way to get the word out to the 28k subscribers who aren't here yet, to let them know? I think that's the biggest issue - no one will mind new rules or the new sub, people just don't want to feel alone or left behind.  I'm very thankful that they're communicating and they want to help this place stay up.",False,False
e9tyt3t,t3_9xoztk,t1_e9tym34,gigi-has-issues,1,2018-11-16 13:02:34,/r/EDAnonymous/comments/9xoztk/we_have_been_contacted_by_reddit_admin/e9tyt3t/,I don’t think so but we are going to be clear about what is allowed. I have messaged them back and asked them to review our community guidelines and resources once I have them :) ,False,True
e9tym34,t3_9xoztk,t3_9xoztk,might_be_alright,1,2018-11-16 13:00:12,/r/EDAnonymous/comments/9xoztk/we_have_been_contacted_by_reddit_admin/e9tym34/,so is the sub still going private?,False,False
e9tyjz8,t3_9xoztk,t3_9xoztk,nekkedpebbl,1,2018-11-16 12:59:28,/r/EDAnonymous/comments/9xoztk/we_have_been_contacted_by_reddit_admin/e9tyjz8/,"Oh my gosh, I am so so so happy",False,False
e9ty64e,t3_9xoztk,t3_9xoztk,orthoreXXX,1,2018-11-16 12:54:57,/r/EDAnonymous/comments/9xoztk/we_have_been_contacted_by_reddit_admin/e9ty64e/,"Oh my god the title gave me so much anxiety lol, I really hope this one stays 🙏🏼🙏🏼🙏🏼",False,False
