Comment ID,Link ID,Parent ID,Author,Score,Publish Date,Permalink,Text,Stickied,Is Submitter
fcselbx,t3_eii9v6,t3_eii9v6,Competitive-Basket,1,2020-01-01 15:50:34,/r/EDAnonymous/comments/eii9v6/oh_no/fcselbx/,Sometimes I hit the button and change it to Watts or something other than calorie burned or I put my towel or phone over the numbers. The calories burned are never accurate on the machines anyway.,False,False
fcrl7fv,t3_eii9v6,t1_fcqj7ri,tigerchik,1,2020-01-01 12:27:38,/r/EDAnonymous/comments/eii9v6/oh_no/fcrl7fv/,"or a towel - that seems like you'd get less questions, if you're concerned about that",False,False
fcre3zn,t3_eii9v6,t1_fcqk0is,Entemma,1,2020-01-01 11:43:17,/r/EDAnonymous/comments/eii9v6/oh_no/fcre3zn/,"Yea, it actually depends on a lot of things such as your weight, muscle mass, etc.",False,False
fcqk0is,t3_eii9v6,t1_fcqjjnr,captainsdoctor,1,2020-01-01 08:02:39,/r/EDAnonymous/comments/eii9v6/oh_no/fcqk0is/,"Knowing that they don’t work actually makes me feel a little bit better, Thankyou! Towel is a good idea ! Don’t wanna ruin the screen:)",False,True
fcqjmpt,t3_eii9v6,t3_eii9v6,AnnaTriesToBeHealthy,1,2020-01-01 07:59:33,/r/EDAnonymous/comments/eii9v6/oh_no/fcqjmpt/,The calorie counters don’t work,False,False
fcqjjnr,t3_eii9v6,t3_eii9v6,SemicolonButterfly,1,2020-01-01 07:58:46,/r/EDAnonymous/comments/eii9v6/oh_no/fcqjjnr/,"I don’t trust the machine’s calories number anyhow. Sometimes it seems improbably high, others improbably low. Covering up the screen with a towel is a popular move too :)   Hope you can find a way that works for you!",False,False
fcqj7ri,t3_eii9v6,t1_fcqj5od,captainsdoctor,1,2020-01-01 07:55:59,/r/EDAnonymous/comments/eii9v6/oh_no/fcqj7ri/,That’s a good idea ! Thankyou :),False,True
fcqj5od,t3_eii9v6,t3_eii9v6,color_me_skinny,1,2020-01-01 07:55:30,/r/EDAnonymous/comments/eii9v6/oh_no/fcqj5od/,Tape a piece of paper over the screen?,False,False
