Comment ID,Link ID,Parent ID,Author,Score,Publish Date,Permalink,Text,Stickied,Is Submitter
ebs9jsr,t3_a607zr,t1_ebs5nej,frimaire_,1,2018-12-14 10:34:36,/r/EDAnonymous/comments/a607zr/just_a_reminder_a_certain_fat_people_hateesque/ebs9jsr/,"Ugh, and I hate that it reminds me people exist who think like this in real life. For all my problems... at least I'm aware that the models I follow are underweight and have achieved that look through really unhealthy means. I could not believe the number of comments insinuating Bella got that way because she's \*healthy\* and it's a look that came without serious, purposeful restriction.",False,False
ebs8zto,t3_a607zr,t1_ebquzjh,lotsofsqs,1,2018-12-14 10:29:23,/r/EDAnonymous/comments/a607zr/just_a_reminder_a_certain_fat_people_hateesque/ebs8zto/,"I do think there are positives of the sub. This was directed more at the stuff that goes against recovery principles and the triggering content.  I agree that most subscribers are trying to improve their life, but that goes hand-in-hand with people hating themselves (i.e. hating their fat bodies) misdirecting their insecurities and frustrations onto Tumblr posts that frankly have nothing to do with them. Like, sorry that you hate your body, but fuck off judging other people for accepting theirs.",False,True
ebs8nuq,t3_a607zr,t1_ebs0u0h,lotsofsqs,1,2018-12-14 10:26:16,/r/EDAnonymous/comments/a607zr/just_a_reminder_a_certain_fat_people_hateesque/ebs8nuq/,"&gt;Mindfulness is one of the pillars of intuitive eating but it goes both ways, and a lot of the HAES movement people only want to celebrate the ""honor your hunger"" side and not acknowledge the ""respect your fullness"" side, or ""Exercise"", also part of the 10 principles  This frustrates me about HAES. And what frustrates me about FL is that they shit on mindful eating as a whole, without just realizing that HAES is one tiny part of it. FL thinks CICO is the only way.   Frankly, if people were taught mindful eating *along with* nutrition, we'd all be a lot healthier. Most healthy people I know do not count their calories. ",False,True
ebs8797,t3_a607zr,t1_ebr254x,lotsofsqs,2,2018-12-14 10:22:25,/r/EDAnonymous/comments/a607zr/just_a_reminder_a_certain_fat_people_hateesque/ebs8797/,"I remember being annoyed with my dietitians in treatment for ignoring and lying to me about basic human functions, too. But I think a lot of really helpful recovery advice/outlooks are mocked on that sub as well, not just the factual inaccuracies.  I though the post about talking about the ""value"" of food rather than ""calories"" was actually a really healthy way of thinking about food.  I also think body acceptance, at it's core, is a healthy way of thinking. Nothing good comes from hating yourself and others for their appearance. There was a post that said ""Am I happy I gained 10 pounds? No. Am I going to love myself despite gaining 10 pounds? Yes."" How can people argue with that?  Additionally, I believe fat people are treated worse in general than thin people. There are a lot of posts that say this, with comments like ""if you want to be treated like a person just lose weight!!! Fat consequence!""",False,True
ebs6p0t,t3_a607zr,t1_ebr8qco,lotsofsqs,1,2018-12-14 10:10:07,/r/EDAnonymous/comments/a607zr/just_a_reminder_a_certain_fat_people_hateesque/ebs6p0t/,Absolutely!!! They need to stop pretending like they have any idea what an ED is -- either on the AN side or BED side.,False,True
ebs6ixf,t3_a607zr,t1_ebr4daa,lotsofsqs,1,2018-12-14 10:08:45,/r/EDAnonymous/comments/a607zr/just_a_reminder_a_certain_fat_people_hateesque/ebs6ixf/,"Totally. They shit on a lot of pro-recovery stuff. That's why I wanted to post on this subreddit. Because they're still flawed, and I don't want anyone reading that sub as The Bible of health.",False,True
ebs63ez,t3_a607zr,t1_ebqtwwb,lotsofsqs,1,2018-12-14 10:05:17,/r/EDAnonymous/comments/a607zr/just_a_reminder_a_certain_fat_people_hateesque/ebs63ez/,"&gt; Mock people for being willfully stupid. Not their appearance.   Ha, yep. I think the original use for the sub is a great idea. Some of the posts are funny.  But a lot of them are just posts about women trying to accept their bodies as they are. Why is FL so adamant about shaming people for accepting themselves? Successful weight loss often doesn't begin with self-hatred and shame.",False,True
ebs5nej,t3_a607zr,t1_ebrd3wj,lotsofsqs,2,2018-12-14 10:01:42,/r/EDAnonymous/comments/a607zr/just_a_reminder_a_certain_fat_people_hateesque/ebs5nej/,"Absolutely. This is one of the posts that made me want to comment here. This is the illogical crap I'm talking about. There's no one that can convince me that Bella Hadid is at a healthy weight, that people are only calling her too skinny are pro-fat, and that the overweight person commenting has hips just as visible. ",False,True
ebs4zgr,t3_a607zr,t1_ebrkq9c,gigi-has-issues,1,2018-12-14 09:56:16,/r/EDAnonymous/comments/a607zr/just_a_reminder_a_certain_fat_people_hateesque/ebs4zgr/,Woah. Wtf. ,False,False
ebs4ub0,t3_a607zr,t1_ebri3ak,gigi-has-issues,1,2018-12-14 09:55:06,/r/EDAnonymous/comments/a607zr/just_a_reminder_a_certain_fat_people_hateesque/ebs4ub0/,I go there to trigger myself:( ,False,False
ebs1hw5,t3_a607zr,t1_ebr0595,VTMongoose,1,2018-12-14 09:29:02,/r/EDAnonymous/comments/a607zr/just_a_reminder_a_certain_fat_people_hateesque/ebs1hw5/,"And what's ironic is that a lot of them will say ""this sub isn't intended to attack those with eating disorders"" and ""This is about fighting the HAES people who are stealing their material from the ED community to justify their ED's""... and then they themselves literally steal material from the ED community **to use as a basis for hating HAES people**, or just draw more attention/traffic to their subs and posts.",False,False
ebs0u0h,t3_a607zr,t1_ebr254x,VTMongoose,1,2018-12-14 09:24:00,/r/EDAnonymous/comments/a607zr/just_a_reminder_a_certain_fat_people_hateesque/ebs0u0h/,"Wow, I'm really sorry to hear that was your experience. I have a history of obesity myself, so during my AN recovery, I already had an intense fear of weight regain and also of developing BED (something I've never struggled with, thank God). I had already done a lot of research because I realized that bodybuilders and anorexics actually have quite a lot in common in terms of what they put themselves through purely in terms of physical starvation, and I saw a lot of bodybuilders developing BED or other eating disorders and struggling with it, so I was aware of that potential, and what sucks is, yeah, I see all kinds of recovery circles centered around justifying or even celebrating different disordered behaviors just because they were able to eliminate the AN behaviors by flipping from one extreme to the other.  &amp;#x200B;  Since I have a history of obesity, I'm already aware that I need to be mindful that my hedonic system (eating for want rather than need) is a very powerful player in terms of how I make my food decisions. ""Eating whatever I want, whenever I want"" will never be an option for me because I did that for almost my entire life and the effects were what they were. Mindfulness is one of the pillars of intuitive eating but it goes both ways, and a lot of the HAES movement people only want to celebrate the ""honor your hunger"" side and not acknowledge the ""respect your fullness"" side, or ""Exercise"", also part of the 10 principles. If you are consistently eating food when you are not physically hungry, and not exercising, there are consequences.  &amp;#x200B;  Honestly I would be interested to hear more about what you were taught and how it influenced your switch into BED if you have time and don't mind sharing. I feel it's really hard to know what's absolutely right and wrong with eating sometimes. It's complicated.",False,False
ebryblc,t3_a607zr,t1_ebr0rvl,VTMongoose,1,2018-12-14 09:06:00,/r/EDAnonymous/comments/a607zr/just_a_reminder_a_certain_fat_people_hateesque/ebryblc/,"Exactly. It's so easy to paint with a wide brush. The average person struggles with eating disordered thoughts in today's society to a degree but at the same time, we need to respect that we are in vastly different headspaces and we all need different kinds of help.",False,False
ebrws0b,t3_a607zr,t1_ebqzj5b,VTMongoose,2,2018-12-14 08:54:52,/r/EDAnonymous/comments/a607zr/just_a_reminder_a_certain_fat_people_hateesque/ebrws0b/,Screw BMI. I'm one pound overweight technically right now I'm the healthiest I've ever been by every measure. Most anyone who has a larger frame and consistently exercises and builds muscle is going to be overweight.,False,False
ebrvel9,t3_a607zr,t1_ebrkq9c,Emily_BRrealtor,1,2018-12-14 08:44:57,/r/EDAnonymous/comments/a607zr/just_a_reminder_a_certain_fat_people_hateesque/ebrvel9/,Someone was going to post something I said there because I posted on a subreddit about if you are gaining a crazy unreasonable amount of weight go to the doctor there could be something wrong.   I gained 40+ pounds in one year because I got diagnosed with hypothyroidism and went on birth control. And literally people came out of the woodwork to tell me that it was actually my fault that I gained weight and those things don’t actually make you gain weight like that.   I was like where the fuck is your PhD? ,False,False
ebru5fe,t3_a607zr,t1_ebqyf6p,Emily_BRrealtor,1,2018-12-14 08:35:48,/r/EDAnonymous/comments/a607zr/just_a_reminder_a_certain_fat_people_hateesque/ebru5fe/,That is the funniest thing I’ve ever heard and so true. ,False,False
ebru4in,t3_a607zr,t3_a607zr,SaddBunni,1,2018-12-14 08:35:37,/r/EDAnonymous/comments/a607zr/just_a_reminder_a_certain_fat_people_hateesque/ebru4in/,They really aren't even that bad... people need to stop being so sensitive. It's nothing like FPH was. ,False,False
ebrlyk8,t3_a607zr,t1_ebqs0ro,PM_ME_BrusselSprouts,1,2018-12-14 07:29:44,/r/EDAnonymous/comments/a607zr/just_a_reminder_a_certain_fat_people_hateesque/ebrlyk8/,"I like 1200ij because sometimes we have to make fun of ourselves... I think most people on there are regulars on 1200ip and just want a place to vent. I understand that's what 1200ifig is for, but you can get away with a lot more and be funnier in jerky. ",False,False
ebrkq9c,t3_a607zr,t3_a607zr,bulimicomrade,1,2018-12-14 07:15:31,/r/EDAnonymous/comments/a607zr/just_a_reminder_a_certain_fat_people_hateesque/ebrkq9c/,One time something I posted on Twitter ended up there because I was muting terms about diets to try to help me stop thinking about food and dieting. ,False,False
ebri3ak,t3_a607zr,t3_a607zr,nycthrowaway51,1,2018-12-14 06:32:50,/r/EDAnonymous/comments/a607zr/just_a_reminder_a_certain_fat_people_hateesque/ebri3ak/,"Thank you for saying this. I never really understood why some people liked it, it seems unnecessarily mean spirited.   I think that's a problem with any sub dedicated to mocking a certain group, it becomes hateful and starts mocking things that aren't even that bad.",False,False
ebrgplf,t3_a607zr,t1_ebqzj5b,lalaloui22,1,2018-12-14 06:03:39,/r/EDAnonymous/comments/a607zr/just_a_reminder_a_certain_fat_people_hateesque/ebrgplf/,"Oh man, yeah. One girl I follow on instagram (""""""""recovered"""""""" from an eating disorder, is visibly and extremely underweight, exercises excessively imo) posted the other day about how she thinks the bopo movement has gone too far and that its glorifying obesity despite the health issues associated with it. I wanted to scream at her that she si probably more at risk for health complications than a lot of body positive influencers. It was the same kind of thing that I used to see on FL all the time when I frequented it. ",False,False
ebrefk5,t3_a607zr,t1_ebqzj5b,cornpoppet,1,2018-12-14 05:01:55,/r/EDAnonymous/comments/a607zr/just_a_reminder_a_certain_fat_people_hateesque/ebrefk5/,""" there's a policeman in my mind in the form of a 26 yr old straight white dude on Reddit who makes fun of fat women in his spare time""  Omg, i have that exact same voice in my head! Glad to know I'm not alone on this .",False,False
ebrd3wj,t3_a607zr,t3_a607zr,frimaire_,1,2018-12-14 04:23:39,/r/EDAnonymous/comments/a607zr/just_a_reminder_a_certain_fat_people_hateesque/ebrd3wj/,"The amount of people in there claiming that Bella fucking Hadid is at a normal weight or “she’s just naturally thin!” made me so angry. That mentality is so harmful to people both with or without EDs. (Worse, I’m sure a lot of it comes from people thinking she’s hot but don’t want to feel guilty about it). What does it take for people to start portraying thin models/celebs in a realistic light?",False,False
ebrc05w,t3_a607zr,t1_ebqrl4f,hushedbalance,1,2018-12-14 03:50:40,/r/EDAnonymous/comments/a607zr/just_a_reminder_a_certain_fat_people_hateesque/ebrc05w/,Oh you're right. I just checked that out...yikes. ,False,False
ebr8qco,t3_a607zr,t1_ebr4daa,unforgettable_potato,1,2018-12-14 02:11:09,/r/EDAnonymous/comments/a607zr/just_a_reminder_a_certain_fat_people_hateesque/ebr8qco/,"That breaks my heart. I don't go into that sub often because I get irrationally angry or irrationally sad. But leave ED out of their circlejerk. Considering heart failure is a common cause of death in anorexia... Carrying 15 or 20 extra pounds is a hell of lot healthier than dying because you have starved your body so much its literally digesting itself. Gah. Leave those people alone. They had to fight and struggle to get where they are and they don't need asshats like that criticizing them and potentially triggering a relapse. To me, it's like making fun of an alcoholic or addict in recovery. You just don't do that shit.",False,False
ebr8498,t3_a607zr,t1_ebqqttc,Strawberry_Smoothie,1,2018-12-14 01:54:34,/r/EDAnonymous/comments/a607zr/just_a_reminder_a_certain_fat_people_hateesque/ebr8498/,"It's not ""helpful"" to me in a way that it would spur me towards recovery or something, that train is gone, but I like it and have the same experience with the moderation team there like you.  The fact a dietician says it doesn't make it true. The fact someone had an eating disorder in the past doesn't make it true what they say, or healthy what they do now.   ",False,False
ebr5sxd,t3_a607zr,t1_ebqs0ro,dortuh,1,2018-12-14 00:58:29,/r/EDAnonymous/comments/a607zr/just_a_reminder_a_certain_fat_people_hateesque/ebr5sxd/,I thought everyone in 1200isjerky came from 1200isplenty and they were making fun of their own diet. You've blown my mind. ,False,False
ebr5nip,t3_a607zr,t1_ebqtngt,IDontLikeLollipops,1,2018-12-14 00:54:58,/r/EDAnonymous/comments/a607zr/just_a_reminder_a_certain_fat_people_hateesque/ebr5nip/,IGreality gets pretty shitty too though,False,False
ebr5b9d,t3_a607zr,t1_ebr0595,champu-petal,1,2018-12-14 00:47:05,/r/EDAnonymous/comments/a607zr/just_a_reminder_a_certain_fat_people_hateesque/ebr5b9d/,YES THEY ALWAYS MISREPRESENT PRO-RECOVERY CONTENT!!,False,False
ebr4daa,t3_a607zr,t1_ebqtwwb,redcapris,1,2018-12-14 00:25:34,/r/EDAnonymous/comments/a607zr/just_a_reminder_a_certain_fat_people_hateesque/ebr4daa/,"I hate when they respond to former ED sufferers who are now overweight with ""thats not healthy either!! trading one eating disorder for another!!"" while yes a lot of people develop BED in recovery and that still takes a toll on your health you would have to be EXTREMELY obese for the dangers of that to match the dangers of active anorexia or bulimia. You really think being 20 pounds overweight is comparable to a disease where 20% of sufferers die from either the physical or mental toll it takes? Get real. ",False,False
ebr31bz,t3_a607zr,t1_ebqzj5b,heatheringly,1,2018-12-13 23:57:52,/r/EDAnonymous/comments/a607zr/just_a_reminder_a_certain_fat_people_hateesque/ebr31bz/,I guess this is why they say ACAB,False,False
ebr254x,t3_a607zr,t1_ebr0rvl,Swanabe,1,2018-12-13 23:41:19,/r/EDAnonymous/comments/a607zr/just_a_reminder_a_certain_fat_people_hateesque/ebr254x/,"So, personally, I think a lot of things that dietitians and therapists say in reference to “recovery” can still be dangerously incorrect. I feel this way because of personal experience.   When I was a pre-teen/teenager I developed anorexia and after a a few years I got treatment from some well meaning but ultimately incredibly shitty professionals (including therapists and dietitians). They “helped me recover” by instilling values in me that were essentially identical to those found in HAES and FA circles. They had no concern that I could, as MANY recovering restrictive ED patients do, develop BED. Looking back, it’s almost comical how directly and aggressively these professionals pushed me from one eating disorder to another. So much of what they included in my treatment seemed empowering and steeped in self-love at the time, but really it was mostly fatlogic. They lied to me about how the body functions (“starvation mode is real”, “what even IS a calorie?!”, “some metabolisms are just slow!” etc.), they instilled some really fucked up ideals in me, and basically encouraged me to binge, engage in emotional eating, and use food as a drug.   Whenever I see anything that remotely smacks of what I was told during “recovery” I’m so angry because it means that there are more young girls being misinformed and sent in the wrong direction that I was sent in. ",False,False
ebr0rvl,t3_a607zr,t1_ebqqttc,cleanandlovely,1,2018-12-13 23:17:07,/r/EDAnonymous/comments/a607zr/just_a_reminder_a_certain_fat_people_hateesque/ebr0rvl/,"Have you noticed, though, that they often take screenshots from ED specialists social media accounts, and frame these decontextualized posts as fat-logic when they're actually intended to promote recovery?  I had to stop following that sub because watching them tear apart pro-recovery messaging from a couple of IG accounts (dietitians, therapists, etc.) was like actually hearing the voice of anorexia screaming through my screen. I think most commenters aren't necessarily aware of where those posts are coming from, or at least I'd like to give them the benefit of the doubt, but it's clear they are predetermined to view everything through a very black-and-white, ""fatlogic""-skewed lens.",False,False
ebr0595,t3_a607zr,t3_a607zr,cleanandlovely,1,2018-12-13 23:06:22,/r/EDAnonymous/comments/a607zr/just_a_reminder_a_certain_fat_people_hateesque/ebr0595/,"My biggest problem with it is that they often take and criticize messages about body acceptance from IG or FB that I *know* are coming from RDs or other specialists in the field of eating disorders. It's incredibly wrong and harmful, in my opinion, to take a post from an ED clinician out of context and frame it as ""fat-logic"" when it is, in fact, promoting recovery from restrictive eating disorders.      Those messages are meant to counteract the relentless onslaught of bullshit that is diet culture. When you look at those screenshots, knowing that they are addressing an audience of girls and women struggling with disordered eating or EDs, it is obvious that the sub is intentionally misinterpreting a lot of the material they critique.      There is a serious lack of critical, nuanced thinking in that sub. But this is a case when ignorance comes off as malicious.  &amp;#x200B;",False,False
ebqzm2m,t3_a607zr,t1_ebqyf6p,serenasunshine91,1,2018-12-13 22:57:10,/r/EDAnonymous/comments/a607zr/just_a_reminder_a_certain_fat_people_hateesque/ebqzm2m/,Exactly! Couldn't have said it better. ,False,False
ebqzj5b,t3_a607zr,t1_ebqtwwb,champu-petal,1,2018-12-13 22:55:45,/r/EDAnonymous/comments/a607zr/just_a_reminder_a_certain_fat_people_hateesque/ebqzj5b/,"When I was trying to recover, I remember being told that slightly overweight was healthier than slightly underweight.  By multiple doctors.  Blew my fucking mind tbh,  because with men on Reddit, slightly underweight is ""she just has a naturally small appetite :)"" and slightly overweight is fat, lazy, and bound to get diabetes.  I want to say I didn't internalize this so much, but even my ""recovered"" BMI toes the line of normal and underweight.  Now that I know how people would perceive me if I was even at the upper end of healthy, I see anything above 19 as way too fat and undeserving of happiness.  At the end of the day, It's really all about what they're attracted to, I don't care what lies they're selling ",False,False
ebqyf6p,t3_a607zr,t1_ebqtngt,godisamango,1,2018-12-13 22:37:34,/r/EDAnonymous/comments/a607zr/just_a_reminder_a_certain_fat_people_hateesque/ebqyf6p/,I think at one point FL was primarily devoted to fighting actual pro-obesity rhetoric. Now it’s been overrun with hateful circlejerky (sorry) straight dudes who think their boner is a certified nutritionist. ,False,False
ebqvg3m,t3_a607zr,t1_ebquzjh,Swanabe,1,2018-12-13 21:54:08,/r/EDAnonymous/comments/a607zr/just_a_reminder_a_certain_fat_people_hateesque/ebqvg3m/,"Yeah, they call out people who are being illogical on both sides of the spectrum, and also people who are shilling bullshit “weight loss miracle” products.   It’s a nice reminder for me, as someone who almost got sucked into dumbfuck FA bullshit, that HAES is complete crap, starvation mode is a lie, and CICO is king. ",False,False
ebquzjh,t3_a607zr,t1_ebqqttc,Ivydroplet,1,2018-12-13 21:47:31,/r/EDAnonymous/comments/a607zr/just_a_reminder_a_certain_fat_people_hateesque/ebquzjh/,"Yeah, I think it's moderated pretty well, the overly mocking comments or irrelevant posts get dropped. And as far as I've seen there are many people in that sub trying to improve themselves and make lifestyle changes. They seem supportive to each other, and have weekly wellness and recipe discussions. ",False,False
ebqtwwb,t3_a607zr,t3_a607zr,unforgettable_potato,1,2018-12-13 21:33:23,/r/EDAnonymous/comments/a607zr/just_a_reminder_a_certain_fat_people_hateesque/ebqtwwb/,"My biggest gripe with that sub is that some of them  do it under the guise of ""omg we care about HEALTH"". Look an extra 20 pounds isn't instantly gonna give you diabetes or send you into heart failure....  Some of the body positive movement IS cringe and deserves some playful mockery. Some people do spread erroneous info on weight and weight loss and that needs to be corrected. But when I see women in an ad, an inccouous ad, get mocked and they are much smaller than me, what I would call chubby. I wanna fight. I do.  I don't like people of any size being shamed for the weight. Thin or heavy because there are a lot of factors that can affect weight.  Mock people for being willfully stupid. Not their appearance.",False,False
ebqtngt,t3_a607zr,t3_a607zr,serenasunshine91,1,2018-12-13 21:29:49,/r/EDAnonymous/comments/a607zr/just_a_reminder_a_certain_fat_people_hateesque/ebqtngt/,"I saw a post from there they took from the IG reality sub, and they were mocking IGreality saying that they were using fat logic, but no, her organs were actually gone...so... ",False,False
ebqtg6f,t3_a607zr,t1_ebqnc2m,dansla116,1,2018-12-13 21:27:04,/r/EDAnonymous/comments/a607zr/just_a_reminder_a_certain_fat_people_hateesque/ebqtg6f/,"For real, I had like two or three subs in mind OP could've been talking about.",False,False
ebqsqc2,t3_a607zr,t1_ebqspg8,[deleted],1,2018-12-13 21:17:25,/r/EDAnonymous/comments/a607zr/just_a_reminder_a_certain_fat_people_hateesque/ebqsqc2/,[removed],False,False
ebqspg8,t3_a607zr,t1_ebqs0ro,girl_snap_out_of_it,1,2018-12-13 21:17:06,/r/EDAnonymous/comments/a607zr/just_a_reminder_a_certain_fat_people_hateesque/ebqspg8/,/r/1200isfineIGUESSugh is where it's at.,False,False
ebqs0ro,t3_a607zr,t1_ebqpyn1,lemonpepperfresh,1,2018-12-13 21:07:58,/r/EDAnonymous/comments/a607zr/just_a_reminder_a_certain_fat_people_hateesque/ebqs0ro/,"Honestly I hate 1200ij, really whats the point of making fun of people in 1200ip??? Thats not gonna help anyone... If you attack someone's eating habits they will just become defensive and not listen to you. Understanding and patience is the way to go ",False,False
ebqrl4f,t3_a607zr,t1_ebqo28u,aprilfades,1,2018-12-13 21:02:02,/r/EDAnonymous/comments/a607zr/just_a_reminder_a_certain_fat_people_hateesque/ebqrl4f/,Tbh HoldMyFries came to mind first,False,False
ebqqttc,t3_a607zr,t3_a607zr,Swanabe,1,2018-12-13 20:51:10,/r/EDAnonymous/comments/a607zr/just_a_reminder_a_certain_fat_people_hateesque/ebqqttc/,"I honestly can’t remember a time when I saw something on that sub that I thought was being unfairly mocked.   Personally, it’s a very helpful sub for me, but to each their own. ",False,False
ebqpyn1,t3_a607zr,t3_a607zr,saltsplendasriracha,1,2018-12-13 20:38:28,/r/EDAnonymous/comments/a607zr/just_a_reminder_a_certain_fat_people_hateesque/ebqpyn1/,People on that sub and 1200isjerky are belligerant ,False,False
ebqo28u,t3_a607zr,t1_ebqnc2m,JuBelen,1,2018-12-13 20:11:26,/r/EDAnonymous/comments/a607zr/just_a_reminder_a_certain_fat_people_hateesque/ebqo28u/,Fatlogic,False,False
ebqnc2m,t3_a607zr,t3_a607zr,slyfox10601,1,2018-12-13 20:00:51,/r/EDAnonymous/comments/a607zr/just_a_reminder_a_certain_fat_people_hateesque/ebqnc2m/,What is it?? ,False,False
