Comment ID,Link ID,Parent ID,Author,Score,Publish Date,Permalink,Text,Stickied,Is Submitter
fhi26th,t3_f2tgwh,t1_fhetjva,Shreddedlikechedda,1,2020-02-13 11:52:30,/r/EDAnonymous/comments/f2tgwh/i_just_found_out_that_girl_who_bullied_me_because/fhi26th/,Welp someday she’ll be old and her ugly personally won’t be able to save her,False,False
fhh9im6,t3_f2tgwh,t1_fhetjva,Pipergnome,1,2020-02-13 06:52:57,/r/EDAnonymous/comments/f2tgwh/i_just_found_out_that_girl_who_bullied_me_because/fhh9im6/,"That sucks she did that to you. But if it’s any consolation, top 5 means nothing. Most people can’t even remember top 5 in the miss America competitions. People just seem to be sharing it bc they’re like omg I know a famous person. Which won’t last for long. She has her 5 mins of fame and karma will eventually catch up with her.   She sounds really fucked up emotionally with the way she stalked your social media. No idea how she got into pageantry bc aren’t they at least not supposed to be bullies?",False,False
fhgyvai,t3_f2tgwh,t3_f2tgwh,marielazzarus,1,2020-02-13 03:20:10,/r/EDAnonymous/comments/f2tgwh/i_just_found_out_that_girl_who_bullied_me_because/fhgyvai/,find out if she has a po box and send her one of those glitter packages that explode,False,False
fhgi8a2,t3_f2tgwh,t1_fhg7919,lioneyssy,1,2020-02-12 22:23:57,/r/EDAnonymous/comments/f2tgwh/i_just_found_out_that_girl_who_bullied_me_because/fhgi8a2/,"I don’t even have any proof that she bullied me, people wouldn’t believe it anyways because she’s ~✨such a nice person✨~",False,True
fhgh3qy,t3_f2tgwh,t1_fhfaaxa,lioneyssy,1,2020-02-12 22:09:37,/r/EDAnonymous/comments/f2tgwh/i_just_found_out_that_girl_who_bullied_me_because/fhgh3qy/,I wish it was easy to stay kind to myself 😔,False,True
fhggb23,t3_f2tgwh,t3_f2tgwh,Foureyedlemon,1,2020-02-12 21:59:40,/r/EDAnonymous/comments/f2tgwh/i_just_found_out_that_girl_who_bullied_me_because/fhggb23/,My childhood demon is now the Miss ___ of my state lmao shit not fair,False,False
fhgbtln,t3_f2tgwh,t3_f2tgwh,OhCrumbs96,1,2020-02-12 21:06:56,/r/EDAnonymous/comments/f2tgwh/i_just_found_out_that_girl_who_bullied_me_because/fhgbtln/,"It's so sad to see how many of you have had this experience and, to be honest, is a pretty awful reflection of the type of people who go into modelling.  To anyone who is going through this, please try to bear in mind that there are loads of downsides to being in that industry. I'm sure all of you are eventually going to look back on your lives with far more joy, pride and satisfaction than the people who cruelly tormented you will.",False,False
fhg9cak,t3_f2tgwh,t3_f2tgwh,dino_babies,1,2020-02-12 20:39:33,/r/EDAnonymous/comments/f2tgwh/i_just_found_out_that_girl_who_bullied_me_because/fhg9cak/,"Ugh. The girl who bullied and belittled me since we were in elementary school is a model, too. But she was also taken advantage of by a lot of older men when she was starting out with modeling in middle school, so I don't envy that.   I feel bad that she had to go through that. She's a total bitch, but no one deserves that kind of shit happening to them.",False,False
fhg7919,t3_f2tgwh,t1_fhetjva,EmilyVS,1,2020-02-12 20:16:29,/r/EDAnonymous/comments/f2tgwh/i_just_found_out_that_girl_who_bullied_me_because/fhg7919/,"Holy shit. Depending on how sour you still are about and how well known she becomes, you could possibly write an exposé, anonymous or otherwise. I probably would tbh.",False,False
fhg5iub,t3_f2tgwh,t3_f2tgwh,i-eat-bunnies,1,2020-02-12 19:57:47,/r/EDAnonymous/comments/f2tgwh/i_just_found_out_that_girl_who_bullied_me_because/fhg5iub/,"I don't know if this helps, but I know a few girls who are models, and they're not happy at all. It's gruelling work - you'll miss a lot of sleep and you'll spend the entire day going to casting after casting. Some guys are in the business to take advantage of girls and this is commonplace as well. Also doing photoshoots when you're cold, wet, tired and just want to go home. There's also the massive pressure to lose weight unhealthily and to maintain an extremely underweight BMI. It's super taxing on your mental health, and I doubt she's happy.",False,False
fhg2l2b,t3_f2tgwh,t3_f2tgwh,pokeupokeu,1,2020-02-12 19:25:24,/r/EDAnonymous/comments/f2tgwh/i_just_found_out_that_girl_who_bullied_me_because/fhg2l2b/,Sounds like shes a miserable ass bitch,False,False
fhfzr1j,t3_f2tgwh,t3_f2tgwh,AdoreDelLamo,1,2020-02-12 18:53:17,/r/EDAnonymous/comments/f2tgwh/i_just_found_out_that_girl_who_bullied_me_because/fhfzr1j/,lol ruin her career,False,False
fhfsr6s,t3_f2tgwh,t3_f2tgwh,ks788,1,2020-02-12 17:33:58,/r/EDAnonymous/comments/f2tgwh/i_just_found_out_that_girl_who_bullied_me_because/fhfsr6s/,This makes me so sad. Why is life so unfair sometimes :/,False,False
fhfsme2,t3_f2tgwh,t3_f2tgwh,[deleted],1,2020-02-12 17:32:29,/r/EDAnonymous/comments/f2tgwh/i_just_found_out_that_girl_who_bullied_me_because/fhfsme2/,[deleted],False,False
fhfsjj8,t3_f2tgwh,t3_f2tgwh,DisguisedAsMe,1,2020-02-12 17:31:36,/r/EDAnonymous/comments/f2tgwh/i_just_found_out_that_girl_who_bullied_me_because/fhfsjj8/,"The girl who bullied me, called me fat/irrelevant (and slept with my boyfriend at the time while I was having a tumor tested for cancer) is now living abroad as an actress/model lol. Feels bad man",False,False
fhfrsbd,t3_f2tgwh,t1_fhfaaxa,amehlea,1,2020-02-12 17:23:21,/r/EDAnonymous/comments/f2tgwh/i_just_found_out_that_girl_who_bullied_me_because/fhfrsbd/,&gt;Please try to stay kind to yourself in light of the garbage circumstances.  idk why but this got me lmao     **true words tho**,False,False
fhfrs6y,t3_f2tgwh,t3_f2tgwh,cbunni666,1,2020-02-12 17:23:19,/r/EDAnonymous/comments/f2tgwh/i_just_found_out_that_girl_who_bullied_me_because/fhfrs6y/,But look at it this way... You sound like a decent human being. Sweet even. That girl will always be a bitch.,False,False
fhfpzu5,t3_f2tgwh,t3_f2tgwh,notyourpeach,1,2020-02-12 17:03:57,/r/EDAnonymous/comments/f2tgwh/i_just_found_out_that_girl_who_bullied_me_because/fhfpzu5/,"Universe will take care of that, she might be a model but her disgusting heart will never be beautiful enough.   Hugs to you!!! 💖",False,False
fhfln0m,t3_f2tgwh,t1_fhfaaxa,depressionbunny,2,2020-02-12 16:18:39,/r/EDAnonymous/comments/f2tgwh/i_just_found_out_that_girl_who_bullied_me_because/fhfln0m/,^this,False,False
fhflgur,t3_f2tgwh,t3_f2tgwh,snaafuuu,2,2020-02-12 16:16:55,/r/EDAnonymous/comments/f2tgwh/i_just_found_out_that_girl_who_bullied_me_because/fhflgur/,I'm sure she's still a miserable bitch!,False,False
fhfesyb,t3_f2tgwh,t3_f2tgwh,itsnotnaomi,1,2020-02-12 15:12:26,/r/EDAnonymous/comments/f2tgwh/i_just_found_out_that_girl_who_bullied_me_because/fhfesyb/,"I know that feeling... life it’s not like a movie, where the bully gets the punishment he/she deserves most of the times. They continue their life unperturbed, and there is no karma. I hate social media because even if I know I shouldn’t, sometimes I check the profiles of people who have hurt me and they are living the best life while I’m here still sad thinking about the past. Concentrate on positive things, op!",False,False
fhfbp3z,t3_f2tgwh,t3_f2tgwh,miserylovescomputers,1,2020-02-12 14:43:06,/r/EDAnonymous/comments/f2tgwh/i_just_found_out_that_girl_who_bullied_me_because/fhfbp3z/,I hope her eating disorder is way worse than yours.,False,False
fhfaaxa,t3_f2tgwh,t3_f2tgwh,PM-ME-UR-SUCCULENTS,1,2020-02-12 14:29:50,/r/EDAnonymous/comments/f2tgwh/i_just_found_out_that_girl_who_bullied_me_because/fhfaaxa/,"She's probably absolutely miserable on the inside honestly.  For someone who bullied others for their body to go into an industry where staying \~\~thin and beautiful\~\~ is the top priority, she's probably got an assload of her own body image issues and insecurities. It was most likely never truly about you, but about her trying to feel better than you. It could have been anyone. The problem was with her.  I'm sorry she made you feel so shitty and that was incredibly unfair. Please try to stay kind to yourself in light of the garbage circumstances, you are absolutely worth it.",False,False
fhf42lr,t3_f2tgwh,t1_fhezmmp,lioneyssy,1,2020-02-12 13:29:55,/r/EDAnonymous/comments/f2tgwh/i_just_found_out_that_girl_who_bullied_me_because/fhf42lr/,Damn being nice is overrated,False,True
fhezmmp,t3_f2tgwh,t3_f2tgwh,h3rbiv0re,1,2020-02-12 12:46:12,/r/EDAnonymous/comments/f2tgwh/i_just_found_out_that_girl_who_bullied_me_because/fhezmmp/,The girl that bullied me just won miss world for her country lol I feel this,False,False
fheuhgc,t3_f2tgwh,t1_fhetjva,lioneyssy,1,2020-02-12 11:56:03,/r/EDAnonymous/comments/f2tgwh/i_just_found_out_that_girl_who_bullied_me_because/fheuhgc/,ugh I’m so sorry this is the worst feeling ever... and it’s a fuel for my self hatred I thought that I couldn’t go any lower but wow,False,True
fhetjva,t3_f2tgwh,t3_f2tgwh,unde4dinside,1,2020-02-12 11:47:05,/r/EDAnonymous/comments/f2tgwh/i_just_found_out_that_girl_who_bullied_me_because/fhetjva/,"\*hug\* :c  in the same boat here; girl who bullied me relentlessly in elementary and middle school and continued to stalk my social media in high school (even though we went to different ones) to tell the guys I was dating all about how ""they can do so much better"" is now a supermodel and just a few weeks ago ended up in the top 5 for my state's Miss \[Name of State\] pageant and I had to see just about everyone I ever knew and grew up with share her face all over my newsfeed =/",False,False
