Comment ID,Link ID,Parent ID,Author,Score,Publish Date,Permalink,Text,Stickied,Is Submitter
f11t8jf,t3_d7g8qs,t3_d7g8qs,etherealaqua,1,2019-09-22 00:30:27,/r/EDAnonymous/comments/d7g8qs/i_guess_i_fuckin_eat_cheese_now/f11t8jf/,cheese is not so bad! protein! fats! probiotics!,False,False
f0zxmvj,t3_d7g8qs,t1_f0zxjj9,comfortbun,1,2019-09-21 17:19:31,/r/EDAnonymous/comments/d7g8qs/i_guess_i_fuckin_eat_cheese_now/f0zxmvj/,yeah sorry if i came out as asshol,False,False
f0zxjj9,t3_d7g8qs,t1_f0ztac2,TurkeysAreFriends,1,2019-09-21 17:18:55,/r/EDAnonymous/comments/d7g8qs/i_guess_i_fuckin_eat_cheese_now/f0zxjj9/,thank u for the suggestions tho i rly appreciate the response!!,False,True
f0zx8jy,t3_d7g8qs,t1_f0ztac2,TurkeysAreFriends,1,2019-09-21 17:16:53,/r/EDAnonymous/comments/d7g8qs/i_guess_i_fuckin_eat_cheese_now/f0zx8jy/,ahhh yea i do i actually like vegan cheese n buy my own foods n am very strongly against the dairy industry i just been on binge brain and keep eating anything i see knowing i don’t even want to :////,False,True
f0ztac2,t3_d7g8qs,t1_f0zszy3,comfortbun,1,2019-09-21 16:47:42,/r/EDAnonymous/comments/d7g8qs/i_guess_i_fuckin_eat_cheese_now/f0ztac2/,well imo vegan cheese is gross.... try subbing it 4 something maybe. like i’ve had a recent nutella craze n fucked up my 6+ month streak of being dairy free :/ went out n bought some oreos to sub the cravings instead u feel. do u buy ur own groceries? if yes then i would say try to avoid bringing any cheese into ur home.,False,False
f0zszy3,t3_d7g8qs,t1_f0zqe3h,TurkeysAreFriends,1,2019-09-21 16:45:01,/r/EDAnonymous/comments/d7g8qs/i_guess_i_fuckin_eat_cheese_now/f0zszy3/,YEA THATS THE PROBLEM,False,True
f0zqe3h,t3_d7g8qs,t3_d7g8qs,comfortbun,1,2019-09-21 16:20:28,/r/EDAnonymous/comments/d7g8qs/i_guess_i_fuckin_eat_cheese_now/f0zqe3h/,whut. vegans don’t eat cheese,False,False
