Comment ID,Link ID,Parent ID,Author,Score,Publish Date,Permalink,Text,Stickied,Is Submitter
ehgfmna,t3_avf6zb,t3_avf6zb,frantrum,1,2019-02-27 23:35:58,/r/EDAnonymous/comments/avf6zb/the_energy_here_is_so_good/ehgfmna/,This is the sub I come to after a bad day- thank you for saying what I wish I could say every day!,False,False
ehfr75w,t3_avf6zb,t3_avf6zb,Bomby57,1,2019-02-27 17:57:37,/r/EDAnonymous/comments/avf6zb/the_energy_here_is_so_good/ehfr75w/,People who struggle together stick together 💕,False,False
ehfmvvu,t3_avf6zb,t3_avf6zb,unsurebanana,1,2019-02-27 17:02:34,/r/EDAnonymous/comments/avf6zb/the_energy_here_is_so_good/ehfmvvu/,"I agree, I was super surprised at how encouraging and nice and supportive people are! It's a nice change from forums like myproana :)",False,False
ehflhe6,t3_avf6zb,t1_ehfhqpn,Bruiseviolet_,1,2019-02-27 16:45:42,/r/EDAnonymous/comments/avf6zb/the_energy_here_is_so_good/ehflhe6/,Ikr I’m still so sad that r/proed is gone :( there was so many ppl subscribed. I can only hope that they’re all okay. I’ve never come across such a kind &amp; supportive &amp; welcoming community. We all just understand each other perfectly which is so beautiful 🥰,False,False
ehfhqpn,t3_avf6zb,t3_avf6zb,anxthekitten,1,2019-02-27 16:03:28,/r/EDAnonymous/comments/avf6zb/the_energy_here_is_so_good/ehfhqpn/,"that’s how r/ProED was! i loved that sub so much, compared to other subs we were the least toxic ever, everyone supported one another and it was so positive. i’m glad it’s like this on this sub   as well. :’)",False,False
ehfgfwk,t3_avf6zb,t3_avf6zb,marialycia,1,2019-02-27 15:50:47,/r/EDAnonymous/comments/avf6zb/the_energy_here_is_so_good/ehfgfwk/,❤️,False,False
ehf3mxe,t3_avf6zb,t3_avf6zb,vomitandthrowaway,1,2019-02-27 13:39:17,/r/EDAnonymous/comments/avf6zb/the_energy_here_is_so_good/ehf3mxe/,"Peach especially, I've never seen people talk about shit (litterally) so freely. I'm at home. :)",False,False
eheteoi,t3_avf6zb,t3_avf6zb,watermelements,1,2019-02-27 11:55:25,/r/EDAnonymous/comments/avf6zb/the_energy_here_is_so_good/eheteoi/,Dude I agree so much. So accepting and literally so nice. ,False,False
