Comment ID,Link ID,Parent ID,Author,Score,Publish Date,Permalink,Text,Stickied,Is Submitter
ehp1r7r,t3_awns5n,t1_ehoc6ih,anxiety-and-theatre,1,2019-03-03 06:38:49,/r/EDAnonymous/comments/awns5n/heres_a_tip/ehp1r7r/,"I don’t know that post, can you (or someone else) link it?",False,False
ehovnxj,t3_awns5n,t1_eholosc,sentienttrashcan33,1,2019-03-03 03:48:46,/r/EDAnonymous/comments/awns5n/heres_a_tip/ehovnxj/,sAME,False,True
eholosc,t3_awns5n,t3_awns5n,Valer_bear,1,2019-03-02 23:52:51,/r/EDAnonymous/comments/awns5n/heres_a_tip/eholosc/,I exercise even when I’m dying 💀 why am I like this ,False,False
ehog4hv,t3_awns5n,t3_awns5n,sstephenn,1,2019-03-02 22:30:48,/r/EDAnonymous/comments/awns5n/heres_a_tip/ehog4hv/,me even just going up the stairs with a flu ,False,False
ehoc6ih,t3_awns5n,t1_ehnvnx3,giveMeSteamKeysPls,1,2019-03-02 21:36:57,/r/EDAnonymous/comments/awns5n/heres_a_tip/ehoc6ih/,"This plus the ""don't binge fiber one bars"" post a while back would be perfect",False,False
eho7p5d,t3_awns5n,t1_eho4eiq,briarsrose_,1,2019-03-02 20:35:34,/r/EDAnonymous/comments/awns5n/heres_a_tip/eho7p5d/,"Oh bruh don’t even worry about it, it was funny just hard for me to read. ",False,False
eho4eiq,t3_awns5n,t1_eho4a0n,Imaskinnybitchyall,1,2019-03-02 19:49:47,/r/EDAnonymous/comments/awns5n/heres_a_tip/eho4eiq/,I'm sorry! I made it that way to make fun of pro ana blogs. I'll change it. ,False,False
eho4a0n,t3_awns5n,t1_ehnvnx3,briarsrose_,1,2019-03-02 19:48:03,/r/EDAnonymous/comments/awns5n/heres_a_tip/eho4a0n/,Fuck my dyslexic brain had to reread that like 5 times before it made sense. ,False,False
ehnvnx3,t3_awns5n,t3_awns5n,Imaskinnybitchyall,1,2019-03-02 17:50:28,/r/EDAnonymous/comments/awns5n/heres_a_tip/ehnvnx3/,The mods need to add a Tipsntrickz tag and have it all be stuff like this. ,False,False
