Comment ID,Link ID,Parent ID,Author,Score,Publish Date,Permalink,Text,Stickied,Is Submitter
f6ybn2b,t3_dtggys,t1_f6wf9yn,lolimscared101,1,2019-11-08 22:30:09,/r/EDAnonymous/comments/dtggys/i_have_the_flu/f6ybn2b/,Me too!,False,False
f6y3nlr,t3_dtggys,t3_dtggys,five_days_underwater,1,2019-11-08 20:31:20,/r/EDAnonymous/comments/dtggys/i_have_the_flu/f6y3nlr/,I need a goddamn illness to make up for my binge tonight 😩,False,False
f6xzn2a,t3_dtggys,t3_dtggys,RenBumah,1,2019-11-08 19:34:06,/r/EDAnonymous/comments/dtggys/i_have_the_flu/f6xzn2a/,Cough on me right this second.,False,False
f6xffu3,t3_dtggys,t3_dtggys,BXOGRL90,1,2019-11-08 15:28:16,/r/EDAnonymous/comments/dtggys/i_have_the_flu/f6xffu3/,Can I get some of those germs? Please and thank you.,False,False
f6x6grn,t3_dtggys,t3_dtggys,certifiedsnax,1,2019-11-08 13:57:31,/r/EDAnonymous/comments/dtggys/i_have_the_flu/f6x6grn/,i’ll have whatever you’re having,False,False
f6x3ije,t3_dtggys,t3_dtggys,milkiiiii,1,2019-11-08 13:25:06,/r/EDAnonymous/comments/dtggys/i_have_the_flu/f6x3ije/,I also have the flu and it sucks but I feel like a fucking fasting legend,False,False
f6wxqso,t3_dtggys,t3_dtggys,tasha53505,1,2019-11-08 12:21:27,/r/EDAnonymous/comments/dtggys/i_have_the_flu/f6wxqso/,I have the flu 2! After 2 days of heavy restricting I got such a bad flu.,False,False
f6wv88k,t3_dtggys,t1_f6wkyei,K0B3ryant,1,2019-11-08 11:53:53,/r/EDAnonymous/comments/dtggys/i_have_the_flu/f6wv88k/,WAIT i came to say the exact same thing lol,False,False
f6wq6eu,t3_dtggys,t3_dtggys,itsyagirlKat,1,2019-11-08 10:59:14,/r/EDAnonymous/comments/dtggys/i_have_the_flu/f6wq6eu/,"Cough in my mouth, I wanna get sick too:(",False,False
f6wkyei,t3_dtggys,t3_dtggys,nadsatdevotchka,1,2019-11-08 10:02:51,/r/EDAnonymous/comments/dtggys/i_have_the_flu/f6wkyei/,i read soup as soap and i was genuinely scared for you for a moment. gws!!,False,False
f6wf9yn,t3_dtggys,t3_dtggys,vomitsmearedthighs,1,2019-11-08 08:59:21,/r/EDAnonymous/comments/dtggys/i_have_the_flu/f6wf9yn/,You mind coming over and infecting me?,False,False
