Comment ID,Link ID,Parent ID,Author,Score,Publish Date,Permalink,Text,Stickied,Is Submitter
edqgi36,t3_aeac2c,t1_edod3qh,tonithepony,1,2019-01-10 13:10:17,/r/EDAnonymous/comments/aeac2c/my_roommate_just_made_a_big_deal_about_washing/edqgi36/,Dollar tree also has a lot of good $1 plates/mugs/bowls ,False,False
edod3qh,t3_aeac2c,t1_edo5r6m,godisamango,1,2019-01-09 18:45:27,/r/EDAnonymous/comments/aeac2c/my_roommate_just_made_a_big_deal_about_washing/edod3qh/,Goodwill.,False,False
edoclbo,t3_aeac2c,t1_edo5r6m,tigerchik,1,2019-01-09 18:38:21,/r/EDAnonymous/comments/aeac2c/my_roommate_just_made_a_big_deal_about_washing/edoclbo/,brilliant.,False,False
edo7tgh,t3_aeac2c,t3_aeac2c,usegao,1,2019-01-09 17:33:36,/r/EDAnonymous/comments/aeac2c/my_roommate_just_made_a_big_deal_about_washing/edo7tgh/,"This reminds me of some guys who I used to let crash at my apartment. They started complaining that I never wash the dishes. Bro, I drink whole milk out the jug, fuck yo dishes.",False,False
edo5r6m,t3_aeac2c,t3_aeac2c,mermaid_butt,1,2019-01-09 17:06:41,/r/EDAnonymous/comments/aeac2c/my_roommate_just_made_a_big_deal_about_washing/edo5r6m/,This is why you need to get your own set of dishes/glassware/flatware. It works 10/10 There is no argument when the dishes are clearly different and you each only use your own so...,False,False
edo2t6m,t3_aeac2c,t1_ednucn1,kernalmustache,1,2019-01-09 16:30:01,/r/EDAnonymous/comments/aeac2c/my_roommate_just_made_a_big_deal_about_washing/edo2t6m/,"Yeah, sometimes he would complain about dishes I was still using and that was enough to convince him he was right",False,False
edo0adz,t3_aeac2c,t1_ednq1hv,kernalmustache,1,2019-01-09 16:01:31,/r/EDAnonymous/comments/aeac2c/my_roommate_just_made_a_big_deal_about_washing/edo0adz/,"Eww, why are some men like this? Also, my roommates. I have only found 2 of the maybe 15 green coffee mugs I own recently. They must have a pile of them stashed somewhere waiting to be cleaned.",False,False
ednucn1,t3_aeac2c,t1_ednnito,waitingdaisy,1,2019-01-09 15:01:13,/r/EDAnonymous/comments/aeac2c/my_roommate_just_made_a_big_deal_about_washing/ednucn1/,So he didn't recognize his own dishes??? Oh my looooord there is no helping some people. ,False,False
ednu828,t3_aeac2c,t3_aeac2c,NueNesta,1,2019-01-09 14:59:54,/r/EDAnonymous/comments/aeac2c/my_roommate_just_made_a_big_deal_about_washing/ednu828/,Just ew... Nasty roommates are the worst. ,False,False
ednq1hv,t3_aeac2c,t1_ednnito,RedditRanOutOfNamess,1,2019-01-09 14:13:31,/r/EDAnonymous/comments/aeac2c/my_roommate_just_made_a_big_deal_about_washing/ednq1hv/,"Oh man, this sounds like my boyfriend's brother. The dude would rather hide dirty dishes in his room than load a dishwasher.",False,True
ednpyq8,t3_aeac2c,t1_ednmzuo,RedditRanOutOfNamess,1,2019-01-09 14:12:39,/r/EDAnonymous/comments/aeac2c/my_roommate_just_made_a_big_deal_about_washing/ednpyq8/,I pretty much just gave him a sarcastic clap and told him congrats on doing his own dishes. He seemed offended and I genuinely hope that he was even if I have to deal with his attitude from it later.,False,True
ednnito,t3_aeac2c,t3_aeac2c,kernalmustache,1,2019-01-09 13:44:19,/r/EDAnonymous/comments/aeac2c/my_roommate_just_made_a_big_deal_about_washing/ednnito/,Lol sounds like my brother. When I still lived at my mom's he would constantly leave dishes by our computer desk and then complain that I was making a mess by leaving dishes there. I literally always brought my dishes down right away and the only way he realized that he was the problem was when I moved out and it was still constantly a mess. According to my mom he hasn't stopped leaving dishes up there.,False,False
ednmzuo,t3_aeac2c,t3_aeac2c,laisserai,1,2019-01-09 13:38:11,/r/EDAnonymous/comments/aeac2c/my_roommate_just_made_a_big_deal_about_washing/ednmzuo/,Wtf. Show him its all his dishes. What a dick,False,False
