Comment ID,Link ID,Parent ID,Author,Score,Publish Date,Permalink,Text,Stickied,Is Submitter
erniaqp,t3_c297uw,t1_eriwcnd,khakitomatoes,1,2019-06-20 12:54:22,/r/EDAnonymous/comments/c297uw/guys_hear_me_out_stop_consuming_diet_soda_as_well/erniaqp/,For me it's an appetite suppressant. Who gives a shit about health amiright,False,False
erni73t,t3_c297uw,t3_c297uw,khakitomatoes,1,2019-06-20 12:53:20,/r/EDAnonymous/comments/c297uw/guys_hear_me_out_stop_consuming_diet_soda_as_well/erni73t/,That sign can't stop me because I can't read,False,False
ern97gr,t3_c297uw,t3_c297uw,beenknew,1,2019-06-20 11:17:57,/r/EDAnonymous/comments/c297uw/guys_hear_me_out_stop_consuming_diet_soda_as_well/ern97gr/,here for ~~a good time~~ not a long time,False,False
erjo6ul,t3_c297uw,t3_c297uw,EmilysButt,1,2019-06-19 05:28:00,/r/EDAnonymous/comments/c297uw/guys_hear_me_out_stop_consuming_diet_soda_as_well/erjo6ul/,Pretty sure the ED will kill me first 🤷🏻‍♀️ but go off,False,False
erjm60u,t3_c297uw,t3_c297uw,snefferu,1,2019-06-19 04:37:50,/r/EDAnonymous/comments/c297uw/guys_hear_me_out_stop_consuming_diet_soda_as_well/erjm60u/,"I’m studying cell biology rn and literally today I was reading about relative risk. Relative risk can be misleading if the absolute risk is small. The example used in the study material was the recent/ish headlines about red meat increasing cancer risk by 20%, which is true, although in actual fact it’s still incredibly small. So don’t freak out if you love your diet sodas! I think we all know anyway that they’re not the healthiest choices, and if you cut down your intake that’s a good thing 🙃",False,False
erjlsse,t3_c297uw,t3_c297uw,princess-kitty-belle,1,2019-06-19 04:28:29,/r/EDAnonymous/comments/c297uw/guys_hear_me_out_stop_consuming_diet_soda_as_well/erjlsse/,"This is the sort of stuff the orthorexic side of my brain feeds off, while my anorexia freaking loves artificial sweetners.",False,False
erjhbyr,t3_c297uw,t3_c297uw,noonecar3s,1,2019-06-19 02:33:04,/r/EDAnonymous/comments/c297uw/guys_hear_me_out_stop_consuming_diet_soda_as_well/erjhbyr/,"This is not true, various studies tried to prove it was and either failed to do so or had inconclusive results i.e. the claim that artificial sugars can increase one's risk of cancer is rubbish",False,False
erjfg4f,t3_c297uw,t3_c297uw,_nouvelle,1,2019-06-19 01:50:20,/r/EDAnonymous/comments/c297uw/guys_hear_me_out_stop_consuming_diet_soda_as_well/erjfg4f/,Sources??,False,False
erix3y5,t3_c297uw,t1_eriwcnd,synedchdochee,1,2019-06-18 20:59:57,/r/EDAnonymous/comments/c297uw/guys_hear_me_out_stop_consuming_diet_soda_as_well/erix3y5/,i like the bübbles,False,False
eriwcnd,t3_c297uw,t3_c297uw,Blacknbruisey,1,2019-06-18 20:50:15,/r/EDAnonymous/comments/c297uw/guys_hear_me_out_stop_consuming_diet_soda_as_well/eriwcnd/,I just wanna know what the deal is with coke zero anyway?? I haven't drank a soda in years. Is it an appetite suppressant or is it the caffeine? Is it just a cult classic? I'm pretty against regular soda so I'm not sure I'd even try a coke zero lol,False,False
erirngm,t3_c297uw,t3_c297uw,LowCalPal,1,2019-06-18 19:50:09,/r/EDAnonymous/comments/c297uw/guys_hear_me_out_stop_consuming_diet_soda_as_well/erirngm/,"That’s a bold claim that’ll require substantial, replicable proof before anyone here is likely to take your recommendation",False,False
erimtzl,t3_c297uw,t1_eriltet,justanotherskullkid,1,2019-06-18 18:49:24,/r/EDAnonymous/comments/c297uw/guys_hear_me_out_stop_consuming_diet_soda_as_well/erimtzl/,Holy shit that sounds horrible and really scary.   I actually remember watching a diabulimia documentary a while back on BBC3 and it was really sad to watch.   I’m really glad you’re doing better now and I hope you continue to recover.,False,False
eriltet,t3_c297uw,t1_eril6fe,diabetomaximus,1,2019-06-18 18:36:45,/r/EDAnonymous/comments/c297uw/guys_hear_me_out_stop_consuming_diet_soda_as_well/eriltet/,"I'm currently in recovery. I didn't have a choice - I was told I would never regain full use of my knees if I didn't meet a specific protein or at least calorie goal to maintain muscle after my surgery. That said, diabetes makes it much easier to abuse eating patterns. On restrictive days I wouldn't have to take any extra insulin for carbs, and on binge days I could either take a bunch of insulin if I felt like it since I had a stockpile or I could not take insulin and feel like I was doing something because I would pee so much and drink so much water from the high blood sugar it helped give the stomach a flat appearance. But yes, I am doing okay now and I very much appreciate the sentiment. Thank you.",False,False
eril6fe,t3_c297uw,t1_erikefn,justanotherskullkid,1,2019-06-18 18:28:47,/r/EDAnonymous/comments/c297uw/guys_hear_me_out_stop_consuming_diet_soda_as_well/eril6fe/,"That’s true.  I can’t even imagine how tough it must be having diabetes and disordered eating :(  Obviously I see my husband struggle with T1, and I struggle a lot with eating and being underweight. Probably sounds stupid on this subreddit but I hope you’re doing okay.",False,False
eriknuv,t3_c297uw,t3_c297uw,synedchdochee,1,2019-06-18 18:22:15,/r/EDAnonymous/comments/c297uw/guys_hear_me_out_stop_consuming_diet_soda_as_well/eriknuv/,You can pry coke zero out if my grimy little malnourished hands,False,False
erikefn,t3_c297uw,t1_erijuyh,diabetomaximus,1,2019-06-18 18:18:55,/r/EDAnonymous/comments/c297uw/guys_hear_me_out_stop_consuming_diet_soda_as_well/erikefn/,Yeah. Insulin is too expensive to waste units on full sugar drinks anyways 😂,False,False
erik273,t3_c297uw,t3_c297uw,throwawaygyno826378,1,2019-06-18 18:14:35,/r/EDAnonymous/comments/c297uw/guys_hear_me_out_stop_consuming_diet_soda_as_well/erik273/,LMAO,False,False
erijuyh,t3_c297uw,t1_erijcm7,justanotherskullkid,1,2019-06-18 18:12:05,/r/EDAnonymous/comments/c297uw/guys_hear_me_out_stop_consuming_diet_soda_as_well/erijuyh/,My husbands Type 1 so we always have sugar free drinks.  You’re right in that studies have and haven’t shown that sweeteners can cause cancer. It’s a tough one but I personally take the risk.,False,False
erijcm7,t3_c297uw,t3_c297uw,diabetomaximus,1,2019-06-18 18:05:33,/r/EDAnonymous/comments/c297uw/guys_hear_me_out_stop_consuming_diet_soda_as_well/erijcm7/,I have diabetes I don't want to put regular sugar in my coffee lol also this is still largely up for debate - while there are studies that say this is plausible there are also many studies that show the opposite,False,False
