Comment ID,Link ID,Parent ID,Author,Score,Publish Date,Permalink,Text,Stickied,Is Submitter
ewg3u5c,t3_ck4mhd,t3_ck4mhd,Fhjggc,1,2019-08-09 12:54:56,/r/EDAnonymous/comments/ck4mhd/so_jealous_of_skinny_people_who_seem_to_just_not/ewg3u5c/,I don’t understand this kind of obsession with food.  Food is good and all but to think about it CONSTANTLY is insanity.  Don’t you have. anything else to think about/focus on like a job or hobbies?  If you stay on this path you will end up dead from obesity caused illnesses.  You need to find your purpose in life.  Eating is not a purpose.  You eat to live not live to eat.,False,False
evqu5gz,t3_ck4mhd,t3_ck4mhd,[deleted],1,2019-08-01 17:10:03,/r/EDAnonymous/comments/ck4mhd/so_jealous_of_skinny_people_who_seem_to_just_not/evqu5gz/,[deleted],False,False
evo2ise,t3_ck4mhd,t3_ck4mhd,scaredyk4t,1,2019-08-01 00:26:01,/r/EDAnonymous/comments/ck4mhd/so_jealous_of_skinny_people_who_seem_to_just_not/evo2ise/,This girl at my old job was so skinny and pretty. Her style was something I always attempted to dress like. She always came to her shift with a pack of pop tarts and a bag of chips. Just mindlessly eating them while working on the computer wearing a cute crop top and skinny pants. I literally would stare as she was taking each bite. A fucking pack of pop tarts has 400 cals!!!!!!,False,False
evlohcq,t3_ck4mhd,t3_ck4mhd,sadslap,1,2019-07-31 13:19:52,/r/EDAnonymous/comments/ck4mhd/so_jealous_of_skinny_people_who_seem_to_just_not/evlohcq/,"i used to be so jealous of those ppl too - literally my entire life i've just wished i don't like food and don't want to eat food. then, i got put on a medication that kills my appetite and also gives me sores in my mouth, so eating is often very difficult and painful.   initially i was happy bc of the weight loss and no appetite, but seeing my friends eat delicious things or my bf enjoy his food etc. etc. etc. made me sad because food that used to bring me happiness (and guilt) now doesn't incite anything inside me. feels like i lost something that made me happy and i won't ever get it back again... i never have food orgasms anymore everything is just ""food"" and slightly unappetizing.... :(   so plz try to enjoy your food and remember you deserve to enjoy it and allow it to make you happy!!! u never kno when ur health will take a turn, i look back with a lot of sadness on my heavy restriction before this period - if i knew that was the last ice cream sandwich i was going to enjoy or the last time i loved chinese hot pot, i definitely would've savored those times more and appreciated the happiness and joy that comes with eating things that you love",False,False
evl9l0p,t3_ck4mhd,t3_ck4mhd,Skinnytw,1,2019-07-31 11:53:18,/r/EDAnonymous/comments/ck4mhd/so_jealous_of_skinny_people_who_seem_to_just_not/evl9l0p/,"The first point actually is me. I hate to eat food I don't like. If I am not going to completely enjoy it, then I won't eat it.",False,False
evl823e,t3_ck4mhd,t1_evl2z5e,Latrophilin,1,2019-07-31 11:44:33,/r/EDAnonymous/comments/ck4mhd/so_jealous_of_skinny_people_who_seem_to_just_not/evl823e/,"I don't mean that I'm fat now. A few months ago I was the skinniest I've ever been in my adult life. I almost reached the weight you should be hospitalized at. Right now I'm slowly gaining the weight back. I do walk a lot though, both for eating disorder reasons (need to burn off that breakfast!!!) and for health reasons.  What I meant by my comment is that before I ate just enough to maintain my weight in the lower average or slightly underweight BMI range. I only ate when I was hungry, and food didn't cross my mind when I wasn't. I didn't think of calories or avoid 'fattening' foods on purpose. My diet was fairly balanced. Now I'm constantly obsessing over food, can't tell if I'm hungry or just nervous (so I don't eat because I'm probably just nervous, right?), feel guilt comparable to how you'd feel after commiting a heinous crime when I eat something I wasn't 'supposed to' and get panic attacks when grocery shopping.",False,False
evl3g9f,t3_ck4mhd,t3_ck4mhd,genejellydoughnut,1,2019-07-31 11:18:13,/r/EDAnonymous/comments/ck4mhd/so_jealous_of_skinny_people_who_seem_to_just_not/evl3g9f/,My fiance is like this exactly and hes underweight and trying to gain weight but can't... ughhh... 🙃🙃🙃,False,False
evl2z5e,t3_ck4mhd,t1_evk8swn,194277006,1,2019-07-31 11:15:27,/r/EDAnonymous/comments/ck4mhd/so_jealous_of_skinny_people_who_seem_to_just_not/evl2z5e/,"You can still be that person if you choose to be. The only thing that changed between you now and the old you, is that you stopped moving as much. When we are young, we tend to walk a lot and do much more activities VS now using cars/transportation etc",False,False
evl2ovf,t3_ck4mhd,t3_ck4mhd,194277006,1,2019-07-31 11:13:47,/r/EDAnonymous/comments/ck4mhd/so_jealous_of_skinny_people_who_seem_to_just_not/evl2ovf/,"Just because someone is skinny, doesn't mean they're healthy. I used to be one of those people, but I much prefer myself now.  I like knowing how to diet properly, and manage my nutrition to meet my fitness goals. Those skinny people are usually very weak and lacking the basic nutrients to lead a healthy life. They disregard eating fruits and Veg most of the time and just eat one high calorie meal a day",False,False
evkbnwo,t3_ck4mhd,t3_ck4mhd,briarsrose_,1,2019-07-31 08:16:14,/r/EDAnonymous/comments/ck4mhd/so_jealous_of_skinny_people_who_seem_to_just_not/evkbnwo/,"I used to be like this before Ed, and still a little like now that I’m recovered. Not eating if something is a little off always pisses off everyone around me. My family yells at me for being picky.   The forgetting to eat isn’t really forgetting. It’s more like when I’m actually hungry I’m too busy, then when I have time I’m not really hungry so I won’t eat.",False,False
evk8swn,t3_ck4mhd,t3_ck4mhd,Latrophilin,1,2019-07-31 07:52:43,/r/EDAnonymous/comments/ck4mhd/so_jealous_of_skinny_people_who_seem_to_just_not/evk8swn/,"I used to be like that :( I was always 'effortlessly skinny' and people were always complimenting me on that, which has definitely contributed to my ED. Now I'm convinced I'm going to gain weight instantly whenever I eat something.",False,False
evjo2b4,t3_ck4mhd,t3_ck4mhd,poopybuttholeboy,1,2019-07-31 04:45:39,/r/EDAnonymous/comments/ck4mhd/so_jealous_of_skinny_people_who_seem_to_just_not/evjo2b4/,"Omg this!! My boyfriend calls himself s scientific diet- he gets like zero pleasure from food aside from the fact that he knows he’s giving his body what its needs, he’s able to portion out well rounded meals and only eat when he’s hungry and it absolutely baffles me, I can’t even imagine having that kind set.",False,False
evjgy4z,t3_ck4mhd,t3_ck4mhd,internerderner2,1,2019-07-31 03:38:04,/r/EDAnonymous/comments/ck4mhd/so_jealous_of_skinny_people_who_seem_to_just_not/evjgy4z/,"I was just like that until 3 years ago, with the additional plus that I actually really liked food and had the impression of eating a ton.  I really miss those times, I get angry and almost teary-eyed whenever I think about how much the ED has messed up my life.",False,False
