Comment ID,Link ID,Parent ID,Author,Score,Publish Date,Permalink,Text,Stickied,Is Submitter
ei0xm4i,t3_axnegp,t3_axnegp,fuckinhelpmehdhd,1,2019-03-07 15:50:34,/r/EDAnonymous/comments/axnegp/do_you_ever_feel_like_the_universe_wants_you_to/ei0xm4i/,"Yes, I'm living at home away from school for the next month because I developed psychosis so I cant restrict without my fam catching on  also coincidentally I started having dreams of binging every single night since I've moved back in hmmmmm",False,False
ehxoq0o,t3_axnegp,t3_axnegp,shattered_self,1,2019-03-06 12:52:38,/r/EDAnonymous/comments/axnegp/do_you_ever_feel_like_the_universe_wants_you_to/ehxoq0o/,That's awesome. I go to DQ somewhat frequently but I only get a vanilla cone or small sundae. Keeps it around 300.,False,False
ehx6t6b,t3_axnegp,t1_ehuq82m,dragaynite,1,2019-03-06 09:32:52,/r/EDAnonymous/comments/axnegp/do_you_ever_feel_like_the_universe_wants_you_to/ehx6t6b/,Oh god I feel this one. I always tell my parents what I’m craving and as soon as they suggest we go get some I’m internally panicking and trying to think up the most believable excuse to get out of eating. ,False,False
ehwuk0i,t3_axnegp,t1_ehv8eth,BetterWayToFall,1,2019-03-06 06:38:18,/r/EDAnonymous/comments/axnegp/do_you_ever_feel_like_the_universe_wants_you_to/ehwuk0i/,Love those! I see hood brand mini I've cream sandwiches in my local store all the time. the trick is only eating one at a time..,False,False
ehwr0kf,t3_axnegp,t1_ehv6fs6,crossdressingcarp,1,2019-03-06 05:21:09,/r/EDAnonymous/comments/axnegp/do_you_ever_feel_like_the_universe_wants_you_to/ehwr0kf/,I LOVE THEM but i hate how the people who work at mcdonalds always try to be nice and put like 3 servings of soft serve on one cone 😭,False,False
ehvfqh6,t3_axnegp,t1_ehvfpt0,Bot_Metric,1,2019-03-05 16:08:32,/r/EDAnonymous/comments/axnegp/do_you_ever_feel_like_the_universe_wants_you_to/ehvfqh6/,"50.0 lbs ≈ 22.7 kilograms ^(1 pound ≈ 0.45kg)    ^(I'm a bot. Downvote to remove.)   _____    ^| ^[Info](https://www.reddit.com/user/Bot_Metric/comments/8lt7af/i_am_a_bot/) ^| ^[PM](https://www.reddit.com/message/compose?to=Ttime5) ^| ^[Stats](http://botmetric.pythonanywhere.com) ^| ^[Opt-out](https://www.reddit.com/message/compose?to=Bot_Metric&amp;subject=Don't%20reply%20to%20me&amp;message=If%20you%20send%20this%20message,%20I%20will%20no%20longer%20reply%20to%20your%20comments%20and%20posts.) ^| ^[v.4.4.7](https://www.reddit.com/user/Bot_Metric/comments/8o9vgz/updates/) ^|",False,False
ehvfpt0,t3_axnegp,t3_axnegp,holly-mint,1,2019-03-05 16:08:20,/r/EDAnonymous/comments/axnegp/do_you_ever_feel_like_the_universe_wants_you_to/ehvfpt0/,"I'm a Canadian vegan and we just got Beyond Meat crumbles at a build your own burrito place similar to Chipotle called Quesada, and in another week we get Beyond Sausage breakfast sandwiches at A&amp;W (I used to love fast food breakfast sandwiches and it's the biggest thing I miss from before that can't be replicated) so I definitely feel like I'm being tested rn as I have just re committed to losing weight a few days ago and am aiming to lose 50 lbs before my birthday in August eek. Praying I can control myself and get them as an occasional treat 😓",False,False
ehvc9qq,t3_axnegp,t3_axnegp,queenme2468,1,2019-03-05 15:31:48,/r/EDAnonymous/comments/axnegp/do_you_ever_feel_like_the_universe_wants_you_to/ehvc9qq/,The small is a better size ,False,False
ehv8eth,t3_axnegp,t1_ehv6fs6,sintos-compa,1,2019-03-05 14:50:15,/r/EDAnonymous/comments/axnegp/do_you_ever_feel_like_the_universe_wants_you_to/ehv8eth/,ice cream!   kroger has mini ice cream sandwiches for 110 kcal! not awfully small.,False,False
ehv6li8,t3_axnegp,t1_ehv6fs6,samtheonionman,1,2019-03-05 14:30:32,/r/EDAnonymous/comments/axnegp/do_you_ever_feel_like_the_universe_wants_you_to/ehv6li8/,I LOVE those mmmya ,False,True
ehv6fs6,t3_axnegp,t3_axnegp,iceicemilkshake,1,2019-03-05 14:28:49,/r/EDAnonymous/comments/axnegp/do_you_ever_feel_like_the_universe_wants_you_to/ehv6fs6/,PSA the vanilla cones at McDonald’s are ~200! They’re soft serve and so good,False,False
ehv596b,t3_axnegp,t3_axnegp,fatterfly,1,2019-03-05 14:16:11,/r/EDAnonymous/comments/axnegp/do_you_ever_feel_like_the_universe_wants_you_to/ehv596b/,"&gt;What kind of disgusting binge eating pig would eat that?  Ummmmm definitely not me!!!!!11!  &gt;Me of course, i'm going tonight.  Oh thank fuck, me too 😭   P.S. I hate you just a little OP now I'm craving one too 🙃🔫 ",False,False
ehux2lm,t3_axnegp,t3_axnegp,pillbus,1,2019-03-05 12:46:01,/r/EDAnonymous/comments/axnegp/do_you_ever_feel_like_the_universe_wants_you_to/ehux2lm/,"&gt; What kind of disgusting binge eating pig would eat that? Me of course, i'm going tonight.   LMFAO this is me all the time. I hope you can enjoy the blizzard. 💖",False,False
ehuq82m,t3_axnegp,t3_axnegp,amorae,1,2019-03-05 11:30:43,/r/EDAnonymous/comments/axnegp/do_you_ever_feel_like_the_universe_wants_you_to/ehuq82m/,"Oh dear god. She’s beautiful.  And yes totally. All the time more like since I work in food and have the option for free stuff :( Also I talk about random stuff I’m craving in front of my mom just to maintain the illusion of eating. Few days ago, I mentioned Ben &amp; Jerry’s Half-Baked and she actually brought me some.  What kind of daughter am I that I died inside at my mother doing something nice for me.",False,False
