Comment ID,Link ID,Parent ID,Author,Score,Publish Date,Permalink,Text,Stickied,Is Submitter
f19274i,t3_d84yn2,t1_f18le63,etherealaqua,1,2019-09-23 14:27:15,/r/EDAnonymous/comments/d84yn2/seeing_people_post_treatment_is_terrifying/f19274i/,but they’re not “lying” to her is my point. they’re professionals but they can’t always predict exactly how a body is going to react to refeeding,False,False
f18le63,t3_d84yn2,t1_f17u7d9,livipup,2,2019-09-23 12:27:24,/r/EDAnonymous/comments/d84yn2/seeing_people_post_treatment_is_terrifying/f18le63/,I don't think that's really true. The whole starvation mode thing. You can't make fat or muscle out of nothing. They must be overfeeding OP if they're gaining that much weight.,False,False
f17u7d9,t3_d84yn2,t1_f17b71z,etherealaqua,1,2019-09-23 09:20:15,/r/EDAnonymous/comments/d84yn2/seeing_people_post_treatment_is_terrifying/f17u7d9/,"There is no way a treatment team would straight up LIE to op for the heck of it. Regardless of what our disorders want us to think, treatment isn’t some evil made up of people who maliciously want us to gain weight. They’re focused on getting proper NUTRITION back into the body. Sometimes this means your body overcompensates for a bit because it’s so scared of being starved again. It’ll even out over time, op!!! But considering you’re still in treatment, getting fed properly and regularly is still fairly new to your body. Once it learns that it’s not going to be starved of food again, it’ll trust you and settle at a “normal” weight (also, studies show that being slightly “overweight” is WAY healthier than being underweight. Also BMI is a load of bs invented in like the 60s by one guy who wanted to use it to measure entire populations, not individuals). Don’t go back to restricting, that’s the worst thing you could do if you want your body to trust you again!",False,False
f17cbd9,t3_d84yn2,t1_f17bdyc,livipup,1,2019-09-23 07:09:42,/r/EDAnonymous/comments/d84yn2/seeing_people_post_treatment_is_terrifying/f17cbd9/,"Idk if restricting is the best way to lose the excess weight. I understand how you might feel that way since you didn't receive the psychological care you required. It must have been an overall very negative experience to go through this. It could be a good opportunity to learn about healthy weight control methods though. Personally I recommend figuring out how much you need to maintain your weight at your goal weight (*which I would hope is still in the healthy range*) and getting there through a mix of diet and exercise. It's important to eat healthy of course. Restricting doesn't usually allow for a healthy diet. I mean, I personally *can't* eat as much as I need to maintain my weight, so I understand how difficult it is to maintain proper nutrition while restricting.  I basically would have to eat the same thing every single day and my meal plan would include numerous supplements including a meal replacement shake. Even then I never quite meet my full goals. I'm often short on certain minerals and I never get a good ratio of macronutrients because I always end up getting most of my calories through carbs. If you can find a way to eat a normal amount and lose weight that would be best.",False,False
f17bdyc,t3_d84yn2,t1_f17b71z,Annieboot,1,2019-09-23 07:01:58,/r/EDAnonymous/comments/d84yn2/seeing_people_post_treatment_is_terrifying/f17bdyc/,Totally And not just on this - was meant to get psych support too and got none The whole thing was a joke Yay for public health All I know now is I need to restrict and my body required fewer calories to maintain,False,True
f17b71z,t3_d84yn2,t1_f17aql2,livipup,1,2019-09-23 07:00:32,/r/EDAnonymous/comments/d84yn2/seeing_people_post_treatment_is_terrifying/f17b71z/,"Okay, so they lied to you",False,False
f17aql2,t3_d84yn2,t1_f17aa7k,Annieboot,1,2019-09-23 06:56:44,/r/EDAnonymous/comments/d84yn2/seeing_people_post_treatment_is_terrifying/f17aql2/,That’s what I would have thought too but apparently I lost weight one week (also had my period) so they put me on a gain protocol and then said that it wouldn’t continue to result in gain but it has  So now I need to restrict again and lose weight 🙄🤦🏼‍♀️,False,True
f17aopu,t3_d84yn2,t3_d84yn2,Annieboot,1,2019-09-23 06:56:18,/r/EDAnonymous/comments/d84yn2/seeing_people_post_treatment_is_terrifying/f17aopu/,That’s what I would have thought too but apparently I lost weight one week (also had my period) so they put me on a gain protocol and then said that it wouldn’t continue to result in gain but it has  So now I need to restrict again and lose weight 🙄🤦🏼‍♀️,False,True
f17aa7k,t3_d84yn2,t1_f176nz4,livipup,1,2019-09-23 06:52:58,/r/EDAnonymous/comments/d84yn2/seeing_people_post_treatment_is_terrifying/f17aa7k/,If you're close to being overweight after treatment then perhaps they didn't treat you properly. You weren't underweight to begin with so a proper nutritional rehabilitation would involve maintaining your weight rather than forcing you to gain and focusing on getting all of the nutrients you need.,False,False
f179ps0,t3_d84yn2,t3_d84yn2,iced_peach_tea,1,2019-09-23 06:47:55,/r/EDAnonymous/comments/d84yn2/seeing_people_post_treatment_is_terrifying/f179ps0/,"I know its hard and this is coming from a stranger but Im so proud of you for making it through. Its not an easy road to recovery, lots of anxiety but you've got this!!",False,False
f176nz4,t3_d84yn2,t1_f176jyd,Annieboot,1,2019-09-23 06:12:46,/r/EDAnonymous/comments/d84yn2/seeing_people_post_treatment_is_terrifying/f176nz4/,Thanks Part of me believes that might be ok. I wasn’t quite underweight before and I’m just on the brink of overweight now so I feel like it was not needed and looks bad :( but I know Ed messes with my head too,False,True
f176jyd,t3_d84yn2,t3_d84yn2,PozitivePerson,1,2019-09-23 06:11:15,/r/EDAnonymous/comments/d84yn2/seeing_people_post_treatment_is_terrifying/f176jyd/,I bet you look way better.,False,False
