Comment ID,Link ID,Parent ID,Author,Score,Publish Date,Permalink,Text,Stickied,Is Submitter
eiapzxf,t3_adk8lt,t1_ei9pepj,SquirrelMcPants,1,2019-03-11 14:21:17,/r/EDAnonymous/comments/adk8lt/dealing_with_the_consequences_of_ed/eiapzxf/,I’m making an appointment. Super nervous about it /:,False,False
ei9pepj,t3_adk8lt,t1_ediodfu,_FailingStar_,1,2019-03-11 06:18:52,/r/EDAnonymous/comments/adk8lt/dealing_with_the_consequences_of_ed/ei9pepj/,"Go to the dentist, please.   As someone without dental, I worry a lot about the accumulation of damage. My mom had her teeth chip away.   Check on it before any problems can get worse. :(",False,False
edksi6c,t3_adk8lt,t1_edjmns5,cleanandlovely,1,2019-01-08 12:42:43,/r/EDAnonymous/comments/adk8lt/dealing_with_the_consequences_of_ed/edksi6c/,"Perhaps, but unfortunately, it's not approved by the FDA for anything other than C. Diff unless you're taking part in an authorized clinical trial. So I, and most people in my position, have no way to access it.",False,False
edk50jk,t3_adk8lt,t1_ediodfu,ehloveeash,1,2019-01-08 07:41:00,/r/EDAnonymous/comments/adk8lt/dealing_with_the_consequences_of_ed/edk50jk/,"Im so glad you were able to get through the liver issues. I couldnt agree more with everything that this disorder has caused me. So many relationships, opportunities, and actual financial freedom. No one ever tells you how expensive bulimia is in the short term and what the 'real' long term costs are. ",False,True
edk4w2u,t3_adk8lt,t1_edj5n6s,ehloveeash,1,2019-01-08 07:38:56,/r/EDAnonymous/comments/adk8lt/dealing_with_the_consequences_of_ed/edk4w2u/,"Yeah the quality of life change is my biggest regret. At least if I chose to recover sooner I couldve learned to love myself more and enjoyed life, but I chose to continue and now I deal with the consequences because I couldn't admit the I was more afraid of being fat than of dying. ",False,True
edjmns5,t3_adk8lt,t1_edjjkee,AsianMemes,1,2019-01-08 00:30:48,/r/EDAnonymous/comments/adk8lt/dealing_with_the_consequences_of_ed/edjmns5/,"It’s actually been used for quite a while now. It was originally conceived in ancient China and in the late 1950s it was used on 4 critically ill patients to help them recover and the results were successful. Of course, there are risks. Good bacteria is good as long as it’s in balance with bad. Infections usually derive from an imbalance of having too much of good or bad bacteria. However these are relatively rare and should not been taken to heavily. Fecal transplants are incredibly useful and for the most part, safe.",False,False
edjjkee,t3_adk8lt,t1_edj8zqu,cleanandlovely,1,2019-01-07 23:36:40,/r/EDAnonymous/comments/adk8lt/dealing_with_the_consequences_of_ed/edjjkee/,"Yeah, I think it's still considered very experimental. There are definitely risks involved (e.g., I can't imagine it being 100% risk-free to transplant someone else's fecal bacteria into a colon that's riddled with open ulcers, as in IBD... that's not so much a problem with C. diff, the only condition for which it's actually approved). It does sound promising, though, and I seriously hope the research is right about its potential.",False,False
edjanr7,t3_adk8lt,t3_adk8lt,xStingx,1,2019-01-07 21:40:23,/r/EDAnonymous/comments/adk8lt/dealing_with_the_consequences_of_ed/edjanr7/,"What scares me the most is how scared I am of being okay with purging but not being able to stop. I mean, physically I'm able to stop but my fucking mind wont let me. Even when I convince myself that I'm not gonna purge, 30 minutes later I'm shoving my hand down my throat. It never ends. I'm trapped!! Too scared for help too scared to gain. Just wanting to reach my goal but joke's on me because there isn't one. ",False,False
edj8zqu,t3_adk8lt,t1_edhrrdz,nowayjoseTA,1,2019-01-07 21:21:20,/r/EDAnonymous/comments/adk8lt/dealing_with_the_consequences_of_ed/edj8zqu/,"what about a poop transplant? This is a real thing that doctors do to put all the good flora from a healthy person’s poop into an “unhealthy” persons gut. its gross but its still poop, and it’s completely safe.  I’ve never done it but i’ve heard of it",False,False
edj7kv7,t3_adk8lt,t3_adk8lt,ghettoprinsessa,1,2019-01-07 21:05:10,/r/EDAnonymous/comments/adk8lt/dealing_with_the_consequences_of_ed/edj7kv7/,"Eating disorders are everything but glamorous, I agree. I've had anorexia nervosa (binge &amp; purge subtype) for 11 years this year. Luckily I don't have any severe, life-threathening complications so far but I have a lot of ""not so serious"" complications.  When I still was purging (quit that about a year or so ago) I damaged my teeth pretty bad. Several cavities, my dental enamel is pretty much gone and on top of this I'm extremely afraid of dentists. Because of that I'm quite positive I'll never get them fixed. Well, that's my own stupidity though.  At the age of 18 I was diagnosed with a minor heart problem. Nothing lethal, just prolonged QT but it still freaked me out. Last time we checked my heart was in a better condition but that was years ago. I don't know in what condition it is now but hey, I'm still alive!  I also have awful constipation (abusing opioids sure doesn't help haha), thinning hair, lanugo and a hard time sitting in a chair with no cushions; my assbones hurt. Even sleeping in my own, comfortable, soft bed hurts if I am too long in the same position.   So yeah, far, far away from glamour! 😜",False,False
edj5n6s,t3_adk8lt,t3_adk8lt,Caketryahaim,1,2019-01-07 20:42:56,/r/EDAnonymous/comments/adk8lt/dealing_with_the_consequences_of_ed/edj5n6s/,"Shit. I have this also. I don't know how mine started though, since it started before the purging did.   I have a heap of GI issues and food intolerances also. Hair thin, nails brittle, quality of life completely fucking anihiliated.  :( ",False,False
edj3uvl,t3_adk8lt,t3_adk8lt,calibrateichabod,1,2019-01-07 20:23:08,/r/EDAnonymous/comments/adk8lt/dealing_with_the_consequences_of_ed/edj3uvl/,"I have been an anorexic for fifteen years, and I am rendered permanently sterile because of it. I have malnourished my body into knowing that it cannot support life, because I cannot even support my own. My bones are brittle, I can no longer digest dairy at all, my hormones are pretty permanently out of whack, and up until recently my heart was pretty messed up too. It's taken over a year in full recovery for doctors to clear me of significant heart issues. I am twenty seven years old.   Eating disorders, man. They'll fuck you up. Glamorously. ",False,False
edj3ogw,t3_adk8lt,t3_adk8lt,tigerchik,1,2019-01-07 20:21:02,/r/EDAnonymous/comments/adk8lt/dealing_with_the_consequences_of_ed/edj3ogw/,"yeah, the side effects suck.  I'm sorry you have lifelong damage from a disease you never asked to have. :-( can they do anything for you?",False,False
edj1eg1,t3_adk8lt,t3_adk8lt,ehloveeash,1,2019-01-07 19:53:52,/r/EDAnonymous/comments/adk8lt/dealing_with_the_consequences_of_ed/edj1eg1/,Thank you everyone who has replied to this and reached out to me. I appreciate the support now more than ever and to those reading this please look at all of these comments and consider if this is something you really want for yourself because I would never imagine that I am at this point right now dealing with so many illnesses At my age all because I have an eating disorder.,False,True
edizzjc,t3_adk8lt,t1_edi96nx,waterwhore,1,2019-01-07 19:37:03,/r/EDAnonymous/comments/adk8lt/dealing_with_the_consequences_of_ed/edizzjc/,You will have a new normal. Nothing will really feel like before but it’s okay and almost better bc who you were before led to this and who you can become could be sooooo much better than you ever imagined,False,False
ediyork,t3_adk8lt,t1_edi0dbr,MattiseB,1,2019-01-07 19:22:03,/r/EDAnonymous/comments/adk8lt/dealing_with_the_consequences_of_ed/ediyork/,"That’s horrible, defining an eating disorder as brave ",False,False
ediuu3t,t3_adk8lt,t3_adk8lt,livelotus,1,2019-01-07 18:37:49,/r/EDAnonymous/comments/adk8lt/dealing_with_the_consequences_of_ed/ediuu3t/,I pray for the soul(s) that downvoted this. ,False,False
ediodfu,t3_adk8lt,t3_adk8lt,SquirrelMcPants,1,2019-01-07 17:25:55,/r/EDAnonymous/comments/adk8lt/dealing_with_the_consequences_of_ed/ediodfu/,"I’ve spent half my life with this disease, and I’m frankly terrified to go to the GI doc. I don’t want to know what they’ll find. Also, for the first time in my life, I have dental insurance, and I still don’t want to brave the dentist.   I have lost friends, jobs, respect (from others and myself), any shred of self-worth, and I can’t even fathom how much money from dieticians, psychs, shrinks, docs, tests, hospital and inpatient stays.   Stay safe out there. This is hell. ",False,False
edime6p,t3_adk8lt,t3_adk8lt,Mukbangs,1,2019-01-07 17:06:27,/r/EDAnonymous/comments/adk8lt/dealing_with_the_consequences_of_ed/edime6p/,"I've dealt with anorexcia and high restrictive eating for nearly three years now... I'm pretty young, and have already expirenced multiple ER trips along with being admitted into the hospital for a few times. My ED gave me permanent GI issues including my kidney being very damaged / nearly failing on several occasions. Wouldn't wish the physical and mental pain caused by eating disorders on anyone.... ",False,False
edijrjv,t3_adk8lt,t3_adk8lt,MeccaToast,1,2019-01-07 16:39:43,/r/EDAnonymous/comments/adk8lt/dealing_with_the_consequences_of_ed/edijrjv/,"My recovery is going really well. I started purging when I was 12, I’m 30 and pregnant with my first child now and while I have a handle on the b/p urges the body dysmorphia and hate is alive and well. The self hate required to shove my fingers down my throat is mind boggling. This isn’t glamorous it’s not beautiful. It’s disgusting and painful and no matter how much weight you lose there is no way your mind will ever tell you you’ve lost enough, that you are good enough, that you can finally accept yourself. ",False,False
edi9zaj,t3_adk8lt,t3_adk8lt,throwawayyolonot,1,2019-01-07 15:15:55,/r/EDAnonymous/comments/adk8lt/dealing_with_the_consequences_of_ed/edi9zaj/,Oh yeah there’s so much truth in this ,False,False
edi96nx,t3_adk8lt,t3_adk8lt,thegoldengarden,1,2019-01-07 15:09:06,/r/EDAnonymous/comments/adk8lt/dealing_with_the_consequences_of_ed/edi96nx/,"I’m 17, I’ve been bulimic for a year now and honestly I deal with a lot of the consequences even after only a year  This is the differences bulimia has made: I have no control with food, I always have food on my mind, before I could eat like a normal person, my hair is thin af, it used to be so nice and thick, my cheeks are puffy, before my face was normal, I gain and lose weight all the time, before I was just a normal weight, I am extremely constipated and have digestive problems, before this bulimia I was able to eat without feeling pregnant. I always live my life around bulimia, it’s made me distant and lonely. Before bulimia I was normal. How I would so love to be normal again. ",False,False
edi0dbr,t3_adk8lt,t3_adk8lt,MythicalDisneyBitch,1,2019-01-07 13:51:30,/r/EDAnonymous/comments/adk8lt/dealing_with_the_consequences_of_ed/edi0dbr/,"It's horrible. I've had one person say to me they ""wished they were brave enough"" to purge.  I spent my whole day in the hospital after seizures, brought on by this, my teeth are ruined, my hair is horrible, my skin has given up on me, my stomach hurts, and all the other good stuff.   But, to at least one person, this self destruction is ""bravery"". ",False,False
edhrrdz,t3_adk8lt,t3_adk8lt,cleanandlovely,1,2019-01-07 12:34:59,/r/EDAnonymous/comments/adk8lt/dealing_with_the_consequences_of_ed/edhrrdz/,"Co-signed. I can't prove a definitive link back to my ED history, but I was diagnosed at age 28 with a severe GI disease. I theorize that bingeing, restricting, and using lax just destroyed my gut flora. There is no cure for my condition, now, and I'm on what amounts to chemotherapy for... as long as it works? Hoping to avoid surgery. Whoops.",False,False
