Comment ID,Link ID,Parent ID,Author,Score,Publish Date,Permalink,Text,Stickied,Is Submitter
f3i7esi,t3_dh1ook,t1_f3i499p,rubbernoodle,1,2019-10-12 21:19:12,/r/EDAnonymous/comments/dh1ook/psa_oversized_pajama_onesies_make_the_best/f3i7esi/,"I used a cat one last year! :) The best part is, unlike most other Halloween costumes, I can go to sleep in it and rewear it all the time.",False,True
f3i6tg2,t3_dh1ook,t1_f3hh7o5,rubbernoodle,1,2019-10-12 21:15:54,/r/EDAnonymous/comments/dh1ook/psa_oversized_pajama_onesies_make_the_best/f3i6tg2/,I got my usual size and it fits like it’s two sizes too big. The one I got was this one: https://www.amazon.com/dp/B01DZLAQHW/ref=cm_sw_r_cp_awdb_t1_CHOODb7AMT7HJ  There are a bunch of other ones in a similar style (so baggy the crotch hangs almost down to the knees) under “sponsored products related to this item.”,False,True
f3i5p6t,t3_dh1ook,t1_f3hemqm,rubbernoodle,1,2019-10-12 21:09:22,/r/EDAnonymous/comments/dh1ook/psa_oversized_pajama_onesies_make_the_best/f3i5p6t/,This is brilliant.,False,True
f3i499p,t3_dh1ook,t3_dh1ook,thestarxvii,1,2019-10-12 21:01:02,/r/EDAnonymous/comments/dh1ook/psa_oversized_pajama_onesies_make_the_best/f3i499p/,I’m literally doing this this Halloween. Got a kitty onesie and It’s huge on me which is exactly what I wanted.,False,False
f3hh7o5,t3_dh1ook,t3_dh1ook,HarryHardying,1,2019-10-12 18:40:44,/r/EDAnonymous/comments/dh1ook/psa_oversized_pajama_onesies_make_the_best/f3hh7o5/,Should I get one size up or two?,False,False
f3hemqm,t3_dh1ook,t3_dh1ook,skelekey,1,2019-10-12 18:23:17,/r/EDAnonymous/comments/dh1ook/psa_oversized_pajama_onesies_make_the_best/f3hemqm/,"Last year I wore a cow onesie, put my hair up in two buns and said I was a hamburger bun 😂",False,False
