Comment ID,Link ID,Parent ID,Author,Score,Publish Date,Permalink,Text,Stickied,Is Submitter
f40rqvy,t3_digr53,t1_f3whlv1,BEDBulimic,1,2019-10-17 04:56:51,/r/EDAnonymous/comments/digr53/having_adhd_and_an_is_a_wild_fucking_ride/f40rqvy/,Please don't consider abusing prescription meds for weight loss.,False,False
f3wxmcv,t3_digr53,t1_f3whlv1,Panda_Melody,1,2019-10-16 06:35:35,/r/EDAnonymous/comments/digr53/having_adhd_and_an_is_a_wild_fucking_ride/f3wxmcv/,Ya. I basically just binge if I don’t take it,False,True
f3whlv1,t3_digr53,t1_f3vvhre,sadmoonchild98,1,2019-10-16 00:13:48,/r/EDAnonymous/comments/digr53/having_adhd_and_an_is_a_wild_fucking_ride/f3whlv1/,has adderall helped you lose weight?,False,False
f3vvhre,t3_digr53,t1_f3vt5o1,Panda_Melody,1,2019-10-15 19:29:28,/r/EDAnonymous/comments/digr53/having_adhd_and_an_is_a_wild_fucking_ride/f3vvhre/,It’s a fb page. Adhd alien.  Super funny. Super callin my ass out lol   My drs are super stupid and desptie me gaining and losing the same like 20-30 lbs they just keep writing me scripts lol,False,True
f3vt5o1,t3_digr53,t1_f3vsf3i,not_the_cicada,1,2019-10-15 19:03:05,/r/EDAnonymous/comments/digr53/having_adhd_and_an_is_a_wild_fucking_ride/f3vt5o1/,"NO WHAT ARE THEY????  I have an appointment with my psych to discuss meds next week and THANK FUCKING GOD it’s not in person, I think I’ve lost enough weight it might be alarming? 😬",False,False
f3vsf3i,t3_digr53,t1_f3vscfg,Panda_Melody,1,2019-10-15 18:54:30,/r/EDAnonymous/comments/digr53/having_adhd_and_an_is_a_wild_fucking_ride/f3vsf3i/,Exactly. Have you seen the ADHD alien comics? Cause I just obsessively read through all of them. And feel called the fuck out.,False,True
f3vscfg,t3_digr53,t3_digr53,not_the_cicada,1,2019-10-15 18:53:38,/r/EDAnonymous/comments/digr53/having_adhd_and_an_is_a_wild_fucking_ride/f3vscfg/,Fuck I never really thought about this. Yikes.   Plussssssssss Adderall and appetite aren’t best friends...,False,False
