Comment ID,Link ID,Parent ID,Author,Score,Publish Date,Permalink,Text,Stickied,Is Submitter
f6hcf2w,t3_dqvqrb,t1_f6hccqz,Ilovebigkitties,2,2019-11-03 22:48:52,/r/EDAnonymous/comments/dqvqrb/andnow_i_know_my_true_form/f6hcf2w/,I did the same thing this summer. I literally forced myself to eat a bunch just so that I could get “rid” of it.,False,True
f6hccqz,t3_dqvqrb,t3_dqvqrb,bumbumboleji,1,2019-11-03 22:47:49,/r/EDAnonymous/comments/dqvqrb/andnow_i_know_my_true_form/f6hccqz/,"The number of times I’ve looked at bread in the supermarket and said NO very loudly internally to myself, because I know I will crack and eat it all, or nothing but bread. I miss bread but honestly I just can’t 😕 when I do buy it it ends in a mess",False,False
f6fbt0o,t3_dqvqrb,t1_f6fa13e,Ilovebigkitties,2,2019-11-03 14:23:54,/r/EDAnonymous/comments/dqvqrb/andnow_i_know_my_true_form/f6fbt0o/,Thanks! It’s not just me then 😅,False,True
f6fa13e,t3_dqvqrb,t3_dqvqrb,zeerega,2,2019-11-03 14:15:17,/r/EDAnonymous/comments/dqvqrb/andnow_i_know_my_true_form/f6fa13e/,I relate to this so much :( -hugs-,False,False
f6d2o53,t3_dqvqrb,t1_f6ao3vz,Ilovebigkitties,1,2019-11-03 08:20:40,/r/EDAnonymous/comments/dqvqrb/andnow_i_know_my_true_form/f6d2o53/,Yeah it’s similar with me,False,True
f6ao3vz,t3_dqvqrb,t3_dqvqrb,aqua_sea,3,2019-11-03 00:43:07,/r/EDAnonymous/comments/dqvqrb/andnow_i_know_my_true_form/f6ao3vz/,I’ve learned I can’t buy value/multi packs of literally anything ever because I WILL get stressed by the number left and then decide that eating them all is a good way to eliminate said stress and hahah WHY AM I LIKE THIS,False,False
