Comment ID,Link ID,Parent ID,Author,Score,Publish Date,Permalink,Text,Stickied,Is Submitter
f5tmgob,t3_dp936z,t3_dp936z,relativelyinsanee,1,2019-10-30 13:48:03,/r/EDAnonymous/comments/dp936z/skinny_but_only_in_picureson_camera/f5tmgob/,"agreed. it's SUPPOSED to be the opposite because in mirrors your brain gets used to the image and fills in the blanks, so you look more attractive to yourself in mirrors than you do irl, but i just look like an ogre in mirrors, so i hate taking pictures. then when someone snaps a picture of me without noticing, i realize, oh, i actually kind of like this one...",False,False
f5tlbb0,t3_dp936z,t3_dp936z,muddy-palms,1,2019-10-30 13:40:20,/r/EDAnonymous/comments/dp936z/skinny_but_only_in_picureson_camera/f5tlbb0/,(chanting) Same brain! Same brain!,False,False
f5tg1re,t3_dp936z,t3_dp936z,DivaHustlerPrincess,1,2019-10-30 12:50:23,/r/EDAnonymous/comments/dp936z/skinny_but_only_in_picureson_camera/f5tg1re/, ME,False,False
f5tcgs3,t3_dp936z,t3_dp936z,Lewdiful,1,2019-10-30 12:11:14,/r/EDAnonymous/comments/dp936z/skinny_but_only_in_picureson_camera/f5tcgs3/,"Nopee, only the opposite...  I look in the mirror and think, ""hey, I'm not looking so much like an ogre today""  But open up the camera and I see myself looking like 400 pounds, it's a bitch.",False,False
f5tbl77,t3_dp936z,t3_dp936z,dumbitch1312,1,2019-10-30 12:00:44,/r/EDAnonymous/comments/dp936z/skinny_but_only_in_picureson_camera/f5tbl77/,me but the opposite,False,False
f5tbevi,t3_dp936z,t3_dp936z,livipup,1,2019-10-30 11:58:39,/r/EDAnonymous/comments/dp936z/skinny_but_only_in_picureson_camera/f5tbevi/,"I have the opposite problem. I feel like I look great in person, but in pictures I look awful. I feel like I look wider and features don't look as soft.",False,False
f5t9jgp,t3_dp936z,t3_dp936z,u-w-a,1,2019-10-30 11:37:23,/r/EDAnonymous/comments/dp936z/skinny_but_only_in_picureson_camera/f5t9jgp/,it’s a bit different but one time I passed out on a bus and was really happy about it?? like yay my body is finally failing so I’m winning lmao,False,False
f5t8t9v,t3_dp936z,t3_dp936z,sipapito,1,2019-10-30 11:29:35,/r/EDAnonymous/comments/dp936z/skinny_but_only_in_picureson_camera/f5t8t9v/,"I definitely have this. I look down at my body? Huge. Mirror? Huge. Picture? Oh uhhhh is that.. me. Video? Ok I guess like maybe I'm smaller cause the angle or something?   It really fucks with me, it's honestly startling to see yourself how probably others see you!",False,False
