Comment ID,Link ID,Parent ID,Author,Score,Publish Date,Permalink,Text,Stickied,Is Submitter
f84d7w9,t3_dyt52l,t3_dyt52l,TbhIdekMyName,1,2019-11-20 03:30:33,/r/EDAnonymous/comments/dyt52l/dae_constantly_feel_like_theres_hidden_calories/f84d7w9/,"""It's probably wrong so I'll add 200 calories to be safe""",False,False
f849gvq,t3_dyt52l,t3_dyt52l,jendestiny114,1,2019-11-20 01:57:56,/r/EDAnonymous/comments/dyt52l/dae_constantly_feel_like_theres_hidden_calories/f849gvq/,This is me. I drink a flavored sparkling water and each time I have one I instinctively go to log it before I realize there’s nothing to log💀💀  (I still log it anyway),False,False
f83xeuw,t3_dyt52l,t3_dyt52l,Nude-prude,1,2019-11-19 22:20:56,/r/EDAnonymous/comments/dyt52l/dae_constantly_feel_like_theres_hidden_calories/f83xeuw/,YES!!,False,False
f83ohgf,t3_dyt52l,t3_dyt52l,katie23535,1,2019-11-19 20:26:45,/r/EDAnonymous/comments/dyt52l/dae_constantly_feel_like_theres_hidden_calories/f83ohgf/,"This is a big one for me, I always count a gram over to make sure i'm accounting for everything, but sometimes it just seems like there's no way it's that few calories and I log an extra 20 or 30 or 50 cuz my brain tells me there's just no way",False,False
f83nki5,t3_dyt52l,t3_dyt52l,iampieman,1,2019-11-19 20:15:27,/r/EDAnonymous/comments/dyt52l/dae_constantly_feel_like_theres_hidden_calories/f83nki5/,YES,False,False
f83mo2y,t3_dyt52l,t3_dyt52l,mud_octopus,1,2019-11-19 20:04:28,/r/EDAnonymous/comments/dyt52l/dae_constantly_feel_like_theres_hidden_calories/f83mo2y/,"I will compulsively check my fitness pal some days, over and over, to reassure myself that I logged everything I ate, because I'm worried I forgot something and my total is higher -_-.",False,False
f83fv40,t3_dyt52l,t3_dyt52l,thefakemexoxo,1,2019-11-19 18:53:29,/r/EDAnonymous/comments/dyt52l/dae_constantly_feel_like_theres_hidden_calories/f83fv40/,I fed my dog some peanut butter earlier and I licked the spoon for putting it in the dishwasher and then immediately panicked And washed my tongue off 😂,False,False
f83de5q,t3_dyt52l,t3_dyt52l,BipolarSkeleton,1,2019-11-19 18:28:00,/r/EDAnonymous/comments/dyt52l/dae_constantly_feel_like_theres_hidden_calories/f83de5q/,I recount the calories for them   Fat times 9  Carbs times 4  Protein times 4  To get the correct calorie count it’s alway height by a few if not more I don’t trust them,False,False
f839ot8,t3_dyt52l,t3_dyt52l,bir_die,1,2019-11-19 17:49:51,/r/EDAnonymous/comments/dyt52l/dae_constantly_feel_like_theres_hidden_calories/f839ot8/,"Yeah that’s why when I record calories I’ll go with the highest calorie option or I’ll just overestimate serving sizes (2/3rds instead of 1/2, etc)   I don’t weigh stuff out but if I did I’d round up to the nearest hundredth probably lol",False,False
f839j2a,t3_dyt52l,t3_dyt52l,lauryleah,1,2019-11-19 17:48:12,/r/EDAnonymous/comments/dyt52l/dae_constantly_feel_like_theres_hidden_calories/f839j2a/,**a l w a y s**,False,False
