Comment ID,Link ID,Parent ID,Author,Score,Publish Date,Permalink,Text,Stickied,Is Submitter
fevcdkg,t3_eqhys1,t3_eqhys1,FuzzyNumNums,1,2020-01-18 19:02:38,/r/EDAnonymous/comments/eqhys1/is_anyone_really_annoyed_when_you_see_the_fit/fevcdkg/,"I either look at them and get jealous that they can eat like that, or get grossed out and start thinking about how they will eventually regret the way they eat when they gain weight.   Skinny people barely eating just reminds me that barely eating is how you stay skinny. Kind of like how you don’t stay rich if you spend all your money.",False,False
fetvc6q,t3_eqhys1,t1_fetjzay,goldenmantella,1,2020-01-18 14:47:04,/r/EDAnonymous/comments/eqhys1/is_anyone_really_annoyed_when_you_see_the_fit/fetvc6q/,"Yeah, you never know.",False,False
fetjzay,t3_eqhys1,t1_fespq4m,chloesmiddlefinger,2,2020-01-18 13:36:21,/r/EDAnonymous/comments/eqhys1/is_anyone_really_annoyed_when_you_see_the_fit/fetjzay/,Maybe they're doing the exact same thing.,False,False
fespq4m,t3_eqhys1,t1_fesa1bb,goldenmantella,4,2020-01-18 11:15:20,/r/EDAnonymous/comments/eqhys1/is_anyone_really_annoyed_when_you_see_the_fit/fespq4m/,"Yeah... personally, I'm more triggered by very fit, skinny people just picking at their food in public (like little dry salads) because I then feel a need to compete with them... like I can do ""better"" than that.",False,False
fesjpy8,t3_eqhys1,t3_eqhys1,bailsforreal,1,2020-01-18 10:45:16,/r/EDAnonymous/comments/eqhys1/is_anyone_really_annoyed_when_you_see_the_fit/fesjpy8/,Extremely,False,False
fesa1bb,t3_eqhys1,t3_eqhys1,Actualhumandisaster,1,2020-01-18 09:58:11,/r/EDAnonymous/comments/eqhys1/is_anyone_really_annoyed_when_you_see_the_fit/fesa1bb/,"Maybe they eat normally in public to appear fine.  Or that's the only time they're going to eat that day.  I eat normally in public, but restrict heavily when I'm alone.",False,False
