Comment ID,Link ID,Parent ID,Author,Score,Publish Date,Permalink,Text,Stickied,Is Submitter
e9uo7e3,t3_9xoztk,t1_e9ua9ng,gigi-has-issues,1,2018-11-16 18:29:46,/r/EDAnonymous/comments/9xoztk/we_have_been_contacted_by_reddit_admin/e9uo7e3/,"I think we can only have 2 stickied posts so for the foreseeable future it will be 1) recovery resources and 2) rules, I’ll include harm reduction in the recovery post. ",False,True
e9uo1vh,t3_9xoztk,t1_e9uhkmu,NeutralSmithHotel,1,2018-11-16 18:27:28,/r/EDAnonymous/comments/9xoztk/we_have_been_contacted_by_reddit_admin/e9uo1vh/,"I hope that we can keep the spirit of Pro-ED alive either way.  Honestly this summer when I was fully into my ED it was the only place I could go and feel heard. I'm now in recovery, but I would not have gotten there without being able to be open about the stuff I was going through. I hope reddit can realize how important this space is. ",False,False
e9un4sq,t3_9xoztk,t1_e9ueh33,HouseBoIton,1,2018-11-16 18:13:48,/r/EDAnonymous/comments/9xoztk/we_have_been_contacted_by_reddit_admin/e9un4sq/,"In the future we should definitely consider it, but for now we should leave it open to allow time for the rest of the community to find us. Maybe give it a month? I'm sure most active members will find us within that timeframe. ",False,False
e9un1jo,t3_9xoztk,t1_e9uepyh,SnowballMoon,1,2018-11-16 18:12:29,/r/EDAnonymous/comments/9xoztk/we_have_been_contacted_by_reddit_admin/e9un1jo/,"Yeah, I was thinking the same thing. If someone posts about being happy they gained, you'd assume that's a good thing. If someone says they're happy they lost weight, what's an appropriate response? I guess they'd have to clarify whether they've gotten closer to a healthier weight, um, healthily?",False,False
e9umxbb,t3_9xoztk,t1_e9uiews,morose_adipose,1,2018-11-16 18:10:46,/r/EDAnonymous/comments/9xoztk/we_have_been_contacted_by_reddit_admin/e9umxbb/,"Yeah I mean I can go to a certain sub and find out how much OTC cough syrup to take to get high but just be careful with a meme about weight loss because someone might ""catch"" an ED..😒 ",False,False
e9umtvz,t3_9xoztk,t1_e9umm8m,gigi-has-issues,1,2018-11-16 18:09:20,/r/EDAnonymous/comments/9xoztk/we_have_been_contacted_by_reddit_admin/e9umtvz/,Agree and I’m also going on peach 🍑 We are misunderstood. I’ll add you on peach ! ,False,True
e9umm8m,t3_9xoztk,t3_9xoztk,morose_adipose,1,2018-11-16 18:06:14,/r/EDAnonymous/comments/9xoztk/we_have_been_contacted_by_reddit_admin/e9umm8m/,"While I'm ""happy"" they're allowing this sub to stay (for now) I no longer trust Reddit and I don't think I can forgive them removing a network of support for almost 40k people under the guise of ""our wellbeing."" The fuck outta here with that. I hate to say it but I think I want to avoid Reddit for a while and try to make Peach work (I'm there with this same name of anyone wants to find me). I just don't handle change well and I don't know what I'm doing right now. 😞",False,False
e9ul5hs,t3_9xoztk,t1_e9uks8v,gigi-has-issues,1,2018-11-16 17:45:23,/r/EDAnonymous/comments/9xoztk/we_have_been_contacted_by_reddit_admin/e9ul5hs/,We are indeed staying public. Going private won't help because we are already on their radar and they can see private subs anyway. ,False,True
e9ul38t,t3_9xoztk,t1_e9ukmi4,gigi-has-issues,1,2018-11-16 17:44:32,/r/EDAnonymous/comments/9xoztk/we_have_been_contacted_by_reddit_admin/e9ul38t/,"They did. It's not a secret. I posted the message mods were sent on my peach (username: gigihasissues).  They said they ""encouraged"" us to post it and not to make any rules discouraging treatment.  I don't want to endanger an entire community because we refuse to do so. ",False,True
e9uks8v,t3_9xoztk,t3_9xoztk,kalianda,1,2018-11-16 17:40:20,/r/EDAnonymous/comments/9xoztk/we_have_been_contacted_by_reddit_admin/e9uks8v/,I vote public because I would not have been able to find this group if the first one had been private. ,False,False
e9ukmi4,t3_9xoztk,t3_9xoztk,Rosietaylo,1,2018-11-16 17:38:14,/r/EDAnonymous/comments/9xoztk/we_have_been_contacted_by_reddit_admin/e9ukmi4/,bet the admins told them to encourage us to visit that website,False,False
e9ukhpt,t3_9xoztk,t1_e9uk93m,gigi-has-issues,1,2018-11-16 17:36:27,/r/EDAnonymous/comments/9xoztk/we_have_been_contacted_by_reddit_admin/e9ukhpt/,Thanks!! Will add! ,False,True
e9uk93m,t3_9xoztk,t3_9xoztk,trashy_panda,1,2018-11-16 17:33:16,/r/EDAnonymous/comments/9xoztk/we_have_been_contacted_by_reddit_admin/e9uk93m/,"For Australia:   The Butterfly Foundation National Helpline 1800 33 4673  They also have online chat support, [https://thebutterflyfoundation.org.au/our-services/helpline/chat-online/](https://thebutterflyfoundation.org.au/our-services/helpline/chat-online/), which I've used before and would recommend! [",False,False
e9uj5jr,t3_9xoztk,t1_e9ueh33,_BoogieDown,1,2018-11-16 17:19:29,/r/EDAnonymous/comments/9xoztk/we_have_been_contacted_by_reddit_admin/e9uj5jr/,That would be awesome ,False,False
e9uix7e,t3_9xoztk,t1_e9ufen3,gigi-has-issues,1,2018-11-16 17:16:37,/r/EDAnonymous/comments/9xoztk/we_have_been_contacted_by_reddit_admin/e9uix7e/,"This is definitely a fair thing to bring up.  I don't have the answers right now.  I was basically just another r/proED user who happened to become a mod of this sub due to my frequent shitposting on the old one. I am just trying to figure out how to maintain a community that has helped literally thousands of people in pain and keep it from disappearing. For what it's worth, proED helped me stop purging several times a day. I am now below the diagnostic threshold for bulimia. I am currently restricting but trying to do so while maintaining my health as much as possible. To assuage any fears, this isn't becoming a recovery sub although I want to encourage the people who want that to seek it. None of the mods are in recovery at the moment. We are just going to do our best to be vigilant about the 'culture' we are creating.  ",False,True
e9uisjy,t3_9xoztk,t1_e9ui5ti,tcs_hearts,1,2018-11-16 17:15:01,/r/EDAnonymous/comments/9xoztk/we_have_been_contacted_by_reddit_admin/e9uisjy/,"Honestly, I trust you and believe you. It's just very hard to not get paranoid right now. I just need a support community, and I trust that y'all want to make this similar to ProED. Just, ever since the ban, I've felt like I'm being aggressively pushed towards recover and I don't like it. I trust our mods though, mostly just personal paranoia.",False,False
e9uikdb,t3_9xoztk,t3_9xoztk,tseokii,1,2018-11-16 17:12:13,/r/EDAnonymous/comments/9xoztk/we_have_been_contacted_by_reddit_admin/e9uikdb/,"i guess the issue boiled down to the name then. I'm not defending the decision to ban proED because it was a fantastic sub... but it was called proED.  it was misleading, if nothing else.",False,False
e9uiews,t3_9xoztk,t3_9xoztk,fastingfrycook,1,2018-11-16 17:10:19,/r/EDAnonymous/comments/9xoztk/we_have_been_contacted_by_reddit_admin/e9uiews/,We gotta slap a surgeon general's warning on all our memes,False,False
e9ui5ti,t3_9xoztk,t1_e9uf7z2,gigi-has-issues,1,2018-11-16 17:07:09,/r/EDAnonymous/comments/9xoztk/we_have_been_contacted_by_reddit_admin/e9ui5ti/,"Mod/OP here.  We are not becoming a recovery sub. For one, I don't think any of the mods are in recovery. We are definitely going to have information about recovery very accessible. On my peach I posted the message I received from Reddit admin (peach username: gigihasissues).  It basically just said not to have anything problematic like a rule discouraging seeking treatment and that they wanted us to have the recovery info front and center.  We have to be aware of how we are perceived right now. I understand the concern. We are not going to tell you how to live your life and we plan mainly to be a subreddit to commiserate. Most people here don't need 'tips' anyway.  In my personal experience, most of proED was just pure support and we will maintain that. I welcome any input about things you are scared will be eliminated so that we can address it.  ",False,True
e9ui0xs,t3_9xoztk,t1_e9uhkmu,BEDBulimic,1,2018-11-16 17:05:24,/r/EDAnonymous/comments/9xoztk/we_have_been_contacted_by_reddit_admin/e9ui0xs/,"Yeah agreed, to be fair, when I talked with the mods at r/madeofstyrofoam, they already said that going private wouldn’t help and probably make the admins more wary. The only reason we’d go private at this point is to avoid nasty people, but I feel like it’s manageable with good modding. Just wanted to throw it to the crowd and make it a unanimous decision, so people aren’t left wondering why we’ve abandoned going private. :)",False,False
e9uhkmu,t3_9xoztk,t1_e9ueh33,gigi-has-issues,1,2018-11-16 16:59:24,/r/EDAnonymous/comments/9xoztk/we_have_been_contacted_by_reddit_admin/e9uhkmu/,"Gigi here. Admin can even read your private messages (srs), so going private isn't going to help much. We are already on their radar.  Going private doesn't hide us from them.  I think the best thing is to understand optics are *extremely* important right now and to recognize that our long term viability is dependent on us to make sure we make it clear we are not promoting EDs. I know it sucks that we aren't understood. This is not becoming a recovery subreddit either.  But if we want to be left alone, we have to play by their rules. ",False,True
e9uheo5,t3_9xoztk,t1_e9ueh33,tornessa,1,2018-11-16 16:57:13,/r/EDAnonymous/comments/9xoztk/we_have_been_contacted_by_reddit_admin/e9uheo5/,"I would suggest not going private. For new people, it is so rare to find a place like this on the internet.",False,False
e9ugxj4,t3_9xoztk,t1_e9ueh33,agent_philcoulson,1,2018-11-16 16:51:00,/r/EDAnonymous/comments/9xoztk/we_have_been_contacted_by_reddit_admin/e9ugxj4/,"I think as long as the mod teams keeps up with the que, we can handle the skeeves and trolls. Just have to use the report button. ",False,False
e9ugt9i,t3_9xoztk,t1_e9ueh33,picalowpiepi,1,2018-11-16 16:49:26,/r/EDAnonymous/comments/9xoztk/we_have_been_contacted_by_reddit_admin/e9ugt9i/,"I'd like to go private, but wish for it to stay open for a longer time so more people can find this sub.",False,False
e9ufen3,t3_9xoztk,t1_e9uel9l,GimmeYourHands,1,2018-11-16 16:30:16,/r/EDAnonymous/comments/9xoztk/we_have_been_contacted_by_reddit_admin/e9ufen3/,"I think we’ll probably need extreme specifics. Let’s say they say we can’t offer advice that would further someone’s ED or is harmful.  Does advice on tooth care after purging encourage people to hide their EDs? What about advice on how to silently purge?   So advice on hiding your ED might be considered giving advice to childrenti hide from their parents, but what about the hundreds of adults here who need to be under the radar at work or around colleagues for fear of repercussions to their livelyhood?   I’m just saying that what the admins deem “dangerous advice” could be necessary life saving advice in the hands of someone else.",False,False
e9ufagm,t3_9xoztk,t1_e9ue4fg,eternalcoffeebreak,1,2018-11-16 16:28:43,/r/EDAnonymous/comments/9xoztk/we_have_been_contacted_by_reddit_admin/e9ufagm/,"This is the sort of thing that concerns me about the “compromise” they’ve given us. If we have to worry about how our sub looks to “outsiders” then so much positive information is going to be off limits. How do you know what a non disordered person is going to see as glorifying EDs? This was not a “tipz &amp; trickz” sub.. now we have to censor our struggles and support even more, which in my mind means you kind of have to gloss over what makes an ED awful, which sounds a lot like glorifying EDs. I get the intent, and I’m glad they’re willing to “compromise” but I really feel like this whole situation was a lack of understanding or desire to understand what we’re actually about. How would the admins, who presumably don’t have EDs, determine what may or may not be interpreted as harmful advice? I really think this has little to do with positive intentions and everything to do with cleaning up for advertisers. This kind of reaffirms that for me actually.",False,False
e9uf7z2,t3_9xoztk,t3_9xoztk,tcs_hearts,1,2018-11-16 16:27:51,/r/EDAnonymous/comments/9xoztk/we_have_been_contacted_by_reddit_admin/e9uf7z2/,"I have a bad, sinking feeling that this is about to become a recovery sub...",False,False
e9uevh7,t3_9xoztk,t3_9xoztk,HouseBoIton,1,2018-11-16 16:23:26,/r/EDAnonymous/comments/9xoztk/we_have_been_contacted_by_reddit_admin/e9uevh7/,I'm glad it'll remain up but it's a shame what happened to the other subs. I wish they provided us with a warning at least. All we can do is not make the same mistake again.,False,False
e9uepyh,t3_9xoztk,t1_e9u5xvg,MaddieLionJones,1,2018-11-16 16:21:29,/r/EDAnonymous/comments/9xoztk/we_have_been_contacted_by_reddit_admin/e9uepyh/,"The thing I don’t understand about posting weight loss as “progress” is it totally negates someone with BED binging less and possibly having healthier eating habits.  This isn’t really directed at you, just a general statement. Sorry if I seem salty, I am, but not towards you. I’ve seen the post you’re mentioning and comments saying that as well and it just doesn’t make sense to me.  It’s like people believe ED only make you thin.",False,False
e9uel9l,t3_9xoztk,t1_e9ue4fg,gigi-has-issues,1,2018-11-16 16:19:50,/r/EDAnonymous/comments/9xoztk/we_have_been_contacted_by_reddit_admin/e9uel9l/,I mean we can’t give advice for fooling doctors or recommend appetite suppressants. Talking harm reduction for ephedrine? Ok. Telling someone to try it to lose weight? Prob not ok. I’ll be more detailed in the coming days. ,False,True
e9ueh33,t3_9xoztk,t3_9xoztk,BEDBulimic,1,2018-11-16 16:18:21,/r/EDAnonymous/comments/9xoztk/we_have_been_contacted_by_reddit_admin/e9ueh33/,"Can I have a show of hands of what people think regarding whether to go private?  Pros: avoid skeeves and trolls  Cons: takes a LOT of manpower to transition, admins already know about us, harder for other lost ED folk to find the sub.  ",False,False
e9ue4fg,t3_9xoztk,t3_9xoztk,GimmeYourHands,1,2018-11-16 16:13:43,/r/EDAnonymous/comments/9xoztk/we_have_been_contacted_by_reddit_admin/e9ue4fg/,We can’t “give advice”? That’s just..... nonsense. The whole point of a support group is harm reduction. How exactly can we achieve that without offering advice?   Can we not provide folks with food advice for low cal options when they go out or go to places like Starbucks? (When the alternative would likely be self-isolation)  Can we not suggest to people how to deal with eating around thanksgiving or with their significant other? (Pieces of information that have helped me avoid panic attacks or blowing up my relationship.)    ,False,False
e9uditf,t3_9xoztk,t1_e9u41w0,portodhamma,1,2018-11-16 16:05:59,/r/EDAnonymous/comments/9xoztk/we_have_been_contacted_by_reddit_admin/e9uditf/,"To be fair the goals and current weight flair were kind of bad, as were the posts about making weight",False,False
e9udb6j,t3_9xoztk,t1_e9tzy9d,paavanilla,1,2018-11-16 16:03:18,/r/EDAnonymous/comments/9xoztk/we_have_been_contacted_by_reddit_admin/e9udb6j/,oh my god I love that analogy,False,False
e9ub1ns,t3_9xoztk,t3_9xoztk,number1wifey,1,2018-11-16 15:35:07,/r/EDAnonymous/comments/9xoztk/we_have_been_contacted_by_reddit_admin/e9ub1ns/,Would they be willing to let the old sub come back with a new name and stricter rules? So much archives stuff just gone!!,False,False
e9ualjh,t3_9xoztk,t1_e9u9zxr,gigi-has-issues,1,2018-11-16 15:29:23,/r/EDAnonymous/comments/9xoztk/we_have_been_contacted_by_reddit_admin/e9ualjh/,"No, bc they are aware of our sub already. We are just going to be really focused and clear this is a support group and try to minimize any perception we are encouraging EDs. ",False,True
e9ua9ng,t3_9xoztk,t3_9xoztk,HitchHikeHawk,1,2018-11-16 15:25:12,/r/EDAnonymous/comments/9xoztk/we_have_been_contacted_by_reddit_admin/e9ua9ng/,"Hi, you may have seen my post, but I think it would be helpful to have tips for harm reduction stickied, nothing on how to do it.",False,False
e9u9zxr,t3_9xoztk,t3_9xoztk,plaidbluejammies,1,2018-11-16 15:21:45,/r/EDAnonymous/comments/9xoztk/we_have_been_contacted_by_reddit_admin/e9u9zxr/,Is the sub still going private then? I commented requesting to be added but haven’t been approved yet. V v nervous because I can’t lose you guys!,False,False
e9u90f3,t3_9xoztk,t1_e9u8j1q,gigi-has-issues,1,2018-11-16 15:08:32,/r/EDAnonymous/comments/9xoztk/we_have_been_contacted_by_reddit_admin/e9u90f3/,It’s not your fault. We didn’t realize we were at risk for being banned. It’ll be okay. 🤗,False,True
e9u8w54,t3_9xoztk,t1_e9u75vy,bluebrainbethany,1,2018-11-16 15:06:57,/r/EDAnonymous/comments/9xoztk/we_have_been_contacted_by_reddit_admin/e9u8w54/,Thank you ♥️,False,False
e9u8pg9,t3_9xoztk,t1_e9u5xvg,losingmattie,1,2018-11-16 15:04:30,/r/EDAnonymous/comments/9xoztk/we_have_been_contacted_by_reddit_admin/e9u8pg9/,"This is how I feel, too. I already feel worried about posting, because anything acknowledging the issues of any sort with eating disorders seems like admins will see it as ""glorifying""  Like we all have to be in recovery and only that, now. It's making me panic.  Plus, shouldn't the sufferers of EDs get to say what's glorifying etc? If someone without an ED browsed /proed and thought it sounded any more awesome than actual diet subs, they were already inclined towards disordered behavior. Still angry. Sorry for the novel.",False,False
e9u8j7a,t3_9xoztk,t1_e9u84uc,PinkyOutYo,1,2018-11-16 15:02:11,/r/EDAnonymous/comments/9xoztk/we_have_been_contacted_by_reddit_admin/e9u8j7a/,Perfect.,False,False
e9u8j1q,t3_9xoztk,t1_e9u4sq7,woollyshirt,1,2018-11-16 15:02:07,/r/EDAnonymous/comments/9xoztk/we_have_been_contacted_by_reddit_admin/e9u8j1q/,"I dont think any of these are unfair criticisms, honestly, and I was a mod who just stood by and let them happen. Part of it is just thinking it doesn't matter, and part of it was just thinking people would label it a recovery subreddit if i suggested removing weight flairs or stats updates and it wouldn't be popular. But if i knew the existence of the subreddit hinged on it, I definitely would've removed those things before. I'm sorry to everyone that I didn't.",False,False
e9u8cgq,t3_9xoztk,t1_e9u861t,woollyshirt,1,2018-11-16 14:59:36,/r/EDAnonymous/comments/9xoztk/we_have_been_contacted_by_reddit_admin/e9u8cgq/,&lt;3,False,False
e9u88ep,t3_9xoztk,t1_e9u856v,gigi-has-issues,1,2018-11-16 14:58:01,/r/EDAnonymous/comments/9xoztk/we_have_been_contacted_by_reddit_admin/e9u88ep/,Perfect!!!! ,False,True
e9u861t,t3_9xoztk,t1_e9u82rk,gigi-has-issues,1,2018-11-16 14:57:06,/r/EDAnonymous/comments/9xoztk/we_have_been_contacted_by_reddit_admin/e9u861t/,Agreed. I’ll contact you when we need more mods. 🤗,False,True
e9u856v,t3_9xoztk,t3_9xoztk,broketreebranch,1,2018-11-16 14:56:45,/r/EDAnonymous/comments/9xoztk/we_have_been_contacted_by_reddit_admin/e9u856v/,"I suggest [Project Heal](https://www.theprojectheal.org/), they help with scholarships for people with eating disorders who can't afford treatment.",False,False
e9u84uc,t3_9xoztk,t1_e9u2pqk,LittleBookOfSorrows,1,2018-11-16 14:56:37,/r/EDAnonymous/comments/9xoztk/we_have_been_contacted_by_reddit_admin/e9u84uc/,Can I add one?  **The Sanctuary** \-    ### 0300 003 7029  It's like the Samaritans but more geared towards MH crisis.   [https://www.selfhelpservices.org.uk/the-sanctuary/](https://www.selfhelpservices.org.uk/the-sanctuary/),False,False
e9u82rk,t3_9xoztk,t3_9xoztk,woollyshirt,1,2018-11-16 14:55:47,/r/EDAnonymous/comments/9xoztk/we_have_been_contacted_by_reddit_admin/e9u82rk/,"I really wish they did contact the proED mods about all this, because I absolutely would've been okay with implementing all those changes :/",False,False
e9u7mgd,t3_9xoztk,t1_e9u75vy,IncredibleMsDee,1,2018-11-16 14:49:31,/r/EDAnonymous/comments/9xoztk/we_have_been_contacted_by_reddit_admin/e9u7mgd/,"I understand completely - and you are right. It's hard for those on the ""outside"" to understand the complexity of these disorders and how deep they run. I totally get you're just trying to keep our community safe xxxx",False,False
e9u75vy,t3_9xoztk,t1_e9u6rdd,gigi-has-issues,1,2018-11-16 14:43:28,/r/EDAnonymous/comments/9xoztk/we_have_been_contacted_by_reddit_admin/e9u75vy/,I’ve had more than 30 fillings due to bulimia and have to use Rx toothpaste. My dental bill is thousands every year. I understand the anger and frustration with being misunderstood. I’m not here to defend banning the old subreddit. I just want to ensure this one is viable so we all still have a place to come for support. ,False,True
e9u74qu,t3_9xoztk,t1_e9u6tsb,Waterweightless,1,2018-11-16 14:43:04,/r/EDAnonymous/comments/9xoztk/we_have_been_contacted_by_reddit_admin/e9u74qu/,"That would be awesome❤️ If reddit isn't gonna do it, we are just going to have to do it ourselves.",False,False
e9u6wf3,t3_9xoztk,t1_e9u6b9c,gigi-has-issues,1,2018-11-16 14:40:11,/r/EDAnonymous/comments/9xoztk/we_have_been_contacted_by_reddit_admin/e9u6wf3/,My pleasure! Thanks so much for these resources! I'll be putting together 2 megathreads this weekend: 1 for new rules/culture/guidelines and 1 for resources. This will really help! Thanks!!,False,True
e9u6tsb,t3_9xoztk,t1_e9u5xvg,Ednosonline,1,2018-11-16 14:39:16,/r/EDAnonymous/comments/9xoztk/we_have_been_contacted_by_reddit_admin/e9u6tsb/,I can look Up Finnish webpages/numbers/centers at a later point!,False,False
e9u6rdd,t3_9xoztk,t1_e9u10pw,IncredibleMsDee,1,2018-11-16 14:38:25,/r/EDAnonymous/comments/9xoztk/we_have_been_contacted_by_reddit_admin/e9u6rdd/,GLORIFYING??!?!?!   I have to get a FREAKING molar removed from being damaged from purging (something I had shared in a number of posts)     This angers me so much. ,False,False
e9u6hab,t3_9xoztk,t1_e9u41w0,WantAPerfectSoul,1,2018-11-16 14:34:52,/r/EDAnonymous/comments/9xoztk/we_have_been_contacted_by_reddit_admin/e9u6hab/,"I know!! If I could, I'd be side-eyeing them so hard because they could have just quarantined proed while they were suggesting changes, instead of kicking up this whole clusterfuck!  But yes, focusing on the positives, I'm getting excited!",False,False
e9u6b9c,t3_9xoztk,t3_9xoztk,WantAPerfectSoul,1,2018-11-16 14:32:42,/r/EDAnonymous/comments/9xoztk/we_have_been_contacted_by_reddit_admin/e9u6b9c/,"For my Canadian homies, here is a list of Canada's ED Organizations: https://www.eatingdisorderhope.com/treatment-for-eating-disorders/international/canada/canadas-eating-disorder-organizations-charities   http://youthspace.ca/ - Online and text chat support for Canadian youth (under 30). They also have ED and other mental health resources, including by province/territory: http://youthspace.ca/resources/youthspace-resources/   I also remember one lovely person from ED posted a bunch on workbooks, which I think would be a perfect resource to sticky. I think I have the link somewhere, and I will add it when I find it.  Thanks so much for all your efforts GiGi!! U an angel 🕊",False,False
e9u5xvg,t3_9xoztk,t3_9xoztk,Waterweightless,1,2018-11-16 14:28:01,/r/EDAnonymous/comments/9xoztk/we_have_been_contacted_by_reddit_admin/e9u5xvg/,"Well I'm happy that they aren't just going to ban this sub like all the others but I must admit I'm still a bit sceptical. I'm afraid that in an attempt to get the admins of our backs,  that a lot of the ugly and more taboo sides of EDs are going to be swept under the rug. That only people actively looking for recovery are going to feel like they can share their struggles here.   As an example I just saw a post saying that we should not call weight loss ""progress"" because it's the result of a disease and I think almost everyone on here on a rational level can agree with that. But the reality of this disease is that we do see weight loss as progress and not beeing able to share that sentiment because it can be seen as ""glamourising"" EDs just feels a bit wrong to me.   I hope I'm proven though and that this place can feel just as safe and welcoming as proED did.   Also I love that reddit is only providing american resources🙃 If you're in Denmark and looking for help, you can contact Landsforeningen mod spiseforstyrelser og selvskade:+4570101818, or make an appointment with your GP to get a referal to a psychiatrist or therapist.   &amp;#x200B;",False,False
e9u5v3h,t3_9xoztk,t1_e9u556w,gigi-has-issues,1,2018-11-16 14:27:02,/r/EDAnonymous/comments/9xoztk/we_have_been_contacted_by_reddit_admin/e9u5v3h/,This is what we have to deal with now. It’s just the reality of it. Let’s make the most of it. I think 90% of the challenge is being mindful of appearances. I never was “encouraged” or triggered by proED but someone without an ED could definitely get the wrong impression by proED. For us it was obviously support and dark humor to deal with our pain but any who didn’t “get it”could have seen it as really toxic and messed up. We will hopefully make a community that is just as relatable but that is acceptable to Reddit. I miss the old sub but we have to deal with the situation we are in. I sometimes have to remind myself to see things not as setbacks but as opportunities.,False,True
e9u556w,t3_9xoztk,t3_9xoztk,plaidandsad,1,2018-11-16 14:17:55,/r/EDAnonymous/comments/9xoztk/we_have_been_contacted_by_reddit_admin/e9u556w/,admin  cops  are  bastards ,False,False
