Comment ID,Link ID,Parent ID,Author,Score,Publish Date,Permalink,Text,Stickied,Is Submitter
f7ygkhq,t3_dxszdp,t3_dxszdp,OhNoOreos,1,2019-11-18 10:31:05,/r/EDAnonymous/comments/dxszdp/does_anyone_else/f7ygkhq/,Yes my fiance thinks I'm eating normal again and I hate how selfish it is but I can't wait for my weight loss to be noticeable.,False,False
f7y2zfo,t3_dxszdp,t3_dxszdp,CrawlingUpHerLeg,1,2019-11-18 07:49:21,/r/EDAnonymous/comments/dxszdp/does_anyone_else/f7y2zfo/,"Yeah. It seems people can't have any kind of social event unless there's food involved...like, I really enjoy the company of those people but having food there makes me absolutely DREAD those events. My boyfriend keeps telling me it's fine if i ""just don't eat"" because ""no one will force me, care or notice"" even if they don't know I have and ed..and I totally get he's trying to make me feel comfortable and supported, but that's such a fucking lie/cope.  Not only would that be so rude to my friends who have kindly welcomed us into their home and cooked for everyone, it makes them and myself feel so uncomfortable and like a huge burden/waste of space.  So I just end up saying fuck it, drink like there's no tomorrow (ha i WISH) and just eat 'normally'. Then just feel like shit and restrict even more following this, until the next social gathering.",False,False
f7xzonr,t3_dxszdp,t3_dxszdp,poopybuttholeboy,1,2019-11-18 06:58:41,/r/EDAnonymous/comments/dxszdp/does_anyone_else/f7xzonr/,"Omg I wish I could do this, but I get so anxious around food (especially when it’s not prepared by me) and it becomes even worse when more people are around that I can’t eat it. But I can binge like a mofo in private...",False,False
f7xo1iu,t3_dxszdp,t3_dxszdp,skinnyguac,1,2019-11-18 02:37:54,/r/EDAnonymous/comments/dxszdp/does_anyone_else/f7xo1iu/,"I always try looking up menus for places ahead of time whenever possible, and keep a list of a couple generally  lighter options for each type of cuisine if it’s not.",False,False
f7xljpv,t3_dxszdp,t3_dxszdp,Sushisnac,1,2019-11-18 01:39:49,/r/EDAnonymous/comments/dxszdp/does_anyone_else/f7xljpv/,Yes! I restrict every day so when I go out and have a night out and we end up consuming 3 cran vodkas and 2 slices of pizza at 3 am (re: me last night) i can laugh and be like “i guess ive been working out a bit”. Also on date nights my bf loves food and we always end up eating some gourmet stuff I don’t want to spoil that moment so I accomodate it.,False,False
f7xb1wh,t3_dxszdp,t3_dxszdp,teaandblackink,2,2019-11-17 22:28:19,/r/EDAnonymous/comments/dxszdp/does_anyone_else/f7xb1wh/,"I sometimes make up excuses. Like if someone texts our group chat wanting to get dinner I'll say something along the lines of 'I actually just ate, but I'll still come out for a drink or meet up later'. It makes it so I don't have to sacrifice my social life just because it involves food but I'm not pressured to eat.",False,False
f7x42c8,t3_dxszdp,t3_dxszdp,sharongrace_,2,2019-11-17 20:55:01,/r/EDAnonymous/comments/dxszdp/does_anyone_else/f7x42c8/,"I do this so much. It's weird, because I try so hard to seem normal, and I generally order what everyone else does, but I feel as though I'm ""cheating"" on my ED, so to make up for it I usually eat my meal in disordered ways (certain ways of cutting food, chewing, picking, ect) Its really rough when you want nothing more than to not care about food as much as you do",False,False
f7x04tj,t3_dxszdp,t3_dxszdp,hollyxdear,2,2019-11-17 20:05:28,/r/EDAnonymous/comments/dxszdp/does_anyone_else/f7x04tj/,I did that the last two days because I was on a choir trip and they already give me crap about not eating enough so I tried to keep up with how often they eat and I’m so bloated and tired now.,False,False
f7wytl2,t3_dxszdp,t3_dxszdp,moiramaples,2,2019-11-17 19:48:47,/r/EDAnonymous/comments/dxszdp/does_anyone_else/f7wytl2/,I don’t just bc if I’m gonna eat I want to ENJOY it. Not eat in the bg while having a conversation or whatever and stressing about being watched.,False,False
f7wfys7,t3_dxszdp,t3_dxszdp,babyfaced-bitch,7,2019-11-17 17:21:29,/r/EDAnonymous/comments/dxszdp/does_anyone_else/f7wfys7/,"ALWAYS. I know I can make up for it later so I just force it and eat normally around my friends, family, &amp; SO. Then later when I’m on my own or at uni, I restrict HARD.",False,False
f7wfusu,t3_dxszdp,t3_dxszdp,hanban97,4,2019-11-17 17:20:56,/r/EDAnonymous/comments/dxszdp/does_anyone_else/f7wfusu/,"Yeah, I feel like the amount of calories I have to eat to cover up my eating disorder is less than the calories people would start making eat if they found out, so in the end, eating to ease suspicion actually = less calories overall.   Well, that’s how my brain sees it anyways.",False,False
f7wbs1i,t3_dxszdp,t3_dxszdp,spookykawaiigothgf,2,2019-11-17 17:02:20,/r/EDAnonymous/comments/dxszdp/does_anyone_else/f7wbs1i/,"Nope. I have a phobia of being seen eating in public or even purchasing food from a local store in case someone I know sees me 😂 Also eating on my own terms means I can calculate all the calories perfectly and eat my safe foods as I please so that I get enough value for my daily allowed calories, eating 300-400 calories worth of rice cakes as a lunch would look rather strange to others!....",False,False
f7wannh,t3_dxszdp,t3_dxszdp,littlelivethings,8,2019-11-17 16:56:56,/r/EDAnonymous/comments/dxszdp/does_anyone_else/f7wannh/,Yes I fast all day so I can eat a “normal” 400-600 calorie meal with my husband for dinner.,False,False
f7w8j7d,t3_dxszdp,t3_dxszdp,stripteas,5,2019-11-17 16:47:50,/r/EDAnonymous/comments/dxszdp/does_anyone_else/f7w8j7d/,Me too. I feel like so many people with EDs are trying to appear sick and I dont relate to it at all. I want to appear effortless. I always eat totally normal in front of people even tho im freaking out in my brain.,False,False
f7w7r37,t3_dxszdp,t3_dxszdp,Izzy570,3,2019-11-17 16:45:30,/r/EDAnonymous/comments/dxszdp/does_anyone_else/f7w7r37/,"I did this when my ED first developed, only my aunt noticed (I found out recently) because I was underweight but no one could say anything because I was eating normally around ppl",False,False
f7w6eez,t3_dxszdp,t3_dxszdp,CaterpillarTears,9,2019-11-17 16:39:50,/r/EDAnonymous/comments/dxszdp/does_anyone_else/f7w6eez/,Me in a nutshell. Im too scared of people knowing i have a problem and I would be lying if I said I don't enjoy eating normal. Yet the voice is still there and I feel bad for eating. It's always restricting or b/p the next day to validate my illness. Hah. Why am I like this?,False,False
f7w3pfn,t3_dxszdp,t3_dxszdp,boring-unicorn,3,2019-11-17 16:25:29,/r/EDAnonymous/comments/dxszdp/does_anyone_else/f7w3pfn/,Me! Specially around my family,False,False
f7w0qhf,t3_dxszdp,t3_dxszdp,[deleted],4,2019-11-17 16:12:20,/r/EDAnonymous/comments/dxszdp/does_anyone_else/f7w0qhf/,[deleted],False,False
f7w0ktx,t3_dxszdp,t3_dxszdp,many_mishaps_melly,13,2019-11-17 16:11:31,/r/EDAnonymous/comments/dxszdp/does_anyone_else/f7w0ktx/,Yep. Is me. Then I fee like a SUPER failure and then either binge or restrict afterwards and if it's a binge then it's even more of a fail.  So I just don't see friends as much.  Which isn't a good option tbh.,False,False
f7vtbc3,t3_dxszdp,t3_dxszdp,coolcat411,16,2019-11-17 15:40:28,/r/EDAnonymous/comments/dxszdp/does_anyone_else/f7vtbc3/,"I’ve been fluctuating in this weird not recovered but not relapsed stage, and that’s definitely what I’m doing lately. It makes me feel like a fraud!",False,False
