Comment ID,Link ID,Parent ID,Author,Score,Publish Date,Permalink,Text,Stickied,Is Submitter
fbdqk9u,t3_ecsg09,t3_ecsg09,SemicolonButterfly,1,2019-12-19 09:24:10,/r/EDAnonymous/comments/ecsg09/no_energy/fbdqk9u/,"Digesting food actually requires energy (see: thermic effect of food) so that could be part of it. At my LW sometimes I’d swear I felt colder right after eating - hypothesized my body was sending its limited resources to capture dem molecules.   When fasting, my understanding is at least in the short term the brain is releasing ‘stay awake, stay alive, catch that wildebeest!’ chemicals.",False,False
fbdp2w2,t3_ecsg09,t1_fbdf84s,lauryleah,1,2019-12-19 09:07:29,/r/EDAnonymous/comments/ecsg09/no_energy/fbdp2w2/,Yeah... :o,False,True
fbdnmy2,t3_ecsg09,t3_ecsg09,MyMeanBunny,1,2019-12-19 08:50:42,/r/EDAnonymous/comments/ecsg09/no_energy/fbdnmy2/,"Same. I could get a beautiful night’s sleep and eat a nice breakfast and I can literally feel my eyes getting heavy immediately after. No coffee wakes me up. Nothing helps except pushing through it.  Pretty sure its lack of a vitamin &amp; folic acid probably, maybe you can try that as well?",False,False
fbdlume,t3_ecsg09,t3_ecsg09,wheelsonthebusyeah,1,2019-12-19 08:29:13,/r/EDAnonymous/comments/ecsg09/no_energy/fbdlume/,Right? I either sleep for 12-18 hours straight or don't sleep at all. It's like I've forgotten how to be a normal human.,False,False
fbdf84s,t3_ecsg09,t3_ecsg09,Crotchetylilkitten,1,2019-12-19 06:57:33,/r/EDAnonymous/comments/ecsg09/no_energy/fbdf84s/,"Are you eating carb heavy foods, or large amounts of protein?",False,False
