Comment ID,Link ID,Parent ID,Author,Score,Publish Date,Permalink,Text,Stickied,Is Submitter
elm3ls2,t3_bgk3tm,t1_ellgubw,molotov-cocktail,1,2019-04-23 18:19:09,/r/EDAnonymous/comments/bgk3tm/let_me_be_immature_and_rant_about_people_flexing/elm3ls2/,tell her to buy a belt,False,False
elm25pr,t3_bgk3tm,t3_bgk3tm,thetexangypsy,1,2019-04-23 18:01:30,/r/EDAnonymous/comments/bgk3tm/let_me_be_immature_and_rant_about_people_flexing/elm25pr/,"My wife does this sometimes. She's absolutely fucking blessed (tall, size 00, and effortlessly tiny) and she bitches a lot about not being able to find jeans. And she always comments how she wants my legs. Why can't we have body part switching machines yet?!?!?",False,False
ellzcyz,t3_bgk3tm,t3_bgk3tm,peanutbutterismylife,1,2019-04-23 17:27:17,/r/EDAnonymous/comments/bgk3tm/let_me_be_immature_and_rant_about_people_flexing/ellzcyz/,"Jesus.    Sometimes I hate the fact that I work in STEM and I'm one of 2 women in my office of ~60, but then I see shit like this and thank God that most of my coworkers are overweight middle-aged men who don't pull this kind of petty BS.",False,False
ellw6x1,t3_bgk3tm,t3_bgk3tm,fat_cacao,1,2019-04-23 16:49:45,/r/EDAnonymous/comments/bgk3tm/let_me_be_immature_and_rant_about_people_flexing/ellw6x1/,"ugh I hate this, this annoying girl I know posted a snapchat talking about how hard it is for her to shop for clothes because she's a 00 &amp; the next pic was her pointing out like a plus sized petite pant with the caption ""this is the OPPOSITE of petite"" like implying it was in the wrong section. (in case you didn't know, petite means SHORT. you can be plus sized and petite). anyway, I'm sure it probably is hard for her to shop for clothes but like... you don't need to post your size on snapchat? like she's clearly trying to flex?",False,False
ellsvd7,t3_bgk3tm,t1_ellgubw,PM_ME_YER_SHIBA_INUS,1,2019-04-23 16:13:18,/r/EDAnonymous/comments/bgk3tm/let_me_be_immature_and_rant_about_people_flexing/ellsvd7/,Gotta love ye olde humblebrag from coworkers who realize they have a captive audience. 🙄,False,False
ells77r,t3_bgk3tm,t3_bgk3tm,PM_ME_YER_SHIBA_INUS,1,2019-04-23 16:05:52,/r/EDAnonymous/comments/bgk3tm/let_me_be_immature_and_rant_about_people_flexing/ells77r/,"Sometimes I just have to click out of peoples' profiles, take a deep breath, and go  ""I know you're struggling. I know you're struggling. I know this is a symptom of that. I know you're struggling. But god, did you really have to make it *contagious*?""  I have one friend who brings up weight every damn time we go see her, and I know she's been struggling with hers for years, and doesn't mean to cause stress, but...please stop.",False,False
elliawk,t3_bgk3tm,t3_bgk3tm,External_Interaction,1,2019-04-23 14:25:40,/r/EDAnonymous/comments/bgk3tm/let_me_be_immature_and_rant_about_people_flexing/elliawk/,"That's so funny, our BMIs arent even far apart (maybe 5 lbs difference)y) yet I've been imagining this girl as tiny and I'm pretty fucking thick",False,False
ellgubw,t3_bgk3tm,t3_bgk3tm,synedchdochee,1,2019-04-23 14:10:03,/r/EDAnonymous/comments/bgk3tm/let_me_be_immature_and_rant_about_people_flexing/ellgubw/,"I have a really skinny coworker who always complains about her 2 jeans falling down, constantly, and how she's trying so hard to eat more to bulk so she can build a butt at the gym to help. N I'm just like, haha yeah, relatable, that must suck, I would :) hate :) to have :) that problem :).",False,False
ellf9cp,t3_bgk3tm,t3_bgk3tm,poppybasket,1,2019-04-23 13:53:59,/r/EDAnonymous/comments/bgk3tm/let_me_be_immature_and_rant_about_people_flexing/ellf9cp/,(note that i’ll just leave here - i understand that she’s just sharing her struggles with her friends and the disordered pretext is coming only from me. she’s just being regular and my brain is making it an issue. i understand that but i’m still going to rant because it helps to put my irritation into words so i can see how irrational i’m being. in conclusion pls don’t think i’m cluelessly toxic thank u),False,True
