Comment ID,Link ID,Parent ID,Author,Score,Publish Date,Permalink,Text,Stickied,Is Submitter
ei3jp4p,t3_axkhb1,t1_ehuhe2j,PM_ME_BrusselSprouts,1,2019-03-08 15:28:53,/r/EDAnonymous/comments/axkhb1/whats_everyone_giving_up_for_lent/ei3jp4p/,Hey how's your fast going!?,False,True
ehwo119,t3_axkhb1,t1_ehwns1k,banditoindisguise,1,2019-03-06 03:53:42,/r/EDAnonymous/comments/axkhb1/whats_everyone_giving_up_for_lent/ehwo119/,Thanks.,False,False
ehwnt4d,t3_axkhb1,t1_ehvrzdo,PM_ME_BrusselSprouts,1,2019-03-06 03:46:59,/r/EDAnonymous/comments/axkhb1/whats_everyone_giving_up_for_lent/ehwnt4d/,"Thanks, I will look for this! ",False,True
ehwnslg,t3_axkhb1,t1_ehwf37a,PM_ME_BrusselSprouts,1,2019-03-06 03:46:32,/r/EDAnonymous/comments/axkhb1/whats_everyone_giving_up_for_lent/ehwnslg/,Great!!,False,True
ehwns1k,t3_axkhb1,t1_ehwf98e,PM_ME_BrusselSprouts,1,2019-03-06 03:46:02,/r/EDAnonymous/comments/axkhb1/whats_everyone_giving_up_for_lent/ehwns1k/,Happy birthday!!!,False,True
ehwf98e,t3_axkhb1,t3_axkhb1,banditoindisguise,1,2019-03-06 00:08:17,/r/EDAnonymous/comments/axkhb1/whats_everyone_giving_up_for_lent/ehwf98e/,"i'm giving up unhealthy food basically - chips, ice cream, fast food, fried food, white bread, cakes, donuts cookies, candy and chocolate.  &amp;#x200B;  also my birthday is tomorrow and my party on 18th so it means i can get out of eating shit and not be forced to have some birthday cake",False,False
ehwf37a,t3_axkhb1,t3_axkhb1,lupinustexansis,1,2019-03-06 00:05:09,/r/EDAnonymous/comments/axkhb1/whats_everyone_giving_up_for_lent/ehwf37a/,"no sugar in coffee (almond milk ok), and I'm going to commit to being vegan (been vegetarian for a while) ",False,False
ehvrzdo,t3_axkhb1,t1_ehvq9os,bhbubeepy,1,2019-03-05 18:40:20,/r/EDAnonymous/comments/axkhb1/whats_everyone_giving_up_for_lent/ehvrzdo/,"yep! i'm very pale too, but it also leaves no white cast anyway on darker skin. there's a biore one that is a bit more popular and has a nice lemony scent but sadly it completely wrecked my skin lol. the nivea one is totally scent free though!",False,False
ehvq9os,t3_axkhb1,t1_ehvpzs0,PM_ME_BrusselSprouts,1,2019-03-05 18:17:48,/r/EDAnonymous/comments/axkhb1/whats_everyone_giving_up_for_lent/ehvq9os/,"Oh wow, I never heard of this. I am very fair skinned and use 50-100+ SPF, do they make it this strong?",False,True
ehvpzs0,t3_axkhb1,t1_ehub3kx,bhbubeepy,1,2019-03-05 18:14:09,/r/EDAnonymous/comments/axkhb1/whats_everyone_giving_up_for_lent/ehvpzs0/,"you should try japanese sunscreen! the texture is nothing like american sunscreen, it feels like a light gel moisturizer and i forget i have it on as soon as it dries. i use nivea super water gel which comes in a really handy pump bottle too!",False,False
ehvk5l6,t3_axkhb1,t1_ehvk239,LolitaJane,1,2019-03-05 16:59:59,/r/EDAnonymous/comments/axkhb1/whats_everyone_giving_up_for_lent/ehvk5l6/,"No worries, I don't feel too bad about it.  If Lent helps other people manage their vices, I'm happy for them and amazed by their discipline!",False,False
ehvk4cd,t3_axkhb1,t1_ehu9abk,PM_ME_BrusselSprouts,1,2019-03-05 16:59:34,/r/EDAnonymous/comments/axkhb1/whats_everyone_giving_up_for_lent/ehvk4cd/,Yeah it's basically like PB. ,False,True
ehvk239,t3_axkhb1,t1_ehvgh91,PM_ME_BrusselSprouts,1,2019-03-05 16:58:47,/r/EDAnonymous/comments/axkhb1/whats_everyone_giving_up_for_lent/ehvk239/,I'm sorry!,False,True
ehvgh91,t3_axkhb1,t3_axkhb1,LolitaJane,1,2019-03-05 16:16:48,/r/EDAnonymous/comments/axkhb1/whats_everyone_giving_up_for_lent/ehvgh91/,I have basically no confidence in my ability to give up anything for forty consecutive days.  I'm constantly whipsawing violently back and forth between all my contradicting vices and compulsions.  Why pile even more guilt on top of what I come by naturally?,False,False
ehve7d4,t3_axkhb1,t1_ehuhe2j,snowalmond,1,2019-03-05 15:52:16,/r/EDAnonymous/comments/axkhb1/whats_everyone_giving_up_for_lent/ehve7d4/,pardon my lack of knowledge... but how do you stay alive during this?? it sounds intriguing ,False,False
ehvbufd,t3_axkhb1,t3_axkhb1,invincibletitan33,1,2019-03-05 15:27:37,/r/EDAnonymous/comments/axkhb1/whats_everyone_giving_up_for_lent/ehvbufd/,"All unhealthy snacks/food. By that I mean processed sugary snacks, crisps, loaded pizzas etc. So stoked cos it means I can say no to my colleagues who are always offering food. ",False,False
ehv426r,t3_axkhb1,t3_axkhb1,biochembiscuit,1,2019-03-05 14:02:42,/r/EDAnonymous/comments/axkhb1/whats_everyone_giving_up_for_lent/ehv426r/,"i’m giving up my procrastination for studying for the MCAT, also need to keep up my no-b/p streak. ",False,False
ehuwsr7,t3_axkhb1,t1_ehuhe2j,Jenny_Roberts,1,2019-03-05 12:42:58,/r/EDAnonymous/comments/axkhb1/whats_everyone_giving_up_for_lent/ehuwsr7/,I want to do this but I'm so scared of refeed syndrome! I've been fasting on weekdays and eating on the weekend because I'm nervous of longer fasts. What's your plan for refeeding?,False,False
ehuuzq5,t3_axkhb1,t3_axkhb1,pinnekjottt,1,2019-03-05 12:22:47,/r/EDAnonymous/comments/axkhb1/whats_everyone_giving_up_for_lent/ehuuzq5/,"Binge eating, ideally. ",False,False
ehuu84d,t3_axkhb1,t1_ehus9m6,PM_ME_BrusselSprouts,1,2019-03-05 12:14:16,/r/EDAnonymous/comments/axkhb1/whats_everyone_giving_up_for_lent/ehuu84d/,*hugs* ,False,True
ehus9m6,t3_axkhb1,t3_axkhb1,Flesh-And-Bone,1,2019-03-05 11:52:57,/r/EDAnonymous/comments/axkhb1/whats_everyone_giving_up_for_lent/ehus9m6/,my sanity.,False,False
ehuqm3x,t3_axkhb1,t1_ehunpm2,PM_ME_BrusselSprouts,1,2019-03-05 11:35:02,/r/EDAnonymous/comments/axkhb1/whats_everyone_giving_up_for_lent/ehuqm3x/,"Wow, even cutting out beans?! That's quite a cut. Are you always vegan?",False,True
ehupqlt,t3_axkhb1,t1_ehuhe2j,PM_ME_BrusselSprouts,1,2019-03-05 11:25:24,/r/EDAnonymous/comments/axkhb1/whats_everyone_giving_up_for_lent/ehupqlt/,"Wow!! Good on you!! Really considering this! 40 lbs would have me in the middle of a normal BMI, so I have it to lose. And 1 lb a day is optimistic for me. The thing is I work partly outside and it's winter here...  So cold. Yesterday I went home and ate 4000 calories of lasagna, cake and chips and was 2lbs lighter today. I think electrolytes can only take you so far...",False,True
ehuotb2,t3_axkhb1,t1_ehumpst,Arceliaz,1,2019-03-05 11:15:16,/r/EDAnonymous/comments/axkhb1/whats_everyone_giving_up_for_lent/ehuotb2/,“It’s not unhealthy but the amount I eat is” is a forever mood ,False,False
ehuorvc,t3_axkhb1,t1_ehu6adf,Arceliaz,1,2019-03-05 11:14:50,/r/EDAnonymous/comments/axkhb1/whats_everyone_giving_up_for_lent/ehuorvc/,"I honestly haven’t decided, I definitely spend a lot of time on here but you guys are my support group and I don’t think I could cope 40 days without the memes haha ",False,False
ehunpm2,t3_axkhb1,t3_axkhb1,coffidu,1,2019-03-05 11:03:11,/r/EDAnonymous/comments/axkhb1/whats_everyone_giving_up_for_lent/ehunpm2/,"I’m giving up all food except vegetables. I’m already pretty much there, just got to cut out beans and the occasional snack. ",False,False
ehumpst,t3_axkhb1,t3_axkhb1,llllllllambtalk,1,2019-03-05 10:52:23,/r/EDAnonymous/comments/axkhb1/whats_everyone_giving_up_for_lent/ehumpst/,"I'm giving up popcorn..its not unhealthy (my air-popped, large variety of toppings version), but the amount I eat is 🤷‍♀️",False,False
ehuhe2j,t3_axkhb1,t3_axkhb1,archersarrows,1,2019-03-05 09:52:50,/r/EDAnonymous/comments/axkhb1/whats_everyone_giving_up_for_lent/ehuhe2j/,Food. I'm doing a forty day water fast.,False,False
ehucfiz,t3_axkhb1,t1_ehu9ljq,shazzzz,1,2019-03-05 08:52:10,/r/EDAnonymous/comments/axkhb1/whats_everyone_giving_up_for_lent/ehucfiz/,"I'm planning on getting up at 5am to get a headstart on the day, have the gym to myself, and to get a better sleep schedule kick started! Cardio is my big challenge because it's so boring. Good luck with it, you can do it!! :) ",False,False
ehub3kx,t3_axkhb1,t1_ehuatyt,PM_ME_BrusselSprouts,1,2019-03-05 08:34:44,/r/EDAnonymous/comments/axkhb1/whats_everyone_giving_up_for_lent/ehub3kx/,Microneedling or perhaps some form of chemical peel. The problem is I partly work outside so I can't avoid the sun completely. Sunblock only does so much and makes my skin feel suffocated.,False,True
ehuatyt,t3_axkhb1,t1_ehuas6i,UnderwearFighter,1,2019-03-05 08:31:09,/r/EDAnonymous/comments/axkhb1/whats_everyone_giving_up_for_lent/ehuatyt/,"thank you, what kind of procedure are you considering? ",False,False
ehuas6i,t3_axkhb1,t1_ehuaju8,PM_ME_BrusselSprouts,1,2019-03-05 08:30:29,/r/EDAnonymous/comments/axkhb1/whats_everyone_giving_up_for_lent/ehuas6i/,I'm sorry that's plaguing you. I don't have acne but a lot of sun damage and have been thinking about getting a facial procedure done soon to help.,False,True
ehuaju8,t3_axkhb1,t1_ehuafcs,UnderwearFighter,1,2019-03-05 08:27:23,/r/EDAnonymous/comments/axkhb1/whats_everyone_giving_up_for_lent/ehuaju8/,"i usually just wash my face and put on this medicated moisturizer when i wake up and before i go to sleep. was working perfectly until i skipped the night half a few days in a row due to just life getting in the way, plus with how acne prone my skin is when i’m not dairy/egg free. ugh ",False,False
ehuafcs,t3_axkhb1,t1_ehua7f4,PM_ME_BrusselSprouts,1,2019-03-05 08:25:42,/r/EDAnonymous/comments/axkhb1/whats_everyone_giving_up_for_lent/ehuafcs/,Do you have a night self-care routine? ,False,True
ehua7f4,t3_axkhb1,t3_axkhb1,UnderwearFighter,1,2019-03-05 08:22:42,/r/EDAnonymous/comments/axkhb1/whats_everyone_giving_up_for_lent/ehua7f4/,"fried food, dairy, eggs. goddamn my skin needs to clear up",False,False
ehu9ljq,t3_axkhb1,t1_ehu96c0,PM_ME_BrusselSprouts,1,2019-03-05 08:14:03,/r/EDAnonymous/comments/axkhb1/whats_everyone_giving_up_for_lent/ehu9ljq/,"That's great!! What is your plan? I am going to try and do 30 days of Yoga, I think I can manage at work (I work alone for two hours in the morning).",False,True
ehu9abk,t3_axkhb1,t1_ehu996u,LisichkaYenotik,1,2019-03-05 08:09:37,/r/EDAnonymous/comments/axkhb1/whats_everyone_giving_up_for_lent/ehu9abk/,Calories:( and i can't just stop at a serving size ,False,False
ehu996u,t3_axkhb1,t1_ehu4x6d,shazzzz,1,2019-03-05 08:09:10,/r/EDAnonymous/comments/axkhb1/whats_everyone_giving_up_for_lent/ehu996u/,Granola is soooo good and honestly addictive. Is it really *that* unhealthy??,False,False
ehu96c0,t3_axkhb1,t3_axkhb1,shazzzz,1,2019-03-05 08:08:01,/r/EDAnonymous/comments/axkhb1/whats_everyone_giving_up_for_lent/ehu96c0/,"I'm not giving up anything, but I am going to go **on** something - working out every day of Lent!",False,False
ehu6djo,t3_axkhb1,t1_ehu4x6d,PM_ME_BrusselSprouts,1,2019-03-05 07:25:11,/r/EDAnonymous/comments/axkhb1/whats_everyone_giving_up_for_lent/ehu6djo/,"Good thinking, booking an easy success. I do that when I make to-do lists, so maybe I will do one as well. Hmm",False,True
ehu6adf,t3_axkhb1,t1_ehu5fns,PM_ME_BrusselSprouts,1,2019-03-05 07:23:46,/r/EDAnonymous/comments/axkhb1/whats_everyone_giving_up_for_lent/ehu6adf/,Do you consider Reddit to be social media? That's where I always get caught. Can give up the rest of it but Reddit is like the only place in the world I can be myself.,False,True
ehu5ptz,t3_axkhb1,t3_axkhb1,mercifulmothman,1,2019-03-05 07:14:28,/r/EDAnonymous/comments/axkhb1/whats_everyone_giving_up_for_lent/ehu5ptz/,"Junk food so like...sweets, chocolate, crisps, possibly pizza as well? Also I’m trying to be properly veggie with some vegan days as well (not hard seeing as I don’t eat butter, milk or cheese anyway). So yeah! Good times ☺️",False,False
ehu5fns,t3_axkhb1,t3_axkhb1,Arceliaz,1,2019-03-05 07:09:42,/r/EDAnonymous/comments/axkhb1/whats_everyone_giving_up_for_lent/ehu5fns/,I’m thinking maybe social media but it will be hard because I have a trip with my bf coming up soon and I wanna flexxxxx haha ,False,False
ehu4x6d,t3_axkhb1,t3_axkhb1,LisichkaYenotik,1,2019-03-05 07:00:46,/r/EDAnonymous/comments/axkhb1/whats_everyone_giving_up_for_lent/ehu4x6d/,"I think I'm going to give up crisps, granola and chocolate.   Crisps are so easy to have a wee snack on when you're bored. They are so oily too!  Granola is my ultimate binge food.  Chocolate is something I don't really eat anyway but I want an ""easy"" success to look back on! 😂",False,False
ehu4izy,t3_axkhb1,t1_ehu3p3l,Saakkkaaaaiiiii,1,2019-03-05 06:53:49,/r/EDAnonymous/comments/axkhb1/whats_everyone_giving_up_for_lent/ehu4izy/,"Me too, that’s a good shout. My ED can kill me but I don’t want cigarettes to!",False,False
ehu3p3l,t3_axkhb1,t3_axkhb1,iron_blanket,1,2019-03-05 06:38:32,/r/EDAnonymous/comments/axkhb1/whats_everyone_giving_up_for_lent/ehu3p3l/,Cigarettes. They are creeping back into my daily habits..,False,False
ehu2qy3,t3_axkhb1,t3_axkhb1,wouldbeafinething,1,2019-03-05 06:20:16,/r/EDAnonymous/comments/axkhb1/whats_everyone_giving_up_for_lent/ehu2qy3/,Thanks so much for posting about Lent ❤️   I'm going to decide tonight and edit this tomorrow with what I'm giving up on. Leaning towards meat!,False,False
