Comment ID,Link ID,Parent ID,Author,Score,Publish Date,Permalink,Text,Stickied,Is Submitter
ebzw2al,t3_a6riy1,t3_a6riy1,Bomby57,1,2018-12-17 13:40:03,/r/EDAnonymous/comments/a6riy1/i_got_only_an_hour_of_sleep_last_night_and_im/ebzw2al/,"Surprisingly when I don't eat I'm so hyper that I can get a long time without eating. But I'm so cold that I'm just craving hot stuff so, basically, I'm conflicted. ",False,False
ebys6tu,t3_a6riy1,t3_a6riy1,einhornschlag,1,2018-12-17 01:22:04,/r/EDAnonymous/comments/a6riy1/i_got_only_an_hour_of_sleep_last_night_and_im/ebys6tu/,"The whole can of Pringle’s in my kitchen, honey bunches oats with WHOLE milk (not shitty almond milk), a variety pack of cookie dough, orange chicken with fried rice, warm gooey brownies, sonic blasts or Dairy Queen blizzards (soft serve is life), and maybe a few of those dry ass loft house sugar cookies (only 160 calories for the frosted ones and 120 for the crunchy sprinkle ones, could actually fit those into a day)  Oh, and my *signature special drink* from Starbucks: black and white mocha frappicino w/ lots of java chips, the coffee infused whipped cream, and a chocolate drizzle INSIDE OF THE CUP",False,False
ebxmnsm,t3_a6riy1,t3_a6riy1,barbieprivilege,1,2018-12-16 14:59:30,/r/EDAnonymous/comments/a6riy1/i_got_only_an_hour_of_sleep_last_night_and_im/ebxmnsm/,A MASSIVE Cobb salad 🥗 with plenty of blue cheese dressing 🤤,False,False
ebxhy9b,t3_a6riy1,t3_a6riy1,piizza,1,2018-12-16 14:08:34,/r/EDAnonymous/comments/a6riy1/i_got_only_an_hour_of_sleep_last_night_and_im/ebxhy9b/,"Just piles and piles of crappy fast food. Taco Bell, McDonalds, Panda Express, etc. etc. etc. It's honestly embarrassing how badly I want it all right now",False,False
ebxh9cj,t3_a6riy1,t1_ebxb1wz,publixbogo,1,2018-12-16 14:01:02,/r/EDAnonymous/comments/a6riy1/i_got_only_an_hour_of_sleep_last_night_and_im/ebxh9cj/,There's a Krispy Kreme drive thru like 10 minutes from my house and it haunts me. I caved on thursday and had three donuts.  😭 ,False,True
ebxe20j,t3_a6riy1,t3_a6riy1,lilllyyy,1,2018-12-16 13:25:22,/r/EDAnonymous/comments/a6riy1/i_got_only_an_hour_of_sleep_last_night_and_im/ebxe20j/,my cravings are always 100x worse when i don't sleep which lately is a daily occurrence so i feel this.  i just started a new job and lucky me people want to bring in food to leave in the break room pretty much daily- this past week? DONUTS one day and CINNAMON ROLLS another. FML. two of my favorite foods ever. just sitting within 100 ft proximity of my desk. i share an office with others and the woman next to me got a cinnamon roll and warmed it up in the microwave and ate it at her desk - THE SMELLS OMG eff me up.  i was dying on the inside.,False,False
ebxb1wz,t3_a6riy1,t3_a6riy1,zombeezinthetrap,1,2018-12-16 12:51:07,/r/EDAnonymous/comments/a6riy1/i_got_only_an_hour_of_sleep_last_night_and_im/ebxb1wz/,Donuts 🍩  For the last three days I’ve been trying to fit them into my day but I know I couldn’t just eat one. And they’re so high calories 😭😭  I’ve also been craving boneless wings from wing stop. Ooo and a chicken chalupa from Taco Bell.   And hot Cheetos. And Reese cups. Fuck I’m starving 😭,False,False
ebxadww,t3_a6riy1,t3_a6riy1,BigFrameSkinnyAddict,1,2018-12-16 12:43:24,/r/EDAnonymous/comments/a6riy1/i_got_only_an_hour_of_sleep_last_night_and_im/ebxadww/,I'm craving roasted sweet potato- currently going to my papas house in 5 minutes and praying that they're sweet potato's there 😭💙👌,False,False
