Comment ID,Link ID,Parent ID,Author,Score,Publish Date,Permalink,Text,Stickied,Is Submitter
el2jir9,t3_bdmfr7,t1_el2iptd,LowCalPal,1,2019-04-16 20:59:59,/r/EDAnonymous/comments/bdmfr7/the_last_time_i_bought_laxatives_the_cashier/el2jir9/,"“This is the reason your job is being automated, Karen.  This is why.”",False,True
el2iptd,t3_bdmfr7,t3_bdmfr7,TheManyArchetypes,1,2019-04-16 20:50:58,/r/EDAnonymous/comments/bdmfr7/the_last_time_i_bought_laxatives_the_cashier/el2iptd/,One time I had a bagger stare at the directions on the enema bottle I bought for way too long with her stupid eyebrow raised like she was trying to figure out wtf she was looking at. Finally I had to just ask her to put it in the bag without making eye contact with her.,False,False
el0ltuk,t3_bdmfr7,t1_ekzlqzq,michellenemangepas,1,2019-04-16 08:15:33,/r/EDAnonymous/comments/bdmfr7/the_last_time_i_bought_laxatives_the_cashier/el0ltuk/,"""Oh I have an ED and I consume them regularly."" With a smile should make them uncomfortable enough. And will teach them to stfu",False,False
el0dr4a,t3_bdmfr7,t3_bdmfr7,DisguisedAsMe,1,2019-04-16 05:56:44,/r/EDAnonymous/comments/bdmfr7/the_last_time_i_bought_laxatives_the_cashier/el0dr4a/,"If she literally asks just say you need to take it with some medication. If she asks for more details just say that's kind of personal. God, I hate when people make comments about what I buy. It's so unwarranted. Once the cashier made fun of me for buying makeup. Like, they need to mind their own business.",False,False
ekzr31s,t3_bdmfr7,t1_ekzdzgd,danimarie82,1,2019-04-15 21:54:23,/r/EDAnonymous/comments/bdmfr7/the_last_time_i_bought_laxatives_the_cashier/ekzr31s/,I always buy them at the self checkout at Target because they are super cheap and I don't have to interact with a human. Now I'm paranoid about that too...,False,False
ekzlqzq,t3_bdmfr7,t3_bdmfr7,Poopyoo,1,2019-04-15 20:48:59,/r/EDAnonymous/comments/bdmfr7/the_last_time_i_bought_laxatives_the_cashier/ekzlqzq/,Id just be like “i feel really bloated” or “i havent shit in a week” or something. Make em feel uncomfortable af lol,False,False
ekzetpy,t3_bdmfr7,t3_bdmfr7,trexmafia,1,2019-04-15 19:27:53,/r/EDAnonymous/comments/bdmfr7/the_last_time_i_bought_laxatives_the_cashier/ekzetpy/,"If they ask, say you're having a routine colonoscopy. There are a variety of bowel preps ranging from CoLyte to GoLyteley to Picosalax and bEyOnD. Some folks with IBD don't bother with the prescription bowel preps and do what works for them.  No one wants to talk about poop. And if they do, smother them with details. 🙃",False,False
ekzdzgd,t3_bdmfr7,t1_ekzdxu5,DelicateBones,1,2019-04-15 19:17:27,/r/EDAnonymous/comments/bdmfr7/the_last_time_i_bought_laxatives_the_cashier/ekzdzgd/,"Makes sense, but less personal and invasive.",False,False
ekzdxu5,t3_bdmfr7,t1_ekz8dhh,YoItsMe54321,1,2019-04-15 19:16:51,/r/EDAnonymous/comments/bdmfr7/the_last_time_i_bought_laxatives_the_cashier/ekzdxu5/,Theres always a supervisor manning the main terminal and they can watch what youre scanning on their screen  For example.. 1. Lax - 2.99 1. Lax - 2.99 1. Lax - 2.99 1. Lax - 2.99  Is what they see on their screen.  You can still avoid talking to them but personally i would rather just buy them online.    This is one of the reasons self check out is sketching me out.  I always feel like people are judging me when im buying my lunch that consists of saltine crackers and organic carrots.,False,False
ekzatzr,t3_bdmfr7,t1_ekz8dhh,ShoopDaWhoopBurrito,1,2019-04-15 18:37:12,/r/EDAnonymous/comments/bdmfr7/the_last_time_i_bought_laxatives_the_cashier/ekzatzr/,And thank god for it. 🙌🏻,False,False
ekz8dhh,t3_bdmfr7,t3_bdmfr7,DelicateBones,1,2019-04-15 18:07:25,/r/EDAnonymous/comments/bdmfr7/the_last_time_i_bought_laxatives_the_cashier/ekz8dhh/,Self checkout time,False,False
