Comment ID,Link ID,Parent ID,Author,Score,Publish Date,Permalink,Text,Stickied,Is Submitter
eu79dpo,t3_cew8jn,t1_eu71klp,The7thClockworker,1,2019-07-19 02:51:21,/r/EDAnonymous/comments/cew8jn/there_was_an_attempt_to_recover_angry_vent/eu79dpo/,"Sure, and thank you!",False,True
eu79d3i,t3_cew8jn,t1_eu6mp0p,The7thClockworker,1,2019-07-19 02:51:02,/r/EDAnonymous/comments/cew8jn/there_was_an_attempt_to_recover_angry_vent/eu79d3i/,"Yeah, unfortunately my case is not that unusual. Many ED patients I've met while being ip are just going through the cycle of starving themselves until they get to a dangerously low weight, being hospitalized, gaining, getting released, and then repeating all over. Sometimes it just turns into another disordered behaviour.  I've been on and off diagnosed with BPD depending on which psychiatrist I was visiting at the time, so no one knows what my actual diagnosis is, but I definitely experience splitting (or very similar behaviour), plus the extreme need for validation and irrational self hate. To me, it's either skinny or worthless. Which is bull, but my environment while growing up certainly contributed to the praise-craving little me being brainwashed by those beliefs about myself. The issues run insanely deep and it's going to be difficult to find a solution, but hopefully I'll be able to find the will to work on it I had back then.",False,True
eu78bae,t3_cew8jn,t1_eu5yk62,The7thClockworker,1,2019-07-19 02:32:23,/r/EDAnonymous/comments/cew8jn/there_was_an_attempt_to_recover_angry_vent/eu78bae/,"Thank you!  I'm really happy for you that you found a way to get better. Recovery is not black or white, so unfortunately some setbacks are bound to happen, but as you said, the progress you've made remains! Best of luck with your journey and have a virtual hug back. There's always a chance for everyone, hopefully with me included, so I hope I'll be able to go on until I gather enough resolve to look for help again.",False,True
eu77ah8,t3_cew8jn,t1_eu5okuv,The7thClockworker,1,2019-07-19 02:14:43,/r/EDAnonymous/comments/cew8jn/there_was_an_attempt_to_recover_angry_vent/eu77ah8/,"Thank you! I live in a country where even being at the higher end of the BMI spectrum means you get insane amounts of shit from other people for it, add a dose of certain abusive family members (who, for example, called me a whale for growing boobs at 12, or encouraged me to starve, because ""bones are beautiful""), and you get a deeply ingrained mindset of ""it's your fault"", ""you're not even human"", insane body dysmorphia and paranoia.  It's not my fault, and any sane person shouldn't blame ill people for being ill. And of course weight does not play any role whatsoever in your worth as a human being.  I know that.  Even though, I hold those beliefs towards myself. They're just buried too deep, I think. Hopefully I will be able to get rid of them one day. You will get rid of yours as well. Wish you all the best on your road to recovery!",False,True
eu71klp,t3_cew8jn,t3_cew8jn,Astronautee,1,2019-07-19 00:43:48,/r/EDAnonymous/comments/cew8jn/there_was_an_attempt_to_recover_angry_vent/eu71klp/,"Hey, mind if I PM you?? This was my situation reversed, so i awfully resonate with what you wrote.",False,False
eu6mp0p,t3_cew8jn,t3_cew8jn,SwampHag4589,1,2019-07-18 21:37:25,/r/EDAnonymous/comments/cew8jn/there_was_an_attempt_to_recover_angry_vent/eu6mp0p/,"Hi I’m sorry you’re struggling so much. Unfortunately with restrictive eating disorders, the focus is way too much on ending the behaviors that lead to starving, without addressing the mental aspect of it. So you’ll get “healthy” physically but your brain is still very sick. Not surprising at all that you found a different way to cope. But you managed to stop your restrictive behaviors, that means you can totally deal with the binging. You will find a way and you’ll deal with the mental shit too so you won’t have to turn to food to cope with life. Please have some compassion for yourself. I’m very proud of you for making the choice to get better, even if you feel like you’re worse off now. Just keep working on yourself. You’ll be okay!!",False,False
eu6970z,t3_cew8jn,t3_cew8jn,p0et1c,1,2019-07-18 19:09:39,/r/EDAnonymous/comments/cew8jn/there_was_an_attempt_to_recover_angry_vent/eu6970z/,"People with ED's cant always eat intuitively (like me). I feel like recovery wants you to be able to just eat whenever without thought, but it doesn't work that way for us. There's no middle ground for us, only a voice screaming EAT MORE or EAT LESS.  Something that has helped me is setting a calorie and macro goal each day. I know that recovery doesn't want you to do that but if you set it at your TDEE you will be a healthy weight instead of eating too little or too much and verifies you're getting enough nutrients.   Obsessing about your health is supposedly a no-no, but imo if you're obsessing about your health in order to be ACTUALLY healthy, then why not? 🤷‍♀️",False,False
eu5yk62,t3_cew8jn,t3_cew8jn,sleepybear7,1,2019-07-18 17:18:32,/r/EDAnonymous/comments/cew8jn/there_was_an_attempt_to_recover_angry_vent/eu5yk62/,"I wish I could give you a hug. I went through the same thing as a teenager (anorexia and then BED/massive weight gain and obesity) and it was hell. Those were the worst years of my life. After years of weight cycling I developed bulimia and my ED got much worse but i still wasn’t as depressed as I was after that initial BED/weight gain.   You can get through this. Don’t give up hope - if your current medical professionals can’t help you,  there are ones out there that can. I am now nearing 30 and relapsed last year, but had many good years in recovery from treatment I had around age 20. Even now my ability to manage my symptoms is much better. Eating disorders are SO persistent but I do believe recovery is possible.",False,False
eu5okuv,t3_cew8jn,t3_cew8jn,senslessshit,1,2019-07-18 15:32:22,/r/EDAnonymous/comments/cew8jn/there_was_an_attempt_to_recover_angry_vent/eu5okuv/,"it gets better. don't beat yourself up, it's not your fault you have a mental illness. I have a similar situation. I started binging and purging (or restricting after) during anorexia recovery and now I can't stop. but I know it's not my fault. I believe that I will recover someday. and you'll recover too. never give up.",False,False
eu5igxt,t3_cew8jn,t1_eu5i5o1,lolliepopp99,1,2019-07-18 14:31:09,/r/EDAnonymous/comments/cew8jn/there_was_an_attempt_to_recover_angry_vent/eu5igxt/,"Don't apologise for getting your feelings out. I wish I could do more to help but again, all I can say is I'm here if you need to talk. Genuinely wish you the best :)",False,False
eu5i5o1,t3_cew8jn,t1_eu5f3u8,The7thClockworker,1,2019-07-18 14:27:58,/r/EDAnonymous/comments/cew8jn/there_was_an_attempt_to_recover_angry_vent/eu5i5o1/,"Thank you for the reassurance! I know it's just the illness speaking, but it's hard not to feel that way nonetheless. It's a combination of not wanting to endure this any longer and having failed too many times, I think. I went through many types of therapy, including CBT, DBT, psychotherapy. Many of the therapists told me or my parents that they don't know what to do. Plus it's hard to find new ones, as they are either fully booked or too far away for me to commute. I was hospitalized a few times, but I found out that they just keep you in until you're no longer in immediate danger and then send you home. According to my psychiatrist, she tried all types of medication that wouldn't probably have bad side effects in my case, so for now I'm on sertraline, quetiapine, plus Xanax when it gets bad. They can keep me somewhat functional at least.  So for now, it does feel like there's nothing I can do but wait. I try to remind myself that it probably won't last forever, but I also can't imagine having to endure living like this for another 5 years or so. It feels like I'm just wasting my young years away, but I don't have the strength to do anything anymore.    I'm sorry for rambling too much! I'm feeling very edgy right now, haha. Thank you again for the kind words!",False,True
eu5f3u8,t3_cew8jn,t3_cew8jn,lolliepopp99,1,2019-07-18 13:56:57,/r/EDAnonymous/comments/cew8jn/there_was_an_attempt_to_recover_angry_vent/eu5f3u8/,"You're phrasing it as if it's too late for you to change. People can lose weight again, people can get better from BED or at least learn to control it a little more. Have you tried CBT? Any medications?  Weight is not the ultimate measure of your self worth. You are not a failure, you are struggling. You haven't *failed*, it just sounds like you've given up. If you have the strength to motivate yourself to get better a second time then I'm positive you can. It's not too late.  I know I'm just a stranger on the internet but I genuinely wish you all the best. It sounds like you're really struggling right now. If you need to vent to anyone just send me a message. ❤️",False,False
