Comment ID,Link ID,Parent ID,Author,Score,Publish Date,Permalink,Text,Stickied,Is Submitter
ecb5us0,t3_a8h7e9,t3_a8h7e9,taoshka,1,2018-12-22 03:25:15,/r/EDAnonymous/comments/a8h7e9/saved_up_all_my_calories_for_dinner_and_the/ecb5us0/,"I'm so sorry, That's the *worst,* especially when you're all psyched up for it :(",False,False
ecb5gm4,t3_a8h7e9,t3_a8h7e9,alldocsarebastards,1,2018-12-22 03:15:05,/r/EDAnonymous/comments/a8h7e9/saved_up_all_my_calories_for_dinner_and_the/ecb5gm4/,fricking cornstarch literally just use regular flour you little scam i don’t want to be eating any non-newtonian fluids,False,False
ecawhjc,t3_a8h7e9,t3_a8h7e9,shark_robinson,1,2018-12-21 23:53:59,/r/EDAnonymous/comments/a8h7e9/saved_up_all_my_calories_for_dinner_and_the/ecawhjc/,I HATE when that happens! So disappointing. And when you only get a few calories per day it’s just the biggest slap in the face. I have to hold myself back from hate binging everything in sight lol. ,False,False
ecasen7,t3_a8h7e9,t3_a8h7e9,AvariceMalaise,1,2018-12-21 22:43:13,/r/EDAnonymous/comments/a8h7e9/saved_up_all_my_calories_for_dinner_and_the/ecasen7/,I agree. Fuck you cornstarch.,False,False
ecaq1zl,t3_a8h7e9,t3_a8h7e9,OkWorking7,1,2018-12-21 22:01:29,/r/EDAnonymous/comments/a8h7e9/saved_up_all_my_calories_for_dinner_and_the/ecaq1zl/,😪 I made this protein egg stuff last night and totally burnt the bottom of it. I could tell it would have tasted good if I didn’t fuck it up. Then I kept thinking what else I could eat for the rest of the night ,False,False
