Comment ID,Link ID,Parent ID,Author,Score,Publish Date,Permalink,Text,Stickied,Is Submitter
f6pk7eo,t3_ds894c,t3_ds894c,superschuch,1,2019-11-06 10:36:08,/r/EDAnonymous/comments/ds894c/1000_calories_of_nothing/f6pk7eo/,"I hadn’t eaten during the day yesterday then had a few ounces of milk and Halloween cookies for dinner. Not too healthy, still under BMR so I guess I’ll live.",False,False
f6ozdbs,t3_ds894c,t1_f6nz3tk,galacticshock,1,2019-11-06 06:10:38,/r/EDAnonymous/comments/ds894c/1000_calories_of_nothing/f6ozdbs/,"I am horrifically allergic to this stuff, like keep two epipens near by level of allergy.   But it sounds delicious with peanut butter! Haha.",False,False
f6o2d18,t3_ds894c,t1_f6o085x,judgejudystan,1,2019-11-05 20:06:54,/r/EDAnonymous/comments/ds894c/1000_calories_of_nothing/f6o2d18/,"So freaking good, although I hated every second eating it haha. And yeah it was pretty much like that!",False,False
f6o085x,t3_ds894c,t1_f6nz3tk,sugarysweet24,1,2019-11-05 19:41:37,/r/EDAnonymous/comments/ds894c/1000_calories_of_nothing/f6o085x/,"Oh god, peanut butter my old mistress D: Is it any good? I always imagined it’d be like the easy bake oven mixes: sweet af but super dry. or powdered/sugary. I like to mix peanut butter and white sugar when I feel a craving. And of course 💖💕💖",False,True
f6nz3tk,t3_ds894c,t1_f6nyrkf,judgejudystan,1,2019-11-05 19:28:02,/r/EDAnonymous/comments/ds894c/1000_calories_of_nothing/f6nz3tk/,"It’s just so good! I was eating it dry and with peanut butter hahah. Thank you so much btw, take care too! &lt;3",False,False
f6nyrkf,t3_ds894c,t1_f6ny8wz,sugarysweet24,1,2019-11-05 19:23:56,/r/EDAnonymous/comments/ds894c/1000_calories_of_nothing/f6nyrkf/,Oh nesquick is a mood!! I haven’t had it since I was a kid but it was so so good :( idk how u eat it but literally powdery spoonfuls w or w/o milk were my weakness as a kid. hard talk tortilla chips (stale or not) are so good w jalapeños  :( good luck and take care 💖💞💖,False,True
f6ny8wz,t3_ds894c,t3_ds894c,judgejudystan,1,2019-11-05 19:17:39,/r/EDAnonymous/comments/ds894c/1000_calories_of_nothing/f6ny8wz/,"This has been me for the past 2 weeks, I feel you so hard. I wish I actually went out to get a good ass dinner last night instead of eating half a box of nesquik chocolate power and stale tortilla chips",False,False
