Comment ID,Link ID,Parent ID,Author,Score,Publish Date,Permalink,Text,Stickied,Is Submitter
ec0hpld,t3_a6h9b4,t3_a6h9b4,fuckminicinabons,1,2018-12-17 18:26:04,/r/EDAnonymous/comments/a6h9b4/almost_had_a_panic_attack_over_chickfila/ec0hpld/,I’m so glad I’m not the only one who gets intense chic fil a cravings. THOSE FRIES THOUGH ,False,False
ebv9o0u,t3_a6h9b4,t1_ebv5gs9,usr687,1,2018-12-15 15:46:24,/r/EDAnonymous/comments/a6h9b4/almost_had_a_panic_attack_over_chickfila/ebv9o0u/,I get a kids meal almost every time I have to go out to eat! Unfortunately our on campus chick-fil-a only has sandwiches and 8 or 12 counts ,False,True
ebv5kyz,t3_a6h9b4,t3_a6h9b4,jobbluetooth,1,2018-12-15 14:53:37,/r/EDAnonymous/comments/a6h9b4/almost_had_a_panic_attack_over_chickfila/ebv5kyz/,"dude all I eat is chick fil a, I’m literally on my way there right now",False,False
ebv5gs9,t3_a6h9b4,t3_a6h9b4,ReneeLouvier,1,2018-12-15 14:52:08,/r/EDAnonymous/comments/a6h9b4/almost_had_a_panic_attack_over_chickfila/ebv5gs9/,"I usually get a kids meal.  Grilled nuggets, fruit cup and diet lemonade. My kid gets a second toy, everyone's happy!",False,False
ebuypwm,t3_a6h9b4,t1_ebusmeq,usr687,1,2018-12-15 13:22:43,/r/EDAnonymous/comments/a6h9b4/almost_had_a_panic_attack_over_chickfila/ebuypwm/,"I never used to eat it, but it’s one of the only options on campus and I’ve been craving it so hard lately! After low restricting for two days and fasting for one I decided it was time to eat so I got some. And then I almost had a panic attack when I opened the box of nuggets bc calories and real food 🙃",False,True
ebutnq5,t3_a6h9b4,t3_a6h9b4,losingmattie,1,2018-12-15 12:21:59,/r/EDAnonymous/comments/a6h9b4/almost_had_a_panic_attack_over_chickfila/ebutnq5/,"Did this last night over going out to eat. Time fasting/ restricting = one second closer to being perfect, and any interruption is unacceptable. I don't think I've ever told myself I could stop, though, because I just don't want to, ever. (Because control over eating/ my body is the only thing that makes me feel okay ha)",False,False
ebusmeq,t3_a6h9b4,t3_a6h9b4,sayyourprayersbitch,1,2018-12-15 12:09:56,/r/EDAnonymous/comments/a6h9b4/almost_had_a_panic_attack_over_chickfila/ebusmeq/,Omg are you me. I’m obsessed with chick fil a and have literally no self control ,False,False
