Comment ID,Link ID,Parent ID,Author,Score,Publish Date,Permalink,Text,Stickied,Is Submitter
fb2dn9r,t3_ealduy,t1_fb2d8a7,mustyday,1,2019-12-15 16:32:25,/r/EDAnonymous/comments/ealduy/how_do_yall_find_the_energy_to_exist/fb2dn9r/,I just do cardio mostly. My tdee takes into account my exercise levels. My sedentary tdee is like 1800.,False,False
fb2d8a7,t3_ealduy,t1_fauivx9,-Macaronis-,1,2019-12-15 16:28:56,/r/EDAnonymous/comments/ealduy/how_do_yall_find_the_energy_to_exist/fb2d8a7/,What do you do for a workout? I started to lift weights and I'm not sure about my tdee. How did you find out? Online calculators say it's about 2200 maintenance calories for me but I'm very suspicious. It sounds too good to be true.,False,False
fawow0q,t3_ealduy,t3_ealduy,DepressoDog666,1,2019-12-14 19:37:01,/r/EDAnonymous/comments/ealduy/how_do_yall_find_the_energy_to_exist/fawow0q/,I hardcore subsist off chicken broth cold brew and zero energy drinks to maintain electrolytes while fasting and iron pills to reduce the chances of dizzy spells,False,False
fav31jq,t3_ealduy,t3_ealduy,hefnerr,2,2019-12-14 14:26:56,/r/EDAnonymous/comments/ealduy/how_do_yall_find_the_energy_to_exist/fav31jq/,The only way for me is adderall just for the energy,False,False
fauivx9,t3_ealduy,t3_ealduy,mustyday,2,2019-12-14 12:34:02,/r/EDAnonymous/comments/ealduy/how_do_yall_find_the_energy_to_exist/fauivx9/,I can’t. I work 9 hours a day on my feet and if I don’t eat at LEAST 900 calories I can’t function. I eat between 900-1400 on days I work. My tdee is 2200 (I exercise too) so I still am restricting but I feel like a fraud on here lmao,False,False
fau3ix1,t3_ealduy,t1_fau2169,4foot11,1,2019-12-14 11:20:09,/r/EDAnonymous/comments/ealduy/how_do_yall_find_the_energy_to_exist/fau3ix1/,I just wrote my last exam yesterday so I’m back on my low restrict bullshit 🤡,False,False
fau2m9h,t3_ealduy,t3_ealduy,graylynnparadox,1,2019-12-14 11:16:10,/r/EDAnonymous/comments/ealduy/how_do_yall_find_the_energy_to_exist/fau2m9h/,"Tw: calories   I recommend protein shit. I know they can be really intimidating sometimes but it’s really good for trying to not snack or binge, super filling ( like one filled me for my 8hr shift, on my feet) and at 180 cals? Ok. Then protein shakes. Good for in the morning as a breakfast. I have a Carmel one that goes at 160. You need nutrients. Protein. And make sure you drink water because it’s underestimated how much of a difference it makes. Try spreading out your calories more. Not eating at all through the day and then getting home to eat increases my chances of binging on some stupid shit. I have my shake, a protein bar, a coffee when I get to work, a snack, and when I get home a small dinner. And I still stay under 650 a day. And although I’m always tired, cause, well yk, I’m noticeably less tired than I was when I was b/r.",False,False
fau2169,t3_ealduy,t1_fatxtaa,deeznutellaz,2,2019-12-14 11:14:03,/r/EDAnonymous/comments/ealduy/how_do_yall_find_the_energy_to_exist/fau2169/,"I feel you. I high restricted and binged a lot for the finals I just finished. I got really sick towards the end though.  Good luck! You'll do well, and know that it's hard but be proud that you're taking care of yourself the best you can so you can get through exams.",False,True
fatxtaa,t3_ealduy,t3_ealduy,4foot11,2,2019-12-14 10:56:30,/r/EDAnonymous/comments/ealduy/how_do_yall_find_the_energy_to_exist/fatxtaa/,I have to high restrict for exam season to at least get some energy back 😩,False,False
