Comment ID,Link ID,Parent ID,Author,Score,Publish Date,Permalink,Text,Stickied,Is Submitter
ebuxzye,t3_a607zr,t1_ebu42gg,aprilfades,1,2018-12-15 13:13:53,/r/EDAnonymous/comments/a607zr/just_a_reminder_a_certain_fat_people_hateesque/ebuxzye/,Yeah I can’t stand that sub. Lots of people there think shaming people who are overweight/obese is good because it’ll “encourage” those people to get healthier and lose weight. It’s pretty disgusting,False,False
ebua37u,t3_a607zr,t3_a607zr,slyfox10601,1,2018-12-15 07:55:11,/r/EDAnonymous/comments/a607zr/just_a_reminder_a_certain_fat_people_hateesque/ebua37u/,What is FPS??,False,False
ebu7w7b,t3_a607zr,t1_ebu7w3j,auto-xkcd37,1,2018-12-15 07:11:17,/r/EDAnonymous/comments/a607zr/just_a_reminder_a_certain_fat_people_hateesque/ebu7w7b/,"&gt; fat ass-ewwww  ***  ^(Bleep-bloop, I'm a bot. This comment was inspired by )^[xkcd#37](https://xkcd.com/37)",False,False
ebu7w3j,t3_a607zr,t1_ebt3xjc,gigi-has-issues,1,2018-12-15 07:11:12,/r/EDAnonymous/comments/a607zr/just_a_reminder_a_certain_fat_people_hateesque/ebu7w3j/,"FPS is even better because 99% of the stories are people who are like:  &gt;be me, 5'4"", 200lbs but working on it &gt;don't be this fat fuck who is 5'3"" 210lbs omg what a fatass ewwww",False,False
ebu42gg,t3_a607zr,t1_ebqrl4f,sundaeys,1,2018-12-15 05:14:47,/r/EDAnonymous/comments/a607zr/just_a_reminder_a_certain_fat_people_hateesque/ebu42gg/,"hmf is terrible. :( people can have medical conditions that result to them being overweight, right? why are they assuming all fat people are lazy and have no self control? ",False,False
ebtang4,t3_a607zr,t1_ebt98mu,VTMongoose,1,2018-12-14 18:36:31,/r/EDAnonymous/comments/a607zr/just_a_reminder_a_certain_fat_people_hateesque/ebtang4/,"I know those feels. I've got hella loose skin too. Lost half my body weight at one point. Loose skin definitely affects body fat measurements because all the excess skin is partially registered as lean mass and partially as body fat in all measurement systems, and to different degrees in each. Screw it.",False,False
ebt9r1q,t3_a607zr,t1_ebt642x,VTMongoose,1,2018-12-14 18:21:41,/r/EDAnonymous/comments/a607zr/just_a_reminder_a_certain_fat_people_hateesque/ebt9r1q/,"Wow, amazing story. Thanks so much for sharing. Yeah, that's exactly what I try to concentrate on these days. I was obese almost my whole life and then after I lost the weight I became anorexic (not uncommon) and I know exactly the kind of struggle you are talking about because I tell people it's like there are two demons living inside me. One wants me to eat myself into my grave and the other wants me to starve myself into my grave. But I've read hundreds of studies on obesity, metabolism, building muscle, losing fat, body weight/fat set point, etc. It's been an obsession of mine for over a year because I want to understand the state I am in and get a better understanding of what is objectively normal and healthy. So these days what I try to do is concentrate on doing what is objectively healthy at any given moment regardless of whatever the voices in my head are saying. I try to make eating/exercise decisions based on ""what will make me feel stronger/better tomorrow"" or ""how can I respect my body right now"" instead of ""how can I eat as little as possible or not at all"" or ""How can I manipulate myself to achieve the ideal in my mind"" (that doesn't really exist) or ""what would feel/taste good right now?"". Hard as hell, but it's been working. I have good days and bad days but overall the trend is I'm getting stronger and healthier over time.",False,False
ebt98mu,t3_a607zr,t1_ebt919y,godisamango,1,2018-12-14 18:13:11,/r/EDAnonymous/comments/a607zr/just_a_reminder_a_certain_fat_people_hateesque/ebt98mu/,"Lmao enjoy your beer, bro. I went and lost 90 pounds so I’ve got hella loose skin and calipers aren’t gonna be especially accurate. Thanks for the tip tho, and congrats on being a lean mean machine. ",False,False
ebt919y,t3_a607zr,t1_ebt4wv4,VTMongoose,1,2018-12-14 18:09:49,/r/EDAnonymous/comments/a607zr/just_a_reminder_a_certain_fat_people_hateesque/ebt919y/,"You can use skinfold calipers to get a rough estimate (not that I recommend tracking that to anyone on here as it has helped perpetuate a disordered mindset for me). All of the body fat measurement methods are pretty crude approximations though. Both me and another guy I know measure like 7-8% by calipers (I measure about the same using all the different methods since I store about the same amount of body fat in my upper and lower torso) and 15% by DXA. That's a pretty stupid amount of variability.  &amp;#x200B;  Really how you look/feel is more important. Both too little and too much body fat make both your performance and general health worse. Probably one of the best things about gaining fat during recovery was seeing the effects it had on my exercise and general health. I've been cycling for years and how I perform is a great barometer for my general health. Literally all I needed to do was put on a few pounds of fat and all of a sudden tons of problems disappeared and my athletic performance went to a completely different level. Pretty much since I decided to recover, every single pound of body weight I've put on has actually made me faster, and biking is an unforgiving sport where extra weight is punished severely in terms of your speed and efficiency.  &amp;#x200B;  Anyway this is why I made my original comment. Gaining weight has made everything better for me. I may be an outlier but I feel like a lot of other manorexics get caught in the trap of trying to just cut more and more and more weight (""my BMI is still such and such!"") looking for that useless 6-pack that will never be there for some of us, and all you're really doing at a certain point is eating your own muscle. When I look at pics of myself at my lowest, I can't imagine what it's like to live in that state anymore. I couldn't even pull my bed away from the wall to change my sheets from how weak I got.  &amp;#x200B;  Sorry for the long response. I had beer.",False,False
ebt642x,t3_a607zr,t1_ebt3tu2,Swanabe,1,2018-12-14 17:23:58,/r/EDAnonymous/comments/a607zr/just_a_reminder_a_certain_fat_people_hateesque/ebt642x/,"I eventually went back to restrictive tendencies and bounced between Ana behaviors and BED behaviors for a few years. I was two different people, restriction-brain and binge-brain. I got a lot treatment for both (my family is quite well off it was the best treatment money could buy but tbh it all sucked in one way or another). Finally, after having some (scary but thankfully temporary) health issues caused by binging, I had an epiphany that I would probably never have a fully healthy relationship with food, having spent the better part of my life (age 5-25) dealing with some type of food related issue. I accepted that I couldn’t ever erase that and that a full recover from my mental disorder was about as likely as an amputee regrowing  limb, but I COULD ensure that I live in a way that keeps my body healthy.   Fortunately I majored in a field they taught me how to research really well, and I started to teach myself about nutrition, healthy living, weight loss, muscle gain, maintenance, aging well, longevity etc. This is when I realized the full scope of how much my “treatment teams” (not just the ones from the terrible clinic, but others as well!) had lied to me.   To make a long story full of trial and error short: I found things that help me balance my ed with the reality of what my body needs to stay healthy. I’m learning more everyday and always improving. I’m not recovered fully. I won’t ever be. But I’m very physically healthy. I’m very fulfilled in most areas of my life, and my outcomes from this are so much better than they ever were from any treatment. ",False,False
ebt5vyu,t3_a607zr,t1_ebr31bz,lalaloui22,1,2018-12-14 17:20:28,/r/EDAnonymous/comments/a607zr/just_a_reminder_a_certain_fat_people_hateesque/ebt5vyu/,"All Calories Are Bastards? (Just kidding, fuck cops tho)",False,False
ebt4wv4,t3_a607zr,t1_ebt4qhv,godisamango,1,2018-12-14 17:05:44,/r/EDAnonymous/comments/a607zr/just_a_reminder_a_certain_fat_people_hateesque/ebt4wv4/,Well body fat measurements are expensive so this is the best I got lol ,False,False
ebt4uqn,t3_a607zr,t1_ebqtg6f,godisamango,1,2018-12-14 17:04:51,/r/EDAnonymous/comments/a607zr/just_a_reminder_a_certain_fat_people_hateesque/ebt4uqn/,"FL, HMF, FPS, and other selections from the Reddit meanspo community ",False,False
ebt4qhv,t3_a607zr,t1_ebt3r7m,VTMongoose,1,2018-12-14 17:03:04,/r/EDAnonymous/comments/a607zr/just_a_reminder_a_certain_fat_people_hateesque/ebt4qhv/,"I agree that it works pretty well for genpop Joe/Jane with a desk job who spends most of their free time on a couch, just saying, not a good measure for athletes or even anyone that does a lot of physically demanding activity like certain blue collar professions. And it's not just guys, either:  &amp;#x200B;  [https://www.ncbi.nlm.nih.gov/pubmed/22089480](https://www.ncbi.nlm.nih.gov/pubmed/22089480)",False,False
ebt3xjc,t3_a607zr,t1_ebs4ub0,godisamango,1,2018-12-14 16:51:13,/r/EDAnonymous/comments/a607zr/just_a_reminder_a_certain_fat_people_hateesque/ebt3xjc/,Same. Who doesn’t need meanspo from basement dwelling mamma’s boys? Who all start their comment with “I’m still over weight but...” ,False,False
ebt3tu2,t3_a607zr,t1_ebsph2w,VTMongoose,1,2018-12-14 16:49:43,/r/EDAnonymous/comments/a607zr/just_a_reminder_a_certain_fat_people_hateesque/ebt3tu2/,"Holy smokes, thanks for sharing. That is probably one of the most messed up stories regarding treatment I've read on this sub. I don't know where this place is but it should be shut down.  &amp;#x200B;  Imagine the opposite scenario, a world where anorexics banded together and ran a clinic for obese people telling them that we were actually the healthy ones, and they needed to starve themselves to be truly healthy. No way in hell. I feel like all of us are quite aware that what we engage in is in no way healthy or something that should be copied.  &amp;#x200B;  How did you ultimately recover from BED? Or did you recognize yourself that you were taught a disordered mindset and work it out on your own?",False,False
ebt3r7m,t3_a607zr,t1_ebrws0b,godisamango,1,2018-12-14 16:48:38,/r/EDAnonymous/comments/a607zr/just_a_reminder_a_certain_fat_people_hateesque/ebt3r7m/,"You’re an outlier. BMI works for the rest of us pretty well. It’s certainly not perfect, but it’s a good way get a general idea of “health”. ",False,False
ebt3kqj,t3_a607zr,t1_ebs9jsr,godisamango,1,2018-12-14 16:45:58,/r/EDAnonymous/comments/a607zr/just_a_reminder_a_certain_fat_people_hateesque/ebt3kqj/,She exercised so hard her entire face switched to a whole new face! That’s health for ya! /s,False,False
ebsxvca,t3_a607zr,t1_ebsuqsk,Swanabe,1,2018-12-14 15:26:49,/r/EDAnonymous/comments/a607zr/just_a_reminder_a_certain_fat_people_hateesque/ebsxvca/,"Yeah, I acknowledge that the place I went was generally very bad and extreme but it’s very common to see mostly or entirely overweight and obese staff even at better clinics, which I find really problematic for a multitude of reasons.",False,False
ebsuqsk,t3_a607zr,t1_ebsph2w,cleanandlovely,1,2018-12-14 14:45:14,/r/EDAnonymous/comments/a607zr/just_a_reminder_a_certain_fat_people_hateesque/ebsuqsk/,"That sounds absolutely insane. Your feelings are completely understandable in light of what you went through there. I have had my own quibbles with a former treatment team, but nothing even remotely comparable to what you're recounting here. If anything, intuitive eating (the actual book in all its nuance, not just the simplified social media version) helped me to cope healthily with emotional eating and to re-learn mindfulness after the havoc wreaked by my ED. I don't feel like what you're describing matches up with what intuitive eating, or the pursuit of health, is or should be. I'm really sorry you experienced that.",False,False
ebste27,t3_a607zr,t1_ebstcuo,Swanabe,1,2018-12-14 14:27:40,/r/EDAnonymous/comments/a607zr/just_a_reminder_a_certain_fat_people_hateesque/ebste27/,"It was a place that my mother found, I think it was private. ",False,False
ebstcuo,t3_a607zr,t1_ebsph2w,lotsofsqs,1,2018-12-14 14:27:14,/r/EDAnonymous/comments/a607zr/just_a_reminder_a_certain_fat_people_hateesque/ebstcuo/,What the fuuuuck. What kind of place was this? Like a private clinic?,False,True
ebsr6ip,t3_a607zr,t3_a607zr,skeletonsofawhale,1,2018-12-14 13:58:40,/r/EDAnonymous/comments/a607zr/just_a_reminder_a_certain_fat_people_hateesque/ebsr6ip/,"I'm in recovery and I go on that sub a lot. Every time I'm there, I feel guilty, ashamed, and angry at the users all at once. It triggers the fuck out of me. But it's like... I can't look away.  &amp;#x200B;  I also feel like absolute shit because I was never underweight during my ED, yet in recovery I have been intuitively eating anywhere between 2300 and 4000 calories a day. At first I rapidly gained weight on these amounts, but lately I have, for some magical reason, been plateauing on these amounts. It's almost like human metabolism is far, far, \*far\* more nuanced than any TDEE equation or calorie counting app can ever possibly account for!?!?!?  But everytime I see them obsess over cals, I freak out and I get scared that I'm going to end up looking like Amberlynn Reid by the end of next year. ",False,False
ebsplk5,t3_a607zr,t1_ebso6hg,lotsofsqs,1,2018-12-14 13:39:53,/r/EDAnonymous/comments/a607zr/just_a_reminder_a_certain_fat_people_hateesque/ebsplk5/,"I didn't see that post, but I remember seeing a similar one when I was on Tumblr way back in the day! I remember feeling ashamed for buying oversized clothes from thrift stores as a thin person. And I still don't because of it! I'm glad to know I've been unreasonably careful in this respect, lol.",False,True
ebsph2w,t3_a607zr,t1_ebs0u0h,Swanabe,1,2018-12-14 13:38:30,/r/EDAnonymous/comments/a607zr/just_a_reminder_a_certain_fat_people_hateesque/ebsph2w/,"I was in this treatment for a long time and I couldn’t explain every way in which they screwed me over unless I wrote you a 20 page essay, but to make a long story very short:   They taught me medical misinformation about health, nutrition, diabetes, metabolism, etc. These sessions of disseminating misinformation were framed as “lessons”. A lot of the things they told me could have literally been copy-pasted from FA tumblr pages (though I don’t even know if FA tumblr was a thing at the time, it was the late 2000’s). They showed us healthy women’s bodies and talked about how malnourished they must be, and showed us overweight and obese women and discussed how much better those women’s bodies could function. They were supposed to be professionals so I trusted and believed them.   They encouraged me to eat my feelings. I was literally told “when you’re stressed out and would usually work off that energy by exerting yourself physically, try eating a comfort meal like pasta or a sweet treat instead”. We had to write about how we were handling our feelings and were ENCOURAGED to use food as a coping mechanism for negative feelings, as well a way to celebrate victories.   They discouraged me from eating low cal high volume foods. One memory that enrages me to this day is of being discouraged from eating broccoli and other cruciferous veggies because they’re not high calorie enough. I was basically told that eating too many veggies is disordered and even taught that it would DAMAGE THE LINING OF MY STOMACH to eat too many fibrous veggies. I vividly recall being lectured about having a preference for cauliflower over potatoes and being told that was just my disordered brain trying to kill me.   They taught me that working out and other forms of exercise and physical excretion were always negative and disordered. Working out was only ever discussed as if it were inherently unpleasant and a self inflicted punishment. No one ever out and out said “working out is tantamount to self harming” but that was the message. Anything other than a half hour of slow yoga a day was discouraged and analyzed and judged and berated. I caught shit from a therapist for walking my dog “too long” every day, and was told I was damaging my own joints and my dogs joints by walking him for an hour a day, and was told to take my dog to the dog park so I could sit on a bench and relax while he played.   Every single person who was “treating me” were either overweight or obese and they used this as a tool to emotionally manipulate. If I said “well isn’t being too fat just as bad as being too thin?” responses were always “DO I LOOK UNHEALTHY TO YOU?! I’m healthy BECAUSE I’ve got more weight on me! You’re unhealthy because you’ve gotten too thin!!”. This is actually something I’ve experienced in every treatment situation I’ve ever been in. I’ve literally never had a recovery professional who was a healthy weight. The last time I tried to get help the only specialist in my area who took my insurance was borderline immobile due to her obesity and could barely fit through the door to her own office. It’s incredibly difficult to talk about weight issues to someone who’s morbidly obese themselves and WILL act as if their feelings are hurt when the topic of obesity being unhealthy comes up.",False,False
ebso6hg,t3_a607zr,t1_ebs63ez,unforgettable_potato,1,2018-12-14 13:23:20,/r/EDAnonymous/comments/a607zr/just_a_reminder_a_certain_fat_people_hateesque/ebso6hg/,"I have seen some good ones, like a bunch of women getting offended by diy faishon bloggers buying plus-sized clothing from thirft shops and remaking me. Speaking as someone who has a high BMI. GOOD. To me the clothes were sad and frumpy. (another rant for a different sub) They definitely weren't clothes I would want to wear. But sure enough, there was people on Tumblr crying that it was mocking overweight women (it wasn't) or acting like these bloggers were running over plus sized women in need or snatching the clothes out of their hands. Ugh. No, they are just diy-ers who saw a cheap source of fabric. Behavior like this? Yes, please roast them. They are acting nutty. They kinda need the piss taken out of them! I wish that sub was nothing but posts like that but alas! ",False,False
ebsngmz,t3_a607zr,t1_ebrvel9,cleanandlovely,1,2018-12-14 13:15:24,/r/EDAnonymous/comments/a607zr/just_a_reminder_a_certain_fat_people_hateesque/ebsngmz/,"The whole ""medications don't cause weight gain"" drives me crazy.  Ever heard of prednisone? It is a glucocorticoid that is notorious for causing weight gain due to various mechanisms of action. I read full studies on PubMed, Medscape, etc., in order to fully understand how it worked because I had read all the anecdotal horror stories online. Turns out, the drug promotes fluid retention, it increases appetite, and it also alters carbohydrate metabolism in such a way that people who are on high doses in the long-term can develop side effects like diabetes. It actually messes with your hormones (cortisol, insulin). It can also cause fat redistribution to weird places like your face and the back of your neck.  So, not to generalize, but certainly this is an example of a medication that absolutely can lead *directly* to weight gain. And here's the thing: it didn't work that way for me. No, I personally managed to lose weight while on prednisone (91 to 88 lbs) because I logged EVERY FUCKING THING I ATE and stayed below 800-1000 calories a day. But that's because I have another disease, it's called anorexia nervosa!  The fact that it's possible to avoid weight gain on any given medication does not necessarily mean it's reasonable to expect normal, sane people to fight their bodies like that.  &amp;#x200B;",False,False
ebsirxi,t3_a607zr,t1_ebshzq3,lotsofsqs,1,2018-12-14 12:20:15,/r/EDAnonymous/comments/a607zr/just_a_reminder_a_certain_fat_people_hateesque/ebsirxi/,"&gt; I've found it makes more likely to improve my eating habits, and to be able to laugh at the ridiculousness of my disordered thoughts.   I'm glad that you've had this experience. In some ways, I have too. But there's a reason why people in this sub go there to trigger themselves.  &gt; I don't think it is the time for people to equate loving your body with pretending that your weight is entirely out of control, and to give up and accept it. Body positivity should be all about accepting our inborn differences, and everyone improving our bodies through diet and excercise/maintaining a healthy weight, body fat% and nutrient level.   I agree. That's the true fat-logicy stuff I appreciate about the sub.   My original message is for *this* audience. This audience is filled with people with eating disorders who are much more likely to be underweight than the general population. My message is meant to say, ""That sub isn't for you. That sub isn't posting in the interest of those with eating disorders. If it makes you feel bad, leave.""   &amp;#x200B;",False,True
ebshzq3,t3_a607zr,t1_ebsgpq4,Ivydroplet,1,2018-12-14 12:10:51,/r/EDAnonymous/comments/a607zr/just_a_reminder_a_certain_fat_people_hateesque/ebshzq3/,"Look, I'm obviously not one to talk about having a healthy relationship with my body... look at the sub we're in. But the percent of people who are underweight in America is miniscule. Nearly 40% of the U.S. population is obese. The obesity epidemic is very real and very pressing. I don't think it is the time for people to equate loving your body with pretending that your weight is entirely out of control, and to give up and accept it. Body positivity should be all about accepting our inborn differences, and everyone improving our bodies through diet and excercise/maintaining a healthy weight, body fat% and nutrient level.   However, I do agree that the fatlogic sub can be hypocritical about underweight people. But personally, I think it has an overall positive influence. I've found it makes more likely to improve my eating habits, and to be able to laugh at the ridiculousness of my disordered thoughts. ",False,False
ebsgw3t,t3_a607zr,t1_ebsgo90,lotsofsqs,1,2018-12-14 11:57:37,/r/EDAnonymous/comments/a607zr/just_a_reminder_a_certain_fat_people_hateesque/ebsgw3t/,Ha. Fucked from the beginning! And so many poor babies whose parents feed them McDonalds for every meal :'(,False,True
ebsgpq4,t3_a607zr,t1_ebsfie6,lotsofsqs,1,2018-12-14 11:55:31,/r/EDAnonymous/comments/a607zr/just_a_reminder_a_certain_fat_people_hateesque/ebsgpq4/,"&gt; Part of ""loving your body"" *is* taking care of it.   I know and believe this. But people who love their body don't spend so much of their time and energy telling other people to change, which is what happens on FL. There's the true ""fat logic"" part of the sub, which I agree with. Then there's this secondary ""down with fat people"" attitude that has nothing to do with concern for fat people's health, which I think stems from insecurity rather than a real ""love/care for your body"" mentality. FL shits on people who are in the upper end of a healthy BMI and normalizes underweight.  But if you don't find that to be true, we should just agree to disagree. There are a lot of other comments on this post that I agree with, so if you're interested, I'd read those.",False,True
ebsgo90,t3_a607zr,t1_ebsg2g4,Daistis,1,2018-12-14 11:55:03,/r/EDAnonymous/comments/a607zr/just_a_reminder_a_certain_fat_people_hateesque/ebsgo90/,"Yeah, instead we got that god damn food pyramid 😭",False,False
ebsg2g4,t3_a607zr,t1_ebseyxv,lotsofsqs,1,2018-12-14 11:47:43,/r/EDAnonymous/comments/a607zr/just_a_reminder_a_certain_fat_people_hateesque/ebsg2g4/,"&gt; mindful eating *along with* nutrition   Yes, I agree. People recommend documenting every calorie at FL though, which is probably necessary for people on diets with no clue what's in the food their eating. I think if the mindfulness + nutrition approach was followed from kid through adult years, overeating in general would be much less of a problem. ",False,True
ebsfie6,t3_a607zr,t1_ebs8zto,Ivydroplet,1,2018-12-14 11:41:03,/r/EDAnonymous/comments/a607zr/just_a_reminder_a_certain_fat_people_hateesque/ebsfie6/,"What? Trying to improve your life doesn't go hand in hand with hating yourself. Part of ""loving your body"" *is* taking care of it. ",False,False
ebsez6n,t3_a607zr,t1_ebseyxv,[deleted],1,2018-12-14 11:34:29,/r/EDAnonymous/comments/a607zr/just_a_reminder_a_certain_fat_people_hateesque/ebsez6n/,[removed],False,False
ebseyxv,t3_a607zr,t1_ebs8nuq,Daistis,1,2018-12-14 11:34:24,/r/EDAnonymous/comments/a607zr/just_a_reminder_a_certain_fat_people_hateesque/ebseyxv/,"It's probably because a bunch of people, including HAES, somehow get ""eat whatever you want whenever you want"" from intuitive eating even though that's like the opposite of what it's supposed to be.   Honestly maybe a good balance between mindfulness and just being aware of what calories are and how they work could be our best shot, especially for people who are prone to overeating. I don't think applying CICO necessarily means documenting every calorie you eat, it can be just a background thing for healthy people ¯\\_(ツ)_/¯",False,False
ebsctzj,t3_a607zr,t1_ebs4ub0,nycthrowaway51,1,2018-12-14 11:09:37,/r/EDAnonymous/comments/a607zr/just_a_reminder_a_certain_fat_people_hateesque/ebsctzj/,"Oh sorry, I wasn't aware of that. In that case, I hope you stay safe.",False,False
