Comment ID,Link ID,Parent ID,Author,Score,Publish Date,Permalink,Text,Stickied,Is Submitter
finyrad,t3_f8rhnv,t1_finkgej,moonmosaic,1,2020-02-24 13:34:56,/r/EDAnonymous/comments/f8rhnv/unsupportive_boyfriend/finyrad/,"thank you, that is all very true! you are lucky I have a partner who understands I don’t think he sees it as a serious issue though to be quite honest  I talked to him about it and he said he will try in the future to be more supportive but he just didn’t get it and thought that it was comical I was scared of eating out we then had a debate about nutrition and veganism for ages",False,True
finkgej,t3_f8rhnv,t1_finjsr7,Ste_382,1,2020-02-24 11:22:43,/r/EDAnonymous/comments/f8rhnv/unsupportive_boyfriend/finkgej/,"Yeah, I have a few people in my life like that. The thing is, he doesn't even need to understand it himself, he just needs to understand that it's a serious issue and it does affect you in a very real way. As your partner he should at least be willing to accept that. You shouldn't be sacrificing your own mental health and wellbeing just because he has stuff on at work- lots of people experience work stress and don't belittle their partner's struggles because of it.  I honestly do understand how you feel, and it's a hard one as you say because it can be hard to know how to talk to them about it. I'm lucky that my partner gets my food struggles, but I've had plenty of people who don't see the big deal. But the fact is that it does affect you, and he needs to accept that his view of it is pretty narrow and it leaves you feeling like you can't talk to him and get that support from him that, as your partner, he should want to provide.",False,False
finjsr7,t3_f8rhnv,t1_fings4i,moonmosaic,1,2020-02-24 11:17:14,/r/EDAnonymous/comments/f8rhnv/unsupportive_boyfriend/finjsr7/,"Thank you for your help! I think the problem is that he is a logical person and not very empathetic, he doesn’t get eating disorders and views it as a teenage vanity issue caused by social media I’m not even sure how to bring it up with him to be honest, I feel like I’m making a mountain out of a molehill every time I mention it :/ he’s got things going on with work right now and I don’t want to cause extra stress or feel like a pain I’ve been watching some YouTube videos about anorexia recovery and her boyfriend was crazy supportive, whereas he won’t even mention unless I do",False,True
fings4i,t3_f8rhnv,t3_f8rhnv,Ste_382,1,2020-02-24 10:51:26,/r/EDAnonymous/comments/f8rhnv/unsupportive_boyfriend/fings4i/,"I firmly believe that as a partner its part of the job to support the person you're with with things they struggle with, whether or not you understand them yourself. My partner has gone through things that I haven't but I would never turn around to her and tell her that others have it worse. I think he's been extremely invalidating to you, and not understanding isn't really an excuse. If you've made it clear you really struggle with an ED, his response should be to find out more and try to understand how it might be affecting you and what he can do to support you.  I think you need to have this discussion with him and tell him explicitly how it makes you feel when be says things like that. You'll know who he really is as a person based on his response.",False,False
fin7420,t3_f8rhnv,t1_fin6uee,moonmosaic,1,2020-02-24 09:15:29,/r/EDAnonymous/comments/f8rhnv/unsupportive_boyfriend/fin7420/,thank you! I’m probably not going to bother right now but at some point it’s worth bringing up 😌,False,True
fin6uee,t3_f8rhnv,t3_f8rhnv,anjali666,1,2020-02-24 09:12:37,/r/EDAnonymous/comments/f8rhnv/unsupportive_boyfriend/fin6uee/,I hope you can talk with him and work through it together! Best of luck!😌,False,False
fin5z5b,t3_f8rhnv,t1_fin55m7,moonmosaic,1,2020-02-24 09:02:58,/r/EDAnonymous/comments/f8rhnv/unsupportive_boyfriend/fin5z5b/,"I definitely feel selfish talking about it, especially when like he said it’s basically not a real problem He doesn’t get eating disorders, which is fine but at least educate yourself and try to understand! It’s like he just doesn’t care sometimes Thank you for your help though 😊",False,True
fin55m7,t3_f8rhnv,t3_f8rhnv,anjali666,1,2020-02-24 08:53:42,/r/EDAnonymous/comments/f8rhnv/unsupportive_boyfriend/fin55m7/,"I think we forget how self absorbed we can be in the throes of an ED, which is why I tend not to talk about it to anyone but my treatment team. It’s difficult for normal eaters to understand and ends up sounding like petty and insignificant issues to them. I’m not at all saying that it is though! My husband has gone to many therapy and nutritionist appointments with me, and that did help, but he still struggles to wrap his mind around it. Open communication is important. Maybe give him some articles to read, and tell him how you felt invalidated by what he said. Also though if you are always talking about it, he may feel weary, and unsure of how to support you.",False,False
fin10o3,t3_f8rhnv,t3_f8rhnv,bozo0142,1,2020-02-24 08:03:56,/r/EDAnonymous/comments/f8rhnv/unsupportive_boyfriend/fin10o3/,"I relate to this a bit. My boyfriend is supportive but is really invalidating. Every time I tell him I'm struggling, he just says ""you're gonna be ok"" and it really gets tough to be open up to him.  I don't think you're asking for too much at all. Sometimes we just need someone to understand that we feel like crap, instead of undermining it or saying everything will be okay.",False,False
