Comment ID,Link ID,Parent ID,Author,Score,Publish Date,Permalink,Text,Stickied,Is Submitter
faimql3,t3_e98zy2,t3_e98zy2,throwaway37364783929,1,2019-12-11 18:46:48,/r/EDAnonymous/comments/e98zy2/do_any_of_yall_name_the_second_voice_in_your_head/faimql3/,Bitch witch,False,False
fai55v3,t3_e98zy2,t1_fai54xm,MagiPan,1,2019-12-11 15:34:20,/r/EDAnonymous/comments/e98zy2/do_any_of_yall_name_the_second_voice_in_your_head/fai55v3/,Exactly,False,True
fai54xm,t3_e98zy2,t1_fai51af,grumpygrumbles,1,2019-12-11 15:34:04,/r/EDAnonymous/comments/e98zy2/do_any_of_yall_name_the_second_voice_in_your_head/fai54xm/,"Yep, they’re your peanut gallery 👀",False,False
fai51af,t3_e98zy2,t1_fai3jek,MagiPan,1,2019-12-11 15:33:05,/r/EDAnonymous/comments/e98zy2/do_any_of_yall_name_the_second_voice_in_your_head/fai51af/,"I don't consider them a part of me, but rather shitty friends who won't leave.",False,True
fai3jek,t3_e98zy2,t3_e98zy2,grumpygrumbles,1,2019-12-11 15:18:23,/r/EDAnonymous/comments/e98zy2/do_any_of_yall_name_the_second_voice_in_your_head/fai3jek/,"Eating disorder is just Ed to me. I named my ED, anxiety, depression, OCD, and shame and my therapist and I discuss them like they’re real people 😂",False,False
fahtn2n,t3_e98zy2,t1_fahtijh,MagiPan,1,2019-12-11 13:40:51,/r/EDAnonymous/comments/e98zy2/do_any_of_yall_name_the_second_voice_in_your_head/fahtn2n/,I'm w college student. I think the lizard is smarter than me...,False,True
fahtjr1,t3_e98zy2,t1_fahb5he,MagiPan,1,2019-12-11 13:39:55,/r/EDAnonymous/comments/e98zy2/do_any_of_yall_name_the_second_voice_in_your_head/fahtjr1/,Ahhhhh,False,True
fahtijh,t3_e98zy2,t3_e98zy2,esberanza,1,2019-12-11 13:39:35,/r/EDAnonymous/comments/e98zy2/do_any_of_yall_name_the_second_voice_in_your_head/fahtijh/,"I call mine ""Lizard Brain"".",False,False
fahtica,t3_e98zy2,t1_fahthhl,MagiPan,1,2019-12-11 13:39:32,/r/EDAnonymous/comments/e98zy2/do_any_of_yall_name_the_second_voice_in_your_head/fahtica/,Lol,False,True
fahthhl,t3_e98zy2,t3_e98zy2,LowCalPal,1,2019-12-11 13:39:17,/r/EDAnonymous/comments/e98zy2/do_any_of_yall_name_the_second_voice_in_your_head/fahthhl/,I call it Chelsea.  No idea why.,False,False
fahswez,t3_e98zy2,t1_fahskb4,MagiPan,1,2019-12-11 13:33:25,/r/EDAnonymous/comments/e98zy2/do_any_of_yall_name_the_second_voice_in_your_head/fahswez/,"Appropriate.  I like to draw a lot. It helps me cope with stress. I made characters for my 3 migraines diseases, and I make small comics where I interact with them and it helps make it, idk, more fun?    I thought I could do the same for this.",False,True
fahskb4,t3_e98zy2,t3_e98zy2,icetesseracts,1,2019-12-11 13:30:03,/r/EDAnonymous/comments/e98zy2/do_any_of_yall_name_the_second_voice_in_your_head/fahskb4/,"I used to call her Ana, like a proper cringey melodramatic kid.  Now it's ""Monster.""",False,False
fahggoc,t3_e98zy2,t3_e98zy2,junebug-2019,1,2019-12-11 11:31:08,/r/EDAnonymous/comments/e98zy2/do_any_of_yall_name_the_second_voice_in_your_head/fahggoc/,Trump is my ED name.,False,False
fahb5he,t3_e98zy2,t1_fah78ow,ZiggyStardustWasHere,1,2019-12-11 10:46:53,/r/EDAnonymous/comments/e98zy2/do_any_of_yall_name_the_second_voice_in_your_head/fahb5he/,Anorexia.  Rex is the male equivalent of Ana.,False,False
fah9y54,t3_e98zy2,t1_fah8awy,mud_octopus,1,2019-12-11 10:36:55,/r/EDAnonymous/comments/e98zy2/do_any_of_yall_name_the_second_voice_in_your_head/fah9y54/,Haha this makes sense.,False,False
fah8awy,t3_e98zy2,t1_fah82vx,MagiPan,1,2019-12-11 10:22:22,/r/EDAnonymous/comments/e98zy2/do_any_of_yall_name_the_second_voice_in_your_head/fah8awy/,"I just wanna be like ""Shut up Becky""  Idk if I'm gonna name it Becky",False,True
fah82vx,t3_e98zy2,t3_e98zy2,mud_octopus,1,2019-12-11 10:20:16,/r/EDAnonymous/comments/e98zy2/do_any_of_yall_name_the_second_voice_in_your_head/fah82vx/,"I don't name it, but I do perceive it as a separate entity from ""me"". Which is really hard to explain to normal people, hah.   I'm not into naming stuff in general though (like inanimate objects, body parts ...I know others like to, and it feels similar?)",False,False
fah7cpd,t3_e98zy2,t3_e98zy2,anamiahoe,1,2019-12-11 10:13:09,/r/EDAnonymous/comments/e98zy2/do_any_of_yall_name_the_second_voice_in_your_head/fah7cpd/,Named it Astro. Idk.,False,False
fah78ow,t3_e98zy2,t1_fah74ad,MagiPan,1,2019-12-11 10:11:57,/r/EDAnonymous/comments/e98zy2/do_any_of_yall_name_the_second_voice_in_your_head/fah78ow/,Why did you pick Rex?,False,True
fah74ad,t3_e98zy2,t3_e98zy2,ZiggyStardustWasHere,1,2019-12-11 10:10:41,/r/EDAnonymous/comments/e98zy2/do_any_of_yall_name_the_second_voice_in_your_head/fah74ad/,Rex is his name.,False,False
