Comment ID,Link ID,Parent ID,Author,Score,Publish Date,Permalink,Text,Stickied,Is Submitter
f1fec67,t3_d8qmyk,t3_d8qmyk,QueerHoe,1,2019-09-25 15:17:48,/r/EDAnonymous/comments/d8qmyk/anyone_else_really_enjoy_feeling_hungry/f1fec67/,"When I'm hungry I feel alert, productive and good in my body.  I hate feeling full",False,False
f1ciy6d,t3_d8qmyk,t3_d8qmyk,back2decembr,1,2019-09-24 15:55:50,/r/EDAnonymous/comments/d8qmyk/anyone_else_really_enjoy_feeling_hungry/f1ciy6d/,Yes! I'm afraid to eat to the point of being full because then i feel like i'm gaining weight,False,False
f1cbpte,t3_d8qmyk,t3_d8qmyk,red_ossifrage,1,2019-09-24 14:43:57,/r/EDAnonymous/comments/d8qmyk/anyone_else_really_enjoy_feeling_hungry/f1cbpte/,I feel better when I'm hungry and am convinced it's partly physiological,False,False
f1c66og,t3_d8qmyk,t3_d8qmyk,tigerchik,1,2019-09-24 13:46:31,/r/EDAnonymous/comments/d8qmyk/anyone_else_really_enjoy_feeling_hungry/f1c66og/,yes,False,False
f1c4g7u,t3_d8qmyk,t3_d8qmyk,karentakethekids,1,2019-09-24 13:28:04,/r/EDAnonymous/comments/d8qmyk/anyone_else_really_enjoy_feeling_hungry/f1c4g7u/,When i feel full i get v anxious n cant wait to excercise it off no matter if its just a salad :&lt;,False,False
f1c1j0t,t3_d8qmyk,t3_d8qmyk,webtrauma,1,2019-09-24 12:56:36,/r/EDAnonymous/comments/d8qmyk/anyone_else_really_enjoy_feeling_hungry/f1c1j0t/, Yes,False,False
