Comment ID,Link ID,Parent ID,Author,Score,Publish Date,Permalink,Text,Stickied,Is Submitter
f7aixvr,t3_dux1du,t1_f7ahbbb,Redjay12,1,2019-11-11 21:47:42,/r/EDAnonymous/comments/dux1du/i_didnt_delete_the_calorie_counting_app_but_i/f7aixvr/,good job!!!,False,True
f7ahbbb,t3_dux1du,t3_dux1du,ifuckpineapples,1,2019-11-11 21:27:53,/r/EDAnonymous/comments/dux1du/i_didnt_delete_the_calorie_counting_app_but_i/f7ahbbb/,"I did the same thing today! I was sick of the constant hunger pangs and the anxiety of going over my goal that I said screw it, I'm eating a normal amount. you got this!",False,False
f7aamd3,t3_dux1du,t1_f7a7jnn,Redjay12,1,2019-11-11 20:10:31,/r/EDAnonymous/comments/dux1du/i_didnt_delete_the_calorie_counting_app_but_i/f7aamd3/,yes! it’s a win. it’s really difficult to delete all the knowledge of calories you’ve gained so counting in your head is difficult to undo,False,True
f7a7jnn,t3_dux1du,t3_dux1du,melukia,1,2019-11-11 19:33:34,/r/EDAnonymous/comments/dux1du/i_didnt_delete_the_calorie_counting_app_but_i/f7a7jnn/,"Yes! We can do this!  I also haven't deleted the app, but I deleted the widget. I'm still counting in my brain, but it's all in estimates, so I guess that's also a win?",False,False
f78yf4t,t3_dux1du,t1_f78x43x,Redjay12,1,2019-11-11 13:21:36,/r/EDAnonymous/comments/dux1du/i_didnt_delete_the_calorie_counting_app_but_i/f78yf4t/,thank you!,False,True
f78x43x,t3_dux1du,t3_dux1du,flowertattooonherarm,1,2019-11-11 13:12:52,/r/EDAnonymous/comments/dux1du/i_didnt_delete_the_calorie_counting_app_but_i/f78x43x/,"proud of u hun, u got this (:",False,False
