Comment ID,Link ID,Parent ID,Author,Score,Publish Date,Permalink,Text,Stickied,Is Submitter
ewn00mp,t3_coyogg,t3_coyogg,tigerchik,1,2019-08-11 18:08:34,/r/EDAnonymous/comments/coyogg/i_need_to_vent_about_fear_foods_for_a_sec_because/ewn00mp/,"Like someone else suggested, you can buy single-servings! Would that help?",False,False
ewmu4kt,t3_coyogg,t3_coyogg,kenziixoxo,1,2019-08-11 16:56:18,/r/EDAnonymous/comments/coyogg/i_need_to_vent_about_fear_foods_for_a_sec_because/ewmu4kt/,"Peanut butter was my #1 fear food too. :(  I’m sure you’ve tried so many things, but something that has helped me is that I buy those to-go containers of peanut butter that are like 200 Cal. IDK how tightly you restrict but I normally am ok fitting these in and since they’re proportioned I’m not likely to binge.  you aren’t crazy, your ed just really likes peanut butter ❤️",False,False
ewmnsl2,t3_coyogg,t3_coyogg,sintos-compa,1,2019-08-11 15:42:10,/r/EDAnonymous/comments/coyogg/i_need_to_vent_about_fear_foods_for_a_sec_because/ewmnsl2/,"Yes. I fucking love nut butters. There’s gotta be some chemical explanation, but I simply CANNOT have them at home or I will binge the entire jar in one sitting.",False,False
ewmdtq3,t3_coyogg,t1_ewmd40u,dockmackie,1,2019-08-11 13:47:14,/r/EDAnonymous/comments/coyogg/i_need_to_vent_about_fear_foods_for_a_sec_because/ewmdtq3/,"Oh my god. Same!! For me, even low cal ice creams have become fear foods!! How lame is that! I bought a tub of Breyers and licked the top layer off and put it in the freezer and I haven't stopped feeling anxious since.",False,True
ewmd40u,t3_coyogg,t3_coyogg,im_a_bullfrog,1,2019-08-11 13:39:12,/r/EDAnonymous/comments/coyogg/i_need_to_vent_about_fear_foods_for_a_sec_because/ewmd40u/,I'll stare at mine over and over... for days.  Eventually I'll scoop a taste with ONE chopstick.... then feel like a total failure for the day. I'm ridiculous.,False,False
