Comment ID,Link ID,Parent ID,Author,Score,Publish Date,Permalink,Text,Stickied,Is Submitter
ehsab7f,t3_ax9w5y,t3_ax9w5y,boxxfive,1,2019-03-04 13:06:02,/r/EDAnonymous/comments/ax9w5y/men_are_such_a_trigger_for_me/ehsab7f/,"I get unexpectedly triggered by fit young men, somehow moreso than by fit women! I don't want to look like that, or be a man - maybe it's just how little fat or curves they have on their bodies combining unexpectedly with my attraction for them. Who knows. ",False,False
ehsa0uk,t3_ax9w5y,t3_ax9w5y,relapseandrecovery,1,2019-03-04 13:02:42,/r/EDAnonymous/comments/ax9w5y/men_are_such_a_trigger_for_me/ehsa0uk/,Male fat distribution is truly unkind. Their legs tend to always look nice and skinny at normal weights and they naturally have higher bmrs,False,False
ehs9y2w,t3_ax9w5y,t1_ehs8k0m,amorae,1,2019-03-04 13:01:48,/r/EDAnonymous/comments/ax9w5y/men_are_such_a_trigger_for_me/ehs9y2w/,"I mean I know we all know how “naturally thin,” is not really a thing, at least to the extent most people think it is, but don’t men, on average, objectively have a higher muscle to fat ratio than women?",False,False
ehs9a32,t3_ax9w5y,t3_ax9w5y,IDontLikeLollipops,1,2019-03-04 12:54:22,/r/EDAnonymous/comments/ax9w5y/men_are_such_a_trigger_for_me/ehs9a32/,"My fucking lab partner is 6'6"". His tdee makes me want to kms.",False,False
ehs8keh,t3_ax9w5y,t3_ax9w5y,PyrotechnicTurtle,1,2019-03-04 12:46:23,/r/EDAnonymous/comments/ax9w5y/men_are_such_a_trigger_for_me/ehs8keh/,"As a man, I've always experienced objectification and high body standards from women. I know my experiences may not represent the population, but personally the snide comments and the people calling my ugly to my face is what drove me to my ED in the first place. And all of those people were women.",False,False
ehs8k0m,t3_ax9w5y,t3_ax9w5y,cummo22,1,2019-03-04 12:46:15,/r/EDAnonymous/comments/ax9w5y/men_are_such_a_trigger_for_me/ehs8k0m/,I know you’re really just ranting / frustrated but please... none of this is true at all ,False,False
ehs8hef,t3_ax9w5y,t3_ax9w5y,briarsrose_,1,2019-03-04 12:45:25,/r/EDAnonymous/comments/ax9w5y/men_are_such_a_trigger_for_me/ehs8hef/,"My ex would literally eat McDonald’s almost 10x a week, like actual meals, and had a BMI of 18 :/",False,False
