Comment ID,Link ID,Parent ID,Author,Score,Publish Date,Permalink,Text,Stickied,Is Submitter
ebcgmm5,t3_a2hq5e,t3_a2hq5e,girlinamber,1,2018-12-08 02:49:42,/r/EDAnonymous/comments/a2hq5e/whats_the_most_annoying_thing_people_say_to_you/ebcgmm5/,"""you cant have an eating disorder, you're kinda chubby""  😕",False,False
eb8vt27,t3_a2hq5e,t1_eazo0ge,Jenny_Roberts,1,2018-12-06 16:21:06,/r/EDAnonymous/comments/a2hq5e/whats_the_most_annoying_thing_people_say_to_you/eb8vt27/,"Exactly!!! Or the blank stare: ""just eat in moderation""  Yeah, and why don't you just do heroin in moderation? It doesn't work like that for me!",False,False
eb1cm1h,t3_a2hq5e,t1_eazj2u0,ceruleanohara,1,2018-12-03 18:25:59,/r/EDAnonymous/comments/a2hq5e/whats_the_most_annoying_thing_people_say_to_you/eb1cm1h/,"I don't really, that's why I'm here lol",False,False
eb0laqx,t3_a2hq5e,t3_a2hq5e,birdsbirdsbirds339,1,2018-12-03 12:48:12,/r/EDAnonymous/comments/a2hq5e/whats_the_most_annoying_thing_people_say_to_you/eb0laqx/,"my friends when we're at a night out: ""it's ok to order xyz, it's a cheat day""!   ""just one cheat day"" always turns into a 3 day binge bender sorry fam ",False,False
eb0aupg,t3_a2hq5e,t1_eazgnvb,dansla116,1,2018-12-03 10:45:46,/r/EDAnonymous/comments/a2hq5e/whats_the_most_annoying_thing_people_say_to_you/eb0aupg/,"My response to that one is ""Well the bar isn't set very high.""",False,False
eb0a9zd,t3_a2hq5e,t1_eayoyra,dansla116,1,2018-12-03 10:38:12,/r/EDAnonymous/comments/a2hq5e/whats_the_most_annoying_thing_people_say_to_you/eb0a9zd/,&gt; I wish I could eat like you and stay skinny  You wish to starve yourself all day and be miserable?,False,False
eazz2y9,t3_a2hq5e,t3_a2hq5e,gatechnightman,1,2018-12-03 07:57:55,/r/EDAnonymous/comments/a2hq5e/whats_the_most_annoying_thing_people_say_to_you/eazz2y9/,"""Do you, like, not eat?""   ""Here this is nothing food/healthy food... you'll eat that right?""  ""Oh so you wont eat ___, but you'll eat ___?""   Fucking just dont talk about what I eat, it gives me a panic attack every time. ",False,False
eazyylg,t3_a2hq5e,t1_eazntc8,gatechnightman,1,2018-12-03 07:55:48,/r/EDAnonymous/comments/a2hq5e/whats_the_most_annoying_thing_people_say_to_you/eazyylg/,"Seriously FUCK people that think this disorder is a ""diet""",False,False
eazs06i,t3_a2hq5e,t1_eayt7mo,dragaynite,1,2018-12-03 05:17:24,/r/EDAnonymous/comments/a2hq5e/whats_the_most_annoying_thing_people_say_to_you/eazs06i/,S t a r v a t i o n  m o d e 👏🏻👏🏻👏🏻 oh my god if I hear that one more time I will screaaaam,False,False
eazqx1q,t3_a2hq5e,t3_a2hq5e,stopshop,1,2018-12-03 04:40:47,/r/EDAnonymous/comments/a2hq5e/whats_the_most_annoying_thing_people_say_to_you/eazqx1q/,"“Oh, you dont eat cake” “oh, you dont eat bread” “oh, you dont eat....” whenever i recline something. I hate the attention on me/my weight/my body and on my eating. Just leave me alone pls",False,False
eazqku9,t3_a2hq5e,t1_eazo0ge,lintuski,1,2018-12-03 04:29:21,/r/EDAnonymous/comments/a2hq5e/whats_the_most_annoying_thing_people_say_to_you/eazqku9/,Tooooo real. ,False,False
eazpq2s,t3_a2hq5e,t3_a2hq5e,snefferu,1,2018-12-03 03:59:57,/r/EDAnonymous/comments/a2hq5e/whats_the_most_annoying_thing_people_say_to_you/eazpq2s/,"“You need a steak”   🙄 ffs I’m veggie 😏  “You’re too thin”   um yeah I know, also it’s kinda rude. Would you tell someone “you’re too fat”? Don’t think so 🙄  “Don’t lose any more weight”    Well I’m trying not to!   This was also utterly pointless when I was in a relapse, because like I would’ve listened anyway 😂",False,False
eazo0ge,t3_a2hq5e,t1_eazi91o,Zanzalarious,1,2018-12-03 03:01:03,/r/EDAnonymous/comments/a2hq5e/whats_the_most_annoying_thing_people_say_to_you/eazo0ge/,"Same!!  Me: Sooooo, once I start eating, I can't stop until I've had at least, like,  1500 calories. And you're saying I should do that 5 to 6 times a day? I'll get right on that.",False,False
eaznxrd,t3_a2hq5e,t1_eazkiye,I_like_your_unit,1,2018-12-03 02:58:35,/r/EDAnonymous/comments/a2hq5e/whats_the_most_annoying_thing_people_say_to_you/eaznxrd/,"Ughhhhhh. Yes. I once tried to order 6 chicken nuggets and the girl told me ""I'm giving you 9 because it's the same price"" and I actually had to ARGUE with her to just give me 6 because I DONT WANT 9. Fuck off, let me order what I want, or at least ask me nicely if I'd like more than 6 instead of shoving it in my face.",False,False
eazntc8,t3_a2hq5e,t3_a2hq5e,LittleBookOfSorrows,1,2018-12-03 02:54:31,/r/EDAnonymous/comments/a2hq5e/whats_the_most_annoying_thing_people_say_to_you/eazntc8/,"""I wish I was anorexic for a month so I could stick to my diet"".  &amp;#x200B;  Ugh.  Here, please take my ED and don't bother to return it.",False,False
eazkiye,t3_a2hq5e,t3_a2hq5e,taitabo,1,2018-12-03 01:19:11,/r/EDAnonymous/comments/a2hq5e/whats_the_most_annoying_thing_people_say_to_you/eazkiye/,"I had a fast food girl say to me rudely, ""YOU don't need to worry about that!"" When I ordered a Fresca, and a salad with no dressing and no surgar coated nuts. Like, fuck off, the reason I'm skinny is BECAUSE I WORRY ABOUT SHIT LIKE THAT. ",False,False
eazjgwq,t3_a2hq5e,t3_a2hq5e,publius-esquire,1,2018-12-03 00:53:28,/r/EDAnonymous/comments/a2hq5e/whats_the_most_annoying_thing_people_say_to_you/eazjgwq/,"“It’s sooo terrible how society makes girls compete to be the prettiest/skinniest :/”  Uhhh what?? First of all compete for what, you know I’m a lesbian Karen, and secondly if I wanted to be the prettiest I wouldn’t make myself puke cause it’s Very Gross.   She also says shit like “my stomach has just gotten smaller!” Because she’s extremely self-centered and doesn’t realize that other people might struggle with disordered eating too even though I’ve told her about mine.",False,False
eazj9cx,t3_a2hq5e,t1_eayfhzk,publius-esquire,1,2018-12-03 00:48:24,/r/EDAnonymous/comments/a2hq5e/whats_the_most_annoying_thing_people_say_to_you/eazj9cx/,"UGH I know. Like, no, I am A) very much average and B) have been learning my whole life how to dress to make me appear skinniest. It’s a fucking obstacle illusion Karen. It’s a tailored suit of lies!",False,False
eazj2u0,t3_a2hq5e,t1_eazcqwq,sstephenn,1,2018-12-03 00:43:57,/r/EDAnonymous/comments/a2hq5e/whats_the_most_annoying_thing_people_say_to_you/eazj2u0/,oh god how do u survive ,False,False
eaziyn8,t3_a2hq5e,t1_eaysmc1,sstephenn,1,2018-12-03 00:41:08,/r/EDAnonymous/comments/a2hq5e/whats_the_most_annoying_thing_people_say_to_you/eaziyn8/,oh fuck I felt this,False,False
eazinuz,t3_a2hq5e,t1_eaz03ox,Jenny_Roberts,1,2018-12-03 00:34:02,/r/EDAnonymous/comments/a2hq5e/whats_the_most_annoying_thing_people_say_to_you/eazinuz/,"My BF's crush before me is about 98lbs, so I feel ya ",False,False
eazi91o,t3_a2hq5e,t3_a2hq5e,Jenny_Roberts,1,2018-12-03 00:24:28,/r/EDAnonymous/comments/a2hq5e/whats_the_most_annoying_thing_people_say_to_you/eazi91o/,"Me, fasting to battle my BED, which is unstoppable unless I'm only drinking coffee and broth:  Someone else: Yeah, fasting will make you go into starvation mode! It's much healthier to eat 5-6 small meals a day, you'll lose weight faster that way!",False,False
eazhsp0,t3_a2hq5e,t3_a2hq5e,makemedizzy,1,2018-12-03 00:14:19,/r/EDAnonymous/comments/a2hq5e/whats_the_most_annoying_thing_people_say_to_you/eazhsp0/,"“Guys will find you scary if you go under ( overweight for my weight )!!!!” Like good, Karen I’m a lesbian so it doesn’t matter",False,False
eazgnvb,t3_a2hq5e,t3_a2hq5e,Isaidbiiiitttttttchh,1,2018-12-02 23:49:50,/r/EDAnonymous/comments/a2hq5e/whats_the_most_annoying_thing_people_say_to_you/eazgnvb/,"“You’re already in better shape than everyone else we know”   Yeah because they’re all overweight it’s Alabama, everyone is so fat here... :-( ",False,False
eazglh4,t3_a2hq5e,t3_a2hq5e,CalmConcern,1,2018-12-02 23:48:25,/r/EDAnonymous/comments/a2hq5e/whats_the_most_annoying_thing_people_say_to_you/eazglh4/,"“You’re finally eating!” Or anything else that’s as, if not more condescending.      ",False,False
eazfai2,t3_a2hq5e,t1_eaymmx2,Bomby57,1,2018-12-02 23:22:14,/r/EDAnonymous/comments/a2hq5e/whats_the_most_annoying_thing_people_say_to_you/eazfai2/,"My co-worker often says that and I hate her. She has no self control whatsoever. She's not fat but not average either.   Sometimes, she would take a breakfast at home, another breakfast at work and then lunch. By that time, lunch is my only meal in the last 24h and she dares telling me ""you're so lucky, you can eat whatever you want and not get fat"".   Last time I was tired and pissed of hearing that I told her ""No, I'm actually on a perpetual diet"" and she didn't really answer... ",False,False
eazf3ld,t3_a2hq5e,t3_a2hq5e,1-800-FixYourFace,1,2018-12-02 23:18:39,/r/EDAnonymous/comments/a2hq5e/whats_the_most_annoying_thing_people_say_to_you/eazf3ld/,"“Wow, your metabolism is so fast!”  Okurrrrrr well I eat 500 cals a day. But yup whatever ya say...so metabolized, much fast.  ",False,False
eazdnlj,t3_a2hq5e,t1_eayhyf4,seasth,1,2018-12-02 22:52:10,/r/EDAnonymous/comments/a2hq5e/whats_the_most_annoying_thing_people_say_to_you/eazdnlj/,"One of the times I have felt the most anxious, triggered, and horrible was when a girl I knew (and liked, and whose body I admired) in college started talking (in the dining hall, of all fucking places) about how horrible her eating disorder had been, and all the physical damage it had done to her body and heart and stuff.  She was talking about it in terms of “this is a bad, horrible thing that can happen, I could have died” but at the time I was fully aware that I had a death wish, and it just made me feel horrible that she wouldn’t stop talking about it and horrible that I hadn’t managed to do that to myself yet ",False,False
eazdn4m,t3_a2hq5e,t1_eayfo31,rosie1881,1,2018-12-02 22:51:57,/r/EDAnonymous/comments/a2hq5e/whats_the_most_annoying_thing_people_say_to_you/eazdn4m/,My life 😭,False,False
eazdics,t3_a2hq5e,t1_eaymmx2,ShannonAnon,1,2018-12-02 22:49:38,/r/EDAnonymous/comments/a2hq5e/whats_the_most_annoying_thing_people_say_to_you/eazdics/,“Skinny people eat whatever they want” is the biggest lie I was ever sold on. ,False,False
eazcqwq,t3_a2hq5e,t3_a2hq5e,ceruleanohara,1,2018-12-02 22:37:32,/r/EDAnonymous/comments/a2hq5e/whats_the_most_annoying_thing_people_say_to_you/eazcqwq/,"Make a meal for 6 kids, husband, mil, and a few extra ppl that like to show up at meal time.   MIL- ""MAKE ROOM FOR YOUR MAMA! SHE NEEDS TO SIT AND EAT! SHE'S GOTTA EAT SOMETHING! SIT DOWN AND EAT WITH US!!!!!""  Well, now that you've yelled out in front of like 12 people that I have to eat, I'm gonna go ahead and FUCKING NOT EAT IN FRONT OF PEOPLE WHO WILL STARE AT ME EATING LIKE A HUGE PIG. Thanks MIL.   This happens like three times a week. ",False,False
eazc92t,t3_a2hq5e,t3_a2hq5e,cervidaes,1,2018-12-02 22:30:24,/r/EDAnonymous/comments/a2hq5e/whats_the_most_annoying_thing_people_say_to_you/eazc92t/,“Just make sure you’re eating enough” I mean ..... like obviously I’m .... not going to do that ..... I just told you I have an eating disorder ,False,False
eazbkfb,t3_a2hq5e,t3_a2hq5e,SquirrelMcPants,1,2018-12-02 22:19:31,/r/EDAnonymous/comments/a2hq5e/whats_the_most_annoying_thing_people_say_to_you/eazbkfb/,“You shouldn’t lose more weight. You’re at a normal weight! Just eat!”  🙃🙃🙃🙃🙃🙃🙃🙃,False,False
eaz989c,t3_a2hq5e,t1_eayfo31,pomegranate_rose,1,2018-12-02 21:43:58,/r/EDAnonymous/comments/a2hq5e/whats_the_most_annoying_thing_people_say_to_you/eaz989c/,This is me.,False,False
eaz7sn1,t3_a2hq5e,t1_eaz6r2w,FridgethatRidge,1,2018-12-02 21:21:50,/r/EDAnonymous/comments/a2hq5e/whats_the_most_annoying_thing_people_say_to_you/eaz7sn1/,"Same, in volleyball people would always be like, ""you're so thin!"" And like squish my arm and it was so uncomfortable",False,False
eaz6r2w,t3_a2hq5e,t3_a2hq5e,honeyeyedbutts,1,2018-12-02 21:06:22,/r/EDAnonymous/comments/a2hq5e/whats_the_most_annoying_thing_people_say_to_you/eaz6r2w/,not solely verbal but i absolutely hate it when people touch/grab me or squeeze my arm in order to try and emphasize how thin they think i look ,False,False
eaz4fx7,t3_a2hq5e,t3_a2hq5e,IntoYourHeart,1,2018-12-02 20:33:37,/r/EDAnonymous/comments/a2hq5e/whats_the_most_annoying_thing_people_say_to_you/eaz4fx7/,"""Just stop overeating/binging""   Thanks I never thought of that before, I'm cured",False,False
eaz1vqr,t3_a2hq5e,t1_eaz1kd4,Sockapoodledoo,1,2018-12-02 19:57:14,/r/EDAnonymous/comments/a2hq5e/whats_the_most_annoying_thing_people_say_to_you/eaz1vqr/,“What?! I need to eat to stay alive?! How did I get to 25 and not know this?? Omg I’m shocked thank you so much babe.”     /dead,False,False
eaz1kd4,t3_a2hq5e,t1_eaz1e1z,songfireleaf,1,2018-12-02 19:52:43,/r/EDAnonymous/comments/a2hq5e/whats_the_most_annoying_thing_people_say_to_you/eaz1kd4/,"""Wow I had absolutely no idea that living off of basically nothing could possibly be bad for me!"" Like good god we definitely know it ain't good",False,False
eaz1ig3,t3_a2hq5e,t3_a2hq5e,Sockapoodledoo,1,2018-12-02 19:51:57,/r/EDAnonymous/comments/a2hq5e/whats_the_most_annoying_thing_people_say_to_you/eaz1ig3/,“One piece won’t hurt you.”     That’s weird because I tried living by “one piece won’t hurt me” and I gained 15 lbs in 3 weeks. ,False,False
eaz1e1z,t3_a2hq5e,t1_eayhyf4,Sockapoodledoo,1,2018-12-02 19:50:10,/r/EDAnonymous/comments/a2hq5e/whats_the_most_annoying_thing_people_say_to_you/eaz1e1z/,"I my boyfriend that I was speculating how his friend got so skinny (she went from overweight to a stick like, crazy fast), and he told me, “oh, I know how. She only ate *1000 calories a day.*” I literally laughed out loud. He knows about my ED. I told him, “My lowest restriction was 400 calories a day once” and I thought his eyes were going to explode out of his head. Super judgey voice comes out and he goes, “you know that’s super unhealthy for you, right? Like that could have serious health consequences. Your body can’t run right.”  Uhhhhh no shit Sherlock. You think I don’t know this is *bad*? ",False,False
eaz0nwm,t3_a2hq5e,t3_a2hq5e,Serenescence,1,2018-12-02 19:39:50,/r/EDAnonymous/comments/a2hq5e/whats_the_most_annoying_thing_people_say_to_you/eaz0nwm/,"“I wish I had your legs and your flat stomach!”  Uh.. no? My stomach is the only part of me that surprisingly looks underweight even tho I’m only just borderline UW, and my legs are literally COVERED in cellulite which is why I never go bare legged. If you saw me bare legged you wouldn’t ever say you wish you had my legs lmao",False,False
eaz0664,t3_a2hq5e,t3_a2hq5e,bellamoth,1,2018-12-02 19:33:01,/r/EDAnonymous/comments/a2hq5e/whats_the_most_annoying_thing_people_say_to_you/eaz0664/,"""Have you tried not worrying about your weight so much and just eating when you're hungry?"" :))))))  ^oh wow I didn't fucking think of that thanks ",False,False
eaz03ox,t3_a2hq5e,t3_a2hq5e,luvlasso,1,2018-12-02 19:32:02,/r/EDAnonymous/comments/a2hq5e/whats_the_most_annoying_thing_people_say_to_you/eaz03ox/,my boyfriend tells me that i should stop trying to lose weight soon because i look “fine” pretty often and it drives me fucking i n s a n e because i’m 15 lbs heavier than his ex was after she “got fat” lmao ,False,False
eayv999,t3_a2hq5e,t3_a2hq5e,PinkyOutYo,1,2018-12-02 18:37:00,/r/EDAnonymous/comments/a2hq5e/whats_the_most_annoying_thing_people_say_to_you/eayv999/,"""You look healthier than when I last saw you!""  Fuck off, mate, just tell me I'm fat and be done with it.",False,False
eayu1qe,t3_a2hq5e,t3_a2hq5e,letsgetlower,1,2018-12-02 18:24:49,/r/EDAnonymous/comments/a2hq5e/whats_the_most_annoying_thing_people_say_to_you/eayu1qe/,"“Is it because you think you’re fat?”  I never know what to say to this because I don’t even know why I have this disorder, I just do. It feels trivializing af ",False,False
eayte8v,t3_a2hq5e,t3_a2hq5e,michellenemangepas,1,2018-12-02 18:18:22,/r/EDAnonymous/comments/a2hq5e/whats_the_most_annoying_thing_people_say_to_you/eayte8v/,My mom told me I should stop losing weight. That this is a good weight for me.   No. And any doctor would tell you losing weight is perfectly fine for me. ,False,False
eayt7mo,t3_a2hq5e,t3_a2hq5e,empTXistence,1,2018-12-02 18:16:33,/r/EDAnonymous/comments/a2hq5e/whats_the_most_annoying_thing_people_say_to_you/eayt7mo/,bUt sTaRvAtIOn mOdE    yOuRe aLrEaDy sKiNNy    tHaTs nOt vEry hEaLtHy   I need a lot less of people opinions than they seem to think 😒   ,False,False
eaysmc1,t3_a2hq5e,t3_a2hq5e,IDontLikeLollipops,1,2018-12-02 18:10:38,/r/EDAnonymous/comments/a2hq5e/whats_the_most_annoying_thing_people_say_to_you/eaysmc1/,When they bring up your eating habits in a group and suddenly everyone is discussing how you eat and you just have to sit there and take it,False,False
eayqi16,t3_a2hq5e,t1_eayppiz,kalari-,1,2018-12-02 17:48:30,/r/EDAnonymous/comments/a2hq5e/whats_the_most_annoying_thing_people_say_to_you/eayqi16/,Lmao I know I’ve been having a bad week or few when my project manager starts randomly offering me fruit throughout the day,False,False
eayppiz,t3_a2hq5e,t3_a2hq5e,lilmisssuccubus,1,2018-12-02 17:40:11,/r/EDAnonymous/comments/a2hq5e/whats_the_most_annoying_thing_people_say_to_you/eayppiz/,Subtle force feeding. My boss has recently noticed that I am a lot thinner and now has started asking if I’m starving myself. When we go out for lunch/company events he literally tries to make me eat things and will point out when I don’t. ,False,False
eayoyra,t3_a2hq5e,t3_a2hq5e,Ep1cDuCK,1,2018-12-02 17:32:25,/r/EDAnonymous/comments/a2hq5e/whats_the_most_annoying_thing_people_say_to_you/eayoyra/,"""I wish I could eat like you and stay skinny""  Please honey, this is my only meal of the day.",False,False
eaymmx2,t3_a2hq5e,t1_eayfhzk,hottNpopular69,1,2018-12-02 17:08:26,/r/EDAnonymous/comments/a2hq5e/whats_the_most_annoying_thing_people_say_to_you/eaymmx2/,Mines like “ but you’re skinny you can eat anything”  No. I can’t. That’s why I’m skinny. Cause I don’t. ,False,False
eayhyf4,t3_a2hq5e,t3_a2hq5e,songfireleaf,1,2018-12-02 16:19:03,/r/EDAnonymous/comments/a2hq5e/whats_the_most_annoying_thing_people_say_to_you/eayhyf4/,"When they try to tell me stuff to ""scare me straight"" like pal do u rly think I don't already know I could die? Esp when they try to do it by showing me really really horrifying pics of people who are deathly thin. Like. Don't. That triggers my piece of shit brain so fucking hard?",False,False
eayh0md,t3_a2hq5e,t1_eaygptn,soup_slut,1,2018-12-02 16:09:18,/r/EDAnonymous/comments/a2hq5e/whats_the_most_annoying_thing_people_say_to_you/eayh0md/,"I had no idea it could be that cheap, thanks for the heads up!",False,False
eaygptn,t3_a2hq5e,t1_eayg4wz,gigi-has-issues,1,2018-12-02 16:06:08,/r/EDAnonymous/comments/a2hq5e/whats_the_most_annoying_thing_people_say_to_you/eaygptn/,"If you can, look for therapists in training in your area. These places often have a sliding scale as well (plus are very cheap--my place is $30).  It has been just as helpful as the $160/hr therapists I've had.",False,False
eayg4wz,t3_a2hq5e,t1_eayfpft,soup_slut,1,2018-12-02 16:00:09,/r/EDAnonymous/comments/a2hq5e/whats_the_most_annoying_thing_people_say_to_you/eayg4wz/,"Also, like cool I'd love one but I have $5",False,False
eayfpft,t3_a2hq5e,t3_a2hq5e,gigi-has-issues,1,2018-12-02 15:55:54,/r/EDAnonymous/comments/a2hq5e/whats_the_most_annoying_thing_people_say_to_you/eayfpft/,"""You really need to see a therapist"".  Like, no shit Sherlock???  Also, I already have one???",False,False
eayfo31,t3_a2hq5e,t1_eayfhzk,captaincorgi104,1,2018-12-02 15:55:31,/r/EDAnonymous/comments/a2hq5e/whats_the_most_annoying_thing_people_say_to_you/eayfo31/,"For fucks sake Karen, I only look skinny because I don’t have boobs ",False,True
eayfhzk,t3_a2hq5e,t3_a2hq5e,chorusabyss,1,2018-12-02 15:53:49,/r/EDAnonymous/comments/a2hq5e/whats_the_most_annoying_thing_people_say_to_you/eayfhzk/,"the worst for me is ""but youre so skinny already!!!"" like no im a painfully average weight for my height. leave me alone",False,False
