Comment ID,Link ID,Parent ID,Author,Score,Publish Date,Permalink,Text,Stickied,Is Submitter
fc4hsqw,t3_efsp7d,t3_efsp7d,molotov-cocktail,1,2019-12-26 21:24:12,/r/EDAnonymous/comments/efsp7d/im_a_terrible_person/fc4hsqw/,it’s made worse by all the food/calorie talk   people joked about cake being low calorie since it’s christmas so many times my eye started twitching,False,False
fc3i4lv,t3_efsp7d,t3_efsp7d,sadinpink,1,2019-12-26 13:58:30,/r/EDAnonymous/comments/efsp7d/im_a_terrible_person/fc3i4lv/,sometimes i feel like this too. basically all of my family is a bit chubby/overweight except for my cousin (she's hella skinny) so i always feel like i'm competing against everyone,False,False
fc3aqq8,t3_efsp7d,t3_efsp7d,giawhoop,1,2019-12-26 12:39:47,/r/EDAnonymous/comments/efsp7d/im_a_terrible_person/fc3aqq8/,Dudee same. I want to be the skinniest of the people I’m around. It’s like a competition.,False,False
fc39g3e,t3_efsp7d,t3_efsp7d,elite-alien,1,2019-12-26 12:24:39,/r/EDAnonymous/comments/efsp7d/im_a_terrible_person/fc39g3e/,"Omg, I was trying to picture male relatives as women at their BMI to see if I was skinnier than them? Stupid.",False,False
fc2uij5,t3_efsp7d,t3_efsp7d,google-cant-help,1,2019-12-26 09:33:28,/r/EDAnonymous/comments/efsp7d/im_a_terrible_person/fc2uij5/,"Hey, dont beat yourself up too much. I lost weight this Holiday Season from purging every single fucking thing that entered my system, including things that I very explicitly told myself i would not purge. Because I'm physically unable not to.   Even though I am literally killing myself, I still get super proud of myself when someone mentions that they gained weight this season. Because in that moment, I'm better then them according to my stupid fucking ED.",False,False
fc29fqv,t3_efsp7d,t3_efsp7d,x24throwaway,1,2019-12-26 01:55:29,/r/EDAnonymous/comments/efsp7d/im_a_terrible_person/fc29fqv/,"I feel like a terrible person too. My Uncle has been really sick and lost a lot of weight and I was 1. Shocked, 2. Jealous of his weight loss, 3. *Relieved* that I was still the thinnest person at lunch.",False,False
