Comment ID,Link ID,Parent ID,Author,Score,Publish Date,Permalink,Text,Stickied,Is Submitter
ekutv74,t3_bcs1q2,t3_bcs1q2,nosleeptill8,1,2019-04-14 01:33:12,/r/EDAnonymous/comments/bcs1q2/going_wedding_dress_shopping_today/ekutv74/,"Oh no, she’s doing it, she’s shitting in the street 😳",False,False
ekujeqa,t3_bcs1q2,t1_ekuf282,whaleterweight,1,2019-04-13 22:34:25,/r/EDAnonymous/comments/bcs1q2/going_wedding_dress_shopping_today/ekujeqa/,"Imodium saved the day, but now I never want to eat again because holy shit I looked so goddamn fat. Yeesh.",False,True
ekujbzw,t3_bcs1q2,t1_ekuf2xr,whaleterweight,1,2019-04-13 22:33:24,/r/EDAnonymous/comments/bcs1q2/going_wedding_dress_shopping_today/ekujbzw/,Thankfully not. Imodium kicked in just in time.,False,True
ekuf2xr,t3_bcs1q2,t3_bcs1q2,michellenemangepas,1,2019-04-13 21:35:01,/r/EDAnonymous/comments/bcs1q2/going_wedding_dress_shopping_today/ekuf2xr/,Was it a... shitshow?,False,False
ekuf282,t3_bcs1q2,t3_bcs1q2,michellenemangepas,1,2019-04-13 21:34:46,/r/EDAnonymous/comments/bcs1q2/going_wedding_dress_shopping_today/ekuf282/,Well how did it go?,False,False
