Comment ID,Link ID,Parent ID,Author,Score,Publish Date,Permalink,Text,Stickied,Is Submitter
ffqxmek,t3_eudsp2,t1_ffqw317,my-destructive-side,1,2020-01-27 11:25:41,/r/EDAnonymous/comments/eudsp2/i_will_literally_never_be_happy_because_no_matter/ffqxmek/,"I cannot fucking believe I was going to actually send a pic, but couldn’t figure out how because I’m a moron. Probably for the best.",False,True
ffqwp13,t3_eudsp2,t1_ffqmcu3,svalbard5,1,2020-01-27 11:15:51,/r/EDAnonymous/comments/eudsp2/i_will_literally_never_be_happy_because_no_matter/ffqwp13/,"I understand, but the location where you live often determines what you are up against. I live in Los Angeles.  The waitresses here, the girls who came here because they were the most beautiful girl in Shitcreek Nebraska are basically 6s in LA.  I've seen people so beautiful its painful to look at them.  Meanwhile, if you live in Mogadishu (spelling?) I'm sure you see a lot more of the ""holy shit what happened there"" side of things.  So, it's context.  You may be an LA 1, but you're an Africa 7.  You get it?  Then there's the problem of how you see yourself in the mirror.  Like I said in a different post, your mirror image is literally not what you look like. It's inversed.  As a fun experiment download a couple faces of celebrities and flip them horizontally.  You would be amazed how many 'good looking' people suddenly turn into average schlubs when you flip them",False,False
ffqw317,t3_eudsp2,t1_ffqlw9q,szerim,1,2020-01-27 11:09:17,/r/EDAnonymous/comments/eudsp2/i_will_literally_never_be_happy_because_no_matter/ffqw317/,"the fact that you can't figure out exactly what is wrong with your face makes it sound even more like dysmorphia to me, at least to some extent. honestly, i would be really surprised if you were as ugly as you say without at least a couple significant issues you can pinpoint, like an extreme underbite/overbite or an out of proportion nose or forehead.  if you're comfortable with it, you can dm me a pic if you want a random stranger's completely neutral opinion. i'm an artist and i have a huge interest in makeup and plastic surgery, so i've gained a very good understanding of facial proportions and what makes someone attractive and if there are things that stand out to me i can tell you.  no matter what, though, you *do* deserve to be loved and treated well and i'm so sorry you haven't been. i promise you there are people out there who see more than just physical appearance i really hope you can find happiness.",False,False
ffqmcu3,t3_eudsp2,t1_ffpqiwv,my-destructive-side,1,2020-01-27 09:20:30,/r/EDAnonymous/comments/eudsp2/i_will_literally_never_be_happy_because_no_matter/ffqmcu3/,"Right but I’m not trying to compare myself to people who or deformed, nor am I trying to compare myself to airbrushed models in magazines. I compare myself to everyday people, people I’ve gone to school with, worked with, see in shops, walking down the street, or on the train. That’s real life, and that’s the yardstick by which I measure myself. A 1-10 scale of ugliness/attractiveness is, to me, based solely on real life people who I have seen with my own two eyes.  I’d argue that there have been plenty of people who have treated me as though I’m not human, so perhaps a 1 is accurate after all.  If only I had the balls for an actual picture.",False,True
ffqlw9q,t3_eudsp2,t1_ffptywj,my-destructive-side,1,2020-01-27 09:14:58,/r/EDAnonymous/comments/eudsp2/i_will_literally_never_be_happy_because_no_matter/ffqlw9q/,"I’ve spent a lot of time— years and years of my life— trying to figure out specifically what’s wrong with my face. There were times when I thought I’d pinpointed the problem—nose, chin, forehead, cheeks, whatever, but then the next time I’d look I’d change my mind. It only occurred to me recently that the reason I can’t figure out what’s wrong with my face is because it isn’t one thing or even two or three things, it’s everything.",False,True
ffptywj,t3_eudsp2,t1_ffpgrw7,szerim,1,2020-01-27 00:13:39,/r/EDAnonymous/comments/eudsp2/i_will_literally_never_be_happy_because_no_matter/ffptywj/,"okay, i know you said you didn't want people in the comments to try and tell you it's not as bad as you think, but for the record i have NEVER recoiled because of someone being just ugly. i'll admit that i get a shock at severe facial deformities, but that's a different story. i live in an absolutely massive city; i see hundreds of people every day, and i've never been taken aback by someone being so unattractive.  i'm saying this because i want you to see that you percieve yourself in a much, much harsher way than anyone else does. no one is recoiling when they look at you because people just don't do that when they see ugly people. your reaction to your own appearance isn't normal, you're recoiling because of how your mind is working, not just how your face looks.  if you don't mind me asking, what is it about your face that you dislike so much? you said it's not a singular feature, but are there specific things about your face that you hate or are you unable to place it?",False,False
ffpqiwv,t3_eudsp2,t1_ffpgrw7,svalbard5,3,2020-01-26 23:16:30,/r/EDAnonymous/comments/eudsp2/i_will_literally_never_be_happy_because_no_matter/ffpqiwv/,Yes these people have deformities and that’s what makes them ugly. I’m not saying it’s their fault. I’m saying it’s a scale. Perfect symmetry on one end hideous monster on the other  I can’t image you are a 1 given that a 1 isn’t recognizable as human.   You would have to link me a pic or something.,False,False
ffpp37p,t3_eudsp2,t1_ffpgrw7,j4jackj,6,2020-01-26 22:54:38,/r/EDAnonymous/comments/eudsp2/i_will_literally_never_be_happy_because_no_matter/ffpp37p/,Sounds like a dysmorphophobia caused by a lack of confidence.,False,False
ffph1zn,t3_eudsp2,t1_ffosc3x,my-destructive-side,1,2020-01-26 21:14:22,/r/EDAnonymous/comments/eudsp2/i_will_literally_never_be_happy_because_no_matter/ffph1zn/,Thank you for being kind 🖤,False,True
ffph0d7,t3_eudsp2,t1_ffokae1,my-destructive-side,3,2020-01-26 21:13:50,/r/EDAnonymous/comments/eudsp2/i_will_literally_never_be_happy_because_no_matter/ffph0d7/,"That means a lot, thank you 🖤",False,True
ffpgrw7,t3_eudsp2,t1_ffoqv7z,my-destructive-side,5,2020-01-26 21:11:06,/r/EDAnonymous/comments/eudsp2/i_will_literally_never_be_happy_because_no_matter/ffpgrw7/,"These people have literal physical deformities caused by medical conditions though. That’s not quite the same as just flat out being ugly. They’re exceptional cases and not comparable to most people in general.  Based on comparisons between myself and people I see at work/on the train/on the street? I’m a 1-2 if you’re only considering my face. My body (fully clothed, on a good day) bumps me up to a 3-4. I’m so ugly that I actually physically recoil whenever I unexpectedly see my reflection or a photo of myself. And it’s not just a singular feature— like, for example, having a wonky nose but the rest of my face is ok. It’s everything. I’m just hideous through and through.",False,True
ffpfbge,t3_eudsp2,t1_ffpagv9,svalbard5,1,2020-01-26 20:53:51,/r/EDAnonymous/comments/eudsp2/i_will_literally_never_be_happy_because_no_matter/ffpfbge/,Quite literally true. The image in the mirror is inversed. It’s not what you look like.   There was a poster for This Is 40 in which Paul Rudd is reflected in the mirror. He looks like an average slub when his face is reversed,False,False
ffpagv9,t3_eudsp2,t1_ffoqv7z,gypsy_traveler_soul,1,2020-01-26 19:56:35,/r/EDAnonymous/comments/eudsp2/i_will_literally_never_be_happy_because_no_matter/ffpagv9/,"Valid....and makes one think. I've never viewed myself as attractive, but is my scale of beauty realistic?  My own personal experience is no matter what a person thinks they look like, everyone else views them differently from what they see in the mirror.",False,False
ffosc3x,t3_eudsp2,t3_eudsp2,SemicolonButterfly,4,2020-01-26 17:24:23,/r/EDAnonymous/comments/eudsp2/i_will_literally_never_be_happy_because_no_matter/ffosc3x/,"I agree that it’s silly to say ‘looks don’t matter’. They absolutely do. They impact how we see ourselves, feel about ourselves, how others perceive and judge us, how we relate to others, and how they relate to us. It’s a part of life, part of culture. I figure (hope) that other things matter too at least. In the context of substantive interactions, I’m definitely drawn to people for more than their appearance. Intelligence, knowledge, mutual interests, sense of humor, kindness, honesty...I think these are equally why I want to know someone better. Casual interactions are a different game admittedly, which I hate.   I’m 33 (F) and I feel so sad that my face will never be pretty. I’ve even been mistaken for a boy quite a few times and it fuels so much shame. My body proportions are such that regardless of BMI and gym dedication I’m never going to be hott. On the upside, I’ve never been hit on or harassed...which is a relief, but I also feel like it means I’m not attractive or feminine enough to be worth noticing. I guess I’m rapidly approaching (or already at) an age where hotness matters less socially, but that doesn’t really quell the sadness.   I’m so sorry that people have not treated you with the care and respect that you deserve - that all persons deserve. I hope someone will come into your life who will take your hand and walk with you. Who won’t try to make you believe anything, won’t try to change you, and won’t try to take anything from you that you aren’t ready to give. Who will freely offer safety and respect and love, and give you all the time you need to feel safe enough to let those things in &lt;3",False,False
ffoqv7z,t3_eudsp2,t3_eudsp2,svalbard5,1,2020-01-26 17:16:28,/r/EDAnonymous/comments/eudsp2/i_will_literally_never_be_happy_because_no_matter/ffoqv7z/,"Lots of times I see people making statements about something without a real foundation in the scale.  ""Oh, that was the worst movie ever"" after coming out of the new Cats.  No, the new Cats is critically flawed and off putting, but on a scale on 1 to 10, it's probably a 5 or a 6.  There are absolutely unwatchable films that people never hear about.  So, let's agree that you're ugly.  If Brad Pitt is a 10, what do you think you are?  Come up with a number.  You think you're a 1? A 2?  Here's what I consider a 1:  [https://www.youtube.com/watch?v=QBsxoPaEqHk](https://www.youtube.com/watch?v=QBsxoPaEqHk)  Here's what I consider a 2:  [https://www.godupdates.com/ugandas-ugliest-man-marries-and-has-8-kids/](https://www.godupdates.com/ugandas-ugliest-man-marries-and-has-8-kids/)  Here's what I consider a 3:  [https://www.pinterest.com/pin/199002877262036471/](https://www.pinterest.com/pin/199002877262036471/)  &amp;#x200B;  Alright, so considering that, where do you land?",False,False
ffokae1,t3_eudsp2,t3_eudsp2,9b111e,4,2020-01-26 16:41:32,/r/EDAnonymous/comments/eudsp2/i_will_literally_never_be_happy_because_no_matter/ffokae1/,"Hey I’m not going to challenge any of the points you’ve said here or try and convince you that looks don’t matter.  It absolutely sucks that you’re feeling this way. I hope you can find some calm soon.  I can see you give out a lot of love and support to people on here and I think you deserve to receive it too. I just wanted to say I read your rant, you’re not alone and someone’s thinking of you.",False,False
