Comment ID,Link ID,Parent ID,Author,Score,Publish Date,Permalink,Text,Stickied,Is Submitter
eixe57g,t3_axxirq,t3_axxirq,petewentzpetegoez,1,2019-03-19 20:41:43,/r/EDAnonymous/comments/axxirq/whats_the_weirdest_thing_youve_eaten_midbinge/eixe57g/,"Not that weird but     many packages of raw ramen noodles     raw oatmeal with pb2, maple syrup, and a bit of salt     staright up cups of pickles     raw pasta  I guess I have a thing for raw shit",False,False
ei1940t,t3_axxirq,t1_ehx9sns,frameworkautoco,1,2019-03-07 18:10:40,/r/EDAnonymous/comments/axxirq/whats_the_weirdest_thing_youve_eaten_midbinge/ei1940t/,It is! I actually used to eat these together a lot as a kid just because it's easy and they were always in our pantry,False,False
ei10as5,t3_axxirq,t3_axxirq,Vickythescout11,1,2019-03-07 16:21:42,/r/EDAnonymous/comments/axxirq/whats_the_weirdest_thing_youve_eaten_midbinge/ei10as5/,"Gravy granules. It’s something about the weird salty moisture taking away feeling that I just LOVE.   Also, not sure if this counts as a binge, but coffee, Pepsi max and whiskey... ",False,False
ei1047b,t3_axxirq,t1_ehxjut5,Vickythescout11,1,2019-03-07 16:19:34,/r/EDAnonymous/comments/axxirq/whats_the_weirdest_thing_youve_eaten_midbinge/ei1047b/,Savoury yoghurt oh my GOD hahah that sounds exactly like something I’d do,False,False
ei0bx9p,t3_axxirq,t1_ehzg4pr,LolitaJane,1,2019-03-07 11:53:08,/r/EDAnonymous/comments/axxirq/whats_the_weirdest_thing_youve_eaten_midbinge/ei0bx9p/,Cold pasta with the cheapest Parmesan cheese,False,False
ei0bum9,t3_axxirq,t1_ehzfsii,LolitaJane,1,2019-03-07 11:52:20,/r/EDAnonymous/comments/axxirq/whats_the_weirdest_thing_youve_eaten_midbinge/ei0bum9/,That sounds like it would taste of creamsicle ,False,False
ehzl87o,t3_axxirq,t3_axxirq,DominicAeris,1,2019-03-07 06:06:34,/r/EDAnonymous/comments/axxirq/whats_the_weirdest_thing_youve_eaten_midbinge/ehzl87o/,"I once had an entire tray of Stouffer's Enchiladas. They were delicious, and I added even more cheese. I felt like a little goblin XD",False,False
ehzl65t,t3_axxirq,t1_ehwxr52,DominicAeris,1,2019-03-07 06:05:21,/r/EDAnonymous/comments/axxirq/whats_the_weirdest_thing_youve_eaten_midbinge/ehzl65t/,Honestly toast with jam and an avocado slice on top is a fairly normal breakfast for many people (or some variation) sounds good tbh!,False,False
ehzg5qh,t3_axxirq,t1_ehy94vf,Laurenpower,1,2019-03-07 03:54:47,/r/EDAnonymous/comments/axxirq/whats_the_weirdest_thing_youve_eaten_midbinge/ehzg5qh/,I’ve probably eaten an entire jar of biscoff too. Dipping biscof biscuits in it makes it even better.,False,True
ehzg4pr,t3_axxirq,t1_ehymr78,Laurenpower,1,2019-03-07 03:54:00,/r/EDAnonymous/comments/axxirq/whats_the_weirdest_thing_youve_eaten_midbinge/ehzg4pr/,Cold pasta is good tbf,False,True
ehzg06y,t3_axxirq,t1_ehzf2mm,DrKBird,1,2019-03-07 03:50:26,/r/EDAnonymous/comments/axxirq/whats_the_weirdest_thing_youve_eaten_midbinge/ehzg06y/,"&gt; They're candy sold as medicine.  YES!!   &gt;Gummy vitamins are dangerous.  OMG these are also candy sold as medicine.    Let's not even start on Flinstones vitamins or Luden's ""throat lozenges"" because UGH.",False,False
ehzfsii,t3_axxirq,t3_axxirq,bluecokezero,1,2019-03-07 03:44:21,/r/EDAnonymous/comments/axxirq/whats_the_weirdest_thing_youve_eaten_midbinge/ehzfsii/,Marshmallows dipped in orange soda  Surprisingly good,False,False
ehzfc6p,t3_axxirq,t3_axxirq,unforgettable_potato,1,2019-03-07 03:31:04,/r/EDAnonymous/comments/axxirq/whats_the_weirdest_thing_youve_eaten_midbinge/ehzfc6p/,I have literally mixed water and sugar together. And drank it like a God damn hummingbird. ,False,False
ehzf84i,t3_axxirq,t1_ehxml34,unforgettable_potato,1,2019-03-07 03:27:48,/r/EDAnonymous/comments/axxirq/whats_the_weirdest_thing_youve_eaten_midbinge/ehzf84i/,"Dry oatmeal, mixed with margarine and sugar. Add nuts or cinnamon. (I really wanted a cookie.) microwave and mix. It's like depression and self loathing got together and had a baby. ",False,False
ehzf2mm,t3_axxirq,t1_ehwvv4g,unforgettable_potato,1,2019-03-07 03:23:22,/r/EDAnonymous/comments/axxirq/whats_the_weirdest_thing_youve_eaten_midbinge/ehzf2mm/,Omg. Finally. I found my people. Chewy tums are a crime and shouldn't exist. 😭 Why are they so delicious. They're candy sold as medicine.  Regular tums are delightfully chalky.  Gummy vitamins are dangerous. I made myself sick on gummy vit D. ,False,False
ehzas88,t3_axxirq,t1_ehxjut5,lilykeene,1,2019-03-07 01:30:43,/r/EDAnonymous/comments/axxirq/whats_the_weirdest_thing_youve_eaten_midbinge/ehzas88/,omg i’ve done most of these i feel seen,False,False
ehzao9x,t3_axxirq,t3_axxirq,lilykeene,1,2019-03-07 01:28:05,/r/EDAnonymous/comments/axxirq/whats_the_weirdest_thing_youve_eaten_midbinge/ehzao9x/,"just straight up drinking maple syrup, alternating spoonfuls of chocolate chips and guacamole, brown sugar mixed with softened butter (so bomb), choux pastry dough, spaghetti sauce out the can.... typing this out caused #great #shame",False,False
ehz73i0,t3_axxirq,t1_ehz09w6,birdsbirdsbirds339,1,2019-03-07 00:11:05,/r/EDAnonymous/comments/axxirq/whats_the_weirdest_thing_youve_eaten_midbinge/ehz73i0/,I roll up the first and last one and I tear strips for the ones in between for the best both worlds 😫,False,False
ehz09w6,t3_axxirq,t1_ehxqd5s,LolitaJane,1,2019-03-06 22:17:10,/r/EDAnonymous/comments/axxirq/whats_the_weirdest_thing_youve_eaten_midbinge/ehz09w6/,"Did you tear the tortillas into strips or did you roll them up into tubes?  I’m a strips gal, myself.",False,False
ehz05x8,t3_axxirq,t1_ehx00ot,LolitaJane,1,2019-03-06 22:15:30,/r/EDAnonymous/comments/axxirq/whats_the_weirdest_thing_youve_eaten_midbinge/ehz05x8/,I love ramen sandwiches on buttered toast,False,False
ehyvvrf,t3_axxirq,t3_axxirq,Whalel0rd,1,2019-03-06 21:16:48,/r/EDAnonymous/comments/axxirq/whats_the_weirdest_thing_youve_eaten_midbinge/ehyvvrf/,One that sticks with me is that I didn’t have any real food so i binged on a bag of uncooked “ready to steam” vegetables (didn’t steam them) and got food poisoning 👌🏻,False,False
ehyp1b6,t3_axxirq,t1_ehylikc,yungelectric,1,2019-03-06 19:47:30,/r/EDAnonymous/comments/axxirq/whats_the_weirdest_thing_youve_eaten_midbinge/ehyp1b6/,Legit eating dry nutritional yeast rn LOL why must we suffer ,False,False
ehyoo9b,t3_axxirq,t1_ehy94vf,yungelectric,1,2019-03-06 19:42:53,/r/EDAnonymous/comments/axxirq/whats_the_weirdest_thing_youve_eaten_midbinge/ehyoo9b/,FUCK cookie spread it’s too god damn good,False,False
ehyodyk,t3_axxirq,t1_ehylejr,yungelectric,1,2019-03-06 19:39:14,/r/EDAnonymous/comments/axxirq/whats_the_weirdest_thing_youve_eaten_midbinge/ehyodyk/,I was extremely desperate for sweetness so maybe my standards were low but I thought it was pretty good lmfao,False,False
ehymr78,t3_axxirq,t1_ehym1x5,operadiva31,1,2019-03-06 19:17:47,/r/EDAnonymous/comments/axxirq/whats_the_weirdest_thing_youve_eaten_midbinge/ehymr78/,Thank you. Others never understand why I just like don’t even bother hearing things up. Cold pasta? Sign me the hell up!,False,False
ehym1x5,t3_axxirq,t1_ehyiiq3,LolitaJane,1,2019-03-06 19:08:32,/r/EDAnonymous/comments/axxirq/whats_the_weirdest_thing_youve_eaten_midbinge/ehym1x5/,"&gt; Cold leftovers from literally anywhere. Fuck heating things up, no one has time when a binge is on.  This is the truest sentence in the history of sentences, maybe ever ",False,False
ehylrwa,t3_axxirq,t1_ehxzt07,LolitaJane,1,2019-03-06 19:04:53,/r/EDAnonymous/comments/axxirq/whats_the_weirdest_thing_youve_eaten_midbinge/ehylrwa/,Ghetto crepes,False,False
ehylo9s,t3_axxirq,t1_ehxvner,LolitaJane,1,2019-03-06 19:03:33,/r/EDAnonymous/comments/axxirq/whats_the_weirdest_thing_youve_eaten_midbinge/ehylo9s/,"If it’s raw beef, then I get it.  I eat that even when I’m not binging ",False,False
ehylikc,t3_axxirq,t1_ehxjut5,LolitaJane,1,2019-03-06 19:01:26,/r/EDAnonymous/comments/axxirq/whats_the_weirdest_thing_youve_eaten_midbinge/ehylikc/,"Also, I have legit done almost all of these",False,False
ehylejr,t3_axxirq,t1_ehxjut5,LolitaJane,1,2019-03-06 18:59:57,/r/EDAnonymous/comments/axxirq/whats_the_weirdest_thing_youve_eaten_midbinge/ehylejr/,How was the sugar and vanilla?,False,False
ehyiiq3,t3_axxirq,t3_axxirq,operadiva31,1,2019-03-06 18:22:12,/r/EDAnonymous/comments/axxirq/whats_the_weirdest_thing_youve_eaten_midbinge/ehyiiq3/,"* Tortillas spread with jarred or canned tomato sauce (possibly expired), and sprinkled with a fuck ton of shredded cheese. All of this cold, naturally.   * Dry cereal of any variety  *  Croutons. I don’t particularly care for them in my salads, but I will straight up eat a whole bag of those little fuckers dry!   * Day old (or older) rice, with melted American cheese or velvets cheese sauce, not even heated al the way up, so it’s still cold and hard.   * Shitty frozen pizza, topped with mac and cheese, accompanied by as many pickles as I can find, and a metric fuckton of Diet Coke, purges, and follows by a family sized bag of nacho cheese Doritos, and whatever ice cream was nearest.   * Cold leftovers from literally anywhere. Fuck heating things up, no one has time when a binge is on.  * Fun sized Halloween candy that I found in my closet from who knows when that I don’t even like, snack sized bags of trail mix that I also don’t like,  cheese and peanut butter crackers, craisins, shredded cheese - eaten by the handful while staring into the fridge, pickles, Diet Coke, my roommate’s snacks, juice that has been in the fridge since I can remember, stale crackers from last Christmas, a random frozen entree that I found in the back of the freezer, and about $30 worth of delivery when I finally get desperate enough. ",False,False
ehydzur,t3_axxirq,t1_ehwtl3j,operadiva31,1,2019-03-06 17:25:45,/r/EDAnonymous/comments/axxirq/whats_the_weirdest_thing_youve_eaten_midbinge/ehydzur/,You are my hero!,False,False
ehy94vf,t3_axxirq,t3_axxirq,sodiddlydone,1,2019-03-06 16:30:18,/r/EDAnonymous/comments/axxirq/whats_the_weirdest_thing_youve_eaten_midbinge/ehy94vf/,polish sausages dipped into chili hummus and a whole jar of biscoff cookie spread eaten with a spoon.,False,False
ehxzt07,t3_axxirq,t3_axxirq,frostfromfire,1,2019-03-06 14:51:58,/r/EDAnonymous/comments/axxirq/whats_the_weirdest_thing_youve_eaten_midbinge/ehxzt07/,"As a kid I’d always binge on tuna salad scooped onto thin, unridged Lay’s potato chips because the wavy ones were too hard.  Most recent sugar binge included chocolate chips spread evenly across a whole wheat tortilla then microwaved, chocolate spread by knife, then rolled up.",False,False
ehxxywe,t3_axxirq,t3_axxirq,notsoskinny_legend,1,2019-03-06 14:32:51,/r/EDAnonymous/comments/axxirq/whats_the_weirdest_thing_youve_eaten_midbinge/ehxxywe/,I used to take like a whole bag of baby carrots and dip them in salsa (!!!) one by one.... I still can’t eat either food to this day ,False,False
ehxx824,t3_axxirq,t3_axxirq,punkspicelatte,1,2019-03-06 14:25:00,/r/EDAnonymous/comments/axxirq/whats_the_weirdest_thing_youve_eaten_midbinge/ehxx824/,I dipped Ruffles in peanut butter and sprinkled it with shire chocolate chips ¯\_(ツ)_/¯ ,False,False
ehxwzpw,t3_axxirq,t3_axxirq,fabluous,1,2019-03-06 14:22:30,/r/EDAnonymous/comments/axxirq/whats_the_weirdest_thing_youve_eaten_midbinge/ehxwzpw/,Cocoa pebbles with hot chocolate. Lol,False,False
ehxvqsn,t3_axxirq,t1_ehxml34,edub12345,1,2019-03-06 14:08:56,/r/EDAnonymous/comments/axxirq/whats_the_weirdest_thing_youve_eaten_midbinge/ehxvqsn/,"Ok, word. I’ve done this",False,False
ehxvner,t3_axxirq,t3_axxirq,edub12345,1,2019-03-06 14:07:55,/r/EDAnonymous/comments/axxirq/whats_the_weirdest_thing_youve_eaten_midbinge/ehxvner/,"- Corn chips with peanut butter in a bowl, with milk on top, eaten like cereal. Ok actually delicious.  - Shortbread cookies with milk over them, eaten like cereal lmao.  - Honestly A LOT of different foods eaten with milk like cereal (muddy buddies, pastries, caramel corn, anything sweet/starchy)  - Bacon dipped in blue cheese dressing  - Chickpeas and peanut butter  - Pasta with salad dressing  - Alfredo sauce plain  - Raw meat... I’m ashamed of this :( ",False,False
ehxtmqz,t3_axxirq,t3_axxirq,cerareece,1,2019-03-06 13:45:58,/r/EDAnonymous/comments/axxirq/whats_the_weirdest_thing_youve_eaten_midbinge/ehxtmqz/,a bunch of ranch corn nuts mixed into an entire tub of cream cheese. that wasn't hard to get rid of but man i couldn't stop,False,False
ehxqgpo,t3_axxirq,t1_ehwtl3j,Itotsight,1,2019-03-06 13:11:40,/r/EDAnonymous/comments/axxirq/whats_the_weirdest_thing_youve_eaten_midbinge/ehxqgpo/,"Plain beans straight out of the can are the best, but my stomach doesn't agree.",False,False
ehxqd5s,t3_axxirq,t3_axxirq,birdsbirdsbirds339,1,2019-03-06 13:10:35,/r/EDAnonymous/comments/axxirq/whats_the_weirdest_thing_youve_eaten_midbinge/ehxqd5s/,* banana and oreo sandwich (banana in the middle of two oreos) * crispbread with PB + nutella and chips on top * just a whole can of waterchestnuts (sad) * entire bag of plain tomato and basil tortillas * cheerios with vanilla protein shake because i didnt have milk,False,False
ehxmrob,t3_axxirq,t1_ehxd6na,Laurenpower,1,2019-03-06 12:30:59,/r/EDAnonymous/comments/axxirq/whats_the_weirdest_thing_youve_eaten_midbinge/ehxmrob/,"That’s why I made it, I binged last night ",False,True
ehxml34,t3_axxirq,t3_axxirq,icy271,1,2019-03-06 12:29:00,/r/EDAnonymous/comments/axxirq/whats_the_weirdest_thing_youve_eaten_midbinge/ehxml34/,Handfuls of dry oatmeal 😳,False,False
ehxkm52,t3_axxirq,t1_ehxk61i,yungelectric,1,2019-03-06 12:07:09,/r/EDAnonymous/comments/axxirq/whats_the_weirdest_thing_youve_eaten_midbinge/ehxkm52/,Honestly quite gross and made me feel so pathetic 😂,False,False
ehxk61i,t3_axxirq,t1_ehxjut5,Laurenpower,1,2019-03-06 12:02:08,/r/EDAnonymous/comments/axxirq/whats_the_weirdest_thing_youve_eaten_midbinge/ehxk61i/,I mean I eat ketchup sandwiches so can’t really judge but I’ve never had mayo so idk what both would be like 😂,False,True
ehxjut5,t3_axxirq,t3_axxirq,yungelectric,1,2019-03-06 11:58:41,/r/EDAnonymous/comments/axxirq/whats_the_weirdest_thing_youve_eaten_midbinge/ehxjut5/,"Love these threads omg ok   - mayo and ketchup sandwich (so awful)  - melted kraft single slices from the frying pan  - dry nutritional yeast, hot chocolate powder, pb2 powder, protein powder  - sugar mixed with pure vanilla extract   - I once tried making “savoury yogurt” by mixing plain Greek yogurt with salsa and salt and WOW I immediately dry heaved   - salsa straight out the jar literally always   - used to make “cookie dough bowls” when my binge eating was fucked and would legit just make full on cookie dough and binge on it   - drinking maple syrup straight from the bottle :))   - licking salt off my hand till I feel like I will vomit   - eating spoonfuls of brown sugar",False,False
ehxhlcm,t3_axxirq,t1_ehwsc5g,MissNietzsche,1,2019-03-06 11:33:46,/r/EDAnonymous/comments/axxirq/whats_the_weirdest_thing_youve_eaten_midbinge/ehxhlcm/,Rice with jam is actually a thing vegans on YouTube eat!,False,False
ehxf8gl,t3_axxirq,t1_ehwtmft,ChaosSauces,1,2019-03-06 11:07:43,/r/EDAnonymous/comments/axxirq/whats_the_weirdest_thing_youve_eaten_midbinge/ehxf8gl/,Cereal and ice cream. Holy F that is like my secret self hate power couple.   I’m drooling,False,False
ehxd6na,t3_axxirq,t3_axxirq,Arceliaz,1,2019-03-06 10:44:51,/r/EDAnonymous/comments/axxirq/whats_the_weirdest_thing_youve_eaten_midbinge/ehxd6na/,Honestly thank god for these threads they make me feel so much better ,False,False
ehxa96w,t3_axxirq,t1_ehx9sns,ChaosSauces,1,2019-03-06 10:11:58,/r/EDAnonymous/comments/axxirq/whats_the_weirdest_thing_youve_eaten_midbinge/ehxa96w/,Add in some honey/ chocolate chips/ cinnamon sugar / anything on hand to spice it up. Truly a heartfelt binge classic to me. ,False,False
ehx9sns,t3_axxirq,t1_ehwva4m,Flesh-And-Bone,1,2019-03-06 10:06:45,/r/EDAnonymous/comments/axxirq/whats_the_weirdest_thing_youve_eaten_midbinge/ehx9sns/,&gt;Smashed tortilla chips into peanut butter  this sounds surprisingly good.,False,False
ehx73ua,t3_axxirq,t1_ehx6u5v,Laurenpower,1,2019-03-06 09:36:23,/r/EDAnonymous/comments/axxirq/whats_the_weirdest_thing_youve_eaten_midbinge/ehx73ua/,Pancakes with icecream sounds great ,False,True
ehx6u5v,t3_axxirq,t3_axxirq,ijustneededaname,1,2019-03-06 09:33:12,/r/EDAnonymous/comments/axxirq/whats_the_weirdest_thing_youve_eaten_midbinge/ehx6u5v/,"Last night I was out of bread, so I had peanut butter, jam and dry muesli.  Also I used to eat salad with peanut butter and soy sauce :( and oatmeal with salt (not just salt but still)  And I'm a slut for hot &amp; cold combinations, like hot oatmeal or pancakes with ice cream and frozen berries. ",False,False
ehx6sp2,t3_axxirq,t1_ehwzzuq,reallyokfinewhatever,1,2019-03-06 09:32:43,/r/EDAnonymous/comments/axxirq/whats_the_weirdest_thing_youve_eaten_midbinge/ehx6sp2/,"I don't even know! I think I was in one of my ""if I don't buy any food then obv I won't binge"" phases which of course meant I had to raid my pantry for whatever shit I could find to make a decent binge with lol",False,False
ehx3ok3,t3_axxirq,t1_ehwtmft,3cats_in_atrenchcoat,1,2019-03-06 08:54:59,/r/EDAnonymous/comments/axxirq/whats_the_weirdest_thing_youve_eaten_midbinge/ehx3ok3/,Okay but maple toast is where it's at. ,False,False
ehx3fwh,t3_axxirq,t1_ehwwejq,breadndread,1,2019-03-06 08:51:52,/r/EDAnonymous/comments/axxirq/whats_the_weirdest_thing_youve_eaten_midbinge/ehx3fwh/,It's like an adult lunchable!,False,False
ehx2mb2,t3_axxirq,t3_axxirq,ap0cryphal,1,2019-03-06 08:41:24,/r/EDAnonymous/comments/axxirq/whats_the_weirdest_thing_youve_eaten_midbinge/ehx2mb2/,"Oatmeal + instant milk tea powder + psyllium husk powder (???)  the idea was to make my oatmeal taste nice (I love milk tea) and the point of the psyllium husk was so that the oatmeal would also make me poop later lol. But the psyllium husk just made the oatmeal congeal into a solid, sticky block... ick. I still ate it tho lol",False,False
ehx0ysp,t3_axxirq,t3_axxirq,VanillaNutMilk,1,2019-03-06 08:19:37,/r/EDAnonymous/comments/axxirq/whats_the_weirdest_thing_youve_eaten_midbinge/ehx0ysp/,"A big bag of craisins. It was three in the morning and apparently I was pretty heckin’ desperate and had no food in my room, so I just ate craisins. It’s nice for the first few mouthfuls and then it’s just downhill from there. ",False,False
ehx00ot,t3_axxirq,t1_ehwzdmg,Laurenpower,1,2019-03-06 08:06:29,/r/EDAnonymous/comments/axxirq/whats_the_weirdest_thing_youve_eaten_midbinge/ehx00ot/,"I mean, it was good ",False,True
ehwzzuq,t3_axxirq,t1_ehwxr52,Laurenpower,1,2019-03-06 08:06:09,/r/EDAnonymous/comments/axxirq/whats_the_weirdest_thing_youve_eaten_midbinge/ehwzzuq/,I’m interested in how you came up with this combination 😂,False,True
ehwzvj9,t3_axxirq,t3_axxirq,einhornschlag,1,2019-03-06 08:04:27,/r/EDAnonymous/comments/axxirq/whats_the_weirdest_thing_youve_eaten_midbinge/ehwzvj9/,"Bought a box of lite vanilla Winn Dixie brand ice cream and dumped strawberry nesquick powder on 1/3, chocolate pb2 on 1/3, and ovaltine on the final 1/3. Ate the whole box. Didn’t even mix the powder into some bites, I just bit into spoonful after spoonful of flavored powder like an animal.   And then I threw it all up in muh bathtub * finger guns *",False,False
ehwzdmg,t3_axxirq,t3_axxirq,general-zorp-zorp,1,2019-03-06 07:57:17,/r/EDAnonymous/comments/axxirq/whats_the_weirdest_thing_youve_eaten_midbinge/ehwzdmg/,oh my god SPAGHETTI ON TOAST IS A BRILLIANT INVENTION,False,False
ehwxr52,t3_axxirq,t3_axxirq,reallyokfinewhatever,1,2019-03-06 07:32:51,/r/EDAnonymous/comments/axxirq/whats_the_weirdest_thing_youve_eaten_midbinge/ehwxr52/,Avocado mixed with grape jelly. So weird.,False,False
ehwx16u,t3_axxirq,t1_ehwwz7e,paperklipp,1,2019-03-06 07:21:22,/r/EDAnonymous/comments/axxirq/whats_the_weirdest_thing_youve_eaten_midbinge/ehwx16u/,Ngl I’m still tempted by those sometimes when I’m in a heavy restriction phase lol ,False,False
ehwwz7e,t3_axxirq,t1_ehwuehw,biobitch535,1,2019-03-06 07:20:27,/r/EDAnonymous/comments/axxirq/whats_the_weirdest_thing_youve_eaten_midbinge/ehwwz7e/,Same.. kids gummy bear vitamins,False,False
ehwwejq,t3_axxirq,t1_ehwva4m,paperklipp,1,2019-03-06 07:11:01,/r/EDAnonymous/comments/axxirq/whats_the_weirdest_thing_youve_eaten_midbinge/ehwwejq/,&gt; block of cheese on toast  I don’t see a problem here. ,False,False
ehwwbwy,t3_axxirq,t1_ehwvv4g,paperklipp,1,2019-03-06 07:09:47,/r/EDAnonymous/comments/axxirq/whats_the_weirdest_thing_youve_eaten_midbinge/ehwwbwy/,"Yikes. This is extra bad for me because Tums make me nauseated every time I take them, no matter how bad my heartburn is. ",False,False
ehwvx2i,t3_axxirq,t1_ehwtl3j,DrKBird,1,2019-03-06 07:02:47,/r/EDAnonymous/comments/axxirq/whats_the_weirdest_thing_youve_eaten_midbinge/ehwvx2i/,"I'm sorry but this   &gt;i am a disgusting trash fire of a woman  legit made me LOL, so thank you.",False,False
ehwvv4g,t3_axxirq,t1_ehwuehw,DrKBird,1,2019-03-06 07:01:53,/r/EDAnonymous/comments/axxirq/whats_the_weirdest_thing_youve_eaten_midbinge/ehwvv4g/,"I used to go thru a thing of Tums in 2 days, sometimes one.  Chewy Tums?  Those last an afternoon.  BUt...health right? :eyeroll:",False,False
ehwva4m,t3_axxirq,t3_axxirq,ChaosSauces,1,2019-03-06 06:51:37,/r/EDAnonymous/comments/axxirq/whats_the_weirdest_thing_youve_eaten_midbinge/ehwva4m/,"When binging I’m subconsciously trying to find a balance between smooth and crunchy.   So I usually end up with trashy yet beautiful sounding combos like:  Dry pasta and tomato paste  Smashed tortilla chips into peanut butter  Block of cheese on toast [you heard that right! Just a straight up block on toast, as much toast as it takes then usually just polishing off the cheese].   Skinny Pop and ice cream  Sorbet and wasabi peas    I’ve definitely eaten raw meat, uncooked baking ingredients, literal trash, other people’s spit out food but sometimes I’ve amazed myself with hot combos that only a mentally deranged individual could come up with! ",False,False
ehwuehw,t3_axxirq,t3_axxirq,paperklipp,1,2019-03-06 06:35:23,/r/EDAnonymous/comments/axxirq/whats_the_weirdest_thing_youve_eaten_midbinge/ehwuehw/,I live for this thread every time it comes up.   I once binged on kids’ multivitamins because they were orange flavoured and tasted like candy. ,False,False
ehwtmft,t3_axxirq,t3_axxirq,beachedlandwhale,1,2019-03-06 06:20:22,/r/EDAnonymous/comments/axxirq/whats_the_weirdest_thing_youve_eaten_midbinge/ehwtmft/,"Oh boy so many. Bread dipped in maple syrup, cereal mixed with ice cream, microwaved eggs, raw brownie mix... the list goes on",False,False
ehwtl3j,t3_axxirq,t3_axxirq,cloakofdirt,1,2019-03-06 06:19:37,/r/EDAnonymous/comments/axxirq/whats_the_weirdest_thing_youve_eaten_midbinge/ehwtl3j/,"cold day-old rice mixed with mayonnaise. four cans of beans, plain, straight out of the can. an entire loaf of bread slathered in mustard. bread from out the garbage bin. a cookie that i found covered in ants, threw away, only to fish it out of the trash a couple hours later and shake off the ants and eat it (it was in a package, but, still...). a ""burrito"" that was pickled jalapeno wrapped in a slice of swiss cheese that i covered in chili jam (okay, this one was delicious, but i did not feel proud of myself). bread that was literally too stale to chew so i microwaved it with mozzarella so the grease would make it soft enough to force down...  i am a disgusting trash fire of a woman ",False,False
ehwszfa,t3_axxirq,t3_axxirq,NewBullMoose,1,2019-03-06 06:07:24,/r/EDAnonymous/comments/axxirq/whats_the_weirdest_thing_youve_eaten_midbinge/ehwszfa/,A whole jar of Mateo's hot salsa with celery. Yikes.,False,False
ehwsc5g,t3_axxirq,t3_axxirq,Aleph0-4,1,2019-03-06 05:53:15,/r/EDAnonymous/comments/axxirq/whats_the_weirdest_thing_youve_eaten_midbinge/ehwsc5g/,Cold rice with jam. Half a tub of margarine. ,False,False
