Comment ID,Link ID,Parent ID,Author,Score,Publish Date,Permalink,Text,Stickied,Is Submitter
ee54eg4,t3_ag4e6y,t3_ag4e6y,waitingdaisy,1,2019-01-15 13:39:38,/r/EDAnonymous/comments/ag4e6y/im_so_excited_to_buy_carrot_cake_tomorrow/ee54eg4/,I might be having carrot cake tonight!!! I love it! And that coffee sounds like the perfect pair! Enjoy it 😊,False,False
ee4ju2w,t3_ag4e6y,t1_ee3pept,fishysandwich,1,2019-01-15 09:51:01,/r/EDAnonymous/comments/ag4e6y/im_so_excited_to_buy_carrot_cake_tomorrow/ee4ju2w/,"I agreeee, best frosting ever.  I feel like carrot cake is  the oatmeal raisin cookie of cake since everyone hates it but I think it's delicious :) ",False,True
ee4e7op,t3_ag4e6y,t3_ag4e6y,shonamairead,1,2019-01-15 08:39:17,/r/EDAnonymous/comments/ag4e6y/im_so_excited_to_buy_carrot_cake_tomorrow/ee4e7op/,Sounds amazing! I hope you enjoy it ❣️,False,False
ee3rgba,t3_ag4e6y,t3_ag4e6y,grandeicedcovfefe,1,2019-01-15 00:18:28,/r/EDAnonymous/comments/ag4e6y/im_so_excited_to_buy_carrot_cake_tomorrow/ee3rgba/,WF vegan carrot cake is one of my favorite things on this planet. Enjoy!! ,False,False
ee3pept,t3_ag4e6y,t3_ag4e6y,highfunctioningmess,1,2019-01-14 23:39:05,/r/EDAnonymous/comments/ag4e6y/im_so_excited_to_buy_carrot_cake_tomorrow/ee3pept/,Carrot cake is liiiife (that cream cheese frosting tho💕),False,False
ee3keyc,t3_ag4e6y,t3_ag4e6y,dynamicsystem,1,2019-01-14 22:15:44,/r/EDAnonymous/comments/ag4e6y/im_so_excited_to_buy_carrot_cake_tomorrow/ee3keyc/,Sounds delicious 😋 I hope you have a good time! ,False,False
ee3k01e,t3_ag4e6y,t3_ag4e6y,plumtree18,1,2019-01-14 22:09:34,/r/EDAnonymous/comments/ag4e6y/im_so_excited_to_buy_carrot_cake_tomorrow/ee3k01e/,That sounds delicious and well deserved! ,False,False
