Comment ID,Link ID,Parent ID,Author,Score,Publish Date,Permalink,Text,Stickied,Is Submitter
erouf3y,t3_c2cn8n,t1_erke6b6,JJflash56,1,2019-06-20 22:50:28,/r/EDAnonymous/comments/c2cn8n/iae_romanticizing_a_restriction_period_you_had/erouf3y/,"""coked up""? I assume we are not talking about Coke Classic.  HAHA!",False,False
ernpkns,t3_c2cn8n,t1_erni5q9,watsername,1,2019-06-20 14:15:47,/r/EDAnonymous/comments/c2cn8n/iae_romanticizing_a_restriction_period_you_had/ernpkns/,"That's fair.      For me it was drinking when restricting. What triggered my ED was a bad break up, and I partied/drank a lot to self-medicate the emotional pain. Restricting while drinking made me black out and not remember all of the dumb decisions I made. I'm much more in control now of both my drinking and avoiding triggers.     But I don't think this longing to go back to that size will ever go away, it's just a matter of making peace with that fact while not giving in.",False,False
erni5q9,t3_c2cn8n,t1_erkybz9,ppid,1,2019-06-20 12:52:56,/r/EDAnonymous/comments/c2cn8n/iae_romanticizing_a_restriction_period_you_had/erni5q9/,"Can you remember any bad parts that came along with restriction though?  For example, if I stop blocking it out, I remember that my really bad binge eating (staying up til 4am because ""tonight is my only 'cheat night' "") happened during the golden days of restriction.  Whenever I romanticize it, I try to remember the pain that came along with it.",False,True
ernfj4n,t3_c2cn8n,t1_erncs5b,ashplowe,1,2019-06-20 12:25:23,/r/EDAnonymous/comments/c2cn8n/iae_romanticizing_a_restriction_period_you_had/ernfj4n/,"I feel the same, it's a constant battle at the moment. Sorry wish I could offer some more positive words, but it just feels like I'm flailing about",False,False
erncs5b,t3_c2cn8n,t1_erkmrau,ppid,1,2019-06-20 11:56:26,/r/EDAnonymous/comments/c2cn8n/iae_romanticizing_a_restriction_period_you_had/erncs5b/,"With everyone sharing a similar story, I can't help but feel i screwed up my mind from my restriction efforts.   But it's a catch 22, because I ""need"" to lose weight. I actually do though (can't walk properly, other health issues). It's just that I cannot lose weight on a well balanced diet with a TINY, but consistent, caloric deficit because I can't even do that without binging screwing it all up.",False,True
ernblcm,t3_c2cn8n,t1_erkcx59,ppid,1,2019-06-20 11:43:52,/r/EDAnonymous/comments/c2cn8n/iae_romanticizing_a_restriction_period_you_had/ernblcm/,Same,False,True
ernbkod,t3_c2cn8n,t3_c2cn8n,ppid,1,2019-06-20 11:43:40,/r/EDAnonymous/comments/c2cn8n/iae_romanticizing_a_restriction_period_you_had/ernbkod/,Same,False,True
ermgbhs,t3_c2cn8n,t1_ermfnfx,Shorse_rider,1,2019-06-20 03:58:16,/r/EDAnonymous/comments/c2cn8n/iae_romanticizing_a_restriction_period_you_had/ermgbhs/,"When I. was at my very lowest weight, I binged around once a month and it was those binges that kept me alive. I never gained on those binges - it just stopped me from losjingmore weight for that week. But I think every anorexic at that stage will have binged.",False,False
ermfnfx,t3_c2cn8n,t1_erjp2hj,ambxvalence,1,2019-06-20 03:40:50,/r/EDAnonymous/comments/c2cn8n/iae_romanticizing_a_restriction_period_you_had/ermfnfx/,im really struggling with this. you see anorexic people who have been struggling for ages and are heavily emaciated. i just keep wondering if that means they never binge and me bingeing means im not really anorexic. do all people eventually end up bingeing? or are there those that dont?,False,False
ermcnb6,t3_c2cn8n,t3_c2cn8n,lightningmcqueef69,1,2019-06-20 02:25:25,/r/EDAnonymous/comments/c2cn8n/iae_romanticizing_a_restriction_period_you_had/ermcnb6/,holy fuck yes. i fasted for 75% of september 2018. i lost ao much fucking weighy oh god,False,False
erlutu0,t3_c2cn8n,t3_c2cn8n,Pootties,1,2019-06-19 21:24:11,/r/EDAnonymous/comments/c2cn8n/iae_romanticizing_a_restriction_period_you_had/erlutu0/,"Yes, I highly highly romanticize that time. It's one of the few parts of my past that I remember fondly 😬",False,False
erluop6,t3_c2cn8n,t1_erlsg23,Rustlingjimmies87,1,2019-06-19 21:22:19,/r/EDAnonymous/comments/c2cn8n/iae_romanticizing_a_restriction_period_you_had/erluop6/,Debs and I have such a toxic relationship. 😂,False,False
erlsg23,t3_c2cn8n,t1_erl4hdl,forgotmypassword314,1,2019-06-19 20:53:51,/r/EDAnonymous/comments/c2cn8n/iae_romanticizing_a_restriction_period_you_had/erlsg23/,That bitch Little Debbie. She has fucked me up time and time again!!  And same. There are some foods in my local market that I'm sure they keep stocked because I literally eat every single one in a super short period of time. It's hurtful.,False,False
erlihzx,t3_c2cn8n,t1_erldy89,leptictidium00,1,2019-06-19 18:47:52,/r/EDAnonymous/comments/c2cn8n/iae_romanticizing_a_restriction_period_you_had/erlihzx/,I didn’t know calories even existed rly until college so when I first started my ED I was *great* at it. Till my body gave up and starting making me binge. Oof.,False,False
erldy89,t3_c2cn8n,t1_erj8szb,AllConfuse,1,2019-06-19 17:51:08,/r/EDAnonymous/comments/c2cn8n/iae_romanticizing_a_restriction_period_you_had/erldy89/,Dang I was the opposite! I was about to do 800 in high school but college fucked me up! I was constantly eating because of stress and not caring what I ate.,False,False
erl9cy3,t3_c2cn8n,t3_c2cn8n,marshallcat,1,2019-06-19 16:56:49,/r/EDAnonymous/comments/c2cn8n/iae_romanticizing_a_restriction_period_you_had/erl9cy3/,I'm 20 and I'm still trying to get back to that period when I was 13 and I pretty much only ate 2 out of 7 days (I would liquid fast 3-5 days every week) and even on those days I still restricted and exercised... nowadays I struggle just with restricting every day,False,False
erl89r5,t3_c2cn8n,t3_c2cn8n,u2b52,1,2019-06-19 16:44:27,/r/EDAnonymous/comments/c2cn8n/iae_romanticizing_a_restriction_period_you_had/erl89r5/,"I used to stop eating when the number hit 1200. Didn't matter if I was mid bite. I have plenty of days now when I stick to a number, but if I'm still hungry there's plenty of days I just go over it. The fear response just isn't there. I guess bc I'm older and know from experience that I'll live to fight another day. I do miss the fear though",False,False
erl4hdl,t3_c2cn8n,t1_erjww4e,Rustlingjimmies87,1,2019-06-19 16:01:19,/r/EDAnonymous/comments/c2cn8n/iae_romanticizing_a_restriction_period_you_had/erl4hdl/,Saaame. Little Debbie and her side bitch Suzie Q were my downfall. I was binging 3 packs a day. My local gas station had to start upping their order for them because of me. #shame,False,False
erl48xn,t3_c2cn8n,t1_erl47gn,Shorse_rider,1,2019-06-19 15:58:43,/r/EDAnonymous/comments/c2cn8n/iae_romanticizing_a_restriction_period_you_had/erl48xn/,"Oh OK, my bad - I'm sorry!!!",False,False
erl47gn,t3_c2cn8n,t1_erjp406,Rustlingjimmies87,1,2019-06-19 15:58:16,/r/EDAnonymous/comments/c2cn8n/iae_romanticizing_a_restriction_period_you_had/erl47gn/,"Sorry you feel that way. I’m pretty happy with my life currently, just my weight is the only issue. Otherwise 110% happy and normal. 👍🏻",False,False
erkybz9,t3_c2cn8n,t3_c2cn8n,watsername,1,2019-06-19 14:55:42,/r/EDAnonymous/comments/c2cn8n/iae_romanticizing_a_restriction_period_you_had/erkybz9/,"HARDCORE.      I remember it now, 21 and at my lowest weight of 127 (I'm almost 5'8"") I could skip almost any meal and feel absolutely NO anxiety about it. I would constantly make plans at meal times in order to ""forget"" to eat.      Adulthood seems to revolve around meals/meal times and having an office job sure as fuck doesn't help when colleagues eat at desks/microwave their food.    God I'd give anything to go back to my early twenties to regain my discipline.",False,False
erknisj,t3_c2cn8n,t3_c2cn8n,Ughleigh,1,2019-06-19 13:01:48,/r/EDAnonymous/comments/c2cn8n/iae_romanticizing_a_restriction_period_you_had/erknisj/,Yep!!! I'm struggling with binging lately. Why can't I restrict like I used to 😭,False,False
erkna7b,t3_c2cn8n,t3_c2cn8n,StressedCookie,1,2019-06-19 12:59:22,/r/EDAnonymous/comments/c2cn8n/iae_romanticizing_a_restriction_period_you_had/erkna7b/,"Excuse me? Why call me out?!? This happened last year when I was barely eating 1 meal a day with monster to power me through. Hell I work out for 3 hours with oatmeal and monster. I was cold, bruising, and overall weak, but I miss it so much. I wish I have that self control again. School is starting soon. It's easier when you're busy. And not stuck at home like I am.",False,False
erkmrau,t3_c2cn8n,t3_c2cn8n,ashplowe,1,2019-06-19 12:54:01,/r/EDAnonymous/comments/c2cn8n/iae_romanticizing_a_restriction_period_you_had/erkmrau/,"Yep, I lost 35 lbs on 700 a day...3 years ago. It's been nothing but binge and restrict HELL since then. About 2 years ago I decided to seek therapy. It's been a messy, frustrating and scary process, but I think I'm starting to get to a place where I can see a light at the end of the tunnel.",False,False
erkkdnk,t3_c2cn8n,t3_c2cn8n,sriacha-latte,1,2019-06-19 12:29:43,/r/EDAnonymous/comments/c2cn8n/iae_romanticizing_a_restriction_period_you_had/erkkdnk/,"YES last summer I was pulling off 4 day fasts and restricting so low, rarely bingeing.... And haven't been able to do that since this spring lmao. I don't even mind so much that I can't fast without suspicion BUT COULD I STOP BINGEING. COULD I START IF AGAIN. AHHHHH",False,False
erkhgvq,t3_c2cn8n,t1_erjhue5,guineapigqueen,1,2019-06-19 11:59:18,/r/EDAnonymous/comments/c2cn8n/iae_romanticizing_a_restriction_period_you_had/erkhgvq/,"after dropping a lot of weight, i also felt that cockiness. I viewed it as ""Wow I lost so much, I have so much buffer room in case I mess up and binge again"". Slowly yet surely, gained most of it back because of my mindset smh..",False,False
erkgt05,t3_c2cn8n,t1_erjp2hj,guineapigqueen,1,2019-06-19 11:52:23,/r/EDAnonymous/comments/c2cn8n/iae_romanticizing_a_restriction_period_you_had/erkgt05/,"holy crap you're right (in my case). I was restricting so much and was on a weight loss roll. But, I got into a wonderful relationship and my eating habits seemed to turn healthy. Gradually gained a couple of pounds over the next year but I wasn't too worried because I still looked fine. However, me realizing that I cannot restrict like the way I used to (many many unsuccessful attempts to lose weight) + other school/job stresses = a whole new world of depression I've never felt before. Consequently, that depression and that feeling of absolutely NO self control probably caused me to gain around 20 pounds in the past 0.5 year. I am now 10 pounds away from my highest weight ever and acknowledging it makes me want to die. But, that caused me to quit stuffing my face long enough for me to feel hunger again and BOY did that feel good. I forgot how addicting restricting was because I was in a good mental place. Now, the only way to not feel like complete shit is to feel hunger again. My biggest fear now is for this whole experience to turn into a never ending cycle of gaining weight + depression --&gt; unhealthy restricting + losing weight. Sigh.",False,False
erkg8af,t3_c2cn8n,t3_c2cn8n,eIectioneering,1,2019-06-19 11:46:18,/r/EDAnonymous/comments/c2cn8n/iae_romanticizing_a_restriction_period_you_had/erkg8af/,big time. back in february when i’d omad and not eat during my 8h fast food shifts but i fucked it all up in one (1) weekend. haven’t been on track since,False,False
erke6b6,t3_c2cn8n,t3_c2cn8n,ehloveeash,1,2019-06-19 11:24:38,/r/EDAnonymous/comments/c2cn8n/iae_romanticizing_a_restriction_period_you_had/erke6b6/,"YES! I completely miss the days I was able to workout in the morning, go to classes, give my all at dance practices, workout again in the afternoon and stay up till the early hours of the morning partying. The rinse and repeat of being too coked up to even think of food makes me miss those days and the pseudo strength and control I thought I had. Those times are such a blur now, I realize I never really got to enjoy any of it. Its a bittersweet recollection.",False,False
erkde8x,t3_c2cn8n,t1_erjadn6,IkarosFalling,1,2019-06-19 11:16:19,/r/EDAnonymous/comments/c2cn8n/iae_romanticizing_a_restriction_period_you_had/erkde8x/,"I don't think it's linear or irreversible. I restricted to 600 for months at the end of college (stressed about changes), then graduated and got a nice job. Have been struggling to restrict or even maintain since then! Got into a master's program across the country 3 months ago. Stress is back. Bam. 2 day fasts are back and OMAD on the good days.... Maybe you're not failing, you're just in a better place! 💕",False,False
erkcx59,t3_c2cn8n,t3_c2cn8n,savagepatchbitch,1,2019-06-19 11:11:11,/r/EDAnonymous/comments/c2cn8n/iae_romanticizing_a_restriction_period_you_had/erkcx59/,"Omg YES, I fantasize about it all the fucking time. Probably every day",False,False
erk8gt2,t3_c2cn8n,t3_c2cn8n,pounce-a-lot,1,2019-06-19 10:23:11,/r/EDAnonymous/comments/c2cn8n/iae_romanticizing_a_restriction_period_you_had/erk8gt2/,Yep. My sophomore and junior years of high school I somehow lived on 200 calories a day most days. Now I’m lucky to be able to stick to 1500 😭,False,False
erk7xtu,t3_c2cn8n,t3_c2cn8n,olivethedoge,1,2019-06-19 10:17:15,/r/EDAnonymous/comments/c2cn8n/iae_romanticizing_a_restriction_period_you_had/erk7xtu/,So much,False,False
erk66rn,t3_c2cn8n,t3_c2cn8n,fuuwuu,1,2019-06-19 09:57:32,/r/EDAnonymous/comments/c2cn8n/iae_romanticizing_a_restriction_period_you_had/erk66rn/,"sometimes i wish i could be as determined as i was when i was 15, but then i think about buying sketchy weight loss pills in the early days of unregulated self checkouts with my allowance and i just get sad, haha. also i'm a goddamn adult, i shouldn't want to be like my 15 year old self...",False,False
erk65hk,t3_c2cn8n,t3_c2cn8n,ilivetomosh,1,2019-06-19 09:57:09,/r/EDAnonymous/comments/c2cn8n/iae_romanticizing_a_restriction_period_you_had/erk65hk/,Holy shit yes. But I'm finally getting back there by romanticism and letting myself believe a lie again lol,False,False
erk5rgo,t3_c2cn8n,t1_erjxv98,Stupidllama,1,2019-06-19 09:52:49,/r/EDAnonymous/comments/c2cn8n/iae_romanticizing_a_restriction_period_you_had/erk5rgo/,This is me as well.  Sucks.,False,False
erk5jlg,t3_c2cn8n,t3_c2cn8n,Stupidllama,1,2019-06-19 09:50:23,/r/EDAnonymous/comments/c2cn8n/iae_romanticizing_a_restriction_period_you_had/erk5jlg/,Holy shit yes!  And I never realized it until this post.  WTB past me's willpower/motivation/lifestyle/etc.,False,False
erk2dwt,t3_c2cn8n,t3_c2cn8n,Sick_Dark_WorkofArt,1,2019-06-19 09:13:56,/r/EDAnonymous/comments/c2cn8n/iae_romanticizing_a_restriction_period_you_had/erk2dwt/,"Oh yeah. A couple summers ago I got to my LW with a long period of restriction and no bingeing because half of what I previously ate randomly started giving me these horrible digestive symptoms. I was legitimately afraid to eat anything but the blandest of foods because so many things were making me sick. This went on for months. My ED brain loved it. I still have no idea what it was or why it finally one day stopped, but I know I'm never going to be able to replicate that kind of restriction without the coercive power of intestinal pain to keep me from eventually eating everything I can get my hands on.",False,False
erk1vxb,t3_c2cn8n,t3_c2cn8n,xwer15,1,2019-06-19 09:07:56,/r/EDAnonymous/comments/c2cn8n/iae_romanticizing_a_restriction_period_you_had/erk1vxb/,Wishing I had my terribly unhealthy and toxic relationship back just so I could be skinny and have abs hahaha so I laugh or cry,False,False
erk0qfx,t3_c2cn8n,t1_erjfg7l,tahinibitch,1,2019-06-19 08:53:55,/r/EDAnonymous/comments/c2cn8n/iae_romanticizing_a_restriction_period_you_had/erk0qfx/,"Use that motivation! I felt the exact same, exhausted after a decade of disordered eating all around the spectrum. You need to harness that anger and exhaustion and use it for good, use it as fuel against your ED. Hate it for putting you through this and form a pact with yourself that from now on, you and your body are a team fighting against your ED. It’s obviously easier said than done, but if you can get angry, you can start fighting! In my experience, the fixation on food and weight only starts to go away with proper nutrition INCLUDING less ‘nutritious’ foods that you might have banned from your diet. By including those and eating properly, they start to lose the power that they hold in your mind right now. Recovery is a long and arduous process, so feel free to pm me for help if you’d like, but it is so worth it to begin, if only to be relieved of the mental burden of always thinking of food 💕",False,False
erjzzkv,t3_c2cn8n,t1_erjkn16,northernboarder,1,2019-06-19 08:44:37,/r/EDAnonymous/comments/c2cn8n/iae_romanticizing_a_restriction_period_you_had/erjzzkv/,Yeah idk how it was so easy before but now its such a struggle to just eat normally and avoid binging :(,False,False
erjzohb,t3_c2cn8n,t1_erj8szb,northernboarder,1,2019-06-19 08:40:45,/r/EDAnonymous/comments/c2cn8n/iae_romanticizing_a_restriction_period_you_had/erjzohb/,Yup same with me. I don't even know how I was able to restrict so easily before and literally never had any thoughts of binging at all???,False,False
erjzil3,t3_c2cn8n,t3_c2cn8n,thetexangypsy,1,2019-06-19 08:38:42,/r/EDAnonymous/comments/c2cn8n/iae_romanticizing_a_restriction_period_you_had/erjzil3/,"Yep. Then the holidays happened and the constant hounding by family, honestly I kinda disassociated the 2 month span from Thanksgiving to NYE. And here we are, 6 months later, desperately trying to claw it back into existence.  Plus it was so much cheaper. I'm fucking broke.",False,False
erjyo9p,t3_c2cn8n,t1_erjxv98,sickcupcake,1,2019-06-19 08:27:53,/r/EDAnonymous/comments/c2cn8n/iae_romanticizing_a_restriction_period_you_had/erjyo9p/,"I overate a lot when I used to be overweight, but I never binged until I was on their verge of being underweight. Now I’m constantly 5-7 pounds over my lowest weight because I can’t stop the cycle of heavily restricting, binging, and fasting. I just wanna be able to eat like 3 dark chocolate Oreos like a normal person instead of compulsively eating the entire package because I know I’m not going to let myself eat for the next two days. I love food. I want to savor and appreciate it instead of binging on it until it all disgusts me.",False,False
erjyn1e,t3_c2cn8n,t3_c2cn8n,sickcupcake,1,2019-06-19 08:27:26,/r/EDAnonymous/comments/c2cn8n/iae_romanticizing_a_restriction_period_you_had/erjyn1e/,"I overate a lot when I used to be overweight, but I never binged until I was on their verge of being underweight. Now I’m constantly 5-7 pounds over my lowest weight because I can’t stop the cycle of heavily restricting, binging, and fasting. I just wanna be able to eat like 3 dark chocolate Oreos like a normal person instead of compulsively eating the entire package because I know I’m not going to let myself eat for the next two days. I love food. I want to savor and appreciate it instead of binging on it until it all disgusts me.",False,False
erjxvag,t3_c2cn8n,t3_c2cn8n,witchy2628,1,2019-06-19 08:17:12,/r/EDAnonymous/comments/c2cn8n/iae_romanticizing_a_restriction_period_you_had/erjxvag/,Has someone ever successfully recreated it?? Asking out of desperation here...,False,False
erjxv98,t3_c2cn8n,t1_erjadn6,ppid,1,2019-06-19 08:17:12,/r/EDAnonymous/comments/c2cn8n/iae_romanticizing_a_restriction_period_you_had/erjxv98/,"For me, I know my binge eating got worse after I began restricting and lost weight. Maybe I always binged as a fat kid, but now my restricting was developing the need to binge in the binge - restrict cycle.  So the first time I restricted (OMAD) it worked really well short term. But now restricting just activated the ED pathway my brain has developed and I skip right to caving and binging on the first or second day I try fasting.",False,True
erjxe0q,t3_c2cn8n,t1_erjogh8,ppid,1,2019-06-19 08:10:37,/r/EDAnonymous/comments/c2cn8n/iae_romanticizing_a_restriction_period_you_had/erjxe0q/,It's a struggle for me to maintain a 1000 deficit for more than a day. Or even maintenance for that matter. I can't escape the binge,False,True
erjx7sq,t3_c2cn8n,t1_erjkn16,ppid,1,2019-06-19 08:08:13,/r/EDAnonymous/comments/c2cn8n/iae_romanticizing_a_restriction_period_you_had/erjx7sq/,I think even in my glory days if restriction I was binging as well. But I romanticize it and filter out the binging parts because at least I was thinner for a year or two,False,True
erjww4e,t3_c2cn8n,t1_erjhue5,ppid,1,2019-06-19 08:03:38,/r/EDAnonymous/comments/c2cn8n/iae_romanticizing_a_restriction_period_you_had/erjww4e/,&gt; getting cocky about being skinny  Wow. This is exactly what happened to me when I went to college. Was so happy that I wasn't the fat guy. Thought that meant I could eat like others. But really k began binging on all the candy I deprived myself of in high school.,False,True
erjvvvk,t3_c2cn8n,t3_c2cn8n,sickcupcake,1,2019-06-19 07:49:09,/r/EDAnonymous/comments/c2cn8n/iae_romanticizing_a_restriction_period_you_had/erjvvvk/,"“Just survive on 300-500 calories a day without binging for a month and you’ll be so skinny again! Just like last time!” I say that to myself all the time, but I’ve been stuck in a cycle of binging, fasting for days, then heavily restricting again, for months. I’m going to try to get comfortable with a higher calorie restriction and see if that makes me want to binge less. I hope so.",False,False
erjv0jx,t3_c2cn8n,t3_c2cn8n,potatochipcompany,1,2019-06-19 07:36:13,/r/EDAnonymous/comments/c2cn8n/iae_romanticizing_a_restriction_period_you_had/erjv0jx/,"I think is an often under-looked part of the disordered existence. Nostalgia. Suffice to say I am very, very familiar with this phenomenon and it's likely the part of my life that most threatens my continued recovery.",False,False
erjt64o,t3_c2cn8n,t1_erjhue5,glssslipper,1,2019-06-19 07:06:54,/r/EDAnonymous/comments/c2cn8n/iae_romanticizing_a_restriction_period_you_had/erjt64o/,This is literally me. Feeling the skinny confidence and then seeing the scale float around the same number for 6 months.,False,False
erjst6a,t3_c2cn8n,t3_c2cn8n,ifuckpineapples,1,2019-06-19 07:00:44,/r/EDAnonymous/comments/c2cn8n/iae_romanticizing_a_restriction_period_you_had/erjst6a/,eevery day of my life post summer of 2016 :'),False,False
erjq03b,t3_c2cn8n,t3_c2cn8n,MuddyWalruss,1,2019-06-19 06:08:01,/r/EDAnonymous/comments/c2cn8n/iae_romanticizing_a_restriction_period_you_had/erjq03b/,I feel attacked right now. Legit used to restrict to 500 cals but now i can't even do 1800. feels bad man.,False,False
erjp406,t3_c2cn8n,t1_erjhue5,Shorse_rider,1,2019-06-19 05:48:52,/r/EDAnonymous/comments/c2cn8n/iae_romanticizing_a_restriction_period_you_had/erjp406/,this sounds like such a miserable life :(,False,False
erjp2hj,t3_c2cn8n,t1_erjadn6,Shorse_rider,1,2019-06-19 05:47:53,/r/EDAnonymous/comments/c2cn8n/iae_romanticizing_a_restriction_period_you_had/erjp2hj/,time. I think your mind can only do it for so long then you kind of break down (a survival instinct that overrides willpower). Then the only way back is by feeling rock bottom level depression. You kid yourself that you will fix yourself (through restriction) once and for all.. :(,False,False
erjoy78,t3_c2cn8n,t3_c2cn8n,Shorse_rider,1,2019-06-19 05:45:14,/r/EDAnonymous/comments/c2cn8n/iae_romanticizing_a_restriction_period_you_had/erjoy78/,"I think everyone kind of breaks eventually. You see people who are in recovery demonstrating a bit of a lack of control OTT eating under the guise of recovery and freedom from restriction sometimes - you know like on YouTube, where they are eating like billions of calories of junk? (I always think - you're going to gain at a rate you can't cope with and return to vilifying types of food as 'bad' because you've gained on junk only).  &amp;#x200B;  I also think of people who start weight training with no prior gym experience and their rate of progression being super fast. Then someone who has trained for YEARS having a slower progress because it's harder to shock the body.   &amp;#x200B;  With long term restriction the long term stress on the brain and the body does lead to cracks. Often the environment also changes and doesn't support restriction as well (i.e. living with others who have trigger foods that tempt binges, or having a partner). Or being less busy, and having less time to distract yourself between your low calorie meals. A sense of failure and anguish at an inability to restrict always leads to more fails...or the gap between binges becomes much much shorter.",False,False
erjogh8,t3_c2cn8n,t3_c2cn8n,thesugarbowl,1,2019-06-19 05:34:13,/r/EDAnonymous/comments/c2cn8n/iae_romanticizing_a_restriction_period_you_had/erjogh8/,"Always. Gone are the days where restricting to 600 or under was a walk in the park, it's a struggle just to stay under 1000 now.",False,False
erjo9il,t3_c2cn8n,t3_c2cn8n,obviouslynotarobot,1,2019-06-19 05:29:45,/r/EDAnonymous/comments/c2cn8n/iae_romanticizing_a_restriction_period_you_had/erjo9il/,omg yes i would always imagine when i would eat nothing at all for days and then purging out anything i ate,False,False
