Comment ID,Link ID,Parent ID,Author,Score,Publish Date,Permalink,Text,Stickied,Is Submitter
eebuen1,t3_agibo8,t1_ee99w0o,That1weirdperson,1,2019-01-17 22:08:08,/r/EDAnonymous/comments/agibo8/im_feeling_it_now_have_any_of_you_guys/eebuen1/,"I thought that I had enough fiber, with the muesli, quinoa salad, and the grapes.  Thank you!",False,True
ee99w0o,t3_agibo8,t1_ee97qyb,queerasfolx,1,2019-01-17 00:49:28,/r/EDAnonymous/comments/agibo8/im_feeling_it_now_have_any_of_you_guys/ee99w0o/,"Fair enough. It certainly will end eventually (otherwise you would explode). However, she’s not accounting for ED behaviors or daily calorie intake. If you’re high restricting, you gotta increase your fiber. Otherwise, you’ll never shit.",False,False
ee97qyb,t3_agibo8,t1_ee94yhp,That1weirdperson,1,2019-01-17 00:07:30,/r/EDAnonymous/comments/agibo8/im_feeling_it_now_have_any_of_you_guys/ee97qyb/,"I talked to the school nurse today, and she said that maybe I eat too much fiber, and that adding Miralax is adding fiber.  She also said my conditions were temporary, and would come to pass.",False,True
ee94yhp,t3_agibo8,t3_agibo8,queerasfolx,1,2019-01-16 23:16:56,/r/EDAnonymous/comments/agibo8/im_feeling_it_now_have_any_of_you_guys/ee94yhp/,"It’s definitely an ED thing. Since my ED went full blown, I’ve started taking Metamucil daily, along with a high fiber diet, water, coffee, and the occasional lax tea to keep me regular. I can’t stand it when I have that extra weight hanging around.",False,False
ee8z020,t3_agibo8,t1_ee6lp0k,That1weirdperson,1,2019-01-16 21:42:56,/r/EDAnonymous/comments/agibo8/im_feeling_it_now_have_any_of_you_guys/ee8z020/,"Funny thing is, I got mine today.  Maybe it'll stop tonight?",False,True
ee8yymw,t3_agibo8,t1_ee6mbi3,That1weirdperson,1,2019-01-16 21:42:23,/r/EDAnonymous/comments/agibo8/im_feeling_it_now_have_any_of_you_guys/ee8yymw/,Glad to see I'm not alone!,False,True
ee8yxzv,t3_agibo8,t1_ee6s0k3,That1weirdperson,1,2019-01-16 21:42:09,/r/EDAnonymous/comments/agibo8/im_feeling_it_now_have_any_of_you_guys/ee8yxzv/,Thank you!,False,True
ee8ywjh,t3_agibo8,t1_ee7ns7c,That1weirdperson,1,2019-01-16 21:41:36,/r/EDAnonymous/comments/agibo8/im_feeling_it_now_have_any_of_you_guys/ee8ywjh/,Thanks for the advice!,False,True
ee7ns7c,t3_agibo8,t3_agibo8,_t1nk_,1,2019-01-16 12:55:38,/r/EDAnonymous/comments/agibo8/im_feeling_it_now_have_any_of_you_guys/ee7ns7c/,"Yes constipation can very much be caused by the ED. Not just that but other digestive issues too. It sucks and it can be uncomfortable but keep up with the water and try not to force it. Do not get into laxatives (unless doctor recommends), very very much sucks and gets very addictive VERY quickly (at least it does for me). Took me forever to stop and even now I think about it when it gets bad. When you try to poop don't push too hard or long because that might cause haemorrhoids. Just try to be patient and if it doesn't get better, go see your doctor. Adding some oil or fat might help.",False,False
ee6s0k3,t3_agibo8,t3_agibo8,ksck135,1,2019-01-16 05:43:51,/r/EDAnonymous/comments/agibo8/im_feeling_it_now_have_any_of_you_guys/ee6s0k3/,"I thought too much fibre caused constipation.. try to count how much you get and check with some recommendations.. also black tea/coffee seems to help some people or kefir milk..  (my ultimate remedy is cured cheese in oil, but it's just kind of home-made laxative, lots of calories and makes you regret life if you eat too much)",False,False
ee6mbi3,t3_agibo8,t3_agibo8,Saakkkaaaaiiiii,1,2019-01-16 02:54:06,/r/EDAnonymous/comments/agibo8/im_feeling_it_now_have_any_of_you_guys/ee6mbi3/,"I’m literally constipated 24/7 which led to laxative abuse.   Do not recommend, 0/10. No advice but... CONSTIPATION SOLIDARITY 🤙🏻",False,False
ee6lp0k,t3_agibo8,t3_agibo8,roseofdeathh,1,2019-01-16 02:36:28,/r/EDAnonymous/comments/agibo8/im_feeling_it_now_have_any_of_you_guys/ee6lp0k/,"I had the same problem today 😂  It can be caused by disordered eating, but if you consistently eat that much fiber you should be fine. My period does the same thing to me, so maybe it's that?",False,False
