Comment ID,Link ID,Parent ID,Author,Score,Publish Date,Permalink,Text,Stickied,Is Submitter
fag081g,t3_e5udn1,t1_f9ne6wc,plantbasedbitchh,1,2019-12-10 21:53:49,/r/EDAnonymous/comments/e5udn1/anxiety_about_eating_out/fag081g/,LMAO IM DEAD,False,True
fag07ey,t3_e5udn1,t1_f9motiq,plantbasedbitchh,1,2019-12-10 21:53:35,/r/EDAnonymous/comments/e5udn1/anxiety_about_eating_out/fag07ey/,hmmm this salad look sus... \*logs it as 800 calories\*,False,True
f9ne6wc,t3_e5udn1,t3_e5udn1,snugglejuice,1,2019-12-04 12:04:41,/r/EDAnonymous/comments/e5udn1/anxiety_about_eating_out/f9ne6wc/,boy my gay ass sure thought this was going in a different direction,False,False
f9motiq,t3_e5udn1,t3_e5udn1,thiccspo,1,2019-12-04 07:36:25,/r/EDAnonymous/comments/e5udn1/anxiety_about_eating_out/f9motiq/,well yes because i assume anything in a restaraunt is my entire day's worth of calories,False,False
f9m3yfz,t3_e5udn1,t3_e5udn1,Elllliiiizzzaabeth,1,2019-12-04 00:24:34,/r/EDAnonymous/comments/e5udn1/anxiety_about_eating_out/f9m3yfz/,If it’s a chain oftentimes the online menu will include exact calories. I get hella anxious about going out to so I ALWAYS look up the menu online so I know exactly what imma order before I even get there,False,False
f9m0ezj,t3_e5udn1,t3_e5udn1,wishamfwould,1,2019-12-03 23:26:51,/r/EDAnonymous/comments/e5udn1/anxiety_about_eating_out/f9m0ezj/,I always ask for the kids menu if I don’t think they’ll care,False,False
