Comment ID,Link ID,Parent ID,Author,Score,Publish Date,Permalink,Text,Stickied,Is Submitter
esyy6dg,t3_c96f5z,t3_c96f5z,livipup,1,2019-07-05 13:36:13,/r/EDAnonymous/comments/c96f5z/fuck_me_i_guess/esyy6dg/,I think it's just those legging's specifically.,False,False
esuwh8i,t3_c96f5z,t3_c96f5z,Theyogithatcould,1,2019-07-04 20:27:07,/r/EDAnonymous/comments/c96f5z/fuck_me_i_guess/esuwh8i/,It's not you love it's just the shitty fabric! I know they have a long reputation but lululemon actually is worth the price imo and they stretch 4 ways (the aligns atleast) so movement is free as a bird.,False,False
esuq338,t3_c96f5z,t3_c96f5z,TiinyTunes,1,2019-07-04 19:40:49,/r/EDAnonymous/comments/c96f5z/fuck_me_i_guess/esuq338/,"Xercion leggings. They're more workout style, but they come in plain black too and they are high waist and firm the belly area. I love them.",False,False
esu93tf,t3_c96f5z,t3_c96f5z,THE_KIWIS_SHALL_RISE,1,2019-07-04 17:38:10,/r/EDAnonymous/comments/c96f5z/fuck_me_i_guess/esu93tf/,I like to get athletic leggings because the fabric is more durable and thicker than the thin material of regular  leggings.,False,False
esu3d2x,t3_c96f5z,t1_esu35nu,themrschanandlerbong,1,2019-07-04 16:55:02,/r/EDAnonymous/comments/c96f5z/fuck_me_i_guess/esu3d2x/,"Thank you 💖 I agree, like i get he was trying to be helpful and being like “hey i can see ur business” but also like why are you looking ?? 👀👀",False,True
esu35nu,t3_c96f5z,t1_esu2nqa,essieelf,1,2019-07-04 16:53:27,/r/EDAnonymous/comments/c96f5z/fuck_me_i_guess/esu35nu/,Ahh okay! I just checked - they do ship to America too if you are able to shop online. You could also look at the material and check amazon or any local stores. I’m sorry about your dad’s attitude; it’s totally inappropriate of him imo.,False,False
esu2opo,t3_c96f5z,t1_esu2l71,themrschanandlerbong,1,2019-07-04 16:49:53,/r/EDAnonymous/comments/c96f5z/fuck_me_i_guess/esu2opo/,Thanks for the tip tho! 💖,False,True
esu2nqa,t3_c96f5z,t1_esu2l71,themrschanandlerbong,1,2019-07-04 16:49:38,/r/EDAnonymous/comments/c96f5z/fuck_me_i_guess/esu2nqa/,America ))):,False,True
esu2l71,t3_c96f5z,t3_c96f5z,essieelf,1,2019-07-04 16:49:02,/r/EDAnonymous/comments/c96f5z/fuck_me_i_guess/esu2l71/,"Not sure where you live OP but here in Australia the cotton on body sports leggings are quite affordable and not see through or too revealing of underwear. My sister, boyfriend’s sister, and myself all love them and none of us have had an issue despite being very different body shapes and sizes ☺️",False,False
estzq7m,t3_c96f5z,t3_c96f5z,frozenfruitx,1,2019-07-04 16:28:58,/r/EDAnonymous/comments/c96f5z/fuck_me_i_guess/estzq7m/,target’s auden line has no show panties for $5 which is less expensive than the lulu ones. you gotta be careful washing them bc they don’t hold up insanely well but overall good for the price,False,False
estn7ps,t3_c96f5z,t3_c96f5z,Stardusthatesyouall,1,2019-07-04 14:54:10,/r/EDAnonymous/comments/c96f5z/fuck_me_i_guess/estn7ps/,"I've seen teeny tiny ladies in yoga pants that end up see through!   It's not you its just thin fabric!!!! Just get some thicker pairs (note, more expensive/name brand DOES NOT equal better quality/won't go sheer on you, fyi).  Try looking for specifically athletic leggings, in my experience they're usually thicker and less see through then ""fashion"" leggings.  Alternatively, get some long length tank tops/t shirts to wear over the more sheer pairs. That's what I end up doing!",False,False
estityg,t3_c96f5z,t3_c96f5z,until_im_enough,1,2019-07-04 14:22:09,/r/EDAnonymous/comments/c96f5z/fuck_me_i_guess/estityg/,"That's actually a super common thing for everybody with stretchy leggings. It will conform to the body and whatever it's wrapping around! Panty liners showing is just what happens when you wear leggings or yoga pants.  Try no-show panties, thongs work too, or lululemon's namastay brand underclothes made for yoga pants. Don't worry, it really isn't your fault and I'm sorry your dad helicopters you like this, I know it sucks when parents do that.  Be safe sweetie ❤️",False,False
estitvr,t3_c96f5z,t3_c96f5z,Squeakymeeper13,1,2019-07-04 14:22:08,/r/EDAnonymous/comments/c96f5z/fuck_me_i_guess/estitvr/,"Naw, just try a different brand of leggings :)  I've had excellent luck with the Fifa brand because some of the others are so see thru!",False,False
