Comment ID,Link ID,Parent ID,Author,Score,Publish Date,Permalink,Text,Stickied,Is Submitter
eh36nwv,t3_atle9o,t3_atle9o,paranormalpleb,1,2019-02-23 00:39:59,/r/EDAnonymous/comments/atle9o/im_going_inpatient_and_im_scared_shitless/eh36nwv/,I'm proud of you for going!  Good job!  The thing with ED is that a lot of people are going to feel the same way you feel; you aren't alone in there.  I wish you the best of luck :),False,False
eh2r3y2,t3_atle9o,t3_atle9o,cinnamonbicycle,1,2019-02-22 20:22:06,/r/EDAnonymous/comments/atle9o/im_going_inpatient_and_im_scared_shitless/eh2r3y2/,"When I was inpatient, there were people of all different weights. One of my best friends was an atypical anorexic who was overweight or obese, but her anorexia was absolutely valid and no one took her struggles any less seriously than anyone else. A lot of girls were a normal weight, and some of them were among the sickest, because eating disorders are mental and not psychical illnesses. Of course, there are gonna be extremely underweight patients. It's gonna be triggering. But just try to remember that it's not your body that defines your ED, it's those messed up chemicals in your mind. Good luck, OP &lt;3",False,False
eh20bjq,t3_atle9o,t1_eh1vu8h,shapay199,1,2019-02-22 14:39:24,/r/EDAnonymous/comments/atle9o/im_going_inpatient_and_im_scared_shitless/eh20bjq/,"That’s true. Sometimes it’s hard to shift your mind from your own perspective, and remember that everyone else there is just as fucked up as me. Thank you for your input 💜",False,True
eh202mi,t3_atle9o,t1_eh1u5s7,shapay199,1,2019-02-22 14:36:32,/r/EDAnonymous/comments/atle9o/im_going_inpatient_and_im_scared_shitless/eh202mi/,Thank you so much. It’s been so good to have you guys to always pick me up when I’m feeling down ❤️,False,True
eh1vu8h,t3_atle9o,t3_atle9o,luckyskunk,1,2019-02-22 13:48:04,/r/EDAnonymous/comments/atle9o/im_going_inpatient_and_im_scared_shitless/eh1vu8h/,"oh im so proud of you. everyone else there is probably thinking the same of themselves, if that helps any. unless you make friends you probably won't see any of them again either, which is Definitely a thought that helps my own anxieties so i just wanted to add 💙",False,False
eh1u5s7,t3_atle9o,t3_atle9o,lbredj,1,2019-02-22 13:29:07,/r/EDAnonymous/comments/atle9o/im_going_inpatient_and_im_scared_shitless/eh1u5s7/,I've never been inpatient but I am so proud of you for going! Recovery is always scary and I know you're strong enough to make it through inpatient &lt;3 you got this ,False,False
