Comment ID,Link ID,Parent ID,Author,Score,Publish Date,Permalink,Text,Stickied,Is Submitter
eb0xef6,t3_a2ni7b,t1_eb02w23,brattyfawn,1,2018-12-03 15:06:38,/r/EDAnonymous/comments/a2ni7b/gym_routines/eb0xef6/,"Short women unite, I’m 5”1.5. Thank you!",False,True
eb0xc9e,t3_a2ni7b,t1_eazul10,brattyfawn,1,2018-12-03 15:05:55,/r/EDAnonymous/comments/a2ni7b/gym_routines/eb0xc9e/,Thank you!,False,True
eb0x9zg,t3_a2ni7b,t1_eazwlep,brattyfawn,1,2018-12-03 15:05:11,/r/EDAnonymous/comments/a2ni7b/gym_routines/eb0x9zg/,"Thank you so much, this is brilliant! I can’t wait to review it more once I’m home from work. ",False,True
eb0a9e6,t3_a2ni7b,t3_a2ni7b,lotsofsqs,1,2018-12-03 10:37:59,/r/EDAnonymous/comments/a2ni7b/gym_routines/eb0a9e6/,"For a simple routine, I switch between these every other day:  \- deadlifts, bench press, shoulder press (3 sets of 12 for all, rotating between sets)  \- squats, rows, assisted pull-ups  I add about four minutes of ab workouts -- planks, curl ups, etc -- plus any accessory workouts I feel like that day, but this isn't really necessary, IMO.  r/xxfitness is super helpful.",False,False
eb05l81,t3_a2ni7b,t1_eazwlep,weemaway,1,2018-12-03 09:36:21,/r/EDAnonymous/comments/a2ni7b/gym_routines/eb05l81/,"This was extremely helpful, thank you!",False,False
eb02w23,t3_a2ni7b,t3_a2ni7b,orthofuckyrself,1,2018-12-03 08:57:50,/r/EDAnonymous/comments/a2ni7b/gym_routines/eb02w23/,"I lift weights. It's not for weight loss though. (But I did manage to recomp so good that it increased my RMR, which is a fucking godsend as a short woman).   If you want to do core to get abs, make sure you're working upper and lower, and your whole back. You don't want to be imbalanced and throw your back out. ",False,False
eazxia0,t3_a2ni7b,t3_a2ni7b,MsFaceless,1,2018-12-03 07:28:36,/r/EDAnonymous/comments/a2ni7b/gym_routines/eazxia0/,"Warning: long post incoming: Text version of 2 of the videos I linked earlier:   Workout 1 ABS:  1.	Jumping jacks: 60 secs 2. 	Twisting crunches: 20 reps x 3 3. 	Russian twists: 20 reps x 3  	(sitting, weight in hands, side to side, lift legs for extra)	 4.	Side plank: 30 secs each side 5.	Plank: 60 secs 6. 	Mountain climbers: 20 reps x 3 	(start in a plank, knees to chest) 7.	Side leg lifts: 20 reps x 2 (each side) 	(add resistance bands for extra)  Workout 2 ABS: 1.	Plank: 60 secs 2.	Jack knives: 20 reps x 2 (each side) 	(lying, raise left arm to right leg and reverse) 3. 	Flutter kicks: 60 secs 	(lying, hands under butt, legs up and down) 4. 	Spidermans: 20 reps x 30 	(start in a plank: kness to outside elbows) 5. 	Sideways mountain climbers: 20 reps x 3 	(start in a plank, knees to opposite shoulder) 6.	Side plank: 30 secs + 30 secs pulse (each side)  Workout 3 BUTT: 1.	Jump squats: 20 reps 2.	Reverse lunges: 20 reps (each side) 	(standing, lunge backwards until knee on floor &amp; kick forwards) 3.	Donkey kicks: 20 reps + 20 pulse (each side) 	(kneeling, knee to chest and kick up) 4.	Fire hydrants: 20 reps + 20 pulse (each side) 	(kneeling, knees out sideways) 5.	Corner kicks: 20 reps + 20 pulse (each side) 	(kneeling, knee to opposite shoulder and kick up) 6.	Up and over: 20 reps each side 	(kneeling, left leg straight, lift and down to right side, reverse) 7. 	Spider kicks: 20 reps + 20 pulse (each side) 	(kneeling, knee lifted sideways and kick out in opposite direction) 8.	Butterfly bridges: 20 reps + 20 pulse 	(lie on back, knees up, lift pelvis and open knees) 9.	Clams: 20 reps + 20 pulse (each side) 	(lie on side, feet together and life knee) 10.	Side band walk: 20 left and right 	(band around thighs, step wide left and right) 11. 	Step out: 20 each side 	(band around thighs, step out and return to standing)",False,False
eazwlep,t3_a2ni7b,t3_a2ni7b,VTMongoose,1,2018-12-03 07:10:07,/r/EDAnonymous/comments/a2ni7b/gym_routines/eazwlep/,"Resistance training is the biggest key to aesthetics, way more than calorie balance is. Youtuber Mike Thurston had his body fat tested. He got the exact same number on his DXA as I did a couple weeks ago (15.4%) and yet he looks absolutely shredded while I look like a skinny-fat deflated balloon. It's because he physically has more muscle mass than I do. Muscle mass is the biggest determinant of aesthetics. One of the biggest encouragements for me during my ED recovery has been seeing how gaining weight (probably 25+ pounds at this point, dunno, haven't weighed myself in a while) has massively improved my looks because the muscle gain way ""outweighs"" the fat gain in terms of contribution to your aesthetics.  &amp;#x200B;  [https://www.youtube.com/watch?v=o-qbNmR8cLQ](https://www.youtube.com/watch?v=o-qbNmR8cLQ)  &amp;#x200B;  I recently moved to a push-pull split. I rarely directly train legs because I do spinning 3x a week usually.  &amp;#x200B;  My push workouts hit:  * chest (pecs) * shoulders, heavy emphasis on the front delts (OHP, incline/flat bench press with dumbbells, etc) * side delts * triceps  My pull workouts involve a lot of different rows and hit:  * lats (assisted pull-ups are my biggest focus. Wide grip and thumbs behind the bar help decrease bicep involvement for me) * traps * rear delts * biceps  Some muscle groups I find can handle a butt-ton of volume like chest. I do pushups at least every other day and am working on bringing the total up. I did 80 split into 2 sets of 2 yesterday. I train abs using knee raises and the ab crunch machine every session and increase/decrease the number of sets according to how recovered I feel (varies from 4-8 sets). I do dumbbell shrugs with heavy weights (60-70 lb dumbbells currently), not just to hit the upper traps but also to increase my grip strength. Very useful. I do facepulls every session as well to help strengthen my back and correct postural issues.  &amp;#x200B;  There's miscellaneous accessory work I do from time to time when I feel like I need it. Russian twists, planks, glute bridges, miscellaneous lighter weight squats and deadlifts (which are useful for stretching out my ridiculously tight hamstrings more than anything else) using dumbbells.  &amp;#x200B;  I avoid heavy compound movements (don't do the big three, squat, deadlift, bench press at all) and supersetting high intensity movements. In my experience going high intensity during my bodybuilding routine completely ruins my spinning because your CNS can only handle so much stress, and recovery is variable given the nature of the intermittent calorie restriction all of us deal with.  &amp;#x200B;  As far as definition goes, I can't point to any particular exercise group as being more beneficial but I can say that hands down I look the most aesthetic after a heavy push day where I also go heavy on abs, nature of the pump I get from that workout. The shoulder/chest workouts pull my loose skin up and away and the ab/core work gives my midsection definition.  &amp;#x200B;  Also, can't recommend enough supplementing with creatine and citrulline malate. Citrulline malate in particular is amazing for muscular recovery. Long as I take that stuff before spin class I seem to recover in literally 2/3rds of the time.  &amp;#x200B;  Nutrition is important, anyone who does lifting can tell you. Start supplementing with whey shakes, and eat as much protein as humanly possible. Whey is very well studied, there is overwhelming evidence that people who consume whey have more muscle and less fat than people taking in plant-based protein and other protein sources. There is even evidence that it increases fat burning through unknown mechanisms. Just toss it on top of your existing diet, 1-2 a day and try not to worry about calories because it's impossible for your body to store protein as fat anyway.",False,False
eazv595,t3_a2ni7b,t3_a2ni7b,clammyjmoosen,1,2018-12-03 06:38:29,/r/EDAnonymous/comments/a2ni7b/gym_routines/eazv595/,"On days when I don't have time to do cardio, I super set some weight lifting. I'll cycle my routine between three days- chest/abs, legs, and back/arms. I'll do 6-8 exercises total, where I'll alternate between 2 exercises, set for set, for 5 sets on each exercise. It keeps my heart rate high and I'm out of the gym in 30 min. Here's my current routine, but it changes a bunch.  Chest/Abs: Chicken press Bench press Incline bench press Hanging leg raises Push-ups Planks  Legs: Back squats Calf raises Quad extensions Hamstring curls Abductors Adductors Leg Press One leg kick back  Back/Arms: Deadlifts Single arm dumbbell rows Lat pulldowns Seated rows Standing hammer curl Cable standing triceps extensions Shoulder press Seated hammer curl   Unfortunately, I have no idea about the calories burned, so you'll have to do some research on how to adapt!",False,False
eazul10,t3_a2ni7b,t3_a2ni7b,innocentkitty,1,2018-12-03 06:25:08,/r/EDAnonymous/comments/a2ni7b/gym_routines/eazul10/,"i’m doing t25 at the moment and absolutely loving it!! i’ve definitely noticeably started toning up, and i love that it combines cardio and strength. i used to spend hours at the gym and make no progress, so to spend 25 minutes at home and see results is way better for me (and cheaper because i torrented it lmao)   my full routine is abs/arms for half an hour in the morning and then the t25 calendar in the afternoon. for the morning i combine about 10 ab moves (30 reps each) and 15 arm moves (30s ea or 30 reps) from my favourite pilates youtube videos by cassey ho or gabriella whited and switch up the routine every fortnight. ☺️",False,False
eazukzj,t3_a2ni7b,t3_a2ni7b,Blue_Wave92,1,2018-12-03 06:25:07,/r/EDAnonymous/comments/a2ni7b/gym_routines/eazukzj/,I lift weights. Push/Pull/Leg routine. I also indoor rock climb 3x a week. ,False,False
eaztlxk,t3_a2ni7b,t1_eazt2l9,brattyfawn,1,2018-12-03 06:00:09,/r/EDAnonymous/comments/a2ni7b/gym_routines/eaztlxk/,Thank you! I’ll check this out tomorrow before I head to the gym 🙌🏻,False,True
eazt2l9,t3_a2ni7b,t3_a2ni7b,MsFaceless,1,2018-12-03 05:46:08,/r/EDAnonymous/comments/a2ni7b/gym_routines/eazt2l9/,"I've recently gotten into watching the victoria's secret angels training routines, very floor-based resistance bands toning types of workouts, they look very easy but you work up a super sweat and you feel the burn for a few days afterwards: Links to my favs: https://www.youtube.com/watch?v=9kV7PNH3Gio&amp;t=3s / https://youtu.be/c2EiYsdrIgI?list=PLOm0szp-Cn3QmaHc3MvHLdVWr6jCpVzUi",False,False
