Comment ID,Link ID,Parent ID,Author,Score,Publish Date,Permalink,Text,Stickied,Is Submitter
fgdy9fg,t3_exwubh,t1_fgdwzq2,helloiwillnotusethis,1,2020-02-02 18:05:45,/r/EDAnonymous/comments/exwubh/another_worse_resolution_could_easily_trigger/fgdy9fg/,Thank you :-)),False,True
fgdwzq2,t3_exwubh,t1_fgdwow5,j4jackj,2,2020-02-02 17:57:41,/r/EDAnonymous/comments/exwubh/another_worse_resolution_could_easily_trigger/fgdwzq2/,i know she didn't mean it but that doesn't make it ok  manslaughter is a crime and it's used when you didn't mean to kill the person,False,False
fgdwow5,t3_exwubh,t1_fgdu726,helloiwillnotusethis,2,2020-02-02 17:55:21,/r/EDAnonymous/comments/exwubh/another_worse_resolution_could_easily_trigger/fgdwow5/,"Thank you lol (but I don’t want to speak ill of her, she didn’t mean to hurt my feelings or anything)",False,True
fgdu726,t3_exwubh,t1_fgdtm3f,j4jackj,3,2020-02-02 17:42:19,/r/EDAnonymous/comments/exwubh/another_worse_resolution_could_easily_trigger/fgdu726/,For fuck's sake. She needs to stop really,False,False
fgdtm3f,t3_exwubh,t1_fgdq9ns,helloiwillnotusethis,2,2020-02-02 17:39:27,/r/EDAnonymous/comments/exwubh/another_worse_resolution_could_easily_trigger/fgdtm3f/,Like my mum kept talking to me about the things I’m doing wrong. I’m not mad at her she wasn’t being rude but I just feel so bad about myself and the world,False,True
fgdq9ns,t3_exwubh,t3_exwubh,j4jackj,2,2020-02-02 17:16:43,/r/EDAnonymous/comments/exwubh/another_worse_resolution_could_easily_trigger/fgdq9ns/,Lectured?,False,False
fgdmaky,t3_exwubh,t3_exwubh,helloiwillnotusethis,2,2020-02-02 16:52:45,/r/EDAnonymous/comments/exwubh/another_worse_resolution_could_easily_trigger/fgdmaky/,"I have so much work to do... I am going to stay up all night to finish it, then go to school tomorrow, then come home and... I don’t know... but I’ll finish everything I have to do tonight. Tomorrow I will NOT eat anything, I know I won’t. I’ll probably just cry all day. I hate everything",False,True
