Comment ID,Link ID,Parent ID,Author,Score,Publish Date,Permalink,Text,Stickied,Is Submitter
ea234tx,t3_9xaabe,t1_ea1rzc9,FreezePeach1488,1,2018-11-19 15:00:44,/r/EDAnonymous/comments/9xaabe/reddit_staff/ea234tx/,"Wait, FatLogic still exists? WTF!    But yeah, the misogyny in Reddit is pretty egregious. Like, look at /r/justneckbeardthings and /r/justlegbeardthings and it's obvious that the former isn't misandrist while the latter certainly is misogynist. ",False,False
ea1rzc9,t3_9xaabe,t1_e9rptee,cdg2m4nrsvp,1,2018-11-19 12:37:43,/r/EDAnonymous/comments/9xaabe/reddit_staff/ea1rzc9/,Seriously. I’ve taken a look around r/fatlogic and that sub is so fucking misogynistic it is absurd. Pretty much all of the hate is directed at fat women and not fat men. I literally saw two people on there discussing how men have a better understanding of fat logic because they hold themselves to a higher standard while women just want to dictate people’s sexuality. It’s repulsive.,False,False
e9ulxrk,t3_9xaabe,t1_e9svtc8,That_child,1,2018-11-16 17:56:17,/r/EDAnonymous/comments/9xaabe/reddit_staff/e9ulxrk/,Someone needs to get Eddie bravo or Alex Jones up in here to investigate.  ,False,False
e9svtc8,t3_9xaabe,t1_e9rms2p,VakariansFemshep,1,2018-11-16 00:52:25,/r/EDAnonymous/comments/9xaabe/reddit_staff/e9svtc8/,r/thinspo goes private so that straight cis males can't shove their penises at everything -&gt; r/thinspo gets quarantined  *H M M M*,False,False
e9sqcbb,t3_9xaabe,t3_9xaabe,CannonEyes,1,2018-11-15 22:51:15,/r/EDAnonymous/comments/9xaabe/reddit_staff/e9sqcbb/,Not even small. Over 30K subscribers. Clearly a ton of people who need the support ,False,False
e9s500g,t3_9xaabe,t3_9xaabe,kalanchoe-,1,2018-11-15 17:30:21,/r/EDAnonymous/comments/9xaabe/reddit_staff/e9s500g/,"misogynistic men can say the most hateful things about women on here (not to mention racist, homophobic comments as well) but god forbid we have a support group for mental illness!!  (Btw I still agree with another comment I think on this sub that said it was probably a creep who got banned from r/thinspo or r/proed that reported the subs especially as r/halotophoes got deleted in, like, minutes.....)",False,False
e9s39is,t3_9xaabe,t3_9xaabe,axanax_lattepls,1,2018-11-15 17:09:41,/r/EDAnonymous/comments/9xaabe/reddit_staff/e9s39is/,Seriously! I just said the same thing to my twin yesterday like we get banned but those shit subs get to stay. It's bullshit. I never saw actual harmful tips or anything being posted so what gives?,False,False
e9s2qx0,t3_9xaabe,t1_e9s22c2,concentratedregret,1,2018-11-15 17:02:39,/r/EDAnonymous/comments/9xaabe/reddit_staff/e9s2qx0/,"Apparently sharing daily experiences, struggles, progress and relapses in an attempt to cope and give/receive support is only okay when you're on their list of 'Acceptable Mental Illnesses.' Otherwise *clearly* we're all just trying to trigger and worsen each other...",False,False
e9s22c2,t3_9xaabe,t1_e9s1871,WantAPerfectSoul,1,2018-11-15 16:54:19,/r/EDAnonymous/comments/9xaabe/reddit_staff/e9s22c2/,That's what pisses me off the most! The depression and anxiety subs are 'support spaces' but the ED subs 'promote self-harm.' wat?!,False,False
e9s1871,t3_9xaabe,t1_e9ry8y7,concentratedregret,1,2018-11-15 16:44:43,/r/EDAnonymous/comments/9xaabe/reddit_staff/e9s1871/,"Got to say, I agree. Reddit as a whole tends to refer to EDs as a female issue, and thus kind of treats ED support systems as stupid/damaging/nonsensical. Not only sexist but horrible and invalidating towards male and non-binary sufferers. Depression and anxiety based subreddits aren't treat like this, nor are their sufferers. ",False,False
e9ry8y7,t3_9xaabe,t1_e9qoqxl,WantAPerfectSoul,1,2018-11-15 16:07:35,/r/EDAnonymous/comments/9xaabe/reddit_staff/e9ry8y7/,"I kind of hate to say it, but I think there might be a gendered component. Like, depression is widely accepted as a disorder that anyone can suffer from, but because EDs are thought of as 'teenage girl problems' they're not allowed.",False,False
e9rwuqi,t3_9xaabe,t1_e9rnh9z,bluecokezero,1,2018-11-15 15:49:48,/r/EDAnonymous/comments/9xaabe/reddit_staff/e9rwuqi/,Be careful he gave me a three day ban once for pointing out his shitty hypocrisy ,False,False
e9rwqof,t3_9xaabe,t3_9xaabe,bluecokezero,1,2018-11-15 15:48:23,/r/EDAnonymous/comments/9xaabe/reddit_staff/e9rwqof/,Fuck spez,False,False
e9rv6p9,t3_9xaabe,t1_e9rewur,hotoutthekitchen,1,2018-11-15 15:29:10,/r/EDAnonymous/comments/9xaabe/reddit_staff/e9rv6p9/,you're not alone anymore I promise!!,False,False
e9rptee,t3_9xaabe,t3_9xaabe,FreezePeach1488,1,2018-11-15 14:24:26,/r/EDAnonymous/comments/9xaabe/reddit_staff/e9rptee/,"Majority of T_D posters are male, a lot of people diagnosed with EDs are female (because too many Drs are stuck in the 50s not because men can't be ED'd too of course). I find it hard to accept that the usual internet techbro misogyny didn't influence this decision by the Reddit Admins. ",False,False
e9rnh9z,t3_9xaabe,t3_9xaabe,fight-me-grrm,1,2018-11-15 13:56:22,/r/EDAnonymous/comments/9xaabe/reddit_staff/e9rnh9z/,Hey @spez you should feel bad,False,False
e9rmts4,t3_9xaabe,t1_e9r61zs,fragilmountain,1,2018-11-15 13:48:43,/r/EDAnonymous/comments/9xaabe/reddit_staff/e9rmts4/,"this exactly. or they could have just quarantined it, which they should have done! but they obviously didn’t think it through cause fuck people with mental illnesses beyond their control amiright?",False,False
e9rms2p,t3_9xaabe,t1_e9rm7w0,crownoflaurels24,1,2018-11-15 13:48:10,/r/EDAnonymous/comments/9xaabe/reddit_staff/e9rms2p/,Yeah I knew about that. I got approved there. I just thought it was weird how they got banned anyway. ,False,False
e9rmhdt,t3_9xaabe,t1_e9rm52x,anniecakes,1,2018-11-15 13:44:35,/r/EDAnonymous/comments/9xaabe/reddit_staff/e9rmhdt/,Oh I for sure agree! I’m just sharing information. ,False,False
e9rm7w0,t3_9xaabe,t1_e9qw96f,MightyMuskrats,1,2018-11-15 13:41:28,/r/EDAnonymous/comments/9xaabe/reddit_staff/e9rm7w0/,"Also they went private as a way to try to deal with all of the pervs coming in to the sub, not to avoid the ban hammer. ",False,False
e9rm52x,t3_9xaabe,t1_e9rlkyz,MightyMuskrats,1,2018-11-15 13:40:34,/r/EDAnonymous/comments/9xaabe/reddit_staff/e9rm52x/,"Thinspo and EDfood are both quarantined but still, I just think it’s kind of a witch hunt and takes away one of the few spaces for people suffering from a very isolating illness to be there for one another and truly offer support and harm reduction techniques. Like many have stated it’s not something we can just decide we’re cured of, and do it all on our own, at least proED was teaching people safer ways to deal with their eating disorders. ",False,False
e9rlkyz,t3_9xaabe,t1_e9r0l5e,anniecakes,1,2018-11-15 13:34:12,/r/EDAnonymous/comments/9xaabe/reddit_staff/e9rlkyz/,EDfood is also quarantined ,False,False
e9rewur,t3_9xaabe,t1_e9qyml0,LolitaJane,1,2018-11-15 12:12:42,/r/EDAnonymous/comments/9xaabe/reddit_staff/e9rewur/,&gt; no one can understand the little intricate things that someone in our position with this illness deals with unless they're living it too  before proed i was 19 years alone with my illness   ,False,False
e9rb0mm,t3_9xaabe,t1_e9r2wai,Gangreless,1,2018-11-15 11:23:10,/r/EDAnonymous/comments/9xaabe/reddit_staff/e9rb0mm/,"Come on, buddy, we're trying to rebuild here. Admins did a good enough job tearing us down, we don't need to do it to each other.",False,False
e9r7yjd,t3_9xaabe,t1_e9qz3sr,raininginkyoto_,1,2018-11-15 10:43:35,/r/EDAnonymous/comments/9xaabe/reddit_staff/e9r7yjd/,"I only found out like an hour ago and I'm in the same boat, I'm so sad and there's no one in my real life I can talk to about it :(",False,False
e9r61zs,t3_9xaabe,t1_e9r0kpc,GimmeYourHands,1,2018-11-15 10:19:10,/r/EDAnonymous/comments/9xaabe/reddit_staff/e9r61zs/,"If it was a name issue, they only needed to contact the mods and offer renaming as an alternative. But they did absolutely nothing but nuke the community. Reddit is a goddamn parasite, using us for content and unilaterally removing us when we’re a little inconvenient. ",False,False
e9r4uk9,t3_9xaabe,t1_e9r2wai,seks6,1,2018-11-15 10:03:27,/r/EDAnonymous/comments/9xaabe/reddit_staff/e9r4uk9/,Again I’m really sorry I see your post now and they look v similar but I swear I didn’t intentionally copy you ,False,True
e9r2wai,t3_9xaabe,t3_9xaabe,theycallmewidowmaker,1,2018-11-15 09:39:34,/r/EDAnonymous/comments/9xaabe/reddit_staff/e9r2wai/,I literally made this meme a few hours before you.  Not cool dude ,False,False
e9r2d4z,t3_9xaabe,t1_e9qtav8,Throwaway-way-wayway,1,2018-11-15 09:33:02,/r/EDAnonymous/comments/9xaabe/reddit_staff/e9r2d4z/,"I think the beauty of the name was that it was likely to attract people who were really struggling though. Instead of finding the usual meanspo and other things that would hurt them, they stumble into a kind and understanding community that helps them.   Maybe I’m wrong, but I work for an advertising agency and cannot see them withholding an ad from a big platform like Reddit just cause we might slip into r/all sometimes. I’m more acutely aware of very toxic subs like r/braincels or r/drugs than this one...  ",False,False
e9r1z1b,t3_9xaabe,t1_e9qnwya,Throwaway-way-wayway,1,2018-11-15 09:28:10,/r/EDAnonymous/comments/9xaabe/reddit_staff/e9r1z1b/,Yes it’s amazing. I wouldn’t be upset if you made more. More laughing slightly less crying is welcome. ,False,False
e9r0m0g,t3_9xaabe,t1_e9r0l5e,sneakpeekbot,1,2018-11-15 09:10:39,/r/EDAnonymous/comments/9xaabe/reddit_staff/e9r0m0g/,"Here's a sneak peek of /r/selfharm using the [top posts](https://np.reddit.com/r/selfharm/top/?sort=top&amp;t=year) of the year!  \#1: [From a young girl at a rite-aid to the cashier who served her;](https://np.reddit.com/r/selfharm/comments/8n9fkz/from_a_young_girl_at_a_riteaid_to_the_cashier_who/)   \#2: [It isn’t always popping pills, downing whiskey, or slicing veins. Sometimes it’s crossing the street without looking; sometimes it isn’t wearing your seatbelt. Sometimes it’s as simple as staying up all night, because you don’t want tomorrow to come.](https://np.reddit.com/r/selfharm/comments/7kqo8r/it_isnt_always_popping_pills_downing_whiskey_or/)   \#3: [PSA: People who self-harm for attention are still hurting themselves, and deserve support, care, and sympathy as well.](https://np.reddit.com/r/selfharm/comments/7kijhq/psa_people_who_selfharm_for_attention_are_still/)  ---- ^^I'm ^^a ^^bot, ^^beep ^^boop ^^| ^^Downvote ^^to ^^remove ^^| [^^Contact ^^me](https://www.reddit.com/message/compose/?to=sneakpeekbot) ^^| [^^Info](https://np.reddit.com/r/sneakpeekbot/) ^^| [^^Opt-out](https://np.reddit.com/r/sneakpeekbot/comments/8wfgsm/blacklist/)",False,False
e9r0l5e,t3_9xaabe,t1_e9qw96f,MightyMuskrats,1,2018-11-15 09:10:21,/r/EDAnonymous/comments/9xaabe/reddit_staff/e9r0l5e/,"It’s not banned but on quarantine. Kind of hilarious that they got rid of proED, proED memes, and potentially thinspo and EDfood, but r/selfharm is still around. Not that I think they should get rid of any of these subs but it’s funny to me that their reasoning was “promoting self harm” when they could just be honest and say it was about eating disorders and not try to bullshit us, since a lot of us now are concerned about our other mental health subs. ",False,False
e9r0kpc,t3_9xaabe,t1_e9qun42,-dreams-,1,2018-11-15 09:10:12,/r/EDAnonymous/comments/9xaabe/reddit_staff/e9r0kpc/,"I definitely think it was a name issue, anyone who didn't go there consistently were usually confused when they saw the name  I know we have our pitchforks and torches out, but if it was a name issue I can see where they're coming from. Seeing ProED hit the front page would be pretty awkward to explain to advertisers who don't get what it was for.  If it was a name issue though I just wish they would have handled it better and gave some kind of notice instead of forcing us to scramble and create this sub (which I'm still paranoid is going to get banned randomly :c) ",False,False
e9qz3sr,t3_9xaabe,t3_9xaabe,scienceofspin,1,2018-11-15 08:51:25,/r/EDAnonymous/comments/9xaabe/reddit_staff/e9qz3sr/,I’m so glad this sub got made. I freaked tf out when they all got banned yesterday. I couldn’t even tell anyone how upset I was bc no one knows about my ED,False,False
e9qyml0,t3_9xaabe,t1_e9qoqxl,hotoutthekitchen,1,2018-11-15 08:45:02,/r/EDAnonymous/comments/9xaabe/reddit_staff/e9qyml0/,"that's how I feel too. no one can understand the little intricate things that someone in our position with this illness deals with unless they're living it too. if i even tried to mention it to people irl, they'd react with fear, anger, who knows. how's that productive to any potential recovery? at least with you supportive people I can find some shred of normalcy and community and laugh about life instead of living in the black and white realities of recovery or suffering. these subs help me so much and ily all ♥️",False,False
e9qwm24,t3_9xaabe,t1_e9quu99,BittyBeau,1,2018-11-15 08:17:12,/r/EDAnonymous/comments/9xaabe/reddit_staff/e9qwm24/,"supposedly because the subs ""promoted self harm""  but we all know its just bc theyre judgmental dicks who dont understand anything about support groups",False,False
e9qw96f,t3_9xaabe,t3_9xaabe,crownoflaurels24,1,2018-11-15 08:12:06,/r/EDAnonymous/comments/9xaabe/reddit_staff/e9qw96f/,Does anyone know why r/thinspo was deleted? It went private at the beginning of the month. ,False,False
e9qv18k,t3_9xaabe,t3_9xaabe,wolme,1,2018-11-15 07:53:08,/r/EDAnonymous/comments/9xaabe/reddit_staff/e9qv18k/,"Yeah, what is up with that?  ",False,False
e9quu99,t3_9xaabe,t3_9xaabe,_Spicy_Lemon_,1,2018-11-15 07:50:11,/r/EDAnonymous/comments/9xaabe/reddit_staff/e9quu99/,Ok can someone pls fill me in on why it was officially banned?,False,False
e9qun42,t3_9xaabe,t1_e9qtav8,thesugarbowl,1,2018-11-15 07:47:09,/r/EDAnonymous/comments/9xaabe/reddit_staff/e9qun42/,"Same, I'm really hoping the name was a large part of the issue (even though it wasn't really that hard to look through the posts and realise we weren't glamourising EDs at all but whatevs). Hopefully this one will stick around! ",False,False
e9qtav8,t3_9xaabe,t3_9xaabe,skin_ny,1,2018-11-15 07:26:48,/r/EDAnonymous/comments/9xaabe/reddit_staff/e9qtav8/,"I’ve said this before and I’ll say it again this time...I think it’s because the name of the sub was extremely off-putting. When people see it they think pro ana and they think glamorizing starving yourself, and they don’t care to do any further inspection. I think the name of this sub is much better and hopefully our issues will stop here ",False,False
e9qr6x5,t3_9xaabe,t3_9xaabe,damnitjanet6,1,2018-11-15 06:49:02,/r/EDAnonymous/comments/9xaabe/reddit_staff/e9qr6x5/,Honestly! I'm so mad about this ,False,False
e9qr3fk,t3_9xaabe,t1_e9qocjv,PandorasMusicalBox,1,2018-11-15 06:47:09,/r/EDAnonymous/comments/9xaabe/reddit_staff/e9qr3fk/,"It's quarantined. You have to go on desktop and opt in to view the subreddit. It's still there, very alive.",False,False
e9qr25o,t3_9xaabe,t1_e9qp0bs,PandorasMusicalBox,1,2018-11-15 06:46:29,/r/EDAnonymous/comments/9xaabe/reddit_staff/e9qr25o/,"No, it's still quarantined.",False,False
e9qp3ld,t3_9xaabe,t3_9xaabe,b-carbonate,1,2018-11-15 06:04:45,/r/EDAnonymous/comments/9xaabe/reddit_staff/e9qp3ld/,"Oh it could be, Im on mobile so I can’t see those things :’)",False,False
e9qp0bs,t3_9xaabe,t1_e9qocjv,seks6,1,2018-11-15 06:02:31,/r/EDAnonymous/comments/9xaabe/reddit_staff/e9qp0bs/,oh rly?? my bad then i just thought it was quarantined ,False,True
e9qoqxl,t3_9xaabe,t3_9xaabe,howunfortunate_,1,2018-11-15 05:55:28,/r/EDAnonymous/comments/9xaabe/reddit_staff/e9qoqxl/,"btw why are literally all the other mental illness disorder subs not banned??? inconsistent admins??? IN MY WEBSITE?? ru, never  im not saying those should be banned either im just saying its horse shit because ive laugh cried to a lot of posts there while nobody in my real life understands what its like binging on rice cakes and crying about it immediately",False,False
e9qocjv,t3_9xaabe,t3_9xaabe,b-carbonate,1,2018-11-15 05:43:48,/r/EDAnonymous/comments/9xaabe/reddit_staff/e9qocjv/,"Actually Braincels was deleted too, I checked because of the meme coz I didn’t know what it was, and it’s gone too :’)",False,False
e9qo3tx,t3_9xaabe,t3_9xaabe,jaksusu,1,2018-11-15 05:36:34,/r/EDAnonymous/comments/9xaabe/reddit_staff/e9qo3tx/,Wish I had more than one upvote to give this precious meme,False,False
e9qnwya,t3_9xaabe,t1_e9qnb35,MarikoYu,1,2018-11-15 05:30:47,/r/EDAnonymous/comments/9xaabe/reddit_staff/e9qnwya/,No this is beautiful,False,False
e9qnb35,t3_9xaabe,t3_9xaabe,seks6,1,2018-11-15 05:11:40,/r/EDAnonymous/comments/9xaabe/reddit_staff/e9qnb35/,btw tell me if this is inappropriate and ill take it down !!!,False,True
