Comment ID,Link ID,Parent ID,Author,Score,Publish Date,Permalink,Text,Stickied,Is Submitter
ehcet3s,t3_ausagw,t1_ehceknj,__peewee,1,2019-02-26 14:24:03,/r/EDAnonymous/comments/ausagw/wanna_hear_a_scary_story/ehcet3s/,I’m a server too! My reflex is always accidentally offering Diet Coke instead of regular then awkwardly trying to save it 😂😂 worst server tbh,False,False
ehceofd,t3_ausagw,t1_ehb9ui5,__peewee,1,2019-02-26 14:22:36,/r/EDAnonymous/comments/ausagw/wanna_hear_a_scary_story/ehceofd/,you’re actually amazing thank you for this!!,False,False
ehceknj,t3_ausagw,t1_ehb5a77,attenuatingpixie333,1,2019-02-26 14:21:25,/r/EDAnonymous/comments/ausagw/wanna_hear_a_scary_story/ehceknj/,"I'm a server, but since I'm obsessed with only drinking diet soda, I tend to have the opposite happen. Last week a guy got super angry because I accidentally (reflexively) grabbed him a diet coke instead of regular. Oops... 🙈",False,False
ehc5jb4,t3_ausagw,t3_ausagw,Poopyoo,1,2019-02-26 12:38:44,/r/EDAnonymous/comments/ausagw/wanna_hear_a_scary_story/ehc5jb4/,"I dont understand how people can mistake the two. One tastes like shit, one tastes like sweeter shit 😂😭😂",False,False
ehbuwnn,t3_ausagw,t1_eha9o10,_t1nk_,1,2019-02-26 10:35:19,/r/EDAnonymous/comments/ausagw/wanna_hear_a_scary_story/ehbuwnn/,Yeah even if I know I bought the right kind and it says on the box I still check the actual cans.  ,False,False
ehbtych,t3_ausagw,t1_ehb5a77,Mjinzy,1,2019-02-26 10:24:06,/r/EDAnonymous/comments/ausagw/wanna_hear_a_scary_story/ehbtych/,Worst nightmare. I‘m still dumb enough to order diet coke though :D even when my boyfriend orders normal coke and then I‘m stressed during the whole meal.,False,False
ehbsmn8,t3_ausagw,t1_ehb9cvd,Demona666,1,2019-02-26 10:08:12,/r/EDAnonymous/comments/ausagw/wanna_hear_a_scary_story/ehbsmn8/,"Can't on purpose maybe, but unfortunatly accidents happen. 😐",False,False
ehbqvy4,t3_ausagw,t3_ausagw,Caketryahaim,1,2019-02-26 09:47:11,/r/EDAnonymous/comments/ausagw/wanna_hear_a_scary_story/ehbqvy4/,"Oh no, this brings back memories!   My fiance once accidentally bought an entire 42 oz bottle of soda instead of diet. I drank 1/3 before I realized that it tasted way too good to be diet. Cue pouring the entire bottle into measuring containers to determine how many calories I'd unwittingly consumed. Tears were definitely shed that night. ",False,False
ehbqoub,t3_ausagw,t1_ehb5a77,Caketryahaim,1,2019-02-26 09:44:47,/r/EDAnonymous/comments/ausagw/wanna_hear_a_scary_story/ehbqoub/,"Same! Back when I used to work in fast food, I would see it happen all the time.",False,False
ehbnlo2,t3_ausagw,t1_ehbkggm,curvylucifer,1,2019-02-26 09:05:34,/r/EDAnonymous/comments/ausagw/wanna_hear_a_scary_story/ehbnlo2/,😭😭😭,False,True
ehbkggm,t3_ausagw,t1_ehadjqi,Flesh-And-Bone,1,2019-02-26 08:22:50,/r/EDAnonymous/comments/ausagw/wanna_hear_a_scary_story/ehbkggm/,the calories are coming from INSIDE THE BOTTLE,False,False
ehbfmcg,t3_ausagw,t1_ehb9cvd,NotDido,1,2019-02-26 07:08:23,/r/EDAnonymous/comments/ausagw/wanna_hear_a_scary_story/ehbfmcg/,Well they specified accidentally.,False,False
ehb9ui5,t3_ausagw,t1_ehb5a77,curvylucifer,1,2019-02-26 05:03:28,/r/EDAnonymous/comments/ausagw/wanna_hear_a_scary_story/ehb9ui5/,Dip your fingers in the coke and rub together for a few seconds. If it is slippery its diet. If its sticky its regular! ,False,True
ehb9cvd,t3_ausagw,t1_ehb5a77,MuddyWalruss,1,2019-02-26 04:50:14,/r/EDAnonymous/comments/ausagw/wanna_hear_a_scary_story/ehb9cvd/,Im pretty sure that legally they can't mix them up because of diabetics ,False,False
ehb5a77,t3_ausagw,t3_ausagw,__peewee,1,2019-02-26 02:49:27,/r/EDAnonymous/comments/ausagw/wanna_hear_a_scary_story/ehb5a77/,This is why I don’t order diet cokes at restaurants as I am *constantly* paranoid that they must have mixed it up accidentally with regular coke. ,False,False
ehaz90y,t3_ausagw,t1_ehadjqi,flippdipp,1,2019-02-26 00:21:29,/r/EDAnonymous/comments/ausagw/wanna_hear_a_scary_story/ehaz90y/,Thanks for making me actually lol,False,False
ehayyfs,t3_ausagw,t3_ausagw,FreshOpportunity,1,2019-02-26 00:15:18,/r/EDAnonymous/comments/ausagw/wanna_hear_a_scary_story/ehayyfs/,"Oof. I lived in fear while visiting a friend because they had both caffeine free diet coke, which is gold, and caffeine free but regular calorie pepsi, which also has a gold can. Why would anybody do that to themselves??",False,False
ehap5ua,t3_ausagw,t3_ausagw,dark_side_sunchips,1,2019-02-25 21:38:56,/r/EDAnonymous/comments/ausagw/wanna_hear_a_scary_story/ehap5ua/,"ME! I was at the airport. I wanted some sparkling water- SPARKLING WATER. They have tonic water. I know the brand, the black cans are sugar free. Sure, I'll buy it. Wait- fuck, that's expensive, but I've been in line and there's people with me and uhhh yep I'll take it bye bye cash.  I drink it. I decide, I'm not going to be weird. I'm just gonna drink it. I look at the can... 42g sugar.  I don't even care that much about the calories. But I haven't had a real sugary drink in 5 years. It broke my streak. It betrayed me. A fucking.. tonic.. water.",False,False
ehafxnh,t3_ausagw,t3_ausagw,texas_native,1,2019-02-25 19:44:21,/r/EDAnonymous/comments/ausagw/wanna_hear_a_scary_story/ehafxnh/,I did the SAME EXACT THING today! ,False,False
ehadjqi,t3_ausagw,t3_ausagw,button_eyed_coraline,1,2019-02-25 19:14:50,/r/EDAnonymous/comments/ausagw/wanna_hear_a_scary_story/ehadjqi/,The call is coming from *inside the house*,False,False
ehad0p0,t3_ausagw,t3_ausagw,wolme,1,2019-02-25 19:07:57,/r/EDAnonymous/comments/ausagw/wanna_hear_a_scary_story/ehad0p0/,My first thought is how did you not notice but then i remembered that I've done the same damn thing.  Cste la vie 😁,False,False
ehabktt,t3_ausagw,t1_eha9o10,curvylucifer,1,2019-02-25 18:48:38,/r/EDAnonymous/comments/ausagw/wanna_hear_a_scary_story/ehabktt/,Never getting high before buying my sodas again ,False,True
eha9o10,t3_ausagw,t3_ausagw,dynamicsystem,1,2019-02-25 18:23:10,/r/EDAnonymous/comments/ausagw/wanna_hear_a_scary_story/eha9o10/,ahhhh that sucks I’m sorry. I examine the can for like a full minute before drinking for this very reason,False,False
