Comment ID,Link ID,Parent ID,Author,Score,Publish Date,Permalink,Text,Stickied,Is Submitter
fig0fda,t3_f7mxst,t3_f7mxst,Sobersorbet,1,2020-02-22 12:08:55,/r/EDAnonymous/comments/f7mxst/ah_fuck_just_cs_for_the_first_time_and_i_can_see/fig0fda/,"I realised I had a problem with my eating when my med student roommate was talking to me about anorexic patients and told me about c/s. I said like ""oh, that's awful! That's so sad!"" But in my mind I thought ""that's fucking brilliant, why didn't I think of this before??""",False,False
fif8lkp,t3_f7mxst,t3_f7mxst,RosieNP,1,2020-02-22 09:55:18,/r/EDAnonymous/comments/f7mxst/ah_fuck_just_cs_for_the_first_time_and_i_can_see/fif8lkp/,I tried it but found it epically unsatisfying. I wish this did it for me!,False,False
fie48zo,t3_f7mxst,t1_fidezlx,Natali_ana,1,2020-02-22 06:35:34,/r/EDAnonymous/comments/f7mxst/ah_fuck_just_cs_for_the_first_time_and_i_can_see/fie48zo/,Chew/spit,False,False
fidezlx,t3_f7mxst,t3_f7mxst,ashleytjy,1,2020-02-22 04:10:12,/r/EDAnonymous/comments/f7mxst/ah_fuck_just_cs_for_the_first_time_and_i_can_see/fidezlx/,what's c/s?,False,False
fid0u3v,t3_f7mxst,t3_f7mxst,hrabovskaan,1,2020-02-22 02:37:17,/r/EDAnonymous/comments/f7mxst/ah_fuck_just_cs_for_the_first_time_and_i_can_see/fid0u3v/,"i did this with snacks for about three days, and when i actually ate something i almost forgot to swallow it",False,False
ficjsts,t3_f7mxst,t3_f7mxst,seedlesssunflower,1,2020-02-21 23:30:58,/r/EDAnonymous/comments/f7mxst/ah_fuck_just_cs_for_the_first_time_and_i_can_see/ficjsts/,Shout out to the sliver of food that’s leftover[ you are on your way to being America’s next top model](https://images.app.goo.gl/mhbLR3AxU4mHTbuU7),False,True
