Comment ID,Link ID,Parent ID,Author,Score,Publish Date,Permalink,Text,Stickied,Is Submitter
f5cf81k,t3_dnfepj,t3_dnfepj,cbunni666,1,2019-10-26 18:56:24,/r/EDAnonymous/comments/dnfepj/wanted_to_treat_myself_this_morning_to_a_caramel/f5cf81k/,"I get this. One of the fewest times you'll treat yourself without going through 7 circles of Hell ane3 guilt and its messed up for some reason. All.i can say is, less calories but that 60 cents though. I hate being overcharged.",False,False
f5bz7an,t3_dnfepj,t1_f5b0gpj,rkellz1,1,2019-10-26 17:14:03,/r/EDAnonymous/comments/dnfepj/wanted_to_treat_myself_this_morning_to_a_caramel/f5bz7an/,Hahahahaha oh my god blizzards are my favorite I’d bE SO PISSED,False,True
f5bsjge,t3_dnfepj,t3_dnfepj,69jellybeans_69,1,2019-10-26 16:27:54,/r/EDAnonymous/comments/dnfepj/wanted_to_treat_myself_this_morning_to_a_caramel/f5bsjge/,I get it one time I got tea from a tea shop but they gave me peach green tea instead of peach black tea I wanted to scream,False,False
f5b0gpj,t3_dnfepj,t3_dnfepj,Pipergnome,1,2019-10-26 13:53:51,/r/EDAnonymous/comments/dnfepj/wanted_to_treat_myself_this_morning_to_a_caramel/f5b0gpj/,I hate when they do that. I got a blizzard once and they forgot one of the mixings. I kept thinking it was probably closer to the bottom. Half way through I dig around and can’t find it.   I call and they wouldn’t give a replacement bc I ate half already. It’s like how was I supposed to know it was missing otherwise?? Soooo annoying!!!!,False,False
f5ag7l1,t3_dnfepj,t1_f5afu6g,chupke07,1,2019-10-26 11:19:36,/r/EDAnonymous/comments/dnfepj/wanted_to_treat_myself_this_morning_to_a_caramel/f5ag7l1/,You should. They not only messed up your drink but your whole day.,False,False
f5afu6g,t3_dnfepj,t1_f5aeibk,rkellz1,1,2019-10-26 11:16:21,/r/EDAnonymous/comments/dnfepj/wanted_to_treat_myself_this_morning_to_a_caramel/f5afu6g/,"My sis told me this. I prob will. What can I say, I’m a cheap bitch #60centsis60cents",False,True
f5aeibk,t3_dnfepj,t3_dnfepj,chupke07,1,2019-10-26 11:05:15,/r/EDAnonymous/comments/dnfepj/wanted_to_treat_myself_this_morning_to_a_caramel/f5aeibk/,Btw if you email starbucks corporate about it they'll refund you the cost of the drink more than likely.,False,False
