Comment ID,Link ID,Parent ID,Author,Score,Publish Date,Permalink,Text,Stickied,Is Submitter
extf5b2,t3_cu6j97,t1_extbe1q,attenuatingpixie333,1,2019-08-23 08:42:11,/r/EDAnonymous/comments/cu6j97/clueless_mental_health_professionals/extf5b2/," I never said it isn't... it's absolutely a symptom of my ED. My point was that my therapist made an assumption that my appetite was ""normal"" just because of a very vague  comment about the types of food I eat.",False,False
extbe1q,t3_cu6j97,t1_exru0yu,ed_memes_acc,1,2019-08-23 08:11:00,/r/EDAnonymous/comments/cu6j97/clueless_mental_health_professionals/extbe1q/,Rhythmic eating is very much characteristic of (a subset of?) anorexics.,False,False
extba70,t3_cu6j97,t3_cu6j97,ed_memes_acc,1,2019-08-23 08:10:01,/r/EDAnonymous/comments/cu6j97/clueless_mental_health_professionals/extba70/,Pretty much anyone outside of specialists is bad at EDs.  That's true even for therapists/dieticians unfortunately.,False,False
extb392,t3_cu6j97,t1_exrtg0z,ed_memes_acc,1,2019-08-23 08:08:19,/r/EDAnonymous/comments/cu6j97/clueless_mental_health_professionals/extb392/,"&gt; Smfh should have schooled her  If there's one thing you can count on, it's anorexics self-silencing lol",False,False
exs911i,t3_cu6j97,t1_exru0yu,lilmissdisappearing,1,2019-08-22 23:57:00,/r/EDAnonymous/comments/cu6j97/clueless_mental_health_professionals/exs911i/,Hooo boy you just described my eating habits with more detail than I'd like,False,False
exs5kxd,t3_cu6j97,t3_cu6j97,vanillacola77,1,2019-08-22 23:03:41,/r/EDAnonymous/comments/cu6j97/clueless_mental_health_professionals/exs5kxd/,"🤦‍♀️ you should have said , “ so.... you don’t use the education you’ve learned to get your degree anymore..?”",False,False
exs0dot,t3_cu6j97,t1_exrtg0z,pierrottriste,1,2019-08-22 21:52:27,/r/EDAnonymous/comments/cu6j97/clueless_mental_health_professionals/exs0dot/,ik i was so annoyed for like an hour but i cant handle confrontation so im just like this is fine :’-),False,True
exs08x7,t3_cu6j97,t1_exrrlv8,pierrottriste,1,2019-08-22 21:50:43,/r/EDAnonymous/comments/cu6j97/clueless_mental_health_professionals/exs08x7/,yeah i think im atypical AN but either way it’s like you’re obese and have BED or you’re skinnee ana goddess and have real anorexia™️ smh,False,True
exs042v,t3_cu6j97,t1_exru0yu,pierrottriste,1,2019-08-22 21:48:57,/r/EDAnonymous/comments/cu6j97/clueless_mental_health_professionals/exs042v/,yeah people are so undereducated about this stuff...... and most times you cant even go to an ED specialist because 1) it’s expensive as shit and 2) (at least for me bcs im 18) it’s basically announcing your problems to your family,False,True
exru0yu,t3_cu6j97,t3_cu6j97,attenuatingpixie333,2,2019-08-22 20:35:16,/r/EDAnonymous/comments/cu6j97/clueless_mental_health_professionals/exru0yu/,"Yeahhhh...  I think I like my new therapist so far but I haven't mentioned my ED, and during the screening I mentioned I often get stuck in habits, like if I have something to eat I might eat only that for the next week.   She said ""oh, good, that answers my next question about if your appetite is normal! Well it's good that that is unaffected! :) ""   I didn't correct her, but it was like... I never said anything about how much of the food I eat. Sometimes I will find one low cal food and only eat that for a week and drop weight because it is barely anything. Sometimes I find a food that is way too indulgent to eat more than every so often but I do anyway, because I have started to stress eat/emotional eat and I decide it tastes good.    It just annoyed me that I mentioned getting stuck on eating the same food for a week and her takeaway was that I eat a normal amount of it.",False,False
exrtg0z,t3_cu6j97,t3_cu6j97,lovenote123,1,2019-08-22 20:28:24,/r/EDAnonymous/comments/cu6j97/clueless_mental_health_professionals/exrtg0z/,Smfh should have schooled her,False,False
exrrlv8,t3_cu6j97,t3_cu6j97,AS123x,1,2019-08-22 20:06:09,/r/EDAnonymous/comments/cu6j97/clueless_mental_health_professionals/exrrlv8/,ugh I’m sorry you had to go through that. Mental health professionals should know better than anyone that anorexia isn’t the only gd eating disorder!,False,False
