Comment ID,Link ID,Parent ID,Author,Score,Publish Date,Permalink,Text,Stickied,Is Submitter
f2dlmen,t3_dcyt1d,t3_dcyt1d,punkybrewster215,10,2019-10-03 21:52:05,/r/EDAnonymous/comments/dcyt1d/found_boyfriend_googling_mean_shit_about_me/f2dlmen/,"welp, my boyfriend tells me constantly that as soon as he makes enough money, he’s buying me new tits. I have a full C cup and I think they look proportionate on my frame, but unfortunately men are conditioned to expect freak-size Z cup tits thanks to IG/porn. But I digress.   So from one disordered, saggy titted bitch to another - run, girl. Find someone who loves YOU for exactly who and what you are.",False,False
f2dkjsl,t3_dcyt1d,t1_f2cywbd,feistaspongebob,11,2019-10-03 21:38:07,/r/EDAnonymous/comments/dcyt1d/found_boyfriend_googling_mean_shit_about_me/f2dkjsl/,girl LEAVE. you don’t deserve this!!!!,False,False
f2di5of,t3_dcyt1d,t1_f2cypz9,chknsoup4thesoil,9,2019-10-03 21:07:30,/r/EDAnonymous/comments/dcyt1d/found_boyfriend_googling_mean_shit_about_me/f2di5of/,you are NOT weak for falling for manipulation- you’re human. being manipulated can happen to the strongest of people. i really believe that you can and will cut this freak out of your life holy moly he sounds like a douche. wooow.,False,False
f2dgdrf,t3_dcyt1d,t3_dcyt1d,AztecCrystal,7,2019-10-03 20:45:04,/r/EDAnonymous/comments/dcyt1d/found_boyfriend_googling_mean_shit_about_me/f2dgdrf/,"Holy fuck throw the whole man away, he’s the human form of bed crumbs and you deserve better. Let him be with the person he likes, you’ll find someone much better who treats you like a human being",False,False
f2dfqz5,t3_dcyt1d,t3_dcyt1d,NenPractitioner,16,2019-10-03 20:37:16,/r/EDAnonymous/comments/dcyt1d/found_boyfriend_googling_mean_shit_about_me/f2dfqz5/,"Imo probably best to just ghost him and leave instead of any confrontation, especially one in person and at his place. And if possible have friends/family/acquaintances on call for support. I’m a paranoid bitch, stay safe.",False,False
f2df5v9,t3_dcyt1d,t3_dcyt1d,EzraCelestine,12,2019-10-03 20:29:59,/r/EDAnonymous/comments/dcyt1d/found_boyfriend_googling_mean_shit_about_me/f2df5v9/,"Based on your edit, I'd say try to ""keep on good terms"" with him. Like, good enough that you stay friends on facebook. Just mute his posts so you don't have to see them (but so that you still have access to his page). That way you can check in every now and then to let whatever American girl he tries to leverage into getting him a green card know that that's likely what he's doing",False,False
f2dd26p,t3_dcyt1d,t1_f2cywbd,skelekey,16,2019-10-03 20:04:16,/r/EDAnonymous/comments/dcyt1d/found_boyfriend_googling_mean_shit_about_me/f2dd26p/,"Dump his ass. Also, not to be insensitive, but please update with what happens.",False,False
f2dapa1,t3_dcyt1d,t3_dcyt1d,i_am_a_goat_baa,24,2019-10-03 19:39:07,/r/EDAnonymous/comments/dcyt1d/found_boyfriend_googling_mean_shit_about_me/f2dapa1/,"Don't tell him you are dumping him.  Do a google search for ""How to break up with someone"" and leave it on the screen just before you walk out the door.",False,False
f2da7od,t3_dcyt1d,t1_f2cykmy,belivets,4,2019-10-03 19:34:45,/r/EDAnonymous/comments/dcyt1d/found_boyfriend_googling_mean_shit_about_me/f2da7od/,"you weren't dumb! sometimes we can be blinded by these relationships, and we don't always let ourself see who these people truly are. we want to see the best in people, and its hard to get past that. but the fact that you are putting youself first and leaving him is so so brave, and i'm so proud of you &lt;3",False,False
f2d96js,t3_dcyt1d,t3_dcyt1d,slushypandaboobs,6,2019-10-03 19:26:12,/r/EDAnonymous/comments/dcyt1d/found_boyfriend_googling_mean_shit_about_me/f2d96js/,If you need my hit man services I will gladly yeet the bastard,False,False
f2d91xr,t3_dcyt1d,t1_f2cypz9,imabadone,6,2019-10-03 19:25:09,/r/EDAnonymous/comments/dcyt1d/found_boyfriend_googling_mean_shit_about_me/f2d91xr/,Dump him and then when you get away from him block him on everything and everywhere. He can't manipulate what he can't get to.,False,False
f2d78qy,t3_dcyt1d,t1_f2cywbd,bir_die,45,2019-10-03 19:13:40,/r/EDAnonymous/comments/dcyt1d/found_boyfriend_googling_mean_shit_about_me/f2d78qy/,Hell ya get out of there!!!! Find someone who googles “best date nights for sexy partner” and “partner too good for me”,False,False
f2d62k7,t3_dcyt1d,t3_dcyt1d,TheAllMightiest,4,2019-10-03 19:06:09,/r/EDAnonymous/comments/dcyt1d/found_boyfriend_googling_mean_shit_about_me/f2d62k7/,"Dump his ass and don't look back!! If you find yourself feeling like you should stay with him or go back to him get your ass right back on this comment thread and read all these great comments again, and reply to any of us if you need more support! Honey you deserve BETTER than him and you deserve happiness.  Pack ya shit and be FREE!",False,False
f2d5lzx,t3_dcyt1d,t1_f2cywbd,BabyBaphomet_,10,2019-10-03 19:02:12,/r/EDAnonymous/comments/dcyt1d/found_boyfriend_googling_mean_shit_about_me/f2d5lzx/,gogogogo!!!!,False,False
f2d3ag7,t3_dcyt1d,t3_dcyt1d,myEDfeelies,6,2019-10-03 18:46:59,/r/EDAnonymous/comments/dcyt1d/found_boyfriend_googling_mean_shit_about_me/f2d3ag7/,Dump him. Guarantee he’s not worth another second of your time,False,False
f2d2j9z,t3_dcyt1d,t3_dcyt1d,plzsendhelpobama,5,2019-10-03 18:41:26,/r/EDAnonymous/comments/dcyt1d/found_boyfriend_googling_mean_shit_about_me/f2d2j9z/,"hey, nobody deserves this treatment!!!! sounds like he's extremely immature :)) dump that mf",False,False
f2d016w,t3_dcyt1d,t1_f2cy1j7,not_the_cicada,10,2019-10-03 18:24:47,/r/EDAnonymous/comments/dcyt1d/found_boyfriend_googling_mean_shit_about_me/f2d016w/,"YES CELEBRATE breaking free!!!  You can’t control who you fall for, it’s really hard to come to terms with the ways someone you liked can let you down.   DEF nothing foolish about that, just very human 💕",False,False
f2cywbd,t3_dcyt1d,t1_f2cx9ov,tw04679,44,2019-10-03 18:17:03,/r/EDAnonymous/comments/dcyt1d/found_boyfriend_googling_mean_shit_about_me/f2cywbd/,He got wasted and fell asleep so I already started angrily packing some shit :( I haven’t even confronted him yet but you’re right,False,True
f2cypz9,t3_dcyt1d,t1_f2cyew2,tw04679,11,2019-10-03 18:15:36,/r/EDAnonymous/comments/dcyt1d/found_boyfriend_googling_mean_shit_about_me/f2cypz9/,Planning on it but I am SO weak and easily manipulated I need to figure out a game plan and be strong and cut all contact :/ thank you,False,True
f2cykmy,t3_dcyt1d,t1_f2cxlj7,tw04679,8,2019-10-03 18:14:15,/r/EDAnonymous/comments/dcyt1d/found_boyfriend_googling_mean_shit_about_me/f2cykmy/,Thank you 💕 I have been living with him for 3 months and ironically have to move back home to a different country and I guess this will deaden all feelings so no need for a LDR obviously but I just can’t get over me being such a big dumb ahhhhh but thank you again,False,True
f2cyew2,t3_dcyt1d,t3_dcyt1d,here4thesadmemes,14,2019-10-03 18:12:53,/r/EDAnonymous/comments/dcyt1d/found_boyfriend_googling_mean_shit_about_me/f2cyew2/,"I hope you dump his ass, he sounds horrible and no matter how you feel about yourself, you don’t deserve this.",False,False
f2cy1j7,t3_dcyt1d,t1_f2cxafv,tw04679,17,2019-10-03 18:11:36,/r/EDAnonymous/comments/dcyt1d/found_boyfriend_googling_mean_shit_about_me/f2cy1j7/,Thank you so much 😭❤️ I just feel like a fool for getting trapped in such a toxic relationship and pretending everything was fine (this is just a sample selection of his shitty moments lmao) but TIME TO MOVE ON and now I have an excuse to buy a big cake and eat my feelings 💀,False,True
f2cxlj7,t3_dcyt1d,t3_dcyt1d,belivets,21,2019-10-03 18:08:50,/r/EDAnonymous/comments/dcyt1d/found_boyfriend_googling_mean_shit_about_me/f2cxlj7/,lose even more weight by dumping his gross ass because everything you listed here is horrifying and you deserve to be in a rl with someone who respects you and doesn't think such awful things about you.,False,False
f2cxafv,t3_dcyt1d,t3_dcyt1d,not_the_cicada,27,2019-10-03 18:06:17,/r/EDAnonymous/comments/dcyt1d/found_boyfriend_googling_mean_shit_about_me/f2cxafv/,"Fuck his awful bullshit. Fuck it all. You know what? Awful people will show you who they are sometimes. It really fucking sucks when we love someone awful, but us loving them doesn’t make them good or redeemable.   This is all a reflection on him, not a mirror on you 💕",False,False
f2cx9ov,t3_dcyt1d,t3_dcyt1d,superymir,65,2019-10-03 18:06:07,/r/EDAnonymous/comments/dcyt1d/found_boyfriend_googling_mean_shit_about_me/f2cx9ov/,"dude, dump him before he dumps you for that ""person he fancies"", that is NOT a worthwhile relationship",False,False
