Comment ID,Link ID,Parent ID,Author,Score,Publish Date,Permalink,Text,Stickied,Is Submitter
ewtl04t,t3_cpspy6,t3_cpspy6,word-flux,1,2019-08-13 20:54:04,/r/EDAnonymous/comments/cpspy6/when_you_have_a_big_head_and_want_to_be_skinnier/ewtl04t/,"Once I hit my LW earlier this year, my housemate said I'd gotten the ""bobble-headed anorexic look"" (I actually really value her honesty and she was saying it without malice, more like ""oh honey this is worrying"") - I'm six feet tall and broad-shouldered and definitely have an above-average head size lmao. When I was getting fitted for my graduation robes, the guy first selected a small mortarboard and I was like bruz, check out the size of this noggin, that isn't gonna cut it haha. Honestly I think all I can do is gain weight to get rid of the contrast.",False,False
ewtilwn,t3_cpspy6,t3_cpspy6,red-light-district,1,2019-08-13 20:27:15,/r/EDAnonymous/comments/cpspy6/when_you_have_a_big_head_and_want_to_be_skinnier/ewtilwn/,Lol im the opposite. I have kinda broad shoulders so i push them back to look more like a bobble head.,False,False
ewt27ry,t3_cpspy6,t3_cpspy6,Astronautee,1,2019-08-13 18:28:25,/r/EDAnonymous/comments/cpspy6/when_you_have_a_big_head_and_want_to_be_skinnier/ewt27ry/,FUCK MOOOOOOOOOD GOD IM SO GLAD SOMEONE FINALLY SAYS THIS,False,False
ewrzvq1,t3_cpspy6,t3_cpspy6,not_the_cicada,1,2019-08-13 12:28:34,/r/EDAnonymous/comments/cpspy6/when_you_have_a_big_head_and_want_to_be_skinnier/ewrzvq1/,"Jesus this just brought back a vivid memory of my dad saying I looked like this when I first got sick - told me that in a sub shop, he was trying to help me but omfg. I had forgotten about THAT 🤪🥳 but I don’t have to worry about that rn because I am OSSSSFED! :0",False,False
ewrty24,t3_cpspy6,t3_cpspy6,karmarell,1,2019-08-13 11:28:15,/r/EDAnonymous/comments/cpspy6/when_you_have_a_big_head_and_want_to_be_skinnier/ewrty24/,"Yeah, add a stick neck and broader shoulders 😔",False,False
ewrsltx,t3_cpspy6,t3_cpspy6,MP-5,1,2019-08-13 11:14:14,/r/EDAnonymous/comments/cpspy6/when_you_have_a_big_head_and_want_to_be_skinnier/ewrsltx/,Thanks for sharing this. I thought I was the only one with issue and am glad to know I'm not alone. I plan on starting shoulder and chest exercises which should help broaden my upper body to make my head look more proportional.,False,False
