Comment ID,Link ID,Parent ID,Author,Score,Publish Date,Permalink,Text,Stickied,Is Submitter
etgqjp9,t3_cbb789,t3_cbb789,ketothrowaway95,1,2019-07-10 17:12:17,/r/EDAnonymous/comments/cbb789/currently_sitting_on_the_bathroom_floor/etgqjp9/,I feel this.. the sounds people make when they chew with their mouth open make me wanna vomit,False,False
etft5cd,t3_cbb789,t1_eteoikj,IkarosFalling,1,2019-07-10 11:44:22,/r/EDAnonymous/comments/cbb789/currently_sitting_on_the_bathroom_floor/etft5cd/,I hate that shit! My brother used to make the worst noises constantly and it made my entire family mad... Until my mom realized the 2% milk was making him congested permanently and the opening his mouth randomly while eating was an unconscious reaction to not getting enough oxygen nasally! He switched to skim milk and I stopped wanting to murder him (as much),False,False
eteuw28,t3_cbb789,t3_cbb789,throwawayluckybamboo,1,2019-07-10 03:39:11,/r/EDAnonymous/comments/cbb789/currently_sitting_on_the_bathroom_floor/eteuw28/,Ugh that sounds so gross. I have a co-worker who does this and it's so disgusting. Even thinking about it now makes me shudder. But I only have to see her once a week - I'm sorry you have to deal with it every day! I agree with another post saying to puke on him or dry heave haha,False,False
etepsjd,t3_cbb789,t3_cbb789,huhwhatwhytho,1,2019-07-10 01:51:03,/r/EDAnonymous/comments/cbb789/currently_sitting_on_the_bathroom_floor/etepsjd/,I once went on a two week holiday with a friend of mine who is originally from China. I was about ready to pierce my eardrums by the end of the holiday... (open mouth chewing is a cultural thing in some asian countries),False,False
etepktj,t3_cbb789,t1_etep64g,wearetheresult,1,2019-07-10 01:46:57,/r/EDAnonymous/comments/cbb789/currently_sitting_on_the_bathroom_floor/etepktj/,"I would!! Especially since you've tried to bring it up but he doesn't seem to be getting it, ya know? Like ""hurggghhh"" oops sorry babe that sound just ""hurggghhh"" 😂",False,False
etep64g,t3_cbb789,t1_etep1w7,bubble-baddie,1,2019-07-10 01:39:10,/r/EDAnonymous/comments/cbb789/currently_sitting_on_the_bathroom_floor/etep64g/,I will definitely have to try the dry heaving if he doesn't stop 😂,False,True
etep1w7,t3_cbb789,t1_eteoikj,wearetheresult,1,2019-07-10 01:36:59,/r/EDAnonymous/comments/cbb789/currently_sitting_on_the_bathroom_floor/etep1w7/,"Damn, I feel for you. Thankfully my husband hates it as much as I do. Talk to him. And if that doesn't work, get a **very tiny bit** childish and start dry heaving when he does it. Explain that literally hearing him chew eoth less skill than a toddler is going to make you puke. ....... Maybe word it better than that, haha.",False,False
eteoikj,t3_cbb789,t1_etekp3w,bubble-baddie,1,2019-07-10 01:27:05,/r/EDAnonymous/comments/cbb789/currently_sitting_on_the_bathroom_floor/eteoikj/,"He's a very sweet man, he just doesn't understand how much it really bugs me. His mom does it too so maybe he was just never taught to chew right 😂 he says he doesn't realize he's even doing it. I vote to puke on him too sometimes.",False,True
etekp3w,t3_cbb789,t3_cbb789,wearetheresult,1,2019-07-10 00:20:07,/r/EDAnonymous/comments/cbb789/currently_sitting_on_the_bathroom_floor/etekp3w/,"I'm sorry, but he sounds like a dick. Even my 3 year old understands 'chew with your mouth closed'. Shouldn't be hard for a grown person to understand. I personally vote you puke on him. Just beacaue, ew. Seriously, if a 3 year old can not chew like a cow, anyone can🤷🏻‍♀️.",False,False
eteg2xy,t3_cbb789,t3_cbb789,CoconutCowgirl,1,2019-07-09 23:08:58,/r/EDAnonymous/comments/cbb789/currently_sitting_on_the_bathroom_floor/eteg2xy/,"People I have talked to about this get really sensitive about it, like they have no idea how to even self monitor this type of behavior.  It’s a major shift for them and I’m apparently severely disrupting their disconnected eat style. 🙄   I have talked to my boyfriend and my brother about this, I gave up when I got to my mom and step dad. Being around people who are eating is a maddening experience for me. Sometimes, I fake a phone call or take the dog out for a walk to avoid them, or just leave the room for a while. Whatever is possible at the time.  It’s not easy.  In my experience, noisy eaters enjoy further distraction while eating, so they like company and I can’t always get away at restaurants.",False,False
eteex7s,t3_cbb789,t1_eteelno,bubble-baddie,1,2019-07-09 22:52:13,/r/EDAnonymous/comments/cbb789/currently_sitting_on_the_bathroom_floor/eteex7s/,Yeah I've brought it up a couple times. I told him he's the only person I don't completely bitch out when I hear it and that's true. It is realllllly annoying and hasn't gotten to me too much until recently. Everything food related has been making me feel sick so that took me over the edge.,False,True
eteelno,t3_cbb789,t1_eteejtu,StressedCookie,1,2019-07-09 22:47:42,/r/EDAnonymous/comments/cbb789/currently_sitting_on_the_bathroom_floor/eteelno/,"Oh god.. Have you told him that? If he still does it then, idk hahaha that sounds annoying",False,False
eteejtu,t3_cbb789,t1_etee9u2,bubble-baddie,1,2019-07-09 22:46:59,/r/EDAnonymous/comments/cbb789/currently_sitting_on_the_bathroom_floor/eteejtu/,"It's not just chewing with his mouth open, he smacks his lips and makes as much noise as possible 🤦‍♀️",False,True
etee9u2,t3_cbb789,t3_cbb789,StressedCookie,1,2019-07-09 22:43:06,/r/EDAnonymous/comments/cbb789/currently_sitting_on_the_bathroom_floor/etee9u2/,He chews with his mouth open??,False,False
