Comment ID,Link ID,Parent ID,Author,Score,Publish Date,Permalink,Text,Stickied,Is Submitter
efsyr09,t3_an640f,t3_an640f,arcoalien,1,2019-02-05 10:33:06,/r/EDAnonymous/comments/an640f/hae_lost_their_taste_for_coffee/efsyr09/,"Free work coffee always sucks. Recently I've been obsessed with these hawaiian vanilla/macadamia coffee beans. Still nearly zero calories, but it smellssss heavenly and tastes like how it smells.",False,False
efsryz8,t3_an640f,t1_efr0pu9,lotsofsqs,1,2019-02-05 09:11:00,/r/EDAnonymous/comments/an640f/hae_lost_their_taste_for_coffee/efsryz8/,I think my body just got fed up of the stomach aches!,False,True
efsry2e,t3_an640f,t1_efrasw6,lotsofsqs,1,2019-02-05 09:10:42,/r/EDAnonymous/comments/an640f/hae_lost_their_taste_for_coffee/efsry2e/,I think it's basically my body telling me to please stop poisoning it.,False,True
efspxeu,t3_an640f,t3_an640f,TheManyArchetypes,1,2019-02-05 08:44:44,/r/EDAnonymous/comments/an640f/hae_lost_their_taste_for_coffee/efspxeu/,"I drink a lot of coffee and Americanos. We have an espresso machine and a pour over. I take my coffee in a thermos when I take it to work or wherever.   I also drink all the tea.  Sometimes coffee will upset my stomach so I have to switch it up. I love earl grey, green tea, white tea, herbal ginger, mint or fruit etc. Just all the tea.",False,False
efrasw6,t3_an640f,t3_an640f,milovsflo,1,2019-02-04 17:10:22,/r/EDAnonymous/comments/an640f/hae_lost_their_taste_for_coffee/efrasw6/,"I thought I was the only one! I’ve been drinking coffee for years and I’ve always loved it, I even liked black coffee! But these past few days it’s been making me gag. I’ve tried drinking it black, with sugar, with zero calorie sweetener, milk, whatever. It just makes me gag. It’s sad because I’m usually a huge coffee lover. ",False,False
efr17ii,t3_an640f,t1_efr127b,lotsofsqs,1,2019-02-04 15:15:01,/r/EDAnonymous/comments/an640f/hae_lost_their_taste_for_coffee/efr17ii/,"Ooh, cool! I didn't know those existed! I can keep it at work and use their beans, plus I drink coffee on weekends anyway.",False,True
efr155d,t3_an640f,t3_an640f,pinpeach,1,2019-02-04 15:14:16,/r/EDAnonymous/comments/an640f/hae_lost_their_taste_for_coffee/efr155d/,yep. after drinking it for years as a meal replacement and working at starbucks,False,False
efr127b,t3_an640f,t1_efr0qu2,celinat0r,1,2019-02-04 15:13:20,/r/EDAnonymous/comments/an640f/hae_lost_their_taste_for_coffee/efr127b/,"Ooo wait I bought a cold brew maker at Target for $8.99 and a good-sized bag of fair trade ground beans for $6! Obviously still a bit of coin compared to your work coffee which I’m assuming is free, but definitely cheaper than a $5 starbucks cup haha",False,False
efr0qu2,t3_an640f,t1_efqyyt5,lotsofsqs,1,2019-02-04 15:09:41,/r/EDAnonymous/comments/an640f/hae_lost_their_taste_for_coffee/efr0qu2/,"Iced coffee is definitely more palatable! It certainly doesn't help that the coffee at my work seems to taste really burnt, but I don't want to start a daily coffee-shop habit.",False,True
efr0pu9,t3_an640f,t3_an640f,els4,1,2019-02-04 15:09:21,/r/EDAnonymous/comments/an640f/hae_lost_their_taste_for_coffee/efr0pu9/,"Noo, but it burns on an empty stomach if it's black and goes right through me. So I love black coffee, but it's hard lol",False,False
efqyyt5,t3_an640f,t3_an640f,celinat0r,1,2019-02-04 14:49:16,/r/EDAnonymous/comments/an640f/hae_lost_their_taste_for_coffee/efqyyt5/,oh no. i’m obsessed with coffee:( have you tried different preparations? i find that having it iced + with a lighter roast (medium is my favorite) makes it much more palatable!,False,False
