Comment ID,Link ID,Parent ID,Author,Score,Publish Date,Permalink,Text,Stickied,Is Submitter
ezy4fin,t3_d2lk9q,t1_ezwke6y,SubWhereItHappens,1,2019-09-11 22:04:30,/r/EDAnonymous/comments/d2lk9q/wellness_wednesday_september_11_2019/ezy4fin/,"You're welcome. :) Wishing you all the best with getting the medical stuff underway, and the convo with your fiance when you're ready.",False,False
ezx99c9,t3_d2lk9q,t3_d2lk9q,cisheterpatriarchy,1,2019-09-11 15:49:01,/r/EDAnonymous/comments/d2lk9q/wellness_wednesday_september_11_2019/ezx99c9/,i just hit 14 days without binging tonight. i am so proud of myself. i want to keep this up for a long time,False,False
ezx6ces,t3_d2lk9q,t1_ezvszdv,randomjee,1,2019-09-11 15:17:40,/r/EDAnonymous/comments/d2lk9q/wellness_wednesday_september_11_2019/ezx6ces/,"I read this today: ""Doing anything--even doing it badly--is always better than sitting paralyzed and doing nothing."" Chin up, doll!",False,False
ezx2myt,t3_d2lk9q,t3_d2lk9q,SmileIsKey,1,2019-09-11 14:37:55,/r/EDAnonymous/comments/d2lk9q/wellness_wednesday_september_11_2019/ezx2myt/,\~goals\~  lose weight the healthy weigh and eat at maintence &gt;.&gt;  not weigh myself until oct 1 because i know weiging myself would just trigger me   enjoy this gap semester and actually listen to therapist,False,False
ezwoz5v,t3_d2lk9q,t3_d2lk9q,tigerchik,1,2019-09-11 12:08:19,/r/EDAnonymous/comments/d2lk9q/wellness_wednesday_september_11_2019/ezwoz5v/,racking up more days... sat through an urge last night (33 days binge free!). Journaling is helping me be healthier right now.,False,False
ezwke6y,t3_d2lk9q,t1_ezwagsi,TheAllMightiest,1,2019-09-11 11:18:31,/r/EDAnonymous/comments/d2lk9q/wellness_wednesday_september_11_2019/ezwke6y/,"(TW BMI)     Thank you so much for the information! I'll probably reach out to the head nurse at my clinic and ask if she can refer me to a PCP. My BMI is probably somewhere around like, 18.7?? Very low end of ""normal"", definitely, although I haven't been able to weigh myself recently.",False,False
ezwagsi,t3_d2lk9q,t1_ezw9dqi,SubWhereItHappens,1,2019-09-11 09:27:53,/r/EDAnonymous/comments/d2lk9q/wellness_wednesday_september_11_2019/ezwagsi/,"(TW numbers maybe?)  Also this seems to be very inconsistent from one medical professional to another, but I was not at a sub-18.5 bmi, let alone the magic 17.5 criteria. Low end of traditional ""normal,"" yes.",False,False
ezw9dqi,t3_d2lk9q,t1_ezvxq12,SubWhereItHappens,1,2019-09-11 09:15:16,/r/EDAnonymous/comments/d2lk9q/wellness_wednesday_september_11_2019/ezw9dqi/,"My primary care doctor diagnosed me, yes, and at that first appointment when I brought it up in very ""I don't know what I need but help?"" fashion.  I did talk to a therapist at that appointment because my drs office does have some behavioral health services, but the doctor wasn't shy about calling it AN before I even got to that part of the program.",False,False
ezw07mn,t3_d2lk9q,t3_d2lk9q,K0B3ryant,1,2019-09-11 07:14:03,/r/EDAnonymous/comments/d2lk9q/wellness_wednesday_september_11_2019/ezw07mn/,"TW, self harm, suicide, other self hate talk I guess   .    .   .   I just found a picture of myself last year and I looked sick and I was looking at it admiring myself, KNOWING the self loathing I was experiencing at that time. KNOWING the desperation I felt to feel even a tiny tiny minuscule amount better or I would kill myself soon.  I’m ashamed of this. This picture was right at the time I started cutting myself.   To add to this stupidity I was probably pretty close to the weight I am right now but I can’t see it today. I’m so much healthier now in every way but I looked at that picture and thought “damn I want that look again.”    Actually idiot you don’t. Stop romanticizing your sickness K0B3!",False,False
ezvxq12,t3_d2lk9q,t1_ezvualy,TheAllMightiest,1,2019-09-11 06:32:40,/r/EDAnonymous/comments/d2lk9q/wellness_wednesday_september_11_2019/ezvxq12/,"Did you just get your diagnosis through your primary care physician? Did it require multiple appointments/a combination of a doctor and therapist to diagnose you?  Feel free to only share as much as you're comfortable with, I just don't know much about how to get a diagnosis.",False,False
ezvualy,t3_d2lk9q,t1_ezvpynk,SubWhereItHappens,1,2019-09-11 05:22:38,/r/EDAnonymous/comments/d2lk9q/wellness_wednesday_september_11_2019/ezvualy/,"I did the doctor thing first. And then actually armed with a diagnosis was able to kind of organize my brain chaos and sit down and say ""this is what's been going on, and this is what the doctor had to say, and this is how we're going to start tackling it.""",False,False
ezvszdv,t3_d2lk9q,t3_d2lk9q,Sea_Plane,1,2019-09-11 04:48:50,/r/EDAnonymous/comments/d2lk9q/wellness_wednesday_september_11_2019/ezvszdv/,"I'm really really *really* trying to take each day as it comes, rather than becoming paralysed with stress and fear about my (very uncertain) future. I'm not doing a terribly good job of it, but maybe if I keep trying, something in my brain will click? I have to accept that a lot of big things in my life right now are out of my control and I just have to make the best out of shitty circumstances and work with what I've got. That's really hard for me.    I signed up for an art therapy group, so that I'm literally forced to sit down and be still and calm for 2 hours a week, and to focus on something other than my fear for a little while.",False,False
ezvpynk,t3_d2lk9q,t3_d2lk9q,TheAllMightiest,1,2019-09-11 03:23:21,/r/EDAnonymous/comments/d2lk9q/wellness_wednesday_september_11_2019/ezvpynk/,"Does anyone have encouragement/tips for telling a relationship partner you have an ED? I'm almost to the point where I'm ready to tell my fiancé, but my dumb ED brain doesn't want to stop restricting and thinks I should get to an UW BMI first in case I go to a doctor for a diagnosis, and I also just don't know how to bring up the subject? I don't want him to feel like he has to be the one in charge of my recovery (but he is a nurse, so he may do so anyway) and I don't want to tell him because he's already stressed out about work and has a therapy intake appointment on Thursday.",False,False
ezvoktn,t3_d2lk9q,t3_d2lk9q,sstephenn,1,2019-09-11 02:45:11,/r/EDAnonymous/comments/d2lk9q/wellness_wednesday_september_11_2019/ezvoktn/,Just trying to slow myself down a bit I deal with this crap everyday why am I rushing stuff,False,False
