Comment ID,Link ID,Parent ID,Author,Score,Publish Date,Permalink,Text,Stickied,Is Submitter
efvo22n,t3_anfy5w,t1_efuj87q,BED_bitch,1,2019-02-06 10:51:26,/r/EDAnonymous/comments/anfy5w/i_have_an_opened_bag_of_chips_that_has_been_in_my/efvo22n/,Thank you for your kind words &lt;3,False,True
efvo12m,t3_anfy5w,t1_efui054,BED_bitch,1,2019-02-06 10:51:08,/r/EDAnonymous/comments/anfy5w/i_have_an_opened_bag_of_chips_that_has_been_in_my/efvo12m/,"Yay, congrats! (Still not sure I am strong enough to have granola bars at home haha)",False,True
efvnw2k,t3_anfy5w,t1_efuckwo,BED_bitch,1,2019-02-06 10:49:32,/r/EDAnonymous/comments/anfy5w/i_have_an_opened_bag_of_chips_that_has_been_in_my/efvnw2k/,"I have a similar approach; this is my first bag of chips in weeks, so I totally understand you.",False,True
efvnjuk,t3_anfy5w,t1_efto1qu,BED_bitch,1,2019-02-06 10:45:39,/r/EDAnonymous/comments/anfy5w/i_have_an_opened_bag_of_chips_that_has_been_in_my/efvnjuk/,Thank you &lt;3,False,True
efvnj9f,t3_anfy5w,t1_eftgc9x,BED_bitch,1,2019-02-06 10:45:28,/r/EDAnonymous/comments/anfy5w/i_have_an_opened_bag_of_chips_that_has_been_in_my/efvnj9f/,"I tried and failed too, many times. I believe in you!",False,True
efvnfwo,t3_anfy5w,t1_eft97xh,BED_bitch,1,2019-02-06 10:44:25,/r/EDAnonymous/comments/anfy5w/i_have_an_opened_bag_of_chips_that_has_been_in_my/efvnfwo/,"Doritos? Damn, those and Cheetos are my worst binge snacks.",False,True
efuj87q,t3_anfy5w,t3_anfy5w,fishonthesun,1,2019-02-05 21:58:44,/r/EDAnonymous/comments/anfy5w/i_have_an_opened_bag_of_chips_that_has_been_in_my/efuj87q/,"This is so awesome!!!! V proud, keep up the hard work",False,False
efui054,t3_anfy5w,t3_anfy5w,MissNietzsche,1,2019-02-05 21:42:51,/r/EDAnonymous/comments/anfy5w/i_have_an_opened_bag_of_chips_that_has_been_in_my/efui054/,"I've recently FINALLY started being okay with having snacks like that in the pantry, after 8 years of my dad always thinking my sisters ate a lot of granola bars and had to buy like four boxes every week. It feels so good to be able to keep processed food in storage without bingeing on it. Congrats, OP.",False,False
efufo5n,t3_anfy5w,t1_eft97xh,ImNotUnique____,1,2019-02-05 21:14:17,/r/EDAnonymous/comments/anfy5w/i_have_an_opened_bag_of_chips_that_has_been_in_my/efufo5n/,"If there are ED gods, they shined upon you that day.   Or did it like some Old Testament shit just to test you.",False,False
efuckwo,t3_anfy5w,t3_anfy5w,violettheatre,1,2019-02-05 20:38:25,/r/EDAnonymous/comments/anfy5w/i_have_an_opened_bag_of_chips_that_has_been_in_my/efuckwo/,"Yay, congrats! I have just not been buying any snacks or candy at all for months now but honestly I miss treats....maybe I'll buy some chips this weekend and also try to eat a Normal Person^(TM) amount",False,False
efto1qu,t3_anfy5w,t3_anfy5w,82326,1,2019-02-05 15:28:26,/r/EDAnonymous/comments/anfy5w/i_have_an_opened_bag_of_chips_that_has_been_in_my/efto1qu/,Congrats!,False,False
eftgc9x,t3_anfy5w,t3_anfy5w,yesyesyeszaddylike,1,2019-02-05 13:57:58,/r/EDAnonymous/comments/anfy5w/i_have_an_opened_bag_of_chips_that_has_been_in_my/eftgc9x/,Good job I need to try to practice that. I try every day and fail every day. I’m still trying though. ,False,False
eft97xh,t3_anfy5w,t3_anfy5w,gigi-has-issues,1,2019-02-05 12:35:07,/r/EDAnonymous/comments/anfy5w/i_have_an_opened_bag_of_chips_that_has_been_in_my/eft97xh/,One time I found a bag of Doritos in my party that had only been half eaten and I couldn’t fucking believe it.  Congrats OP ,False,False
