Comment ID,Link ID,Parent ID,Author,Score,Publish Date,Permalink,Text,Stickied,Is Submitter
fgp8i99,t3_ezmnac,t3_ezmnac,my-destructive-side,1,2020-02-06 08:30:45,/r/EDAnonymous/comments/ezmnac/affordable_safe_food_advice/fgp8i99/,"Frozen fruit and veg, oats/oatmeal, beans (dried are super cheap but even canned beans aren’t expensive), eggs, tofu, certain fresh fruits/veg (bananas, onions, leafy greens can be cheap depending on the type and store, carrots, celery, potatoes but not sure if those are safe for you), rice if it’s safe for you is cheap if you buy it in bulk somewhere like Costco.  You can make soup for suuuuuper cheap, and one pot can last an entire week.  Minestrone— a can of diced tomatoes, some tomato paste, an onion, garlic, a can of kidney beans and cannelinni (sp?) brand, celery, carrots, one zucchini, some frozen chopped spinach, and boullion (why tf do I not know how to spell anymore?) cubes.  Chickpea no noodle soup— onion, garlic, celery, carrots, one or two cans of chickpeas, dried rosemary, and boullion cubes.  Stir fry with frozen veg and tofu with a bit of teriyaki sauce or something is cheap and easy.",False,False
fgoqg9f,t3_ezmnac,t3_ezmnac,Mogsternaut,1,2020-02-06 03:32:14,/r/EDAnonymous/comments/ezmnac/affordable_safe_food_advice/fgoqg9f/,"Bullion cubes in water - if you have Oxo cubes, the beef ones are 15kcal per one and very filling. Grissini bread sticks, plain rice cakes, fruit, 0% fat yoghurt in half portions and (weirdly) toast.",False,False
fgoq0l7,t3_ezmnac,t1_fgojzz7,rottengirlbones,1,2020-02-06 03:21:39,/r/EDAnonymous/comments/ezmnac/affordable_safe_food_advice/fgoq0l7/,"i just posted in there, hopefully it helps, thank you",False,True
fgojzz7,t3_ezmnac,t3_ezmnac,puppetcreature,1,2020-02-06 01:07:55,/r/EDAnonymous/comments/ezmnac/affordable_safe_food_advice/fgojzz7/,Maybe r/safefood will help you,False,False
fgoi07a,t3_ezmnac,t3_ezmnac,cjmbcpa,1,2020-02-06 00:31:07,/r/EDAnonymous/comments/ezmnac/affordable_safe_food_advice/fgoi07a/,Pickles and fruit like kiwis/blueberries/cherry tomatoes. Also cereal for me because its sweet enough that i feel satisfied but also not good enough that ill binge on it.,False,False
fgohht6,t3_ezmnac,t3_ezmnac,SemicolonButterfly,1,2020-02-06 00:22:18,/r/EDAnonymous/comments/ezmnac/affordable_safe_food_advice/fgohht6/,"It kinda depends on where I'm at, but at various times it's included eggs, cottage cheese, stovetop oatmeal, various fruits/veggies that are in season or on sale, canned tuna, and protein bars/drinks if I can score them for about $1 each.",False,False
fgoh3uh,t3_ezmnac,t3_ezmnac,bigglob,1,2020-02-06 00:15:44,/r/EDAnonymous/comments/ezmnac/affordable_safe_food_advice/fgoh3uh/,Eggs!,False,False
fgobsbx,t3_ezmnac,t3_ezmnac,k_otamatone,1,2020-02-05 22:56:04,/r/EDAnonymous/comments/ezmnac/affordable_safe_food_advice/fgobsbx/,Canned soup. There’s literally no calories in there,False,False
