Comment ID,Link ID,Parent ID,Author,Score,Publish Date,Permalink,Text,Stickied,Is Submitter
feg8m68,t3_eosxwa,t1_fefd7nc,unlikelyotter,1,2020-01-15 03:57:49,/r/EDAnonymous/comments/eosxwa/what_do_you_mean_i_ate_one_reese_cup_and_now_i/feg8m68/,They put me at 390 calories a day 🙈,False,False
feg29t5,t3_eosxwa,t1_fefdcls,ysamw,1,2020-01-15 01:36:32,/r/EDAnonymous/comments/eosxwa/what_do_you_mean_i_ate_one_reese_cup_and_now_i/feg29t5/,i felt this comment to my core omg,False,False
feft04m,t3_eosxwa,t1_fefdcls,SecretIdentity8594,1,2020-01-14 22:58:15,/r/EDAnonymous/comments/eosxwa/what_do_you_mean_i_ate_one_reese_cup_and_now_i/feft04m/,"I can relate to that, my desk is covered in them since I got brought TWO Reece’s cup advent calendars at Christmas... and now they just taunt me every day since I love them but I can’t eat them. I imagine it must be awful to deal with with an ED as well, which luckily for me I don’t suffer with.  Good luck dealing with it too, you’re doing great just by being able to eat Reece’s cups.",False,False
fefdcls,t3_eosxwa,t1_fef4s2w,pancakes4meplz,1,2020-01-14 20:04:44,/r/EDAnonymous/comments/eosxwa/what_do_you_mean_i_ate_one_reese_cup_and_now_i/fefdcls/,There is a huge jar of candy at work and I have an intense sweet tooth. The lord is testing me every day.,False,True
fefd7nc,t3_eosxwa,t1_fef8w1k,pancakes4meplz,1,2020-01-14 20:03:17,/r/EDAnonymous/comments/eosxwa/what_do_you_mean_i_ate_one_reese_cup_and_now_i/fefd7nc/,"According to Samsung Health I can eat 1000 calories a day, do literally nothing else, and lose 2 pounds  week so I don't trust it that much.",False,True
fef8w1k,t3_eosxwa,t3_eosxwa,unlikelyotter,1,2020-01-14 19:15:45,/r/EDAnonymous/comments/eosxwa/what_do_you_mean_i_ate_one_reese_cup_and_now_i/fef8w1k/,"I use Samsung Health too and it throws me off a lot when the weight management this says ""over"" and is in the red, but it goes down over the day and it's always in the ""under"" the next morning for me 🙈 but it can be stressful when its giving like ""run for 45min to be on target"" and you've only eaten an apple lol",False,False
fef4s2w,t3_eosxwa,t3_eosxwa,foxx_ghost,1,2020-01-14 18:29:28,/r/EDAnonymous/comments/eosxwa/what_do_you_mean_i_ate_one_reese_cup_and_now_i/fef4s2w/,Reece’s cups are my favorite. I wouldn’t be able to only eat one so props to you!,False,False
