Comment ID,Link ID,Parent ID,Author,Score,Publish Date,Permalink,Text,Stickied,Is Submitter
feit1ke,t3_emmmyy,t3_emmmyy,Tomyoldbrownearth,1,2020-01-15 21:47:42,/r/EDAnonymous/comments/emmmyy/am_i_the_only_one_who_feels_like_shit_if_someone/feit1ke/,"This is like a KEY component for my ed. I used to binge so hard as a kid, before I even understood anything about it. Now I’m so afraid of eating more than anyone because I feel like I embarrassed myself and didn’t even realize it at all growing up. Probably just embarrassing myself in other ways I’ll figure out later though 😎",False,False
fdskgsl,t3_emmmyy,t3_emmmyy,red_ossifrage,1,2020-01-10 18:58:34,/r/EDAnonymous/comments/emmmyy/am_i_the_only_one_who_feels_like_shit_if_someone/fdskgsl/,"The worst is when people COMMENT ABOUT IT. Like, ""Wow, YOU ate more than DANA???"" Okay, guess I'm never eating with you guys as witnesses ever again in my life.",False,False
fdsbzzl,t3_emmmyy,t3_emmmyy,tigerchik,1,2020-01-10 17:32:08,/r/EDAnonymous/comments/emmmyy/am_i_the_only_one_who_feels_like_shit_if_someone/fdsbzzl/,"I go back and forth between ""watch me not eat anything while you eat  stuff"" and ""watch me eat more than you and stay skinnier"". It depends on what sort of ""show off"" mood I'm in.",False,False
fds4p0y,t3_emmmyy,t1_fdqf101,fategghead,1,2020-01-10 16:11:29,/r/EDAnonymous/comments/emmmyy/am_i_the_only_one_who_feels_like_shit_if_someone/fds4p0y/,I feel you. Today I ate a bowl of soup and was so happy when my boyfriend chose to eat hog dogs and beans on butter toast instead. Like why do I care?,False,True
fdrec55,t3_emmmyy,t1_fdpoyma,confusedguineapig,1,2020-01-10 13:08:26,/r/EDAnonymous/comments/emmmyy/am_i_the_only_one_who_feels_like_shit_if_someone/fdrec55/,This exactly yes,False,False
fdr4lj0,t3_emmmyy,t1_fdq7es8,theclimbingvines,1,2020-01-10 12:03:18,/r/EDAnonymous/comments/emmmyy/am_i_the_only_one_who_feels_like_shit_if_someone/fdr4lj0/,Mememe. I never eat breakfast as a rule and I loooove cooking him these elaborate breakfasts every day. Or asking him if he wants a before bed snack. Or cooking him super rich dinners.  I really need to stop but there’s something nice about preparing something like that for someone else. It’s honestly like all the good parts of binging without the bad parts. It’s the preparation that’s soothing.,False,False
fdqzp6d,t3_emmmyy,t3_emmmyy,fr0gcodes,1,2020-01-10 11:31:49,/r/EDAnonymous/comments/emmmyy/am_i_the_only_one_who_feels_like_shit_if_someone/fdqzp6d/,SAME,False,False
fdqpbip,t3_emmmyy,t3_emmmyy,ohthisoldthang,1,2020-01-10 09:59:25,/r/EDAnonymous/comments/emmmyy/am_i_the_only_one_who_feels_like_shit_if_someone/fdqpbip/,You’re in good company,False,False
fdqmo4w,t3_emmmyy,t3_emmmyy,Nihilistic_Asshole_9,1,2020-01-10 09:31:32,/r/EDAnonymous/comments/emmmyy/am_i_the_only_one_who_feels_like_shit_if_someone/fdqmo4w/,"""I haven't eaten aaaaall day"" Time to fast for three days ig",False,False
fdqkbg6,t3_emmmyy,t3_emmmyy,Mmmieb,1,2020-01-10 09:05:41,/r/EDAnonymous/comments/emmmyy/am_i_the_only_one_who_feels_like_shit_if_someone/fdqkbg6/,"No I do this too... Sometimes I even try to like talk people into eating, when we’re not already eating, cause then I’ll feel better about myself",False,False
fdqjmfi,t3_emmmyy,t3_emmmyy,PetitCinnamonPumpkin,1,2020-01-10 08:57:52,/r/EDAnonymous/comments/emmmyy/am_i_the_only_one_who_feels_like_shit_if_someone/fdqjmfi/,I feel this with my fucking soul. It’s just so annoying (even more) when bigger people eat less than you!!!! Like bitch EAT.(while you yourself deny food but like that’s totally ok 🤡),False,False
fdqioqx,t3_emmmyy,t3_emmmyy,ri-ri,1,2020-01-10 08:47:10,/r/EDAnonymous/comments/emmmyy/am_i_the_only_one_who_feels_like_shit_if_someone/fdqioqx/,Absolutely fucking not you are NOT ALONE! I always watch other people eat and if they pick or simply nibble at their food I get triggered....,False,False
fdqhafg,t3_emmmyy,t3_emmmyy,orthofuckyrself,1,2020-01-10 08:30:46,/r/EDAnonymous/comments/emmmyy/am_i_the_only_one_who_feels_like_shit_if_someone/fdqhafg/,"I was cured of this by ending up spending a lot of time around people who 1) regularly forget to eat/chronically undereat but 2) are considerably less lean than me.   It took about a year, but eventually I internalized the fact that I must be the one eating right.",False,False
fdqf101,t3_emmmyy,t3_emmmyy,oatmeal_thottie,1,2020-01-10 08:03:02,/r/EDAnonymous/comments/emmmyy/am_i_the_only_one_who_feels_like_shit_if_someone/fdqf101/,"I literally make up ""competitions"" (idk how else to describe them) with everyone around me.  Like when I'm at work, I can't eat until at least one of my coworkers eat. When im at home, I cant eat unless my boyfriend either eats first or is eating with me.  If I'm out with friends, they have to eat first too.  It's actually very exhausting keeping tabs on what everyone around me is eating lmao",False,False
fdqdvwp,t3_emmmyy,t1_fdq7es8,haroraoi,1,2020-01-10 07:48:13,/r/EDAnonymous/comments/emmmyy/am_i_the_only_one_who_feels_like_shit_if_someone/fdqdvwp/,Yuppppp. I love baking all my friends treats and watching them eat it.,False,False
fdqds7t,t3_emmmyy,t3_emmmyy,haroraoi,1,2020-01-10 07:46:50,/r/EDAnonymous/comments/emmmyy/am_i_the_only_one_who_feels_like_shit_if_someone/fdqds7t/,"Omg, same. It's like every time I eat with someone else, I need to make sure I either eat the least amount or be eating the least calorie dense food. It's the worst. The only times where I feel comfortable eating is by myself because I'm not focused on the amount as much.",False,False
fdqa3xr,t3_emmmyy,t3_emmmyy,KrypticKricket,1,2020-01-10 06:53:29,/r/EDAnonymous/comments/emmmyy/am_i_the_only_one_who_feels_like_shit_if_someone/fdqa3xr/,Instant shame spiral.,False,False
fdq9zuw,t3_emmmyy,t3_emmmyy,stevieisbored,1,2020-01-10 06:51:43,/r/EDAnonymous/comments/emmmyy/am_i_the_only_one_who_feels_like_shit_if_someone/fdq9zuw/,"My mom is thin and eats pretty small meals and it's low-key triggering to me to watch. I know for a fact that she eats intuitively, doesn't restrict herself, and her weight is healthy (It's like a 21.5 BMI, based on convos we've had), but it's hard to watch. I know I should be eating like her, or even less since she's two inches taller. Ugh.",False,False
fdq7es8,t3_emmmyy,t3_emmmyy,Maiko90,1,2020-01-10 06:07:15,/r/EDAnonymous/comments/emmmyy/am_i_the_only_one_who_feels_like_shit_if_someone/fdq7es8/,Can relate AND I project my cravings on my boyfriend. I love to make him eat what I don't want/can eat.. anybody else?,False,False
fdq4h8r,t3_emmmyy,t3_emmmyy,progressolight,1,2020-01-10 05:07:01,/r/EDAnonymous/comments/emmmyy/am_i_the_only_one_who_feels_like_shit_if_someone/fdq4h8r/,"my mom had bariatric surgery forever ago, she's still fat because she eats very high calorie foods but she can only eat like a single slice of pizza before she's full for example, and watching her eat / eating with her is the biggest trigger lmao. even though i know the food i'm having is way lower in calories and i could eat pounds of it without it equaling the calories in her pizza abomination, if the physical amount of food that i eat is more than the physical amount of food she eats i feel like an absolute globe",False,False
fdq2sdq,t3_emmmyy,t3_emmmyy,nosleeptill8,1,2020-01-10 04:27:37,/r/EDAnonymous/comments/emmmyy/am_i_the_only_one_who_feels_like_shit_if_someone/fdq2sdq/,"Omg, only recently I realised that when I was feeling particularly bad about my eating was when I would bake cakes and cookies that i was allergic to, so my bf would eat them and I’d feel better about myself. I felt super fucked up when I realised what i was doing and stopped.",False,False
fdq2fx6,t3_emmmyy,t3_emmmyy,cvonstreit,1,2020-01-10 04:19:28,/r/EDAnonymous/comments/emmmyy/am_i_the_only_one_who_feels_like_shit_if_someone/fdq2fx6/,"Worst feeling ever when people eat less than you. I feel like people think im a glutton when i eat more than them so I made it a habit of trying to convince other people to eat and not eat myself lol. My friends all think i have a feeder fetish :D  had a mild mental breakdown when my friend brought us cinnamon rolls and he didnt finish his after i was already done. I now eat EXTRA slow so i can see how much others eat before deciding whether or not to finish, and i am always the last to order - always got that low cal small-salad-dressing-on-side option on the DL lol",False,False
fdpz8i4,t3_emmmyy,t3_emmmyy,420everydayweed,1,2020-01-10 03:03:40,/r/EDAnonymous/comments/emmmyy/am_i_the_only_one_who_feels_like_shit_if_someone/fdpz8i4/,"Always :/   like growing up, if my cousin ate less than me i would feel so bad about myself",False,False
fdpsng5,t3_emmmyy,t3_emmmyy,twiggybigs,1,2020-01-10 00:48:47,/r/EDAnonymous/comments/emmmyy/am_i_the_only_one_who_feels_like_shit_if_someone/fdpsng5/,"Ohhh yeah, and it’s true for me in grocery stores as well :/ If I see someone buy less or healthier (cuz I often eat instant noodles and shit like that #collegelife) food than I do, I can’t help but feel awful and like they’re making judgements about me",False,False
fdppozt,t3_emmmyy,t3_emmmyy,Peanut2ur_Tostito,1,2020-01-09 23:57:29,/r/EDAnonymous/comments/emmmyy/am_i_the_only_one_who_feels_like_shit_if_someone/fdppozt/,I always compare what I'm eating to what others are eating.,False,False
fdpoyma,t3_emmmyy,t3_emmmyy,0rangevanillac0ke0,1,2020-01-09 23:45:19,/r/EDAnonymous/comments/emmmyy/am_i_the_only_one_who_feels_like_shit_if_someone/fdpoyma/,Yup. Like if I see someone else eating less or lower cal things I’m like “do i really need this obviously not esp if they don’t”,False,False
