Comment ID,Link ID,Parent ID,Author,Score,Publish Date,Permalink,Text,Stickied,Is Submitter
fb821v0,t3_ebr2g7,t3_ebr2g7,Sushisnac,1,2019-12-17 11:40:36,/r/EDAnonymous/comments/ebr2g7/what_other_mentalemotional_problems_do_yall_have/fb821v0/,Phobia and more recently general anxiety!,False,False
fb7mril,t3_ebr2g7,t1_fb6rrzz,ZiggyStardustWasHere,1,2019-12-17 08:52:51,/r/EDAnonymous/comments/ebr2g7/what_other_mentalemotional_problems_do_yall_have/fb7mril/,"They sure do.  ED can be a bitch interacting with all the other disorders, and the other disorders can just reinforce ED.   Yes, I do. A good team of doctors and a very good therapist.   I wish the same for you :)",False,False
fb79i2n,t3_ebr2g7,t3_ebr2g7,psybeams,1,2019-12-17 05:14:39,/r/EDAnonymous/comments/ebr2g7/what_other_mentalemotional_problems_do_yall_have/fb79i2n/,"major depression, severe anxiety, bipolar, adhd. i just got diagnosed with adhd and it makes so much sense how caffeine and addys never did shit for me and sometimes made me tired lmfaoooo jesus christ the amount of money i wasted buying my friends addys/ritalin or bangs/monsters to try and fast and failing makes me wanna cry 🤦🏻‍♀️",False,False
fb788h1,t3_ebr2g7,t3_ebr2g7,IntuitiveStars,1,2019-12-17 04:42:20,/r/EDAnonymous/comments/ebr2g7/what_other_mentalemotional_problems_do_yall_have/fb788h1/,"Dissociative identity disorder, PTSD, chronic depression, conversion disorder.",False,False
fb71uke,t3_ebr2g7,t3_ebr2g7,paraphrasis,1,2019-12-17 01:59:41,/r/EDAnonymous/comments/ebr2g7/what_other_mentalemotional_problems_do_yall_have/fb71uke/,PTSD and bipolar II.,False,False
fb717pb,t3_ebr2g7,t3_ebr2g7,entirecircuslol,1,2019-12-17 01:45:18,/r/EDAnonymous/comments/ebr2g7/what_other_mentalemotional_problems_do_yall_have/fb717pb/,general anxiety and persistent depressive disorder (PDD),False,False
fb6ym85,t3_ebr2g7,t3_ebr2g7,livipup,1,2019-12-17 00:50:27,/r/EDAnonymous/comments/ebr2g7/what_other_mentalemotional_problems_do_yall_have/fb6ym85/,"BPD, ADHD, and gender dysphoria  Eating disorders are a comorbidity for every one of those",False,False
fb6xei7,t3_ebr2g7,t3_ebr2g7,frostydog568,1,2019-12-17 00:26:59,/r/EDAnonymous/comments/ebr2g7/what_other_mentalemotional_problems_do_yall_have/fb6xei7/,"OCD, major depressive disorder, generalized anxiety disorder.",False,False
fb6x74g,t3_ebr2g7,t3_ebr2g7,analeonhardt,1,2019-12-17 00:23:03,/r/EDAnonymous/comments/ebr2g7/what_other_mentalemotional_problems_do_yall_have/fb6x74g/,Anxiety and depression,False,False
fb6tlwn,t3_ebr2g7,t3_ebr2g7,Striped_Sponges,1,2019-12-16 23:20:08,/r/EDAnonymous/comments/ebr2g7/what_other_mentalemotional_problems_do_yall_have/fb6tlwn/,Misophonia and depression,False,False
fb6s03s,t3_ebr2g7,t3_ebr2g7,x24throwaway,1,2019-12-16 22:54:26,/r/EDAnonymous/comments/ebr2g7/what_other_mentalemotional_problems_do_yall_have/fb6s03s/,PTSD and BP II.,False,False
fb6rxjj,t3_ebr2g7,t3_ebr2g7,bakeahri,1,2019-12-16 22:53:23,/r/EDAnonymous/comments/ebr2g7/what_other_mentalemotional_problems_do_yall_have/fb6rxjj/,Big ADHD (primarily inattentive) :-),False,False
fb6rtul,t3_ebr2g7,t3_ebr2g7,kindbear_kindbud,1,2019-12-16 22:51:48,/r/EDAnonymous/comments/ebr2g7/what_other_mentalemotional_problems_do_yall_have/fb6rtul/,I have general anxiety disorder and major depressive disorder. I don't have a diagnosis but am reasonably sure I have OCD. I also struggle with substance abuse,False,False
fb6rrzz,t3_ebr2g7,t1_fb6rn3x,zimablew,1,2019-12-16 22:51:00,/r/EDAnonymous/comments/ebr2g7/what_other_mentalemotional_problems_do_yall_have/fb6rrzz/,"ED’s love their company, don’t they? I hope you have access to help and some kind of support system &lt;3",False,True
fb6rn3x,t3_ebr2g7,t3_ebr2g7,ZiggyStardustWasHere,1,2019-12-16 22:48:56,/r/EDAnonymous/comments/ebr2g7/what_other_mentalemotional_problems_do_yall_have/fb6rn3x/,"C-PSTD, PTSD, Major Depressive Disorder, Generalised Anxiety Disorder, and Gender Dysphoric Disorder.",False,False
