Comment ID,Link ID,Parent ID,Author,Score,Publish Date,Permalink,Text,Stickied,Is Submitter
eym4a6y,t3_cx995x,t1_eym3bsa,ISBbaby,1,2019-08-30 16:05:10,/r/EDAnonymous/comments/cx995x/1200_calories_omad_is_easy/eym4a6y/,"I was on the upper end of normal as a teen, actually. I think you're onto something about the nutrition; if you're taking supplements and what you do eat is very nutritious, I bet it would help immensely. Also, if you're really active, that'll take it out of you, since that depletes stores even faster.",False,False
eym3wck,t3_cx995x,t1_eym2p5h,Cattynest,1,2019-08-30 16:00:35,/r/EDAnonymous/comments/cx995x/1200_calories_omad_is_easy/eym3wck/,"You mentioned pain in the joints but to have it in the extremities as well just sucks even more :/ I mean okay, it's just the body needing help or whatever but it kiiinda feels like betrayal for interfering what also feels like a ""needed"" fast",False,True
eym3bsa,t3_cx995x,t1_eyliuj7,Cattynest,1,2019-08-30 15:53:50,/r/EDAnonymous/comments/cx995x/1200_calories_omad_is_easy/eym3bsa/,"Were you underweight or close to it as a teen too? I was around BMI 20 when I first did it (though lost ""healthily"" from maybe 23 the few months prior), and at low 19s I still felt like I was in heaven (although for my height that was only like a 4-lb difference lol) until my food quality got worse and worse, and then around the underweight range I just felt exhausted more and more frequently while purposely walking. I guess it does help that you were smart enough to pay attention to nutrition because back then I thought calories were the *only* factor in keeping me functional",False,True
eym2p5h,t3_cx995x,t1_eym2inf,kenodhagxjah,1,2019-08-30 15:46:27,/r/EDAnonymous/comments/cx995x/1200_calories_omad_is_easy/eym2p5h/,"no not numb, i think it was just pain",False,False
eym2nnm,t3_cx995x,t3_cx995x,kenodhagxjah,1,2019-08-30 15:45:58,/r/EDAnonymous/comments/cx995x/1200_calories_omad_is_easy/eym2nnm/,"no not numb, i don't think. it was just pain",False,False
eym2inf,t3_cx995x,t1_eylgaoy,Cattynest,1,2019-08-30 15:44:19,/r/EDAnonymous/comments/cx995x/1200_calories_omad_is_easy/eym2inf/,"Ah yeah, I had EDNOS too for the three years in college (which was ""good"" in a way because I could still function at a higher level), losing the same 5-10 lbs, and after a few months I would always feel more obsessive over food, and walking around for hours and hours became less effortless. And that was without much fasting as when I first started (like I probably hadn't done 20+ hours for a year), so I'd imagine your experience was way worse, especially when it gets to the point of physically interfering with quality sleep (well, being way too alert to sleep is one thing, but having to suffer through longer hours of pain is another). That sounds so horrible 😭  Did you ever get the random calf cramps and numb hands/legs? I think those are due to low potassium but I'm not sure.",False,True
eyliuj7,t3_cx995x,t1_eyldtsd,ISBbaby,1,2019-08-30 12:18:07,/r/EDAnonymous/comments/cx995x/1200_calories_omad_is_easy/eyliuj7/,"Actually, when I was doing it consistently, I was just slightly above underweight (low 19s) and I was on cloud nine while fasting. I'd occasionally get a little woozy when standing up too fast after 48 hours, but it wasn't too bad and never interfered with my life. I did pay attention to my vitamins and minerals and did what I could to keep them good. However, I've fasted on and off since my early teens, so maybe I'm more accustomed to deprivation, lol.",False,False
eylgaoy,t3_cx995x,t1_eyle68i,kenodhagxjah,1,2019-08-30 11:50:11,/r/EDAnonymous/comments/cx995x/1200_calories_omad_is_easy/eylgaoy/,"unfortunately like many, i've been blessed with the 'losing and gaining the same 5 pounds' so my weight has not drastically changed, though i believe that i have became weaker that i was before - as in, physically. I do think that it is due to malnutrition, like the stronger and longer it gets the harder it gets to fo anything honestly, including fasting.  By sick i meant besides being dizzy and getting headaches, the reason i had to break that 60hr one was a) joint pains b) insomnia it got to the point where i could cry from the pain in my legs it was so intense. My usual ED caused insomnia got way worse and i had these added joint pains at night.",False,False
eyle68i,t3_cx995x,t1_eyjq7ko,Cattynest,1,2019-08-30 11:26:54,/r/EDAnonymous/comments/cx995x/1200_calories_omad_is_easy/eyle68i/,"What was the length of time you spent finding fasts easy (like months) and/or BMI difference? I'm wondering if it's not only a low-ish body fat that makes fasting more difficult, but also malnutrition, if you did it a lot. And what did you mean by sick? Like stomach in turmoil and nauseous (wacky acid levels) or dizzy/headaches and the like?",False,True
eyldtsd,t3_cx995x,t1_eyk4c2w,Cattynest,1,2019-08-30 11:23:01,/r/EDAnonymous/comments/cx995x/1200_calories_omad_is_easy/eyldtsd/,"Yeah long-term nutritional deficiencies are a pain. I'm wondering if there's anyone who's underweight who feels fine doing it (probably not severely though), because it's not the weight but the vitamin and mineral reserves that might be more important then",False,True
eyld7pn,t3_cx995x,t1_eyk5kt9,Cattynest,1,2019-08-30 11:16:14,/r/EDAnonymous/comments/cx995x/1200_calories_omad_is_easy/eyld7pn/,"Do you think the idea of confining it to one meal plays a factor in wanting to prolong the meal and eat more? Fasting definitely ramps up my appetite and hunger hormones for when I start eating too - I can be full and still feel depleted, but I notice that even if I fast for the same amount of time, the urge to continue eating is not AS strong if I give myself time to eat ""later,"" not that I have to end the meal and then fast for another 23 hours. And I don't hold it off forever, but for maybe an hour or two before I eat something again. Did you ever experience something like that?",False,True
eylc8j0,t3_cx995x,t1_eyl33v8,Cattynest,1,2019-08-30 11:05:31,/r/EDAnonymous/comments/cx995x/1200_calories_omad_is_easy/eylc8j0/,"Yeah, I would think it's way harder when your energy requirements are higher! The bit about caffeine is a good point - I don't drink coffee so maybe that was why I was so exhausted on fasts, but I don't want to experience the withdrawals of not having coffee lol",False,True
eyl33v8,t3_cx995x,t3_cx995x,MidwestSkinnyCow,1,2019-08-30 09:23:53,/r/EDAnonymous/comments/cx995x/1200_calories_omad_is_easy/eyl33v8/,"Idk when I did omad and I was obese/overweight, it was way harder than now at a (high) normal weight. I got horrible headaches, even doing omad I would feel light-headed and sometimes dizzy. Lmfao it felt pathetic whenever I saw other people saying it was easy because it was super hard for me until I started drinking like a lot of caffeine.",False,False
eyk5kt9,t3_cx995x,t3_cx995x,Savikitty,1,2019-08-29 23:00:26,/r/EDAnonymous/comments/cx995x/1200_calories_omad_is_easy/eyk5kt9/,"OMAD was a terrible idea for me. I'd eat 1000-1200 calories in a sitting and it'd make me even more hungry than if I'd eaten nothing and just kept fasting, or broke a fast with a small amount of food. Any day I tried OMAD ended up being a day where I'd eat something like 2-3000 cals and feel super sick and bloaty. OMAD is literally a binge trigger for me.",False,False
eyk4c2w,t3_cx995x,t3_cx995x,ISBbaby,1,2019-08-29 22:41:41,/r/EDAnonymous/comments/cx995x/1200_calories_omad_is_easy/eyk4c2w/,"The physical element doesn't come into play for me until about five days. I can't imagine being so weak and feint after less than a day of fasting; that almost makes me wonder if there's some other issue at play, like low iron or something.",False,False
eyjq7ko,t3_cx995x,t3_cx995x,kenodhagxjah,1,2019-08-29 19:35:10,/r/EDAnonymous/comments/cx995x/1200_calories_omad_is_easy/eyjq7ko/,"it used to be much easier for me. Longest fast i've done was 60 hours - a intended 72 but i had to stop because of how sick i felt. Have done occasional 48 hr water fasts too, and due to all this doing 24 was incredibly easy! sometimes i used to accidentally complete them, BUT now i don't know what changed but i can barely last ~20 hours. It drives me mad! 24 used to be nothing to me and now i can't even reach that bar. Concerning OMAAD,  i've never done a proper one, There is no way my brain will let me eat 1200 calories in one sitting lmao. The only OMAAD i've done was once, on i think ~500 cals.",False,False
