Comment ID,Link ID,Parent ID,Author,Score,Publish Date,Permalink,Text,Stickied,Is Submitter
ewqdgik,t3_cpjbzd,t1_ewqcm1b,horrendouswhore,1,2019-08-12 21:23:20,/r/EDAnonymous/comments/cpjbzd/why_tf_do_people_think_its_ok_to_ask_how_much_you/ewqdgik/,this is great advice and thank you for replying  💖💖 I’m definitely gonna attempt to set some boundaries with them.,False,True
ewqcm1b,t3_cpjbzd,t1_ewq6m4h,delicateradar,1,2019-08-12 21:12:52,/r/EDAnonymous/comments/cpjbzd/why_tf_do_people_think_its_ok_to_ask_how_much_you/ewqcm1b/,"They didn’t like it at first and kept breaking the boundaries until I literally stopped talking to them for awhile. It was hard for them to adjust but they seem more understanding now that they realize I am not going to tolerate it. I try to be compassionate/understanding and still get frustrated but we’re in a better place than we were. Lmk if you have any questions, I hope you are okay! It’s so hard to deal with those comments!!",False,False
ewqb9qh,t3_cpjbzd,t3_cpjbzd,herdofthebay,1,2019-08-12 20:56:44,/r/EDAnonymous/comments/cpjbzd/why_tf_do_people_think_its_ok_to_ask_how_much_you/ewqb9qh/,Don’t address/ answer those questions because it gives them the ok to ask you again in the future. Set a boundary now and you can avoid an emotional outburst against them later.,False,False
ewq6m4h,t3_cpjbzd,t1_ewq46ti,horrendouswhore,1,2019-08-12 20:02:04,/r/EDAnonymous/comments/cpjbzd/why_tf_do_people_think_its_ok_to_ask_how_much_you/ewq6m4h/,"you’re right, I’ve been thinking about how to stay this to them. How did your fam/fiancé’s fam take it when you said it to them? have they stopped with the comments?",False,True
ewq46ti,t3_cpjbzd,t3_cpjbzd,delicateradar,1,2019-08-12 19:33:32,/r/EDAnonymous/comments/cpjbzd/why_tf_do_people_think_its_ok_to_ask_how_much_you/ewq46ti/,"You need to set some boundaries around food/diet talk ASAP!! Just say you are on a path to getting healthier even if it’s a lie and that you don’t want to hear about anything related to diet, weight, etc. Tell them what the consequences of violating these boundaries are (whatever you feel comfortable with) and reinforcing them. Sorry for unsolicited advice; i had to do this with both my immediate fam and my fiancé’s fam.",False,False
ewpsukt,t3_cpjbzd,t1_ewps3ye,Peanut2ur_Tostito,1,2019-08-12 17:21:57,/r/EDAnonymous/comments/cpjbzd/why_tf_do_people_think_its_ok_to_ask_how_much_you/ewpsukt/,Thanks.,False,False
ewps3ye,t3_cpjbzd,t1_ewprnrp,horrendouswhore,1,2019-08-12 17:13:48,/r/EDAnonymous/comments/cpjbzd/why_tf_do_people_think_its_ok_to_ask_how_much_you/ewps3ye/,good luck at the party! 💖💖💖,False,True
ewprnrp,t3_cpjbzd,t3_cpjbzd,Peanut2ur_Tostito,1,2019-08-12 17:08:58,/r/EDAnonymous/comments/cpjbzd/why_tf_do_people_think_its_ok_to_ask_how_much_you/ewprnrp/,"I understand. I hate this too. I've avoided family &amp; friend birthday parties &amp; get-togethers for a year now because I have no patience with people who make these comments to me anymore. That and I also don't want to answer the question of why my last relationship failed. People suck &amp; most of them think they're being friendly, but don't think about what they say before spewing their stupidity. It's none of their business! I have a HUGE party I can't get out of coming up in a few weeks &amp; I'll definitely give anyone who asks me these types of questions a piece of my mind!",False,False
