Comment ID,Link ID,Parent ID,Author,Score,Publish Date,Permalink,Text,Stickied,Is Submitter
elk77id,t3_bg5549,t3_bg5549,ALonelyComputerVirus,1,2019-04-23 04:37:13,/r/EDAnonymous/comments/bg5549/ikea_lunch/elk77id/,"I always crave the meatballs but the thought of eating a whole plate excites and terrifies me. Also I’m cheap so I get the largest meatball plate and split it with me friend, and get her to eat most of it",False,False
elk3jnz,t3_bg5549,t1_elj2buz,fabscarbs,1,2019-04-23 02:48:57,/r/EDAnonymous/comments/bg5549/ikea_lunch/elk3jnz/,"Boyyy the cakes used to be so good, but I already gave in with the easter chocolates ahahh",False,True
eljd9pb,t3_bg5549,t3_bg5549,tseokii,1,2019-04-22 19:42:19,/r/EDAnonymous/comments/bg5549/ikea_lunch/eljd9pb/,"they have all their nutrition information posted, at least at my Ikea. So you can pick whatever. they don't have a huge menu or anything.  Just don't get the salmon sandwich if they have it because boi that shit is dry af.",False,False
elj9lhh,t3_bg5549,t3_bg5549,NuclearSpark,1,2019-04-22 18:53:27,/r/EDAnonymous/comments/bg5549/ikea_lunch/elj9lhh/,"You should look up their nutrition info! They actually have quite a lot of under 500 cal options! All of their soups and salads are under 500 (lowest cal soup is chicken noodle@110 and lowest salad is the side salad@15). For salmon, their salmon salad was 360 as well as their salmon sandwich, 360-ish!",False,False
elj2buz,t3_bg5549,t3_bg5549,3cats_in_atrenchcoat,1,2019-04-22 17:19:07,/r/EDAnonymous/comments/bg5549/ikea_lunch/elj2buz/,Honestly? Every time I go I just get the little slice of scor type cake and coffee.   No one has ever looked at me weird because it's a treat. No idea what the cals are on that are though.   Salmon is a great choice regardless. It's full of great protein and healthy fats and the kind at IKEA so good. I always buy some frozen to take home.,False,False
