Comment ID,Link ID,Parent ID,Author,Score,Publish Date,Permalink,Text,Stickied,Is Submitter
ff58nsk,t3_eqiyc8,t3_eqiyc8,SecretIdentity8594,1,2020-01-20 23:12:02,/r/EDAnonymous/comments/eqiyc8/how_do_you_deal_with_the_boredom/ff58nsk/,"SAME  My life is SO boring now I hate it.  I can’t even play games with my siblings like I love doing as I’m too hungry and irritable. How do people keep living their lives completely normally when I have to spent all day barely awake and in pain just because I didn’t eat enough today.  I like watching old episodes of TV shows, that’s how I’ve been passing the time recently. I watched basically the entire first 4 seasons of Skins over Christmas just because I had so much time to kill where I could do anything since I only let myself eat the Christmas food and that made me hungry for 16 hours of each day.",False,False
ff0mlvv,t3_eqiyc8,t1_fez4z72,sp00py13,1,2020-01-19 15:44:33,/r/EDAnonymous/comments/eqiyc8/how_do_you_deal_with_the_boredom/ff0mlvv/,"I’m sorry, I really don’t have any great tips. I find it extremely challenging to focus on anything. I manage to pull straight As because my perfectionist ass doesn’t settle for anything less, but I honestly don’t know how",False,True
fezi9v1,t3_eqiyc8,t1_fez19yn,untildivorcedouspart,1,2020-01-19 12:14:15,/r/EDAnonymous/comments/eqiyc8/how_do_you_deal_with_the_boredom/fezi9v1/,Yeah but I don't use it it's shit,False,False
fez4z72,t3_eqiyc8,t1_fetrtqw,sparklylite,1,2020-01-19 11:11:56,/r/EDAnonymous/comments/eqiyc8/how_do_you_deal_with_the_boredom/fez4z72/,how do you focus on schoolwork? im a uni freshman and struggling so hard to do my work because all i can think about are ed-related things. kind of in desperate need of tips to get my shit together haha,False,False
fez19yn,t3_eqiyc8,t1_fesv0ke,Horizonaaa,1,2020-01-19 10:56:20,/r/EDAnonymous/comments/eqiyc8/how_do_you_deal_with_the_boredom/fez19yn/,Have you heard of duolingo?,False,False
fex32bn,t3_eqiyc8,t3_eqiyc8,milllklatte,2,2020-01-19 02:44:52,/r/EDAnonymous/comments/eqiyc8/how_do_you_deal_with_the_boredom/fex32bn/,"God the boredom AND irritability. Honestly these are terrible but I’ll list them anyway,  - I like watching food youtubers like sv3rige, milk jar, freelee and vegan gains - lavender essential oil on my chest is nice and lavender chamomile tea is also nice, just something to make me feel a bit less on edge! - I spend an embarrassing amount of my free time pacing around my living area while listening to music - if it’s early in the day and I’m off work I’ll make myself coffee! I like to add vanilla almond milk to mine, and usually if I make myself coffee I’ll also... - set up my TV to play supersize vs superskinny. lol!  *Sometimes* I’ll practice the language I’m learning and sometimes I’ll message my language exchange partners in order to practice but rarely ever. More of a time passer kind of girl and less of a goal oriented go-getter these days 🙃",False,False
fewx130,t3_eqiyc8,t1_fesnmt3,manicpixiefearfood,2,2020-01-19 02:00:01,/r/EDAnonymous/comments/eqiyc8/how_do_you_deal_with_the_boredom/fewx130/,"I got *so* goddamn good at baking because my ED and my Bake-Off obsession combined to create an un-fucking-godly drive to make bread lmao. I can't bake pastries for the life of me (my hands get too warm cause I get stressed and I always melt the lamination😔), but pretzels, star bread, Rustic Loaves™, braided loaves, challah... I swear to god my only two hobbies are starving myself and making baked goods that I then give to other people lol",False,False
fewqznz,t3_eqiyc8,t3_eqiyc8,Panic-atthepanic,2,2020-01-19 01:16:27,/r/EDAnonymous/comments/eqiyc8/how_do_you_deal_with_the_boredom/fewqznz/,Oh my god are you me? You're me.  I can't stop thinking of fucking food.  I've been trying acceptance (mindfulness).  Doesn't always work and doesn't always leave me happy either :(,False,False
fewnfwz,t3_eqiyc8,t1_feuqkxr,heartemoji,3,2020-01-19 00:35:20,/r/EDAnonymous/comments/eqiyc8/how_do_you_deal_with_the_boredom/fewnfwz/,Also watch fat people shows on YouTube. The best.,False,False
few6ae3,t3_eqiyc8,t3_eqiyc8,n00bii,2,2020-01-18 21:51:26,/r/EDAnonymous/comments/eqiyc8/how_do_you_deal_with_the_boredom/few6ae3/,I binge watch shows that give me thinspo like desperate housewives. That or walking around or taking a walk or playing games on my phone,False,False
few2bij,t3_eqiyc8,t1_fesx7kw,Qecam,1,2020-01-18 21:28:17,/r/EDAnonymous/comments/eqiyc8/how_do_you_deal_with_the_boredom/few2bij/,"If you’re into science, the ones I’ve been listening to lately are All In The Mind and Inquiring Minds. The Podcast History of Our World is great if you’re into world history. I also listen to TED Talks via podcast. I have about a billion different ones saved onto Overcast that I thought sounded interesting including The Infinite Monkey Cage, You Are Not So Smart, StarTalk Radio, The Skeptics’ Guide to the Universe, Science Friday, Making Sense with Sam Harris, Psychology and Stuff, and many, many more. I can find the full list if you want lol.  History is Gay is a history one I’ve been meaning to listen to. I’m super into dinosaurs and paleontology so Dinosaur George is an incredible podcast if you’re into that.  Then there’s a bunch of unexplained mystery-related ones I think I just randomly added from a search. Haven’t listened to any personally but I like those like I like my true crime stuff. Stuff They Don’t Want You To Know is similar and I’ve heard it’s good. It’s on my to-listen list.",False,False
few20z1,t3_eqiyc8,t1_few1nyg,sp00py13,2,2020-01-18 21:26:19,/r/EDAnonymous/comments/eqiyc8/how_do_you_deal_with_the_boredom/few20z1/,"I used to love to read, but haven’t been able to for a while now for similar reasons. I’ll have to give audiobooks a try!",False,True
few1nyg,t3_eqiyc8,t3_eqiyc8,iampieman,2,2020-01-18 21:23:36,/r/EDAnonymous/comments/eqiyc8/how_do_you_deal_with_the_boredom/few1nyg/,"I used to get obsessed with TV shows and easily binge and read books. But the last couple of months I just...haven’t been able to? I don’t know if it’s a lack of concentration or increased depression or what, but I can’t do either anymore. But I’ve discovered audiobooks and can still listen to them, so that’s been good. Also I’ve gotten into Jigsaw puzzles! I know I sound so lame lmao.",False,False
fevylyx,t3_eqiyc8,t1_fevx2rh,sp00py13,1,2020-01-18 21:06:39,/r/EDAnonymous/comments/eqiyc8/how_do_you_deal_with_the_boredom/fevylyx/,Ugh I feel this so hard,False,True
fevyhbr,t3_eqiyc8,t3_eqiyc8,thr0wawaynametaken,1,2020-01-18 21:05:56,/r/EDAnonymous/comments/eqiyc8/how_do_you_deal_with_the_boredom/fevyhbr/,"honestly doing worse in my ed feels a lot less boring to me. it has a lot more ""novelty"" than being well. it's convinced me that what's boring is being healthy - is not being in a constant state of crisis, lol",False,False
fevx2rh,t3_eqiyc8,t3_eqiyc8,THEARCHlVES,4,2020-01-18 20:56:05,/r/EDAnonymous/comments/eqiyc8/how_do_you_deal_with_the_boredom/fevx2rh/,"Between this and my depression I’m almost constantly bored. I switch through reddit, tumblr, Instagram, and twitter a million times throughout the day. I guess I’m lucky to have an obsessive personality so I’ll get myself hooked on something (a show, youtube, a video game, a book, writing again) and occupy myself with those until I finish or get bored again. Occasionally I’ll join a group chat and stress myself out about that. Some days I just put on new music to listen to and annoy my friends with iMessage games because I have literally nothing better to do. The boredom is one of the worst things.",False,False
fevgw82,t3_eqiyc8,t1_fespj7l,desperate_housecat,3,2020-01-18 19:27:45,/r/EDAnonymous/comments/eqiyc8/how_do_you_deal_with_the_boredom/fevgw82/,I friggin live for the Bon Appetit youtube channel.,False,False
fev7qr9,t3_eqiyc8,t1_feuluzn,Entemma,6,2020-01-18 18:36:26,/r/EDAnonymous/comments/eqiyc8/how_do_you_deal_with_the_boredom/fev7qr9/,Or just depression naps,False,False
feuztcl,t3_eqiyc8,t3_eqiyc8,Qa4646,3,2020-01-18 17:52:15,/r/EDAnonymous/comments/eqiyc8/how_do_you_deal_with_the_boredom/feuztcl/,I spend hours everyday looking at houses and clothes online that I could never afford or making sims that look like me but are skinny and successful.,False,False
feuqkxr,t3_eqiyc8,t1_feuqcpo,sp00py13,1,2020-01-18 17:10:14,/r/EDAnonymous/comments/eqiyc8/how_do_you_deal_with_the_boredom/feuqkxr/,Damn that sucks 😩,False,True
feuqcpo,t3_eqiyc8,t1_feupvp7,the_real_blobfish,1,2020-01-18 17:09:51,/r/EDAnonymous/comments/eqiyc8/how_do_you_deal_with_the_boredom/feuqcpo/,Fucking Australian Netflix doesn’t have it  lmao guess I could just get a vpn 😂,False,False
feupvp7,t3_eqiyc8,t1_feup0lg,sp00py13,1,2020-01-18 17:07:57,/r/EDAnonymous/comments/eqiyc8/how_do_you_deal_with_the_boredom/feupvp7/,":(  I watch it on Netflix, but that really only helps if you already pay for Netflix",False,True
feupld6,t3_eqiyc8,t1_fespj7l,the_real_blobfish,1,2020-01-18 17:06:08,/r/EDAnonymous/comments/eqiyc8/how_do_you_deal_with_the_boredom/feupld6/,"I used to watch tasty videos but now I watch tastemade videos because they seem,,,,,, classier,,,,, (it’s so weird lmao)",False,False
feup0lg,t3_eqiyc8,t1_fesnmt3,the_real_blobfish,4,2020-01-18 17:04:27,/r/EDAnonymous/comments/eqiyc8/how_do_you_deal_with_the_boredom/feup0lg/,"Great British bake off is everything I need from entertainment ever... comedy, British people and food... too bad I can’t stream it on all4 bc I’m not in the uk 😪",False,False
feuluzn,t3_eqiyc8,t3_eqiyc8,lizzytheloser,5,2020-01-18 16:49:26,/r/EDAnonymous/comments/eqiyc8/how_do_you_deal_with_the_boredom/feuluzn/,benadryl naps,False,False
fetz0lf,t3_eqiyc8,t1_fetrtqw,elhae,3,2020-01-18 15:04:30,/r/EDAnonymous/comments/eqiyc8/how_do_you_deal_with_the_boredom/fetz0lf/,"fam i wish i had that wtf, id sleep with all that free time 😩 in all seriousness tho rip and good luck",False,False
fetrtqw,t3_eqiyc8,t1_fetr6zu,sp00py13,3,2020-01-18 14:26:23,/r/EDAnonymous/comments/eqiyc8/how_do_you_deal_with_the_boredom/fetrtqw/,"I take 6 classes (a full load), work 2 jobs as well (gotta love being a broke bitch), and am in a professional organization and a club sport, and I still find myself with too much time on my hands 😅😩",False,True
fetr6zu,t3_eqiyc8,t3_eqiyc8,elhae,7,2020-01-18 14:18:45,/r/EDAnonymous/comments/eqiyc8/how_do_you_deal_with_the_boredom/fetr6zu/,"4 classes, 2 jobs, 3 high commitment orgs. i’m too busy to eat more than a snack on a walk between things most of the day.",False,False
fet7v7k,t3_eqiyc8,t1_fesx7kw,sp00py13,2,2020-01-18 12:35:45,/r/EDAnonymous/comments/eqiyc8/how_do_you_deal_with_the_boredom/fet7v7k/,"If you’re into true crime at all, My Favorite Murder and Morbid are both really good! I also like This Podcast Will Kill You, which is about diseases/infectious illnesses/stuff like that",False,True
fet7nqy,t3_eqiyc8,t1_fesoxyk,sp00py13,4,2020-01-18 12:34:47,/r/EDAnonymous/comments/eqiyc8/how_do_you_deal_with_the_boredom/fet7nqy/,I take like 3 hour walks every day #compulsiveexercisegang 😅🤪,False,True
fet21l8,t3_eqiyc8,t1_fesx7kw,Tiny_Buttercups98,3,2020-01-18 12:11:26,/r/EDAnonymous/comments/eqiyc8/how_do_you_deal_with_the_boredom/fet21l8/,I quite like lore and the johnathan van ness podcast. Other than that I haven't yet gotten into anyone's voice yet if that makes sense,False,False
fesx7kw,t3_eqiyc8,t1_fesstwx,bailsforreal,2,2020-01-18 11:50:42,/r/EDAnonymous/comments/eqiyc8/how_do_you_deal_with_the_boredom/fesx7kw/,Do you have any podcast suggestions actually? I’m tired of the one I always listen to when I walk,False,False
feswqec,t3_eqiyc8,t1_fesvo82,untildivorcedouspart,3,2020-01-18 11:48:46,/r/EDAnonymous/comments/eqiyc8/how_do_you_deal_with_the_boredom/feswqec/,"I really recommend it , it also makes you into an interesting person as you learn loads about current affairs and it makes you more employable too. Irs very addictive so great for ED people because you want to get better and better and you really want to master this language :) if you have a basis in a second language, e.g learnt at school, I would recommend you start with that language as it will be easier as you will have a grip on tenses, grammar etc",False,False
fesvo82,t3_eqiyc8,t1_fesv0ke,sp00py13,3,2020-01-18 11:44:51,/r/EDAnonymous/comments/eqiyc8/how_do_you_deal_with_the_boredom/fesvo82/,This is actually cool!,False,True
fesv0ke,t3_eqiyc8,t3_eqiyc8,untildivorcedouspart,4,2020-01-18 11:41:12,/r/EDAnonymous/comments/eqiyc8/how_do_you_deal_with_the_boredom/fesv0ke/,"Honestly what I do is learn either than exercise etc new languages. Choose a language you want to learn, find the top paper of the language, print out like the 10 pages of the newspaper and read it and chose the words you don't know and look them up, and everntuallly , you'll remember the words and you'll become super informed and you will know another language. At the same time, what Netflix shows in that language and YouTube videos in that language to familiarise yourself and you'll eventually be good at another language . It's actually quite obsessive as you just wanna get better and better lol. I'm a loser",False,False
fesstwx,t3_eqiyc8,t1_fesoxyk,Tiny_Buttercups98,2,2020-01-18 11:31:06,/r/EDAnonymous/comments/eqiyc8/how_do_you_deal_with_the_boredom/fesstwx/,"Walks are seriously the best, especially with a good podcast/playlist. Plus it's a great way to meet new dogs and cats",False,False
fespj7l,t3_eqiyc8,t1_fesnmt3,algorthin,3,2020-01-18 11:14:17,/r/EDAnonymous/comments/eqiyc8/how_do_you_deal_with_the_boredom/fespj7l/,"I used to just watch like... Tasty videos because I didn't like the food being interrupted by people talking, but now I watch more Bon Appetit type videos. Recovery?",False,False
fesoxyk,t3_eqiyc8,t3_eqiyc8,bailsforreal,4,2020-01-18 11:12:13,/r/EDAnonymous/comments/eqiyc8/how_do_you_deal_with_the_boredom/fesoxyk/,"I go on long ass walks, I clean, I do homework, luckily I have school and interning, I binge watch stuff, I read, and I also just sleep.",False,False
fesnmt3,t3_eqiyc8,t1_fesnd6i,sp00py13,2,2020-01-18 11:05:57,/r/EDAnonymous/comments/eqiyc8/how_do_you_deal_with_the_boredom/fesnmt3/,Hahaha me too though. I fill my time with obsessively plugging different numbers into Losertown and watching baking/cooking shows (The Great British Bakeoff 🤩) nonstop oops,False,True
fesnd6i,t3_eqiyc8,t3_eqiyc8,algorthin,3,2020-01-18 11:04:30,/r/EDAnonymous/comments/eqiyc8/how_do_you_deal_with_the_boredom/fesnd6i/,"Honestly, not suggesting this because I don't think it's exactly recovery forward, but what I do is watch shows (TV, youtube, even instagram) about food and shows about weight loss and I plan out meals and I research about food, and then I get into bed and go to sleep. I can't even work anymore so it's just this and treatment all the time. Super boring lifestyle. Dread the question ""What do you do for fun?"" because I'm literally like ""I uh... I know how many calories are in a sprinkle""",False,False
