Comment ID,Link ID,Parent ID,Author,Score,Publish Date,Permalink,Text,Stickied,Is Submitter
f83xf47,t3_dymuwu,t3_dymuwu,runhappy18,1,2019-11-19 22:21:02,/r/EDAnonymous/comments/dymuwu/how_do_yall_deal_with_holidays/f83xf47/,Fast a few days before and I’m doing super low restriction right now. Only I go home this weekend and all my friends are going to ask me to eat out god forbid so I’m super nervous about that. I especially don’t want me best friend who is recovered to be triggered by me relapsing so I’m not so sure yet but I’ll probs restrict when I leave I guess? Idk I’m anxious,False,False
f83ln9e,t3_dymuwu,t3_dymuwu,BOOKWORMCat2004,1,2019-11-19 19:53:16,/r/EDAnonymous/comments/dymuwu/how_do_yall_deal_with_holidays/f83ln9e/,i’m newer to this and terrified of the holidays. too scared to purge but i do have dairy intolerance so it’ll get me out of eating a bunch of stuff. my grandma is making me a special dairy free chocolate cake which is my favorite tho. i’ll have to fast ig.,False,False
f82i2bt,t3_dymuwu,t3_dymuwu,lemonye,1,2019-11-19 13:27:32,/r/EDAnonymous/comments/dymuwu/how_do_yall_deal_with_holidays/f82i2bt/,"Go and hang out with the people, bring something healthy and just mingle and have a good time! I’m sure it will be absolutely fine :)",False,False
f82c3mg,t3_dymuwu,t3_dymuwu,thefakemexoxo,1,2019-11-19 12:31:42,/r/EDAnonymous/comments/dymuwu/how_do_yall_deal_with_holidays/f82c3mg/, I’m going to fake a stomach bug. Hello laying on the couch with my dog and drinking broth while the rest of the family argues at the dinner table.,False,False
f825o75,t3_dymuwu,t3_dymuwu,chaotic_ass_neutral,1,2019-11-19 11:28:26,/r/EDAnonymous/comments/dymuwu/how_do_yall_deal_with_holidays/f825o75/,"i’m just gonna get fat and cry about it, the self hate gets me through the low restriction that follows",False,False
f825kx2,t3_dymuwu,t3_dymuwu,Rivka90,1,2019-11-19 11:27:33,/r/EDAnonymous/comments/dymuwu/how_do_yall_deal_with_holidays/f825kx2/,I told work I am going to see family and family that I have to work. I'll be chilling with my cat in stealth mode ;),False,False
f824vv4,t3_dymuwu,t3_dymuwu,kitkatxxo,1,2019-11-19 11:20:34,/r/EDAnonymous/comments/dymuwu/how_do_yall_deal_with_holidays/f824vv4/,i work thanksgiving and christmas so my plan is to just restrict and fast on the days before/after. and eat when i see my parents /: dont wanna hear their bullshit so have to make up for it by fasting,False,False
f824p5h,t3_dymuwu,t3_dymuwu,lauryleah,1,2019-11-19 11:18:42,/r/EDAnonymous/comments/dymuwu/how_do_yall_deal_with_holidays/f824p5h/,I plan to restrict.. like fasting 2 weeks before christmas or something,False,False
