Comment ID,Link ID,Parent ID,Author,Score,Publish Date,Permalink,Text,Stickied,Is Submitter
eyd5gof,t3_cscz6n,t1_exgwhh9,orthofuckyrself,1,2019-08-28 11:58:59,/r/EDAnonymous/comments/cscz6n/daily_discussion_monday_august_19_2019/eyd5gof/,"Things have improved in my city since the time I was seeking treatment. It was a few years ago now, and standards/resources have made leaps and bounds since then.   I never asked for a low dose; I know other people who did and got gatekept. I do know one person who takes a low dose, but they are prescribed a full one and just don't take all of it. They don't tell their doctor about this.   But fyi, that same person (who was initially on a full dose) sings in a *beautiful* tenor now. They had teenage-boy voice for about a year though, ofc.",False,False
exgwobn,t3_cscz6n,t3_cscz6n,BabyBaphomet_,1,2019-08-20 00:25:54,/r/EDAnonymous/comments/cscz6n/daily_discussion_monday_august_19_2019/exgwobn/,"I thought I was deadass recovered because I stopped thinking about restricting months ago.     Went to the doctor last week and I lost 10 pounds since then.          So yea I guess I'm back. What's up demons? It's me, ya boi.",False,False
exgwhh9,t3_cscz6n,t1_exf5gwq,red_ossifrage,1,2019-08-20 00:21:20,/r/EDAnonymous/comments/cscz6n/daily_discussion_monday_august_19_2019/exgwhh9/,"Shit, where do you live that you're experiencing this kind of gender care? If you're anywhere in CA I can probably give you the name of a better clinic.  I mean, did the doctors give you a reason why they wouldn't give you a very low dose? Fuck the ""all or nothing"" attitude, that makes literally no sense. If I couldn't start on a low dose I wouldn't start at all. I know some people weather drastic hormonal shifts pretty well, but there is just no way in hell I'm throwing my oversensitive body that kind of a curveball. Plus I'm paranoid about my singing voice. Or, hell, what if I start and absolutely hate it and suddenly know I'm making the wrong decision, you know? There are lots of reasons not to want to start at a typical dose. Or to stay on a low dose permanently.  But just FYI, a permanent low dose will eventually masculinize your body just as much as a higher one, it just takes much longer. If you're aiming for androgyny, you'd probably want to be on T for a while and then stop, not keep taking it in perpetuity.",False,False
exgwgpw,t3_cscz6n,t1_exe6h62,word-flux,1,2019-08-20 00:20:50,/r/EDAnonymous/comments/cscz6n/daily_discussion_monday_august_19_2019/exgwgpw/,"I've switched to vaping and I honestly think it works better as an appetite suppressant than the cigs, I don't know why.",False,False
exgvxoh,t3_cscz6n,t3_cscz6n,bruisequeen,1,2019-08-20 00:08:39,/r/EDAnonymous/comments/cscz6n/daily_discussion_monday_august_19_2019/exgvxoh/,tfw u collapse in public on the street and have to pretend that everything is ok when the people around u ask if ur alright. you’d think I’d learn to not restrict when this happens but watch me do it again yikes 🤡🤡,False,False
exgptbb,t3_cscz6n,t3_cscz6n,delicateradar,1,2019-08-19 22:14:21,/r/EDAnonymous/comments/cscz6n/daily_discussion_monday_august_19_2019/exgptbb/,"Had a rly bad interaction with a man today. I’m trying to help design my mom’s book cover and her publisher sent me the most mansplain-y, vitriolic email berating me for not understanding his ridiculously vague instructions. I can’t shake the bad energy. It doesn’t help that I’m literally starving. Sorry to vent just am constantly caught off guard by other people’s asshole behavior. I didn’t eat for the rest of the day and still got my steps in, yay internalized loathing aka what society wants",False,False
exgl24p,t3_cscz6n,t3_cscz6n,Aleph0-4,1,2019-08-19 21:07:11,/r/EDAnonymous/comments/cscz6n/daily_discussion_monday_august_19_2019/exgl24p/,I want to take a 3 month soma holiday and wake up thin again.,False,False
exftv6b,t3_cscz6n,t3_cscz6n,melissuhnicole,1,2019-08-19 15:57:34,/r/EDAnonymous/comments/cscz6n/daily_discussion_monday_august_19_2019/exftv6b/,TW: I just feel so hungry and weak today. Just totally zapped of energy. I don’t even have the energy to workout and I don’t know why. I’ve been keeping it between 700-900 calories so it’s not even like I’m fasting. I need to suck it up.,False,False
exfqpbi,t3_cscz6n,t1_exf7qel,sucks_tosuck,1,2019-08-19 15:25:28,/r/EDAnonymous/comments/cscz6n/daily_discussion_monday_august_19_2019/exfqpbi/,"I have no idea how I'll get back on track, I need to be mindful again, I've been eating carelessly because I went on vacation, and I didn't even enjoy it, I just eat and then feel bad",False,False
exfqj8a,t3_cscz6n,t1_exflj3w,sucks_tosuck,1,2019-08-19 15:23:50,/r/EDAnonymous/comments/cscz6n/daily_discussion_monday_august_19_2019/exfqj8a/,"Yeah, I want to remember how it feels like to not overthink everything that I ingest, I want to forget that calories exist.  I either binge or restrict at this point, and it's sooo toxic...",False,False
exfpbiz,t3_cscz6n,t3_cscz6n,PuzzleheadedSpring,1,2019-08-19 15:12:10,/r/EDAnonymous/comments/cscz6n/daily_discussion_monday_august_19_2019/exfpbiz/,"I was buying stuff to binge on at the grocery store, mainly potato chips since that’s my weakness. The person working at the cash register decided to comment on it by saying something like “That’s a lot of potato chips” A long line of people behind me heard it, and I wanted to cry. Now I just feel like shit.",False,False
exflj3w,t3_cscz6n,t1_exfl0l4,Mangelwurzelbeat,1,2019-08-19 14:33:08,/r/EDAnonymous/comments/cscz6n/daily_discussion_monday_august_19_2019/exflj3w/,What should be an enjoyable thing feels like a bit of nightmare .,False,False
exfl0l4,t3_cscz6n,t1_exfgwzt,adendorffie,1,2019-08-19 14:27:51,/r/EDAnonymous/comments/cscz6n/daily_discussion_monday_august_19_2019/exfl0l4/,"This is so true. Sometimes I just look at people that are thin, and eat. Like just eat normally. No stress, no worries, no guilt. And I wonder how they do it. And then I wonder why I can't do it. Just, pain.",False,False
exfkqcw,t3_cscz6n,t3_cscz6n,adendorffie,1,2019-08-19 14:24:59,/r/EDAnonymous/comments/cscz6n/daily_discussion_monday_august_19_2019/exfkqcw/,"I decided to try and not restrict. As in try and recover. Ended up eating the entire house and just so scared of calculating the calories, because I will want to throw up even though I have never really been one for throwing up. Don't even have laxatives or anything on hand. I can't. And I have so much to do for school so I can not be obsessing over this rn. But I am. Crying.",False,False
exfjdda,t3_cscz6n,t1_exf9ndi,tigerchik,1,2019-08-19 14:10:47,/r/EDAnonymous/comments/cscz6n/daily_discussion_monday_august_19_2019/exfjdda/,"thanks! I alternate between feeling that I do ""have this"" and fragile that I'll binge again. Like I don't want to get too confident and then all out of nowhere I binge and ruin my streak.",False,False
exfj7yu,t3_cscz6n,t1_exf25hw,junebug-2019,1,2019-08-19 14:09:13,/r/EDAnonymous/comments/cscz6n/daily_discussion_monday_august_19_2019/exfj7yu/,"Just start telling them, you are not fooling them especially if she is concerned about your weight loss",False,False
exfiqdf,t3_cscz6n,t1_exff89x,oh-em-jizzles,1,2019-08-19 14:04:01,/r/EDAnonymous/comments/cscz6n/daily_discussion_monday_august_19_2019/exfiqdf/,that's awesome!,False,False
exfgwzt,t3_cscz6n,t1_exelb3m,Mangelwurzelbeat,1,2019-08-19 13:44:48,/r/EDAnonymous/comments/cscz6n/daily_discussion_monday_august_19_2019/exfgwzt/,"It's a very strange feeling when looking at other people and noticing that they are relaxed around a dinner table , or in a restaurant when you know that it feels not normal to you .",False,False
exff89x,t3_cscz6n,t3_cscz6n,Tinyturtletakeover,1,2019-08-19 13:27:08,/r/EDAnonymous/comments/cscz6n/daily_discussion_monday_august_19_2019/exff89x/,"Almost binged on angel hair pasta again, my weakness food, but I measured out a reasonable amount and am now engaging in what I call the Smart Binge. Nothing fancy, just eating your binge foods within you allotted calories-- the name just makes me feel good about it.",False,False
exf9ndi,t3_cscz6n,t1_exf7n5f,rainbowraptor16,1,2019-08-19 12:29:35,/r/EDAnonymous/comments/cscz6n/daily_discussion_monday_august_19_2019/exf9ndi/,Hell yes! Proud of you! You got this!,False,False
exf7qel,t3_cscz6n,t1_exelb3m,tigerchik,1,2019-08-19 12:09:35,/r/EDAnonymous/comments/cscz6n/daily_discussion_monday_august_19_2019/exf7qel/,ack; I'm sorry. 1 time in 7 months is still awesome. How are you going to get back on track?,False,False
exf7n5f,t3_cscz6n,t3_cscz6n,tigerchik,1,2019-08-19 12:08:35,/r/EDAnonymous/comments/cscz6n/daily_discussion_monday_august_19_2019/exf7n5f/,proudly sitting on 10 days in a row w/o bingeing!,False,False
exf71z4,t3_cscz6n,t3_cscz6n,elllxvi,1,2019-08-19 12:02:11,/r/EDAnonymous/comments/cscz6n/daily_discussion_monday_august_19_2019/exf71z4/,my mom is making me eat 1500 calories from now on and i’m going to lose my mcfucking mind because my tdee is less than that i am going to gain ahahaha life is great,False,False
exf5gwq,t3_cscz6n,t3_cscz6n,orthofuckyrself,1,2019-08-19 11:45:05,/r/EDAnonymous/comments/cscz6n/daily_discussion_monday_august_19_2019/exf5gwq/,"My dysmorphia is such that I cannot tell muscle or bone from fat some days. But i do know that I didn't grow love handles overnight, so I'm just avoiding the mirror for the rest of the day.   So much of this bullshit came from me struggling with gender issues. Maybe I shouldn't have backed out of transition before going on T. Maybe I should have taken the leap and shot up and fully come out. Then again, most days I feel that I made the right decision in not doing that.   It sucks that no doctor on Earth would clear me to microdose T, lol. I'm not a competitive athlete, so imo it's nobody's business but mine. But I'd want medical supervision, and they're pretty much all-or-nothing when it comes to this stuff. And I feel like the dosage they'd insist on giving me would have me just as uncomfortable with myself as I am now. I want an androgynous body. Not full blown masculine.   I could bootleg it EASY. I work fitness industry and hang out with queer people. But I don't want to DIY a microdose of hormones when I literally just had an endocrine system related health scare. Seems like maybe a bad idea lol",False,False
exf25hw,t3_cscz6n,t3_cscz6n,questionably-sane,1,2019-08-19 11:08:43,/r/EDAnonymous/comments/cscz6n/daily_discussion_monday_august_19_2019/exf25hw/,"I was going to purge yesterday and had already started when I remember that I have a psych appointment today and that she has been concerned about my weight loss so I stopped.  Then when I inevitably weighed more this morning I cried in the shower.  Not entirely sure what I expected, I'm not going to magically weigh two different things at the same time.  Those of you who see someone for mental health reasons other than an ED how have you brought it up with them?  I don't really know how to go about it.",False,False
exeyy3k,t3_cscz6n,t3_cscz6n,urixu,1,2019-08-19 10:32:22,/r/EDAnonymous/comments/cscz6n/daily_discussion_monday_august_19_2019/exeyy3k/,"school starting back up caused me massive anxiety which triggered an even worse binge and I ended up sitting here eating all the things even though they 1) were not good and 2) did nothing to calm my anxiety. now I’m more anxious, broke, and feeling like shit. what a great day",False,False
exewz51,t3_cscz6n,t3_cscz6n,MSG-63,1,2019-08-19 10:09:31,/r/EDAnonymous/comments/cscz6n/daily_discussion_monday_august_19_2019/exewz51/,My SO told me they love the free space between my underpants and my skin.... they meant hipbones ofc ; don't know why it's so triggering,False,False
exew4sy,t3_cscz6n,t3_cscz6n,ifuckpineapples,1,2019-08-19 09:59:49,/r/EDAnonymous/comments/cscz6n/daily_discussion_monday_august_19_2019/exew4sy/,Had the biggest stress dream last night about being forced into inpatient. They took away my meds and wouldnt let me take them. I had a tiny room that i had to share with a middle aged woman. If i didnt want to eat the food they gave me i got shoved into my room. So out of nowhere considering im not that bad right now,False,False
exeq0oa,t3_cscz6n,t1_exe23q0,Pleiades_13,1,2019-08-19 08:49:05,/r/EDAnonymous/comments/cscz6n/daily_discussion_monday_august_19_2019/exeq0oa/,I found salt and vinegar flavoured corn thins at my local grocery store. They’re pretty much my only safe food at the moment aside from chicken broth.  Thank god for corn thins dude.  Also had a good lol at “they are the goat” so thank you for that. Haha,False,False
exepp3t,t3_cscz6n,t3_cscz6n,Pleiades_13,1,2019-08-19 08:45:23,/r/EDAnonymous/comments/cscz6n/daily_discussion_monday_august_19_2019/exepp3t/,"Tonight has been rough. I’ve been heavily restricting for days now and I hate it. I’m literally terrified of food. My SO bought churros home and asked if I wanted one and I just flat out started bawling because I wanted one so so bad but I just couldn’t. Then he broke down in tears, I’ve never seen him cry so hard before, just holding me so close saying “baby please please stop doing this to yourself I need you, our kids need you, please try to get better I love you so much”. We just held each other and sobbed. He is so supportive of me without being pushy.   I hate myself for hurting him like this. I hate myself for hurting my body like this. I hate that I’m too weak to spend time with my daughter who has cancer, she fucking needs her mama but I’m too weak to play with her. I want to recover so badly but I’m not “sick enough”.   But on the upside I’ve started taking multivitamins every day and drinking electrolyte drinks so I can at least try not do too much damage.  This disease is fucking brutal. all I want is for this fucked up voice in my head to go away. My illness is trying to kill me and it won’t be satisfied until I’m hospitalised again on a fucking feeding tube.  I’m not going to let that happen. I’m going to try my fucking hardest to start eating a little more before I do permanent damage and then I won’t be able to look after my babies at all. They need me so much. I will not let this disease take my family from me, my life, my love, my joy.   Fuck every cunt out there who says EDs are a choice. I am tormented constantly by this disease in my head. But I will fight my absolute hardest to beat this. My family needs me.   I love you all and I hope every single one of you struggling can find some peace. I wouldn’t wish this shit on my worst enemy.",False,False
exelb3m,t3_cscz6n,t3_cscz6n,sucks_tosuck,1,2019-08-19 07:49:52,/r/EDAnonymous/comments/cscz6n/daily_discussion_monday_august_19_2019/exelb3m/,"I purged for the first time in 7 months, I'm feeling bad, so bad ...   People are starving and here I am, stuffing my face with food because I'm gluttonous and can't have a healthy relationship with food.  The moment I open my eyes in the morning, food pops in my head , why am I obssessed ? Damn...",False,False
exedmed,t3_cscz6n,t3_cscz6n,frunalimon,1,2019-08-19 05:34:58,/r/EDAnonymous/comments/cscz6n/daily_discussion_monday_august_19_2019/exedmed/,"I'm back to calorie counting after a three month break where I still somehow lost weight through sheer fear of eating. Unfortunately during that phase I also picked up a b/p habit, which I am now trying to kick by counting calories. As per usual my definition of a reasonable daily calorie limit keeps slipping lower and lower, which makes eating (or not eating in most cases) more and more stressful.  I'm going to try to eat a little bit more tomorrow, just to prove that I can do it and I'm not gonna gain weight by eating over 1000kcal. First step will be eating breakfast! I promised myself tonight that I can have porridge tomorrow!",False,False
execuku,t3_cscz6n,t1_exe23q0,frunalimon,1,2019-08-19 05:16:37,/r/EDAnonymous/comments/cscz6n/daily_discussion_monday_august_19_2019/execuku/,I agree but also consider: rice cakes for sweet toppings and corn thins for savoury,False,False
exea0g1,t3_cscz6n,t1_exe4kmg,serendipi7y_,1,2019-08-19 04:10:28,/r/EDAnonymous/comments/cscz6n/daily_discussion_monday_august_19_2019/exea0g1/,"have a good rest for these few days and you might be able to feel more calm and think better (especially with making big decisions whether to stay or transfer college).  i am not good with words, but hope u feel a little better by being easy with yourself. take care!!",False,False
exe8ib4,t3_cscz6n,t1_exe2ouh,elllxvi,1,2019-08-19 03:35:07,/r/EDAnonymous/comments/cscz6n/daily_discussion_monday_august_19_2019/exe8ib4/,"me too, i feel like i’ll gain weight on anything but low restriction even if that’s impossible ):",False,False
exe73i4,t3_cscz6n,t1_exe23q0,koicartel,1,2019-08-19 03:00:45,/r/EDAnonymous/comments/cscz6n/daily_discussion_monday_august_19_2019/exe73i4/,I’ve never read a truer statement tbh,False,False
exe6h62,t3_cscz6n,t3_cscz6n,throwaway71871127198,1,2019-08-19 02:45:50,/r/EDAnonymous/comments/cscz6n/daily_discussion_monday_august_19_2019/exe6h62/,Cigarettes are supposed to be an appetite suppressant so why the fuck do they make me hungrier &gt;:(,False,False
exe4tao,t3_cscz6n,t3_cscz6n,phaeo15,1,2019-08-19 02:07:05,/r/EDAnonymous/comments/cscz6n/daily_discussion_monday_august_19_2019/exe4tao/,"I used to think that the clarity and level-headedness I feel after a binge was an illusion and that it was solely the high. But realized tonight that isn’t the case. Really, I just have these monsters inside me. And most of the time they’re *screaming* at me, doing everything they can to manipulate me into giving them what they want. The thing is, once they get it, they’re temporarily satisfied. They’re distracted with the carbs and sugar and shit I just have them. And for a little while they’re quiet. The screaming is gone and I’m alone with my real thoughts and feelings. The clarity is real. The high is still there of course, but that part is chemicals. The level-headedness is ME. Actually *me*. Me without the constant abuse from these monsters.    I don’t know. May sound silly but thinking of it this way is helping me. I don’t feel the confusion of “which thoughts are real” anymore. I know the good ones where I feel like I can do this, that I can get better and keep going, are the real ones. Hopefully I can remind myself of that when the monsters start screaming again and I feel like I can’t do this and don’t have the strength.",False,False
exe4kmg,t3_cscz6n,t3_cscz6n,SmileIsKey,1,2019-08-19 02:01:42,/r/EDAnonymous/comments/cscz6n/daily_discussion_monday_august_19_2019/exe4kmg/,"relasping hard and seeing my therapist, i am overweight and I might drop out of college because I 1,) unhappy there and plan to transfer anyway 2.) too ashamed for anyone see my weight gain and honestly I cant tell if its my ed hating my colleges or the fact that I hate the college itself.   &amp;#x200B;  I have a week/ two weeks to decide?  &amp;#x200B;  So you know what this dumb bitch is doing? Planning to eat almost nothing so atleast I'll be mid bmi and then recovery fully and lose weight the healthy weigh. I know this is shitty logic, but I don't want to drop out and this is a way to appease the ed ;\_\_;  &amp;#x200B;  also i stopped purging ( did today but only once and very small) but now fallen into the trap of c/s. before it was only small but legit everysnack/ potential dinner has been c/s. I am surronded by my spit out food in my room and it disgusts me also. BUt you know what my ed thinks is more digusting? my fat  yeehaw",False,False
exe2ouh,t3_cscz6n,t3_cscz6n,Butty43,1,2019-08-19 01:21:22,/r/EDAnonymous/comments/cscz6n/daily_discussion_monday_august_19_2019/exe2ouh/,Trying to recover but every thought I have is so triggering. I am eating a little more than I was before but every extra calories seems to make me feel so bloated and uncomfortable. I feel like I'm not restricting to the same extreme as a couple of weeks ago but I'm still trying to limit my calories and anytime I feel like I'm getting even slightly more body fat I just cut back again. Fuck!,False,False
exe23q0,t3_cscz6n,t3_cscz6n,tea-addicted-taemint,1,2019-08-19 01:09:25,/r/EDAnonymous/comments/cscz6n/daily_discussion_monday_august_19_2019/exe23q0/,Fuck rice cakes corn thins are the goat,False,False
exe1xpe,t3_cscz6n,t3_cscz6n,vomitcomets,1,2019-08-19 01:06:07,/r/EDAnonymous/comments/cscz6n/daily_discussion_monday_august_19_2019/exe1xpe/,im watching the snapchat story of kcon and. like tell me why loona is fucking triggering me... theyre astronomically thin and (for me) have an unrealistic body type which i doubt i could even maintain... but that wont stop me from trying 😀,False,False
