Comment ID,Link ID,Parent ID,Author,Score,Publish Date,Permalink,Text,Stickied,Is Submitter
ewm8xpu,t3_co2tv1,t1_ewg586d,Pootties,1,2019-08-11 12:52:13,/r/EDAnonymous/comments/co2tv1/this_thread_is_for_my_nasty_eders_only/ewm8xpu/,That's so weird my legs go numb and even hurt when I have to take a huge shit too. Sounds like we are poop twins 💩,False,False
ewm8sfb,t3_co2tv1,t1_ewg5bz9,Pootties,1,2019-08-11 12:50:33,/r/EDAnonymous/comments/co2tv1/this_thread_is_for_my_nasty_eders_only/ewm8sfb/,"Awe, thanks! That's a lovely name for a cat. My childhood cat name was Pood (like from ""Pudding"", not ""I just pood"" lol)  I guess poo is just a theme in our lives!",False,False
ewjbrvh,t3_co2tv1,t1_ewhn73n,tokieofrivia,1,2019-08-10 14:11:15,/r/EDAnonymous/comments/co2tv1/this_thread_is_for_my_nasty_eders_only/ewjbrvh/,"Why thank you! I tend to commit to my cover ups, if necessary.   But yes, it's a mega oof, and probably not even the worst one but definitely the one that stands out to me!",False,False
ewicapr,t3_co2tv1,t1_ewh1f19,vanillabake,1,2019-08-10 08:59:36,/r/EDAnonymous/comments/co2tv1/this_thread_is_for_my_nasty_eders_only/ewicapr/,Oh no :( and it’s really scary because there’s a possibility you’d cut your hands too! I can’t purge anymore because my family watches for the smell of vomit and will immediately confront me. And I can only purge in a washroom. So chew and spit it is :(,False,False
ewi5ood,t3_co2tv1,t1_ewi1lg3,BigBootySnitches,1,2019-08-10 07:16:44,/r/EDAnonymous/comments/co2tv1/this_thread_is_for_my_nasty_eders_only/ewi5ood/,That's a whole ass liquid baby! Damn girl I'm impressed!,False,True
ewi3a9z,t3_co2tv1,t1_ewi2zte,min_imalist,1,2019-08-10 06:27:58,/r/EDAnonymous/comments/co2tv1/this_thread_is_for_my_nasty_eders_only/ewi3a9z/,"I would pretty much try to tough it out until the lunch break after the 2nd period, but then I'd sleep through the break in the classroom we'd have the next class in and after a while not even teachers bothered to wake me up. Someone would just shake me so I could go to the next classroom, rinse and repeat  It was pretty sad tbh, I cringe now looking back at it, it must've looked like I was a hardcore junkie or something (and I certainly looked the part :(( )",False,False
ewi2zte,t3_co2tv1,t1_ewg8nnn,algolde,1,2019-08-10 06:21:34,/r/EDAnonymous/comments/co2tv1/this_thread_is_for_my_nasty_eders_only/ewi2zte/,"just wondering, how do u sleep through school? doesn't anyone wake you up?",False,False
ewi1lg3,t3_co2tv1,t3_co2tv1,whatxever,1,2019-08-10 05:48:43,/r/EDAnonymous/comments/co2tv1/this_thread_is_for_my_nasty_eders_only/ewi1lg3/,so purging is awful but i managed to do it for basically 2 semesters without any of my roommates noticing at the dorm (2 realized on our trip somewhere but that doesn't count). &amp; i actually managed to purge entirely into a trash bag that I then weighed (7 lbs of vomit ladeez) &amp; i was so fucking exhausted from exhuming that amount of shit from my stomach that i just tied it up as tight as i could &amp; put it into the main trash that all of them are too lazy to ever take out. it was safe like it couldn't have leaked unless both bags had holes but someone did take it out randomly the next morning ! so kinda gross kinda shitty of me but i didn't have to shame walk that to the dumpster at 2 in the morning on a school day aaaand i got 7 entire pounds out of my body which is just wild to me. i'm sure i've purged more if not the same before but i never can weigh it bc it's usually into a toilet lol,False,False
ewi03lr,t3_co2tv1,t1_ewg8mkh,candiedrose,1,2019-08-10 05:11:10,/r/EDAnonymous/comments/co2tv1/this_thread_is_for_my_nasty_eders_only/ewi03lr/,"Please, please stop using laxatives. I wish all ed peeps would learn to just take probiotics. They'll help you poop, stop you from bloating, and it actually improves your gut health, rather than damage it like laxes.",False,False
ewhs99y,t3_co2tv1,t3_co2tv1,Entemma,1,2019-08-10 01:51:16,/r/EDAnonymous/comments/co2tv1/this_thread_is_for_my_nasty_eders_only/ewhs99y/,I let my tube feed drip into an empty monster ultra can when i was hospitalized and had an ng tube... They caught me,False,False
ewhnegh,t3_co2tv1,t1_ewg3lqe,EzraCelestine,1,2019-08-10 00:13:48,/r/EDAnonymous/comments/co2tv1/this_thread_is_for_my_nasty_eders_only/ewhnegh/,Dude the garbage disposal was my best fuckin friend when I would be home alone lmao. Purging or c/s ing into one is so fuckin EASY,False,False
ewhn73n,t3_co2tv1,t1_ewg5bqt,EzraCelestine,1,2019-08-10 00:10:07,/r/EDAnonymous/comments/co2tv1/this_thread_is_for_my_nasty_eders_only/ewhn73n/,That's an oof and a half but honestly I applaud your commitment,False,False
ewhj7g6,t3_co2tv1,t3_co2tv1,convolutedDoggo,1,2019-08-09 23:03:18,/r/EDAnonymous/comments/co2tv1/this_thread_is_for_my_nasty_eders_only/ewhj7g6/,"I spent the night at a friends house and in the morning her parents bought us donuts for breakfast. Seeing no way out, I grabbed a donut and when no one was looking I put pieces of the donut in the waistband of my pajama bands and in my socks until it looked like I finished the donut. When I was packing up my stuff I shoved all the donut pieces in my bag. Fun times",False,False
ewhhtl0,t3_co2tv1,t1_ewg6ixz,mackfork_,1,2019-08-09 22:42:02,/r/EDAnonymous/comments/co2tv1/this_thread_is_for_my_nasty_eders_only/ewhhtl0/,are u me from the future? this sounds like a rock bottom i may eventually hit lol,False,False
ewh8wbq,t3_co2tv1,t1_ewft8fb,fishonthesun,1,2019-08-09 20:38:13,/r/EDAnonymous/comments/co2tv1/this_thread_is_for_my_nasty_eders_only/ewh8wbq/,"I have the same problem even at a not low weight. Could be reynauds syndrome which is, lol, exacerbated by caffeine and nicotine (doesnt stop me tho). Always have gloves or extra warm clothing in case you get cold from restricting, and flex your fingers as much as you can stand to to keep blood moving to them",False,False
ewh8bhk,t3_co2tv1,t1_ewgc2as,BigBootySnitches,1,2019-08-09 20:30:30,/r/EDAnonymous/comments/co2tv1/this_thread_is_for_my_nasty_eders_only/ewh8bhk/,I literally just did this the other day! #nasties,False,True
ewh7vrg,t3_co2tv1,t1_ewg8mkh,BigBootySnitches,1,2019-08-09 20:24:43,/r/EDAnonymous/comments/co2tv1/this_thread_is_for_my_nasty_eders_only/ewh7vrg/,"Also fiber if you can, it's in a lot of low cal vegetables, but you can also get supplements or psyllium husk (idk, the fiber drink mix). It contributes to today's discomfort because everything was &gt;!too solid even because I'd been eating a shit ton (no pun intended) of veggies&lt;!  It does slow the amount you do tho so be careful if you think it will trigger you!  ❤",False,True
ewh7fx4,t3_co2tv1,t1_ewg6ixz,BigBootySnitches,1,2019-08-09 20:18:56,/r/EDAnonymous/comments/co2tv1/this_thread_is_for_my_nasty_eders_only/ewh7fx4/,This is Shakespearean. I might love you.,False,True
ewh7d4t,t3_co2tv1,t1_ewfykev,flamingtrashmonster,1,2019-08-09 20:17:55,/r/EDAnonymous/comments/co2tv1/this_thread_is_for_my_nasty_eders_only/ewh7d4t/,Thanks ❤️,False,False
ewh7c99,t3_co2tv1,t1_ewgzjfj,flamingtrashmonster,1,2019-08-09 20:17:35,/r/EDAnonymous/comments/co2tv1/this_thread_is_for_my_nasty_eders_only/ewh7c99/,Ahh ice cream buckets were what I primarily used too! So many bad memories lol.,False,False
ewh4sm2,t3_co2tv1,t3_co2tv1,BeautylicousBabe,1,2019-08-09 19:44:16,/r/EDAnonymous/comments/co2tv1/this_thread_is_for_my_nasty_eders_only/ewh4sm2/,"Oh god there’s so many.  Eating 3/4 of a cheesecake on my break from work (lived close to home) and then stumbling through the city in the middle of a summer day spitting mouthfuls of foamy cheesecake vomit on to the sidewalk, a tree, some dirt, the gutter - every few steps like a rabid dog crawling home to die.",False,False
ewh2xee,t3_co2tv1,t3_co2tv1,opalearring,1,2019-08-09 19:21:59,/r/EDAnonymous/comments/co2tv1/this_thread_is_for_my_nasty_eders_only/ewh2xee/,"I don't know if I'm proud of this or just amazed I managed to do it.   When I was in the thick of my disorder and living at home, I worked at a bakery and almost exclusively worked the closing shifts. We were allowed to take as much food as we wanted home, so I would do just that. I would take probably 3kg+ of baked goods home every day, and then lock myself in my room to eat all of it. Obviously, being bread, I had to make sure I had at least a litre of liquids to go down with it so I could bring it back up again. Because I was living at home, I became an expert in vomiting into plastic bags on the floor of my bedroom.   But then I just had all these grocery bags full of vomit, so I'd go out onto my balcony and drop them over the edge into the bushes. I always wondered what the groundskeepers thought of the burst bags of vomit in the bushes.",False,False
ewh1f19,t3_co2tv1,t1_ewfvjsv,smorbe,1,2019-08-09 19:04:07,/r/EDAnonymous/comments/co2tv1/this_thread_is_for_my_nasty_eders_only/ewh1f19/,"I'm not always great/successful at purging so I like to C/S as well. I live on my own and recently moved to an apartment with a garbage disposal in the kitchen sink, so my MO is chewing and spitting McDonald's or Chinese food or pizza or an entire box of pasta I made myself or what have you into giant mixing bowls, then pouring it all down the disposal when I'm done.   Naturally I've clogged the damn thing a couple times and have had to reach my hand down the disposal (with it off, of course) and dig through the chewed up food to try and dislodge whatever it is that's clogged it.",False,False
ewgzjfj,t3_co2tv1,t1_ewfrhrk,Muckl3t,1,2019-08-09 18:41:57,/r/EDAnonymous/comments/co2tv1/this_thread_is_for_my_nasty_eders_only/ewgzjfj/,"That’s how I used to be too. Constantly. Went to corner stores, grocery stores, and restaurants multiple times a day. The main reason I recovered was because of how much money I was wasting. I ended up with thousands in credit card debt.",False,False
ewgyfmf,t3_co2tv1,t3_co2tv1,becauseimnotstudying,1,2019-08-09 18:29:13,/r/EDAnonymous/comments/co2tv1/this_thread_is_for_my_nasty_eders_only/ewgyfmf/,I am horny for mukbangs. I keep them playing nearly 24/7,False,False
ewgv3bd,t3_co2tv1,t1_ewgun2s,favisnugget,1,2019-08-09 17:50:35,/r/EDAnonymous/comments/co2tv1/this_thread_is_for_my_nasty_eders_only/ewgv3bd/,Ooooo can I get flair?,False,False
ewgun2s,t3_co2tv1,t1_ewguasb,demon_floof,1,2019-08-09 17:45:52,/r/EDAnonymous/comments/co2tv1/this_thread_is_for_my_nasty_eders_only/ewgun2s/,I'm happy I'm not the only bag shitter out here.,False,False
ewguasb,t3_co2tv1,t1_ewgtr48,favisnugget,1,2019-08-09 17:42:15,/r/EDAnonymous/comments/co2tv1/this_thread_is_for_my_nasty_eders_only/ewguasb/,I’m so sorry.,False,False
ewgtsxy,t3_co2tv1,t1_ewg8mkh,Throwmich,1,2019-08-09 17:37:08,/r/EDAnonymous/comments/co2tv1/this_thread_is_for_my_nasty_eders_only/ewgtsxy/,Miralax,False,False
ewgtr48,t3_co2tv1,t1_ewggiwp,demon_floof,1,2019-08-09 17:36:36,/r/EDAnonymous/comments/co2tv1/this_thread_is_for_my_nasty_eders_only/ewgtr48/,I just did this a few weeks ago. I had used some electrolyte tablets that I have for exercise to recover from purging. This was the final event that made realize they were causing me to shit my brains out. I quadruple bagged it and left it on the fire escape until my roommate left for work. 10/10 humiliating experience.,False,False
ewgt6ja,t3_co2tv1,t1_ewggiwp,Katnip_Everdeen,1,2019-08-09 17:30:33,/r/EDAnonymous/comments/co2tv1/this_thread_is_for_my_nasty_eders_only/ewgt6ja/,My deepest fear. Half the reason I wanna live alone is I have my own bathroom,False,False
ewgsief,t3_co2tv1,t1_ewfn92t,annielovesbacon,1,2019-08-09 17:23:05,/r/EDAnonymous/comments/co2tv1/this_thread_is_for_my_nasty_eders_only/ewgsief/,me before I purposely get the flu: god I want the flu I need to lose weight so bad  me while having the flu: fuck my life I want to fucking die  me after having the flu: ooh I lost 5 pounds :),False,False
ewgpd0a,t3_co2tv1,t1_ewggesn,seogyeokdong,1,2019-08-09 16:46:26,/r/EDAnonymous/comments/co2tv1/this_thread_is_for_my_nasty_eders_only/ewgpd0a/,Sounds like an absolute blast lmfaooo,False,False
ewgo0hi,t3_co2tv1,t1_ewfhdfk,burnthatbridge,1,2019-08-09 16:31:03,/r/EDAnonymous/comments/co2tv1/this_thread_is_for_my_nasty_eders_only/ewgo0hi/,Give those toddler ants some toast then!!,False,False
ewgnats,t3_co2tv1,t3_co2tv1,Spectrachic311311,1,2019-08-09 16:23:01,/r/EDAnonymous/comments/co2tv1/this_thread_is_for_my_nasty_eders_only/ewgnats/,I used to run a lot to get rid of extra calories and I also did laxatives on top of that. I was running in my neighborhood once and had to shit bad. So I dropped my shorts and crapped by some bushes. A lady saw me and called the cops on me and I got arrested. Not my finest moment.,False,False
ewglo00,t3_co2tv1,t3_co2tv1,mungomangotango,1,2019-08-09 16:04:34,/r/EDAnonymous/comments/co2tv1/this_thread_is_for_my_nasty_eders_only/ewglo00/,"I regularly take poops that clog the toilet. It happens often, and I don't know of its because my poops are so SOLID or if they're just absolutely massive. Also, unrelated note, almost died purging two bagels last night. Literally on the floor, gasping for air, blacking out a bit and wondering if this was how I was fucking going.",False,False
ewgljqe,t3_co2tv1,t3_co2tv1,Talibeea,1,2019-08-09 16:03:13,/r/EDAnonymous/comments/co2tv1/this_thread_is_for_my_nasty_eders_only/ewgljqe/,I think my entire Ed is nasty but nothing compared to that one point I had too many lax.  I was going h Through a b/p phase after months of restricting then had a “binge “ of about 900 calories which was crazy back then for me. Needless to say I took the lax just to get rid of the horrible pain in my stomach from eating so much compared to what I was used to.  I took 2 and nothing happened then took another 2 as I didn’t expect it to do anything as I read 4 is the upper end of a normal amount to take. Little did I know my body couldn’t handle it  I was 17 or 18 at the time and honestly it’s all from those years I remember. I was crying from the pain and I was so sick and I honestly thought I was going to die that night. I was blacking out unable to make it to a toilet or a fridge to see if food would help. I chugged water and chugged some more until I threw it up all over the floor and then I fell in it unable to move. It was absolutely disgusting and of course on top of that I had lax.   Thankfully throwing up almost instantly made it better I was weak for a few hours but enough to get up and get a snack before taking a cold shower ( I’m sure I would have passed out if I had a hot one as It is very difficult to take hot showers  with an ED and even in recovery sometimes)  I wouldn’t wish this pain in anyone please if you want to try lax don’t!! You never know when you will take it too much and even if this doesn’t happen it doesn’t give the desired effect. You may become dependent upon them and the tiny tummy will turn into a never ending pregnant like bloat from using them. It isn’t worth it. Stay safe your body is going through enough.,False,False
ewglg82,t3_co2tv1,t1_ewg5npv,ifuckpineapples,1,2019-08-09 16:02:09,/r/EDAnonymous/comments/co2tv1/this_thread_is_for_my_nasty_eders_only/ewglg82/,that's honestly damn impressive loli can't believe you have that much stomach control. I mean also like rip but still wow,False,False
ewgj0kc,t3_co2tv1,t3_co2tv1,muesally,1,2019-08-09 15:35:45,/r/EDAnonymous/comments/co2tv1/this_thread_is_for_my_nasty_eders_only/ewgj0kc/,"this isn’t that bad but I’m so ashamed to share it but:  when I was suffering from BED I worked at a restaurant and when people would toss out uneaten food I’d get it out of the trash, hide from my coworkers and eat it. It was always right after it was thrown away so it wasn’t that nasty but still.",False,False
ewghgvi,t3_co2tv1,t3_co2tv1,ginsengdew,1,2019-08-09 15:18:55,/r/EDAnonymous/comments/co2tv1/this_thread_is_for_my_nasty_eders_only/ewghgvi/,Chewing and spitting an entire microwave bag of kettle corn into a gallon ziplock bag and hiding it in the woods about 7 yrs ago lmaoooo,False,False
ewggn4z,t3_co2tv1,t3_co2tv1,Scarab-Beetle,1,2019-08-09 15:10:02,/r/EDAnonymous/comments/co2tv1/this_thread_is_for_my_nasty_eders_only/ewggn4z/,I guess it isn’t that bad but I binged on my favorite oatmeal in my dorm room and i felt disgusting after so I made myself throw up into the trash can and i left it there until the end of the week since my trash wasn’t full and I wasn’t going to waste a trash bag. I was such an odd feeling it felt like throwing up a bag of pudding.,False,False
ewggjy3,t3_co2tv1,t3_co2tv1,nekkedpebbl,1,2019-08-09 15:09:05,/r/EDAnonymous/comments/co2tv1/this_thread_is_for_my_nasty_eders_only/ewggjy3/,Took triple lax and shit myself before bed. Purged that night as well and got puke in my eye. Woke up in the middle of the night when the second wave of lax hit and shit so hard that I literally blacked out on the toilet and only woke up by banging my forehead into the bath next to me. It was a rough night,False,False
ewggiwp,t3_co2tv1,t3_co2tv1,favisnugget,1,2019-08-09 15:08:47,/r/EDAnonymous/comments/co2tv1/this_thread_is_for_my_nasty_eders_only/ewggiwp/,Laxatives kicked in while my roommate was in the shower. She likes to take half hour showers and I had to fucking go. I grabbed a plastic bag and shat into it in my room. It got everywhere. I wish I had a trash can so at least the bag would have been sturdy! Had to carry a bag of shit down four flights to the trash outside. This was before work.,False,False
ewggesn,t3_co2tv1,t3_co2tv1,Noodle-The-Noodle,1,2019-08-09 15:07:35,/r/EDAnonymous/comments/co2tv1/this_thread_is_for_my_nasty_eders_only/ewggesn/,I got free Dr Pepper on a flight and purged it in the bathroom. When I got back to my seat some Dr Pepper started leaking out of nose and got in my mouth. I licked it up then tried to purge again but the flight attendant told me to sit down so I sat in my seat and cried and the kind woman next to me gave me a Xanax  Pretty good time really,False,False
ewgfqq2,t3_co2tv1,t1_ewgc2vh,uggggggggggghhhhhhhh,1,2019-08-09 15:00:25,/r/EDAnonymous/comments/co2tv1/this_thread_is_for_my_nasty_eders_only/ewgfqq2/,i somehow feel grossly accomplished if i can tell it’s still a little cold when it touches my fingers,False,False
ewgf00d,t3_co2tv1,t1_ewg8yft,bachslash,1,2019-08-09 14:52:36,/r/EDAnonymous/comments/co2tv1/this_thread_is_for_my_nasty_eders_only/ewgf00d/,one of the vilest things I've ever had the pleasure of putting in my mouth. 10/10 would not do again.,False,False
ewgezkd,t3_co2tv1,t3_co2tv1,stevieisbored,1,2019-08-09 14:52:28,/r/EDAnonymous/comments/co2tv1/this_thread_is_for_my_nasty_eders_only/ewgezkd/,"I could never purge, despite trying. I once ate an entire block of cream cheese as part of a binge (not the whole binge, part of it). I am very lactose intolerant. Ended up being 2lbs lighter the next day because of all the . . . you know.",False,False
ewgcjv8,t3_co2tv1,t1_ewga48v,obviouslynotjackie,1,2019-08-09 14:27:03,/r/EDAnonymous/comments/co2tv1/this_thread_is_for_my_nasty_eders_only/ewgcjv8/,Lmfaoooo relatable,False,False
ewgc2vh,t3_co2tv1,t1_ewfhdfk,sepidumb,1,2019-08-09 14:22:03,/r/EDAnonymous/comments/co2tv1/this_thread_is_for_my_nasty_eders_only/ewgc2vh/,purging out ice cream is my fave thing to purge  it doesnt taste tht bad when it comes up and it doesnt hurt tht mucb either,False,False
ewgc2as,t3_co2tv1,t3_co2tv1,parislucy,1,2019-08-09 14:21:53,/r/EDAnonymous/comments/co2tv1/this_thread_is_for_my_nasty_eders_only/ewgc2as/,not one i'm proud of but sometimes I feel a vom coming on so I'll just lean over and throw up into the waste paper bin next to my desk...so glam!,False,False
ewgb7g9,t3_co2tv1,t1_ewft8fb,DifferentIsPossble,1,2019-08-09 14:12:48,/r/EDAnonymous/comments/co2tv1/this_thread_is_for_my_nasty_eders_only/ewgb7g9/,"Can you slowly warm them up? Try placing them in cool water, then gradually adding hot water until it's comfortably warm.",False,False
ewga48v,t3_co2tv1,t1_ewg927p,galileo19,1,2019-08-09 14:01:09,/r/EDAnonymous/comments/co2tv1/this_thread_is_for_my_nasty_eders_only/ewga48v/,"You'd think I'd learn to stop binging with plans of ""I'll just purge after"" despite never learning to purge 🙄",False,False
ewg97fw,t3_co2tv1,t1_ewg8oyo,eliasfinn,1,2019-08-09 13:51:30,/r/EDAnonymous/comments/co2tv1/this_thread_is_for_my_nasty_eders_only/ewg97fw/,oh fpdkdjjd i forgot about lactic acid,False,False
ewg970w,t3_co2tv1,t1_ewfhdfk,sad_skelly,1,2019-08-09 13:51:23,/r/EDAnonymous/comments/co2tv1/this_thread_is_for_my_nasty_eders_only/ewg970w/,Just imagining this made me feel good,False,False
ewg93kp,t3_co2tv1,t1_ewg2trp,pugsaremydrugs,1,2019-08-09 13:50:21,/r/EDAnonymous/comments/co2tv1/this_thread_is_for_my_nasty_eders_only/ewg93kp/,o7,False,False
ewg927p,t3_co2tv1,t1_ewg8etj,obviouslynotjackie,1,2019-08-09 13:49:58,/r/EDAnonymous/comments/co2tv1/this_thread_is_for_my_nasty_eders_only/ewg927p/,"Saaaame, I’ve tried so many times to purge and all I ended up with was a teary and snotty face 😓 Proceeded to exercise for hours instead, only to binge after again lmao",False,False
ewg8yft,t3_co2tv1,t1_ewg6ixz,LowCalPal,1,2019-08-09 13:48:53,/r/EDAnonymous/comments/co2tv1/this_thread_is_for_my_nasty_eders_only/ewg8yft/,So...what does shit taste like?,False,False
ewg8w0u,t3_co2tv1,t3_co2tv1,eIectioneering,1,2019-08-09 13:48:10,/r/EDAnonymous/comments/co2tv1/this_thread_is_for_my_nasty_eders_only/ewg8w0u/,"honestly more sad than nasty but my coworker saw i wasn’t eating again, brought me a bagel, i ate it and immediately purged it in the bathroom, all in a 15 minute break at work",False,False
ewg8oyo,t3_co2tv1,t1_ewg6sy6,LowCalPal,1,2019-08-09 13:46:05,/r/EDAnonymous/comments/co2tv1/this_thread_is_for_my_nasty_eders_only/ewg8oyo/,"Milk is a mild acid.  Less acidic than stomach acid, but then so is everything else we eat.",False,False
ewg8nnn,t3_co2tv1,t1_ewfsoka,min_imalist,1,2019-08-09 13:45:43,/r/EDAnonymous/comments/co2tv1/this_thread_is_for_my_nasty_eders_only/ewg8nnn/,"Duuuude are you me?? This is literally all of my high school. I can't even remember those years very clearly. I was so exhausted, I'd sleep through school and then go load up on binge food and just waste the days away. I knew every single place with a somewhat public bathroom, I think I even went to a supermarket some 2 miles away ON FOOT to purge bc I couldn't do it at home. \^(fucking hell this sounds terrifying now that i wrote it down)",False,False
ewg8n02,t3_co2tv1,t1_ewg40ah,eIectioneering,1,2019-08-09 13:45:32,/r/EDAnonymous/comments/co2tv1/this_thread_is_for_my_nasty_eders_only/ewg8n02/,the cooling feeling dawg .... especially soft serve shit comes out like the mf ice cream machine,False,False
ewg8mkh,t3_co2tv1,t3_co2tv1,Funktionierende,1,2019-08-09 13:45:25,/r/EDAnonymous/comments/co2tv1/this_thread_is_for_my_nasty_eders_only/ewg8mkh/,"I haven't been able to poop without a laxative in almost 3 years. I managed to wean myself off over the last few months but I'm pretty sure I've ruined something in my GI tract permanently. I took my last lax last Tuesday, didn't poop until Thursday, and now I've had diarrhea worse than my lax poops ever since. So I dunno, every other time I tried to quit it was always constipation for a couple weeks until I gave up and started laxing again. But whatever, at least I'm pooping, don't really care if it's explosive and fiery. Guess I'll just keep pounding water and electrolytes.",False,False
ewg8etj,t3_co2tv1,t3_co2tv1,galileo19,1,2019-08-09 13:43:07,/r/EDAnonymous/comments/co2tv1/this_thread_is_for_my_nasty_eders_only/ewg8etj/,"So I've never successfully purged but I've tried so many times it's not funny. My freshman dorm had a gender neutral bathroom with a locking door in the basement and I'd sneak down there after fucking stuffing my face at the gross all-you-can-eat dining hall and try to purge until I was a snotty, teary mess. Eventually I'd give up and take my gross version of a walk of shame back to my dorm room and try not to off myself over it. Fun times, gained the freshman 15 and then some.",False,False
ewg7x5m,t3_co2tv1,t1_ewfsoka,frameworkautoco,1,2019-08-09 13:37:56,/r/EDAnonymous/comments/co2tv1/this_thread_is_for_my_nasty_eders_only/ewg7x5m/,"Oh fuck I thought it was just me, age 20-24. I moved to a different part of town and when I catch myself near one of my old public b/p places it fucks up my whole day",False,False
ewg6sy6,t3_co2tv1,t1_ewg61qj,eliasfinn,1,2019-08-09 13:25:57,/r/EDAnonymous/comments/co2tv1/this_thread_is_for_my_nasty_eders_only/ewg6sy6/,my Professional Biochemist Opinion™ is that the basicity of the milk counteracts the acidity of stomach bile and neutralizes it so it doesnt burn your throat as much,False,False
ewg6ixz,t3_co2tv1,t3_co2tv1,bachslash,1,2019-08-09 13:22:59,/r/EDAnonymous/comments/co2tv1/this_thread_is_for_my_nasty_eders_only/ewg6ixz/,"Today I binged on fucking Pillsbury biscuits and ate the entire fucking thing, but while I was purging in the toilet, the laxatives kicked in, so I had to switch gears. After shitting my guts out, I accidentally tasted my own shit while attempting to purge again that I ended up purging involuntarily. I looked at the toilet and was really fucking proud of my masterpiece, and I literally lost over half pound in doing all of this.",False,False
ewg660i,t3_co2tv1,t1_ewg2trp,cbew,1,2019-08-09 13:19:13,/r/EDAnonymous/comments/co2tv1/this_thread_is_for_my_nasty_eders_only/ewg660i/,&gt;Mama didn't raise a quitter but she did raise a dumb bitch   Lol that's hilarious. Are you me?,False,False
ewg61qj,t3_co2tv1,t1_ewg40ah,topcoatsandhats,1,2019-08-09 13:17:58,/r/EDAnonymous/comments/co2tv1/this_thread_is_for_my_nasty_eders_only/ewg61qj/,Sometimes I’ll intentionally eat ice cream or drink milk if I’m planning a purge because it makes vomiting so much easier,False,False
