Comment ID,Link ID,Parent ID,Author,Score,Publish Date,Permalink,Text,Stickied,Is Submitter
f2pcn93,t3_ddet55,t1_f2iqpds,MissNietzsche,2,2019-10-06 00:49:04,/r/EDAnonymous/comments/ddet55/who_here_wants_to_get_plastic_surgery/f2pcn93/,My doctor didn’t make me small enough -_-,False,False
f2mdk66,t3_ddet55,t3_ddet55,[deleted],1,2019-10-05 14:38:31,/r/EDAnonymous/comments/ddet55/who_here_wants_to_get_plastic_surgery/f2mdk66/,[deleted],False,False
f2lto1e,t3_ddet55,t1_f2kc24f,notracisthasblackcat,1,2019-10-05 12:56:26,/r/EDAnonymous/comments/ddet55/who_here_wants_to_get_plastic_surgery/f2lto1e/,The answer we can all relate to,False,True
f2kp33k,t3_ddet55,t3_ddet55,ogre-ish,2,2019-10-05 10:06:31,/r/EDAnonymous/comments/ddet55/who_here_wants_to_get_plastic_surgery/f2kp33k/,"i don't think i'd ever have plastic surgery, not because of 'natural superiority' or anything like that (you do you), but because i'm scared of complications and changing myself permanently and all that. but if i had infinite money and everything came out perfectly:   slight nose job, something to give me a nice jawline, lipo or something for my stomach fat/waist, maybe a fat transfer to make my butt nicely shaped, probably a gastric sleeve, and, depending on how my new body looks, i might want my breasts bigger. :o)",False,False
f2kc24f,t3_ddet55,t3_ddet55,ColesEyebrows,1,2019-10-05 08:53:26,/r/EDAnonymous/comments/ddet55/who_here_wants_to_get_plastic_surgery/f2kc24f/,Brain transplant please. This shit isn't salvageable.,False,False
f2jo020,t3_ddet55,t3_ddet55,elllxvi,1,2019-10-05 06:34:22,/r/EDAnonymous/comments/ddet55/who_here_wants_to_get_plastic_surgery/f2jo020/,i’m too scared of looking like i wear a diaper but a brazilian butt lift sounds pretty good,False,False
f2jl93z,t3_ddet55,t3_ddet55,BabyBaphomet_,1,2019-10-05 06:15:52,/r/EDAnonymous/comments/ddet55/who_here_wants_to_get_plastic_surgery/f2jl93z/,"My boobs are really uneven so I'd like to get a reduction or implants. Idk which yet, just want em evened out.      Aside from that I don't rlly know what else...maybe filler in my hip dips. Oh and I wanna try out getting my lips done, since it's not super permanent....I don't dislike my lips I'm just curious about it.",False,False
f2jikpp,t3_ddet55,t3_ddet55,brideofkane,1,2019-10-05 05:57:40,/r/EDAnonymous/comments/ddet55/who_here_wants_to_get_plastic_surgery/f2jikpp/,I have a lot of loose skin and pretty saggy boobs.  It honestly affects how clothes fit me so I really want to get them fixed.  Also surgery to get rid of my eye bags. They look so pronounced now. A friend of mine got hers removed in South Korea and it looks so natural!,False,False
f2jhf2b,t3_ddet55,t3_ddet55,Flippingkittens,1,2019-10-05 05:49:45,/r/EDAnonymous/comments/ddet55/who_here_wants_to_get_plastic_surgery/f2jhf2b/,Liposuction on my thighs.,False,False
f2iuyd0,t3_ddet55,t3_ddet55,guesswhosback455,1,2019-10-05 03:11:20,/r/EDAnonymous/comments/ddet55/who_here_wants_to_get_plastic_surgery/f2iuyd0/,I'd like some fat taken from my arms and a complete face remodel like that stupid Kylie Jenner had,False,False
f2iqpds,t3_ddet55,t1_f2ieijw,exh_ust_d,1,2019-10-05 02:39:21,/r/EDAnonymous/comments/ddet55/who_here_wants_to_get_plastic_surgery/f2iqpds/,What went wrong the first time?,False,False
f2iq9ts,t3_ddet55,t3_ddet55,exh_ust_d,1,2019-10-05 02:36:18,/r/EDAnonymous/comments/ddet55/who_here_wants_to_get_plastic_surgery/f2iq9ts/,"Double mastectomy, scar removal, lipo, leg lengthening (lmao)",False,False
f2ieijw,t3_ddet55,t3_ddet55,MissNietzsche,1,2019-10-05 01:14:59,/r/EDAnonymous/comments/ddet55/who_here_wants_to_get_plastic_surgery/f2ieijw/,I got a rhinoplasty and breast reduction done already. I want a second breast reduction.,False,False
f2ib5of,t3_ddet55,t1_f2i4llk,Brief_Somewhere,1,2019-10-05 00:52:22,/r/EDAnonymous/comments/ddet55/who_here_wants_to_get_plastic_surgery/f2ib5of/,"I do everything in my power to flatten my bouncing jugs and I guess I hate attention on me while i wear a bra, so out of my own insecurity I tend to take it as they are mocking me or flaunting the one thing I want most and well. I know we all out here tryin our best. Might as well curb my paranoia and support all of us and our body issues lol",False,False
f2i6cyr,t3_ddet55,t1_f2i05pw,ImDemandingARefund,1,2019-10-05 00:20:34,/r/EDAnonymous/comments/ddet55/who_here_wants_to_get_plastic_surgery/f2i6cyr/,"...so, uhhh....I know im supposed to see muscle as “***OMG TOTES GOALZ***” at least in the event I can’t accept my fatness, but...    does anyone known if there’s a surgery where they can cut out or shave down the thigh muscle that’s behind your femur? I’d suffer for it...",False,False
f2i4llk,t3_ddet55,t1_f2hv6a1,ImDemandingARefund,2,2019-10-05 00:09:21,/r/EDAnonymous/comments/ddet55/who_here_wants_to_get_plastic_surgery/f2i4llk/,"Some karen-lite bitches do this as a form of self deprecation humor / motive of beating people to the punch type thing.   .     .  .   *** It’s me.    .  .  I’m karen-lite bitches.    Making fun of my two raisins on a bread board feels similar to drawing comedic attention to my pancake ass, my fence post figure, my dumpy stature, or my bloated-because-I-ate anything-at-all boss-hog-belly.",False,False
f2i10if,t3_ddet55,t3_ddet55,Bumalagirl,1,2019-10-04 23:46:44,/r/EDAnonymous/comments/ddet55/who_here_wants_to_get_plastic_surgery/f2i10if/,Rhinoplasty without a second thought and maybe something to flatten my stomach.,False,False
f2i05pw,t3_ddet55,t3_ddet55,ImDemandingARefund,1,2019-10-04 23:41:32,/r/EDAnonymous/comments/ddet55/who_here_wants_to_get_plastic_surgery/f2i05pw/,"Does anyone know if your face/cheeks actually look skinnier by comparison if you get lip fillers? I heard that somewhere....   Anyways, Full body Lipo I suppose. Oh wait that’s called “weight loss” which I’m not allowed to aim for anymore. But yeah...full body Lipo, or at least  jaw + upper arm + upper &amp; lower abdominal + flank + inner thigh lipo lol.  I wouldn’t get the fat transferred anywhere since I don’t really want a “sexy” look, also because that’s literally putting the weight back on.  Anyways I bet no one who is sane would agree to do nearly full body lipo on someone my weight so I don’t think there’s anything I’d really get. Unless we can stretch the definition of plastic surgery to include gastric sleeves done by shady over seas doctors lol.   Hypothetically if we lived in a world where stature increase/leg extending surgery didn’t require; shattering your bones, slowly having your bones pulled apart daily, excruciating pain, several months of procedures, down time for the entire procedure time period, several months of recovery, walking with a walker for like a year, and tens-of-thousands of dollars....then I’d get like 4-5 inches.",False,False
f2hy4of,t3_ddet55,t1_f2hv6a1,notracisthasblackcat,1,2019-10-04 23:29:04,/r/EDAnonymous/comments/ddet55/who_here_wants_to_get_plastic_surgery/f2hy4of/,it's always Karen tho isn't it,False,True
f2hv6a1,t3_ddet55,t3_ddet55,Brief_Somewhere,2,2019-10-04 23:10:55,/r/EDAnonymous/comments/ddet55/who_here_wants_to_get_plastic_surgery/f2hv6a1/,"Maybe not full removal because the video's i've watched of Top Surgery scare me.  but as much of a breast reduction as possible. Im sick of other girls being like ""yeah i have no tits lol look at me not wearing a bra.""   Like wear what ever you want but STOP. TELLING. ME. ABOUT YOUR TINY TITTIES KAREN",False,False
f2huidi,t3_ddet55,t3_ddet55,TotallyNotARadar,2,2019-10-04 23:06:37,/r/EDAnonymous/comments/ddet55/who_here_wants_to_get_plastic_surgery/f2huidi/,Nose. Low key look like a witch lol,False,False
f2ht36m,t3_ddet55,t3_ddet55,annielovesbacon,2,2019-10-04 22:57:33,/r/EDAnonymous/comments/ddet55/who_here_wants_to_get_plastic_surgery/f2ht36m/,I don’t think I’d ever actually do it but I’d love chin fillers or a chin implant. A bitch just wants to have a jawline,False,False
f2hpez1,t3_ddet55,t3_ddet55,SaintClaire1,1,2019-10-04 22:34:54,/r/EDAnonymous/comments/ddet55/who_here_wants_to_get_plastic_surgery/f2hpez1/,"Lipo my stomach and I would do those Brazilian butt lifts...but tastefully. I'm not asking for a whole lotta booty, just a little something and a small flat stomach. And not so flabby arms. And my chin fat. I feel like it'll be a downward spiral lol 😅",False,False
f2hnv5q,t3_ddet55,t3_ddet55,RetailSlaveNo1,2,2019-10-04 22:25:17,/r/EDAnonymous/comments/ddet55/who_here_wants_to_get_plastic_surgery/f2hnv5q/,"When I'm my ugw I wanna get a breast lift (and maybe reduction if somehow I still have boobs) and tummy tuck. I'm nonbinary so my breasts give me dysphoria some days but I don't want total top surgery. They're very saggy tho because of constant weight cycling for years. Same with loose skin on my stomach. Those are my top two. Arm lift would be nice but isn't as important to me. I'd also like to get a minor nose job, I've always been hella self conscious about it (plus my only friend in HS literally said ""you have a huge nose, and I'm a jew so that's saying a lot"" which made it even worse 🙃🙃🙃 p sure he was negging me tho)",False,False
f2he7rm,t3_ddet55,t3_ddet55,GirlWearingMyDress,1,2019-10-04 21:29:41,/r/EDAnonymous/comments/ddet55/who_here_wants_to_get_plastic_surgery/f2he7rm/,"Thought about boobs, but I’m afraid to look like Donatella Versace with two tennis balls stuck to her ribs.",False,False
f2hbbdj,t3_ddet55,t3_ddet55,Bitchbasic,2,2019-10-04 21:13:46,/r/EDAnonymous/comments/ddet55/who_here_wants_to_get_plastic_surgery/f2hbbdj/,"Lipo, skin tightening, cellulite removal, hip dip fillers, butt lift &amp; boob lift, nose job, forehead reduction surgery. maybe smth for my chin? get a better jawline.  edit: i'm actually planning on using my signing bonus for going full time on a breast lift, got about a year to wait.",False,False
f2h89oj,t3_ddet55,t3_ddet55,radicalcantaloop,2,2019-10-04 20:57:11,/r/EDAnonymous/comments/ddet55/who_here_wants_to_get_plastic_surgery/f2h89oj/,"Idk if I would ever actually go for plastic surgery even if given the option. But if I were to get something done I might fix my chin bc it’s uneven. I think it would look nicer and hopefully make my face appear shorter.  Maybe also my nose to make it slimmer, but nose jobs kind of terrify me so 🤷🏻‍♀️",False,False
f2h44y9,t3_ddet55,t3_ddet55,aimerix,2,2019-10-04 20:32:32,/r/EDAnonymous/comments/ddet55/who_here_wants_to_get_plastic_surgery/f2h44y9/,my whole face 😫,False,False
f2h1037,t3_ddet55,t1_f2go5v4,notracisthasblackcat,1,2019-10-04 20:13:39,/r/EDAnonymous/comments/ddet55/who_here_wants_to_get_plastic_surgery/f2h1037/,"I feel like with the lip fillers it's like boob implants, people really want their money's worth so they go overboard",False,True
f2gugb5,t3_ddet55,t3_ddet55,virtual_self_,3,2019-10-04 19:34:06,/r/EDAnonymous/comments/ddet55/who_here_wants_to_get_plastic_surgery/f2gugb5/,"hoo boy, do i think about this a ton. definitely a nose job and something to fix my cleft chin. fixing my hip dips would be great, and liposuction specifically on my inner thighs and hips. a boob job would be nice, but not to make them bigger, just to make them less saggy from loosing weight. also, not plastic surgery, but i’d love electrolysis around my mouth and cheeks.",False,False
f2gswjq,t3_ddet55,t3_ddet55,lasirenexx,3,2019-10-04 19:24:30,/r/EDAnonymous/comments/ddet55/who_here_wants_to_get_plastic_surgery/f2gswjq/,"I’d like to get buccal fat removal on my left cheek and possibly a brow lift... so far, I’ve had a breast augmentation, arm lipo, a nose job and an upper blepharoplasty.",False,False
f2gr793,t3_ddet55,t3_ddet55,Sushisnac,1,2019-10-04 19:13:43,/r/EDAnonymous/comments/ddet55/who_here_wants_to_get_plastic_surgery/f2gr793/,"I would see if my overbite could be corrected, and maybe lipo on my face and hips. Even at my LW i have baby fat in those areas 😪",False,False
f2go5v4,t3_ddet55,t3_ddet55,shrinkingviolet85,1,2019-10-04 18:53:58,/r/EDAnonymous/comments/ddet55/who_here_wants_to_get_plastic_surgery/f2go5v4/,"The only thing I definitely want to get fixed is the bags under my eyes. They look fine usually but when I smile they just scrunch up and look huge and gross. I’ve also recently thought about lip fillers but I’ve never seen someone who had that done and it wasn’t very obviously fake looking. Also briefly thought about a nose job but wouldn’t actually do it because if I still hate it after, I would blame myself for causing it instead of just blaming my genetics.",False,False
f2gk7m9,t3_ddet55,t3_ddet55,cervidaes,2,2019-10-04 18:28:06,/r/EDAnonymous/comments/ddet55/who_here_wants_to_get_plastic_surgery/f2gk7m9/,Breast reduction 10000000000000000%,False,False
f2gjxa1,t3_ddet55,t3_ddet55,milkeyedmenders,2,2019-10-04 18:26:18,/r/EDAnonymous/comments/ddet55/who_here_wants_to_get_plastic_surgery/f2gjxa1/,"nose job (my nose is horrendous and so many people give me shit abt it) + lip fillers + maybe something with my chin idk much about chin procedures but my side profile is horrible. weirdly i dont know if i’d do anything with my body despite hating it and having an ED. i feel like its structure has potential if i get thinner. my face is just stuck being ugly as hell   even in a magical world where i could afford any of that i still...probably wouldn’t get it bc plastic surgery doesn’t really align w my values/goals (i dont judge or care when other people do at all, i just have a long term goal of wholeheartedly accepting myself as i am when it comes to things that don’t matter ie my appearance and this wouldn’t really help or align w that. plus i know it won’t make me not hate myself.) Also i think having a different face even if it was objectively nicer would fuck me UP dysmorphia wise. like looking in the mirror and not fully recognizing myself would trigger me idk. it’s the same reason i dont have any tattoos even tho i want them, like it would confuse my dysmorphia pea brain even more lmao",False,False
f2gjos2,t3_ddet55,t3_ddet55,webtrauma,1,2019-10-04 18:24:49,/r/EDAnonymous/comments/ddet55/who_here_wants_to_get_plastic_surgery/f2gjos2/,"I want a jaw implant, lipo, more lipo, and skin removal if i need any",False,False
f2gizfd,t3_ddet55,t1_f2ge8ya,RVKH,1,2019-10-04 18:20:22,/r/EDAnonymous/comments/ddet55/who_here_wants_to_get_plastic_surgery/f2gizfd/,i know i’m only one person but i personally really like the look of having ears that stick out! i think it’s really cute and unique looking :),False,False
f2ghxbz,t3_ddet55,t3_ddet55,TheLittlestPineapple,2,2019-10-04 18:13:43,/r/EDAnonymous/comments/ddet55/who_here_wants_to_get_plastic_surgery/f2ghxbz/,"Liposuction 100% Maybe a nose job, lip fillers, and I’d want a boob job but that kinda sounds scary so idk",False,False
f2gh0bd,t3_ddet55,t3_ddet55,etherealaqua,5,2019-10-04 18:08:16,/r/EDAnonymous/comments/ddet55/who_here_wants_to_get_plastic_surgery/f2gh0bd/,"recently I saw that calf reductions exist and I’m like 👀but yeah I’ve gotten some plastic surgery and am going to get more. I’m surprised it isn’t more common in ed communities but I guess for most people their body image problems center mainly around weight whereas I feel horrible about every! single! part! of my body/appearance, not just weight!! 🙃🙃🙃",False,False
f2gf06t,t3_ddet55,t1_f2geqqp,notracisthasblackcat,1,2019-10-04 17:57:32,/r/EDAnonymous/comments/ddet55/who_here_wants_to_get_plastic_surgery/f2gf06t/,"Oh yeah that's one thing that prevents me from fakies too, I would just get small ones because I've been flat my whole life, even when I was overweight...",False,True
f2gevc2,t3_ddet55,t1_f2ge8ya,notracisthasblackcat,1,2019-10-04 17:56:42,/r/EDAnonymous/comments/ddet55/who_here_wants_to_get_plastic_surgery/f2gevc2/,"Aw I'm sorry :( you shouldn't need plastic surgery to feel normal but I understand, all those people suck huge balls",False,True
f2geqqp,t3_ddet55,t3_ddet55,tea-addicted-taemint,3,2019-10-04 17:55:56,/r/EDAnonymous/comments/ddet55/who_here_wants_to_get_plastic_surgery/f2geqqp/,"If I wasn't scared of complications, absolutely either a double mastectomy or (small) fake boobs. Going from slightly overweight to underweight relatively quickly during the last relapse meant those bad boys lost any uhh...perkiness to spare gory details.",False,False
f2ge8ya,t3_ddet55,t3_ddet55,coffidu,3,2019-10-04 17:53:00,/r/EDAnonymous/comments/ddet55/who_here_wants_to_get_plastic_surgery/f2ge8ya/,I’d kill for a nose job and to have my ears pinned back. I’ve been bullied about my nose and ears my whole life and I just want to feel normal.,False,False
